file,text_bm,text_nn,start,end,duration,date,proceedingsfile
stortinget-20100303-090601_2m_13398000_13427200,spørsmålet mitt til statsråden er hvilke grep vil man nå foreta seg slik at man i hvert fall kan få bygd opp igjen magasinkapasitet slik at det ikke vil komme i samme situasjon altså statsråd qqq president eee grep i forhold til å fylle opp magasiner eee som oppfatta jeg spørsmålet til slutt nå eee ligger på det må jeg med respekt å melde ligger noe utafor eee mitt mulighetsområde i forhold til at det nok være være de neste eee månedene som kommer til å avgjøre eee hvor mye magasiner blir fylt opp,spørsmålet mitt til statsråden er kva grep vil ein no foreta seg slik at han i vert fall kan få bygg opp jnglasin kapasitet slik at det ikkje vi kommer i same situasjon neste statsråd president eee grep i forhold til å fylgje opp magasina eee som oppfatta det spørsmålet til slutt nå eee ligg på meg eg e med respekt av meleg ligg noko utanfor eee mitt mulighetsområde i forhold til at det noko er det vere i neste eee månader som komme til å avgjere eee kor mye magasinet blir fylgt opp,13398.0,13427.2,29.200000000000728,2010-03-03,2010-03-03_proceedings.txt
stortinget-20100303-090601_2m_13427200_13457000,hvis representanten tenker på grep i forhold til å redusere bruken av strøm ifra de samme magasinene og sånn sett eee hindre nedtapping eee som nå skjer så eee så går jo det eee på eee bruken av energi s altså eee en effektiv energibruk utover våren det går på å sørge for tilstrekkelig import til områdene med eee lav egenproduksjon eee midtnorge er jo et eksempel på det eee og der har vi heldigvis en bedre situasjon nå enn vi har hatt tidligere ved at den nye i arbeidstøforbindelsen eee har kommet opp,viss representanten tenker på grep i for lov til å redusere bruken av straum ifrå dei same magasinet og sånn sett eee hindre ei nedtapping eee som nå skjer så eee så går jo det eee på eee eee bruket av energi altså eee ein effektiv energibruk utover våren det går på å sørgje for tilstrikkeleg import til område med eee lav eigen produksjon eee midtnoreg er jo eit eksempel på det eee og der har vi heldigvis ein betre situasjon no enn via hatt tidlegare ved at den nye jerpestrømeog forbindelsen eee har komme opp,13427.2,13457.0,29.799999999999272,2010-03-03,2010-03-03_proceedings.txt
stortinget-20100303-090601_2m_13457000_13484200,eee og sånn sett bidrar til at kraftområdet midtnorge og kraftområdet norden for øvrig eee på en helt annen måte tidligere er et kraftområde så det viktigste enkelttiltaket i forhold til det som representanten eee jeg antar representanten spurte om eee det går på eee importkapasiteten eee i primært i fra sverige nesvik ja president det er flere grep jeg skal ikke forvente at statsråden skal måtte vente og stole på vår her i så sammenheng det får vi se hvordan sommeren og høsten,eee og sånn sett bidrar til at eee kraftområdet midtnoreg og kraftområdet norden for øvrig eee på ein heilt annan måte tidlegare er eit kraftområde så det viktigaste enketiltaket i forhold til det som representanten eee antar representanten spurt om eee det går på eee importkapasiteten eee i primært ifrå sverige nevi president flere grep eg skal ikkje på det at statsråden skal måtte vente å stole på kva her i så samanheng me får vi se korleis sommaren og hausten,13457.0,13484.2,27.200000000000728,2010-03-03,2010-03-03_proceedings.txt
stortinget-20100303-090601_2m_13484200_13494700,eee mitt utgangspunkt er at man må kjøpe magasinkapasitet hos leverandørene slik at de kan bygge opp kapasitet og ikke tappe ned og bruke det og det er en kostnad knytta til det er,eee mitt utgangspunkt er at ein må kjøpe magasinkapasitet hos leverandørane slik at dei kan bygge opp kapasitet og ikkje tappe ned å bruke det og det er er ein kostmad knytt til det,13484.2,13494.7,10.5,2010-03-03,2010-03-03_proceedings.txt
stortinget-20100303-090601_2m_13494700_13521200,det kan gjøres blant anna ved at man kan kjøre det mobile gasskraftverket utover våren eee og sommeren for å bygge opp kapasitet det kan være også at man eee åpna for å ha en betydelig import eee inn til regionen slik at magasinkapasiteten kan øke er det flere grep som skal tas og jeg skal ikke eee ta det opp imot det som har med det reint nedbørsmessige for det er en en eee en sak som jeg selv ikke forvente at at stats,det kan gjerast blant anna at ein kan køyre dei mobile gasskraftverka utover våren eee og sammen for å bygge opp kapasitet det kan vere også at ein eee opnar for å ha ein betydeleg import inn til regionen slik at magasinkapasiteten kan auke så er det fleire grep som skal tas og eg skal ikkje eee ta det opp imot det som har med det reint nedbørdsmessige for det er ein ein ein sak som eg sel ikkje forventar at stats,13494.7,13521.2,26.5,2010-03-03,2010-03-03_proceedings.txt
stortinget-20100303-090601_2m_13521200_13550300,eee mitt eee neste ord og spørsmål går jo selvfølgelig fra at altså statsråden sier sjøl han kan ikke gjøre noe eee umidlebare kortsiktige grep eee jo man kan det man kan si at vi vil trøre i gang eee eee mo der mobile gassverket var umiddelbart for å bøte på situasjonen det vil nok ikke ha en stor konsekvens på prisene umiddelbart men at man kan begynne å bygge opp magasin og vil statsråden nå åpne for de eee slik at man også i midt norge kan ha et næringsliv som fortsatt er oppegående,eee mitt eee neste orde spørsmål går jo seg følga statsråden seier sjøl han kan ikkje gjere noko umiddelbare kortsiktige grep eee jo men kan det ein kan si at vi vil køyre i gang eee eee mo det mobile gassverk var umiddelbart for å bøte på situasjonen det vil nok ikkje ha den store konsekvensen på prisane middelbart men at ein kan bunne å bygge opp magasin og vil statsråden no opnar for det eee slik at ein også i midtnoreg kan ha eit næringsliv som fortsatt er oppegåande,13521.2,13550.3,29.099999999998545,2010-03-03,2010-03-03_proceedings.txt
stortinget-20100303-090601_2m_13550300_13574300,president jeg er glad for at representanten nesvik eee er nyansert i sin beskrivelse av effekten av de nevnte eee mobile eee gasskraftverket eee nettopp fordi at eee forskjellen i den effekten som er tilgjengelig der opp imot den effekten som nå er ute og som er hovedproblemet i det her eee spørsmålet altså de fire tusen megawatta som nå er tatt ned ifra svensk jernkraftroduksjon,statsråd president eg er glad for at representanten elsvik eee er nyansert i sin beskrivelse av effekten av dei dømde mobile eee gaskatverka eee nettopp fordi at eee forskjelling i den effekten som er tilgjengeleg der opp imot den effekten som no er ute og som er hovudproblemet i det her eee spørsmålet altså dei fire tusen megawatta som nå er tatt ned ifrå svensk kjernkraftproduksjon,13550.3,13574.3,24.0,2010-03-03,2010-03-03_proceedings.txt
stortinget-20100303-090601_2m_13574300_13602900,forskjellen på det og tre hundre megawatt på de to kraftverka vi har i midtnorge det er en formidabel vi snakker vel om en installert effekt på cirka syv og en halv prosent av det som er ute så eee så jeg tror vi skal være edruelige i forhold til effektene av det eee og så har jeg tidligere sagt eee at det vedtak som stortinget tidligere har fatta er noe jeg forholder meg til eee og som jeg også mener er et klokt vedtak i forhold til å ha en reservkapasitet installert i områder som har beredskap som eee,forskjellen på det og tre hundre megawatt på dei to kraftverka vi har i midtnoreg den er formidabel vi snakkar vel om eee innstallerte efet på cirka sju ein halv prosent av det som er ute så eee så er eg trur vi skal vere edrulege i forhold til effektene av det eee og så har eg tidlegare sagt eee at det vedtak som stortinget tidlegare har fatta her no i forholde meg til eee og som eg også meiner det er eit klokt vedtak i forhold til å ha ein reserve kapasitet installert i området som har beredskap som eee,13574.3,13602.9,28.600000000000364,2010-03-03,2010-03-03_proceedings.txt
stortinget-20100303-090601_2m_13602900_13631000,eee som mål og som skal startes hvis det er beredskapsmessig hensyn til det det gir en veldig god trygghet for innbyggerne i eee i regionen fordi at en vet at det er tilgang på strøm eee uansett hva som måtte skje i forhold til beredskapsmessige spørsmål neste spørsmål vil bli stilt av representanten oskar jel grimsdal og vil bli besvart av olje og energiministeren terje ris johansen fremstad,eee som mål og som skal startast viss det er beredskapsmessig hensyn til det det gir ein veldig god trygghet for innbyggarane i eee i regionen fordi at me veit at det er tilgang på strøm eee uansett kva som måtte skje i forhold til beredskapsmessige spørsmålneste spørsmål vil bli stilt av representanten oskar jarle grimstad og vil bli besatt av olje og energiministeren terje rys johansen grimstad,13602.9,13631.0,28.100000000000364,2010-03-03,2010-03-03_proceedings.txt
stortinget-20100303-090601_2m_13634100_13662000,president eee undertegner har gleden av å stille følgende spørsmål til olje og energiministeren i forbindelse med behandling av stortingsproposisjon nummer trettisju for totusenogåtte totusenogni vedrørende finanskrisepakken foreslo fremskrittspartiet økt støtte til utbygging av fornybar energi i midt norge denne vinteren har for alvor vist behovet for mer kraft i midt norge vil statsrådet nå sørge for at det kanaliseres økte midler til utbygg av fornybar energi,president eee underteikne har gleden av å stille følgjande spørsmål til olje og energiministeren i forbindelse med behandling av stortingsproposisjon nummer trettisju for totusenogåtte totusenogni vedrørende finanskrisepakke føreslo framstegspartiet økt støtte til utbygging av fornybar energi i midtnoreg denne vinteren har for alvor vist behovet for meir kraft i midtnoreg vil statsråden no sørge for at det kanaliserast økte middel til utbygg av fornybar energi,13634.1,13662.0,27.899999999999636,2010-03-03,2010-03-03_proceedings.txt
stortinget-20100303-090601_2m_13662000_13686600,samt vurdere etablering av støtteprogram for slik utbygging i spesielle geografiske områder denne gangen direkte knyttet til midt norgeone statsråd qqq president regjeringa har tidligere eee trukket opp en brei strategi for å bedre kraftsituasjonen i midtnorge det er alltid gjennomført omfattende tiltak for å bedre den her situasjonen re regjeringa vil følge opp med ytterligere tiltak i tida framover,samt vurdere etablering av støtteprogram for slikutbygging i spesielle geografiske område denne gongen direkte knytte til midt noreg regionen statsråd qqq president regjeringa har tidlegare eee trekt opp ein brei strategi for å betre kraftsituksjon i midtnoreg det er alt gjennomført omfattande tiltak for å betre den her situasjonen re regjeringa vil følgje opp med ytterlegare tiltak i tida framover,13662.0,13686.6,24.600000000000364,2010-03-03,2010-03-03_proceedings.txt
stortinget-20100303-090601_2m_13686600_13712100,hovedelementene i strategien er henholdsvis tiltak for å styrke nettet i regi av statnett og satsing på fornybar energi samt energieffektivisering statnett har investert for om lag fem milliarder kroner de siste åra og planlegger ytterligere investeringer for to og en halv milliard eee de nærmeste åra en ny overføringsforbindelse mellom eee sogn og møre er nå til behandling i departementet en realisering av den her forbindelsen vil bedre kraftsituasjonen i midtnorge betydelig,hovedelementen i strategien er henoldsvis tiltak for å styrke nettet i resgiavskapenet og satsing på fornybar energi samt energieffektivisering statnett har investert for lag fem milliardar kroner dei siste åra og planlegge ytterlegare investeringar for to ein halv milliard eee dei nærmaste åra ein ny ovringsforbindelse mellom eee song og møre er no til behandling i departementet ei realisering av den her forbindelsen vil betre kraftsituasjonen i midtnoreg betydeleg,13686.6,13712.1,25.5,2010-03-03,2010-03-03_proceedings.txt
stortinget-20100303-090601_2m_13712100_13736300,regjeringa fører president en ambisiøs politikk for å fremme fornybar energi og energieffektivisering i år overføres en komma åtte milliarder kroner til enovas arbeid med fornybar energi og eee energieffektivisering eee i perioden null seks til null ni så er det satt av over fem komma tre millioner kroner til den her satsinga det er for øvrig nær to og en halv gang så mye som eee forrige eee regjering eee satt av,regjeringa fører president ein ambisiøs politikk for å fremme fornybar energi og energieffektivisering i år overførast ein komma åtte milliardar kroner til novas arbeid med fornybar energi og eee energieffektivisering eee i perioda null seks til null ni så er det satta over fem komma tre millionar kroner til den her satsinga det er forøvrig i nær to og ein halv gong så mykje som eee fore regjering eee satt av,13712.1,13736.3,24.19999999999891,2010-03-03,2010-03-03_proceedings.txt
stortinget-20100303-090601_2m_13736300_13764000,siden totusenogseks så har det gitt tilskudd til prosjekter med forventa energiresultat på om lag sju og en halv twh satsinga har bidratt til å utløse mange gode prosjekter i midtnorge og det er lagt til rette for en fortsatt høy aktivitet vi må styrke innsatsen for å bygge nett i re de regionene der de er blitt ubalanse mellom produksjon og forbruk vi skal også fortsette å drive fram utbygging av fornybar energi og vi skal styrke arbeidet med å bruke energien mer effektivt utbygging av fornybar enerog energieffektivisering,sidan totusenogseks så har det gitt tilskot til prosjekt med forventa energiresetat på om lag sju og ein halv ti veha satsinga har bidrege til å utløyse mange gode prosjekter i midtnoreg og det er lagt til rette for ein fortsatt høg aktivitet vi må styrke innsatsen for å bygge nett i dei regionane der er blitt ubalanse mellom produksjon og forbruk vi skal også fortsette å drive fram utbygging av fornybar energi og vi skal styrka edene å bruke energien meir effektivt utbygging av fornybar ener og energieffektivisering,13736.3,13764.0,27.700000000000728,2010-03-03,2010-03-03_proceedings.txt
stortinget-20100303-090601_2m_13764000_13794000,vil gjøre kraftbalansen mer robust når vi har et godt nett i alle deler av landet og derfor så er det nødvendig å ha svært stor oppmerksomhet på nettutbygging i den nærmeste tida takk grimstad takk eee for svaret president eee og som nevnt så foreslo fremskrittspartiet tre hundre millioner kroner til satsing i midt norge nettopp for å møte reistreimeutfordringe ne opp i og som tiltak i ei tid eee der det var fornuftig å bidra med offentlige tiltak spakne for holde jula i gang,vil gjere kraftbalansen med robust når vi har gått nett i alle delar landet og derfor så er det nødvendig å ha svært stor oppmerksomhet på nettutbygging i den nærmaste tida takk grimstad takk eee for svar president eee som nemnt så foreslo fresepartiet tre hundre million kroner til satsinga i midtnoreg nettopp for å møte dei straumutfainga ne er oppe i og som tiltak i ei tid eee då det var fornuftig å bidra med offre tiltakspakker for halde hjula i gang,13764.0,13794.0,30.0,2010-03-03,2010-03-03_proceedings.txt
stortinget-20100303-090601_2m_13794000_13818400,i dag ser vi at denne ekstra innsprøytinga kunne bidratt til at løsninga på den store utfordringa manglen på streinutidar kunne vært et viktig skritt å gjøre vi ser eee i media at også statsråden sine partikollegaer i møre og romsdal senterpartiet krever løysing gjennom å oppheve midtnorge som eiet prisområde og sørge for lik streinpris i heile landet dette forslaget henger også senterpartiet trøerlogg seg på eee,i dag ser vi at denne ekstra innsprøytinga kunne bidra til at løysinga på den store utfordringa mangelen på steimetida kunne vore eit viktig skrett vidare vi ser eee i media at også statsråden sine partikollega i møre og romsdal senterparti krev ei løysing gjennom å oppheve midtnoreg som har eige prisområderåde og sørger for lik streimepris i heile landet dette forslaget heng også senterpartiet trø nog seg på eee,13794.0,13818.4,24.399999999999636,2010-03-03,2010-03-03_proceedings.txt
stortinget-20100303-090601_2m_13818400_13840300,og skulle man gå til en slik løsning så er det som mange beskriver og stikk eee haudet i sandelen og tror at problemet er vekk men i tillegg så klarer jo møre og romsdal senterparti å mistenkeliggjøre hjørnesteinsbedrifter enn det gjennom følgende kraftsalget vi kan ikke risikere at gjøre heins bedrifter stenger og sender ansatte til nav for så var økonomisk gevinst gjennom kraftsaleee,og skal ein ha ein godt leis slik løysing så er det som mange beskriv og stikke haudet i sanden og tru at problemet er vekk men i tillegg så klarer jo å vere å romstal senterparti å mistenkelegjere gjennomsteisbedriftene det gjennom følgende kraftsalet vi kan ikkje resikere at øse bedrifter stenger og sender ansatte til nav for så å økonomiske vinst gjennom kraftsal eee,13818.4,13840.3,21.899999999999636,2010-03-03,2010-03-03_proceedings.txt
stortinget-20100303-090601_2m_13840300_13868300,hva planer her regjeringa for å møte eee den utfordringa etter ogsa kr kraftlinja ørsko farole er ferdig for sjøl da så har man ikke dekket energibehovet i midt norge statsråd president min ambisjon er å fortsette det arbeidet som vi nå er eee godt i gang med som blant annet som jeg nevnte innbefatter er å bruke syv og en halv milliard kroner i eee i området eee og med all respekt på tre hundre millioner kroner så vil jeg nok mene at det som blir gjort i området er betydelig mer enn det,kva planar har regjeringa for å møte eee denne utfordringa etter også at kra eee kraftige ørsal fordele er ferdig for sjøl då så har ein ikkje dekte energibehovet i midt noreg statsråd president min ambisjon er å fortsette det arbeidet som vi nå er eee godt i gang med som blant anna som me nemnde innbefatta her å bruke sju og ein halv milliard kroner i eee i området eee og med all respekt på tre hundre millionar kroner så vil han nok meiner at det som blir gjort i området er betydeleg meir enn det,13840.3,13868.3,28.0,2010-03-03,2010-03-03_proceedings.txt
stortinget-20100303-090601_2m_13868300_13889600,eee og eee det er summen eee av de her tiltaka altså nettutbygging kraftutbygging og energieffektivisering i midtnorge som kommer til å bidra til at situasjonen nå gradvis blir bedre det har eee bidratt med at vi har fått nede og arbestrømmen på plass det har bidratt til at kraftflyten mellom midtnorge og det nordiske markedet for øvrig har blitt bedredoksalt nok sånn,eee og eee det er summen eee av dei her tiltaka altså nettutbygging eee kraftutbygging og energieffektivisering i midtnorge som kommer til å bidra til at situasjonen no gradvis blir betre det har eee bidratt med at vi har fått ned i øpestrømmen på plass det har bidratt at kraftflyten mellom midtnoreg og den nordiske markedet for øvrig har blitt betredoksalt nok sånn,13868.3,13889.6,21.30000000000109,2010-03-03,2010-03-03_proceedings.txt
stortinget-20100303-090601_2m_13889600_13916900,at eee i år så har da eee situasjonen i det nordiske markedet eee vært så eee alvorlig som det vi har sett i vinter eee at det har også slått inn i midtnorge men eee det er som jeg sa i mitt forrige eee forrige replikkveksling det er ikke noen annen vei til løsning her enn å jobbe målretta med nettinvesteringer med energieffektivisering og med kraftutbygging i regionen vi driver med alle tre tinga grimstad,at eee i år så har da eee situasjonen i det nordiske markedet eee vore så eee alvorleg som det vi har sett i vinter eee at det har også slått inn i i midtnoreg men eee det er som eg sa i mitt førre eee fore replikkuviksling det er kun no annan veg til løysing her enn å jobbe bårete med nett investeringar med energieffektivisering og med kraftutbygging i regionen vi driv med alle tre tinga grimstad,13889.6,13916.9,27.299999999999272,2010-03-03,2010-03-03_proceedings.txt
stortinget-20100303-090601_2m_13916900_13943600,ja takk president det virker som om statsråden nå begynte og fiiverkletts orientering som er nærere de to nevnte fylker sine og senterpartiet har et tonevntfylker sine konklusjoner og det er jeg glad for at ikke man leite opp i dag eee prisforskjeller som eee som eee ligger på et halvt år og etter år og hva det nødvendig er så så det er et framskritt men i forhold til til de eee umiddelbare eee tiltaka som kan bli setts,ja takk president det verkar som om statsråden har begynte å fei ei verklegsorientering som er nærare dei to nemnde fylka sine og senterpartiet har dei to nemnde fylka sine konklusjonar og det er eg glad for at ikkje ein leite opp i dag eee prisforskjellar som eee som ligg på eit halvt år og eitt øre og kva det no einig er så så eee det er eit framskritt men i forhold til til dei u eee umiddelbare tiltaka som kan bli setså,13916.9,13943.6,26.700000000000728,2010-03-03,2010-03-03_proceedings.txt
stortinget-20100303-090601_2m_13943600_13968800,energiregionen eee mitt norge fått konsesjon men det er eee avhengig nå av cotorensing eee ser ikke statsråden at mere kunne gi inn aksept til til eee dette tiltaket som utgjør fire hundre og femti megawatt kunne også være med å bidra til at energien eee kunne komme til rask av påplass sjøl etter at far al ørskoglinja er på plass statsråd,energiregion eee eee midtnoreg fått eee konsesjon men det er avhengig då av ceotorensing eee ser ikkje statsråden at med å kunne gje ein aksept til til dette tiltaket som utgjer fire hundre og femti megawatt kunne også vore med å bidra til at energien eee kunne kome til raskare på plass sjøl etter at fardal ørskoglinja er på plassstatsråd,13943.6,13968.8,25.19999999999891,2010-03-03,2010-03-03_proceedings.txt
stortinget-20100303-090601_2m_13968800_13994600,president eee jo det er ikke tidlig med at fire hundre og femti megawatt i midtnorge vil bidra til en bedre energibalanse i området det er vil jeg nesten si er ein matematikk eee det som eee vi har sagt i forbindelse med at konsesjonen har blitt gitt det er jo eee at vi er både opptatt av energidelen men også av klimadelen eee og at eee håndtering av utslippa er også en del av eee det her eee og eee jeg vil nok eee også mane eee til eee,president eg jo der ikke tyende at fyre hudre og femti megaard i midtnoreg vil bidra til ein betre energibalanse i området det vil eg nesten sider ein matematikk eee det som eee vi har sagt i forbindelse med at konsesjonen har blitt gitt det er jo eee at vi har både opptatt av energidelen men også av klima delen eee og at eee handtering av utsleppa er også ein del av det her eee og eigen nok eee og som bane eee til eee,13968.8,13994.6,25.80000000000109,2010-03-03,2010-03-03_proceedings.txt
stortinget-20100303-090601_2m_13994600_14011600,eee til å klare i en vanskelig tid som vi nå er inne i til å ha fokus både på energiutfordringene og eee klimautfordringene det er ikke mer enn to måneder siden vi var samla i københavn eee alle verdens land omtrent for å håndtere og diskutere åssen du skal ha eee møte klimautfordringene framover,eee til å klare i ein vanskeleg tid som vi no er inne i til å ha fokus både på energiutfordringane og eee klimautfordringane det er ikkje meir enn to månader sidan vi var samla i københavn eee alle verdas land omtrent for å handtere og diskutere også ein skal ha eee møte klimautfordringane framover,13994.6,14011.6,17.0,2010-03-03,2010-03-03_proceedings.txt
stortinget-20100303-090601_2m_14011600_14037500,resultatet av det var ikke oppløfte hans eee vi i norge er nødt til å følge opp det som eee er intensjonen tenkinga bak det globale klimaarbeid til å også ha ambisjoner på på jernbane og en del av den ambisjonen går jo på renseteknologi rensing av kraftverk for på den måten å få ned utslippa og det gjelder eee også i de her spørsmåla neste spørsmål vil bli stilt av representanten ketil solvikolsen,resultatet der var ikkje oppløf dans eee vi i noreg er nøydt til eee å følgje opp det som eee er intensjonen tenkinga bak til globale klimaarbe til å også ha ambisjonar på på jernbane og ein del av den ambisjonen går jo på renseteknologi rensing av kraftrekk for på den måten å få utsleppa og det gjeld eee også i dei her spørsmolenneste spørsmål vil bli stilt av representanten ketil solvicolsen,14011.6,14037.5,25.899999999999636,2010-03-03,2010-03-03_proceedings.txt
stortinget-20100303-090601_2m_14037500_14063300,og vil bli besvart av olje og energiministeren solvikolsen president kraftsituasjonen er anstrengt flere steder i landet og statistikken viser at mange av vannmagasinene har lavest fyllingsgrad på mange år,og vil bli besvart av olje og energiministeren solvikolsen president kraftsituasjonen er anstrengt fleire steder i landet og statistikken viser at mange av vannmagasin hald og verste fyllingskra på mange år,14037.5,14063.3,25.799999999999272,2010-03-03,2010-03-03_proceedings.txt
