file,text_bm,text_nn,start,end,duration,date,proceedingsfile
stortinget-20100527-095539_2m_5977800_6005300,eee og hva med statssekretærer som ble nevnt permisjonsreglene er det viktig og nødvendig at vi av og til tar grundige drøftinger om og behandling av dagens grunnlovsforslag dreier seg derimot om en representants rett til å fratre vervet som stortingsrepresentant etter eget ønske hvis vi hadde akseptert det president så ville det undergrade stortingsver,eee og var med statssekretæren som blei nemnt permisjonsreglane er det viktig og nødvendig at vi av og til tar grundige drøftingar om og behandling av dagens grunnlovsforslag dreier seg derimot om ein representants rett til å frå trevervet som stortingsrepresentant etter eiget ønske viss vi hadde akseptert det president så ville det undergrade stortingsved,5977.8,6005.3,27.5,2010-05-27,2010-05-27_proceedings.txt
stortinget-20100527-095539_2m_6005300_6031400,verdighet og rettigheter og plikter i tillegg til å undergrave den forpliktelse der å være stortingsrepresentant og det ansvaret en representant etter grunnloven er pålagtstortings vervet er en grunnlovfestet plikt hvis man skulle kunne si fra seg vervet i perioden så ville det innebære en slags deva,vers verdighet og rettigheter og plikter i tillegg til å undergrave den forpliktelse det er å vere stortingsrepresentant og det ansvaret ein representant etter grunnloven er pålagt stortingsvervet er ein grunnlovsfeste plikt viss ein skulle kunne sifra seg vervet i perioden så ville det innebere ein slags deva,6005.3,6031.4,26.099999999999454,2010-05-27,2010-05-27_proceedings.txt
stortinget-20100527-095539_2m_6031400_6056700,det å være stortingsrepresentant må aldri bli en salderingspost eller et springbrett for en person man skal altså ikke kunne gå av som stortingsrepresentant for å bli sjef for posten for å ta et eksempel fra vårt naboland eller for den sak som vil begynne å studere ved land om school of economics det vil undergrave vervets betydning status og plikter etter min oppfatning men i tillegg,det å vere stortingsrepresentant må aldri bli ein sonderingspost eller eit springbrett for ein person ein skal altså ikkje kunne gå av som stortingsrepresentant for å bli sjef for posten for å ta eit eksempel frå vårt naboland eller for den saks skyld begynner å studere ved lande skor av ekonomisk det vil undergrave vervets betydning status og plikter etter midoppfatning men i tillegg,6031.4,6056.7,25.300000000000182,2010-05-27,2010-05-27_proceedings.txt
stortinget-20100527-095539_2m_6056700_6086200,så vil det faktisk også kunne føre til en usunn kultur i partiorganisasjonene der representanter kan bli presset til å trekke seg for å overlate stortingsplassen til nestemann på lista eller blir utsatt for press fra organiserte grupper i gitte situasjoner for ikke å snakke om to personer inngår en dil jeg sitter i to år så trekker jeg meg da kan du trygt stå bak meg på lista,så vil det faktisk også kunne føre til ein usunn kultur i partiorganisasjonene der representantar kan bli presset til å trekke seg for å overlate stortingsplassen til nestemann på lista eller blir utsett for press frå organiserte grupper i gitte situasjonar på ikke å snakke om to personar inngår ein del ei siterito år så trekke her meg da kan du trykt stå bak meg på lista,6056.7,6086.2,29.5,2010-05-27,2010-05-27_proceedings.txt
stortinget-20100527-095539_2m_6086200_6113700,aller verst vil dette kunne bli for en som er i en midlertidig vanskelig livssituasjon det som faktisk var utgangspunktet for at dette forslaget så vidt jeg vet ble lagt fram husk på hvis man er i en vanskelig livssituasjon da har man en sårbarhet en personlig sårbarhet da er det lett å gi etter for press eller fornende råd kanskje,aller verst vil dette kunne bli for ein som er i ein midlertidig vanskeleg livssituasjon det som faktisk har utgangspunktet for at dette forslaget så vidt gjer vet blir lagt fram hus på viss ein er i ein vanskeleg livssituasjon da har ein ein sårbarheit ein personleg sårbarhet da er det lett å gjere på press eller fornande råd kanskje,6086.2,6113.7,27.5,2010-05-27,2010-05-27_proceedings.txt
stortinget-20100527-095539_2m_6113700_6141400,om å trekke seg når så den personlige kristen er over så er stortingsvervet borte da er man ikke lenger folkevalgt for da har man frivillig valgt å trekke seg så til slutt president vi må heller drøfte hva slags velferdsordninger og tilbud vi kan gi våre medrepresentanter i situasjoner hvor det kan være nødvendig for det vet vi alle sammen akkurat,og å trekke seg når så den personlige kristne rover så har eit stortingsvervet borte da er ein ikkje lenger okevag for da har ein frivillig valt å trekke segså til slutt president vi må heller drøfte var slags velferdsordninger og tilbod vi kan gi våre medrepresentantar i situasjonar vår det kan vere nødvendig for det vet vi alle saman og,6113.7,6141.4,27.699999999999818,2010-05-27,2010-05-27_proceedings.txt
stortinget-20100527-095539_2m_6141400_6148400,da er neste taler steinar gullvåg,då er neste påver stenar gullvåg,6141.4,6148.4,7.0,2010-05-27,2010-05-27_proceedings.txt
stortinget-20100527-095539_2m_6160200_6187800,deretter ulf erik knutsen bak president qqq det vil eee muligens forundre noen at eee undertegnede og flere andre av forslagsstillerne kommer til å stemme imot sitt eget forslag når vi kommer så langt når vi allikevel gjør det så er det fordi atsaken er behandlet,deretter er det vel erik knutsen ulak president qqq det vil eee muligens forundre nokon at eee underteikne og fleire andre av forslagsstillarane kommer til å stemme imot sitt eige forslag når vi kommer så langt når vel likevel gjer det så er det fordi atsaka her behandlet,6160.2,6187.8,27.600000000000364,2010-05-27,2010-05-27_proceedings.txt
stortinget-20100527-095539_2m_6187800_6217700,i arbeiderpartiets gruppe eee og vi følger gruppa i denne saken når det er sagt så er jeg glad for at eee det så sterkt understrekes at eee man vil se på ordninger i forhold til permisjonsreglementet som gjør det mulig for representanter som kommer i vanskelige sosiale situasjoner eee og bli fritatt for si,i arbeidarpartiets gruppe eee og vi følger gruppa i denne saka når det er sagt så er eg glad for at eee det er så sterk understrekast at eee ein eee vil se på ordningar i forhold til permisjonsreglamentet som gjer det mulig for representantar som kommer i vanskelege sosiale situasjonar eee å bli fritatt frå si,6187.8,6217.7,29.899999999999636,2010-05-27,2010-05-27_proceedings.txt
stortinget-20100527-095539_2m_6217700_6246000,eee daglig oppmøteplikt eee i stortinget for kortere eller lengre perioder fordi når forslaget ble fremmet så var det med grunnlag i at permisjonsreglementet så langt ikke ga en slik anledning og fordi daværende pensjons eee permisjonsordning faktisk viste seg å være i strid med grunnlovens bestemmelser,eee dagleg oppmøteplikt eee i stortinget for kortare eller lengre periode fordi når forslaget blei fremma så var det med grunnlag i at permisjonsreglementet så langt ikkje gav ein slik anledning og fordi daverende pensjons eee permisjonsordning faktisk visse vere i strid med grunnlovens bestemme seg,6217.7,6246.0,28.300000000000182,2010-05-27,2010-05-27_proceedings.txt
stortinget-20100527-095539_2m_6246000_6268600,jeg ber imidlertid om at presidentskapet forfølger det de nå har sagt fra talerstol slik at vi kan få skikkelige ordninger som gjør det mulig for representanter å slippe å møte dersom sosiale situasjoner skulle tilsi detneste taler er ulf erik knutsen deretter martin kolberg,eg ber imidlertid om at eee presidentskapet forfølger det dei nå har sagt fra talestol slik at vi kan få skikkelege ordningar som gjer det mulig for representantar å slippe å møte dersom sosiale situasjon skulle til seg veneste talar er ul fredrik eee knudsen deretter er det martin kolbe,6246.0,6268.6,22.600000000000364,2010-05-27,2010-05-27_proceedings.txt
stortinget-20100527-095539_2m_6272100_6298000,knudsen er sakens ordfører ærede president bare en meget kort kommentar i forhold til innlegget fra representanten marit nybakk hun tok utgangspunkt i at jeg tok opp dette og nevnte flere steder etter med permisjonsreglene og at det faktisk ikke var det sentrale i forslaget som skal voteres over men i begrunnelsen eee i forslaget,knutsen er sakas ordførar eee president berre ein megelkort kommentar i forå til innlegget frå representanten marit nybakk eee under utgangspunktet at eg tok opp dette og nentere selet med permisjonsreglane og at det faktisk ikkje var det sentrale i forslaget som skal voterast over men i begrunnelsen eee i forslaget,6272.1,6298.0,25.899999999999636,2010-05-27,2010-05-27_proceedings.txt
stortinget-20100527-095539_2m_6298000_6322400,så er dette med permisjonene tatt opp en rekke ganger og det var også grunnen for at jeg viste til det i mitt innlegg qqq for øvrig så deler jeg synspunktene som eee representanten nybakk eee kom med i meget stor grad eee og spesielt når eee hun tar til orde for eee at man skal se på hvilke regler som er når det gjelder permisjon,så er dette med permisjonen tatt opp ein rekke gonger og det var også grunnen for at eg viste til det i mitt innlegg qqq for øvrig så deler eg synspunkta som eee representanten nybakk eee kom med i mega stor grad eee og spesielt når eee hon tar til orde for eee at ein skal se på kve reglar som er når det gjeld permisjon,6298.0,6322.4,24.399999999999636,2010-05-27,2010-05-27_proceedings.txt
stortinget-20100527-095539_2m_6322400_6341300,og også siste taler ulvo representanten gullvåg tar jo opp dette eee er jeg meget fornøyd med at man eee tar opp i presidentskapet hvor både presidenten som ledet møtet i dag og marit nybakk sinneste taler er martin kolberg deretter per christian foss,og også siste talar ullva representanten gullvåg tar jo opp dette eee eg er meget fornøgd med at ein eee tar opp i presidentskapet vore både presidenten som leder møter i dag og marit nybach sitneste talar er martin eee kolberg deretter per kristian oss,6322.4,6341.3,18.900000000000546,2010-05-27,2010-05-27_proceedings.txt
stortinget-20100527-095539_2m_6347800_6375100,ler president eee jeg eee jeg viser til representanten nybakks innlegg som vår hovedbegrunnelse for å eee stemme mot forslaget men det er en betraktning som jeg syns bare hører hjemme i denne debatten eee og som jeg mener er riktig å fremføre før vi avslutter den og det eee knytter seg det eee,copresident eee ei jeg viser til representanten nybakks innlegg som vår hovedbegrunnelse for å eee stemme mot forslaget men her er ein betraktning som eg synest berre høyrer hjemme i denne debatten eee og eee som eg meiner det er riktig å framføre før vi avsluttar den og det eee knyt seg det eee,6347.8,6375.1,27.300000000000182,2010-05-27,2010-05-27_proceedings.txt
stortinget-20100527-095539_2m_6375100_6402400,viktige og riktige prinsipp som eee vår forvaltning også bygger på det er at når en stortingsrepresentant er valgt så er det vedkommende selv som forvalter det embetet som velgerne har gitt vedkommende det er ikke partiene og det er heller ikke eee det er ikke partiene og det er heller rtinget som sådan,viktige og riktige prinsipp som eee vår forvaltning også bygger på det gjer at når ein stortingsrepresentant er valt så er det vedkomande sel som forvalter det embetet som veljarane har gitt velkommen det er ikkje parti og det er heller ikkje eee he det er ikkje partia og det er heller rtinget som sådan,6375.1,6402.4,27.299999999999272,2010-05-27,2010-05-27_proceedings.txt
stortinget-20100527-095539_2m_6402400_6427400,som kan overprøve den enkeltes representantsrettigheter og intryggitet og det eee for å ikke overdrive det så går den å si at det forslaget som nå ligger der til en viss grad kan undergrave den ordningen og den integriteten slik som marit nybakk har argumentert,som kan overprøve den enkeltes representansrettigheter og integritet og det eee k for ikkje å overdrive det så går det ned å si at det forslaget som nå ligg der til ein viss grad kan undergrave den ordningen og den integriteten slik som marit nybak har argumentert,6402.4,6427.4,25.0,2010-05-27,2010-05-27_proceedings.txt
stortinget-20100527-095539_2m_6427400_6454000,og det er en prinsipiell betraktning som iallfall jeg tillegger ganske stor vekt fordi det at det enkelte mandat tilhører den enkelte representant når vedkommende er valgt det er en viktig balanse mellom den enkelte partiene og velgerne og det er også et argument som vi må legge inn i betraktningen når vi nå mener at vi skal avvi,og det er ein prinsipiell betraktning som i alle fall gjei tillegg er ganske stor vekt fordi det at det enkelte mandat tilhøyrer den enkelte representanten og velkomne er valt det er ein viktig balanse mellom den enkelte partia og veljane og det er også eit argument som vi må legge inn i betrakningan når vi no meiner at vi skal avvi,6427.4,6454.0,26.600000000000364,2010-05-27,2010-05-27_proceedings.txt
stortinget-20100527-095539_2m_6454000_6459100,neste taler er per kristian foss,neste talar er per kristian foss,6454.0,6459.1,5.100000000000364,2010-05-27,2010-05-27_proceedings.txt
stortinget-20100527-095539_2m_6465000_6493000,oss eee sist inntegnede taler eee president høyre eee er på veg på høyres vegne en del av denne enstemmige innstilling men bare for ordens fjel har rettet en feil på side tre i innstillingen høyre skal ikke være en del av merknaden på side tre dermed heller ikke en del av flertallet fordi disse medlemmer eee viser til at partiene har vært skeptiske til de ganger representanter har trådt ut av stortingsvervetor du blir statssekretærer eller lignende,fors eee siste innteikna eee president høyde eee vi er her på veg på høgre sven ein del av denne enstemmig innstilling men berre for ordningsøl har dette et ein feil på sine tre i innstillinga høgre skal ikkje vere ein del av merknaden på side tre dermed heller ikkje del av fleirtalet fordi desse medlemmer eee viser til at partia har vore skeptiske til dei gonger representantar det har slått ut av stortingsvara for å bli statssekretærar elle linne,6465.0,6493.0,28.0,2010-05-27,2010-05-27_proceedings.txt
stortinget-20100527-095539_2m_6493000_6518400,jeg tror ikke ikke jeg med høye med hånd på hjertet kan si at høyre alltid har vært det de andre forholder seg til sine egne hjerter for å si det sånn men eee som historiebeskrivelse tror jeg dette tror jeg ikke vil være med på den formuleringen så ved en inkurie har jeg kommet inn der den siste setningen etter flertallets oppfatning er det eee tilstrekkelig adgang til det til til permisjoner i det gjeldende regelverket og så videre det er for seg en beskrivelse jeg kan være med på,eg trur ikkje ikkje med høge med honom på hjartet kan si at høgre har altid har vore det dei andre får holde seg til sin eigne jarrodproduktiv og sånn men eee som historiebeskrivelså trur eg dette eg trur eg ikkje å vere med på den formuleringa så vid ein inku har eg komme inn der den siste setninga etter fleirtalets oppfatning er dei eee til stikklaga til til til permisjon det det gjeld regelverket og så vidare det er ei for sein beskrivelse eg kan vere med på,6493.0,6518.4,25.399999999999636,2010-05-27,2010-05-27_proceedings.txt
stortinget-20100527-095539_2m_6518400_6544900,men den tror jeg ikke til helle er stor uenighet om egentlig i komiteen som sådan men ikke at denne historiebeskrivelsen om skepsis den eee den tror jeg eee vil ha å falle høyre un av takk presidentda har eee representanten eee foss redegjort for de eee eee inkurie som her er og har da er det ikke flere som har tegna seg til debatt i sak fire og sak fire er den eee ferdigbehandla og det vil bli rin,men den trur eg ik det heile er stor ueinigheit om eigentleg i komiteen som sådan men akk at ein ikkje stod beskrivelse om skepsis den eee den trur eg eg vil ha å få høyre un av takk president da har eee representanten eee fo redegjort for i eee enuen som eidade er det ikkje fleire som har tenna seg til debatt i sak fire og sak fire og den er ferdigbehandla og det vil bli in,6518.4,6544.9,26.5,2010-05-27,2010-05-27_proceedings.txt
stortinget-20100527-095539_2m_6545000_6548600,sa,smitte,6545.0,6548.6,3.600000000000364,2010-05-27,2010-05-27_proceedings.txt
stortinget-20100527-095539_2m_6582500_6588100,ja vadalen,der men der medan kjetomtsaka,6582.5,6588.1,5.600000000000364,2010-05-27,2010-05-27_proceedings.txt
stortinget-20100527-095539_2m_6640100_6642800,vi må skulegata nytte,men ordet eiane,6640.1,6642.8,2.699999999999818,2010-05-27,2010-05-27_proceedings.txt
stortinget-20100527-095539_2m_6655500_6658100,lagmesterskap,stad mila men sume suver så god,6655.5,6658.1,2.600000000000364,2010-05-27,2010-05-27_proceedings.txt
stortinget-20100527-095539_2m_6671300_6673600,fredet men jeg har tegnerteamet,nesen landt,6671.3,6673.6,2.300000000000182,2010-05-27,2010-05-27_proceedings.txt
stortinget-20100527-095539_2m_6708500_6711600,daedeok med andreet,as solen hannis,6708.5,6711.6,3.100000000000364,2010-05-27,2010-05-27_proceedings.txt
stortinget-20100527-095539_2m_6719800_6722500,et er nå faraasen hemme,minutt snakk med sen ein,6719.8,6722.5,2.699999999999818,2010-05-27,2010-05-27_proceedings.txt
stortinget-20100527-095539_2m_6756900_6759300,men han var hode er et foran,me må jo mote hjelp mot ikkje for langt,6756.9,6759.3,2.4000000000005457,2010-05-27,2010-05-27_proceedings.txt
stortinget-20100527-095539_2m_6988700_6991000,arealene angliae,na,6988.7,6991.0,2.300000000000182,2010-05-27,2010-05-27_proceedings.txt
stortinget-20100527-095539_2m_7083200_7107000,da skulle vi være eee klar til å gå til votering på eee eee votering på sak en til fire på dagens kart sak en under debatten har halgerhee langeland tatt opp eee forslag på vegne av eee sv om at grunnlovsforslaget bifalles presidenten vil foreslå at det voteres alternativt mellom innstillingens forslag til vedtak,då skulle vi vere klart til å gå til votering på eee votering på sak ein til fire på dagens kart sak en under debatten har holger ho løngeland tatt opp eee forslaget på vegner av eee sv om at grunnlovsforslaget bifaldes presidenten vil foreslå at det voterast alternativt mellom innstillingas forslag til vedtak,7083.2,7107.0,23.800000000000182,2010-05-27,2010-05-27_proceedings.txt
stortinget-20100527-095539_2m_7107000_7136200,og forslaget fra sv om at det vo og at det voteres på vanlig våt måte med voteringsanlegget innstillingen refereres dokument eee tolv tre totusenogsju totusenogåtte grunnlovsforslag fra austen jupedal ågot valle og rolf reikvam om endringer i grunnlovens paragraf en tre tolv til fjorten seksten til tjueto tjuefem til trettien sekstito sekstisju til sekstini syttifire pil åttien åttiseks,og forslaget frå sv om at det å og at det voterast på vanleg vå måte med voteringsanlegget innstillinga refererast dokument tolv tre totusenogsju totusenogåtte grunnlovsforslag frå austen jupedal og opole og rolf reikvam om endringar i grunnlovens paragraf ein tre tolv til fjorten casten til tjueto tjuefem til trettiein sekstito sekstisju til sekstini syttifire til åttiein åttiseks,7107.0,7136.2,29.199999999999818,2010-05-27,2010-05-27_proceedings.txt
stortinget-20100527-095539_2m_7136200_7162100,og hundre og tolv om opphevelse av grunnlovens paragraf fire til ni elleve tjuetre tjuefire trettito trettifire til trettisju trettini til førtien førtitre til førtiåtte om ny paragraf tretten om endringen av grunnlovens overskrift innføring av represent eee statsform hundre og tretten lettelse system,og hundre og tolv om opphevelse av grunnlovens paragraf fire til ni elleve tjuetre tjuefire trettito trettifire trettisju trettini til førtiein førtitre til førtiåtte om ny paragraf tretten om endring av grunnlovens overskrift innføring av eee statsform hundre og tretten rettelse siste,7136.2,7162.1,25.900000000000546,2010-05-27,2010-05-27_proceedings.txt
stortinget-20100527-095539_2m_7162100_7179400,de fales ikke de som stemmer for innstillinga bruker forknapp og sitter de som eee stemmer for forslaget bruker motknapp og reise seg og det voteresvoteringa er avslutta,i forliket dei som stemmer for innstillinga bruker forknapp og sit dei som stemmer for forslaget bruker motknapp og reiser seg og det voterastvoteringa er avslutta,7162.1,7179.4,17.299999999999272,2010-05-27,2010-05-27_proceedings.txt
stortinget-20100527-095539_2m_7180600_7207400,for innstillinga stemte hundre og tjuefem for eee forslaget stemte sytten dermed er innstillingen vedtatt og forslaget forkastet sak to sak to under debatten har eee halgeir h langeland tatt opp to forslag på vegne av sv og venstre forslag nummer to går urslaget,for innstillinga stemte hundre og tjuefem for eee forslaget stemte sytten dermed er innstillinga vedtatt og forslaget forkasta sak to sak to under debatten har eee holger ho langeland tatt opp to forslag på vegner av eee sv og venstre forslag nummer to går uslaget,7180.6,7207.4,26.799999999999272,2010-05-27,2010-05-27_proceedings.txt
stortinget-20100527-095539_2m_7207400_7237100,bifalles presidenten vil foreslå at det voteres alternativt mellom innstillingens forslag til vedtak og forslag nummer to fra sv og venstre og at det voteres på vanlig måte ved bruk av voteringsanlegget innstillingen refereres dokument tolv seks totusenogsju totusenogåtte grunnlovsforslag fra heikki holmås åsa elvik inge marte torkelsen og eee odde in are dørum om endring i grunnlovens paragraf tolv femti og sekstien,bifalles presidenten vil foreslå at det voterast alternativt mellom innstillingas forslag til vedtak og forslag nummer to frå sv og venstre og at det voterast på vanleg måte ved bruk av voteringsanlegget innstillinga refererast dokument tolv seks totusenogsju totusenogåtte grunnlovsforslag frå heggi holmås åsa elvik inge marti tørkelsen og eee ordenar dørum om endring i grunnlovens paragraf tolv femti og sekstiein,7207.4,7237.1,29.700000000000728,2010-05-27,2010-05-27_proceedings.txt
stortinget-20100527-095539_2m_7237100_7257800,innføring av stemmerettsalder seksten år ved stortingsvalg bifalles ikke de som stemmer for innstillinga bruker forknapp og sitter og de som stemmer for forslaget bruker motknapp og reiser seg og det voteresvoteringa er,innføring av stemmerettsalder casten og ved stortingsval bifalles ikkje dei som stemmer for innstillinga bruker forknapp og sit og dei som stemmer for forslaget bruker motknapp og reiser seg og det voterastvoteringa e,7237.1,7257.8,20.699999999999818,2010-05-27,2010-05-27_proceedings.txt
stortinget-20100527-095539_2m_7257800_7283200,for innstillingen stemte hundrede og tredve for eee forslaget stemte tolv dermed er innstillingen vedtatt og forslaget forkasta det voteres så over forslag nummer en fra sv og venstre og det er opptalt de som stemmer for forslaget bruker forknapp og sitter de som stemmer imot bruker motknapp og reiser seg og det voteres,for innstillinga stemte hundrede og tredve for forslaget stemte tolv dermed er innstillinga vedtatt og forslaget forkasta det voterast så over forslag nummer ein frå sv og venstre og det er opptatt de som stemmer for forslaget bruker forknapp og sit dei som stemmer imot bruker motknapp og reiser seg og det voterast,7257.8,7283.2,25.399999999999636,2010-05-27,2010-05-27_proceedings.txt
stortinget-20100527-095539_2m_7289200_7315300,voteringa er avslutta for eee forslaget stemte eee tretten mot stemte ett hundre og tjueåtte dermed er forslaget forkasta sak tre det foreligger en enstemmig innstilling men eee sia vi nå skal gjøre vedtak om endringer i grunnloven vil presidenten foreslå,voteringa er avslutta for forslaget stemte eee tretten mot stemte eitt hundre og tjueåtte dermed er forslaget forkasta sak tre det foreligger en enstemmig innstilling men sidan vi no skal gjere vedtak om endringar i grunnloven vil presidenten føresl,7289.2,7315.3,26.100000000000364,2010-05-27,2010-05-27_proceedings.txt
stortinget-20100527-095539_2m_7315300_7341800,de som eee ikke har kommet med noe innvinn innvendinger mot det og da går vi frem som foreslått av presidenten og innstillinga refereres dokument tolv eee femten totusenogsju totusenogåtte grunnlovsforslag fra annund helleland og finn erik linje vedtatt til fremsettelse av carl i hagen inge lønning berit børrøby ola t lanke og olav gunnar,dei som ikkje har komme med noko inn innvendingar mot det og dag går vi sem som foreslått av presidenten og innstillinga refererast dokument tolv femten totusenogsju to totusenogåtte grunnlovsforslag frå amund hylland og finn erik vinje vedtatt til framsettelse av carl i hagen inge lønning berit bø brøby ola telonke og olav gunnar,7315.3,7341.8,26.5,2010-05-27,2010-05-27_proceedings.txt
stortinget-20100527-095539_2m_7341800_7356300,paragraf eee tredve sekstien hundre og hundre og seks retting av språklige feil bifalles,paragraf eee tredve sekstiein hundre og hundre og seks retting av språklege feil bi faveo,7341.8,7356.3,14.5,2010-05-27,2010-05-27_proceedings.txt
stortinget-20100527-095539_2m_7360200_7385300,kan sviske ja begynner det da starter vi med oppropet med representant nummer ni for eee akershus fylke nei horda rettelse hordaland fylke eee og de som stemmer for innstillinga svarer ja de som stemmer eee imot innstillinga,nessaene då startar vi oppropet med representant nummer ni for eee akershus fylke ei hore rettelse hordaland fylke eee og dei som stemmer for innstillinga svarer ja dei som stemmer eee i mot innstillinga,7360.2,7385.3,25.100000000000364,2010-05-27,2010-05-27_proceedings.txt
