file,text_bm,text_nn,start,end,duration,date,proceedingsfile
stortinget-20100611-095544_2m_3429400_3459400,og da er jo mitt første spørsmål er om et stort mindretall eee i denne sal vil bety at regjeringen egentlig vil heller lytte til de og da flytte presis til oslo eee istedenfor til trondheim det andre spørsmålet mitt president det er den merknaden som flertallet har og som jeg sitert i mitt innlegg om at man mener at det vil være uheldig at man får tre kandidat nei er kun en kandidat ja det vil innskrenke regjeringens frihet til å vurdere hvem som skal innstilles og utnevnes,og da er jo mitt første spørsmål er om eit stort mindretal eee i denne sal vil bety at regjeringa eigne vil heller lytte til dei og da flytte preses til oslo eee i staden for til trondheim det andre spørsmålet mitt president det er den merknaden som fleirtalet har og som er sitert i mitt innlegg om at ein meiner at det vil vere uheldig at ein får tre kandidat eee er kun ein kandidatar dei vil innskrenke regjeringas frihet til å vurdere kven som skal innstilles og utnemnast,3429.4,3459.4,30.0,2010-06-11,2010-06-11_proceedings.txt
stortinget-20100611-095544_2m_3459400_3478700,president er det sånn at i er trosfrihetspørsmål og i denne saken så har man vært mest opptatt av å bevare regjeringens frihet til å vurdere hvem som skal innstilles og hvem som skal utnevnes ja president eee eee det er eee så,president er det sånn at u er trosfrihetsspørsmål og i denne saka så har ein vore mest opptatt av å bevare regjeringas frihet til å vurdere ven som skal innstillast og ven som skal utnemnastja president eee eee der så,3459.4,3478.7,19.299999999999727,2010-06-11,2010-06-11_proceedings.txt
stortinget-20100611-095544_2m_3478700_3500700,etter sto etter kirkeforliket som ble inngått i denne salen så har jeg oppfatta at eee stortinget ønsker å få denne saken til behandling eee det har stortinget i dag det vedtaket som ble gjort her i dag vil sjølsagt regjeringa sørge for å bli s blir satt ut i livet eee og jeg har ikke oppfatta verken i kirkeforliket eller seinere at noen har ment at man,etter sto att kirkeforliket som blei inngått i denne salen så har eg oppfatta at eee stortinget ønsker å få denne saka til behandling eee det har stortinget i dag det vedtaket som blei gjort her i dag vil sjølvsagt regjeringa sørge for å bli bli satt ut i livet eee og eg har ikkje oppfatta verken i kirkeforliket eller seinere at nokon har meint at ein,3478.7,3500.7,22.0,2010-06-11,2010-06-11_proceedings.txt
stortinget-20100611-095544_2m_3500700_3511600,at regjeringa og stortinget ikke skal ta sjølstendig ansvar for denne saken er sånn det gjelder både lokaliseringa og måten man velger ut den eee tolte biskopen på,at regjeringa og stortinget ikkje skal ta sjølvstendig ansvar for denne saka her sånn det gjeld både lokaliseringa og måten ein velger ut den eee tolte biskopen på,3500.7,3511.6,10.900000000000091,2010-06-11,2010-06-11_proceedings.txt
stortinget-20100611-095544_2m_3511600_3540700,vi har valgt å følge det som er helt normale prosesser der man innstiller flere kandidater når embetsmenn skal utnevnes det gjøres i biskopsaker det gjøres når vi har proster og vi har valgt å gjøre det på den måten nettopp for at man skal kunne eee ha samme muligheten som man har når man for eksempel utnevner biskoper i forbindelse med at vi utnevner en presis neste replikant er anders amundsen deretter hans olav sivertsen,vi har valt å følge det som er heilt normale prosessar der ein innstiller fleire kandidatar når embedsmenn skal utnemnast det gjøres i biskopsaker dei gjerast når vi har poster og vi har valt å gjera det på den måten nettopp for at ein skal kunne eee ha same muligheita som ein har når ein for eksempel utnemne biskopar i forbindelse med til utnemner ein presisneste replikant er anders amundsen deretter hans olav sivertsen,3511.6,3540.7,29.09999999999991,2010-06-11,2010-06-11_proceedings.txt
stortinget-20100611-095544_2m_3541700_3567100,amundsenærede president statsråd aasrud har overtatt et svært alvorlig og viktig ansvar og hun har selv i dag presisert grunnlaget for mye av den saken her nemlig kirkeforliket og hun har eee gjentatte ganger sagt at det dette er er en oppfølging av kirkeforliket kirkeforliket ble inngått mellom alle partier i denne sal president i dag ser vi en sak hvor to viktige elementer,ærede president statsråd aaserud har overtatt eit svært alvorleg og viktig ansvar og unnar sel i dag presisert grunnlaget for mye av den saka her nemleg kirkeforliket og hon har gjentatte gonger sagt at det dette er er ein oppfølging av kirkeforliket kirkeforliket blei inngått mellom alle parti i denne sak president i dag ser vi ein sak vore to viktige element,3541.7,3567.1,25.40000000000009,2010-06-11,2010-06-11_proceedings.txt
stortinget-20100611-095544_2m_3567100_3587500,viser en klar splittelse mellom posisjonspartiene og opposisjonspartiene jeg synes det er leit president at vi nå står i en situasjon hvor statsråd aasrud ikke klarer å følge ånden i kirkeforliket og skape en enighet om hvordan dette skal følges opp mellom alle partier og jeg håper president at statsråden nå vil bekrefte,viser ein klar splittelse mellom posisjonspartia og opposisjonspartia eg synest det leit president at vi no står i ein situasjon der statsråd aasrud ikkje klarer å følgje onden i kirkeforliket og skape ein einigheit om korleis dette skal følgjast opp mellom alle partia og a håper president at statsråden nå vil bekrefte,3567.1,3587.5,20.40000000000009,2010-06-11,2010-06-11_proceedings.txt
stortinget-20100611-095544_2m_3587500_3615100,at en bruker en sak som oppfølging av kirkeforliket hvor en ikke gjør noe forsøk på å skape enighet mellom alle partene i kirkeforliket i oppfølgingen av det som er kanskje det viktigste forlik i kirkens eee moderne historierja president i arbeidet med kirkeforliket så er vi opptatt av å skape breie forlik med opposisjonen i stortinget det vil jeg bekrefkal eee,at ein bruker ein sak som oppfølging av kirkeforliket vore ein ikkje gjer noko forsøk på å skape einigheit mellom alle partane i kirkeforliket i oppfølginga av det som er kanskje det viktigaste forlik i kirkes eee moderne historie statsrådja president i arbeidet med kirkeforliket så er vi opptatt av å skapa breie forlik med opposisjonen i stortinget det vil bekrefkal eee,3587.5,3615.1,27.59999999999991,2010-06-11,2010-06-11_proceedings.txt
stortinget-20100611-095544_2m_3615100_3630300,prøve å bidra til men du kan aldri i en sånn sak som er så krevende som har så mange elementer i seg garantere at man ikke vil være uenig jeg tror denne salen vil være eee tjent med at vi har debatter om eee om også kirkelig spørsmer og det er,prøve å bidra til men du kan aldri gi ein sånn sak som er så krevjande som har så mange elementer i seg garantere at ein ikkje vil vera ueinig eg trur denne salen vil vera eee tent med at vi har debattar om eee om også skirkeleg spørsmer og det er,3615.1,3630.3,15.200000000000273,2010-06-11,2010-06-11_proceedings.txt
stortinget-20100611-095544_2m_3630300_3659300,mange enkeltelementer som vi skal eee behandle flere stortingsmeldinger flere saker som vi kommer til stortinget med og jeg kan ikke her i dag stå og love at vi ikke at vi skal klare å komme fram til enighet men at vi skal søke å nå fram til enighet i de viktigste spørsmåla det tror jeg er viktig for denne saken eee for at vi skal få et eee eee skille eee der vi får eee får eee nye lovregler som kan bære over tid sånn at vi ikke trenger å gjøre om det når det kommer et redd,mange enkelte element som vi skal behandle fleire stortingsmeldingar fleire saker som vi kommer til stortinget med og eg kan ikkje her i dag stå lova at vi ikkje at vi skal klare å komme fram til einigheit men at vi skal søke å nå fram til einigheit i dei viktigaste spørsmåla det trur eg er viktig for denne saka eee for at vi skal få eit eee skilje eee der vi får får ein nye lovreglar som kan vera av vorti sånn at vi ikkje treng å gjera med det når det kommer rett,3630.3,3659.3,29.0,2010-06-11,2010-06-11_proceedings.txt
stortinget-20100611-095544_2m_3659300_3667700,eventuelt andre som ønsker å gjøre andre ting i stortinget så det vil jeg prøve å bidra tilneste replikant er han,eventuelt andre som ønsker å gjere andre ting i stortinget så det vil eg prøve å bidra tilneste replikant her han,3659.3,3667.7,8.399999999999636,2010-06-11,2010-06-11_proceedings.txt
stortinget-20100611-095544_2m_3671100_3699200,siversenja president eee statsråden her var fal grei de at hun har oppgradert trondheim fra være distrikt til storby i løpet av debatten så det er det sikkert fornøyd med i trondheim i det minste men mitt spørsmål går på forståelsen statsrådens prinsipielle forståelse av hva kirkedemokrati er for noe så mye tid som hun og flertallet bruker på hva mindretallet i alle sammenhenger mener,simusenja president eee statsråden har jo ar fagrei det at ho har oppgradert trondheim frå fleire distrikt til storeby løpet av debatten så det er eg sikkert fornøgd med i trondheim i det minste men mitt spørsmål går på forståelsen statsrådens prinsipielle forståelse av kva kirke demokrati er for no så mykje tid som hon og flertalet bruker på var mindre talet i alle samanhenger meiner eg,3671.1,3699.2,28.09999999999991,2010-06-11,2010-06-11_proceedings.txt
stortinget-20100611-095544_2m_3699200_3726300,så får man inntrykk av at det er en egen form for mindretallsdemokrati i kirken som skal opphøyes til noe særskilt så mitt spørsmål president til statsråden er har statsråden et annet prinsipielt syn på demokrati i kirken enn det demokrati som utøves på arbeiderpartiets landsmøte i dette hus eller i regjeringen for den saks skyldstatsråd,så får ein inntrykk av at det er ein eigen form for mindretalsdemokrati i silke som skal opphøgjast til noko særskilt så mitt spørsmål president til statsråden er har statsråden eit anna prinsipielt syn på demokrati i skilken enn det demokrati som utøvast på arbeidarpartiets landsmøte i dette hus eller i regjeringa for den sak skylden statsråd,3699.2,3726.3,27.100000000000364,2010-06-11,2010-06-11_proceedings.txt
stortinget-20100611-095544_2m_3726300_3745100,ja president i kirkeforliket så har man eee ikke sånn som jeg oppfatter det sagt at man skal i alle saker følge kirkas råd i alle saker som skal behandles i denne sak tvert imot så meiner jeg at i den perioden her så har storting,ja president i kirkeforliket så har ein eee ikkje sånn som eg oppfattar det sagt at ein skal i alle saker følge skikkast råd i alle saker som skal behandlast i denne saka tvert imot så meiner eg at i den perioden her så har stortinget,3726.3,3745.1,18.799999999999727,2010-06-11,2010-06-11_proceedings.txt
stortinget-20100611-095544_2m_3745100_3772300,og regjering er et sjølstendig ansvar for å gjøre vurderinger av de råd man får fra kirkas organer ja syns også det er riktig at man ser og hører på hva andre medlemmer av den norske kirke meiner det har regjeringa gjort og det oppfatter jeg også at stortingsflertallet gjør i dag dermed er replikkordskiftet over qqq vi går tilbake til den ordinære talerlistenr helga pedersen,og regjering eit sjølvstendig ansvar for å gjera vurderingar av dei råd ein får frå kirkas organet eg synest også det er riktig at ein ser og høyrer på kva andre medlemmer av det norske fylket meiner det har regjeringa gjort og det oppfattar eg også at stortingsfleirtalet gjer i dagdermed er replikkordskiftet over går tilbake til den ordinære talarlistener helga pedersen,3745.1,3772.3,27.200000000000273,2010-06-11,2010-06-11_proceedings.txt
stortinget-20100611-095544_2m_3772300_3775800,deretter torchild omland,deretter er det torkel omland,3772.3,3775.8,3.5,2010-06-11,2010-06-11_proceedings.txt
stortinget-20100611-095544_2m_3779400_3805800,representanten pedersen har en taletid qqq inntil fem minutter eee president det er nå drøye to år siden man inngikk det historiske forliket med alle stortingspartiene i stat kirkesaka forliket viste at vi i fellesskap kunne finne breie løsninger på et viktig spørsmål det er en sak som dreier seg om våre tradisjon,kyrpresnanten pedersen har en taletid inntil fem minutt til eee president det er nu drøye to år sidan ein inngjekk det historiske forliket med alle stortingspartiane i statskirke saka forliket viser at vi i fellesskap kunne finne breie løysinger på eit viktig spørsmål det er ein sak som dreier seg om våre tradisjon,3779.4,3805.8,26.40000000000009,2010-06-11,2010-06-11_proceedings.txt
stortinget-20100611-095544_2m_3805800_3833200,og som dreier seg om religionsfrihet minoritetsrettigheter og likeverd som kirken sjøl har tatt til orde for så gjennomføres det nå en demokratireform der hovedformålet er å tilrettelegge for at kirkens medlemmer får utøve reell innflytelse også på spørsmål i menighet og lokalsamfunn og det her for å styrke den norske kirke som en god og inklud folkekirke,og som dreier seg om religionsfrihet minoritetsrettigheter og like verd sånn kirken sjøl har tatt til orde for så gjennomførast det nu ein demokratireform der hovudformålet er å tilrettelegge for at kiska medlemmer får utover reell innflytelse også på spørsmål i menigheit og lokalsamfunn og det er her for å styrke det norske fisket som ein god og inklud folkekirke,3805.8,3833.2,27.399999999999636,2010-06-11,2010-06-11_proceedings.txt
stortinget-20100611-095544_2m_3833200_3842600,som kirkeministeren sa det på kirkemøtet i fjor vi vil styrke båndene mellom folk og kirke og løsne noe på båndene melloen og kirka,som kiskeminister sa det på kiskemøtet i fjor vi vil styrke banane mellom folk og fiske og løsne noko på bannan mellomen og fiskar,3833.2,3842.6,9.400000000000091,2010-06-11,2010-06-11_proceedings.txt
stortinget-20100611-095544_2m_3842600_3869000,behovet for å drøfte spørsmål knytta til religion og livssyn har økt også grunn av et større mangfold som både beriker samfunnet men som også skaper utfordringer nettopp det her tror jeg har bidratt til at forholdet mellom stat samfunn enkeltindivid religion og livssyn er kommet sterkere på dagsorden i politikken og det er noe vi har til felles med en,behovet for å drøfte spørsmål knytta til religion og livssyn har økt også grunna eit større mangfald som både beriker samfunnet men som også skaper utfordringar nettopp det her trur eg har bidrag til at forholdet mellom stat samfunn enkelte individ religion og livssyn er kome sterkare på dagsordnen i politikken og det er noko vi har til felles med ein,3842.6,3869.0,26.40000000000009,2010-06-11,2010-06-11_proceedings.txt
stortinget-20100611-095544_2m_3869000_3899000,jeg vil benytte anledninga i dag til å berømme representanten dagfinn høybråten for hans bidrag til at stortinget tjueåttende mai drøfte nettopp religionsplass i samfunnet det at regjeringa nå skal sette ned et bredt sammensatt offentlig utvalg som skal gå gjennom tros og livssynspolitikken er en naturlig oppfølging av den utviklinga vi ser i tråd med den norske kirkes anbefaling så har regjeringa altså tilrettelagt for dagens debatt om presesfunksjonen,eg vil benytte anledninga i dag til å berømme representanten dagfinn høybråten for hans bidrag til at stortinget tjueåttande mai drøfta nettopp religionens plass i samfunnet det er at regjeringa no skal sette ned eit breitt samansett offentleg utval som skal gå gjennom tros og livssynspolitikken er ein naturleg oppfølging av den utviklinga vi ser i tråd med den norske fiskets anbefaling så har regjeringa altså tilrettelagt for dagens debatt om presesfunksjonen,3869.0,3899.0,30.0,2010-06-11,2010-06-11_proceedings.txt
stortinget-20100611-095544_2m_3899000_3914800,det her er i tråd med kirkeforliket og dessuten et bidrag til å styrke kirkens rolle som folk i kirke å styrke bitsbemøtet er viktig og ikke minst i en krevende periode med oppfølging av forliket og utfordringer en rekke områder,det her er i tråd med fiskeforliket og dessutan eit bidrag til å styrke kirstens rolle som folket kirker å styrke bispemøte er viktig og ikkje minst i ein krevjande periode med oppfølging av forliket og utfordringar ein rekke område,3899.0,3914.8,15.800000000000182,2010-06-11,2010-06-11_proceedings.txt
stortinget-20100611-095544_2m_3914800_3939000,så er det da heller ikke sjølve funksjonen som har bidratt til den debatten vi har hatt med et visst støynivå det har i overveiende grad dreid seg om eee lokaliseringa og tilknytninga til no nideros domkirke det demokratiske og folkelige engasjementet rundt lokalisering av det nye embetet som preses i den norske kirke er først og fremst svært gledelig mener jeg,så er det heller ikkje sjølve funksjonen som har bidrag til den debatten vi har hatt med eit visst støynivå det har i overvegande grad dreid seg om eee lokaliseringa og tilknytninga til no nyverosdomkiske det demokratiske og folkelege engasjementet rundt lokaliseringa av det nye embetet som preses i den norske kirke er først og fremst svært gledeleg meiner det,3914.8,3939.0,24.199999999999818,2010-06-11,2010-06-11_proceedings.txt
stortinget-20100611-095544_2m_3939000_3968200,for kirken så signaliserer det sterke engasjementet vi har sett at landet rundt er betydelig interesse for kirkens rolle og eee utvikling eee trøndelagsrådet fylkesordføreren i sørtrøndelag og trondheims ordfører har argumentert solid og grundig for sin anbefaling om at det nye mbt som presses lokaliseres til nidaros men her har også vært et stort engasjement i fylkeskommuner og regionråd eee over nærsagt,for siska så signalisere det sterke engasjementet vi har sett at det landet rundt er betydeleg interesse for kiskens rolle og eee utvikling eee trøndelagsrådet fylkesordføraren i sørtrøndelag og trondheims ordførar har argumentert solid og grundig for sin anbefaling om at det nye embetet som preses lokaliserast til nidaros men her har også vore eit stort engasjement i fylkeskommuner og regionråde over den er sagt,3939.0,3968.2,29.199999999999818,2010-06-11,2010-06-11_proceedings.txt
stortinget-20100611-095544_2m_3968200_3991600,hele eee landet og i de fleste av de her rundene så har altså de borgerlige partiene støtta lokalisering i eee trondheim så når opposisjonspartiene i dagens debatt mener man skal eee følge flertallet på kirkemøtet så er det åpenbart et synspunkt som bestrides av borgerlige folkevalgte ute i eee landet,heile eee landet og i dei fleste av dei her rundane så har altså dei borgerlege partiane støtta lokalisering i eee trondheim så når opposisjonspartia i dagens debatt meiner ein skal eee følgje fleirtalet på kirkemøtet så er det openbert eit synspunkt som bestrides av borgerlege folkevakter ute i eee landet,3968.2,3991.6,23.40000000000009,2010-06-11,2010-06-11_proceedings.txt
stortinget-20100611-095544_2m_3991600_4003700,opposisjonspartiene har i dag brukt eee i ganske sterke ord som maktdemonstrasjon overkjøring i kirka at man er flau over regjeringa og da kunne det være interessant å høre,opposisjonspartia har i dag brukt eee ganske sterke ord som maktdemonstrasjon overkøyring i kiska med flau over regjeringa og då kunne det vore interessant å høyre,3991.6,4003.7,12.099999999999909,2010-06-11,2010-06-11_proceedings.txt
stortinget-20100611-095544_2m_4003700_4028400,hvordan karakteristikker og vurderinger representantene for opposisjonspartiene i dag gir av for eksempel krf i nordland høyre i sørtrøndelag og nordtrøndelag og fremskrittspartiet i møre romsdal som i likhet med eee borgerlige politikere eee i store deler av landet har støtta og lokalisering av feces til eee trondheim,korleis karakteristikker og vurderingar representantane for opposisjonspartiane i dag gir av for eksempel krf i nordland høgre isørtsennerlag og mosjonerag og framstegspartiet i møre romstad som i likhet med eee borgelege politikar eee i store delar av landet har støtta lokalisering av pese til eee trondheim,4003.7,4028.4,24.700000000000273,2010-06-11,2010-06-11_proceedings.txt
stortinget-20100611-095544_2m_4028400_4048800,det er selvfølgelig mulig ut ifra flere hensyn å argumentere godt for en løsning som innebærer at det nye bisbembetet skulle legges til oslo sånn som bispemøtet og kirkemøtet har gjort men en helhetsvurdering har altså likevel gjort at vi har kommet frem til å tilrå lokalisering i trondheimærlig,det er selvfølgelig mulig ut ifrå fleire hensyn å argumentere godt for ein løysing som inneber at det nye bispeembetet skulle leggast til oslo sånn som bispemøte og kirkemøtet har gjort men ein helhetsvurdering har altså likevel gjort at vi har kome fram til å tilrå lokalisering i trondheimærleg,4028.4,4048.8,20.40000000000009,2010-06-11,2010-06-11_proceedings.txt
stortinget-20100611-095544_2m_4048800_4069200,understreke det betydelige tverrpolitiske engasjementet folkevalgte organer har bidratt med for å få den her løsninga rundt om i landet det er det verdt å legge merke til det forteller mye om hvordan engasjement vi faktisk har rundt kirka i norge og det lover godt for det videre arbeidet med opt,g understreke det betydelege tverrpolitiske engasjementet folkevalde organar har bidratt med for å få den her løysinga rundt om i landet det er det vert å legge merke til det forteller myje om korleis engasjement vi faktisk har rundt fiska i noreg og det lover godt for det vidare arbeidet med opet,4048.8,4069.2,20.399999999999636,2010-06-11,2010-06-11_proceedings.txt
stortinget-20100611-095544_2m_4069200_4089800,og for min egen del så vil jeg fortsett eee holde fast på at dagens kommunikasjoner tilsier at et sånt valg er fullt ut forsvarligneste taler er torkill omland deretter marianne aasen,og for min eigen del så vil eg fortsett eee halde fast på at dagens kommunikasjoner til gjer at eit sånt vad er fullt ut forsvarleg neste talar er torkil omland erete mariaasen,4069.2,4089.8,20.600000000000364,2010-06-11,2010-06-11_proceedings.txt
stortinget-20100611-095544_2m_4089800_4113899,omland president jeg synes det er interessant å høre på eee regjeringspartienes eee forsøk på å eee finne en rasjonell begrunnelse for eee det som man her foreslår i dag det bærer jo veldig preg av at man har hatt en politisk hestehandel i regjeringen,omland president så det er interessant å høyre på eee regjeringspartias forsøk på å finne ein rasjonell begrunnelse for eee det som ein her foreslår i eee dag det ber jo veldig preg av at ein har hatt ein politisk eee hestehandel i regjeringa,4089.8,4113.899,24.09900000000016,2010-06-11,2010-06-11_proceedings.txt
stortinget-20100611-095544_2m_4113899_4139899,eee og så har man bestemt seg og så gjelder det å i ettertid å prø forsøke å finne en eller annen eee begrunnelse for hvorfor man har gjort dette og dette er jo nok en sak hvor eee man innskrenker trossamfunnenes frihet man innskrenker trosfriheten eee og og det bære litt prega vi har jo hatt flere av disse debattene tidligere i vår også at det blir veldig mye syttende mai retorikk eee om religionsfrihet og trossam,eee og så har ein bestemt seg og så gjeld det å etter tida å prø forsøke å finne ein eller annan eee begrunnelse for kvorfor ein har gjort dette og dette er jo noko sak vore ein innskrenker trosamfunns frihet ein innskrenker trosfriheten eee og og det ber litt preg av v har jo hatt fleire av desse debatten eee tidlegare i vår og så at det blir veldig mykje sytte meir retorikk eee om regionsfriheit og trusam,4113.899,4139.899,26.0,2010-06-11,2010-06-11_proceedings.txt
stortinget-20100611-095544_2m_4139899_4169700,når det kommer til de konkrete sakene så gjør man altså det stikk motsatte av det man ellers snakker om eee og det blir jo ikke spesielt når både statsråden og helga pedersen slut her sier at man skal styrke båndene mellom folk og kirke og svekke båndene mellom stat og kirke det er ikke så fryktelig vanskelig å si at det er faktisk det stikk motsatte man gjør i den saken her president i kirkeforliket så var jo alle parter enige om målet om kirkelig selvstyre og demokrati så kommer denne saken der plasseringen av presis bli et stort tema,når det kommer til dei konkrete sakene så gjer ein altså det stikk motsette av det ein ellos snakkar om eee og det blei jo litt spesielt når både statsråden og helga pedersen til slutt her seier at ein skal styrke bandene mellom folk og kirke og svekke bandet mellom stat og kirke det er ikkje så frykteleg vanskeleg å seie at det faktisk er stikk motsette ein gjer i den saka her president i kirteforliket så var jo alle partar einige om målet om kirkeleg selvstyre og demokrati så kommer denne saka det er plasseringa av preses i eit stort tema,4139.899,4169.7,29.800999999999476,2010-06-11,2010-06-11_proceedings.txt
