file,text_bm,text_nn,start,end,duration,date,proceedingsfile
stortinget-20100527-095539_2m_16704800_16734599,når man fremlegger forslag som skal ta til seriøs eee debatt i stortinget så hadde det kanskje vært greit å definere hva innholdet i forslagene faktisk handler om for til nå i løpet av snart to timers debatt så har man ikke krevde å definere hva er offentlige tjenester hva inkluderes i det begrepet og ikke så vidt meg er kjent er jo hva som flyplasskontroll i en offentlig tjeneste som man alleventet sikter til jeg synes det minner om den gangen man sa at det var krav om halalkjøkken i norske fengsler,når ein fremlegge forslag som skal ta til seriøs eee debatt i stortinget så har det kanskje vore grei å definere var innhaldet i forslaget det faktisk handlar om for til nå i løpet av snart to timers debatt som ein ikkje greide å definere va er offentlege tenester var inkludere i det begrepet og ikkje så vidt me har kjent er kor altså flyplasskontrollen ei offentleg gjeneste som ein advendt sikter til eg synest til mindre om den gongen ein eee sa at det var krav om hallakjøkken i norske fengsler,16704.8,16734.599,29.79899999999907,2010-05-27,2010-05-27_proceedings.txt
stortinget-20100527-095539_2m_16734599_16760900,var ikke et krav men man fremstilte det sånn i forslags form så ok kanskje noen leser emk eller grunnloven men noen ganger kan det kanskje være greit å definere forslagene sine noe bedre før man fremmer den presidenten vil bemerke at angrepet på representanten tybringgjedde nok var noe i overkant eee parlamentarisk eee neste tale,var ikkje eit krav men han fremstilte sånn i forslagsform så ok kanskje nokon leser emk eller grunnloven men nokon gonger kan det kanskje vere greit å definere forslaga sine noko betre før men fremme den presidenten vil bemerke at angrepet på representanten tybring gjedde nok var no i overkant eee parlamentarisk eee neste tala,16734.599,16760.9,26.301000000003114,2010-05-27,2010-05-27_proceedings.txt
stortinget-20100527-095539_2m_16760900_16788500,hei deretter martin kolberg holmås har en taletid på inntil tre mastija president jeg vil også bare trekke opp igjen dette her som handler om religionsfrihet for jeg vil bare peke på at eee at fremskrittspartiet eee på den ene siden argumenterer veldig hardt for religionsfrihet mens i denne sammenhengen så sier de ikke hvem er dem skal få lov å bestemme hva det er muslimer skal mene skal det være den enkelte muslim eller skal det være skal det være liksom den ene muslimske n og og president,ei deretter martin ove vårmøn tati på inkereenja president eg vil også berre teke opp igjen dette her som handlar om relionsfrihet for eg vil berre peike på at at framstegspartiet eee på den eine sida argumenterar veldig hardt for det jeljonsprighet mens i denne samanhengen så seier det kven er det som skal få lov å bestemme kva det er muslimar skal meine skal det vere den enkelte muslim eller skal det vere skal det vere liksom den eine muslimske n og og president,16760.9,16788.5,27.599999999998545,2010-05-27,2010-05-27_proceedings.txt
stortinget-20100527-095539_2m_16788500_16816800,eee det bare gå ned på eee det bare gå ned å se på grunnlovsfadene eee fedrene her ned det dessverre bare fedre og ingen kvinner men det bare gå ned å se på grunnlovsfedrene her ned der så ser du at en del folk mente de og der tror jeg samtidige var kristne det tror det må være mulig å si men der var det en del av de kristne folkene som mente at det ikke skulle være at det var til altså billedforbud det som ikke ble tillatt å avbildes bare for å vise at både innenfor kristen og og innenfor islamsk vis det er utrolig mange avskygninger av hva det er man oppfatter til å være sin religion,eee det e bare går det på det berre går ned og ser på grunnlovsfane eee fedrene her nede dessverre berre fjedre og ingen kvinner men eg berre går ned og ser på grunnlovsfedrane her nede så ser du at ein del folk meinte det trur eg samtlege var kristne det trur dei må vi mulig å si men der var det ein del av dei kristenefolka som meinte at det ikkje skulle vere aktive til billeforbod viss ikkje ver tillat å avbildast og for å vise at både innanfor kristendom og innanfor islam finst det utruleg mange avskygningar av kva det er ein oppfattar til å vere sin religion,16788.5,16816.8,28.299999999999272,2010-05-27,2010-05-27_proceedings.txt
stortinget-20100527-095539_2m_16816800_16832400,og det er den religiøse linjen den er pluralistisk også i norge og jeg vil si at når vi har kritisert at den katolske kirke ikke tillater kvinnelige prester at vi har kritisert at frelselsamimien nsker å ansette homofile,og det er den religøse linjen den er pluralistisk også i noreg og eg vil si at når vi har kritisert at dei katolske kirke ikkje tillate kvinnelege prestar at vi har kritisert at frelsesameemenn nsker å ansette opp mofile,16816.8,16832.4,15.600000000002183,2010-05-27,2010-05-27_proceedings.txt
stortinget-20100527-095539_2m_16832400_16851750,når vi har kritisert at du har eee manglende stemmerett og krav til bekledning innenfor eee enkelte kristne miljøer du har oppdeling av eee av kvinner og menn i eee i forbindelse med med med religiøse høytider også i islamske tros eee trossamfunn altså du,når vi har kritisert at du har i mangle stemmerett og krav til bekledning innanfor enkelte kristemiljøar då oppdeling av eee av kvinner og menn i eee i forbindelse med med med religøse høgtider også i i islamske tros eee trosamfunn altså,16832.4,16851.75,19.349999999998545,2010-05-27,2010-05-27_proceedings.txt
stortinget-20100527-095539_2m_16851750_16873200,har alle disse forskjellige religiøse oppfatningene som jeg oppfatter ikke er tegn akkurat på god likestilling eee så er det noe som ligger der og som fremskrittspartiet alltid sier ja men dette må jo være lov dette her er trosfrihet dette er sånn den enkelte religion skal få lov å bestemme sjølr eksempel har sagt at nei,har alle desse forskjellige reliøse oppfatningane som eg oppfattar ikkje er ein akkurat på god likestilling eee så er det noko som ligg der og som framstegspartiet alltid seier ja men dette må jo vera lov dette her er trosfrihet dette er sånn den enkelte religionen skal få lov å bestemme sjølor eksempel har sagt at nei,16851.75,16873.2,21.450000000000728,2010-05-27,2010-05-27_proceedings.txt
stortinget-20100527-095539_2m_16873200_16895600,alle skal følge likestillingsloven fra sv sin side har sagt at vi har som utgangspunkt at alle bør følge likestillingsloven ellers så skal de vise sin økonomiske støtte men når det kommer til dette spørsmålet om trosfrihet og få lov å bestemme at vet hva jeg mener faktisk at det er greit å gå i klare burke selv om jeg mener at det er et helt for stokket kvinnesyn som ligger til grunn for det,alle skal følgje likestillingsloven frå sv sin side og at me har som utgangspunkt at alle bør følgje likestillingslova eller så skal dei viste sin økonomiske støtte men når det kommer til dette spørsmålet om trosfrihet og få lov å bestemme at ved kva eg meiner faktisk at det er greitt å gå i klæde burka sjøl om eg meiner at det er eit heilt forstokkeit kvinnesyn som ligg til grunn for det,16873.2,16895.6,22.399999999997817,2010-05-27,2010-05-27_proceedings.txt
stortinget-20100527-095539_2m_16895600_16924600,og jeg vil kjempe mot det kvinnesynet og vi kje som legger til grunn i forhold til burker ja vi kjempe mot det kvinnesynet som ligger til grunn for all form for diskriminering av kvinner eller homofile i andre religionssamfunn så er vi i hvert fall konsekvente og så sier vi at dette her er noe som vil komme til å kjempe mot men vi kommer til å bruke demokratiets virkemidler og ikke forbud til å bekjempe disse tingene her så vil jeg også bare spørre for det er ingen tvil om at eee du har spørsmål om symboleffekt i forhold til disse disse tingene,og eg vil kjempe mot det kvinnesynet og vil kje som legg til grunn i forhold til burka eg vil kjempe mot det kvinnesynet som legg til grunn for all form for diskriminering av kvinner eller homofile i andre religionsamfunn så er vi i kvart fall konsekvente og så sier vi at dette her er noko som vi vi kommer til å kjempe mot er vi komer ti å bruke demokratiets verkemiddel og ikkje forbod til å bekjempe desse tinga her så vil eg også berre køyra fordet er ingen tvil om at du har spørsmålet om symboleffekt i forhold til desse desse tingane,16895.6,16924.6,29.0,2010-05-27,2010-05-27_proceedings.txt
stortinget-20100527-095539_2m_16924600_16953300,eee og det er helt klart at eee det er helt klart eee at når vi tar den debatten der fremskrittspartiet alt så mener jeg at her er det viktig å statuere et eksempel så her er det viktig i forhold til symboleffekt eee så mente man for eksempel i forhold til prostitusjon så mente man ikke det var viktig selv om åttinitti prosent av de menneskene som eee lever av prostitusjon har vært utsa for seksuelle overgrep så mener altså fremskrittspartiet at det var galt å forby kjøp av seks da mener de at forbud var feil mener,eee eee og det er heilt klart at eee det er heilt klart at når vi tar den debatten der framstegspartiet altså meiner at her er det viktig å statuere eit eksempel så her er det viktig i forhold til sumboleppekt eee så meinte ein for eksempel i forhold til prostitusjon som me trur ein ikkje det var viktig ser om åtti nitti prosent av dei menneskene som eee lever av prostitusjonen har vore utsett for seksuelle overgrep så meiner altså framstegspartiet at det var galt å forby kjøp av sek der meiner dei at forbodet var feil med,16924.6,16953.3,28.700000000000728,2010-05-27,2010-05-27_proceedings.txt
stortinget-20100527-095539_2m_16953300_16982600,di det er riktigneste taler er martin kolberg representanten kolberg har hatt ordet to ganger og får ordet til en kort merknad begrenset til ett minutt president eee det er eee etter å ha hørt dette nå så vil jeg si at det er to muligheter når det gjelder fremskrittspartiets argumentasjon for det første vil jeg si da jeg hørte kristian tybinggjedde som jeg inntil nå i løpet av denne stortingsperioden har oppfatta som,er i det riktigeneste talar er martin kober representanten koba han hatt ordet to gonger og får ordet til ein kort merknad begrense til eitt minutt eee president eee det har etter å ha høyrt dette no så vil eg seie at det er to muligheter når det gjeld framstegspartiets argumentasjon for det første vil eg sei dei høyrte kristian tybingedde som er inntil no i løpet av denne stortingsperioden har oppfattast som,16953.3,16982.6,29.299999999999272,2010-05-27,2010-05-27_proceedings.txt
stortinget-20100527-095539_2m_16982600_17012600,liberalismens fremste representant i stortinget som var han hatt et veldig politisk slit sant når han holdt innlegga nå holdt det er den ene muligheten den andre muligheten er at det er et uttrykk for eee fremskrittspartiets politiske praksis at de ønsker å fremstille seg liberalistisk men at de i realiteten ikke er det de bruker det når de passer men ikke når de ikke passer,liberalismens fremste representant i stortinget så må han har hatt det veldig politisk slitsamt når han har holdt dei innlegga han no hatt det gjer den eine muligheten den andre muligheten er at det er eit uttrykk for eee fremskrittspartiets politiske praksis at vi ønsker å fremstille seg liberalistisk men at i realiteten ikkje er det dei bruker det vore passar men ikkje når dei ikkje passar,16982.6,17012.6,30.0,2010-05-27,2010-05-27_proceedings.txt
stortinget-20100527-095539_2m_17012600_17039100,og er det noe denne debatten faktisk har avslørt så er det det og om det skal jeg si og det er eee polemisk sagt men det hører hjemme jeg legger merke til en tydelig kulturforskjellen mellom høyre og fremskrittspartiet i denne saken høyre vil samarbeide med fremskrittspartiet i regjering ja sier som bestemorami slit med helsa da er neste og hittil eee sist inntegnede ta,og er det noko den debatten faktisk har avslørt så er det og om det skal eg seie og det er polemisk sagt men det høyrer hjemme eg legg merke til ein tydeleg kulturforskjellen mellom høgre og fremstegspartiet i denne saka høgre vil samarbeide med fremst partiet regjering i ei sider som best moray slit med helsege er beste og i til sist interne ta,17012.6,17039.1,26.5,2010-05-27,2010-05-27_proceedings.txt
stortinget-20100527-095539_2m_17039100_17068700,som har en taletid på inntil tre minutter president eee qqq det er ikke noe litt at hver gang fremskrittspartiet blir utfordret på sine forslag så begynner de å eee å eee hva kan vi si undergrave dem vi spør to ting for det første spør vi er det nå slik at eee vi skal staten skal bestemme at du skal gå kledd sånn og sånn og sånn sånn for å få disse rettighetene og hvis ikke du gjør det,som har ein taletid på in til tre minutt president eee det er kun nitt at waran fremstegspartiet blir utfordra på sine forslag så vinner vi og eee og eee va kan vi seie undergreve det vis bør to ting for det første spør vi er det no slik at eee vi skal staten skal bestemme at du skal gå kledd som å få å få sånn for å få beste rettighetene og viss ikkje du gjer det,17039.1,17068.7,29.600000000002183,2010-05-27,2010-05-27_proceedings.txt
stortinget-20100527-095539_2m_17068700_17097000,så skal de miste disse rettighetene er det dett denne linjen frp nå skal legge til grunn for sin politikk det er det ene det andre med en gang jeg spurte er det sånn at en kvinne burka klett kvinne som blir påkjørt av en buss ikke skal få eee ambulansehjelp så unntar representanten per olly amundsen akkurat dette nei hun skal få det ja vel hvem er det som ikke skal få offentlige tjenester er det kvinnen,så skal de miste visserettigheten er det det denne linjen frp nå skal legge til grunn for sin politi der det er det andre men gong er spurte er det sånn at ein kvinne burkar kledt kvinner som blir påkøyrt av ein buss ikkje skal få eee a ambulansehjelp så unntarrepresentanten per ole amundsen akkurat dette nei ho skal få det ja vil vem er det som ikkje skal få offentlege hense er kvinner,17068.7,17097.0,28.299999999999272,2010-05-27,2010-05-27_proceedings.txt
stortinget-20100527-095539_2m_17097000_17123100,som eee trenger en bistand advart er det hun ikke skal få det er det kvinnen som eee eee som blir utsatt for en overgreps ikke skal få politihjelp jeg håper nå at de frps representanter nå forsvarer dette forteller oss hva dette betyr så er det de alene og det andre er president at vi spør eller de sier at vi ikke har noe løsninger klarte,som trenger en bistand s ada eller ho nike skal håbe er det kvinner som eee eee som blir utsett for ein overgrep ikkje skal for politiet jeg håper no at vi fot frps representanter no forsvarar dette forpelros kva dette betyr så er det det det eine og det andre er president at vi spør eller dei seier at vi ikkje har noko løysningar klart,17097.0,17123.1,26.099999999998545,2010-05-27,2010-05-27_proceedings.txt
stortinget-20100527-095539_2m_17123100_17150500,se bare på den lille biten som vi var innom barnehagen både de jentene småjenter som går inn på disse barnehagene blir opplært til å bli selvstendige individer når de en dag blir voksne og de mødre som får mulighet til å få bruke de denne frigjorte tiden til å ta arbeid ne og eee og bli økonomisk selvstendige dette er løsningen se på de jentene som nå har niversitetene,ser berre på den lille viten som vi var innom barnehagen både dei gjentene småjenter som går inn på desse barnehagane blir opple til å bli sjølvstendige individ når i en dag bli vaksne og dei mødre som får mulighet til å få bruke de denne friere tiden til å ta arbeid ne og eee å bli økonomisk sjølvstendige dette er løysinga ser på dei jentene som no harniversitetan,17123.1,17150.5,27.400000000001455,2010-05-27,2010-05-27_proceedings.txt
stortinget-20100527-095539_2m_17150500_17177100,når de går frem som advokater som forretningskvinner de er de beste eee rollemodellene for jenter som kommer etter dem eee og vil eee virke sånn qqq som kvi kvinnefrigjørende så eee er det president representanten eee hagesete var for parimål,når dei går fram som advokatar som forretningskvinne dei er dei beste eee rålemodellen for gjenter som kommer etter dei og vil verke som qqq som kin kvinnetreendeså eee ei det president representanten eee hagsete var for på hærimål,17150.5,17177.1,26.599999999998545,2010-05-27,2010-05-27_proceedings.txt
stortinget-20100527-095539_2m_17177100_17205500,fra eee fra en annen representant at ja fra fra eee jan tore sanner at når han ser en kvinne bruk av klett kvinne som tar trikken så er det en utvikling han ikke liker ja hvilken del av utlik utviklingen er det hun ikke liker det at at kvinnen tar trikken leverer barnegruppungen sin til barnehage eller at hun tar trikken på vei til russnof for å ta språkopplæringen eller at hun er på vei til eee til en eee,frå eee frå ein andre representant at ja frå frå jan tolesani at når han ser ein kvinne brukarkleddt kvinner som tar trikken så er det ein utvikling han ikkje liker ja kva del av utvik utviklinga er denikeliker det er at at kvinnene tar trikken leverer barne grudommen sin til barnehage eller at hen tar trikken på veg til losna for å ta språkopplæringa eller at hun er på veg til eee til ein eee,17177.1,17205.5,28.400000000001455,2010-05-27,2010-05-27_proceedings.txt
stortinget-20100527-095539_2m_17205500_17233400,eee et et lamp universitet hva hvilken utvikling er det representanten ha hageseter ikke liker nå ønsker vi å få svar på disse spørsmålene og det ene spørsmålet som eee er fortsatt ligger igjen hvordan mener de at burka fremmer integrasjon og frigjør kvinner fra undertrykkelseda er neste taler perwilly amundsen eee representanten amundsen har hatt ordet to ger og får da ordet,eee eit eit eller at universitet var vaken mike klinga representanten ha hagset vikke ligger nå ønsker vi å få svar på desse spørsmå og det eine spørsmålet som fortsatt ligg igjen vore meiner dei at bulka fremmer integrasjon og frigjer kvinner frå undertykelseda er neste talar per willy amundsen eee representanten amundsen har han hatt ordet to gger og får da ordet,17205.5,17233.4,27.900000000001455,2010-05-27,2010-05-27_proceedings.txt
stortinget-20100527-095539_2m_17233400_17262000,til en kort merknad begrenset til ett minutt amundsen ærede president til det siste jeg trur vi har gjentatt flere ganger forbudet mot burka nikab vil hjelpe fordi at det forsvinner fra det offentlige rom og man vil klar sende klare signaler det samme i forhold til eee rett til offentlige ytelser og lignende selvfølgelig skal liv og helse gå foran men man må ikke forvente at hvis man søker sosialhjelp eee på i kommunen,til ein kort merknad begrense til eitt minutt amundsen er det president til det siste eg trur vi har gjentatt fleire gonger forbodet mot burka nikab vil hjelpe fordi at det forsvinn frå det offentlege rom og ein vil kla sine klare tinga og det same i forhold til eee rett til opentleg ytelesaulingane selvfølgelig skal liv og helse går foran men ein må ikkje forvente at viss ein søker sosialhjelp eee på eit i i kommunen,17233.4,17262.0,28.599999999998545,2010-05-27,2010-05-27_proceedings.txt
stortinget-20100527-095539_2m_17262000_17290300,at man får det dersom man eee bærene bruker eller nikab men så president det er dette dreier seg om det er heilt fundamentale ting det er de helt fundamentale verdiene som kjennetegner vårt samfunn det handler om frihet det handler om eee demokrati det handler om eee likestilling likeverd og av og til så er det sånn at noen av disse verdiene kommer i konflikt med hverandre,at ein får det dersom ein eee ber ein burka eller nikka men så president det er dette dreier seg om det er heilt fundamentale ting det er dei heilt fundamentale verdiane som kjenneteikner vårt samfunn det handlar om frihet det handlar om e demokrati det handlar om eee likestilling like berd og av og til så er det sånn at nokon av desse verdiane kommer i konfliktberd,17262.0,17290.3,28.299999999999272,2010-05-27,2010-05-27_proceedings.txt
stortinget-20100527-095539_2m_17290300_17317600,religionsfrihet som det hevdes her kontra den individuelle friheten alle kvinner skal ha i det norske samfunnet når man møter den type problemstillinger så må man tenke klart det gjør fremskrittspartiet her vi tar parti med de svake kvinnene fremfor mullene eee og de som står for det samme og neste taler er christian tybringegjedde deretter gjeter,relionsfrihet som det hevdast her kontra den individuelle friheten alle kvinner skal ha i det norske samfunnetnår ein møter den type problemstillingar så må ein tenke at det er jo framstegspartiet her vi tar parti med dei svake kvinner framfor mulla eee og dei som står for det talar er kristian tybringegjedde deretter gjeti,17290.3,17317.6,27.299999999999272,2010-05-27,2010-05-27_proceedings.txt
stortinget-20100527-095539_2m_17322800_17348500,tybringgjedde har en taletid på inntil tre minutter tybringgjedde vær så god president jeg skal faktisk ikke bruke tre minutter og jeg tenkte bare skulle si at forbud mot nikab og byrka kommer til å komme i hele europa og du kommer til å komme til norge også ikke i dag ikke de med denne dette stortingsflertallet men enkelte av disse partiene kommer til å få andre mening og jeg er helt overbevist om at arbeiderpartiet selv om de later som måde argumenterer voldsomt mot et forbud,tybring eda har ein badetid på en til tre minutter tybring en så godpresident eg skal faktis ikkje bruke tre minutter og eg tenkte ver eg skulle si at forbodet mot nikab og burka har kommer til å kome i heile europa og det kommer til å kome til noreg også ikkje i dag ikkje nemne denne dette stortingsfleirtalet men enkelt av desse partia kommer til å forandre meining og eg er heilt ovevist om at arbeidarpartiet sidan dei latre måte argumenterer valdsamt eee mot eit forbod,17322.8,17348.5,25.700000000000728,2010-05-27,2010-05-27_proceedings.txt
stortinget-20100527-095539_2m_17348500_17378400,vil være for et forbud den dagen eu kommer til å vedta et forbud mot nikab og bruke i det offentlige rom jeg kan garantere at det kommer til å skje man ser utviklingen i europa de ser tendensen i andre land før de kommer til norge de ser hvilke undertrykkende symboler og effekter nikaburka har og de kommer til å vedta et forbud og kritikken kommer ikke til å vær at de er for lite liberalistiske eller kommer til den type påstander det kommer til å skje for å bevare de frihetene vi står for,vil vere for eit forbod den dagen eu kommer til å vedta eit forbod mot nik av og burka i offentleg rom eg kan garantere at det kommer til å skje han ser utviklinga i europa vi ser tendensen i andre land frå du kommer til noreg vi ser ke undertrykkende symboli og effektar ni kva burka har og dei kommer til å vedta eit forbod og kritikken kommer ketil å vere at det er for lite liberalistisk eller kome til den type påstander det kommer til å skje for å bevare dei friheten vi står for,17348.5,17378.4,29.900000000001455,2010-05-27,2010-05-27_proceedings.txt
stortinget-20100527-095539_2m_17378400_17407200,det kommer til å skje for at vi ønsker å ha bevare en sekulær rettsstat et demokrati ønsker bare likeverd likestilling ytringsfrihet religionsfrihet akkurat de verdiene hele vårt samfunn er tuftet på nemlig toleranse derfor kommer et forbud og det er altså ikke brudd på liberalismen som kolberg sier liberalismen er helt tydelig den de som kolberg ikke har studert liberalisme det er kanskje ikke overaskende de ikke har studert liberalismen men min frihet slutter der din begynner det er liberalismen,det kommer til å skje på at dei ønsker å ha bevare ein sekulær rettsstat demokrati den skulle vere likeverd likestilling ytringsfrihet regions frihet akkurat dei verdiane heile vårt samfunn er tuftet på nemleg toleranse derfor komme det eit forbod og det er altså ikkje brudd på liberalismen som corbei sider liberalismen er har tydeleg den det som korger ikkje har studert liberalismen er kanskje er overraskande kkje har studert liberalismen men min tre sluttar den dyne det er liberalismen,17378.4,17407.2,28.799999999999272,2010-05-27,2010-05-27_proceedings.txt
stortinget-20100527-095539_2m_17407200_17437200,og vi oppdager at det er diskriminering av kvinner i norge i dag som vi tillater fordi at vi sier at det er slags bakmenn og det er deres ektemenn som er bakmennene her vi vet hvem det er men storberg og andre sier at vi skal gjøre noe med det men vet ikke hva hva så gjør noe med det da for det blir flere og flere hver eneste dag i likestillingens navn kritiserer gjerne fremskrittspartiet for ikke å være for likestilling men gjør noe med det at de som mener at de er for likestilling og tro at de kan heve seg over andre,og vi oppteke at det er diskriminering av kvinner i noreg i dag som vi tillater fordi at vi ser at ei slags bakmenn og der det er ektemenn som er bakmennene her vi veit ven det er men storberget og andre seier at vi skal gjere no med det me veit i kva kva var så gjer no me det da og det blir fleire og fleire eineste dag i likestillingas namn kritiser gjerne framstegspartiet for ike ver får ei likestilling men gjer no med det at dei som meiner at dei er for likestilling og trur at vi kan hevsa over andre,17407.2,17437.2,30.0,2010-05-27,2010-05-27_proceedings.txt
