file,text_bm,text_nn,start,end,duration,date,proceedingsfile
stortinget-20100527-095539_2m_3800_6200,takk,,3.8,6.2,2.4000000000000004,2010-05-27,2010-05-27_proceedings.txt
stortinget-20100527-095539_2m_36600_40600,takk,,36.6,40.6,4.0,2010-05-27,2010-05-27_proceedings.txt
stortinget-20100527-095539_2m_64300_71800,takkkkk,,64.3,71.8,7.5,2010-05-27,2010-05-27_proceedings.txt
stortinget-20100527-095539_2m_134600_136800,,,134.6,136.8,2.200000000000017,2010-05-27,2010-05-27_proceedings.txt
stortinget-20100527-095539_2m_145100_147500,,,145.1,147.5,2.4000000000000057,2010-05-27,2010-05-27_proceedings.txt
stortinget-20100527-095539_2m_169200_174400,takk takk takk,,169.2,174.4,5.200000000000017,2010-05-27,2010-05-27_proceedings.txt
stortinget-20100527-095539_2m_194000_197200,,,194.0,197.2,3.1999999999999886,2010-05-27,2010-05-27_proceedings.txt
stortinget-20100527-095539_2m_237900_240300,dekke taland meseguer,presidenten arland ensasesong,237.9,240.3,2.4000000000000057,2010-05-27,2010-05-27_proceedings.txt
stortinget-20100527-095539_2m_243700_247300,også er kunde nå viser det høreapparat,tueneset statsråd i banka,243.7,247.3,3.6000000000000227,2010-05-27,2010-05-27_proceedings.txt
stortinget-20100527-095539_2m_266700_294100,stortingets møte er lovlig satt det foreligger tre permisjonssøknader fra fremskrittspartiets stortingsgruppe om sykepermisjon for representanten karin s woldseth fra og med tjuesjuende mai og inntil videre fra arbeiderpartiets stortingsgruppe om sykepermisjon fra representanten tore hagebakken fra og med tjuesjuende mai og inntil videre og fra representanten dakin høybråten om permisjon torsdag tjuesjuende mai for å delta i med russiske og nordiske,stortingets møte er lovlig satt det foreligger tre permisjonssøknader frå framstegspartiet stortingsgruppe om sykepermisjon for representanten karin es valseth frå å med tjuesjuande mai og inntil vidare frå arbeidarpartiets stortingsgrupp om sjukepermisjon frå representanten tore hagebakken frå og med tjuesjuande mai og inntil vidare og frå representanten dag sin høgre open om permisjonen torsdag tjuesjuande mai for å delta i emed rusiske og nordiske,266.7,294.1,27.400000000000034,2010-05-27,2010-05-27_proceedings.txt
stortinget-20100527-095539_2m_294100_317700,parlamentarikere i regi av nordisk råd i bergen disse søknadene foreslås behandlet straks og innvilget det anses vedtatt følgende vararepresentanten bør foreslås innvalgt å møte i permisjonstiden for hordaland fylke torkil omland for oppland fylke espen grahrberg johnsen for rogaland fylke kjell arvid svensen det anses også vedtatt,parlamentarikarar i regi av nordisk råd i bergen siste støken foreslås behandlet straks og innvilget det anses vedtattfølgende varerepresentanten ber foreslås innvalde å møte i permisjonstiden for hordaland fylke turki omland for oppland fylke espen grad berg jonsen for rogaland fylke kjell arvid svensen det anses også retta,294.1,317.7,23.599999999999966,2010-05-27,2010-05-27_proceedings.txt
stortinget-20100527-095539_2m_317700_336400,torcer omland eee espen granberg johnsen og kjell arvid svensen er til stede og vil ta seterepresentanten morten hauglund vil fremsette to representantforslag morten hauglund,purke omland eee espen granberg jonsen og kjell arvid svensen eir tilstede og vil ta senterrepresentanten moten hauglund vil fremsette to representantforslag morten hauglund,317.7,336.4,18.69999999999999,2010-05-27,2010-05-27_proceedings.txt
stortinget-20100527-095539_2m_340300_361100,president på vegne av representanten jan arild ellingsen og meg selv vil jeg fremme to representantforslag ett om norsk budsjettstrategi for bistand til fn og ett om krav til antikorrupsjon og åpenhet i bistanden forslagene vil bli behandla på reglete,president på vegner av representanten jan arild ellingsen og meg selv vil eg fremme to representantforslag eitt om norsk budsjettstrategi for bistand til fn og eitt om krav til antikorrupsjon og openheit i bistandenforslaga vil bli behandla på reglete,340.3,361.1,20.80000000000001,2010-05-27,2010-05-27_proceedings.txt
stortinget-20100527-095539_2m_361100_390900,til behandling foreligger de saker som er oppført på dagsorden nummer åttitre før sakene på dagens kart tas opp eee til behandling vil presidenten foreslå at stortinget fraviker bestemmelsen i forretningsordens paragraf eee førtitre første ledd og foretar votering etter sakene en til fire på dagens kart er ferdigbehandla og deretter samlet votering etter sakene fem til ni ved slutten av dagens møte inn eee ingen innvendinger kommet mot presidentens forslag,til behandling foreligger dei saker som er oppført på dagsorden nummer åttitre før sakene på dagens kart tas opp eee til behandling vil presidenten foreslå at stortinget fraviker bestemmelsen i forretningsordens paragraf eee førtitre først i ledd og foretar voteringar til sakene ein til fire på dagens kart er ferdigbehandla og deretter samla voteringar til sakene fem til ni ved slutten av dagens møte inne ingen innvendinger komme mot presidentens forslag,361.1,390.9,29.799999999999955,2010-05-27,2010-05-27_proceedings.txt
stortinget-20100527-095539_2m_390900_414000,det er bra da anses det vedtatt sak en innstilling fra kontroll og konstitusjonskomiteen om grunnlovsforslag fra øystein jupedal ågot valle og roll reklam om endring i grunnlovens paragraf en tre tolv til fjorten seksten til tjueto tjuefem til trettien,det er bra det anses det vedtatt sak ein innstilling frå kontroll og konstitusjonskomiteen om grunnlovsforslag frå ysten jupedal ovot valle og rolf forekom om endring i grunnlovens paragraf ein tre tolv til fjorten seksten til tjueto tjuefem til trettiein,390.9,414.0,23.100000000000023,2010-05-27,2010-05-27_proceedings.txt
stortinget-20100527-095539_2m_414000_442000,sekstito sekstito sekstisju til sekstini sytti fire til åttien åttiseks og hundre og tolv om opphevelse av grunnlovens paragraf fire til ni eee elleve tjuetre tjuefire trettito trettifire trettisju trettini til førtien førtitre til førtiåtte om ny paragraf hundre og tretten om endringen av grunnlovens overskrift innføring av replikantskorm,sekstito sekstito sekstisju til sekstini syttifire til åttiein åttiseks og hundre og tolv om opphevelse av grunnlovens paragraf fire til ni eee elleve tjuetre tjuefire trettito trettifire trettisju trettini til førtiein førtitre til førtiåtte om ny paragraf hundre og tretten om endringa av grunnlovens overskrift innfølgling av repliganske statsråden,414.0,442.0,28.0,2010-05-27,2010-05-27_proceedings.txt
stortinget-20100527-095539_2m_442000_470500,innstilling to hundre og femtito s totusenogni totusenogti jamfør dokument nummer tolv tre totusenogått totusenogsju to tu totusenogåtte første taler er hans olav eee syversen som er sakens ordfører deretter martin kolberg syversenpresident,innstilling to hundre og femtito s totusenogni totusenogti jamfør dokument nummer tolv tre totusenog totusenogsju toto totusenogåtte første talar er hans olav eee syversen som er sakas ordførar deretter er martin kolberg siversenpresident,442.0,470.5,28.5,2010-05-27,2010-05-27_proceedings.txt
stortinget-20100527-095539_2m_470500_497300,ja dette er et forslag som eee stortinget har debattert mange ganger eee det er en eee programforpliktelse tror jeg for sv å fremme forslaget å omgjøre vårt monarki til å bli en republikk og forslaget tror jeg vi kan allerede fastslå vil nok en gang bli,ja dette er eit forslag som stortinget har debattert mange gonger eee det er ein programforplikkelse tru eg for sv å fremme forslaget å omgjere vårt monerki til å bli ein republikk og forslaget trur eg vi kan aldri det fastslå vil nokon gong bli,470.5,497.3,26.80000000000001,2010-05-27,2010-05-27_proceedings.txt
stortinget-20100527-095539_2m_497300_526300,som presidenten refererte i sin innledning så innebærer det jo dersom forslaget skulle bli vedtatt eee det vil innebærer endringer i over femti grunnlovsparagrafer og således så er det ikke å ta munnen for full når en enstemmig komite kan fastslå at forslaget representerer et grunnleggende grunnleggende brudd med den norske,som presidenten refererte i sin innledning så inneber det jo dersom forslaget skulle bli vedtatt eee det inneber endringar i over femti grunnlovsparagrafar og så le det så er det ikkje å ta munnen for full når ein einstemmig komite kan fastslå at forslaget representerer eit grunnleggande grunnleggende brudd med den norske,497.3,526.3,28.999999999999943,2010-05-27,2010-05-27_proceedings.txt
stortinget-20100527-095539_2m_526300_555700,president eee de prinsipielle argumenter som sosialistisk venstreparti anfører for republikk er jeg sikker på at de selv vil redegjøre for for flertallet så står det likevel helt klart at vi mener at den statsskikk og statsform vi i dag har er den beste,statsformapresident eee dei prinsipielle argumenta som sosialistisk venstreparti anfører for republikk eg er sikker på at dei sel vil redegjøre for for fleirtalet så står det likevel heilt klart at vi meiner at den statsskikk og statsform vi dag har er den beste,526.3,555.7,29.40000000000009,2010-05-27,2010-05-27_proceedings.txt
stortinget-20100527-095539_2m_555700_583400,monarkiet har bred oppslutning i det norske folk da vi eee hadde folkeavstemning eee hvorvidt vi skulle fortsette å ha monarki for over hundre år siden så var det cirka syttini prosent som stemte for monarki og tjueen pnt stemte mot,monarkiet har bre oppslutning i det norske folk det vi hadde for avstemming eee vore vik vi skulle fortsette å ha monarki for over hundre år sidan så var det cirka syttini prosent som stemte for monarki og tjueein pnt stemte imot,555.7,583.4,27.699999999999932,2010-05-27,2010-05-27_proceedings.txt
stortinget-20100527-095539_2m_583400_612500,hvis vi ser på den siste meningsmålingen som nrk har tatt opp så sent som i april i år så er det cirka sytti prosent som fortsatt ønsker eee monarki i vårt land det tror jeg president ikke bare er en tilslutning til statsikken som sådan men også en honnør til den måten som eee,viss vi ser på den siste meningsmålinga som nrk har tatt opp så sent som i april i år så er det cirka sytti prosent som fortsatt ønsker eee monarki i vårt land det trur eg president ikkje berre er ein tilslutning til statsskikken som sådan men også ein eee honør til den måten som,583.4,612.5,29.100000000000023,2010-05-27,2010-05-27_proceedings.txt
stortinget-20100527-095539_2m_612500_641600,vår kongefamilie utøver sine verv på så kan man si er det det som skal avgjøre vår holdning i en så vidt viktig prinsipiell sak eee det kan man diskutere og jeg har for så vidt eee sans for noe av det sv fremlegger nemlig at eee det er ikke noe en stilling som bør gå i arv i i,vår kongefamilie utover sine verv på så kan ein så er det det som skal avgjere vår haldning i ein såvidt viktig prinsipiell sak eee det kan ein diskutere og eg har for så vidt eee sans for noko av det sv fremlegge nemleg at eee det er ikkje noko ein stilling som bør gå i arv i i,612.5,641.6,29.100000000000023,2010-05-27,2010-05-27_proceedings.txt
stortinget-20100527-095539_2m_641600_671200,et demokrati som det norske til det skal det også anføres at det er faktisk det norske folk som gjennom en folkeavstemning altså gjennom demokratiske virkemidler har valgt den statsikken vi har og jeg er også glad for at sv sier selv at dersom det skulle komme på tale å endre eee vår statsskikk så skulle det også skje ved en forutgående,eit demokrati som det norske til det skal det også anførast at det er faktisk det norske folk som gjennom ein folkeavstemning altså gjennom demokratiske verkemiddel har valt den statsskikken vi har og jeg er også glad for at sv seier seier at dersom det skulle komme på tale og endre vår statsskikk så skulle det også skje ved ein forutgåande,641.6,671.2,29.600000000000023,2010-05-27,2010-05-27_proceedings.txt
stortinget-20100527-095539_2m_671200_698600,folkavstemning i forbindelse med den målingen som eee jeg refererte til så blir kongen spurt av nrk og det er jo ikke så ofte han svarer på den type spørsmål han blir spurt har norge behov for kongehuset i framtida har norge trengt dendreårene som har gått,fork avstemming i forbindelse med den målinga som eee har refererte til så blir kongen spurt av nrk og det er og så ofte han svarar på den type spørsmål han blir spurt å ha ei noreg behov for konghuset i framtida har noreg trengt dendre åra som har gått,671.2,698.6,27.399999999999977,2010-05-27,2010-05-27_proceedings.txt
stortinget-20100527-095539_2m_698600_728100,spør kong harald tilbake også svarene jeg tror svaret er ja jeg tror det har vært en fordel for norge at det har vært et kongehus de første årene var det definitivt en fordel det jo særlig krisetider at det blir aktuelt nå får vi håpe at norge ikke får noen krisetider men det er i vanskelige tider at folk samler seg om den slags da er det kanskje godt at det er der sier kongen og kronprinsen,spør kong harald tilbake og så svarar han eg trur svaret er ja eg trur det har vore ein fordel for noreg at det har vore eit kongehus dei første åra var det definitivt ein fordel det er jo særleg krisetider at det blir aktuelt no får vi håpe at noreg ikkje får nokon krise tider men det er i vanskelege tider at folk samlar seg om den slags da er det kanskje godt at det er der seier kongen og kronprinsen,698.6,728.1,29.5,2010-05-27,2010-05-27_proceedings.txt
stortinget-20100527-095539_2m_728100_755100,eee bidrar også til eee kloke refleksjoner etter min mening det kan i hvert fall være godt i en tid med mye skifter og en stor informasjonsstrøm fra hele verden og hvor kanskje livet føles litt flyktig for mange så kan det være greit med noe som har kontinuitet og som ligger litt fast sitat slutt jeg tror det egentlig oppsummerer vai,eee bidrar også til eee kloke refleksjonar etter min mening det kan i kvart fall vere godt i ein tid med mykje skifter og ein stor informasjon strøm frå heile verda over kanskje livet føler slik flykt i for mange så kan det vere greit med noko som har kontunitet og som ligg litt fast sitat slutt eg trur det eigentleg oppsummerin vari,728.1,755.1,27.0,2010-05-27,2010-05-27_proceedings.txt
stortinget-20100527-095539_2m_755100_784700,vårt land eee føder eee rundt spørsmålet om monarki og nå har vi jo syttende mai like bak oss og jeg må jo også tilstå at det vil ikke akkurat bli en stor opptur for undertegnede eee å se opp mot slosbadkongen og eventuelt eee hylle en viseutenriksminister eller en visestatsminister,vårt land eee følger eee rundt spørsmålet om monarki og nå har vi jo sett når mei like bak oss og eg må jo også tilstå at det villiket akkurat bli ein stor opptur for underteikne det eee og se opp mot sjåsbarkkongen og eventuelt eee hylle ein vise utanriksminister eller ein visestatsminister,755.1,784.7,29.600000000000023,2010-05-27,2010-05-27_proceedings.txt
stortinget-20100527-095539_2m_784700_809900,slik sv anfører som en mulig et mulig alternativ til eee det eee den statsik vi har i dag mulig det hadde vært hyggelig for erik langstein eller ingrid fisk jeg er ikke så sikker på at det hadde eee vært så mye tilfredsstillelse for mange andre og det president bringer meg hen til det faktum at jeg synes forslaget er svært dårlig fundert,slik sv anfører som ein mulig eit muleg alternativ til eee det eee den statsskikk vi har i dag mulig det hadde vore tydeleg for erik landstein eller ingri fiska er ikkje så sikker på at det hadde vore så mykje tilfredsstillelse for mange andre og det president bringer meg hen til det faktum at eg synest forslaget er svært dårleg fundert,784.7,809.9,25.199999999999932,2010-05-27,2010-05-27_proceedings.txt
stortinget-20100527-095539_2m_809900_839800,hvis man først mener at man skal innføre republikk så hadde jeg og det må jeg være ærlig nok å si forventet et mer gjennomarbeidet forslag og hvis vi skulle ta opp forslaget på alvor president så vedtas det her i dag og norge er i prinsippet en republikk samtidig så sier sv selv i innstillingen at man vil høre folket,viss man først meiner at ein skal innføre i republikk så hadde eg og det må eg vere ærleg nok å si får vente til eit meir gjennomarbeida forslag og viss vi skulle ta forslaget på alvor president så vedtas det her i dag og noreg er i prinsippet ein republikksamtidig så seier sv sel i innstillinga at ein vil høyre folket,809.9,839.8,29.899999999999977,2010-05-27,2010-05-27_proceedings.txt
stortinget-20100527-095539_2m_839800_869300,at det skal være en folkeavstemning som skal avgjøre hvorvidt vi skal bli en republikk eller ikke da president må jo den normale fremgangsmåten være at sv heller foreslår at vi legger fram dette for folket vi får en folkeavstemning skulle den gi et flertall for republikk så ville jo tiden da vært inne for å komme med endringsforslag til over femti paragrafer i,at det skal vere ein folkeavstemming som skal avgjere kor vidt vi skal bli ein republikk eller ikkje det president må jo den normale fremgangsmåten vere at sv heller føreslår at vi legg fram dette for folket vi får ein forkastemning skulle den gi eit fleirtal for republikk så vil jo tida da vore inne for å komme med endringsforslag til over femti paragrafar i,839.8,869.3,29.5,2010-05-27,2010-05-27_proceedings.txt
stortinget-20100527-095539_2m_869300_899200,grunnloven president den jevne nordmann tror jeg ikke tenker prinsipielt hver dag på spørsmålet om vi skal ha republikk eller demokrati og jeg eee tror det blir en personlig refleksjon at monarkiets fremtid i stor grad vil avgjøres av de som innehar det øverste verv i vårt land,grunnlovenpresident den gjevne nordmannen trur eg ikkje tenker prinsipielt kvardag på spørsmålet om vi skal ha republikk eller demokrati og eg eg trur det blir ein personleg refleksjon at monarkiets framtid i stor grad vil avgjerast av dei som innehar det øvste verv i vårt land,869.3,899.2,29.90000000000009,2010-05-27,2010-05-27_proceedings.txt
stortinget-20100527-095539_2m_899200_925800,så rotfestet som monarkiet har vært eee de siste hundre årene og blitt så skyldes det ikke minst på den måten kongehuset har virket i vårt land og det tror jeg fortsatt vil være avgjørende for om det er en solid oppslutning om monarkiet eee i norge president på denne bakgrunn så anbefaler jeg,så rotfeste som monarkiet har vore eee dei siste hundre åra og blitt så skuldast det ikkje minst på den måten konghuset har verka i vårt land og det trur eg fortsatt vil vere avgjerande for om det er ein solid oppslutning om monarkiet eee i noreg president på denne bakgrunnen så anbefalar i ei,899.2,925.8,26.59999999999991,2010-05-27,2010-05-27_proceedings.txt
stortinget-20100527-095539_2m_926200_933100,neste taler er martin eee kolberg deretter det halgeir h langeland,neste talar er martin eee kolberg deretter er det halge ho langelei,926.2,933.1,6.899999999999977,2010-05-27,2010-05-27_proceedings.txt
stortinget-20100527-095539_2m_942200_970600,kolberg president det er selvsagt slik a når stortinget diskuterer norges statsform så er det en svært alvorlig og viktig sak fordi statsformens organisering legger grunnlaget for vårt samfunns funksjonalitet jeg tror det er eee,kolbe president det er sjølvsagt slik at når stortinget diskuterer noregs statsform så er det eine svært alvorleg og viktig sak fordi statsformas organisering ligg grunnlaget for vårt samfunns punksjonaviteteg trur det er eee,942.2,970.6,28.399999999999977,2010-05-27,2010-05-27_proceedings.txt
stortinget-20100527-095539_2m_970600_995700,en realitet at det er veldig få i befolkningen og kanskje får jeg si ingen i det norske storting eee som på prinsipielt grunnlag mener at det er riktig at statsoverhodets tilgang til makt skal komme gjennom arv jeg hører ingen sier det,er ein realitet at det er veldig få i befolkninga og kanskje får eg seie ingen i det norske storting eee som på prinsipielt grunnlag meiner at det er riktig at statsoverhodes tilgang til makt skal kome gjennom arv eg høyrer ingen sier det,970.6,995.7,25.100000000000023,2010-05-27,2010-05-27_proceedings.txt
stortinget-20100527-095539_2m_995700_1024800,eee det det er brei tilslutning til er jo at det er de demokratiske prosessene basert på det vi kaller for hemmelige og frie valg som skal være grunnlaget for maktutøvelsen slik forslagsstilleren sier i sin begrunnelse for sine forslag hele den sosialdemokratiske tenkningen om samfunnsmodellen i norge bygger jo akkurat på det,eee det det er ei brei tilslutning til er jo at det er dei demokratiske prosessane basert på det vi kallar for hemmelege og frie val som skal vere grunnlaget for maktutøvelsen slik forslagsstilaren sir i sin begrunnelse for sine forslag heile den sosialdemokratiske tenkningen om samfunnsmodellen i noreg byggjer jo akkurat på det,995.7,1024.8,29.09999999999991,2010-05-27,2010-05-27_proceedings.txt
stortinget-20100527-095539_2m_1024800_1052700,i norges moderne historie bygger vår kulturelle sosiale og økonomiske utvikling på en demokratisk styreform et godt organisert og levende demokrati er en forutsetning for et stabilt og humanistisk samfunni det historiske perspektiv vet vi at det har vært mye motstand,i noregs moderne historie bygger vår kulturelle sosiale og økonomiske utvikling på ein demokratisk styreform eit godt organisert og levande demokrati er ein forutsetning for eit stabilt og humanistisk samfunni det historiske perspektiv veit vi at det har vore mykje motstand,1024.8,1052.7,27.90000000000009,2010-05-27,2010-05-27_proceedings.txt
stortinget-20100527-095539_2m_1052700_1081500,men i dag kan vi si at alle grunnleggende sett er enige om dette det andre historiske perspektivet er utviklingen av det norske monarkiet monarkiet og et levende representativt folkestyre har utviklet seg sammen til å bli et stabilt styreform i norge og som det nå er stor oppslutning om,men i dag kan vi si at alle grunnleggande sett er einige om dette det andre historiske perspektivet er utviklinga av det norske monarkiet monarkiet og eit levende representativt folkestyre har utviklet seg saman til å bli eit stabilt styreform i noreg og som det no er stor oppslutning om,1052.7,1081.5,28.799999999999955,2010-05-27,2010-05-27_proceedings.txt
stortinget-20100527-095539_2m_1081500_1110000,i folketdenne utviklingen har funnet sted fordi kongen som saksordføreren sa har forvaltet sin makt fornuftig og lojalt viste respekt for stortinget og regjeringens reelle rett til å styre samfunnetpå den annen side har de folkevalgte organene respektert kongemaktens betydning som en stabiliserende faktor,i folkedenne utviklinga har funne stad fordi kongen som saksordføraren sa har forvalta sin vakt fornuftig og loalt visst respekt for stortinget og regjeringas reelle rett til å styre samfunnet på den anna side har dei folkevalde organet respektert kongemaktes betydning som eit stabiliserande faktor,1081.5,1110.0,28.5,2010-05-27,2010-05-27_proceedings.txt
stortinget-20100527-095539_2m_1110000_1139500,med positiv betydning for det norske samfunnetmonarkiet og statsformen er en meget lang historie har et lang historie i norge våre konger er nært knyttet til knyttet opp til hvordan vi omtaler og tenker på norges historie også i vår moderne tid etter unionsoppløsningen nittennullfem,med positiv betydning for det norske samfunnet monarkiet og statsforma er ein meget lang historie har eit lang historie i noreg våre konger er nær knytt til knytte opp til vorda vi omtalar og tenker på noregs historie også i vår moderne tid etter unionsoppløysinga i nittendull fem,1110.0,1139.5,29.5,2010-05-27,2010-05-27_proceedings.txt
stortinget-20100527-095539_2m_1139500_1166100,bekreftet folket gjennom folkeavstemning at det eee at det ønsket at norge fortsatt skulle være et kongedømme vårt valg av konge viste seg å være heldig vi kan ikke omtale norge under andre verdenskrigen uten at kong håkon den syvendes viktige rolle er med arbeiderpa,bekrefte folket gjennom forkastemming at det at det ønske at noreg fortsatt skulle vere eit kongedøme vårt val av konge viser seg å vere heldig vi kan ikkje omtale noreg under andre verdskrigen utan at kong håkondensynes viktige rolle er medarbeidarpar,1139.5,1166.1,26.59999999999991,2010-05-27,2010-05-27_proceedings.txt
stortinget-20100527-095539_2m_1166100_1194900,ble opprettet som følge av at den samme kongen på demokratisk vis ønsket at arbeiderpartiet skulle danne regjering han spilte en viktig rolle vårt kongehus slik som det har vært forvaltet har vært hele folkets kongehus både kong olav og segn senere kong harald har fulgt sin beste far og sin fars fotspor,blei oppretta som følge av at den same kongen på demokratisk vis ønsket at arbeidarpartiet skulle danne regjering har spelte ein viktig rolle vårt kongehus slik som det har vore forvalta har vore heile folkets konghus både kong olav og seine seinare kong harald har fylgt sin beste far og sin fars fotspor,1166.1,1194.9,28.800000000000182,2010-05-27,2010-05-27_proceedings.txt
