file,text_bm,text_nn,start,end,duration,date,proceedingsfile
stortinget-20100527-095539_2m_12152500_12181700,gjennomførte sitt eee forbud mot angrep på mot religioner og livssyn eee så jeg tror jeg skal trur eee statsråden skal være litt forsiktig med å ta alle over land til inntekt for sitt syn men president det er altså qqq qqq det er jo litt merkelig eee den her eee diskusjonen rundt eee artikkel ni i den europeiske menneskerettighetskonvensjonen nå ser man altså at frankrike kanskje kommer til å innføre et forbud,gjennomført sett forbod mot angrep på mot relionar og livssyn eee så eg trur eg skal trur eee statsråden skal vere litt forsiktig med å ta an overgang til inntekt porsusyn men president det er altså de det er jo litt merkeleg eee den her diskusjonen rundt eee eee artikkel ni i europeisk menneskeskovisjon no ser ein altså at frankrike eee kanskje kommer til å innføre eit forbod,12152.5,12181.7,29.200000000000728,2010-05-27,2010-05-27_proceedings.txt
stortinget-20100527-095539_2m_12181700_12208700,eee belgia har allerede gjort det i første gangs behandling skal du behandle for andre gang i senatet hva er det disse landene ikke forstår som lovavdelinga justisdepartementet åpenbart har statsråd storberget ja president det er jo ikke meg gitt å svare på hva andre land måtte legge til grunn når det gjelder menneskerettig forpliktelser men nå brukte altså representanten will perwilly amundsen hele sitt inn innlegg på å beskylde den rødgrønne regjeringen og flertallet for å dekke segtsfanen,eee belgia har allereie gjort det i første gongsbehandling sa no behandla andre gong i senatet kva er det desse lønnene ikkje forstår som lovavdelinga justisdepartementet openbert for sat råd storbergena president det er a meg i til å svare på kva andre land måtte legge til grunn når det gjeld menneskeheita forpliktelse men nå dukta altså representanten wil per ivil amundsen heile side innlegg på å beskylde den raudgrøne regjeringa og fleirtalet for å dekke segtsfonen,12181.7,12208.7,27.0,2010-05-27,2010-05-27_proceedings.txt
stortinget-20100527-095539_2m_12208700_12229200,eee også det første man gjør i replikkordskiftet er å å nettopp trekke fra denne jeg vil jo u eller utfordre perwilly amundsen til å se på hva slags effekt billet forbud faktisk få for de kvinnene som rammes av denne type tvangsmessig atferd og er det riktig at de kvinnene som lever i slike situasjoner at man måtte iklassene vilje,eee og så første ein gjer i replikkordskiftet her å nettopp trekka denne eg ville jo eller utfordre per ville auste å se på kva slags effekt ville eit forbod faktisk få for dei kvinner som rammast av denne type tvangsmessig adferd og er det riktig at dei kvinner som lever i slike situasjonar at ein må i klessa vilje,12208.7,12229.2,20.5,2010-05-27,2010-05-27_proceedings.txt
stortinget-20100527-095539_2m_12229200_12256900,at de faktisk skal miste de offentlige tjenestene som ville kunne hjelpe dem med integrering det er den reelle debatten og da overrasker det meg at fremskrittspartiet sitt første replikk nettopp begynner å å måle eee andre lands oppfatning av menneskerettsligetsstandarder hvis vi virkelig skal få en reell debatt om dette som perwilly amundsen ønsket ja så burde man jo nettopp se på hva slags konsekvens vil det få er i norge hvis vi fratarde kvinnene som måtte bære sånne plagg,at vi faktisk skal miste dei of dei tenestene som ville kunne hjelpe det med integrering der den regel debatten og det overraskar meg at førstepartit sitt første replikk nettopp begynner og å måle eee andre lands oppfatning av menneskehetslegestandar a viss vi verkeleg skal få ein reell debatt om dette som per willy amundsen ønsker ut ja så burde ein jo nettopp se på kva slags konsekvens vil det få her i noreg viss vi fråtardei kvinner som måtte bere sånne plagg,12229.2,12256.9,27.69999999999891,2010-05-27,2010-05-27_proceedings.txt
stortinget-20100527-095539_2m_12256900_12277800,offentlige tjenester det er et viktig spørsmål neste replikant er han andre opterd dal deretter hans tode kel annas mehl president eee høyre og statsråden er enige på prinsipielt grunnlag og høyre bruker i likhet med statsråden ikke mk som er en slags krikke men som et støtteargument for et fellepunkt,offentleg tenester det er eit viktig spørsmålneste replikant er ha andre oppedal der han stod ikkje lanasmyhlpresident eee høgre og statsråden er einige på prinsipielt grunnlag og høgre bruker i likhet med statsråden ikkje nk som ein slags krykke men som eit støtteargument for eit felldpunkt,12256.9,12277.8,20.899999999999636,2010-05-27,2010-05-27_proceedings.txt
stortinget-20100527-095539_2m_12277800_12301800,det her blir jo fort en debatt for mot frp det synes jeg er en ganske uinteressant debatt men det som er interessant å diskutere er jo hva mener statsråden vil være det viktigste å gjøre for å på en effektiv måte hjelpe de kvinnene det her er snakk om uavhengig av standpunktet man har i spørsmålet om forbud eller ikke om burkastatsråd storberget president det er veldig vanskelig å påpeke ett tiltak som er viktigst,det her blir jo gjort ein debatt for og mot frp eg synest eg ein ganske uinteressant debatt men det som er interessant å diskutere er jo kva meiner statsråden vil vere det viktigaste å gjere for på ein effektiv måte å hjelpe dei kvinnene det her er snakk om uavhengig av standpunktet ein har i spørsmål om forbod eller ikkje om burkaen store president det er veldig vanskeleg å påpeike eitt tiltak som er viktigast,12277.8,12301.8,24.0,2010-05-27,2010-05-27_proceedings.txt
stortinget-20100527-095539_2m_12301800_12331400,men jeg mener eee flere av representantene i debatten allerede har pekt på det virkemiddelsettet som vi faktisk har og det det handler om som jeg tror er veldig viktig det er at vi kommer inn veldig tidlig overfor unge jenter og at skolen som fellesskapsarena blir helt avgjørende eee det er jo eee heldigvis slik at det er få tall som vi ser bedre denne type plagg men det betyr jo ikke at vi må hvile det betyr at vi skal være aktive for å forhindre at flere kommer til å være det og jeg tror skolen og skolens tiltak det å sikre at vi har,men eg meiner eee fleire av representantane i debatten allereie peikt på det verkemiddelsettet som vi faktisk har og det det handlar om som eg trur er veldig viktig det er at vi kommer inn veldig tidleg år for unge jenter og at skoen som fellesskapsarena blir heilt avgjerande eee det er jo eee heldigvis slik at de er eit fåtal som vi ser betre denne type plag men det betyr at vi må vile det betyr at vi skal vere aktive for å forhindre at fleire kommer til å bere det og eg trur skolen og skolens tiltak er å sikre at vi har,12301.8,12331.4,29.600000000000364,2010-05-27,2010-05-27_proceedings.txt
stortinget-20100527-095539_2m_12331400_12359200,god deltakelse fra eee familier med minoritetsbakgrunn i norsk og alminnelig skole helt avgjørende jeg tror også at å trekke flere av disse kvinnene inn i arbeidslivet er helt avgjørende ikke bare i forhold til hva slags plagg man bærer men også når det gjelder det generelle integreringsarbeidet og så vil jeg jo s eee sist men ikke minst peke på at det ville være viktig også om man klarer å få opp straffer som er knytta til tvang,god deltagelse frå eee familier med minoritetsbakgrunn i norsk og mindre skole heilt avgjerande eg trur også at å få teke fleire av desse kvinnene inn i arbeidslivet er heilt avgjerande ikkje berre frå til var sagt pragg ein ber inn men også når det gjeld det generelle integreringsarbeidet og så vil eg jo s sist men ikkje minst peike på at det ville vere viktig også om ein klarer å få opp straffeker som er knytt til tvang,12331.4,12359.2,27.80000000000109,2010-05-27,2010-05-27_proceedings.txt
stortinget-20100527-095539_2m_12359200_12388700,som menn utover offer for kvinner er når det gjelder plei klesplag eller annen type virksomheneste replikant hans dyr kjellanasphjerærede president bruk av helleki plagg eee stiller mange eee utfordrende eee problemstillinger nå har vi forstått at statsråden ikke vil være med på et generelt forbud eee i det offentlige rom eee ved bruk av slike av bruk av slike eee plagg,som menn utover og for kvinner er nå gelder pe klesplag eller anna type vismeneste replikant hans lodikjelsmyreide president bruk av heildekte plagg eee stiller mange eee utfordande eee problemstillinga nå har vi forstått at statsråden ikkje vil vere med på eit generelt forbod eee i det offentlige rom eee ver bruka slike eg brukar slike eee plagg så,12359.2,12388.7,29.5,2010-05-27,2010-05-27_proceedings.txt
stortinget-20100527-095539_2m_12388700_12415700,eee problemstillinger alt fra eee sikkerhetsmessige utfordringer eee identifik identifikasjon når man kommer eee til et offentlig kontor og krever sin rett for eksempel eee henting av barn i barnehage spole og så videre mange problemstillinger eee og eee mange eee norske samfunnsinstitusjoner bedrifter og så videre eee trenger å ha enrhetskontroll,eee problemstillinga er alt frå eee sikkerheitsmessige utfordringar identifi identifikasjon når ein kommer eee til eit offentleg kontor og krev sin rett for eksempel eee henting av barn i barnehage skole og så vidare mange problemstillingar eee og eee mange eee norske samfunnsinstitusjonar bedrifter og så vidare eee trenger å ha einerheitskontroll,12388.7,12415.7,27.0,2010-05-27,2010-05-27_proceedings.txt
stortinget-20100527-095539_2m_12415700_12442900,eee når det gjelder å eee å slippe folk inn eee i eee inn i eee bedriften institusjonen blant annet stortinget eee vil eee statsråden mene at eee det vil være greit at for eksempel stortinget eee nekter personer å komme inn eee med heldekkende plagg statsråd storberget president eee når det gjelder alle de sikkerhetstiltak vi har ug for så vidt også,eee når det gjeld å eee å slikke folk inn eee i eee inn i eee bedriften inspilusjonen blant anna stortinget eee vil statsråden meine at eee det vil vere greit at for eksempel stortinget eee nekter personar å kome inn eee med heildekte plaggstatsråd stortinget president eee når det gjeld alle dei sikkerheits tiltak vi har uog for så vidt også,12415.7,12442.9,27.19999999999891,2010-05-27,2010-05-27_proceedings.txt
stortinget-20100527-095539_2m_12442900_12469200,eee regler og eee praksis knytta til at folk får offentlige tjenester eee for eksempel pass kommer innom passkontroll kommer inn i ofte bygninger ja så er det sånn at der må mennesker finne seg i eee og måtte kunne avgi identitet og det er derfor jeg er helt åpen på det at i den grad det blir problemstillinger rundt dette så er vi parat i også se på regler hvis der,eee reglar og eee praksis knytt til at folk får offentleg tenester eee for eksempel pass kommer innom passkontroll kommer inn i ofte bygningar ja så er det sånn at der må menneske finne seg i eee og å kunne avvi identitet og det er derfor er eg heilt open på det at i den grad det blir problemstillinga rundt dette så har vi paratet oss å se på reglar viss dar,12442.9,12469.2,26.30000000000109,2010-05-27,2010-05-27_proceedings.txt
stortinget-20100527-095539_2m_12469200_12495000,men så langt så ser det ikke ut til at dette har ut utgjort ne nevnverdig problem tiden for replikkordskifte synes dermed over over og vi går tilbake til den ordinære talerliste de talere som heretter får ordet har en taletid på inntil tre minutter først martin kolberg deretter jermund hagesæterærede president det er jo slik at eee det er allerede berørt ganske eee godt,men så langt så ser det ikkje ut til at dette har utu utgjort næ nøvendig problemtidan for replikkordskiftet synest dei med over over og vi går tilbake når den her talarliste dei talaren er heiter frode har ein taletid på inntil tre minutter først martin kobe deretter gjermun hageseter president det er jo slik at eee eee det allerede berørt ganske eee godt og det var,12469.2,12495.0,25.799999999999272,2010-05-27,2010-05-27_proceedings.txt
stortinget-20100527-095539_2m_12495000_12523400,var fint å se at fremskrittspartiets parlamentariske leder nå kom inn i salen fordi det gir en en mulighet til å svare på noe som er et tungt prinsipielt spørsmål som har kommet tydelig frem i den debatten allerede fremskrittspartiet tar jo mål av seg til å bli regjeringsparti og mener fremskrittspartiet at det nå skal invitere stortinget til det juridiske prinsipp at hvis ikke folk kler seg sånn,det var fint å se at fremskrittspartiets parlamentariske leiar å komme inn i salen fordi det gir en en mulighet til å svare på noko som er eit tungt prinsipielt spørsmål som har komme tydeleg fram i den debatten allereie framstegspartiet tar måla seg til å bli regjeringsparti og meiner fremskritpartiet at det no skal invitere stortinget til det juridiske prinsipp at viss ikkje folk kler seg som,12495.0,12523.4,28.399999999999636,2010-05-27,2010-05-27_proceedings.txt
stortinget-20100527-095539_2m_12523400_12551900,vi mener de skal klare seg så har de ikke rett til offentlige tjenester altså tenk igjennom det hva det vi egentlig skal bety for rettspraksisen i norge hvis det skal etablere seg og jeg vil faktisk si president dette er et veldig alvorlig spørsmål og fremskrittspartiets ledelse bør i denne sal svare på hvordan de tenker seg at rettspraksisen skal etableres i fremtiden,vi meiner dei skal kle seg så har du ikkje rett til offentlege tenester altså tenk igjennom det kva det eigentleg skal betyde for rettspraksisen i noreg viss det skal etablere seg og eg vil faktisk si president dette er eit veldig alvorleg persme og framstegspartiets ledelse bør i denne sal svare på korleis ei tenker seg at rettspraksisen skal etablerast i framtiden,12523.4,12551.9,28.5,2010-05-27,2010-05-27_proceedings.txt
stortinget-20100527-095539_2m_12551900_12578000,prinsipielt så vil jeg si at eee når det gjelder saken så vil jeg kort si at selvsagt er det slik at det norske arbeiderparti med all sin kraft ønsker å bekjempe all form for kvinneundertrykking hele vår historie har vært preget av det,prinsipielt så vil eg si at eee når det gjeld saka så vil eg kort si at sjelvsagt er det slik at norske arbeidarparti med all sin kraft ønsker å bekjempe au form for kvinnetrykking heile vår historia har vore prega av det,12551.9,12578.0,26.100000000000364,2010-05-27,2010-05-27_proceedings.txt
stortinget-20100527-095539_2m_12578000_12606800,er jo det virkemiddelet som fremskrittspartiet har snakket for akterlig om gjennom mange år og kalt det for statsfeminisme når vi har brukt forskjellige virkemidler for nettopp å sørge for at kvinnene får plass i det norske samfunn jeg tillater meg å si president at jeg er gammel nok til å væ har vært med så lenge at jeg husker trygve brattli tok initiativet til dette i nittensyttito,er jo det verkemiddelet som fremskrittspartiet har snakket for akteleg om gjennom mange år og ka det for statsfeminismenår vi har brukt forskjellige verkemiddel for nettopp å sørge for at kvinner får plass i norske samfunna er tillat meg å seie president at jau gammel nok to ve har vore med så lenge at husketryggog bratteli tok initiativet til dette i nittensyttito,12578.0,12606.8,28.799999999999272,2010-05-27,2010-05-27_proceedings.txt
stortinget-20100527-095539_2m_12606800_12635300,gjennom å bruke samfunnets forskjellige virkemidler for virkelig økonomisk og sosialt å skape likestilling og på den måten sørge for at kvinnene ikke blir undertrykket og det er denne måten skritt for skritt i den sosialdemokratiske sfære at det faktisk har ført til at det norske samfunnet har blitt et av de mest likestilte i i i i i verden og all form for undertrykking er ikke lenger stuereint,gjennom å bruke samfunnets forskjellige verkemiddel for verkeleg økonomisk og sosialt å skape likestilling og på den måten svørger for at kvinner ikkje ber under trykket og der denne måten skritt for skritt i den sosialdemokratiske sverre at det faktisk har ført til at det norske samfunnet har blitt eit av dei mest likestilte eee i i i i verden og au folk får undertrykking er ikkje lenger stuereint,12606.8,12635.3,28.5,2010-05-27,2010-05-27_proceedings.txt
stortinget-20100527-095539_2m_12635300_12663900,det norske arbeiderpartiet har stått i spissen for undertrykking også innenfor vår egen kirke på mange måter nettopp å ta den kulturelle kampen men fremskrittspartiet er alltid skygga unna den og da gjenstår til slutt president det som jo eee er blitt sagt litt for forsiktig synes jeg derfor så sier jeg det direkte dette tror jeg fremskrittspartiet gjør som et ledd i sin utrettelige kamp,det norske arbeidarpartiet har stått i spissen for undertrykking også innanfor vår eigen fylke på mange måtar nettopp å ta den kulturelle kampen men framstegspartiet har autid skygge under den og det gjenstår til slutt president det som jo eee er blir sagt litt for forsiktig synest eg derfor så seier eg til direkte dette trur eg fremstegspartiet gjer som eit ledd i sin utrettelege kamp,12635.3,12663.9,28.600000000000364,2010-05-27,2010-05-27_proceedings.txt
stortinget-20100527-095539_2m_12663900_12684700,for å plassere innvandrerbefolkningen i et på et annet sted enn vi for øvrig ønsker at vi skal væreneste taler er jermund hageseter deretter gina knutsen barstad president vil minne om at fremskrittspartiets forslag ennå,for å plassere innvandrarbefolkninga i på eit anna stad enn vi for øvrig ønsker at vi skal vereneste talar er jermund hagesete deretter gina knutsen barstad president minne om at framstegspartiets forslag enn,12663.9,12684.7,20.80000000000109,2010-05-27,2010-05-27_proceedings.txt
stortinget-20100527-095539_2m_12688600_12718000,ærede president nikab og burka og andre heldekkende plagg har ingenting i det norske samfunnet å gjøre og det må vi være tydelige på å si i frå til de som kommer til norge at det aksepterer vi ikke og samme måten som nordmenn som flytter til andre land også må respektere normer og kulturer i de landene man har flytta til så må vi også kreve,her er det president nikab og burka og andre heldekkande plagg har ingen ting i det norske samfunnet å gjera og det må vi vera tydelege på og seie i frå til dei som kommer til noreg at det aksepterer vi ikkje og same måten som nordmenn som flyttar til andre land også må respektera normer og kulturar i dei landa me har flytta til så må vi også krevja,12688.6,12718.0,29.399999999999636,2010-05-27,2010-05-27_proceedings.txt
stortinget-20100527-095539_2m_12718000_12748000,visse ting i fra utlendinger som flytter til norge og det er blant annet et heldekkende plass er det altså ikke rom for i norgenå har jeg nettopp vært i midtøsten eee for en to måneders tid tiden for med forsvarets høyskole og jeg må bare si at jeg synes det var trist og jeg synes det var leit å sjå på unge jenter i hvert fall på høyden som gikk med heldekkende plagg og kunne slå fram til et helt liv,visse ting ifrå utlendingar som flyttar til noreg og det er blant anna eit heildekkande plass er det altså ikkje rom på i noregno har ein nettopp vått i midtausten eee på ein to månads tidstidan for med forsvarets høgskule og eg må berre seia at eg synest det var trist og eg synest det var leitt å sjå på unge gjenter kvart fall på høgden som gjekk med heildekkande plagg og kunne sjå fram til eit heilt liv,12718.0,12748.0,30.0,2010-05-27,2010-05-27_proceedings.txt
stortinget-20100527-095539_2m_12748000_12775100,uten identitet og bak heildekkende plagg resten av livet sitt slik vil vi ikke ha det i norge og eee jeg fikk også kjøpt med meg en nikab og hvis presidenten er redd for at jeg tar den på med på talerstolen så skal jeg ikke gjøre det eee av respekt for eidsvoldsmennene men det er det altså det er et slikt ploggsom dette her som også flertalskal være tillatt,utan identitet og bak heildekkande plagg resten av livet sitt slik vil vi ikkje ha det i noreg og eee eg fekk også kjøp med meg ein nikkop og viss presidenten er redd for at eg tar den kome på tallerstolen så skal eg ikkje gjera det eee av respekt for eidsvoldsmannen men det er det altså det er eit slikt plagg som dette her som også fleirtakal vera tillagt,12748.0,12775.1,27.100000000000364,2010-05-27,2010-05-27_proceedings.txt
stortinget-20100527-095539_2m_12775100_12805000,å gå rundt med i det offentlige rom og jeg vil invitere samtlige her til å komme til meg etterpå så kan vi gå ut i vandrehallen og så kan de ta på seg dette her samtlige kvinner og da er jeg helt sikker på at det er ingen som tror at noen kvinner tar på seg dette her og går med et sånt plagg rundt frivillig enten er man gjerne vaske enten som man påvirker eller så vil man påvirke om omgivelsene,og gå rundt med i det offentlege rommet og eg vil invitera samtlige her til å komma til meg etterpå så kom me går ut i vandrehallen og så kan eg ta på seg dette her samtlige kvinner og då er eg heilt sikker på at det er ingen som trur at nokon kvinner tar på seg dette her og går med eit sånt plagg rundt frivillig enten er en gjernevaska enten som ein påverkar eller så er ein påverka av romgjivelsene,12775.1,12805.0,29.899999999999636,2010-05-27,2010-05-27_proceedings.txt
stortinget-20100527-095539_2m_12805000_12834400,for å gå med noe sånt ingen gjør dette her frivillig en annen utfordring med nikab burka og heldekkende plagg er selvfølgelig det at man kan ikke sjå identiteten man kan ikke vite om det er en undertrykt kvinne som har gode hensikter som du møter på karl johan eller om det er for eksempel en mann som har onde hensikter kriminelle hensikter vinningsforbrytelser terrorisme,for å gå med noko sånt ingen gjer dette her frivillig ein annan utfordring med nikab burka og heildekkande plagg er selvfølgeleg det at ein kan ikkje sjå identiteten men kan ikkje vita om det er ein undertrykt kvinne som har gode hensikter som du møter på kar johann eller om det for eksempel er ein mann som har undhensikte kriminelle hensikter vinningsforbrytelser terrorisme,12805.0,12834.4,29.399999999999636,2010-05-27,2010-05-27_proceedings.txt
stortinget-20100527-095539_2m_12834400_12863000,attentat og den type ting og tanker i hodet sitt det skaper en utfordring for det norske samfunnet det skaper en sikkerhetstrussel og derfor så håper jeg det og hadde ønskt at stortinget hadde altså vedtatt et forbud for at dette er altså noe som ikke høyrer heima i det norske samfunnet og det må vi være tydelige på og det må vi sette ned foten for,atentat og den type ting og tankar i hode sitt det skapar ein utfordring for det norske samfunnet det skapar ein sikkerheits trussell og derfor så ropar eg det og hadde ønskt at stortinget hadde altså vedtatt eit forbod for at dette er altså noko som ikkje høyrer heime i det norske samfunnet og det må vi vera tydeleg på og det må vi setta ned foten på,12834.4,12863.0,28.600000000000364,2010-05-27,2010-05-27_proceedings.txt
stortinget-20100527-095539_2m_12863000_12891100,de som kommer til norge må respektere enkelte mist minste normer og de å undertrykke kvinner og de å tillate heldekkende plagg det kan vi ikke akseptereneste taler er gina geir knutsen barstad deretter håkon haugli president eee jeg synes det kanskje at det vil være på sin plass å minne forrige taler om hans parti sin eee posisjon i prostitusjonsdebatten,dei som kommer til noreg må respektera enkelte mis minste norme og dei å undertrykka kvinner og dei å tillate heildekkande plagg det kan vi ikkje aksepteraneste talar er gina knutsen barstad deretter håkan hauglipresident eeeg synest kanskje at det vil vere på sin plass å minne fordi talar om hans parti sin posisjon i prostitusjonsdebatten,12863.0,12891.1,28.100000000000364,2010-05-27,2010-05-27_proceedings.txt
stortinget-20100527-095539_2m_12891100_12914400,der både frp har holdt fram at kvinner kan velge å være prostituerte så er jeg for øvrig enig med med representanten i at valg og frivillighet alltid skjer så enkelt men forskjellen på oss og dere er at vi vil straffe de som undertrykker kvinner og ikke de som blir undertrykt president fremskrittspartiet trekker gjerne fram et glansbilde av likestillingsnage når de skal svette befolk minoritetsbefolkningen,der bør frp har holdt fram at kvinner kan velje å vere prostituerte så er eg forøvrig einig med med representanten i at val og frivillighet alltid skje er så enkelt men forskjellen på oss og dokker er at vi vil straffe dei som undertrykker kvinner og ikkje dei som blir undertrykt president framstegspartiet trekker gjerne fram eit glanspeldav likestillingsnordiget når dei skal sverte befolkn minoritetsbefolkninga,12891.1,12914.4,23.299999999999272,2010-05-27,2010-05-27_proceedings.txt
stortinget-20100527-095539_2m_12914400_12941100,representanten amundsen argumenterer med religionsfriheten og bruker nøyaktig de samme konvensjonene som fremskrittspartiet tidligere i år brukte da de ville at trossamfunn eee sk ikke skulle være unntatt norsk likestillingslov og norsk arbeidsmiljølov da argumenterte frp for at det var viktig at trossamfunnet kunne bryte norsk likestillingslov og jeg mener at eee det viser at fremskrittspartiet kun er opptatt av likestilling når de kan bruketeter,representanten amundsen argumenterer med religionsfriheten og bruka nøyakt i dei same konvensjonane som framstegspartiet tidlegare i år brukte det dei ville at trosamfunn eee s ikkje skulle vere unntatt norsk likestillingslov og norsk arbeidsmiljølov da argumenterte frp for at det var viktig at trosamfunn kunne bryte norsk likestillingslov og eg meiner at eee det viser at framstegspartiet kun er opptatt av likstilling når dei kan bruktetar,12914.4,12941.1,26.700000000000728,2010-05-27,2010-05-27_proceedings.txt
