file,text_bm,text_nn,start,end,duration,date,proceedingsfile
stortinget-20100611-095544_2m_6406800_6434400,alle her er enige om at det er viktig å styrke presesfunksjonen president men helt fra denne diskusjonen startet så var premissene for kirken som brakte dette på bane at det måtte samlokaliseres med den øvrige kirkeadministrasjonen fordi hvis en ikke gjorde det så vil en opprettholde det som er hovedutfordringen med dagens presisordning nemlig at en må reise til oslo flere ganger i uka for å klare å jobbe ut de administrative oppgavene sisfunksjon er tillagt,alle her er einige om at det er viktig å styrke presesfunksjonen president men helt frå denne diskusjonen starta så var premissen frå kirken som bratte dette på bane at det måtte samlokaliserast med den øvrige kirke administrasjonen fordi viss ein ikkje gjorde det så ville ein opprettholde det som er hovudutfordringa med dagens presisordning nemleg at ein må reise til oslo fleire gonger i uka for å klare å jobbe ut dei administrative oppgåvene sisfunksjon er tillagt,6406.8,6434.4,27.599999999999454,2010-06-11,2010-06-11_proceedings.txt
stortinget-20100611-095544_2m_6434400_6462600,dette er ikke noe symbolfunksjon dette er ikke noe gallionsfigur som skal sitte i trondheim og skue utover dette er en mann som bli eller en dame som blir tillagt et administrativt ansvar for den norske kirke på vegne og sammen med de øvrige biskopene det er krevende oppgaver ikke symbolikk jeg var en av de som hadde gleden president av å delta i stat kirkeforhandlingene og tilbrakte mange nattetimer med å bekymre meg for oppfølgingen og derfor blir jeg litt provosert,dette er ikke nok symbolfunksjon det er tekne og gallionsfigur som skal sitte i trondheim og sku utover dette er ein mann som bli eller ein dame som blir tillagt eit administrativt ansvar for det norske kyrket på vegner og saman med dei øvrige biskopa det krevde oppgåver ikkje symbolikk eg var ein av dei som hadde gleda president av å delta i statskirkeforhandlingane og tilbragte mange nattetimar ned å bekymre meg for oppfølgingen og derfor blir det litt provosert,6434.4,6462.6,28.200000000000728,2010-06-11,2010-06-11_proceedings.txt
stortinget-20100611-095544_2m_6462600_6490800,når statsråden fra stortingets talerstol sier at dette er i tråd med kirkeforliket og det er i tråd med kirkeforliket sånn og det var et stort og bredt forlik som alle var enige om men i oppfølgingen av dette så har man ikke engang tatt seg bryet med å initiere samtaler med de øvrige partene som ikke er en del av regjeringen jeg synes egentlig det i seg selv president er en altfor dårlig oppfølging av et kirkeforlik her kunne vi satt oss ned og funnet gode løsninger på samme måte som vi gjorde i kirkeforliket,når statsråden frå stortingets talestol seier at dette er i tråd med kirkeforliket har vert i tråd med kirkeforlikets sånn og det har vore eit stort og breitt forlik som alle var einige om men i oppfølginga av dette så har ein ikkje ein gong tatt seg bry med å initsiere samtalar med dei øvrige partane som ikkje er ein del av regjeringa a synest eigentleg det i seg selv president er ein altfor dårleg oppfølging av eit skirkeforlik her kunne vi sett oss ned og funne gode løysingar på same måte som vi gjorde i kirke forliket,6462.6,6490.8,28.199999999999818,2010-06-11,2010-06-11_proceedings.txt
stortinget-20100611-095544_2m_6490800_6515800,for dette dreier seg ikke om en lokaliseringsdebatt dette dreier seg ikke om oslo verses trondheim dette dreier seg om vi skal ta kirkeforliket på alvor om vi skal erkjenne at kirken er i stand til å ta avgjørelser på egne vegne og da deler stortinget seg ii i dette helt grunnleggende eee spørsmålet president som er hele utgangspunktet for stat kirkeforliket så deler denne sal seg i og det er v,for dette dreier seg ikkje om ein lokaliseringsdebatt dette dreier sak om oslo verses trondheim dette dreier seg om vi skal ta kirke for liket på alvor om vi skal erkjenne at kirken er i stand til å ta avgjørelser på eigne vegner og da deler stortinget seg to i dette heilt grunnleggande eee spørsmålet president som er heile utgangspunktet for stats sirkeforliket så deler denne sa seg to og det er,6490.8,6515.8,25.0,2010-06-11,2010-06-11_proceedings.txt
stortinget-20100611-095544_2m_6515800_6544600,veldig veldig synd og jeg synes det er bekymringsverdig når sentrale politikere i arbeiderpartiet vi hørte parlamentarisk leder i arbeiderpartiet står fra talerstolen og fremmer dette som om det var et ordinært lokaliseringsspørsmål da har man ikke forstått hva denne debatten dreier seg om president og det er flere representanter fra regjeringspartiene som har holdt taler som egentlig ikke dreier seg om spørsmålet nemlig hvem er det som skal bestemme i den norske kirke ja stortinget og regjering kan gjøre det formelt,veldig veldig syn og eg synest det er bekymringsverdig når sentrale politikar i arbeidarpartiet vi hørte xxx parlamentarisk leder i arbeidarpartiet står frå talarstolen og fremmer dette som om det var eit ordinært lokaliserings spørsmål då har ein ikkje forstått kva denne debatten dreier som president og det er fleire representantar frå regjeringspartia som har holdt talar som eigentleg ikkje reier som spørsmålet nemli kvem er det som skal bestemme i den norske kyrke ja stortinget og regjeringa kan gjere det formelt,6515.8,6544.6,28.800000000000182,2010-06-11,2010-06-11_proceedings.txt
stortinget-20100611-095544_2m_6544600_6563700,men det ødelegger fundamentet for den fremtidige demokratiutvikling som vi alle tidligere har slått sammen omneste taler er kristine nilsen brandtøi deretter svein harberg,men det ødelegger fundamentet for den framtidige demokratiutvikling som vi alle tidlegare har stått saman omneste talar er kristine nilson ramtha deretter svein habet,6544.6,6563.7,19.099999999999454,2010-06-11,2010-06-11_proceedings.txt
stortinget-20100611-095544_2m_6563700_6586200,nilsen raudpresident eee det her er en sak som har skapt et veldig stort engasjement det er ikke så overraskende at det her er en sak som skaper et stort engasjement internt i kirka men det som er veldig gledelig er jo at det her har skapt et så stort engasjement veldig bredt og blant mange medlemmer i den norske kirken,nilsen alfred president eee det her er ein sak som har skapt veldig stort engasjement det er ikkje så overraskande at det her er ein sak som skapar eit stort engasjement internt i kirka men det som er aldri gledeleg er at det her har skapt eit så stort engasjement veldig breitt eee og blant mange medlemmar i dei norske cirket,6563.7,6586.2,22.5,2010-06-11,2010-06-11_proceedings.txt
stortinget-20100611-095544_2m_6586200_6603700,for senterpartiet sier det vært viktig å tatt valg basert på innspill både fra kirka sitt verde organ men ikke minst å lytte til anna stemmer som ikke er representert direkte i kirkemøtet og det her er jo en del av den breie folkekirka som vi har i norge i dag,for senterpartiet så har det vore viktig og tatt valt basert på innspel både frå skjerka sitt verde organ men ikkje minst og lytt til ei anna stemme som ikkje er representert direkte i kirkemøtet og det her er jo ein del av dei breie folkekirka som vi har i noreg i dag,6586.2,6603.7,17.5,2010-06-11,2010-06-11_proceedings.txt
stortinget-20100611-095544_2m_6603700_6625200,mange i debatten her i dag prøver å skape en motsetning mellom ønsket om å ha et styrka demokrati i kirka samtidig som vi har ei statskirke ja president eee flere framstiller det nærmest som vi ikke har ei statskirke i norge i dag og mange henviser til kirkrliket i stortinget,mang i debatten her i dag prøver å skape ein motsetning mellom ønsker om å ha eit styrka demokrati i kirka samtidig som vi har ei statcirke ja president eee fleire framstiller det nærmast som ikkje har i statskirke i noreg i dag og mang henviser til skirkrliket i stortinget,6603.7,6625.2,21.5,2010-06-11,2010-06-11_proceedings.txt
stortinget-20100611-095544_2m_6625200_6652500,da er det vel greit å minne om at det er og en forutsetning om utviklinga i demokratiet i kirka og det her henger jo tett sammen med utviklinga for statskirka vår historisk er trondheim landet sin naturlige kirkehovedstad og senterpartiet har programfesta om at vi ønsker det her sjøl den nasjonalhelligdommen ligger i trondheim med nidarosdommen og mange vil mene at hjertet den norske ki i den her byen,då er det vel greitt å minne om at det er og ein forutsetning om utviklinga i demokratiet i kirka og det her heng jo tett saman med utviklinga for statskirka åres historisk er trondheim løyne si naturlege kirkehovudstad og senterpartiet har programfesta om at vi ønsker det her sjølve nasjonalhelgedommen ligg i trondheim med nidarosdomen og mang vil meine at hjartet i den norske ki den her byen,6625.2,6652.5,27.300000000000182,2010-06-11,2010-06-11_proceedings.txt
stortinget-20100611-095544_2m_6652500_6677900,ei tydelig forankring av ambetet i nidar og stomkirke og arpebisbegårend vil synliggjøre kirka sin tusenår historie i landet og styrker trondheim som et nasjonalt kirkesenter for senterpartiet handler det her om kirkas historie og hvordan vi ønsker å utvikle kirka inn i framtida og vi har så absolutt ikke vært alene om å mene at trondheim,ei tydeleg forankring av embetet i nederostomkirket og erp bispe garn vil synleggjere slika sin tusen år historie i landet og styrke trondheim som eit nasjonalt kirkesenter for senterpartiet handlar det her om skirkase historie og korleis vi ønsker å utvikle skjerka in i framtida og vi har så absolutt ikkje vore å leine om å men a trondheim,6652.5,6677.9,25.399999999999636,2010-06-11,2010-06-11_proceedings.txt
stortinget-20100611-095544_2m_6677900_6707800,den naturlige kirkehovedstaden som flere har vært inne på i debatten det her er det veldig veldig mange som støtter opp om senterpartiet blir beskyldt for at det her handler om distriktspolitikk for oss handler ikke det her om distriktspolitikk er det noen president som har nevnt distriktspolitikk her i salen så er det jo opposisjon for senterpartiet handler det her om å legge grunnlag for å utvikle kjerskad til en sterk samfunnsaktør solid forankra i sin tusenårige historie,er den naturlege skilkehodstaden som fleire har vore inne på i debatten det her er det veldig veldig mange som støttar opp om senterpartiet bil beskyldt for at det her handlar om distriktspolitikk for oss handle det her om distriktspolitikk er det nokon president som har nemnt distriktspolitikk her i salen så er det jo opposisjon for senterpartiet handlar det her om å legge grunnlag for å utvikle kjerskap til ein sterk samfunnsaktør solid forankra i sin tusenårige historie,6677.9,6707.8,29.900000000000546,2010-06-11,2010-06-11_proceedings.txt
stortinget-20100611-095544_2m_6707800_6715000,neste taler er svein harberg forse sakens ordfører deretter akseld hagen,neste talar er svein harberg forsett sakas ordførar deretter aksel hagen,6707.8,6715.0,7.199999999999818,2010-06-11,2010-06-11_proceedings.txt
stortinget-20100611-095544_2m_6718900_6746100,ja president qqq til tider har jo debatten tatt en vending som reint med at noen ville prøve å finne argumenter i sin god omtale av trondheim det er altså ikke det saken eee handler om jeg har sjelden hørt en debatt med så dårlige argumenter på flertallets side som jeg har hørt her jeg må kommentere noen av de tingene som er sagt i sa det første så,hæreid ja president til tider har jo debatten tatt ein vending som reint med at nokon ville prøve å finne argument i sin gode omtala trondheim det er altså ikkje det saka eee handlar om eg har skjelden høyrt ein debatt med så dårlege argument på fleirtalet sider som er avhørt her eg må kommentere nokon av dei tinga som er sagt i sa det første så,6718.9,6746.1,27.200000000000728,2010-06-11,2010-06-11_proceedings.txt
stortinget-20100611-095544_2m_6746100_6775500,så synes jeg det var ærlig og og godt at eee sv flagget sitt primærstandpunkt så må jeg bare få korrigere når representanten fra sv sa at jeg hadde brukt ordene skremmende og mistillit om lokalisering så er det helt feil det gjaldt prosessen om ting valga pesesså til senterpartiets anne tingelstad wøien som ikke kunne forstå at vi syntes det var å overstyre kirken for her skulle det oppnevnes en ny biskop nei det skal ikke det,så synest eg det var ærleg og og godt at sv flagga sitt primærstandpunkt så må eg berre for å korrigere når representanten frå sv sa at eg hadde brukt ord skremmende og mistillit om lokalisering så er det heilt feil det gjeld prosessen omkring val gav presis så til senterpartiets anne tingelstad høyen som ikkje kunne forstå at vi synest det var å overstyre kirken for her skulle jo oppnemnast ein ny biskop nei det skal ikkje det,6746.1,6775.5,29.399999999999636,2010-06-11,2010-06-11_proceedings.txt
stortinget-20100611-095544_2m_6775500_6799600,alle de som skal nomineres her er valgt som biskop fra før kongen i statsrådet har sagt at disse er representative kan være biskop det er prese som skal velges altså tillitsblant valgt biskopene det skal bare flyttes over til et nytt tilsynsområde da må en jo forstå at det blir unaturlig å overprøve det,alle dei som skal nominerast her er vald som biskop fra før kongen i statsrådet har sagt at desse er representative og kan vere biskop det er preses som skal veljast altså tillitsplant valt biskopene det skal bare flyttast over til eit nytt tilsynsområde då må ein jo forstå at det blir unaturleg å overprøve det,6775.5,6799.6,24.100000000000364,2010-06-11,2010-06-11_proceedings.txt
stortinget-20100611-095544_2m_6799600_6827000,statsråden brukte lang tid på det det var enighet om og ble så etter gang gangen når det kom til de vanskelige sakene det var sikkert bra og så at det viktigste nå er at vi får den tolvte biskopen på plass men det er da virkelig viktig hvem som blir det og at dette er en person som kirken sjøl føler kan representere de på den måten som en skal og så sa statsråden også i svar på spørsmålet her og at rt til samarbeid,statsråden brukte lang tid på det det var einigheit om og blei så redd ut gå om gongen når det kom til dei vanskelege sakene det var sikkert bra og sa at det viktigaste no er at vi får den tolte biskopen på plass men det er det verkeleg viktig vem som blir det og at dette er ein person som kirken sjøl føler kan representere dei på den måten som ein skal og så sa statsråden også i svar på spørsmålet her at erte samarbeid,6799.6,6827.0,27.399999999999636,2010-06-11,2010-06-11_proceedings.txt
stortinget-20100611-095544_2m_6827000_6852000,ja sånn som jeg har opplevd som kirkepolitisk talsmann fra høyre så har jeg altså lest i avisene og fulgt med i media på en svær debatt regjeringspartiene landet og så kom saken med sine ferdige konklusjoner ja takk for samarbeidet sier jeg da så er det noen som viser til at der er så stort engasjement og det gjør at en må velge trondheim president,ja sånn som eg har opplevd som kirkepolitisk talsmann for høgre så har eg altså lest i avisen og følgt med i media på ein svær debatt regjeringspartia i landet og så kom saka med sine ferdige konklusjonar ja takk for samarbeidet sier e da så er det nokon som viser til at det er så stort engasjement og det gjer at ein må velje trondheim president,6827.0,6852.0,25.0,2010-06-11,2010-06-11_proceedings.txt
stortinget-20100611-095544_2m_6852000_6881400,kirkemøtet hadde to trelesflertall for en annen lokalisering det er og et stort engasjement som er begrunna i behandlingen rundt om i alle de stedene det skal behandles i kirken jeg har en anbefaling til flere her med ola borten mo i spissen til aktiv delta eee bli aktive deltagere i kyrken og i kirkens demokrati der er det god plass for å påvirke dette framover,kyrkemøtet hadde to tredels fleirtal for ein annan lokalisering det er og eit stort engasjement som er begrunna i behandlinga rundt om i alle dei stadene det skal behandlast i kirken eg har ein anbefaling til fleire her med ola vårt mo i spissen ta aktiv delta bli aktive deltakar i hylke og i kirkas demokrati der er det god plass for å påverke dette framover,6852.0,6881.4,29.399999999999636,2010-06-11,2010-06-11_proceedings.txt
stortinget-20100611-095544_2m_6881400_6898100,denne saken gjelder styrking og rammebetingelser for presis ikke styrking av historietilknytningen til den norske kirkeneste taler er aksel hagen deretter statsråd aasrud,denne saka gjeld styrking og rommbetyngelser for presis ikkje styrking av historietilknytinga til den norske kirkeneste talar er aksel hagen deretter statsråd aasrud,6881.4,6898.1,16.700000000000728,2010-06-11,2010-06-11_proceedings.txt
stortinget-20100611-095544_2m_6901200_6927800,hagen president når torkel omlandet elisabeth aspaker i sine innlegg gjør et stort poeng av å avsløre svs sv sitt primærstandpunkt så blir det litt liksom en stort patos å sprenge i åpen dør all den tid jeg sjøl presenterte jo det i mitt å,hage president når torkel omland elisabeth aspaker sine innlegg gjer ei stor poeng av å avsløre svs sv sitt primær stappunkt så blir det litt liksom med stor patos å sprenge ei open dør av den tida eg sjøl presshandterte jo det i mitt o,6901.2,6927.8,26.600000000000364,2010-06-11,2010-06-11_proceedings.txt
stortinget-20100611-095544_2m_6927800_6952800,det jeg videre sa var at vi burde være litt avdempe i språkbruken vår all den tid vi alle er splittet i denne saken med hensyn til lokalisering der var jeg nok litt for naiv temperaturen i salen har virkelig steget betraktelig det minner meg litt om slik fedrekvotediskusjon som vi hadde tidligere når i viko her da opplevde regjeringa et hardkjør fra høgre og frp mot regjeringa og for høyre,det vidare sa var at vi burde vere litt avdempe i språkbruken vår all den tid vi alle er splitta i denne saka med hensyn til lokalisering der var nok litt for naiv temperaturen i salen har verkeleg stege betraktlig det minn me litt om ei slik fedrekvote diskusjon som vi hadde tidlegare når i vik her da opplevde regjeringa eit haskjør frå høgre og frp mot regjeringa og for høgre,6927.8,6952.8,25.0,2010-06-11,2010-06-11_proceedings.txt
stortinget-20100611-095544_2m_6952800_6981600,sine representanter var det og et halkjøer mot mindretallet sitt eget parti blant annet på landsmøtet inkludere egen partiledelse og den gangen for noen dager sia så undrer meg over at det var mulig å bruke så tøffe hard språkbruk når du vet at det inn i det egne blant annet som du argumenterer mot for en nybyndelse er dette her virkelig litt pussig det er nesten litt imponerende jeg må si det president at den makta å bli så indignert mot til et standpunkt som en vedtatt mange partikamerater,sine representantar var då å talkjøre mot mindretal sitt eige parti blant anna på landsmøte inkludivt ei eigen partiledelse og den gongen for nokon dar sidan så under me over at det var mulig å bruke så tøff og hal språkbruk når du veit at den dei eigne blant anna som du argumenterer imot for nybegynnere er dette her bli litt pussig det er nesten litt imponerande om å si det president at ein maktar å bli så inndiggner mot eit standpunkt så men ved tatt mange partikaratar,6952.8,6981.6,28.800000000000182,2010-06-11,2010-06-11_proceedings.txt
stortinget-20100611-095544_2m_6981600_7010400,rundt omkring i landet har så jeg undrer meg president hvis nå alle de partikamerat til høgre og frp og kristelig folkeparti og venstre nå følge med av oss og er det dem egentlig tenke når de blant annet får beskjed om at de underminerer kirkeforliket med sitt engasjement og at de innehar er at de og bruker sjelden dårlige argumenter for forsøksvis å prøve å sitere saksordfører en gang til,rundt omkring i landet har så eg undrer meg president viss no alle dei partikameratane til høgre og frp og kristeleg folkeparti og venstre nå følger med oss og er om eigentleg tenkje når dei blant anna får beskjed om at ho underminerer kirkeforliket med sitt engasjement og at dei innhar er at dei og bruker skjelde dårlege argumenter for forsøksvis å prøve å sitere saksordfr ein gong til,6981.6,7010.4,28.799999999999272,2010-06-11,2010-06-11_proceedings.txt
stortinget-20100611-095544_2m_7010400_7029700,jeg skulle gjennavære flugge på vegen når døpt møtesatt takk statsråd rigmor aasrud deretter anne tingelstad wøien statsråd ja president eee,eg skulle gjerne vore flygge på veg inn når de møtesatt takk statsråd rigmor aasrud deretter anne tingelstad vøienstatsrådja president eee,7010.4,7029.7,19.300000000000182,2010-06-11,2010-06-11_proceedings.txt
stortinget-20100611-095544_2m_7029700_7057400,jeg syns det er nok en gang grunn til å minne om hva denne saken egentlig dreier seg om det dreier seg også om å opprette en tolvte biskop i det norske kjørke som skal innhold ha viktige funksjoner som i dag det er vanskelig å kombinere med eee jobben som en vanlig biskop det er det denne saken dreier seg om og når jeg har sagt at jeg meiner at det denne saken er i tråd med kirkeforliket så er det nettopp derfor det at gir eee,eg synest det er nok ein gong grunn til å minne om kva denne saka eigentleg reisa det dreier sa som å opprette ein tolte biskop i det norske kyrket som skal innhald ha viktige funksjonar som i dag det er vanskeleg å kombinere med eee jobben som ein vanleg biskop der det denne saka reiser av og no eg har sagt at eg meiner at det denne saka her er i tråd med kyrkeforliket så er det nettopp derfor det at gir eee,7029.7,7057.4,27.699999999999818,2010-06-11,2010-06-11_proceedings.txt
stortinget-20100611-095544_2m_7057400_7074000,bispemøte den avlastninga eee i og med at vi får på plass en tolvte biskop så meiner det faktisk er i tråd med den avtalen som man har inngått så må jeg si at jeg er overraska altså over språkbruken som her her når det blir sagt fra talerstolen i stortinget at vi skal ikke spare,bispemøte den avlastninga eee i og med at vi får på plass ein tote biskop så meiner eg det faktisk er i tråd med den avtalen som ein har inngått som me seier at det er overraskande så var språkbruken som er her når det blir sagt frå talarstolen i stortinget at vi skal ikke spør,7057.4,7074.0,16.600000000000364,2010-06-11,2010-06-11_proceedings.txt
stortinget-20100611-095544_2m_7074000_7100000,e noen som ligger nede så er det ikke den norske kirka jeg møter når jeg er ute jeg møter en vital kirke der det er stor aktivitet folk som har stort engasjement og jeg trur vi skal huske på det også når vi snakker om kjørka framover så har jeg også lyst på å kom kommentere det at vi nå ønsker at det skal eee legges fram valgmuligheter for regjeringa når man skal,ke noko som ligg nede så er det ikkje den norske kilka gjer møter nåreg er ute igjen møter ei vital kyrke der det har stor aktivitet folk som har stort angasjement og eg trur vi skal huske på det også når vi snakkar om kyrka framover så er også lyst på å kom kommentere det at vi nå ønsker at det skal leggast fram valgmuligheter for regjeringa når han skal,7074.0,7100.0,26.0,2010-06-11,2010-06-11_proceedings.txt
stortinget-20100611-095544_2m_7100000_7123300,det høres det framstilles som om dersom eee regjeringa da ikke velger den kandidaten som bispemøtet har pekt på så eee vil man da nærmest eee få en person som ikke kan aksepteres av biskoper der også sånn at biskopen i utgangspunktet skal nominere tre personer jeg vil jo tru at man nominerer tre personer president som man har tillit til,det hørest til fremstiller sum om dersom regjeringa da ikkje velger den kandidaten som bisbemøte har peikt på så vil ein da nærmast få ein person som ikkje kan aksepterest av biskopa der altså sånn at biskopa er utgangspunktet skal nominere tre personar ja vil jo tru at ein nominerer tre personar president som ein har tillit til,7100.0,7123.3,23.300000000000182,2010-06-11,2010-06-11_proceedings.txt
stortinget-20100611-095544_2m_7123300_7147300,debatten har vært spennende eee jeg er helt sikker på at vi gjennom de vedtak som skal gjøres i stortinget i dag vil bidra til å styrke eee den norske kirke som en samfunnsaktør at det vil være viktige innspill i det eee gi viktige innspill i det arbeidet som skal gjøres framover og så vil jeg minne om at vi er midt oppi en demokratiprosess en demokrati,debatten har voret eee spennande eee ja er heilt sikker på at vi gjennom dei vedtak som skal gjerast i stortinget i dag vil bidra til å styrke eee det norske fylket som er ein samfunnsaktør at det vil vera viktig innspel i det eee gi viktig innspel i det arbeidet som skal gjerast framover og så vil eg minne om at vi er midt oppe i ein demokratiprosess ein demokra,7123.3,7147.3,24.0,2010-06-11,2010-06-11_proceedings.txt
stortinget-20100611-095544_2m_7147300_7176900,ti prosess som skal være gjennomført i løpet av totusenogelleve og etter det så vil stortinget få seg forelagt de saker som eee vil gjøre de nødvendige vedtaka og som gjør at mere myndighet overføres til kirkelige organer fram til det president så mener jeg at storting og regjering har en helt legitim eee rett til å kunne gjøre de innstillinger og gjøre de valg vi meiner er riktige neste taler er anne tingstad woien deretter tord lien,tiprosessen skal vera gjennomført i løpet av totusenogelleve og etter det så vil stortinget få seg forelagt ei saka som vil gjera dei nødvendige vedtaka som gjer at meir myndigheit overføres til skirkelege organ fram til det president så meiner eg at stortinget og regjering har ein her leggitimeee rett til å kunna gjera dei innstillingar og gjera det val vi meiner er riktigneste talar er anne tingelstad wøien deretter tord lien,7147.3,7176.9,29.599999999999454,2010-06-11,2010-06-11_proceedings.txt
