file,text_bm,text_nn,start,end,duration,date,proceedingsfile
stortinget-20100303-090601_2m_6850300_6880300,eee carl erik seth pedersen i tillegg til hans arbeid med å administrere regjeringens bilordningstatsminister stoltenberg eee stats president statsråd eee giske har jo selv understrekt at dette er hans eee beslutning eee og eee jeg eee registrerer jo også at eee det jo nå altså har kommet en en en avklaring der eee grumprinsen i samråd med statsråden har kommet til at krumprinsen,eee karl erik sjøh pedersen i tillegg til hans eee arbeid me å amunisere regjeringas biløyningstatsminister stolten ei eee stats president statsråd eee giske haust sel undersøkt dette er hans eee beslutning eee og ja eg registrerer jo også at eee det må altså komme til ein ein ein avklaring der eee kompisen i samråd med statsråden har kome til at devikomprinsen,6850.3,6880.3,30.0,2010-03-03,2010-03-03_proceedings.txt
stortinget-20100303-090601_2m_6880300_6900600,ikke bør sitte i denne gruppen og det er en løsning jeg mener er klok og god da er eee tilleggsspørsmål det blir gitt anledning til to tilleggsspørsmål eee første tilleggsspørsmål fra harald tom nesvik deretter representanten svein flåt,ikkje bør sitte i denne gruppen og det er ein løysing eg meiner klok og godda er eee tilleggsspørsmål det blir gitt anledning til to tilleggsspørsmål eee første tilleggsspørsmålet har tom nesvik deretter representanten svein flot,6880.3,6900.6,20.300000000000182,2010-03-03,2010-03-03_proceedings.txt
stortinget-20100303-090601_2m_6900600_6926400,ja president det er jo i hvert fall hyggelig å kunne konstatere at på klokskapen i hvert fall er til stede og det kan jo være godt i denne saken men eee president det er et eee utsagn som er finner grunn til å be statsministeren om å svare på for jeg av nyhetsendingene i går kveld så fikk vi i hvert fall inntrykk av at i det et intervju med nærings og handelsminister trond giske,ja president det er jo i kvart fall hyggeleg å kunne konstatere at dette på plokskåpan i kvart fall er til stede og det kan jo vere godt i denne saka men president det er eit utsond som er finn grunn til å be statsministeren om å svare på for i ei av nyheitssendingane i går kveld så fekk vi kvart fall inntrykk av at i det etter intervjue med nærings og handelsminister tom giske,6900.6,6926.4,25.799999999999272,2010-03-03,2010-03-03_proceedings.txt
stortinget-20100303-090601_2m_6926400_6956400,at eee statsministeren var konsultert i januar var fremkom i det eee progra i den nyhetsinnslaget spørsmålet mitt til statsministeren eee i den sammenheng er hvorvidt statsministeren var informert om at nærings og handelsministeren eee var eee holdt på å ta med kronprins eee påkorn hans kongelige høyhet inn i dette utvalget for dersom det er riktig så setter vi jo denne saken i et eee nytt lys,at statsministeren var konsultert i januar var framkom i det eee program i den nyhetsinnslaga spørsmålet mitt til statsministeren eee i denne samanheng er kor vidt statsministeren var informert om at eee nærings og handelsministeren eee var holdt på å ta med kronprins eee håkon hans kongelege høyet inn i dette utvalet for dersom det er riktig så set det jo denne saka i eit nytt lys,6926.4,6956.4,30.0,2010-03-03,2010-03-03_proceedings.txt
stortinget-20100303-090601_2m_6956400_6981900,så spørsmålet mitt til statsministeren var statsministeren informert i januar slik det fremkom eee fra trond giske i nyhetene i går veldstatsminister stoltenberg president som jeg svarte på det andre spørsmålet og som næringsminister trond giske selv har understreket ved flere anledninger så er detter hans eee beslutning eee og det er også slik at de eee nå er kommet en beslutning om at kronprins ikke skal delta i denne gruppen det,så spørsmålet mitt til statsministeren var statsministeren informert i januar slik det framkome frå thon giske i eee nyhetene i går kvell statsminister sotme president som eg svarte på det andre spørsmålet og som eee eee næringsminister trong giske sel har understreket ved fleire anledningar så er dette hans eee beslutning eee og det er også slik at eee nå er komme til beslutning om at kumpenset ikkje skal delta i denne gruppen der ein,6956.4,6981.9,25.5,2010-03-03,2010-03-03_proceedings.txt
stortinget-20100303-090601_2m_6981900_7009400,beslutning som kronprinsen og næringsministeren har kommet sam fram til i sam råd og er enige om det og som jeg sier det mener jeg er en viktig beslutning en klok beslutning når det gjelder håndtering i regjeringen så har vi en lang tradisjon fra mange regjeringer for at man ikke eee spesielt ikke fra stortingets talerstol redegjør for den interne saksbehandlingen i regjeringen da er neste og siste tilleggsspørsmål fra representanten svein plottenen vær så god,beslutning som kronprinsen og næringsministeren har kome sam eee fram til i eee samråd og er einige om det og så eg sier eg meiner her er ein viktig besytning ein klok beslutning når det gjeld handtering i regjeringa så har vi ein lang tradisjon frå mange regjeringa for å kneike eee spesielt ikke stortingets tadese redegjort for den interne saksbehandlinga i den der neste og siste tilleggsspørsmål er representanten svein plottenten ver så god,6981.9,7009.4,27.5,2010-03-03,2010-03-03_proceedings.txt
stortinget-20100303-090601_2m_7009400_7039300,president jeg skjønner at svaret på alle spørsmål i denne saken er at avgjørelsen som har kommet er klok og god men jeg tror nok at dette med konstitusjonell rolleblanding også er en sak for statsministeren fordi at dette måtte jo være klart helt fra begynnelsen at dette var politikk for fjorten dager siden så presenterte statsministeren prosjektet samarbeid for arbeid som et meget politisk prosjekt og næringsministeren har jo da sagt til utnevnelse av kronprinsen at dette ikke var,eee president eg kjenner at svaret på alle spørsmålet i denne saka her at avjølsen som har kome er klok og god men eee eg trur nok at dette med konstitusjonell rolleblanding og så er ein sak for statsministeren fordi at dette måtte jo vere klart heilt frå begynnelsen at dette var politikk på fjorten dagar sidan så presenterte statsministeren prosjektet samarbeid for arbeid som eit meget politisk prosjekt og næringsministeren har jo da sagt ut den sa kronprinsen at dette ikkje var,7009.4,7039.3,29.900000000000546,2010-03-03,2010-03-03_proceedings.txt
stortinget-20100303-090601_2m_7039300_7067200,så spørsmålet mitt president er til eee til statsministeren er vil statsministeren gjøre noe for å slik at næringsministeren forstår at samarbeid for arbeid er et politisk prosjekt og slik at vi i fremtiden kan unngå denne typen meget uheldige rolleblandingerstatsminister stoltner president,og politikk så spørsmålet mitt president er til til statsministeren er vil statsministeren gjere noko for å slik at næringsministeren forstår at samarbeid for arbeid er eit politisk prosjekt og slik at vi i framtida kan inngå denne typen meget uhendige rolle blandingar statsminister stolte president,7039.3,7067.2,27.899999999999636,2010-03-03,2010-03-03_proceedings.txt
stortinget-20100303-090601_2m_7067200_7095000,det er veldig viktig at vi ikke eee laver usikkerhet rundt eee roller eee og jeg mener at eee den diskusjonen og den tvilen som oppsto var jo det som er begrunnelsen både for næringsministeren og for eee kromprinsen for den beslutningen om at kromprinsen ikke deltar og så kan man helt sikkert ha ulike meninger men det avgjørende er at de ønsket å fjerne usikkerhet og tvil og at dette skulle ha ment som en positiv ting som oppfattes som negativt og derfor,det er veldig viktig at vi ikkje eee laver usikkerheit rundt eee roder eee og eg meiner at eee den diskusjonen og den tvilen som oppstår kvar av det som er begrunnelsen både for næringsministeren og for eee kronprinsen for den beslutninga om at krompinsen ikkje deltar og så kan ein heilt sikert ulike meiningar med navene er at dei ønsker til å fjerne usikkerheit og tvil og at dette ein meiner som ein positiv ting som oppfatta som negativt og derfor,7067.2,7095.0,27.800000000000182,2010-03-03,2010-03-03_proceedings.txt
stortinget-20100303-090601_2m_7095000_7122200,eee er det en riktig og klok beslutning det de har eee tatt eee generelt så mener jeg jo at det er bra at vi har et kongehus som er aktive som fremmer norsk næringsliv som ikke minst overfor andre land på reiser og og møter og konferanser eee er med på å fremme norsk næringsliv men det er viktig at vi ikke det skjer på en måte som skaper usikkerhet om roller konstitusjonelle forhold og derfor er jo det en del av begrunnelsen for at grunprinsen ten,eee er det ein riktig klok beslutning det dei har eee tatt eee generelt så meiner eg jo at det er bra at vi har eit konghus som er aktive som fremmer norsk næringsliv som ikkje minst år for andre land på reise og og møter og konferansar eee er med på å fremme norsk næringsliv men det er viktig at vi gre skjer på måte som skaper usikkerheit om rolle konsesjonelle forhold og derfor er det ein del av begunder at kronprinsen i,7095.0,7122.2,27.199999999999818,2010-03-03,2010-03-03_proceedings.txt
stortinget-20100303-090601_2m_7122900_7148500,og da går vi til siste hovedspørsmål av hensyn til eee tidsbruken så langt så vil det bli gitt anledning til svært få om noen tilleggsspørsmål til følgende hovedspørsmål fra representanten jan tore sanner sanner vær så god takk skal du da president eee det største og viktigste valgløftet som ble gitt fra arbeiderpartiet sv og senterpartiet i fjorårets valgkamp,og da går vi til siste hovudspørsmål med hensyn til eee tidsbruken så langt så vil det bli itt anledning til svært få om nokon tilleggsspørsmål til følgande hovudspørsmål frå representanten jan tore sander samer ver så god før skal det president eee det største og viktigaste vakløftet som blei gitt frå arbeidarpartiet sv og senterpartiet i fjor årets svakkamp,7122.9,7148.5,25.600000000000364,2010-03-03,2010-03-03_proceedings.txt
stortinget-20100303-090601_2m_7148500_7177200,det var at det skulle satses hundre milliarder kroner mer på vei og bane dette løftet ble godt mottatt eee selv om de fleste nok var igjen med høyre i at hovet er enda større det er behov for bedre veier for at bedriftene skal kunne komme ut på markedet med sine varer det er behov for mer kollektivtransport av hensyn til miljø og fremkommelighet og det er behov for tryggere veier av hensyn til de altfor mange eee trafikkskadde,det var at det skulle satsast hundre milliardar kroner meir på veg og bane dette løftet blei godt mottatt selam dei fleste noko dei igjen med høgre i at hovet er enda større det er behov for betre vegar for at bedriftene skal kunne komme ut på marknaden med sine varer det er behov for meir kollektivtransport av hensyn til miljø og framkomelegheit og det er behov for tryggare vegar og hensyn til dei altfor mange eee trafikkskadar,7148.5,7177.2,28.699999999999818,2010-03-03,2010-03-03_proceedings.txt
stortinget-20100303-090601_2m_7177200_7206200,president eee like etter valget så skrev eee statsministeren i dagens næringsliv at sitat staten har penger nok det er eee det viktige er viljen til å prioritere vei og bane det står i sterk kontrast til hva vg kunne fortelle på søndag hvor en sentral anonym arbeiderpartikilde sier sitat det er helt utenkelig at planen kan oppfylles sult ut,president eee like etter valet så skriv eee statsministeren i dagens næringsliv at sitat staten hår penge nok det er eee det viktige er viljen til å prioritere veg og bane det står i sterk kontrast til kva veg kunne fortelle på søndag vore sentral og anonym arbeidarpartiet i kilde seier sitat det er heilt utenkeleg at planen kan oppfyllast fullt ut,7177.2,7206.2,29.0,2010-03-03,2010-03-03_proceedings.txt
stortinget-20100303-090601_2m_7206200_7232800,det gjør nok president at mange velgere sitter igjen med spørsmålet ble vi lurt i fjor høst av arbeiderpartiet sv og senterpartiet sitt løfte eller er det slik at man nå ikke lenger klarer å foreta de vanskelige valgene som statsministeren påpekte i dagens næringsliv nemlig at det er et spørsmål om å prioritere men det stopper ikke der fordi at en anonyråd,det gjer nok president at mange veljarar sit igjen med spørsmålet blei illu i fjor haust av arbeidarpartiet sv og senterpartiet sitt løfte eller er det slik at ein nå ikkje lenger klarer å foreta dei vanskelege vagene som statsministeren påpeikte i dagens næringsliv nemleg at de er eit spørsmål om å prioritere men det stoppar ikkje der fordi at er ein anonyråd,7206.2,7232.8,26.600000000000364,2010-03-03,2010-03-03_proceedings.txt
stortinget-20100303-090601_2m_7232800_7260800,i den rødgrønne regjeringen en statsråd i stoltenbergs regjering sier til til vgs sitat alle må kutte også samferdsel det er jo veldig mye penger å hente der sitat slutt og da er mitt spørsmål til statsministeren er det slik at det løftet som ble gitt til velgerne ikke hadde full støtte i den rødgrønne regjeringen eller er det slik at statsministeren har gitt beskjed om at det skal kuttes også i samferdsel,i den raudgrøne regjeringa ein statsråd i stoltenbergs regjering seier til til vege sitat alle må kutte også samferdsel det er jo veldig mykje pengar å hente dei sitat slutt og da er mitt spørsmål til statsministeren er det slik at det løftet som blei gitt til veljarane ikkje hadde full støtte i den raudgrøne regjeringa eller er det slik at statsministeren har gitt beskjed om at det skal kuttast også i samferdsel,7232.8,7260.8,28.0,2010-03-03,2010-03-03_proceedings.txt
stortinget-20100303-090601_2m_7260800_7277400,statsminister stoltenberg president regjeringen har ikke hatt sin første budsjettkonferanse det er ingen i dag som kan si nøyaktig hvordan budsjettet for totusenogelleve kommer til å se ut simpelt hen fordi vi ikke har startet arbeidet med budsjettet for totusenogelleve det jeg kan si,statsminister president regjeringa har i alt sin første budsjettkonferanse der ingen i dag sidan sin i aktiv la budsjettet for totusenogelleve kommer til å se ut sim pertent fordi vika har starta arbeidet med budsjettet for totusenog eee elleve det er kan si,7260.8,7277.4,16.599999999999454,2010-03-03,2010-03-03_proceedings.txt
stortinget-20100303-090601_2m_7277400_7306900,det er at de planer de målsettinger regjeringen har trukket opp blant annet i soramoraerklæringen i nasjonal transportplan og andre steder står ved lag så det betyr jo at nasjonal transportplan står ved lag det betyr at den planen vi har til omsorgsløftet eee opptrapping i forhold til eee i forhold til eldreomsorg i kommunene står ved lag eee kulturløftet eee forsvarsplanen står ved lag og det er mange andre planer som står ved lag det står også målsettingen og planen om å komme tilbake igjen,det er at dei planar dei målsettinga regjeringa har trukket opp blant anna dei store mordklæring nasjonaltransport an og andre stader står ved lag så det betyr jo at nasjonaltransportane står vi lag det betyr at den planen har vore til omsorgsløfte eee opptrapping i forhold til for til eldreomsorga eee i kommunane står i lag eee kulturløftet eee forsvarsplanen står i lag og det er mange andre planar som står ved lag det står også målsettinga av planen om me å komme tilbake igjen,7277.4,7306.9,29.5,2010-03-03,2010-03-03_proceedings.txt
stortinget-20100303-090601_2m_7306900_7328300,eee til en bruk av oljepengebruk som tilsvarer fire prosent eee av pensjonsfondet så vi har mange målsettinger mange planer og så vil vi da i de enkelte budsjetter avgjøre hvor langt og hvor konkret vi kommer når det gjelder oppfølging når det gjelder transportplanen så er det en plan der vi har virkelig vist at vi gjør det vi sa vi skulle gjø den forrige regjeringen,eee til ein bruk av oldepengerbruk som tilsvarer tive prosent eee av pensjonsfondet så vi har mange målsettinga mange planar og så vil vi da dei enkelte budsjettet avgjere kor langt over konkret vi kommer når det gjeld oppfølging når det gjeld transportplanen så er det ein planen der vi har virkelig vist at vi gjer det vi sa vi skulle gje den forge regjeringa,7306.9,7328.3,21.400000000000546,2010-03-03,2010-03-03_proceedings.txt
stortinget-20100303-090601_2m_7328300_7354900,la fram en meget lite ambisiøs transportplan mye mindre til vei enn det denne regjeringen har sørget for og de greide ikke å oppfylle den planen så når det gjelder å bryte planer så har altså høyre lang erfaring vi la fram en vesentlig mer ambisiøs eee transportplan og har fulgt den denne regjeringen har gjennomført den forrige transportplanen og la fram en ny og enda mer ambisiøs transportplan allerede i totusenogt løft,la fram ein meget lite ambisiøs transportplan mye eee mindre til veg enn det denne regjeringen har sørgt for og dei greidde kan å oppfylle den planen så nå det geld å bryte planen så har altså høgre lang erfaring vi la fram ein vesentleg meir ambisiøs eee transportplan og har fylgt den denne regjeringa har gjennomført den fore transportplanen og lagt fram ein ny a enda mer ambisiøse transportplan overrei i totusenogt løft,7328.3,7354.9,26.599999999999454,2010-03-03,2010-03-03_proceedings.txt
stortinget-20100303-090601_2m_7354900_7380600,for å både øke bevilgninger til vei og til bane i tråd med hva vi har lovet i transportplanen så våre planer står ved lag vi vil i de enkelte budsjettene redegjøre for hvor konkret og hvor langt vi kommer i å oppfylle densanner til oppfølging president dette er vel det nærmeste man kommer et goddagmannøkseskaftsvar vi kan gjerne krangle om fortiden eee selv om jeg tror at det er li lite formålstjenlig,for å både auke bygninga til veg og til bane i tråd med kva vi har lovet i transportplanen som våre planar står ved lag vi vil i dei enkelte budsjetta redegjør for vore konkret og kor langt vi kommer i oppfyllingsarføling president dette er vel den eineste men kommer i eit godag mann økseskaft svar vi kan gjerne krangle om fortiden eee sjøl om eg trur at det er litt lite for moss tenleg,7354.9,7380.6,25.700000000000728,2010-03-03,2010-03-03_proceedings.txt
stortinget-20100303-090601_2m_7380600_7410300,jeg tror at alle ser at mange regjeringer av ulik farge ikke har gjort nok men det som står fast er at bondevikregjeringen regjeringen høyre satt i bygget flere kilometer vei enn det stoltenbergregjeringen har gjort eee i forrige periode og det skyldes at vi klarte å få mere ut av av veipengene jeg er enig i målsettingen at man skal komme ned til handlingsregelen men handlingsregelen den handler ikke bare om hvor mye penger man skal bruke fra fra pensjonsfondet men det handler også om hvordan man skal bruke pengene,eg trur at alle ser at mange regjeringa av ulik farge ikkje har gjort nok men det som står fast er at bomvikregjeringan regjeringa høgre sat dei bygger fleire kilometer veg enn det stoltenbergregjeringa har gjort eee i førre periode og det skyldes at vi klarte å få mere ut av av veig pengane ja eg er einig med åsiktovat ein skal kome ned til handlingsregen men handlingsregen den handlar ikkje berre om kor mye pengar ein skal bruke frå frå pensjonsfondet men det handlar også om kor at ein skal bruke pengane,7380.6,7410.3,29.699999999999818,2010-03-03,2010-03-03_proceedings.txt
stortinget-20100303-090601_2m_7410300_7439500,og det stoltenberg var enig med høyre og andre partier om da handlingsplan eee handlingsregelen ble introdusert det var at oljepengene skulle brukes til å investere for fremtiden i kunnskap i forskning i samferdsel og i skattelettelser for eee blant annet eee bedriftene president står statsministeren fast på det som var intensjonen i handelsregelen nemlig at man skulle prioritere investeringer for fremtiden statsminister solberg president ja,og det stoltenberg var einig med høgre og andre parti om da handlingspe planen eee handlingsrege blei introdusert det var at oljepengane skulle brukast til å investere for framtida i kunnskap i forsking i samferdsel og i skattelettelser for eee blant anna bedriftene president står statsministeren fast på det som var intensjonen i handelsregen nemleg at han skulle prioritere investeringar for framtiden statsminister stokmark president ja,7410.3,7439.5,29.199999999999818,2010-03-03,2010-03-03_proceedings.txt
stortinget-20100303-090601_2m_7439500_7467700,og det er grunnen til at denne regjeringen har økt betydelig investeringene i samferdsel det er mye som gjenstår det er mange veier som ikke er gode nok det er mye jernbane som ikke er bygget men det forhindrer ikke at vi har altså doblet jernbane jen jernbaneinvesteringene og økt veiinvesteringe med mange milliarder eee kroner så vi har fulgt opp vår plan og den forrige regjeringen bevilget mindre enn den lov ut og greide ikke å følge opp eee sin eee plan og så sier jeg at vi har allerede i totusenogtibudsjettet,og det er grunnen til at denne regjeringen har økt betydeleg investeringane i samferdsel det mye som instår der mange vegar som ikkje er god nok det er mye jernbane som ikkje er bygg ut men det forhindrer ikke at vi har altså doblet jernbane jern jernbaneinvesteringane og økt vegistiling med mange milliardar eee kroner så vi har fylgt opp vår plan under førre regjeringa bevilga mindre enn den lovut og grei å følga opp sin eee plan og så seier eg at vi har allereie i totusenogti budsjettet,7439.5,7467.7,28.199999999999818,2010-03-03,2010-03-03_proceedings.txt
stortinget-20100303-090601_2m_7467700_7492200,eee hatt en betydelig opptrapping i tråd med eee transportplanen når det gjelder eee transport det våre planer står ved lag og så skal vi i de enkelte budsjettene konkretisere hvor langt vi kommer i å realisere den det gjelder alle planer og alle målsettingene da vil det bli begrensa til to tilleggsspørsmål første tilleggsspørsmål fra representanten øyvind halleraker deretter fra representanten bård hoksrud halleraker vær så god,eee har hatt ein betydeleg opptrapping i tråd med eee transportplanen når det gjeld eee transport der våre planar står ved lag og så skal vi i dei enkelte budsjetta konkritisere kor langt vi kommer i å realisere det er det alle planar alle motsettingada vil det bli begrensa til to tilleggsspørsmål første tilleggsspørsmålet frå representanten eivind haldrake deretter frå representanten bål vågsø halderaker ver så god,7467.7,7492.2,24.5,2010-03-03,2010-03-03_proceedings.txt
stortinget-20100303-090601_2m_7492200_7521400,takk president den forrige regjeringen hadde ikke noe felles nasjonal transportplan det hadde imidlertid en semerklæring og den ble oppfylt og så må jeg få minne statsministeren om at regjeringen allerede ligger to komma tre milliarder etter den ntpen han sto og skrøt av jo en slik virkelighet hvor toget det står på grunn av manglende vedlikehold og nyinvestering hvor vi stadig fornyer apporter om at veiene blir dårligere så opplever vi altså at stoltenbergregjeringen nå sår tvil om å utsette nødvendige tiltak som kunne ha gitt oss tryggere veier,takk president den forrige regjeringa hadde ikkje noko felles nar sjonat transportplane hadde midt i ein skjemmeklæring og det blei oppfylt og så må eg få minne statsministeren om at regjeringa allereie ligg to komma tre milliardar etter ein ntpenastor og skrøpe au ei slik virkelighet og togende står på grunn av manglande vedlikehald i investering og vi stadig får nye rapportar om at vegane er blitt dårlegare så opplever vi altså at oteregjeringa nå sår tvil om og utsette nødvendige tiltak som kunne har gitt oss tryggare vegar,7492.2,7521.4,29.199999999999818,2010-03-03,2010-03-03_proceedings.txt
stortinget-20100303-090601_2m_7521400_7550200,og bedre fremkommelighet på bane og som selvfølgelig også er vekstfremmende tiltak som man burde satse på i slike tider som vi er nå for knapt et år siden uttalte statsministeren følgende nå har vi satt oss nye ambisiøse mål for neste tiårsperiode hundre milliarder kroner ekstra til samferdsel bare det er god nok grunn til at velgerne bør gi vår flertallsregjering fire nye år et halvt år etterpå så sier han følgende arbeiderpartiets styrke er ikke bare å foreslo,og betre framkommelegheit på bane og som selvfølge også er vekstfremmande tiltak som ein burde satse på i slike tider som vi har nå for knapt eit år sidan uttalte statsministeren følgende nå har vi satt oss nyande siø som mål for neste tiårsperiode hundre milliardar kroner ekstra i samferdsel bare det er god nok grunn til at veljarane bør gi vår fletanering fire nye år eit halvt år etter på så seier han følgjande arbeidarpartiet styrke er ikkje berre å føreslå,7521.4,7550.2,28.800000000000182,2010-03-03,2010-03-03_proceedings.txt
