file,text_bm,text_nn,start,end,duration,date,proceedingsfile
stortinget-20100611-095544_2m_9508900_9538500,kan gjøre opprustning og utvidelse som ikke står i konflikt med naturinngrep den saken vi diskuterer i salen i dag har gjennom komitebehandlingen fått en litt dreining det har tidligere talere vært inne på men fra kristelig folkeparti sin side så håper vi at den saken som nå er til behandling hos nve det prosjektet som flertallet i kommunestyret i rauma har støttet,kan gjere opprustning og utvidelse som ikkje står i konflikt med naturinngrepden saka vi diskuterer i salen i dag har eee gjennom komitebehandlinga fått ein litt dreining det har tidlegare talarar vore inne på men frå kristeleg folkeparti sin side så håper vi at den saka som no er til behandling hos nve det prosjektet som fleirtalet i kommunestyret rauma har støtt ut,9508.9,9538.5,29.600000000000364,2010-06-11,2010-06-11_proceedings.txt
stortinget-20100611-095544_2m_9538500_9567400,er et eee prosjekt som det er mulig å finne en løsning på fordi dette vil gi både økt energiproduksjon og samtidig så vil det ta vare på de det naturmangfoldet som vi har i dette områdetda er neste taler statsråd terje riis johansen som var tilbake til stortinget som olje og energiminister etter et godt vikariat som utenriksminister her tidligere i uka rit johansen vær så god,er eit prosjekt som det er mulig å finne ein løysing på fordi dette vil gi både økt energiproduksjon og samtidig så vil det ta vare på dei det naturmangfaldet som vi har i dette området der neste talar statsråd terje lis johansen som var tilbake i stortinget som origo energiminister etter eit kort vikariat som utdelingsministere har tidlege juka rit johansen ver så god,9538.5,9567.4,28.899999999999636,2010-06-11,2010-06-11_proceedings.txt
stortinget-20100611-095544_2m_9567400_9592800,qqq president eee takk for velkomsten eee som følge av at forslagsstillerne i realiteten har trukket forslaget så ser ikke jeg noe behov for å bidra til å forlenge den her eee debatten eee ytterligere det er store spørsmål som gjelder fornybar energi som vi har ulike anledninger til å diskutere i den her salen men det konkrete forslaget som nå eee var fremma oppfatter jeg å i realiteten være eee trekt takk qqq,qqq president eee takk for bekomsten eee som følger at forslagsstyrane i reariteten har trekt forslaget så sikker eg no behov for å bidra til å forlenge den her eee debatten eee ytterlegare det er det store spørsmålet som eee gjeld fornybar energi som vi har ulike anledningar å diskutere i den her salen men det konkrete forslaget som no eee var ei fremma oppfattar eg o ivoriteten vere eee tekt takk,9567.4,9592.8,25.399999999999636,2010-06-11,2010-06-11_proceedings.txt
stortinget-20100611-095544_2m_9593000_9604100,da åpnes det for replikkordskifte begrenset til fem replikker og første replikant er eee oskar ale grimstad,da åpnes det for replikkordskifte begrenset til fem replikker og første replikant er oskar jarle grimstad,9593.0,9604.1,11.100000000000364,2010-06-11,2010-06-11_proceedings.txt
stortinget-20100611-095544_2m_9607400_9632800,grimstad vær så god president is kong er et eee stort problem i eksisterende inntaksdam i dag og isen kjeme nedover dalen går inn i inntaksdammen og har vi to tilfeller gått over kanten og ned på jernbane togskinnene gangen og har skapt store problemer eee for det,grimstad ver så godpresident isgang er eit stort problem i eksisterande inntaksdam i dag og isen kjem ned over dalen går inn i inntaksdammen og har vi to tilfelle gått over kanten og ned på jernbane togskinnegangen og har skapt store problem eee for det,9607.4,9632.8,25.399999999999636,2010-06-11,2010-06-11_proceedings.txt
stortinget-20100611-095544_2m_9632800_9655000,ingenting tyder på at man klarer å å eee forbedre den biten i forhold til eee den søknaden som eee ligger inne i dag og grunnen er jo at rauma kommune føler seg pressa til å eee gå på ei utbygging for øvrig utbygging til tre hundre millioner kroner,ingenting tyder på at ein klarer å å eee forbetre den biten i forhold til eee den søknaden som eee ligg inne i dag og grunnen er jo at reima kommune føler seg pressa til å eee eee gå på ei utbygging for øvrig utbygging til tre hundre million kroner,9632.8,9655.0,22.200000000000728,2010-06-11,2010-06-11_proceedings.txt
stortinget-20100611-095544_2m_9655000_9685000,som som eee de ei stor anso var eneste muligheta hva vil statsråden råd de til å gjøre i forhold til isingsproblemer som ikke ikke er avslutta ved ei utviding slik som at flertallet nå går infrastatsråd ris johansen president jeg trur ikke jeg har noe faglig grunnlag for å bei mi meg inn på en diskusjon i få til rådgiving når det gjelder ising av vassdrag eee det er nok eee andre som eee og mere faglige instanser som er mere eee egna til eee til det,som som dei ei stund ansåg var einaste muligheter kva vil statsråden rå dei til å gjere i forhold til isingsproblemet som ikkje ikkje er avslutta ved eee ei utviding slik som eit fleirtal i dag går i forstatsråd rit jansen president eg trur ikkje er har noko fagleg grunnlag for å be i bi me inn på ein diskusjon som har fått rådgiving deret jeld ising av vassdrag eee det er nok eee andre som eee og meir fagleg instansar som er meir eee eina til eee til det,9655.0,9685.0,30.0,2010-06-11,2010-06-11_proceedings.txt
stortinget-20100611-095544_2m_9685000_9712800,eee og når det gjelder saken for øvrig så så er jo den vel belyst i den forstand at det her eee er også et spørsmål i forhold til eee rammer som stortinget tidligere har satt i forhold til eee eee verning av områdene takkneste replikant er siri a meling vær så godpresident det er hyggelig at vi fra anne også kan være enig i saker,eee og når det gjeld saka forøvrig så så er jo den vel belyst i den forstanden at det her eee er også eit spørsmål i forhold til eee rammer som stortinget tidlegare har sett i forhold til eee verning av område takkneste replikant er sivi a mehlinmåning ver så godpresident det er hyggeleg at vi portane også kan vere einige i saker,9685.0,9712.8,27.799999999999272,2010-06-11,2010-06-11_proceedings.txt
stortinget-20100611-095544_2m_9712800_9735400,eee men jeg har allikevel et spørsmål til til statsråden og det går på framdriften i behandlingen eee av den søknaden som nå ligger til behandling hos norges vassdag og energidirektorat eee har statsråden mulighet for å si noe om hva tid vi kan forvente å få et svar derfra statsråd terje risen president det er jo visse utfordringer knytta til generelt å diskutere enkeltsaker,eee men eg har likevel eit spørsmål til til statsråden og det går på framdriften i behandlinga eee av den søknaden som no ligg til behandling hos noregs farsdag og energidirektorat eee har statsråden mulighet for å seie noko om kva tid vi kan forvente å få eit svar derfrå president det er jo visse utfordringar knytt til å generelt å diskutere enkeltsaker,9712.8,9735.4,22.600000000000364,2010-06-11,2010-06-11_proceedings.txt
stortinget-20100611-095544_2m_9735400_9761600,og jeg mener også at det blir gærent hvis jeg som statsråd begynner å instruere nve på enkeltsaker og hvilke saker som skal gå foran i køen og hvilke som skal gå bak eee jeg mener derfor at min rolle er å sørge for rammer for en vesen virksomhet som gjør at de er i stand til å håndtere eee saker eee i et høyere tempo enn tidligere jeg mener at køen rundt eee saker i nv har vært for stor vi har økt bevilgningene og sånn sett så kan både stortinget og jeg forvente at nv,og eg meiner også at det blir gent viss det som statsråd begynner å instruere ein ved på enkeltsaker og ke saker som skal gå foran i køen og vi som skal gå bak eee eg meiner det er lt min rolle er å sørge for rammer for ein vesen virksomhet som jer at det er istand til å handtere eee saker eee i eit høgre tempo enn tidlegare eg meiner at køen rundt eee saker i ein me har vore for stor vi har økt bevilgningene og sånn sett så kan både stortinget og ei forventa at ein ve,9735.4,9761.6,26.200000000000728,2010-06-11,2010-06-11_proceedings.txt
stortinget-20100611-095544_2m_9761600_9783500,enn det de har gjort tidligere i tillegg så har jeg gjennom tildelingsbrevet til nve eee definert hvilke områder jeg mener er generelt viktig altså en ved å prioritere og det har jo da vært definert som eee som småkraftutbygginger og eee linjeføring eee nye kraftlinjer takkingen flere har bedt om ordet til replikkeplikkordskiftet er dermed omme,enn det dei har gjort tidlegare i tillegg så har eg gjennom tilleggsbrevet til nve eee definert kva område jeg meiner det er generelt viktig at vi er med å prioritere og det har jo da vore definert som eee som småkraftutbyggingar og eee linjeføring eee nye kraftgi takk ingen flere har vedt om ordet til replikk eplikkordskifta i den med over,9761.6,9783.5,21.899999999999636,2010-06-11,2010-06-11_proceedings.txt
stortinget-20100611-095544_2m_9783500_9799400,stortinget går tilbake til den ordinære talerlisten og de talere som heretter får ordet har en taletid på inntil tre minutter og da er det elisabeth røbek nørve som er neste taler og deretter tove se torve,stortinget går tilbake til den ordinære talerlisten og dei talare som heretter får ordet har ei taletid på inntil tre minutt og da er det elisabet røbek nørve som er neste talar og deretter tove se torve,9783.5,9799.4,15.899999999999636,2010-06-11,2010-06-11_proceedings.txt
stortinget-20100611-095544_2m_9803000_9826900,ruvet nerve vær så godpresident elva værmåa har vært regulert sia nittentjuetre ei flytting av dagens inntaksdam til storhavnen vil føre til en produksjonsøkning fra dagens sytti til hundre og førti gwh uten eee nye reguleringer i vassdraget,rebeh nede ver så god president elva vermoa har vore regulert sidan nittentjuetre ei flytting av dagens inntektsstand til storhaun vil føre til ein produksjonsøkning frå dagens sytti til hundre og førti geveho utan eee nye reguleringar i vassdraget,9803.0,9826.9,23.899999999999636,2010-06-11,2010-06-11_proceedings.txt
stortinget-20100611-095544_2m_9826900_9836400,behovet for økt energitilgang er svært stort i området og det gamle inntaket er i en svært dårlig forfatning det haster derfome i gang med ei utbedring,behovet for økt energitilgang er svært stort i området og det gamle inntaket er i ein svært dårleg forfatning det hastar defoe i gang med ei utbidring,9826.9,9836.4,9.5,2010-06-11,2010-06-11_proceedings.txt
stortinget-20100611-095544_2m_9836400_9863400,da rauma kommune eee og rauma energi fikk avslag på sin første søknad som gikk på flytting av inntak til storhavn avsto jeg fra og anke ettersom statsråden i sin begrunnelse ved flere anledninger viste til verneplan for vassdrag som et vedtak i stortinget som derfor vil være den rette instansen til å åpne for eventuell justering i verneplan reime og energi og remakommunejustering iveren,da rauma komune eee og reima energi fekk avslag på sin første søknad som gjekk på flytting av inntak til storhamn avstod dei frå anke ettersom statsråden i sin begrunnelse ved fleire anledningar viste til verneplan for vassdrag som eit vedtak i stortinget som derfor vil vere den rette instansen til å opne for eventuell justering i verneplanen reima energi og dei må kommunejustering i vern,9836.4,9863.4,27.0,2010-06-11,2010-06-11_proceedings.txt
stortinget-20100611-095544_2m_9863400_9890000,planen som svært krevende og valgte det for å søke om å få utbedra eksisterende inntak som vil gi tjue til tredve twh mindre u uvitende om at det forelå en søknad om eksisterende inntak lover at eee samtlige representanter og jeg sier samtlige representanter på morbanken en støtte for storehanen og alternativet som blei oss presentert i valgkampen og under besøk et,plan som svært krevjande og valde derfor å søke om å få utbetra eksterande inntak som vil gi tjue til tredve til vho mindre u uvitne om at det forelå ein søknad om eksisterande inntak lover eee samtlige representantar og i sir samtlige representantar på myrbenken støtte for storhaun og alternativet som blei oss presentert i valkampen og under besøk et,9863.4,9890.0,26.600000000000364,2010-06-11,2010-06-11_proceedings.txt
stortinget-20100611-095544_2m_9890000_9913600,saka vistes er dessverre å være mer komplisert og kontroversiell i rauma kommune en det som nådde frem eee som informasjon til mørebanken høyre som ikke har for vane å overkjøre lokaldemokratiet valgte derfor etter et møte med høyres representanter og ordføreren i rauma å støtte lokaldemokratiet og følge det som der og da var flertallet i kommunen,saka viste seg dessverre å vere meir komplisert og kontroversiell i reven av kommunen det som nådde fram eee som informasjon til mørebenken høgre som ikkje har for vane å overkøyre i lokaldemokratiet valde derfor etter eit møte med høgres representantar og ordføraren i rauma å støtte lokaldemokratiet og følge det som der og då var fleirtalet i kommuna,9890.0,9913.6,23.600000000000364,2010-06-11,2010-06-11_proceedings.txt
stortinget-20100611-095544_2m_9913600_9938000,det som så skjedde i etterkant av møtet med høyres representanter og med ordføreren fra senterpartiet var at generalforsamlinga i rauma energi som også er kommunestyre gjorde et nytt flertallsvedtak anført av fremskrittspartiet arbeiderpartiet krf og faktisk også sv om å jobbe videre for å realisere storhaunalternativet president,det som så skjedde i etterkant av møtet med høyrest representantar og med ordføraren frå senterpartiet var at generalforsamlinga i rauma energi som også er kommunestyret gjorde eit nytt fleirtalsvedtak anført av framstegspartiet arbeidarpartiet krf og faktisk også sv om å jobbe vidare for å realisere storheim alternativet president,9913.6,9938.0,24.399999999999636,2010-06-11,2010-06-11_proceedings.txt
stortinget-20100611-095544_2m_9938000_9951200,når høyre i denne omgang vil avvente å sjå om søknaden om oppgradering av eksisterende inntak får et positivt svar fra statsråden så er ikke det fordi vi er uenige i store haualternativet nei tvert imot,når høgre i denne omgang vil avvente og sjå om søknaden om oppgradering av eksisterande inntak får eit positivt svar frå statsråden så er ikkje det fordi vi er ueinig i storhaugalternativet nei tvert imot,9938.0,9951.2,13.200000000000728,2010-06-11,2010-06-11_proceedings.txt
stortinget-20100611-095544_2m_9951200_9971200,høyre ønsker modernisering av eksisterende vannkraft der en på en skånsom måte kan ta i bruk ny teknologi og få mer fornybar energi utover det enkelte vassdrag vi aksepterer at vassdrag eee reguleres innenfor verneområdet kan moderniseres for å gi økt twh derso,høgre ønsker modernisering av eksisterande vannkraft der ein på ein skånsam måte kan ta i bruk ny teknologi og få meir fornybar energi ut av dei enkelte vassdrag vi aksepterer at vassdrag regulerast innanfor verna område kan moderniserast for å gi økt til behov derso,9951.2,9971.2,20.0,2010-06-11,2010-06-11_proceedings.txt
stortinget-20100611-095544_2m_9971200_9991350,det var på dette grunnlaget at høyre fremma sitt forslag for å flytte eksisterende inntak fra verma og kraftverk i storheim i tråd med det som kommunestyret i rauma primært ønska og fikk avslag på skulle rauma energi nok en gang få avslag på sin søknad da vil undertegnede og høyre på ny fremme foner,det var på dette grunnlaget at høgre fremma sitt forslag for å flytte eksisterande inntak frå verma og kraftverk til storheim i tråd med det som kommunestyret i rema primært ønskte og fekk avslag på skulle reima energi nok ein gong få avslag på sin søknad då vil underteikne det å høyre på ny framme foner,9971.2,9991.35,20.149999999999636,2010-06-11,2010-06-11_proceedings.txt
stortinget-20100611-095544_2m_9991350_10019700,gi og reymakommune kan vise til et vedtak med brei lokal forankring jeg vil på det sterkeste anmode både statsråden og arbeiderpartiet og sv om å stemme for høyre sitt forslag om å vedlegge forslaget til protokoll da kommer de i hvert fall sine egne i rauma kommune langt på vei i møte takk da er neste taler representanten tove lise torve og deretter siri a meling,gi og rema kommune kan vise til eit vedtak med brei lokal forankring eg vil på det sterkaste anmodet både statsråden og arbeidarpartiet og sv om å stemme for høyre sitt forslag om å vedlegge forslaget til protokoll då kommer dei i kvart fall sine eigne i rauma kommunar langt på veg i møte takk da er neste taler representanten tove lise torve og deretter siri a meling,9991.35,10019.7,28.350000000000364,2010-06-11,2010-06-11_proceedings.txt
stortinget-20100611-095544_2m_10020300_10037500,torve vær så god president eee uttrykket mange bekker små blir til en stor å passer godt i den her saka,torv ver så godpresident eee uttrykker mange bekkersmå blir til ein stor og passar godt denne her saka,10020.3,10037.5,17.200000000000728,2010-06-11,2010-06-11_proceedings.txt
stortinget-20100611-095544_2m_10037500_10064800,eee det er jo slik at den store velstandsutviklinga velferdsutvikling har opplevd her til lands starta jo nettopp med alle bakken små som blir til stor å og gjennom oppdemming og vannkraftutbygging har gitt oss kraftig industriutvikling som igjen har gitt mange arbeidsplasser og stor verdiskaping etter hvert som det var mange og til dels store og grove vannkraftanlegg rundt omkring i det ganske land tok flere og flere til orde fot bramsen på,eee det er jo slik at den store karstlandsutviklinga av velferdsutviklinga var opplevd her til lan startar jo nettopp med alle ein bakke små som blir til stor og og gjennom oppdemming og vannkraftutbygging har gitt oss eee kraft til industriutvikling som gjennom gitt mange arbeidsplassar og stor verdiskaping etter kvart som det vart mange og til dels store og grove vannkraftanlegg rundt omkring i dei ganske langt tok fleire og fleir til orde fot bramsane på,10037.5,10064.8,27.299999999999272,2010-06-11,2010-06-11_proceedings.txt
stortinget-20100611-095544_2m_10064800_10087000,for å unngå at viktige naturområder var ødelagt for all framtid derfor så har vi verna mange viktige naturområder her i norge og det er bra det er mange små og store vannkraftutbygginger som ligger i rannsona av eller i verna områder det her gjør det krevende å renovere og modernisere anlegga,for å unngå at viktige naturområde vart øydelagt for all framtid derfor så har vi verna mange viktige naturområde her i noreg og det er bra det er mange små og store vannkraftutbyggingar som ligg i ransona av eller i verna område det her gjer det krevjande å renovere å modernisere anlegga,10064.8,10087.0,22.200000000000728,2010-06-11,2010-06-11_proceedings.txt
stortinget-20100611-095544_2m_10087000_10111100,det har vært stor teknologisk utvikling innenfor det her feltet og gjennom ny teknologi så kan vi nå få mykje mer kraft ut av anlegga enn vi kunne ha tidligere nye teknologier gjør og at det mykje mer kan bygges under jorda og inn i fjellet slik at anleggene nærmest er usynlig flere anlegg vil altså med en renovering eller modernisering framstå som mer miljøvennlige en gjør i dag,det har vore stor teknologisk utvikling fort det her feltet og gjennom ny teknologi så kan vi no få mykje meir kraft ut av anlegga enn vi kunna tidlegare ny teknologi gjer og at mykje meir kan byggast under jorda og inn i fjellet slik at anlegga nærmast er usynleg fleire anlegg vil avstand med ein renovering eller modernisering framstå som meir miljøvennleg n dei gjer i dag,10087.0,10111.1,24.100000000000364,2010-06-11,2010-06-11_proceedings.txt
stortinget-20100611-095544_2m_10111100_10136200,jeg meiner og det her står på my regning at vi burde ha sett med nye øyer på om verneplanene kunne åpne for renovering og opprusting av aktuelle vannkraftverk der den samla miljøgevinsten vil være positiv for det aktuelle området i vinter så har vi igjen fått oppleve hvor krevende energisituasjon er ideelle av landet vårt spesielt i midtnorge,eg meiner at det her står på mi rekning at vi burde ha sett med nye auga på om verneplanane kunne opna for renovering og opprusting av aktuelle vannkraftverk der den samla miljøgjevinsten vil vera positiv for det aktuelle område i vinter så har vi igjen fått oppleve kor krevjande energisituasjon er i delar av landet vårt spesielt i midt noreg,10111.1,10136.2,25.100000000000364,2010-06-11,2010-06-11_proceedings.txt
stortinget-20100611-095544_2m_10136200_10164700,regjeringa har satt i gang mange tiltak som har bedra på situasjonen men vi er ikke i mål uttrykket alle monner drar passer og godt i den her saka det er viktig at vi finner løsninger for renovering av alle de vannkraftanlegga som ligger i tilknytning til verneområder verma kraftverk er et slikt anlegg rauma energi sine planer for renovering og opprustning kan gi nærmere en fordobling av kraftproduksjonen i et underskuddsområde,regjeringa har sett i gang mange tiltak som har betra på situasjonen men vi er ikkje i mål uttrykket alle monner drar passa og godt i den her saka det er viktig at vi finn løysingar får renovering av alle dei vannkraftanlegga som ligg i teknytting til vernområdet verma kraftverk er eit slikt anlegg rell med energi sine planar for renovering og opprusting kan gi nærmare ein fordobling av kraftproduksjonen i eit underskotsområde,10136.2,10164.7,28.5,2010-06-11,2010-06-11_proceedings.txt
stortinget-20100611-095544_2m_10164700_10191300,nve skal i august på befaring i området for å vurdere verma kraftverk sine planer nve vil da vurdere alternative og hensynene opp imot hverandre både med tanke på behovet for ny kraft og dem løsningene som vil gi den beste miljøgevinsten jeg meiner at nve må foreta disse her vurderingene før det foretas en på politisk beslutning og at debatten i dankt,nve skal i august på befaring i området for å vurdere verma kraftverk sine planar nve vil då vurdere alternative og hensyna opp imot kvarandre både med tanke på behovet for ny kraft og den løysingane som vil gi den beste miljøgevinsten eg meiner at nve må føreta desse her vurderingane før det foretas ein på politisk beslutning og at debatten i dunkt,10164.7,10191.3,26.599999999998545,2010-06-11,2010-06-11_proceedings.txt
stortinget-20100611-095544_2m_10191300_10210700,viser det seg at miljøfordelene med planene for utbygging er større enn miljøulempene så bør regjering og storting etter mitt syn være åpen for å gi en dispensasjon fra verneplanen takkneste taler er representanten siri a meling og deretter oskar jarle grimstad,viser det seg at miljøfordelane med planane for utbygging er støre ein miljøulempe in så bør regjeringa og stortinget etter mitt syn vere open for å gi ein dispansasjon frå verneplan takkneste talar er representanten siri a meling og deretter oskar jarle grimstad,10191.3,10210.7,19.400000000001455,2010-06-11,2010-06-11_proceedings.txt
stortinget-20100611-095544_2m_10214600_10243200,vær så godpresident jeg tar ordet fordi representanten snorre valen eee hadde eee en kommentar til høyres syn og behandling i forhold til det representantforslaget vi hadde til behandling sist mandag her i stortinget eee i forhold til kravet om cotourensning fra på ny gasskattverk fra dag en i den debatten så eee hadde jeg undertegnet et innlegg hvor jeg sa at høyre støttet forslaget fra fremskrittspartiet,meno ver så god president eee tar ordet fordi representanten snare valen eee hadde eee ein kommentar til høgre syn og behandling i forhold til det representantforslaget vi hadde til behandling sist måndag her i stortinget eee i forhold til krav om seotorensing frå på nye gasskatverk frå dag ein eee i den debatten så eee hadde under tende eit innlegg og eg sa at høgre støtte ut forslaget frå framstegspartiet,10214.6,10243.2,28.600000000000364,2010-06-11,2010-06-11_proceedings.txt
stortinget-20100611-095544_2m_10243200_10272300,dessverre så ble ikke det fanget opp av president og sekretær eee og høyre stemte derfor feil under voteringen vi har anmodet om å få en protokolltilførsel på det uten at det er blitt imøtekommet så forstår jeg at eee representanten valen og sosialistisk venstreparti ønsker å kjøre nærmest en kampanje i forhold til høyre eee på innenfor miljøpolitikken men jeg håper at representanten valen er så voksen at han forstår at i denne saken som angikk ceotorønsning ved gassgafsverk,dessverre så blir ikkje det fanget opp av president og sekretær eee og høgre har stemt seg for feil under voteringa vi har anmode om å få ein protokolltilførsel på det utan at det er blitt imøtekommet så forstår eg at eee representanten valen og sosialist venstreparti ønsker å køyre nærmast ein kampanje i forhold til høgre eee på innanfor miljøpolitikken men eg håpar at representanten valen er så vaksen at han forstår at i denne saka så angikk eee seotorrensing ved gaskasverk,10243.2,10272.3,29.099999999998545,2010-06-11,2010-06-11_proceedings.txt
