file,text_bm,text_nn,start,end,duration,date,proceedingsfile
stortinget-20121115-095531_5012600_5039300,hva hvilken avtale hvilken løsning er det man man ønsker å få på bordet når man er går så langt at man skal gå til valg på å si opp den den suverent viktigste handelsavtalen norge har som betyr altfor det skapende liv i norge man nullstiller president når man har også så faget beskrevet de syvogtredve streikene i europa i går hvor proteksjonisme faren for at spill,kva kven avtale kva løysing er det ein ein ønsker å få på bordet når ein går så langt at ein skal gå til val på å si opp den den suverent viktigaste handelsavtalen noreg har som betyr alt for dei skapande liv i noreg men nullstiller president når ein har også så fagert beskrive dei suv og tredve streikane i europa i går kor proteksjonisme faren for at spel,5012.6,5039.3,26.699999999999818,2012-11-15,2012-11-15_proceedings.txt
stortinget-20121115-095531_5039300_5066300,finanskrisens virkninger så må man være i stand til å fortelle det norske folk i alle fall om hva som er alternativet er det for eksempel president noe grunn til å tro at de fra europas side vil man være interessert i å reforhandle eee de vilkåra norsk landbruk norge har for å beskytte norsk landbruk vil man for eksempel fra europa si side være interessert i å utnytte handlingsrom rommet maksi maksimaltskerinæring,finanskrisens virkninger så må ein vere i stand til å fortelje det norske folket i alle fall om kva som er alternativet er det for eksempel president noko grunn til å tru at i frå europas side vil ein vere interessert i å reforhandle eee dei vilkåra norsk landbruk noreg har for å beskytte norsk landbruk vil ein for eksempel frå europa si side vere interessert i å utnytte handlingsrom rommet maksi maksimaltskerinæring,5039.3,5066.3,27.0,2012-11-15,2012-11-15_proceedings.txt
stortinget-20121115-095531_5066300_5093800,eee spørsmålet går både til utenriksministeren men like mye til svs og senterpartiets talskvinner og og menn handlingsrommet som norge maksimalt ønsker å utnytt nytte som det eneste land i dag som gjennomfører begrepet proteksjonisme er altså at man man gjennom wtolovverket har har anledning til å skru opp tollbeskyttelsen med femogtredve eee opogtredve prosent,eee spørsmålet går både til utanriksministeren men like mye til svs og senterpartiets talskvinner og og menn handlingsrommet som noreg maksimalt ønsker å utnytnytte som det einaste landet i dag som gjennomfører begrepet proteksjonisme er altså at ein ein gjennom veto lovverket har har anledning til å skru tollbeskyttelsen med femogtredve eee opogtredve prosent,5066.3,5093.8,27.5,2012-11-15,2012-11-15_proceedings.txt
stortinget-20121115-095531_5093800_5122900,det betyr eksempelvis at mye av norsk industri mye av norsk fiskerinæring over natta mirk mistet adgangen til sitt viktigste marked eee høyre skal stå både last og brast med dagens avtale og det må være tillatt å kunne eee pirke i disse helt vitale spørsmål hvor også finanskrisens virkninger for norsk eksportnæring nå gjør seg mer og mer gjeldende det må være anledning i en tid som dette er,det betyr eksempelvis at mye norsk industri mya norsk fiskerinæring over natta mi mista avgangen til sitt viktigaste marked eee høgre skal stå både last og brast med dagens avtale og det må vere tillat å kunne eee pike i desse heilt vitale spørsmål kor også finanskrisens virkninger på norsk eksportnæring no gjer seg meir og meir gjeldande det må vere anledning i ein tid som dette er,5093.8,5122.9,29.099999999999454,2012-11-15,2012-11-15_proceedings.txt
stortinget-20121115-095531_5122900_5152300,som representanten nikolai astrup var inne på at eee dagens debatt og dagens entusiaster for norsk eumedlemskap viser at flertallet ikke alltid har rett så er vi i en situasjon her hjemme at vi er alltid nødt til å lytte og navigere etter flertallet derfor trenger vi en dyp debatt også om hva som er alternativet for de som som markedsfører og nullstille dagens viktigste eksport og handelsavtale,som representanten nikolai astrup var inne på at eee dagens debatt og dagens entusiastar for norsk eumedlemskap viser at fleirtalet ikkje alltid har rett så er vi i ein situasjon her igjen med at vi er alltid nøydt til å lytt å navigere etter fleirtalet derfor treng vi ein dyp debatt ogs om kva som er alternativet for dei som som markedsføring og nullstiller dagens viktigaste eksport og handelsavtal,5122.9,5152.3,29.400000000000546,2012-11-15,2012-11-15_proceedings.txt
stortinget-20121115-095531_5152300_5160500,da er neste taler representanten marianne marthinsen deretter representanten peter n myhre,da er neste tale reprentant marianne martinsen deretter representanten peter n myra,5152.3,5160.5,8.199999999999818,2012-11-15,2012-11-15_proceedings.txt
stortinget-20121115-095531_5169100_5198400,takk eee president jeg vil også starte med å takke ministeren for eee en god redegjørelse og så kan jeg samtidig berolige representanten gitmark med at det ikke er vedtak på nei til eus landsmøte som danner det politiske grunnlaget for sittende regjering det er det store moria ii som gjør og der er eee forholdet til eøs krystallklart så starter representanten voldseth sitt innlegg med å slå fast at eøsavtalen ligger fast,takk eee president jeg vil også starte med å takke ministeren for eee ein god redegjørelse og så kan eg samtidig berolige representanten gitmark med at ikkje er vedtak på nei til eus landsmøte som danner det politiske grunnlaget for sittande regjering ber vitoria moria to som gjer og der er eee forhold til eøs krista klart så starta representanten vågset sitt innlegg med å slå fast at eøsavtalen ligge fast,5169.1,5198.4,29.299999999999272,2012-11-15,2012-11-15_proceedings.txt
stortinget-20121115-095531_5198400_5226400,men fremskrittspartiet skriver altså i sitt nye programutkast eee at de vil reforhandle eøsavtalens bestemmelser på arbeidsliv og velferd og som eee som representanten pedersen var inne på så er det så er det full godt med å sette hele avtalen i spill så jeg mener at det er grunn til å spørre representanten wolseth om om hennes uttalelse her fra denne talerstolen betyr at hun har avlyst frps programdebatt på akkurat det punktet det hadde vært greit å få et svar på det,men framstegspartiet skriver altså i sitt nye programutkast eee at dei vil reforhandle eøsavtalens bestemmelser på arbeidsliv og velferd og som eee som representanten pedersen var inne på så er det så er det full godt med å sette heile avtalen i spel så eg meiner at det er grunn til å spørje representanten målsett om eee om hennes uttalelse her frå denne talarstolen eee betyr at hon har avlyst frps programdebatt på akkurat det punktet det vert rett å få eit svar på det,5198.4,5226.4,28.0,2012-11-15,2012-11-15_proceedings.txt
stortinget-20121115-095531_5226400_5256200,så starta utenriksministeren sin redegjørelse med å tegne opp et alvorlig bakteppe etter en periode med svak framgang så opplever europa igjen økonomisk nedgang og den gangen så skjer det ikke på grunn av uro i finansmarkedene og stigende renter på statsgjeld denne gangen så er det kuttpolitikken og forsøkene på å få gjelda under kontroll som gir tunge utslag eee de siste oversiktene vi har fått viser at arbeidsledigheten fortsatt stiger og det er jo med det bakteppet her,så startar utanriksministeren sin reagelse med å teikne opp eit alvorleg bakteppe etter ein periode med svak framgang så opplever europa igjen økonomisk nedgang og denne gongen så skjer ikkje på grunn av uro i finansmarkedene stig ne rente på statsgjeld denne gongen så er det kuttpolitikken og forsøka på å få gjelda under kontroll som gir tunge utslag eee dei siste oversiktene vi har fått viser at arbeidsledige ledigheten fortsatt stiger og dermed det er bakteppet her,5226.4,5256.2,29.800000000000182,2012-11-15,2012-11-15_proceedings.txt
stortinget-20121115-095531_5256200_5279100,at den norske eøsdebatten også foregår vi har en avtale som sikrer full markedsadgang for norsk eks eksportretta virksomhet våre aller viktigste handelspartnere befinner seg i europa tyskland er den aller viktigste tyskland anså som i det lengste har prøvd å unngå å havne i en situasjon hvor de må garantere for de søreuropeiske landas gjeld,at norske eøsdebatten også foregår vi har ein avtale som sikrar full markedsavgang for norsk eks eksportretta virksomhet våre aller viktigaste handelspartnarar befinner seg i europa tyskland er den aller viktigaste tyskland altså som i det lengste har prøvde å unngå å hamne i ein situasjon verdi med å garantere for dei søreuropeiske lava gjeld,5256.2,5279.1,22.900000000000546,2012-11-15,2012-11-15_proceedings.txt
stortinget-20121115-095531_5279100_5307500,eee men nå tvinges det indirekte tid allikevel eee da den europeiske sentralbanken bestemte at de åpner for å kjøpe statsobligasjoner så skjedde det imot tysklands stemme i styret men angela merkel har ikke satt ned foten hun skjønner at dette må til dersom europrosjektet skal eee overleve eee det er bare dersom noen kan gå inn og garantere forelle at man kan unngå at den blir verdiløs når vi havna en sånn omspiral som det vi har gjort men dette er også situasjonen som tyskland er i,eee men nå tvingast dei inndirekte tida likevel eee da den europeiske sentralbanken bestemde at i åpne for å kjøpe statsobligasjonar så skjedde det imot tysklands stemme i styret men angela merkel har ikkje sett med foten ho kjemmer at dette må til dersom euro prosjektet skal eee overleve eee det er en berre dersom nokon kan gå under garantere for gjelda at ein kan unngå at ein blir verdilaus når vi hamna i ein sånn omspural som det vi har gjort men dette er altså situasjonen som tyskland er i,5279.1,5307.5,28.399999999999636,2012-11-15,2012-11-15_proceedings.txt
stortinget-20121115-095531_5307500_5336900,de må ta et tungt ansvar for å redde europrosjektet norge har full markedsadgang tyskland er vår viktigste handelspartner men vi har en avtale som gjør at vi verken er euromedlem heldigvis vil jeg si eee eller er forplikta til å ta ansvar for at den skal overleve og jeg tror for å være helt ærlig president at eus tålmodighet dersom norge kommer fra å reforhandle en avtale som blir oppfatta som i overkant god vil være veldig veldig liten så betyr ikke det at vi ikke kan ha debatt i norge,dei må ta eit tungt ansvar for å redde auro prosjektet noreg har full markedsavgang tyskland er vår viktigaste handelspartnar men vi har ein avtale som gjer at dei verken er euromedlem heldigvis vil eg si eee eller dei forplikta til å ta ansvar for at ein skal oppleve det og eg trur for å vere heilt ærleg president at det er us for modigheit dersom noreg kommer frå reforhandla ein avtale som blir oppfatta som i overkant god vil vere veldig veldig liten så betyr ikkje det at vi ikkje kan ha debatt i noreg,5307.5,5336.9,29.399999999999636,2012-11-15,2012-11-15_proceedings.txt
stortinget-20121115-095531_5336900_5357100,selvfølgelig ikke jeg mener for eksempel at det er på sin plass med en debatt om hvorvidt vi benytter handlingsrommet i eøsavtalen godt nok eee jeg tror at det helt sikkert er mulig å være mer proaktive eee enn det vi til tider er ta mer initiativ overfor eusystemet ha bedre mer opplyste offentlige debatter i norge både om enkeltdirekti,selvfølge ikke eg meiner for eksempel at det heilt på sin plass med ein debatt om kor vidt vi benyttar handlingsrommet i eøsavtalen godt nok eee ja eg trur at det heilt sikkert er mulig å vere meir proaktive eee enn det vi tte tider er ta medr initiativ overfor er systemet har betre meir opplyste offentleg debattar i noreg både om enkelte direkt,5336.9,5357.1,20.200000000000728,2012-11-15,2012-11-15_proceedings.txt
stortinget-20121115-095531_5357100_5384400,eee gitmarkstil tilnærming eee virka å være at vetoretten ikke er noe som er reelt at den ikke er noe som kan brukes at vi aldri skal utfordre at vi skal ta alt uten debatt det er helt fundamentalt uenig avtalen er ikke eee lagd av glass men vi må ha helt klart for oss hvilke utviklingstrekk i samfunnet vårt som kan knyttes til eøsavtalen og hvilke som ikke kan det jeg er av dem som er eee veldig bekymra for uter av norsk arbeidsliv,eee gitmarks til tilnærming eee verkar jo vere at eee vetoretten ikkje er noko som er reelt at ein ikkje noko som kan brukast at vi aldri skal utfordra at vi skal ta alt utan debatt ved er helt og fundamentalt ueinige avtalene er ikkje eee lagt av glass men vi må ha klart for oss kva utviklingstrekk i samfunnet vårt som kan knyttast til eøsavtalen og kva som ikkje kom det ja er av dei som er eee veldig bekymra for utler av norsk arbeidsliv,5357.1,5384.4,27.299999999999272,2012-11-15,2012-11-15_proceedings.txt
stortinget-20121115-095531_5384400_5414100,tar man for eksempel på sand hjelm bra ut og besøker en byggeplass så er det ganske hårreisende hva slags historier det er man får servert om vilkåra på de arbeids arbeidsplassene spesielt for utenlandsk innleid eee arbeidskraft og det er en utfordring som neppe kommer til å bli mindre med årene altså tvert imot den kommer til å bli større fordi at vi henter inn stadig større mengder arbeidskraft fra europa og det åpner for sosial dumping i et helt annet omfang enn det vi har vært vant til i norge men jeg hører ikke noen si at svaret på det er å stenge grensene,tar ein for eksempel på seg ein hjelm drar ut og besøker ein byggeplass så er det ganske hårreisande kva slags historie det er ein får servert om vilkåra på dei arbeids arbeidsplassane spesielt for utanlandsk innleid eee arbeidskraft og det er ein utfordring som neppe kommer til å bli mindre måla altså tvert imot det kommer til å bli større fordi at vi hentar inn stadig større mengder arbeidskraft frå europa og det opne for sosial dumping er til eit anna omfang enn det vi har vore vann til i noreg men eg høyrer ikkje nokon si at svaret på det er å stenge grensene,5384.4,5414.1,29.700000000000728,2012-11-15,2012-11-15_proceedings.txt
stortinget-20121115-095531_5414100_5437100,ingen og at folk fra fra våre naboland ikke lenger skal få komme til norge å jobbe sånn at dette vil være et utviklingstrekk helt uavhengig av eøs vi ønsker at naboene våre skal kunne jobbe hos oss og vi ønsker at nordmenn skal kunne jobbe og studere i danmark lithauen storbritannia men sosial dumping må bekjempes med solid eee lovverk den jobben gjør vi og vi skal fortsette å gjøre den,ingen og at folk frå eee frå vår naboland ikkje lenger skal få kome til noreg og jobbe son at dette vil vere eit utviklingstrekk heilt uavhengig av eøs vi ønsker at naboane våre skal kunne jobbe ho sass og vi ønsker at nordmenn skal kunne jobbe og studere i danmark litt au storbritannia men sosial dumping må bekjempes med solid eee lovverk den jobben gjer vi og vi skal fortsette å gjere den,5414.1,5437.1,23.0,2012-11-15,2012-11-15_proceedings.txt
stortinget-20121115-095531_5437100_5464700,to eee to pakker mot sosial dumping den tredje er varsla og det gjøres innafor rammen av eøsavtalenjeg skjønner bekymringa rundt at avtalen er dynamisk og man kan ikke garantere for alle framtidige dommer selvfølgelig ikke men eksemplene som utenriksministeren sjøl viste til med hjemfallsrett med differensiert arbeidsgiveravgift befi beviser at handlingsrommet er der og at vi er parat til å agere dersom vesentlige norske interesser blir og arbeidsmiljøloven,to eee to pakker mot sosial dumping den tredde er varsla og det gjerast innanfor rammene av eøsavtalen ja eg skjemmer bekymringar rundt at avtalen er dynamisk og ein kan ikkje garantere for alle framtidige domar selvfølge like men eksempla som utanriksministeren sjøl viste til med hjemfallsrett med ditransiært arbeidsgjevarav vist befi beviser at handlingsrommet er der og at vi er parat til å agere dersom vesentleg norske interesser blir og arbeidsmiljøloven,5437.1,5464.7,27.599999999999454,2012-11-15,2012-11-15_proceedings.txt
stortinget-20121115-095531_5464700_5483700,er en helt klart eee norsk interesse den største trusselen mot arbeidsmiljøloven handler om å få en ny høyrefrpregjering som ønsker et helt annet lovverk enn det vi gjør takk da er neste taler representanten peter n myhre deretter representanten steinar gulvo myhre vær så god,ein har klart eee norsk interesse men største trusselen mot arbeidsmiljøloven handlar om å få ein ny høgre og frp regjering som ønsker eit eit anna lovverk enn det vi gjer takkdå er neste talar representanten peter endmyr deretter representanten steinar gulvomyre ver så god,5464.7,5483.7,19.0,2012-11-15,2012-11-15_proceedings.txt
stortinget-20121115-095531_5490600_5517300,mange takk eee president la meg også få innledningsvis takke utenriksministeren for en grundig eee og god redegjørelse om viktige europapolitiske temaer gårsdagens demonstrasjoner ved en rekke euland viser med tydelighet at problemene i eu ikke er overi land som hellas og spania er folk fortørnet over at statskassen er tommester jobben,mange takk eee president la meg også få innledningsvis takke utanriksministeren for ein grundig eee og god redegjørelse om viktige europapolitiske tema gårsdagens demonstrasjon ved ein rekke euland viser med tydelegheit at problema i eu ikkje er overi land som hellas så spann ja er folk fortørna over at statskassen er tomestar jobben,5490.6,5517.3,26.699999999999818,2012-11-15,2012-11-15_proceedings.txt
stortinget-20121115-095531_5517300_5546900,videre protesterer de mot at långiverne stiller krav om en bedre økonomistyring når nye kriselån skal deles ut på den annen side reagerer folk med harme i euroland som har greid seg rimelig bra som tyskland østerrike nederland og for så vidt frankrike der har folk og ikke helt uten grunn inntrykk av at det er de som nå skal betale prisen for årevis med uansvarlig økonomisk politikk i de sydeuropeiske landene,vidare protesterer dei mot at långivarane stiller krav om ein betre økonomistyring når nye kriselån skal delest ut på den nsida reagerer folk med harme i euroland me har greie seg rimeleg bra som tyskland østerrike nederland og for så vidt frankrike der har folk og ikkje heilt utan grunn inntrykk av at det er dei som oss skal betale prisen for årevis med uansvarleg økonomisk politikk i dei sydeuropeiske landet,5517.3,5546.9,29.599999999999454,2012-11-15,2012-11-15_proceedings.txt
stortinget-20121115-095531_5548500_5578500,utenriksministeren henviste tirsdag til at norge er et unntak i europa med overskudd i statsøkonomien høy sysselsetting og penger på bok og det er for seg riktig i dag sa utenriksministeren at dette skyldes at dette er på grunn av trygg styring det er nok bare delvis riktig den viktigste årsaken til at det går bra med norge er de enorme olje og gassinntektene våre hadde vi ikke hatt dem,utanriksministeren henviste ti stad til at noreg har eit unntak i europa med overskot i statsøkonomien høg sysselsetting og penge på bok og det er i og for seg riktig i dag sa utanriksministeren at dette skyldes at dette er på grunn av trygg styring det er nok eee berre delvis riktig det viktigaste årsaken til at det går bra med noreg er dei enorme olje og gassinntektene våre hadde vi ikkje hatt dei,5548.5,5578.5,30.0,2012-11-15,2012-11-15_proceedings.txt
stortinget-20121115-095531_5578500_5607900,ville offentlig virksomhet som vi nå venner oss til å finansiere over statsbudsjettet ikke vært mulige det er sikkert en overdrivelse president men når noen sier at hellas er lik norge minus olje så er det ikke helt på jordet norge er nemlig sårbart dersom eulandenes etterspørsel etter norske eksportprodukter som olje gass teknologi og fisk avtar,ville offentleg virksomhet som vi no vender oss til å finansiere over statsbudsjettet ikkje vore mulig det er sikkert ein overdrivelse president men når nokon seier at helles er lik noreg minus olje så er det ikkje heilt på jordenoreg er nemleg sårbart dersom eulandets etterspørsel etter norske eksportprodukter som olje gass teknologi og fisk avtar,5578.5,5607.9,29.399999999999636,2012-11-15,2012-11-15_proceedings.txt
stortinget-20121115-095531_5607900_5636900,det må vi ta på alvor nå er tiden inne for å ha is i magen og vett i pannen og stå imot kravene om bevilgninger til alle typer velmente formål bedre er det om vi kan bruke denne gylne sjanse som vi nå har til å investere i fremtiden bygge opp infrastrukturen og gjøre norge robust for å tåle andre og dårligere rammebetingelserpresident eøs er bærebjelken i norges økonomiske forhold til europa,det må vi ta på alvor no har tiden inne for å ha is i magen og vette pannen og stå imot krava om bevilgninga til alle typer velmente formål betre er det om vi kan bruke denne gyllene sjanse som vi no har til å investere i framtiden bygge opp infrastrukturen og gjere noreg robust for å tåle andre og dårlegare rammebetingelserpresident eus er berebjelken i noregs økonomiske forhold til europa,5607.9,5636.9,29.0,2012-11-15,2012-11-15_proceedings.txt
stortinget-20121115-095531_5637000_5666900,det er en samlet opposisjon enig om deler av regjeringen er også enig i det men eee eøsdebatten i norge foregår ikke i denne sal den foregår først og fremst i regjeringskontorene eee to av regjeringens tre partier ønsker altså rett og slett å si opp hele eøsavtalen uten,det er ein samla opposisjon einig om deler av regjeringa er også einig i det men eee eøsdebatten i eee noreg foregår ikkje i denne sal den foregår først og fremst i regjeringskontora eee to av regjeringas tre partia ønsker altså rett til å slept til å seie opp heile eøsavtalen utan,5637.0,5666.9,29.899999999999636,2012-11-15,2012-11-15_proceedings.txt
stortinget-20121115-095531_5666900_5695500,eee å kunne ha noen forsikring om hva vi får i steden jeg må si det minner i hovedsak om kanskje mer enn noe annet at de ønsker å være med og spille men de synes spilleregler er noe tull med en sånn strategi for å søke et samarbeid med europeiske land så har det klart eee at regjeringen har et problem dette har jo slått seg ute slått ut på mange måter hvor jeg nevner et eksempel eøsavtalens artikkel nummer nitten,eee og kunne ha nokon forsikring om at vi får i staden eg må si det minner i hovudsak om kanskje meir enn noko anna at dei ønsker å vere med å spille men del synest spillereglar er notullmed ein sånn strategi for å søke eit samarbeid med europeiske land så er det klart eee at regjeringa har eit problem dette har jo slått saue slått ut på mange måtar og eg nemner eit eksempel eøsavtalens artikkel nummer nitten,5666.9,5695.5,28.600000000000364,2012-11-15,2012-11-15_proceedings.txt
stortinget-20121115-095531_5695500_5724200,den slår fast at norge og eu skal fortsette sine bestrebelser på en gradvis liberalisering av handelen med landbruksvarer når det står i artikkel nitten at vi skal fortsette våre bestrebelser så blir det kanskje litt rart for denne typen bestrebelser har det vært veldig lite av i et møte mellom utenriks og forsvarskomiteen og en delegasjon fra euparlamentet den enogtjuende februar i år så ble det fra eu hold gitt uttrykk for sterk misnøye,den slår fast at noreg og eu skal fortsette sine bestremelser på ein gradvis liberalisering av handel med landbruksvarer når det står i artikkel nitten at vi skal fortsette vore bestrebelser så blir det kanskje litt rart fordi denne typen bestrebelser har vore veldig lite av i eit møte mellom mutings og forsvarskomiteen og ein delegasjon frå euparlamentet den eine og tjuende februar i år så blei det frå euhald gitt uttrykk for sterk misnøye,5695.5,5724.2,28.699999999999818,2012-11-15,2012-11-15_proceedings.txt
stortinget-20121115-095531_5724200_5751000,med fremdriften i dette arbeidet de etterlyste mere regularitet i møtene eee i ekspertgruppene slik at vi kan eee komme videre i dette spørsmålet norge har allerede fått god tilgang når det gjelder eksport av mat til eu i form av fiskeeksport eee og norsk politikk når det gjelder import av matvarer oppfattes i eu som vesentlig prk,med fremdriften i dette arbeidet dei etterlyste meir regloaritet i møtene eee i ekspertgruppene slik at vi kan eee komme vidare i dette spørsmålet noreg har allereie fått god tilgang når det gjeld eksport av mat til eu i form av fiskeeksport eee og norsk politikk når det gjeld import av matvarer oppfattast i eu som vesentleg prk,5724.2,5751.0,26.800000000000182,2012-11-15,2012-11-15_proceedings.txt
stortinget-20121115-095531_5751000_5780300,men president mer frihandel med var med matvarer vil gi norske forbrukere et bedre utvalg mer mangfold mere kvalitet og lavere priser derfor er dette tatt med eøsavtalen dette er jo kjempebra videre vil det gi eu et etterlengtet teks eksportmarked og den norske stat kan redusere landbrukssubsidiene og bruke pengene til noe mer konstruktivt altså en fordel både for folk flest i eu og for våre respektive statskasser jeg utfordrer derfor utenriksministeren,men president meir frihandel med vare med matvare vil gi norske forbrukarar eit betre utval mer mangfold mer kvalitet og lavere priser derfor har dei ikkje tatt med eøsavtalen dette au kjempebra vidare vil det gi eu eit etterlengta tekts eksportmarked og den norske stat kan redusere landbruksoppsideene og bruke pengar til no mer konstruktivt altså ein fordel både for folk flest i eu og for våre respektive statskasse ja eg utfordrar derfor utanriksministeren,5751.0,5780.3,29.300000000000182,2012-11-15,2012-11-15_proceedings.txt
