file,text_bm,text_nn,start,end,duration,date,proceedingsfile
stortinget-20121115-095531_13403400_13429900,eee slutter eee slutter seg ikke til forslaget fra eee fremskrittspartiet men vi er glade for at også frp erkjenner behovet for et ankerfestet økonomien og vi er glade for at de fire ikkesosialistiske partiene stiller seg bak i at bruken av oljeinntektene er helt avgjørende for vår evne til å bære velferden i årene som kommer neste taler er representanten geir ketil hansen og deretter magnhild,eee slutt eee slutter seg ikkje til forslaget frå eee framstegspartiet men vi er glade for at også frp er kjenner behovet for eit ankefest og økonomien og vi er glade for at dei fire ikkjesosialistiske partia stiller seg bak i at bruken av oldeinntektene er heilt avgjerande for å vere evne til å bere velferda i ordna som kommerneste talar er representanten gei ketil hansen og deretter magnill,13403.4,13429.9,26.5,2012-11-15,2012-11-15_proceedings.txt
stortinget-20121115-095531_13432400_13434800,,top,13432.4,13434.8,2.399999999999636,2012-11-15,2012-11-15_proceedings.txt
stortinget-20121115-095531_13439700_13463600,qqq ja president eee vi diske vi diskuterer altså et forslag fra fremskrittspartiet om et nytt ankerfeste for den økonomiske politikken hvor handlingsregelen for bruk av oljeinntekter skal erstattes med en ny modell hvor penger skal gå til investeringer mer penger til så til investeringer mindre penger til drift som det heter,ja president eee vi disk i skute altså eit forslag frå framstegspartiet om eit nytt ankerfeste for den øko økonomiske politikken kor handlingsregelen for bruk av oljeinntekter skal erstattast med ein ny modell kor pengar skal gå til investeringar meir pengar til sovel investeringar mindre pengar til drift som det heiter,13439.7,13463.6,23.899999999999636,2012-11-15,2012-11-15_proceedings.txt
stortinget-20121115-095531_13463600_13489600,og økte bevilgninger til investeringer skal i hovedsak knyttet til samfunnsøkonomisk lønnsomme investeringer og det betyr da at mindre penger skal gå til samfunnsøkonomisk såkalt ulønnsomme investeringer president det er mye en ku en kunne ha sagt om f om dette forslaget men det er forslag om et nytt ankerfeste i realitet et nytt ankerfeste for mer bruk av penger i statsbudsjettet og samtidig en ty,og økte bevilgninger til investeringar skal er i hovudsak knytt til samfunnsøkonomisk lønnsame investeringar og det betyr det at mindre pengar skal gå til samfunnsøkonomisk såkalla ulønnsame investeringar president er mer en kule ein kunne ha sagt om få om dette forslaget men det er forslag om eit nytt ankefeste i realiteten eit nytt ankefeste for meir bruk av pengar i statsbudsjettet og samtidig ein t,13463.6,13489.6,26.0,2012-11-15,2012-11-15_proceedings.txt
stortinget-20121115-095531_13489600_13516200,eee skal gå til det som da defineres som økonomisk lønnsomt hva er så eee samfunnsøkonomisk lønnsomme investeringer eee på samferdselssektoren president som vi ofte debatterer i denne salen og som vi skal nå snart debattere i forbindelse med nasjonal transportplan så blir berek så blir begrepet nytte kost brukt i tilknytning til investeringer samfunnsøko og det er da samfunnsøkonomisk onge,eee skal gå til det som da definerast som økonomisk lønnsamt kva er så eee samfunnsøkonomisk lønsam investeringar eee på samferdslesektoren president som vi ofte debatterer i denne salen og som vi skal no snart debatter i for viss med nasjonal transportplan så blir vi det så blir grepet nytte kost brukt i tilknyting til investeringar og samfunnsøko de og det er da samfunnsøkonomisk oange,13489.6,13516.2,26.600000000000364,2012-11-15,2012-11-15_proceedings.txt
stortinget-20121115-095531_13516200_13542300,investeringer som kommer gjennom det nå nåløyet på plussida det er de store samferdselsinvesteringene rundt de store eee byene oslo bergen trondheim og stavanger resten av landet og det er ikke bare noen få veier det er oppi nord som tybtybringgjedde eee kalte for det er resten av landet kommer ikke gjennom dette nåee så i realiteten så,investeringar som kommer gjennom det nå nårøye på plussida det er dei store samferdsinvesteringan rundt dei store eee byane oslo bergen trongeråstavwanger resten av landet og det er ikkje berre nokon få vegar der oppe i nord som tyb tybringgjedde eee kallt det føl det er resten av landet kommer ikkje gjennom dette nåden eee qqq så i realiteten så,13516.2,13542.3,26.099999999998545,2012-11-15,2012-11-15_proceedings.txt
stortinget-20121115-095531_13542300_13570600,på på samferdselssektoren men også på andre større tunge investeringsområder vil i realiteten være en markant sentralisering av eee budsjettet av pengebruken i i dette landet qqq det og det bør fremskrittspartiet komme frem å fø og fortelle hvilken an vi hvordan skal man kutte i investeringer i resten av landet for eksempel innenfor samferdselssektoren hva så,på på samferdssektoren men også på andre større tunge investeringsområde vil realiteten vere ein markant sentralisering av eee budsjettet av pengebruken i dette landet det og det bør framstegspartiet komme fram og få å fortelje kva an vorda skal ein kutte i investeringar i resten av landet for eksempel innanfor samferdselssektoren kva så,13542.3,13570.6,28.30000000000109,2012-11-15,2012-11-15_proceedings.txt
stortinget-20121115-095531_13570600_13599100,president at det skal brukes mindre av oljepenger på drift for det er jo også en klar føring i i i budsjektetsjettet meld på investering mindre på drift hva er så drift i statsbudsjettet jo det er driften av sykehus det er driften av jernbane det er driften av vei det er overføring til kommunesektoren det er eldreomsorg det er barn og videregående skole det er barnehager og så videre det bygging av velferdsstaten vi snakker om betydelig mindre penger skal brukes på dette,president at det skal brukast mindre av oljepengar på drift for det er jo også ein klar føring i i budsjet budsjettet med på investeringa mindre på drift kva er så drift i statsbudsjettet jo det er driften av sjukehus det er driften av jernbane det er driften av veg det er overføring til kommunesektoren det er eldreomsorg det barn og vidaregåande skole det barnehagar og så vidare det er bygging av velferdsstaten vi snakkar om betydeleg mindre pengar skal brukast på dette,13570.6,13599.1,28.5,2012-11-15,2012-11-15_proceedings.txt
stortinget-20121115-095531_13599200_13625000,og det betyr store kutt i budsjett budsjettene til disse formålene hvor skal fremskrittspartiet kutte når vi samtidig tar med at fremskrittspartiet foreslår store skatte og avgiftslettelser i størrelsesorden opptil hundre milliarder over en fireårsperiode så får fremskrittspartiet et stort forklaringsproblem et stort forklaringsproblem som jeg håper at de i den her debatten kan være med å bidra til å oppklare hvordan skal dette henge sammen,og det betyr store kutt i budsjet budsjetta til desse føremåla kor skal framstegspartiet kutte når vi samtidig ta med at framstegspartiet føreslår store skatter og avgiftslettelser i størrelsesorden opp til hundre milliardar over ein fireårs periode så får framstegspartiet eit stort forklaringsproblem eit stort forklaringsproblem som eg håpar at i den her debatten kan vere med og bidra til å oppklare korleis skal dette henge saman,13599.2,13625.0,25.799999999999272,2012-11-15,2012-11-15_proceedings.txt
stortinget-20121115-095531_13625000_13654200,derfor så er president et forslag om et nytt ankerfeste for den økonomiske politikken sånn som er presentert i realiteten et forslag om å redusere pengebruken til drift av skole til drift av sykehus til drift av universiteter og samtidig en omlegging av en investeringspolitikken fra å bruke dem over hele landet til i hovedsak å bruke pengene på de sentrale strøket dette dette landet en storstilt forslag om en storstilt sentralisering president jeg er glad for at fremskrittspartiet,derfor så er president eit forslag om eit nytt ankerfeste for den økonomiske politikken sånn som er presentert i realiteten eit forslag om å redusere pengebruken til drift av skole til drift av sjukehus til drift av universiteta og samtidig ein omlegging av invest investeringspolitikken frå å bruke dei over heile landet til i hovudsak å bruke pengar på dei sentrale strøk i dette dette landet er ein storstilt forslag med storstil sentralisering president eg glad for at framstegspartiet,13625.0,13654.2,29.200000000000728,2012-11-15,2012-11-15_proceedings.txt
stortinget-20121115-095531_13654200_13682300,er aleine om dette forslaget så langt men jeg forventer at de samarbeidspartiene de partiene som skal samarbeide med fremskrittspartiet i denne fireårsperioden eee er veldig klar og tydelig på at dette er en politikk de ikke går inn på og det forventer jeg at det blir gitt en avklaring på en tydelig avklaring langt tydeligere enn det representanten sanner fra komp kom med i sitt innlegg eee i den i den videre debatt og jeg er glad for at regjeringa og regjeringspartiene overhodet ikke,er aleine om dette forslaget så langt men eg forventar at dei samarbeidspartia dei partia som skal samarbeide med framstegspartiet i denne fire årsperioden eee er veldig klar og tydeleg på at dette er ein politikk dei ikkje går inn på og det forventar eg at det blir gitt ein avklaring på ein tydeleg avklaring langt tydeleg enn det representanten zaneta kom kom med i sitt innlegg eee i den i den vidarodebatt og eg er glad for at regjeringa regjeringspartia overhode ikkje,13654.2,13682.3,28.099999999998545,2012-11-15,2012-11-15_proceedings.txt
stortinget-20121115-095531_13682300_13693100,eee vil nærme seg de tankene som er fremma i dette forslaget takkneste taler er representanten magnild meltvet kleppe og deretter hans olav syversen,eee vil nærme seg dei tankane som er fremma i dette forslaget takkneste talar er representanten magnild meltvedt kleppa og deretter hans ola syversen,13682.3,13693.1,10.800000000001091,2012-11-15,2012-11-15_proceedings.txt
stortinget-20121115-095531_13703000_13728100,mehl tvert lippe vær så god president eee prinsippet for innfasing av oljepenger i økonomien er et av de største og mest prinsipielle spørsmålene vi behandler i norsk politikk eee det er underfallende at der er et så bredt flertall på stortinget som samla seg i å avvise fremskrittspartiets forslag om ledje handlingsregelen til sies,me kva klippa a s godpresident prinsippet for innfasinga av oljepengar i økonomien er eitt av dei største og mest prinsipielle spørsmåla me behandlar i norsk politikk eee det er gjennefallande at det er eit så breitt fleirtal på stortinget som samlar seg i å avvise framskrittspartiets forslag om å leggje handlingsregelen til sides,13703.0,13728.1,25.100000000000364,2012-11-15,2012-11-15_proceedings.txt
stortinget-20121115-095531_13728100_13756600,det er så viktig at jeg vil å sitere fra innstillinja flertallet understreker at handlingsreglen er mer enn en økonomisk krittstrek det er en samfunnskontrakt mellom politikere og det norske folk som vekslene regjeringa har forholdt seg til over tid flertallet viser til at vekslen regjeringa siden totusenogen har brukt elleve år på å bygge opp handlingsregelens legitimitet og troverdighet,det er så viktig at eg vil å sitera ifrå innstillinga fleirtalet understrekar at handlingsreglane er mer enn ein økonomisk krittstrek det er ein samfunnskontrakt mellom politikarar og det norske folk som vekslende regjeringa har forholdt seg til over tid fleirtalet viser til at vekslende regjeringa sidan totusenog ein har brukt elleve år på å bygge opp handlingsregelens legitimitet og truverdighet,13728.1,13756.6,28.5,2012-11-15,2012-11-15_proceedings.txt
stortinget-20121115-095531_13756600_13784000,den troverdigheten må ikke skusles bort dette er tydelig tale eee det må leses som et ultimatum ifra fremskrittspartiet sine samarbeidspartnere om hvem som skal styre scooter i ei eventuell fremskrittsparti høyre regjering når kursen for den økonomiske politikken skal trekkes oppså til hva fremskrittspartiet vil si i stand folingsregelen,den troverdigheten må ikkje skuslast bort dette er tydeleg tale eee det må lesast som eit ultimatum frå framskrittspartiet sine samarbeidspartnarar om kvin som skal styrast ute i ei eventuell framskrittspartiet høgre regjering når kursen for den økonomiske politikken skal trettet opp så til kva framstegspartiet vil setja i stand flingsreglen,13756.6,13784.0,27.399999999999636,2012-11-15,2012-11-15_proceedings.txt
stortinget-20121115-095531_13784000_13813000,her slår det jo delvis inn åpne dører ved å meine at jeg siterer samfunnsmessige lønnsomme investeringer i blant annet infrastruktur sitat slutt skal prioriteres fra senterpartiet si side er vi fullt uenig i at en rikdom vi nå er så heldig å disponere må komme framtida til gode det gjør vi både ved å spare oljepenger gjennom statens pensjonsfond utland og,her slår det jo delvis inn opne dørar ved og meiner at eee eg siterer samfunnsmessige lønsame investeringar i blant anna infrastruktur sitat slutt skal prioriterast frå senterpartiet si side er me fullt ut einige i at den rigdom men nå er så heldige å disponera må komme framtida til gode det gjer me både ved å spara oljepengar og gjennom statens pensjonsfond utland og,13784.0,13813.0,29.0,2012-11-15,2012-11-15_proceedings.txt
stortinget-20121115-095531_13813000_13839600,ved å bygge ut en infrastruktur som gir grunnlag for å ta hele norge i bruk gjennom verdiskaping og bosejingden raugrønne regjering ja kan være stolt av si satsing på infrastrukturene vei bane og breiban vi leverte i totusenogen ei nasjonal totusenogni en nasjonal transportplan som forutsetter bevilgningsvekst på hundre milliarder kronerfram,ved å byggja ut ein infrastruktur som gir grunnlag for å ta heile noreg i bruk gjennom verdiskaping og busetjing denne raudgrøne regjeringa kan vere stolt av si satsing på infrastruktur gjennom veg bane og breiban me leverte i totusenogein ei nasjonal totusenogni ein nasjonal transportplan som forutsette bevilgningsvekst på hundre milliardar kronerfram,13813.0,13839.6,26.600000000000364,2012-11-15,2012-11-15_proceedings.txt
stortinget-20121115-095531_13839600_13868200,en plan som kan oppsummere de siste fire åra med ei over oppfylling av ramma og jeg er sikker på eee som og har tilsvarende ambisiøse mål for neste fire årsperiode den raugrønne gjer regjeringa kan altså så lang summere opp med at eee de med de veianlegg som er enten åpna for trafikk,ein plan som kan oppsummera dei siste fire åra med ei over oppfylging av rammar og eg er sikker på eee som og har tilsvarande ambisiøse mål for neste fire års periode den raudgrøne regjeringa kan altså så langt summera opp med at eee eee dei med dei veganlegg som er enten opnar for trafikk,13839.6,13868.2,28.600000000000364,2012-11-15,2012-11-15_proceedings.txt
stortinget-20121115-095531_13868200_13897900,e ona buing eller har oppstart i nær framtid så er det brukt for eksempel tusen kilometer med ny riksvei det tilsa av strekning i stavanger oslo trondheim det er og slik at eee adle igangsetter jernbaneprosjekt når de er ferige så vil det være hundre kilometer med dobbeltspora jernbane og det er slik at i dag president så går over nitti prosent,er under bygjing eller har oppstart i nær framtid så er det bygt for eksempel tusen kilometer med ny riksveg det tilsara strekning stavangar oslo trondheim det er og slik at adle i gang sett jernbaneprosjekt når dei er ferdige så vil det var hundre kilometer med dobbeltspora jernbane og det er slik at i dag president så går over nitti prosent,13868.2,13897.9,29.69999999999891,2012-11-15,2012-11-15_proceedings.txt
stortinget-20121115-095531_13897900_13927100,av persontoø i rute jeg nevner dette for å understreke at fremskrittspartiet trenger ikke å vrake handlingsregelen for å delta i ei satsing på infrastruktur så til det neste elementet i fremskrittspartiet sitt nye ankerfeste eee vi merker oss jo president eee sanner sin mikkelede over at fremskrittspartiet faktisk nå da har funnet et ankerfeste,av persontoga i rute eg nemner dette for å understreke at fremskrittspartiet tenk kje å raka handlingsregelen for å delta i ei satsing på infrastruktur så til det neste elementet i framstegspartiet sitt nye ankarfeste eee me merkar jo president eee sama sin glede over at framstegspartiet faktisk nå då har funne eit ankerfeste,13897.9,13927.1,29.200000000000728,2012-11-15,2012-11-15_proceedings.txt
stortinget-20121115-095531_13927100_13955800,men til det andre elementet eee de vil altså begrense oljepengebruken som går til varig statlig forbruk i dette så forstår jeg at høyre og venstre stiller på lag men at krf reserverer seg hva sa en egentlig like begrepet statlig forbruk det blir jo noe til først men det ligger nær å tru at en ikke ønsker å fortelle,men til det andre elementet eee dei vil altså begrensa oljepengebruken som går til vare i statleg forbruki dette så forstår eg at høgre og venstre stiller på lag men at krf reserverer seg kva som ein eigen lik ligge begrepet statleg forbruk det blir jo noko defust men det ligg nære å tru at ein ikkje ønskjer å fortelja,13927.1,13955.8,28.69999999999891,2012-11-15,2012-11-15_proceedings.txt
stortinget-20121115-095531_13955800_13985800,eee som sant er at redusert statlig forbruk det kan fort dreie seg om reduserte ambisjoner for satsing på barn og eldre det er jo nettopp disse gruppene som særlig har nytt godt av auka budsjettet i denne regjeringa sin arbeidsperiodeneste taler er representanten hans olav syversen deretter borgild tenden,eee som sant er at redusert statleg forbruk det kan fort reia seg om reduserte ambisjonar for satsing på barn og eldre det er jo nettopp desse gruppene som særleg har nyttgodta auka budsjettet i denne regjeringa sin arbeidsperiodeneste talar er representanten hans olav sivertsen deretter borge tenden,13955.8,13985.8,30.0,2012-11-15,2012-11-15_proceedings.txt
stortinget-20121115-095531_13992400_14021000,ja president det ble mye vei og jernbane i siste innlegg det var kanskje ikke så overraskende men tidligere samferdselsminister eee når det gjelder selve representantforslaget fra frp så er jeg fra et parti som er veldig begeistret for ankerfester kanskje var en litt annen karakter ofte enn det som er beskrevet i i dette representantforslaget men jeg også merker meg jo at,president det blei mye veg og jernbane i siste innlegg det var kanskje ikkje så overraska over ein tidlegare samferdselsminister eee når det gjeld det selve representantforslaget frå frp så er eg ei frå eit parti som er veldig begeist for ankerfeste kanskje var ein litt annan karakter ofte enn det som er beskrive i i dette representantforslaget men ja og så merker meg jo at,13992.4,14021.0,28.600000000000364,2012-11-15,2012-11-15_proceedings.txt
stortinget-20121115-095531_14021000_14050100,at frp her eee peker på nødvendigheten å ha et ankerfeste for den økonomiske politikken det ser vi positivt på fra krfs side så benytter jeg denne anledningen både til å minne om vår tilslutning til og si at det fortsatt er nødvendig eee at vi oppebærer en langsiktig økonomisk politikk og vi ser faktisk pensjonsfondet eller oljefondet om man vil,at frp her eee peiker på nødvendigheten å ha eit ankerfeste for den økonomiske politikken det ser vi positivt på frå krfside så benytter eg denne anledninga både til å minne om vår tilslutning til og si at det fortsatt er nødvendig eee at vi oppeberer ein langsiktig økonomisk politikk og vi ser faktisk pensjonsfondet eller oljefondet om ein vil,14021.0,14050.1,29.100000000000364,2012-11-15,2012-11-15_proceedings.txt
stortinget-20121115-095531_14050100_14070600,som en viktig del av dette og handlingsregelen som en vesentlig faktor for å ha orden i norsk økonomi og her er eee det stor enighet eee i denne sal stort sett samtidig,som er ein viktig del av dette og handlingsreglane som er ein vesentleg faktor for å ha orden i norsk økonomi og her er eee det er stor einigheit eee i denne sal stort sett samtidig,14050.1,14070.6,20.5,2012-11-15,2012-11-15_proceedings.txt
stortinget-20121115-095531_14070600_14095300,enig med representanten sanner i at eee en ting er jo bruke altså eee omfanget av hvor mye vi faser inn av oljepenger i norsk økonomi en helt annen ting er jo hvordan vi bruker disse pengene og vi la oss ikke underslå da at vi var enige om hva eee innfasingen av oljepenger hva det skulle gå til i totusenogen,einige med representanten sanner i at eee ein ting er jo bruk altså omfanget av og mye vi faser inn av oljepengar i norsk økonomi ein heilt annan ting er ola vi bruker desse pengane og vi la oss ikkje underslå det at vi var ei einige om kvar eee innfasinga av oljepengar i var det skulle gå til i totusenog ein,14070.6,14095.3,24.69999999999891,2012-11-15,2012-11-15_proceedings.txt
stortinget-20121115-095531_14095300_14120700,nemlig bedre infrastruktur tiltak for å bringe fram ny kunnskap gjennom forskning og utvikling bidra til å styrke vekstevnen og eee dermed også trygge grunnlaget for de offentlige velferdsordninger dette er jo elementer som en kan spørre seg hvordan eee skiftende regjeringer har oppfylt jeg vil vel si at bondevik iiregjeringen var ganske god til det,nemleg betre infrastruktur tiltak for å bringe fram ny kunnskap gjennom forsking og utvikling bidrag til å styrke vekstevnen og eee dermed også trygge grunnlaget for dei offentlege velferdsordningar dette er jo elementer som ein kan spørje seg vor ein eee skifte regjeringa har eee oppfylt eg vil vel si at bonden wiktoregjeringa var ganske god til det,14095.3,14120.7,25.400000000001455,2012-11-15,2012-11-15_proceedings.txt
stortinget-20121115-095531_14120700_14146700,nå er det nok litt mer de først hva oljekronene egentlig går til bortsett for at de går til ulike gode formål innenfor våre budsjetter og hvorfor er det så viktig med både pensjonsfond og handlingsregel det beste eksemplet vi vel har i europa på viktigheten av det er å se til,nå er det nok litt meir difust va oljekronene eigentleg går til bortsett frå at dei går til ulike gode formål innanfor våre budsjetter og kvifor er det så viktig med både pensjonsfond og handlingsregel det beste eksempelet vi vel har i europa på viktigheten av det er å se til,14120.7,14146.7,26.0,2012-11-15,2012-11-15_proceedings.txt
stortinget-20121115-095531_14146700_14172400,forvaltet sine gassressurser på slutten av syttitallet der innfaset man pengene meget raskt i økonomien og eee man fikk når eee inntektene falt eee også en kollaps delvis i nederlandsk økonomi som i fagtermer nå betegnes som den hollandske syke det er eee den,på vatet sine gassressursar på slutten av syttitalet der innfase ein penne meg eit raskt i økonomien og ein fekk når eee inntektene falt eee også ein kollaps delvis i nederlandsk økonomi som i fagterme no beteiknast som den hollandske psyket det er eee den,14146.7,14172.4,25.69999999999891,2012-11-15,2012-11-15_proceedings.txt
stortinget-20121115-095531_14172400_14200800,det bakteppet vi må ha med oss når eee det angripes fra ulike hold eee for hvordan vi behandler vårt fond og eee handlingsregelen og la oss heller ikke unnslå i hvert fall har jeg opplevd det når finanskomiteen er ute på våre reiser og møter våre kolleger og finansinstitusjoner med mer så er vel ganske unison ros av norge og forvaltningen av eee våre,det bakteppet vi må ha med oss når eee det angripast frå ulike hald eee for vore vi behandlar vårt fond og eee handlingsreglane las eller ikke unsa i kvart fall har eg opplevde når finanskomiteen er ute på våre reiser og møter våre kolleger og finansinstitusjoner med mer så er det vel ganske unison ros av noreg og forvaltninga av eee våre,14172.4,14200.8,28.399999999999636,2012-11-15,2012-11-15_proceedings.txt
stortinget-20121115-095531_14200800_14223100,eee naturressurser som eee har en såpass klar ramme som de har og rammen i seg selv er viktig om det er tre eller fire prosent på handlingsreglen det kan man diskutere men det å vite i markedene at man har en slik regel det er vel i seg selv eee viktig president,eee naturressursar eee som eee har ein såpass klar ramme som dei har og rammene i sel er viktig om det er tre eller fire prosent på handlingsreglane det kan ein diskutere men det er jo vite i markedene at ein har ein slik regel det er vel i ssel eee viktig president,14200.8,14223.1,22.30000000000109,2012-11-15,2012-11-15_proceedings.txt
stortinget-20121115-095531_14223100_14249900,det heter i et gammelt godt norsk eee ordtak det skal rygg til å bære gode dager president jeg tror det er grunnlaget for at det store flertallet her i denne sal har sluttet seg både til opprettelsen av et pensjonsfond og til en derpå følgende handlingsregeleneste taler e tenden,det heiter i eit gammelt eee godt norsk eee ordtak det skal god rygg til å bere gode dagar president eg trur det er grunnlaget for at det store fleirtalet her i denne sal har slutte seg både til opprettelsen hatt pensjonsfond og til ein dei påfølgande hamningsregelenneste talar e tenden,14223.1,14249.9,26.799999999999272,2012-11-15,2012-11-15_proceedings.txt
stortinget-20121115-095531_14249900_14266100,og deretter statsråd sigbjørn johnsen tenden vær så god takk for det president eee har vi brukt for et nytt ankerfeste i den økonomiske politikken eee mitt av venstres svar er nei,og deretter statsråd sigbjørn jensen ten a så godtakk for det president eee har vi bruk for eit nytt anke flest i den økonomiske politikken eee mitt og venstres svar er nei,14249.9,14266.1,16.200000000000728,2012-11-15,2012-11-15_proceedings.txt
