file,text_bm,text_nn,start,end,duration,date,proceedingsfile
stortinget-20121115-095531_268000_270400,qqq jeg så god,ke verså god,268.0,270.4,2.3999999999999773,2012-11-15,2012-11-15_proceedings.txt
stortinget-20121115-095531_274800_300100,stortingets møte er lovlig satt ærede medrepresentanter tidligere stortingsrepresentant håkon randal er død åttito år gammel håkon randal var født i eivindvik i sogn og fjordane av utdanning var han lærer og etter lærerskoleeksamen i nittenfemtitre,stortingets møte er lovleg sett er det med representantar tidlegare stortingsrepresentant håkon randal er dø åttito år gammal håkon randal var født i eivinvik i song og fjordane og utdanning var han lærar og etter lærerskoleeksamen i nittenfemtitre,274.8,300.1,25.30000000000001,2012-11-15,2012-11-15_proceedings.txt
stortinget-20121115-095531_300100_329800,hadde han forskjellige lærerstyringer før an i nittensekstifem ble ansatt som rektor ved bremnes ungdomsskole på bømlo og dramdal eee engasjerte seg raskt i politikk og kulturliv i bømlo og sund hordaland han var blant annet formann i bømlo høyre og i hordaland høgre han var medlem av høyres sentralstyre i åra nittenåtti til åttifire og eee da var han vise første viseformann i høyres,hadde han forskjellig lærarstyringa før han i nittensekstifem blei ansett som rektor ved bremnes ungdomsskule på bømerookodrandal engasjert seg raskt i politikk og kulturliv i bømlo og sunnhordaland han var blant anna formann i bømmelo høgre og i hordaland høgre han var medlem av høgre sentralstyre i åra nittenåttiåttifire da var han vise første viseformann i høyres,300.1,329.8,29.69999999999999,2012-11-15,2012-11-15_proceedings.txt
stortinget-20121115-095531_329800_356100,hovedorganisasjon i nittensyttitre ble han valgt til stortinget fra hordaland et verv han innehadde i tolv år til nittenåttifem sine to første perioder var andal medlem av kirke og undervisningskomiteen og markerte seg raskt som en av høyres ledende skolepolitikere med et sterkt engasjement for å sikre kvalitet i,hovudorganisasjoni nittensyttitre blei han valt til stortinget frå hordaland eit verv han innehadde i tolv år til nittenåttifem sine to første periodar var det antal medlemmer av kirke og unnvisningskomiteen og markert sei rask som ein av høyres ledande skolepolitikarar med eit sterkt angasjement for å sikre kvalitet i,329.8,356.1,26.30000000000001,2012-11-15,2012-11-15_proceedings.txt
stortinget-20121115-095531_356100_383400,han var blant annet formann for høyres skolepolitiske komite og han var medlem av høyres gruppestyre i perioden nittenåttien til åttifem var håkon randal formann i kommunal og miljøvernkomiteen medlem av den utvida utenriks og konstitusjonskomiteen som medlem av stortingets delegasjon til nordisk råd var han særlig opptatt av å styrke banna mellom n island,han var blant anna formann for høgres skolepolitiske komite og han var medlem av høgres gruppestyri perioden nittenåttiein til åttifem var håkon randolf formannen i kommunal og miljøvernkomiteen medlemer av den utvida utanriks og konstitusjonskomiteen som medlem av stortingets delegasjon til nordisk råd var han særleg opptatt av å styrke banna mellom ng island,356.1,383.4,27.299999999999955,2012-11-15,2012-11-15_proceedings.txt
stortinget-20121115-095531_383400_413100,han var vara president og fungerte som visepresident i stortinget i nittenåttifire ble håkon randal utnevnte fylkesmannen i hordaland dette embete innad i fjorten år da han gikk av med pensjon i nittennittiåtte både i og etter fylkesmannsperioden hadde randal en rekke tillitsver han var elevene engasjert i forsvarssaken og var president i norsk forsvarsforening i perioden totusenogen,han var vara president og fungerte som visepresident i stortinget i nittenåttifire blei håkon randal utnendtte fylkesmannen i hodaland dette embetet innehadde han i fjorten år der han gjekk av med pensjon i nittennittiåtte både i og etter fylkesmannsperioden hadde landa ein rekke tillitsval ha var levande engasjert i forsvarssaka og president i norsk forsvarsforening i perioden totusenogein,383.4,413.1,29.700000000000045,2012-11-15,2012-11-15_proceedings.txt
stortinget-20121115-095531_413100_441700,totusenogfem hans andre hovedinteresse var kultur han var en av initiativtagerne til de kirkehistoriske spiller på moster og tusenårsjubileet for kristendommen i norge i nittennitti han var sterkt medvirkende til etablering av sundhordaland senioruniversitet og senior høyre i hordaland og leder begge steder til synd,i totusenogfem hans andre hovudinteresse var kultur han var ein av initiativtakarane til dei kirkehistoriske spilla på moster og tusenårs jubileet for kristendommen i noreg i nittennittifemhan var sterkt medverkande til etablering av sunnhordaland senior universitet og senor høgre i hordaland og leder begge stader til syn,413.1,441.7,28.599999999999966,2012-11-15,2012-11-15_proceedings.txt
stortinget-20121115-095531_441700_465300,håkon randal var levende engasjert også som pensjonist han hadde en uslitelig pågangsvilje for den tinga han ville ha gjennomført han var en inspirator med stor utstråling og gjennomføringsevne vi takker håkon randal for hans virke og lyser fred over hans minne,bortganghoken randal var levande angasjert også som pensjonist og hatt ein uslitleg pågangsvilje for dei tinga han ville ha gjennomført han vare ein inspirator med stor utstråling og gjennomføringsevne vi takkar håkan randal for hans virke og lyse fred over hans minne,441.7,465.3,23.600000000000023,2012-11-15,2012-11-15_proceedings.txt
stortinget-20121115-095531_523600_526000,takk,takk,523.6,526.0,2.3999999999999773,2012-11-15,2012-11-15_proceedings.txt
stortinget-20121115-095531_535600_562300,fra arbeiderpartiets eee stortingsgruppe foreligger søknad om sjukepermisjon for representanten eirin sund fra og med femtende november og inntil videre den søknaden foreslås behandla straks og innvilga og det anses vedtatt fra første vararepresentant for rogaland fylke laila thorsen foreligger søknad om fritak for å møte i stortinget under representanten eirin sunds permisjon av velferdsgrunner den sla straks,frå arbeidarpartiets eee stortingsgruppe for ligge søknad om sjukepermisjon frå representanten eirin sund frå med femtende november og inntil vidare den søknaden foreslås behandla strags og innvilga og det anses vedtatt det første vararepresentant på rogaland filkelela torsen foreligge søknanden fritak for å møte i stortinget under representanten eirin sund permisjon av velferdsgrunner den sla straks,535.6,562.3,26.699999999999932,2012-11-15,2012-11-15_proceedings.txt
stortinget-20121115-095531_562300_590400,og innvilga og det anses vedtatt andre vararepresentant siv len strandskog foreslås innkalt for å møte i permisjonstida og det anses og vedtatt silens transkog er til stede og vil ta sete til behandling foreligger den eee saker som er oppført på dagsorden nummer seksten og før sakene på dagens kart tas opp til behandling vil presidenten opplyse om at møtet om nødvendig fortsetter utover klokka seksten null,og innvilga og det anses vedtatt andre vararepresentant siv len strandskog foreslås innkalt for å møte i permisjonstida og det anses og vedtatt siv len strandskog er til stede og vil ta sete til behandling foreligger de eee saker som er oppført på dagsorden nummer seksten og før sakene på dagens kart tas opp til behandling ved presidenten opplyse om at møtet om nødvendig fortsetter utover klokka seksten mulig,562.3,590.4,28.100000000000023,2012-11-15,2012-11-15_proceedings.txt
stortinget-20121115-095531_590400_619000,sak en er eee qqq innstilling eee fra valgkomiteen om suppleringsvalg til stortingets delegasjon for forbindelse med europaparlamentet ingen har bedt om ordet til sak en og debatten i sak en er dermed avslutta vi går til sak to som er debatt om utenriksministerens redegjørelse om viktig eu og eøssaker eee debatten blei eee,eee nøhlsak ein er det innstilling eee frå valkomiteen om suppleringsval til stortingets delegasjon for forbindelse med europaparlamentet ingen har bedt om ordet i sak en og debatten i sak en de er avslutta vi går til sak to som er debatt om utanriksministerens redegjørelse om viktig eu og eøs saker eee debatten blei e,590.4,619.0,28.600000000000023,2012-11-15,2012-11-15_proceedings.txt
stortinget-20121115-095531_619000_639900,talen ble holdt i stortingets møte trettende november tjuetolv etter ønske fra komiteen vil presidenten foreslå at debatten blir begrensa til en time og tredve minutter og taletida blir fordelt slik på gruppene arbeiderpartiet trettifem minutter fremskrittspartiet tjue minutter høyre femten minutter sosialistisk venstreparti fem minutter senterparti fem minutter kristelig folkeparem minutter,dalen blei holt i stortingets møte trettende november tjuetolv etter ønske frå komiteen vil presidenten foreslå at debatten blir begrensa til ein time og tredve minutter og taletida blir fordelt slik på gruppene arbeidarpartiet trettifem minutt fremstegspartiet tjue minutter høgre og femten minutter sosialistisk venstreparti fem minutter senterpartiet fem minutt til kristeleg folkeparem minuttar,619.0,639.9,20.899999999999977,2012-11-15,2012-11-15_proceedings.txt
stortinget-20121115-095531_639900_668200,videre vil presidenten foreslå at det blir gitt anledning til replikkordskifte på inntil seks replikker med svar etter innlegg fra medlemmer av regjeringa innenfor den fordelte taletid og videre blir det foreslått at dem som måtte tegne seg på talerlista utover den fordelte taletid får en taletid på inntil tre minutter og det anses vedtatt første taler er representanten svein roald hansen deretter representanten morten hauglund hansen vær så god,vidare vil presidenten foreslå at det blir gitt anledning til replikkordskifte på inter seks replikkar med svar etter innlegg frå medlem av regjeringa innan på den fordelte taletid og vidare blir det foreslått at dei som måtte ta inn seg på talarlista utover den fordelte taletid for ei taletid på inntil tre minutt og det anses vedtatt første talar er representanten svein roald hansen deretter representanten morten hauglund hansen ver så god,639.9,668.2,28.300000000000068,2012-11-15,2012-11-15_proceedings.txt
stortinget-20121115-095531_680300_709000,president jeg vil takke utenriksministeren for en god gjennomgang av utfordringene i europa hvor av mange også er våre utfordringer det er fortsatt mye som gir god grunn til bekymring selv om mye er gjort for å forhindre de aller alvorligste konsekvensene av krisen og igjen bygge et fundament for økonomisk eee vekst eøs har som utenriksministeren pekte på i sin redegjørelse vært rammen for vårt forhold til eu gjennom fem stortingsperioder og seks regjeringer,president eg vil takke utenriksministeren for ein god gjennomgang av utfordringa i europa vore av mange og som har våre utfordringar det er fortsatt mykje som gir god grunn til bekymring sjøl om mye har gjort for å forhindre dei aller alvorlegaste konsekvensane av krisen og gje ein bygge eit fundament for økonomisk eee vekst eøs har som utanriksministeren peikte på i sin redegjørelse vart rammen for vårt forhold til eu gjennom fem stortingsperioder og seks regjeringar,680.3,709.0,28.700000000000045,2012-11-15,2012-11-15_proceedings.txt
stortinget-20121115-095531_709000_732600,eøsavtalen vil fortsatt være grunnlaget for kommende perioder og regjeringer den har tjent oss godt slik regjeringen også slår fast i stortingsmeldingen om eøsavtalen over øvrige avtaler med eu det er den eneste avtaleform mellom eu og et naboland som sikrer at bedriftene konkurrerer innenfor et felles regelverk som gir nordmenn fri adgang til et europeisk arbeidsmarked,eøsavtalen vitt fortsatt vere grunnlaget for kommande perioder og regjeringar den har tent oss godt slik regjeringa også slå fast i stortingsmeldinga om eøsavtalen over øvrige avtaler med eu det er den eineste avtaleform mellom eu og eit naboland som sikrer at bedriftene konkurrerer innanfor eit felles regelverk som gir nordmenn fri adgang til eit europeisk arbeidsmarked,709.0,732.6,23.600000000000023,2012-11-15,2012-11-15_proceedings.txt
stortinget-20121115-095531_732600_762100,som i nordmenn som bosetter seg i andre europeiske land i deler av året eller fast sikkerhet for å bli behandlet som landets egne innbyggere i debatten om regler som ikke måtte vær som måtte være for dårlig tilpasset norske forhold må vi ikke glemme de muligheter og rettigheter denne avtalen gir norske bedrifter og personer i tretti europeiske land heller ikke må vi glemme at avtalen gir handlingsrom for å tilpasse regelverket slik vi har oppnådd mange ganger,som i nordmenn som busetter seg i andre europeiske land i deler av vår eller fast sikkerheit for å bli behandla som landets eigne innbyggarari debatten om reglar som ikkje måtte vere som måtte vere for dårleg tilpassa norske forhold må vi ikkje glemme dei muligheter og rettigheter denne avtalen gir norske bedrifter og personar i tretti europeiske land heller ikkje må vi gløyme at avtalen gir handlingsrom for å tilpasse regelverket slik vi har oppnådd mange gonger,732.6,762.1,29.5,2012-11-15,2012-11-15_proceedings.txt
stortinget-20121115-095531_762100_789000,det handlingsrommet skal vi fortsatt bruke når det er behov for det president av og til så tror jeg vi glemmer de krefter som driver fram nødvendigheten av internasjonalt samarbeid der den globale sammenvevingen av landets økonomi som skaper behov for felles kjørelege kjøle kjøreregler avtaler og samarbeidsstrukturer land imellom det er ikke omvendt når økonomien internasjonalen følge etter,det handlingsromma skal vi fortsatt bruke når det er behov for det president av og til så trur eg vi glemmer dei krefter som driv fram nødvendigheten av internasjonalt samarbeid der den globale samanvevinga av landets økonomi som skaper behov for felles køyreleg kjøle kjøreregler avtaler og samarbeidsstrukturar landar i mellom der ikkje omvendt når økonomien internasjonalen følge etter,762.1,789.0,26.899999999999977,2012-11-15,2012-11-15_proceedings.txt
stortinget-20121115-095531_789000_819000,det er hva felles regelverk avtaler og samarbeid handler om det må forplikte hvis det skal virke skal vi kunne velge over ake vil andre land ha rett til det samme og da fungerer det ikke president drømmen om å være utenfor for å slippe unna regler vi ikke liker er langt på vei en illusjon uansett hvilket avtaleforhold vi måtte ha til eu vil et land som selger mer enn to tredje av sine varer og tjenester til det indre marked,det var felles regelverk avtaler og samarbeid handlar om det må forplikta viss det skal virke skal vi kunne velje å vrake vil andre land ha rett til det same og da fungerer det ikkje president drømmen om å vere utanfor for å slippe unna regler vi ikke liker er langt på veg ein illusjon uansett kva avtaleforhold vi måtte ha til eu vil eit land som seljer meir enn to tredelar sine varer og tenester til det indre marked,789.0,819.0,30.0,2012-11-15,2012-11-15_proceedings.txt
stortinget-20121115-095531_819000_848400,måtte følge de standarder og regler som er satt for varer og tjenester ingen land heller ikke utenfor det indre marked for solgt en eneste liter kjemikalier i det europeiske markedet som ikke tilfredsstiller kravene i riksdirektivet på samme måte som verken japan eller sørkorea får solgt biler til norge hvis de ikke har bilbelte og herberg president ute i europa er det store utfordringen en økende arbeidsledighet her hjemme trenger vi arbeidskraft,måtte følge dei standarar og reglar som er satt for varer og tenester ingen land heller ikkje utanfor dei indre marked for selt den eineste liter kjemikaliar i det europeiske markedet som ikkje tilfredstiller krava i risdirektivet på same må måte som verken japan eller sørkorea for selt bilar til noreg viss dei ikkje har bilbelte og ervegpresident ute i europa er det store utfordringar i ein øka arbeidsledighet her hjemme treng vi arbeidskraft,819.0,848.4,29.399999999999977,2012-11-15,2012-11-15_proceedings.txt
stortinget-20121115-095531_848400_876400,statoil rekrutter ingenører i spania over hundre tusen har flyttet til oss fra østeuropeiske euland og fyller jobber som ellers ville stått ledige det er positivt men det skaper også utfordringer vi må sikre at de behandles som våre egne vi må unngå sosial dumping det har vi makter til nå innenfor et felles regelverk som i all hovedsak legger minstestandarder på arbeidsbetingelser dette hever standarden i mange land,statsråd rekrutteri ingsenører i spannia over hundre tusen har flytta til oss frå austeuropeiske euland og fyller jobber som elles ville stått ledige det er positivt men det skaper også utfordringar vi må sikre at dei behandlast som våre eigne vi må unngå sosial dumping det har vi makter til nå innanfor eit felles regelverk som i all hovudsak legg minstestandardar på arbeidsbetingelser dette er hever standarden i mange land,848.4,876.4,28.0,2012-11-15,2012-11-15_proceedings.txt
stortinget-20121115-095531_876400_904400,det er bra jo kortere avstand landene imellom gjor svakere grunnlag for sosial dumping innenfor avtalens rammer har vi gjennomført tretti tiltak mot sosial dumping og for et anstendig arbeidsliv truslene mot denne politikken president kommer ikke fra eøsavtalen den kommer fra en regjering hvor høyre og fremskrittspartiet bestemmer politikken en slik regjering ville ikke stått opp mot sosial dumping på denne må på den måten som den sittende regjering har gjort,og det er bra jo kortare avstand landet imellom jo svakare grunnlag for sosial dumping innanfor avtalens rammer har vi gjennomført tett i tiltak mot sosial dumping og for eit anstendig arbeidsliv tusen mot denne politikken president kommer ikkje frå eøsavtalen det kommer frå ein regjering vår høgre og fremskrittspartiet bestemmer politikken ein slik regjering ville ikkje stått opp mot sosial dumping på denne må på den måten som den sitande regjering har gjort,876.4,904.4,28.0,2012-11-15,2012-11-15_proceedings.txt
stortinget-20121115-095531_904400_932600,president den økonomiske krisen den høye ledigheten i mange av landene skaper grobunn for politiske strømninger vi trodde var ryddet bort når demokratiet erstattet diktaturet på vårt kontigent kontinent utenriksministeren trakk fram ungarn og romania situasjonen er enda alvorligere og mer bekymringsfull i land utenfor som ukraina for ikke å snakke om hviterussland det er en påminnelse om verdien av det samarbeidet som er utviklet i vår verdensdel,president den økonomiske krisen den høge ledigheten i mange av landet skapar grobunn for politiske strømmingar vi trudde var rydde bort når demokratiet er statte diktaturer på vårt kontigent kontinent utanriksministeren takk for ungarn og romania situasjonen er enda alvorleg og mer bekymringsfull i land utanfor som ukraina for ikkje å snakke om vitrusland det gjer ein påminnelse om verdien av det samarbeidet som har utvikla i vår veidnes del,904.4,932.6,28.200000000000045,2012-11-15,2012-11-15_proceedings.txt
stortinget-20121115-095531_932600_960900,og en advarsel om hva som kan gjenta seg om samarbeidet svekkes ingen kan lukke øynene for den stabiliserende rolle som eusamarbeidet har spilt i omformingen av europa fra et krigens til en fredens verdensdel slik nobelkomiteen også begrunner årets fredspris samtidig som komiteen pekte på betydningen av dette samarbeidet nettopp i en krisetid det er et viktig perspektiv å eee ha med seg eee,og ein advarsel om kva som kan gjenta seg om samarbeidet svekkast ingen kan lukke øynene for den stabiliserande rolle som eusamarbeidet har spelt i omforminga av europa frå eit krigens til ein fredens eee verdas del slik novelkomiteen også begrunner årets fredspris samtidig som komiteen peiker på betydninga av dette samarbeidet nettopp i ein krisetid det er eit viktig perspektiv å eee ha med seg eee,932.6,960.9,28.299999999999955,2012-11-15,2012-11-15_proceedings.txt
stortinget-20121115-095531_960900_985700,også når eudelegasjonen i morgen skal mark i nor eudelegasjonen i norge i morgen skal markere at det er et førti år siden det indre marked ble etablert titelen er erfaringer og visjoner og de visjonene er det viktig å legge vekt på president neste taler er representanten morten hauglund deretter representanten peter skovholt gitmark hauglund vær så god,og så når eudelegasjonen i måren skal mar ei nor eudelegasjonen i noreg i måren skal markere at det er førti år sidan indre marked blir etablert tittelen er erfaringar og visjonar og dei visjonane er det viktig å legge vekt på presidentneste talar er tala otten hauglund deretter representanten peter skovholt gime haglund ver så god,960.9,985.7,24.800000000000068,2012-11-15,2012-11-15_proceedings.txt
stortinget-20121115-095531_990100_1017100,president vi er tilfreds med at utenriksministeren kom med et sterkt forsvar for eøsavtalen det er betryggende for når man hører enkelte andre representanter for regjeringspartiene så kan man jo få et inntrykk av at eøsavtalen er under avvikling med fortsatt rødgrønt styre nå anser jeg at den type retorikk vil bli lagt vekk samtidil å diskutere,president vi er tilfreds med at utanriksministeren kome med eit sterkt forsvar for eøsavtalen det er betryggande for når ein høyrer enkelte andre representantar frå regjeringspartia så kan ein jo få eit inntrykk av at euavtalen er under avvikling med fortsatt raudgrønt styre no anser eg at den type retorikk vil bli lagt vekk samtidl å diskutere,990.1,1017.1,27.0,2012-11-15,2012-11-15_proceedings.txt
stortinget-20121115-095531_1017100_1042300,for så vidt både avtalens traktatgrunnlag og ikke minst enkeltdirektiver ikke for å bli kvitt avtalen eller for å undergregrave deltagelsen i det indre marked men for å ha en avtale som hele tiden er oppdatert og relevant i forhold til dagens utfordringer og vi ser frem til å komme tilbake til å diskutere dette i forbindelse med den stortingsmeldingen som nå er lagt frem regjeringens viktigste strategiske satsingsområde i utenrikspolitikken er nordområdene,for så vidt både avtalen straktatgrunnlag og ikkje minst enkeltdirektiv ikkje for å bli kvitt avtalen eller for å undergrev grave deltakelsen i det indre marked men for å ha ein avtale som heile tida har oppdatert og relevant i forhold til dagens utfordringar og vi ser frem til å kome tilbake til å diskutere dette i forbinde med den stortingsmeldinga som no har lagt fram regjeringas viktigste strategiske satsingsområde i utanrikspolitikken er nordområda,1017.1,1042.3,25.199999999999932,2012-11-15,2012-11-15_proceedings.txt
stortinget-20121115-095531_1042300_1069800,allikevel så ble ikke dette berørt i redegjørelsen som et tema i forhold til eu og europa og eu i arktis det handler jo om mer enn å få eu på plass som observatør i arktisk råd selv om det også er viktig det er en interesse fra eu og mange europeiske land mot arktis og nordområdene det skal vi se som en mulighet og her ligger det et potensial langt utover energi innen skipsfart er det muligheter som må utnyttel for eksempel infrastruktur,likevel så blei ikkje dette berørt i redegjørelsen som er tema i forhold til eu og europa og eu i arktisk det handlar jo om meir enn å få eu på plass som observatør i arktisk råd sjøl om det også er viktig det er ein interesse frå eu og mange europeiske land mot arktis og nordområdene det skal vi ses som ein muligheit og her ligg det eit potensial langt utover energi innan skipsfart der det e muligheter som må utnyttel for eksempel infrastruktur,1042.3,1069.8,27.5,2012-11-15,2012-11-15_proceedings.txt
stortinget-20121115-095531_1069800_1094100,mineraler er et annet område hvor eukommisjonen nå har definert en del kritiske råstoffer og hvordan få tak i disse dette vil påvirke oss relevante euprogrammer innen forskning transport og logistikk er særlig relevant for utviklingen i nordområdene spørsmålet er om vi kan se for oss et strategisk engasjement mellom norge og eu slik at vi kan være med å legge premisser for fremtidige euprogrammer,mineralar er eit anna område vår eukommisjonen no har definert ein del kritiske råstoffer og vor dei få tak i desse dette vil påverke oss relevante euprogrammer in forskingstransport og logistikk er særleg relevant for utviklinga i nordområdespørsmål er om vi kan se for oss eit strategisk engasjement mellom noreg og eu slik at vi kan vere med å legge premissar for fremtidige euprogrammer,1069.8,1094.1,24.299999999999955,2012-11-15,2012-11-15_proceedings.txt
stortinget-20121115-095531_1094100_1122200,å gjøre eu mer ansvarlig i forhold til krevende utfordringer og problemstillinger i nord at europa er konkurransedyktig er i aller høyeste grad i vår interesse det er derfor nødvendig å se om vi kan finne felles strategier på viktige områder faren med den alltid eksisterende europadebatthar inne hjemme det er at enten så handler det om en uaktuell medlemskapsdebatt eller så graver vi oss ned i enkeltdirektiver av varierende viktighet,å gjere eu meir ansvarleg i forhold til krevjande utfordringar og problemstillingar i nord at europa er konkurransedyktiger i aller høgste grad i vår interesse det er derfor nødvendig å se om vi kan finne felles strategier på viktige område faren med den alltid eksisterande europadebatt her inn hjemme det er at enten så handlar det om ein uaktuell medlemskapsdebatt eller så graver vi oss ned dei enkelte direktivet av varierande viktighet,1094.1,1122.2,28.100000000000136,2012-11-15,2012-11-15_proceedings.txt
