file,text_bm,text_nn,start,end,duration,date,proceedingsfile
stortinget-20121115-095531_9745100_9770000,og da eee det er også flere utfordringer med det så eu endrer sin arbeidsmåte de går fra enkeltdirektiv til rammedirektiv og fellesprogrammer temaprogrammer det gjør at det blir vanskeligere for norge å sortere disse programmene på ulike departement det gjør at det blir vanskeligere å avklare hva som er eøs relevant og det forsinker også prosessen og gjør at det blir vanskeligere å oppnå det som bør være regjeringens hovedmål nemlig å komme tidligere inn i prosessene,og da eee der også fleire utfordringar med det så eu endra sin arbeidsmåte det går frå enkeltdirektiv til rammedirektiv eee og fellesprogrammet temaprogram det gjer at det blir vanskelegare for noreg å sortere desse programma på ulike departement der att blir vanskelegare å avklare kva som er evit relevante og det forsinkar også prosessen og gjer at det blir vanskelegare å oppnå det som bør vere regjeringas hovudmål nemleg å komme tidlegare inn i prosessene,9745.1,9770.0,24.899999999999636,2012-11-15,2012-11-15_proceedings.txt
stortinget-20121115-095531_9770000_9792700,eee og og nou nummer to totusenogtolv viser jo det med all tydelighet på side syvognitti så er det en graf som som viser at mange hundre direktivet er flere år forsinket i implementeringen og det er svært uheldig eee både for norge og for norsk næringsliv eee og det kan være gode grunner selvfølgelig til at noen direktiv ligger i fryseboksen eee en stund men ikke mange hundre over mange år,eee og nou nummer to totusenogtolv viser jo det med au tydelegheit på sidan sju og nitti så er det ein ein graf som som viser at mange hundre direktiv er fleire år får sinke implumenteringa og det er svært uhyggelig eee både for noreg og for norsk næringsliv eee og det kan vere gode grunner selfølgele til at nokon direktiv ligg i fryseboksen eee ein stund men ikkje mange hundre og mange år,9770.0,9792.7,22.700000000000728,2012-11-15,2012-11-15_proceedings.txt
stortinget-20121115-095531_9792700_9820000,eee da eee må man gjøre noe miljøverndepartementet fastslo på sine hjemmesider for noen år siden at det var interne stridigheter mellom departementene som var en av årsakene til at man ble forsinket og implementere disse direktivene dette er noe i så fall regjeringen eee må adressere så eee eee vil jeg si at det er mange her i dag eee rep la var blant dem,eee det eee må ein gjere no miljøverndepartementet fastslo på sine hjemside for nokon år sidan at det var interne stridigheter mellom departementet som var ein av årsakene til at ein blei forsinka i å implementere distrektiva dette er no i så fall regjeringa eee må adressere så eee eee vil eg si at det er mange her i dag eee replanar blant dei,9792.7,9820.0,27.299999999999272,2012-11-15,2012-11-15_proceedings.txt
stortinget-20121115-095531_9820000_9849000,som argumentert for at høyre er servile overfor eu og at vi ikke har noe kritisk sans i forhold til det som kommer det vil jeg på det sterkeste ta avstand fra men vi mener altså ikke at postdirektivet som er det eneste direktivet i denne salen har reservert seg mot er av avgjørende betydning fordi det har så handler det om om staten skal ha monopol på vinneskomplu konflukter som veier mindre enn femti gram eee og som snart blir erstattet av epost det er ikke eee essensielle norske interesser det er andre saker som må være viktigere enn dette hvis vi skal bruke reservasjonsretten,som argumentert for at høgre er servil lov for eu og at vi vi ikkje har noko kritisk sans i for ol det som kommer det vil vere på det sterkaste ta avstand frå men vi meiner altså ikkje at postrektivet som er enstrektive i denne salen når dei servert seg mot er avgjerande betydning fordi det som handlar om om staten skal ha monopol på vinduskompl komforluktar som veger mindre enn femti gram eee og som snart blir satt av epost det er ikkje eee eee essensielle norske interesser det er andre saker som må vere viktige enn dette viss vi skal bruke reservasjonsretten,9820.0,9849.0,29.0,2012-11-15,2012-11-15_proceedings.txt
stortinget-20121115-095531_9849000_9854200,neste taler er utenriksminister espen barth eide,neste talar er utanriksminister espen barth eide,9849.0,9854.2,5.200000000000728,2012-11-15,2012-11-15_proceedings.txt
stortinget-20121115-095531_9858100_9886100,barth eide vær så god eee skal vi ikke tverre ut dette mye lenger eee men eee siden nå eee spørsmålet president var hva vi skal fylle handlingsrommet med så var det noe av det jeg var innom i mitt siste innlegg vi har et særlig fokus på utviklingen i forhold til eee arbeidslivet og det er fordi vi tror det er både bra for norsk økonomi nav bra for norske arbeidstakere bra for arbeidsinnvandrere at vi sørger for å opprettholde de gode ordningene vi har,at eide og så joe skal vi ikkje tverre ut dette mye lenger eee men eee siden då spørsmålet president var eee var vi skal fylje handlingsrommet med så var det noko av det eg var innom i mitt siste innlegg vi har eit særleg fokus på utviklinga i forhold til eee arbeidslivet og det er fordi vi trur det er både bra for norsk økonomi na bra for norske arbeidstakarar bra for arbeidsinnvandrarar at vi sørger for å opprettholde dei gode ordningane vi har,9858.1,9886.1,28.0,2012-11-15,2012-11-15_proceedings.txt
stortinget-20121115-095531_9886100_9914600,der man altså gir arbeidstakere medbestemmelse og får ansvar og medansvar tilbake det har bidratt til små forskjeller det bidratt til at vi kan omstille oss sammen så på de på det konkrete spørsmålet fra jeg nå fikk eee så er det svaret det som er gjennomgående er at vi egentlig fortsatt ikke hører fra høyre hva de skal bruke handlingsrommet til jeg slutter meg til at det er viktig å få implementert direktiver både i norge og i eu er det en rekke,der ein altså gir arbeidstakarar medbestemmelse og får ansvar og medansvar tilbake det bidrar til små forskjellar det bidrar til at vi kan omstille oss saman så på dei på det konkrete spørsmålet frå eee eg no fekk eee så er det eee svaret det som er gjennomgåande er at vi eigentleg fortsatt ikkje høyrer frå høgre kva dei skal bruka handlingsrommet til ja eg sluttar meg til at det er viktig å få implementert direktiv både i noreg og i eu er det ein rekke,9886.1,9914.6,28.5,2012-11-15,2012-11-15_proceedings.txt
stortinget-20121115-095531_9914600_9942800,eee land som strever med å få direktivene implementert og en av grunnene er altså det store omfanget det er også helt riktig og det sa vi også i den forrige europameldingen jeg hadde gleden av å være med og skrive i år totusen som daværende statssekretær for torbjørn jagland norges største eutilhenger at vi kom til å gå inn i en tid der eu utvikler seg vekk fra det eu vi tilpasset oss til eee i i nittennittifire eee og det er jo nettopp derfor vi nå har utvidet antallet,eee land som strever med å få direktiva implementert og ein av grunnene er altså det store omfanget det er også heilt riktig og det sa vi også i den føre europameldinga eg hadde glede av å vere med og skrive i år totusen dam daverande statssekretær for torbjørn jagland noregs største eutilhenger at vi kom til å gå inn i ein tid der eu utvikle seg vekk frå det eu vi tilpasse oss til eee i eee i nittennittifire eee og det er jo nettopp derfor vi no har utvidet antalet,9914.6,9942.8,28.19999999999891,2012-11-15,2012-11-15_proceedings.txt
stortinget-20121115-095531_9942800_9969300,tilpasningsordninger til tilslutningsordninger deltar i flere programmer deltar i flere eee organisasjoner og nettverk inn mot eu men men det er altså en påpekning fra høyre som jeg deler at eu skal brukes aktivt eøs skal brukes aktivt men jeg lurer på hva er det høyre vil bruke handlingsrommet til for det vi fortsatt ikke hørt noe om i denne debattenneste taler er representan,tilpassingsordningar til tilslutningsordningar deltar i fleire programme deltar i fleire eee orgnisasjonar og nettverk inn mot eu men men det er altså ei påpeiking frå høgre som gjer deler at eu skal brukast aktivt eus skal brukast aktivt men eg lurer på kva er det høgre vil bruke handlingsrommet til for di har vi fortsatt ikkje høyrt noko om i denne debattenneste talar er representan,9942.8,9969.3,26.5,2012-11-15,2012-11-15_proceedings.txt
stortinget-20121115-095531_9979200_10000800,astrup vær så godtakk president eee vel høyre vil blant annet bruke handlingsrommet eee til å jobbe for eee det regjeringen også er opptatt av nemlig å motarbeide sosial dumping det er ingen uenighet mellom partiene i stortinget eee om at det er viktig å bekjempe sosial dumping og høyre har også støttet flere av de forslagene som remmer i sin tiltakspakke,stru ver så godtakk president eee vil høgre vil blant anna bruke handlingsrommet eee til å jobbe for eee det regjeringa også har hatt data nemleg å motarbeide sosial doping det er ingen u einigheit mellom partia i stortinget eee om at det er viktig å bekjempe sosial dumping og hør ar også støtte ut fleire av dei forslaga som fremmer til sin tiltaksbakke,9979.2,10000.8,21.599999999998545,2012-11-15,2012-11-15_proceedings.txt
stortinget-20121115-095531_10000800_10029600,eee vi har ikke støttet alle og det er ikke fordi vi er mot å bekjempe sosial dumping men fordi noen av de forslagene mener vi ikke er det rette for å håndtere de utfordringene vi står overfor og vil ha andre svært uheldige konsekvenser for utviklingen i norge så eee så den kampen deler vi men barth eide trekker fra utenriksministeren eee trekker frem et eee s politikkområde som han skal fylle dette handlingsrommet med og jeg regner med at det var det som et som et eksempel fordi det handler jo om hva hvordan vi er til stede tidlig i prosessene,eee me har kisa utt alle og det ikkje fordi vi er mot å bekjempe sosial dumping men fordi none av dei forslaga meiner vi ikkje er dei rette for å handtere dei utfordringa vi står for og vil ha andre svart og høgre konsekvensar for utviklinga i noreg så eee så den kampen deler vi men vart ei det trykket frå utanriksministeren eee trekker frem eitt eee politikkområde som han skal fylgje dette handlingsrommet med og eg reknar med at det var som eit som eit eksempel fordi det handlar jo om kva korleis vi gjere til stede tidleg prosessene,10000.8,10029.6,28.80000000000109,2012-11-15,2012-11-15_proceedings.txt
stortinget-20121115-095531_10029600_10057100,og mitt eksempel på at vi bruker mange år på å avklare her i norge om et direktiv eu så relevant viser jo om all tydelighet at da går toget for å påvirke eu hvis vi skal kunne påvirke eu så må vi avklare tidlig om det er eøs relevant å komme tidlig inn i prosessene både på parlamentsnivå og på regjeringsnivå eee og det at regjeringen da har latt for eksempel eee den nasjonale ekspertstillingen i europaparlamentet stå ledig i tre over tre år er jo et eksempel på at man ikke p mantra om,og mitt eksempel på at vi bruker mange år på avklare her i noreg om direktiv er ause relevant viser om alt tydeleg at da går toget for å påverke eu viss vi skal kunne påverke eu så må vi avklare tidleg om dei er øsrelevant og komme tidleg inn i prosessane både på parlamentsnivå og på regjeringsnivå eee og det at regjeringa da har latt for eksempel den nasjonale ekspertstyringa i europaparlamentet stå ledig i tre over tre år er jo eit eksempel på at ein ikkje fp mantra om,10029.6,10057.1,27.5,2012-11-15,2012-11-15_proceedings.txt
stortinget-20121115-095531_10057100_10085700,aktiv europapolitikk som skal fylle dette handlingsrommet eee så det her fins mye politikk eee og viktige norske interesser som høyre skal fremme i brussel men det er viktig hvordan vi gjør det og denne regjeringen er dessverre på etterskudd i veldig mange eee viktige saker eee og eee regjeringen ble tatt på sengen for eksempel da man behandlet selsaken i parlamentet fordi man ikke var til stede i parlamentet man hadde undervurdert parlamentet som politisk arena,aktiv europapolitikk som skal fylle dette handlingsrommet eee så det finst mye politikk eee og eee viktige norske interesser som høgre skal fremme i bryssel men det er viktig vorden vi gjer det eee og denne regjeringa er dessverre på etterskot i veldig mange eee viktige saker eee og eee regjeringa blei tatt på sengen for eksempel da ein må hadde selsaken i parlamentet fordi ein ikkje var til stade i parlamentet ein hadde underdek parlamentet som politisk arena,10057.1,10085.7,28.600000000000364,2012-11-15,2012-11-15_proceedings.txt
stortinget-20121115-095531_10085700_10115000,eee og så er det hviler det selvfølgelig et ansvar på de politiske partiene i denne sal å utøve eee innflytelse gjennom sine politikkgrupper i europaparlamentet men også regjeringen må jo forholde seg til at parlamentet er blitt en viktig aktør i europeiske beslutningsprosesser og der mener jeg at eee regjeringen langt på vei har sviktet sitt eee ansvar eee en annen utfordring med eee eus politikkutvikling er jo at flere beslutninger flyttes ned i byråer eee og der er er det jo viktig at norge er til stede,eee og så har vilar selvfølge eit ansvar på dei politiske partia i denne sal og utover eee innflytelse gjennom sine politikk grupper i europaparlamentet men også regjeringa må jo forholde seg til at parlamentet er blitt ein viktig aktør i europeiske beslutningsprosess og der meiner eg at regjeringa langt på veg har svikta sitt eee ansvar eee ein annan utfordring med eee eus politikkutvikling er jo at fleire beslutningar flyttast ned i byråer eee og der er er det jo viktig at noreg er til stede,10085.7,10115.0,29.299999999999272,2012-11-15,2012-11-15_proceedings.txt
stortinget-20121115-095531_10115000_10143700,og at norge bruker de mulighetene for innflytelse som eee vi har selv om de er begrenset og bar utenriksministeren og jeg vil jo være enige om at det beste vil være norsk medlemskap i eu for da vil vi faktisk kunne ha en stemme i brussel men når det ikke er aktuelt akkurat nå eee så må jo iallfall eee sta norske statsråder bruke de mulighetene de har for å møte på uformelle ministermøter noe de ikke gjør og det er noe regjeringen bør ta tak i eee umiddelbart,og at noreg bruker dei muligheitene for innflytelse som eee vi har sjel om det er begrensa og xxx utanriksministeren eg ville vere einige om at det beste ville vere i norsk medlemskap i eu for da ville vi faktisk kunne ha ein stemme i bryssel men når det ikkje er aktuelt akkurat no eee så må eg allfall eee sta norske statsråden bruke dei muligheitene dei har for å møte på uformelle ministermøte noko dei ikkje gjer og det er no regjeringa bør ta tak i eee umiddelbart,10115.0,10143.7,28.700000000000728,2012-11-15,2012-11-15_proceedings.txt
stortinget-20121115-095531_10144400_10166400,neste taler er representanten peter skålholt gitmark representanten gitmark har hatt ordet to ganger og får derfor ordet til en kort merknad begrenset oppad til ett minutt git mor vær så god president det vil være betydelige forskjeller på en europapolitikk ledet av høyre den europapolitikken vi ser av dagens regjering,neste talar er representanten peter skovholt gitmark representanten witmark har hatt ordet to gonger og får derfor ordet til ein kort merknad begrenset oppå til eitt minutt gitmark ver så god president det vil vere betydelege forskjellar på ein europapolitikk lede til høgre og den europapolitikken vi ser i dagens regjering,10144.4,10166.4,22.0,2012-11-15,2012-11-15_proceedings.txt
stortinget-20121115-095531_10166400_10180200,hovedforskjellen går på at vi ønsker å være inne tidlige prosesser vi ønsker å være med når eee politikken utvikles ikke kommer i etterkant og kunne kun svare ja eller veto president det er et politisk valg,hovudforskjellen går på at vi ønsker å vere inne tidleg prosessar vi ønsker å vere med når eee politikken utviklast ikkje komme i etterkant og kunne kun svare ja eller veto president det er eit politisk val,10166.4,10180.2,13.800000000001091,2012-11-15,2012-11-15_proceedings.txt
stortinget-20121115-095531_10180200_10196600,når vi ser norske statsråder ikke ønsker å bruke brussel som et politisk vekst jeg ikke ønsker å være til stede i brussel når viktige saker for norge diskuteres ja men så er det et politisk valg da velger man den interne uenigheten her å se og bruker ikke de muligheter som finnes,når vi ser norske statsrådar ikkje ønsker å bruke bryssel som eit politisk verste ikkje ønsker å vere til stade i bryssel når viktige saker for noreg diskuterast ja men så er det eit politisk val da velger ein den interne uenigheten her og så å bruke ikkje dei muligheita som finst,10180.2,10196.6,16.399999999999636,2012-11-15,2012-11-15_proceedings.txt
stortinget-20121115-095531_10196600_10224900,president allerede i dag har høyre en aktiv europapolitikk vi er til stede i alle de organer vi kan spesielt knyttet til eee europaparlamentet og eppgruppen vi er nære samarbeidspartnere og deltagere i fps ulike fora og det gjør at vi har også gjennomslag eee som parti i det partigruppen gjør og til syvende og sist dette handler om politisk vilje den viljen har høyre og det skal vi bruke til å eee påvirke,president allereie i dag har høgre ein aktiv europapolitikk vi er til stader i alle dei organa vi kan spesielt knytte til europaparlamentet og ppgruppen vi er nære samarbeidspartnar og deltakarar i pps ulike for og det gjer at vi har også gjennomslag eee som parti i det partigruppen gjer og til obnosist dette handlar om politisk vilje den ville ein har høgre og det skal vi bruke til å eee påverke,10196.6,10224.9,28.299999999999272,2012-11-15,2012-11-15_proceedings.txt
stortinget-20121115-095531_10224900_10232100,neste taler er representanten snorre valen og deretter utenriksminister espen barth eide,neste talar er representanten snorre walen og deretter utanriksminister espen barth eide,10224.9,10232.1,7.200000000000728,2012-11-15,2012-11-15_proceedings.txt
stortinget-20121115-095531_10237800_10266300,vær så takk president jeg slutter meg til representanten astrup jeg veit ikke hva jeg synes om kvaliteten på debatten men nå har det vært en debatt eee det som slår meg er at de som kanskje høyest i denne salen sier at de ønsker mer europadebatt helst ikke vil ha det for når det kommer meninger eller refleksjoner som eee høyresida ikke slutter helt opp om så er det farlig og det skaper uro,warum ver så god takk president eg slutte meg til representanten astrup eg veit ikkje kva eg synest om kvaliteten på debatten men då har no vore ein debatt eee det som slår meg er at dei som kanskje høyrast i denne san sier at dei ønsker meir europadebatt helst ikkje vil ha det for når det kommer meningar eller refleksjonar som eee høgresida ikkje sluttar heilt opp om så er det farleg og det skaper uro,10237.8,10266.3,28.5,2012-11-15,2012-11-15_proceedings.txt
stortinget-20121115-095531_10266300_10294400,jeg tror enkelte fra høyre har vært opptatt av å karakterisere regjeringas indre liv og at det er som hovedfokus i diskusjonen og det har til og med blitt sagt at svs programforslag skaper usikkerhet for eee for norge og europa eee og sjøl om leder av framkomiteen inga martin thorkilsen er til stede og riktignok er statsråd så er kanskje det å ta litt hardt i eee vi har erfaring med å diskutere europa i norge det er en bra ting og det tror jeg ikke vi tar skade av,eg trur enkelte frå høgre har vore opptatt av å karakterisere regjeringas indre liv og hatt det som hovudfokus i diskusjonen og det har til og med blitt sagt at svs programforslag skaper usikkerheit for eee for noreg og europa eee og sjøl om leder av pronkomiteen inger vart torkelsenærti stader og rike nok er statsråd så er kanskje det å ta litt hart i eee vi har erfaring med å diskutere europa i noreg det er ein bra ting og det trur ikkje vi tar skade av,10266.3,10294.4,28.100000000000364,2012-11-15,2012-11-15_proceedings.txt
stortinget-20121115-095531_10294400_10320600,jeg tror fokuset som høyre spesielt har lagt seg på i denne debatten ikke i så stor grad frp for der har du både eutilhengere og eumotstandere men jeg tror fokuset til høyre bunner i det faktum at høyre står for en faglig politikk og en arbeidslivspolitikk som ligger nærmere sine partikamerater i europa enn det vi har norsk eee bygd veldig mye av det norske fellesskapet på og det vil,eg trur fokuset som høgre spesielt har lagt seg på i denne debatten ikkje i så stor grad frp for der har du både eu til lenger og eumotstandarar men eg trur fokuset til høgre bunner i det faktum at høgre står for ein fagleg politikk og ein arbeidslivspolitikk som ligg nærmare sine partikaratar i europa enn det vi har norsk bygd veldig mykje av det norske fellesskapet på og det vil,10294.4,10320.6,26.200000000000728,2012-11-15,2012-11-15_proceedings.txt
stortinget-20121115-095531_10320600_10348700,enten med norge i eu eller med høyre i regjering så det er fristende uten å skulle sette i gang en helt ny debattrunde nå president for det tror jeg ingen vil ha men det er jo fristende å spørre opposisjonen tilbake hvis man er så opptatt av avklaringer partier imellom på motsatt fløy er det sånn at en ny regjering der høyre inngår vil trosse et klart folkeflertall og søke eumedlemskap for for mange av høyres politikere er jo det livets mål og mening,enten med noreg i eu eller med høgre i regjering så det er fristene utan å skule sette i gang ein heilt ny debatt under nå president for det trur eg ingen vil ha men det er jo fristen å spørje opposisjonen tilbake viss ein er så opptatt av avklaringar partia i mellom på motsett flei er det sånn at ein ny regjering der høgre inngår vil trasse eit klart folkefleirtal og søke eumedlemskap for for mange av høgre politikar er og det er livets mål og meining,10320.6,10348.7,28.100000000000364,2012-11-15,2012-11-15_proceedings.txt
stortinget-20121115-095531_10348700_10376900,eller vil høyre love at de ikke vil søke norsk eumedlemskap i neste periode det hadde det vært veldig interessant å høre tydelige svar på både fra høyre og fra de andre borgerlige partiene hva de mener og til å være så glad i eøsavtalen som enkelte fra høyre sia i dag har sagt så er det jo interessant å høre hvor stygt vi snakker om eøsavtalen når de reiser rundt i europabevegelsen og argumenterer for norsk eumedlemskap nærmest med den ene grunn alene,eller vil høgre lova at dei ikkje vil søke norsk eumedlemskap i neste periode det hadde det vore veldig interessant å høyre eit tydeleg svar på både frå høgre og frå dei andre borgerlege partia kva de meiner og til å vere så glad i eøsavtalen som enkelte frå høyre sa i dag har sagt at det er så er det jo interessant å høyre vår stykt vi snakkar om eøsavtalen når dei reiser rundt i europabevegelsen og argumenterer for norsk eumedlemskap nærmast med den eine grunna lene,10348.7,10376.9,28.19999999999891,2012-11-15,2012-11-15_proceedings.txt
stortinget-20121115-095531_10376900_10393600,at eøsavtalen er det minst demokratiske instrumentet norge noen gang har vært en del av det er så fælt at vi må se å melde oss inn med å få litt innflytelse med en gangneste taler er utenriksminister espen barth eide og deretter laila gustavsen,at eøsavtalen er det minst demokratiske instrumentet noreg nokon gong har vore ein del av det er så fart at vi må sjå om melde oss inn og få litt innflytelse med ein gongneste talar er utanriksminister espen barth eide og deretter leila gustavsen,10376.9,10393.6,16.700000000000728,2012-11-15,2012-11-15_proceedings.txt
stortinget-20121115-095531_10398800_10419400,barth eide vær så god president jeg vil til slutt siden det kanskje ikke ble tilstrekkelig besvart eee bare bekrefte at det nå er enighet med europaparlamentet å få på plass en ny nasjonal ekspert vi har fått for formell tilslutning til det og stillingen vil bli utlyst i nær fremtid det syns det var viktig å gjøre oppmerksom på jeg vil bareke at,at eide ver så god president eg vil til slutt sidan det kanskje ikkje blir tilstrekkeleg besvart eee berre bekrefta at det no er einigheit med europaparlamentet å få på plass ein ny nasjonal ekspert vi har fått for formell tilslutning til det og stillinga vil bli utlyst i nær framtid det synest det var riktig øre oppmerksom på eg vil berreka at,10398.8,10419.4,20.600000000000364,2012-11-15,2012-11-15_proceedings.txt
stortinget-20121115-095531_10419400_10447400,det representanten astrup representanten gitmark og jeg har til felles er at vi er tilhenger av eøs og vi hadde syns eumedlemskap var enda bedre og så tror jeg vi alle erkjenner at det ikke er umiddelbart forestående og derfor baserer vi politikken på eøs jeg er glad for høyres tilslutning til hovedelementene i regjeringens eee melding som er bruke handlingsrommet ved tidlig tilstedeværelse på bred front velges innslag eee og og å jobbe systematisk,det representanten astrup depresentanten gitmark og eg har til felles er at vi er tilhenger av eøs og vi hadde synest eumedlemskap og enda betre og så trur eg vi alle er kjenner at det ikkje er umiddelbart forestande og derfor baserer vi politikken på eøs jeg er glad for høgre tilslutning til hovudelementa i regjeringas eee melding som er bruke handlingsrommet ved tidlig tilstedeværelse på bre front velge sine slag eee og og å jobbe systematisk,10419.4,10447.4,28.0,2012-11-15,2012-11-15_proceedings.txt
