file,text_bm,text_nn,start,end,duration,date,proceedingsfile
Stortinget-20141120-095704_3324500_3340250,av om eee planen i tilstrekkelig grad eee er oppdatert og og har de kvalitetene som de trenger for å få en ny eee reguleringsplan dette gir en fleksibilitet inn i kommunene og gjør også en mulighet for at gode planer kan,av om eee planen i tilstrekkeleg grad eee er opptatert og og har dei kvalitetane som du trenger for å få ein ny eee reguleringsplan det det gir ein fleksibilitet inn i kommunane og gjer også ein mulighet for at gode planar kan,3324.5,3340.25,15.75,2014-11-20,2014-11-20_proceedings.txt
Stortinget-20141120-095704_3340250_3367300,videreføres eee også gjennom tiår for det må være kvaliteten på planen som er avgjørende og ikke hvor lenge siden den faktisk ble vedtatt dette er en dette er en viktig forenkling både for næringslivet og de som legger fram planene men også for kommunene eee så president så ser vi fram med egentlig med forventning til den forskriften som krgjøre også,vidareførast eee også gjennom ti år for det med å vere kvaliteten på planen som er avgjerande og ikkje var lenge sidan den faktisk blei vedtatt dette er ein dette er ein viktig forenkling både for eee næringslivet og dei som legg fram planene men også for eee kommunane eee så president så ser vi fram eigentleg med ei forventning til den forskrifta som rgjere også,3340.25,3367.3,27.050000000000182,2014-11-20,2014-11-20_proceedings.txt
Stortinget-20141120-095704_3367300_3395500,eee hvilke unntak for krav om planprogram i reguleringsplanene som kommunene kan benytte seg av tror jeg også kan være en viktig forenkling det er viktig at kommunene får den nødvendig fleksibilitet sånn at de kan gjennomføre sine målsettinger på best mulig vå måte for plan ansvaret for planleggingen ligger jo til kommunene og ambisjonsnivået må komme fra kommunene,eee kva unntak for kravet om planprogram i reguleringsplanar som kommune kan benytte seg av trur eg også kan vere ein viktig forenkling det er viktig at kommunane får dei nødvendig fleksibilitet sånn at dei kan gjennomføre sine målsettingar på best mulig å måte for plan ansvaret for planeigae ligg jo til kommunane og ambisjonsnivået må kome frå kommunane,3367.3,3395.5,28.199999999999818,2014-11-20,2014-11-20_proceedings.txt
Stortinget-20141120-095704_3395500_3414600,både når det gjelder å ha nok eee reguleringsplan ha nok boligbygging og også de miljøkravene som som eee ligger der fristene med to uker for å oversende kommunestyrets vedtak til fylkesmannen er god der det er innsigelse og det er viktig også at man nå får en frist,både når det gjeld det å ha nok eee reguleringsplan ha noko bolebyggene og også dei miljøkrava som eee som eee ligg der fristene med to øker frå overskjene kommunestyre vedtak til fylkesmannen er godt der det er innsigelse og det er viktig også at ein no får ein frist,3395.5,3414.6,19.09999999999991,2014-11-20,2014-11-20_proceedings.txt
Stortinget-20141120-095704_3414600_3441100,for å oversende fylkesmannens tilrådning til departementet i innsigelsessaker det er ingen tvil om at det er altfor mange saker som eee har en nærmest en eee liggetid i uten at de er under behandling eee men at du er en forsinkelse i systemet som med disse tidsfristene man kan få strammet opp og få sakene raskere igjennom i systemet men så,for å oversende fylkesmannens tilrådning til departementet i innsigelsesaker det er ingen tvil om at det er altfor mange saker som eee har ein nærmast ein eee liggetid eee utan at det er nokon behandling eee men at det er ein forsinkelse i systemet som er desse tidsfristene ein kan få stramme topp å få sakene raskare gjennom i systemet men så,3414.6,3441.1,26.5,2014-11-20,2014-11-20_proceedings.txt
Stortinget-20141120-095704_3441100_3468300,så er det en ett eee en tidsfrist som i hvert fall for venstre hvor vi hvor vi har en uro og det er tolvukersfristen for å få saker igjennom og da igjennom til kommunestyrebehandlingen for det er klart reguleringsplaner har en veldig eee variert kompleksitet eee og særlig i en kommuner som også har,så er det ein eitt eee ein tidsfrist som kvart fall for venstre vore vi vore vi har ein uro og det er eee toutyrsfristen for å få saker igjennom og der igjennom til kommunestyre behandlinga sjølv klart reguleringsplanar har ein veldig eee variert kompleksitet eee og særleg i ein e kommunar som oss vara,3441.1,3468.3,27.200000000000273,2014-11-20,2014-11-20_proceedings.txt
Stortinget-20141120-095704_3468300_3497200,andre som ikke styres etter formannskapsmodellen som her i oslo hvor du har også saker de skal gjennom et byråd og deretter skal de til et kommunestyre et kommunestyre som gjerne har et møte en gang i måneden eee og også et byrådsystem som gjør at saker kan ta er det kompliserte så kan det ta tid eee og det som er viktig så vi jeg har en betro den tolvukers vin fristen,andre som ikkje styre setter formannskapsmodellen som her i oslo borde har også saker dei skal gjennom eit byråd og deretter skal det til eit kommunestyre eit kommunestyre som gjerne har eee eit møte ein gong i månden eee og også eit byrådssystem som gjer at saker kan ta ærlig kompliserte så kan det ta tid eee og det som er viktig så vil eg har den betrullen togbrukesvint fristen,3468.3,3497.2,28.899999999999636,2014-11-20,2014-11-20_proceedings.txt
Stortinget-20141120-095704_3497200_3526500,kan være gode saklige grunner til at den er vanskelig å etterfølge og det er viktig at dette er en bør bestemmelse at man har forståelse for at det kan ta lengre tid eee og det er også og vi er tilfreds med at det sånn sett ikke ligger noen sanksjoner til bestemmelsen eee sånn som forslaget er le sånn som dette ligger eee forelagt eee utover,kan vere gode saklege grunner til at den er vanskeleg å etterfølge og det er viktig at dette er ein børbestemmelse at ein har forståelse for at det kan ta lenger tid eee og det er det også og vi er tilfreds med at det sånn sett ikkje ligg nokon sanksjonar til bestemmelsen eee sånn som forslaget er le sånn som dette ligger eee forelagt eee utover,3497.2,3526.5,29.300000000000182,2014-11-20,2014-11-20_proceedings.txt
Stortinget-20141120-095704_3526500_3544600,den uroen president så mener venstre at dette er en god sak den bidrar til en forenkling og den bidrar til at kommunene får en større fleksibilitet sånn også ligger det og tilligger det dem å sørge for den nødvendige,den uroen president så meiner venstre at dette er ein god sak den bidrar til ein forenkling og den bidrar til at kommunane får ein større fleksibilitet så og så ligg det og tilligger det dem og sørger for den nødvendige,3526.5,3544.6,18.09999999999991,2014-11-20,2014-11-20_proceedings.txt
Stortinget-20141120-095704_3544600_3566600,kvalitet og det er nødvendig kvalitet selvfølgelig innenfor det som også er de nasjonale rammene og der også fylkesmannen og andre har sitt ansvar for å påse og etterfølge at nasjonale målsettinger også følges opp via sin via sitt ansvar takkneste taler er representanten åsmund aukrust deretter oskar grimstad,kvalitet og det er nødvendig kvalitet selvfølgeleg innanfor det som os så er dei nasjonale rammene og der også fylkesmannen og andre har sitt ansvar frå på seg å etterfølgje at nasjonale målsettinga også følgjast opp via sin vida sitt ansvar takkneste talar er representanten åsmund aukrust deretter ostar grimstad,3544.6,3566.6,22.0,2014-11-20,2014-11-20_proceedings.txt
Stortinget-20141120-095704_3573100_3599900,aukrust vær så god president ja det er jo ikke veldig store endringer vi nå i dag behandler det synes jeg vi arbeiderpartiet i for seg er greit fordi plan og bygningsloven fungerer godt eee allerede og vi er i hovedsak enig i alle de forslagene og stiller oss bak endringer til regjeringa og håper at dette fører til et enklere regelverk både for pok,aukrust persen president ja det er jo eee veldig store endringar vi nå i dag behandlar det synest jo vi har beidarpartiet i o for seg er greit fordi plan og tingingslova fungerer godt eee allereie og vi er i hovudsak einig i alle dei forslaga og stiller oss bak endringar til regjeringa og håpar at dette føre til eit enklare regelverk både for pok,3573.1,3599.9,26.800000000000182,2014-11-20,2014-11-20_proceedings.txt
Stortinget-20141120-095704_3599900_3620000,så allikevel noen kommentarer femårsregelen den skulle jo sikre a side som sa jo at bygginga skulle starte maks fem år etter at planen var regulert skulle ikke hun hindre at tomter ble stå ble stående ubebygd etter at de var ferdig regulert i tillegg til fem år så kunne man nå be om to års ytterli,så var likevel nokon kommentar i femårsvegeren den skulle jo sikre au sisen sa jo at bygginga skulle starte i maks fem år etter at planen var regulert skulle ikkje å hindre at tomte blei stå blei ståande ubebygd etter at dei var ferdig regulert i tillegg til fem år så kunne ein no be om to års ytel,3599.9,3620.0,20.09999999999991,2014-11-20,2014-11-20_proceedings.txt
Stortinget-20141120-095704_3620000_3634500,dette var jo en regel som ble innført i totusenogni så det har jo ikke gått fem år siden en gang siden den ble innført derfor så veit vi jo egentlig ikke helt om den har eee fungert etter hensikten vi merker jo oss også at tidligere le,dette var jo ein regel som blei innført i totusenogni så det har ikkje gått fem år sidan gang sidan blei innført derfor så veit jo egentle ikkje heilt om den har eee fungert etter e hensikta vi merkar jo oss også at tidlegare le,3620.0,3634.5,14.5,2014-11-20,2014-11-20_proceedings.txt
Stortinget-20141120-095704_3634500_3652400,regelen skulle fjernes men det man i praksis har gjort er å gjøre femårsregelen over til en tiårslov tiårsregel og at mange av høringsinstansene sier at det i praksis vil få liten betydning og derfor skuffa av at regjeringa ikke gjorde som de tidligere hadde eee hadde eee annonsert,regelen skulle fjernast men det ein i praksis har gjort er å gjere femårsregelen overtlen tiårs lov er tiårs regel og at mange av høringsinstansene seier at det i praksis vil få liten betydning og derfor skuffar vet regjeringa ikkje gjorde som dei tidlegare hadde eee hadde eee anonsert,3634.5,3652.4,17.90000000000009,2014-11-20,2014-11-20_proceedings.txt
Stortinget-20141120-095704_3652400_3673500,regjeringa ber også om muligheten til å gjøre en forskriftsendring som gjør eee som gir unntaksmulighet for krav om planprogram ved reguleringssaker for oss arbeiderpartiet så framstår det litt uklart hvilke unntak man mener at skal finne sted og vi skriver i våre merknader at disse unntakene bare skal finne sted i særlige eee tilfeller vit dette kan,regjeringa ber også om muligheten til å gere ein forskingsendring som gjer eee som gir inntektsmulegheit for kravet om planprogram ved reguleringssaker for as arbeidarpartiet så framstår det litt uklart kva unntak ein meiner at e skal finnest det er og vi skriver i våre merknader at desse untak berre skal finnast det i særlege eee tilføyer vit dette kan,3652.4,3673.5,21.09999999999991,2014-11-20,2014-11-20_proceedings.txt
Stortinget-20141120-095704_3673500_3698300,potensielt sett føye seg inn i rekken av en del forslag som kan svekke vernet av natur og miljø vi er veldig for forenkling men det må ikke gå på bekostning av hensynet til eee miljøvern og samtidig som man har en rekke av disse forenklingsforslagene så ser vi at mange av disse faginstansene som jobber med miljø og klima de får svekka midler både nasjonalt og lokalt,potensielt sett føyer seg inn i rekken ein del forslag som kan svekke vernet av natur og miljø vi er ei veldig for forenkling men det må ikkje gå på bekostning av hensynet til eee miljøvern og samtidig som ein har ein rekkje av desse forenklingsforslaga så ser vi at mange av desse faginstansane som jobbar med miljø og klima dei får svekka midlar både nasjonalt og lokalt,3673.5,3698.3,24.800000000000182,2014-11-20,2014-11-20_proceedings.txt
Stortinget-20141120-095704_3698300_3715550,det er viktig med tilstrekkelig kunnskap om sårbar natur både fordi naturen har en verdi i seg sjøl men også fordi ta mest av alt fordi tap av det biologiske mangfoldet er en av våre største miljøproblemer så arbeiderpartiet kommer til å følge opp det i denne saken og i andre saker som kommer fra regjeringa til slutt president,det er viktig med tilstrekkeleg kunnskap om sårbar natur både fordi naturen har ein verdi i seg sjøl men også flyt mest av alt fordi tap av det biologiske mangfaldet er ein av våre største miljøproblem er så arbeidarpartiet kommer til å følge opp det i denne saka og i andre saker som kommer frå regjeringa til slutt president,3698.3,3715.55,17.25,2014-11-20,2014-11-20_proceedings.txt
Stortinget-20141120-095704_3715550_3732800,vi ser jo at byggenæringa sliter med produktivitet og flere av høringsinstansene sier at stadig endring i regelverket det gjør det vanskelig for dem å forholde seg til også i denne runden så varsler regjeringa at det skal komme nye endringer i plan og bygningsloven det betyr jo at selv om intensjonen,vi ser jo at byggnæringa slit med produktivitet og fleire av høyringsinstansane seier at stadig endringer i regelverket det gjer det vanskeleg for det me å forholde seg til også i denne runden så varslar jo regjeringa at det skal komme nye endringar i plan og bygningslova det betyr jo at selam intensjonen,3715.55,3732.8,17.25,2014-11-20,2014-11-20_proceedings.txt
Stortinget-20141120-095704_3732800_3762500,er god og intensjonen er forenkling så kan resultatet bli mer forvirring og mangel for før for forutsigbarhet derfor så har vi sammen med miljøpartiet og venstre skrevet i en merknad at vi mener at man i framtidige endringer bør fastsette en eee fastsette en fast dato som når eee når endringene trer i kraft slik at uavhengig når de er vedtatt så blir det iverksatt en eee fastsatt dato annethvert år det ville gitt næringa mer forutsigbarhet og det hadde i seg sjøl vært et godt forenklingstiltak,er god og intensjonen er forenkling så kan resultatet bli meir forvirring om mangel få for for forutsigbar hett derfor så har vi i saman med miljøpartiet o venstre skrive til ein merknad at vi meiner at ein i framtidige endringar bør fastsette ein eee fastsette ein fast dato som når eee når endringane trer i kraft slik at uavhengig i når dei er vedtatt så blir dei verksett ein eee fastsett dato anna vore år det ville gitt næringa meir forutsigbarhet og det hadde i seg sjøl vore eit godt forenklingstiltak,3732.8,3762.5,29.699999999999818,2014-11-20,2014-11-20_proceedings.txt
Stortinget-20141120-095704_3762500_3769000,neste taler er representanten oskar grimstad deretter statsråd jan tore sanner,neste talar er representanten oskar grimstad deretter statsråd jan tore sander,3762.5,3769.0,6.5,2014-11-20,2014-11-20_proceedings.txt
Stortinget-20141120-095704_3774000_3801700,grimstad vær så god president høyrefrpregjeringa ved kommunal og moderniseringsdepartementet forslår i proposisjonen lovendringer qqq som i hovesak skal legge til rette for ei enklere mer effektiv og fleksibel behandling av forslag til reguleringsplaner i tillegg foreslås retninga og klargjøring i enkelte av lovens bestemmelser og denne regjeringa leverer slik vi lover også på dettet og vi kan nevne,grimstad ver så godpresident høgrefrpregjeringa ved kommunal og moderniseringsdepartementet for slår i proposisjonen lovendringa som i hovudsak skal legge til rette for ei enklare meir effektiv og fleksibel behandling av forslag til reguleringsplanar i tillegg foreslås rettinga og klar regjeringa i enkelte av lovens bestemmelser og denne regjeringa leverer slik vi lovde også på dettet og vi kan nemne,3774.0,3801.7,27.699999999999818,2014-11-20,2014-11-20_proceedings.txt
Stortinget-20141120-095704_3801700_3825400,en øker lengda på fristen fra fem til ti år for å begynne gjennomføring av detaljreguleringer det kan gjøres unntak for krav om planprogram for reguleringsplaner tydeliggjøring av kommunenes mulighet til å unnlate å fastsette planprogram for pre private reguleringsplaner innføre enkelte nye veiledende frister knytta til behandlingen av planer,ein auke lengda på fristen frå fem til ti år for å begynne gjennomføring av detaljreguleringa det kan gjerast unntak for krav om planprogram for reguleringsplanar tydeleggjering av kommunanes mulegheit til å unnlate og fastsette polamprogram for pri eee private reguleringsplanar innfører enkelte nye vegledende fristar knytt til behandlinga av planar,3801.7,3825.4,23.700000000000273,2014-11-20,2014-11-20_proceedings.txt
Stortinget-20141120-095704_3825400_3850600,i tillegg foretar en retting av klargjøring i atten paragrafer i lovteksten som også var nødvendig alt dette for å få ei enklere og mer effektiv og fleksibel behandling av reguleringsforslag etter at de overfornevnte forslag har vært på høring komiteen merker seg at høringsinstansene generelt sett er positiv til forslaga som oppfattes som praktisk er og vel begrunna,i tillegg foretar ein rettinga og klargjeringa i atten paragrafar i lovteksten som også er var nødvendig alt dette for å få ei enklare og meir effektiv og fleksibel behandling av reguleringsforslag etter at dei overfornemnte forslag har vore på høyring komiteen merkar seg at høyringsinstansane generelt sett er positiv til forslaga som oppfattast som praktisk og velbegrunna,3825.4,3850.6,25.199999999999818,2014-11-20,2014-11-20_proceedings.txt
Stortinget-20141120-095704_3850600_3879000,en samla komite deler også regjeringa sin syn på at endringene vil ha positive konsekvenser for både utbyggere og innbyggere å gi mindre ressursbruk i forbindelse med planbehandling for kommunene på vegne av fremskrittspartiet er jeg glad for at vi kan være med på denne forenklinga som vil føre til en mer effektiv forandrift og forsi forutsigbarhet i forbindelse med reguleringsarbeid framover til nytte og glede både til det offentlige og private utbyggere,ein samla komite delar også regjeringa sin syn på at endringane vil ha positive konsekvensar for både utbyggjarar og innbyggarar og gi mindre ressursbruk i forbindelse med planbehandling for kommunane på vegner av framstegspartiet er glad for at vi kan vere med på denne forenklinga som vil føre til ein meir effektiv framdrift og forsi forutsigbarhet i forbindelse med reguleringsarbeid framover til nytte og glede både til det offentlege og private utbyggarar,3850.6,3879.0,28.40000000000009,2014-11-20,2014-11-20_proceedings.txt
Stortinget-20141120-095704_3879000_3885200,neste taler er statsråd jan tore sanner deretter ronny berg,neste talar er statsråd jan tore sanner deretter ronny berg,3879.0,3885.2,6.199999999999818,2014-11-20,2014-11-20_proceedings.txt
Stortinget-20141120-095704_3890500_3916600,statsråd sanner vær så god president eee la meg først få lov til å takke eee komiteen eee for en rask og effektiv behandling eee av disse forenklingsforslagene det er i forenklingsforslagenes ånd at det også blir behandlet på en effektiv måte i i stortinget det setter vi pris på fordi at mange av disse endringene,statsråd sa ver så godpresident eee la meg først få lov til å takke komiteen for ein eee rask og effektiv behandling eee av desse forenklingsforslaga det er i forenklingsforslagas om at det også blir behandla på ein effektiv måte i eee i stortinget det set vi pris på fordi at mange av desse endringane,3890.5,3916.6,26.09999999999991,2014-11-20,2014-11-20_proceedings.txt
Stortinget-20141120-095704_3916600_3943800,både fra bygge og anleggsbransjen men også fra kommunenes side når vi nå fjerner fem årsregelen så er det eee ut ifra innspill som både har kommet fra de store byene men også fra eee kommuner som legger til rette for for eksempel eee hyttebygging hvis obo skal bygge tusen leiligheter i oslo så er det kreløpet av fem år,både frå byggje og anleggsbransjen men også frå kommunanes side når vi no fjernar femårsregelen så er det eee ut ifrå innspel som både har kome frå dei store byane men også frå eee kommunar som legg til rette for for eksempel eee hyttebygging viss obo skal bygge tusen leilegheiter i i oslo så er det kreløpet av fem år,3916.6,3943.8,27.200000000000273,2014-11-20,2014-11-20_proceedings.txt
Stortinget-20141120-095704_3943800_3969400,eee det betyr at med femårsregelen så kan det innebære at du får nye omkamper nye innsigelsesrunder nye forsinkelser med femårsregelen tilsvarende med private reguleringsplaner eee i hytteområder hvor man kanskje ønsker å legge opp til en plan over en ti femten år så er det eee åpner man også for nye omkamper og nye forsinkelser med dagens regelverk,eee det betyr at med femårsregelen så kan det innebere at du får nye omkamper nye innsigelsesrunder nye forsinkelser med femårsregelen tilsvarande med private reguleringsplanar eee i hytteområde og ein kanskje ønsker å legge opp til ein plan over ein ti femten år så er det eee opna ein også for nye omkamper og nye forsinkelser med dagens regelverk,3943.8,3969.4,25.59999999999991,2014-11-20,2014-11-20_proceedings.txt
Stortinget-20141120-095704_3969400_3996000,den nye regelen er ikke at vi går fra fem år til ti år vi fjerner fem årsregelen men vi sier at etter ti år så må man foreta en vurdering av om man tilfredsstiller de kravene som er er stilt vi gjennomfører nå forenklinger eee på veldig mange områder eee vi har allerede fått vedtatt i stortinget forenklinger i bygningsloven vi har satt i gang nye forenklingstidet,den nye reglen er ikkje at vi går frå fem år til ti år vi fjernar fem års reglen men vi ser at etter ti år så må ein føreta ein vurdering av om ein tilfredstiller dei krava som er er stilt vi gjennomfører nå forenklingar eee på veldig mange område eee vi har allereie fått vedtatt i stortinget forenklingar i bygningsloven vi har sett i gang nye forenklingstildet,3969.4,3996.0,26.59999999999991,2014-11-20,2014-11-20_proceedings.txt
Stortinget-20141120-095704_3996000_4023300,vi spider opp prosessen med digitalisering av hele plan og bygningsprosessen noe som vil være en stor forenkling både for kommuner for innbyggere og for for for næringen eee og vi har også eee lagt større vekt på eee at eee det skal lyttes til lokaldemokratiet i innsigelsessaker noe av det aller viktigste effekten av det er at sakene løses tidligere vere nivå,vi spider opp prosessen med digitalisering av heile plan og bygningsprosessen noko som vil vere ein stor forenkling både for kommunar for innbyggjarar og for for for næringa eee og vi har også lagt større vikt på eee at eee det skal lyttast til lokaldemokratiet i innsigelsesaker no har det aller viktigaste effekten av det er at sakene løysast tidlegare vare nivå,3996.0,4023.3,27.300000000000182,2014-11-20,2014-11-20_proceedings.txt
Stortinget-20141120-095704_4023300_4032600,det har vært en tendens til at ulike etater har lagt inn innsigelser i håp om at de skal vinne frem til slutt når detsrådens kontor,det har vore ein tendens til at ulike tatar har lagt inn innsigelser i håp om at dei skal vinne fram til slutt når detsrådens kontor,4023.3,4032.6,9.299999999999727,2014-11-20,2014-11-20_proceedings.txt
Stortinget-20141120-095704_4032600_4062300,eee når eee sakene skal løses tidligere vel så finner man gode løsninger i kommunen i et samarbeid med de ulike etatene det skal legges vekt på miljø det skal legges vekt på kulturminner men man kan finne de gode løsningene lokalt uten at man trenger å gå helt til departementets kontor derfor så har vi også sett en veldig kraftig nedgang i antall innsigelser som eee som havner i kommunal og moderniseringsdepartementet,eee når eee sakene skal løysast tidlegare vel så finn ein gode løysingar i kommunen i eit samarbeid med dei ulike etatane det skal leggast vekt på miljø det skal legges vekt på kulturminner men ein kan finne dei gode løysingane lokalt utan at ein treng å gå kjel til departementets kontor derfor så har vi også sett ein veldig kraftig nedgang i antal innsigelser som eee som hamner i kommunal og moderniseringsdepartementet,4032.6,4062.3,29.700000000000273,2014-11-20,2014-11-20_proceedings.txt
Stortinget-20141120-095704_4062300_4080200,eee og vi har også eee markert et klart eee skift fra at om lag syttifem prosent av innsigelsene ble eee eee ble eee akseptert til at det nå er syttifem til åtti prosent av kommunens synspunkter som blir eee ivaretatt,eee og vi har også markert eit klart skift frå at om lag syttifem prosent av innsigelsene blir eee eee blir eee akseptert til at det nå er syttifem til åtti prosent av kommunessynspunkter som blir eee ivaretatt,4062.3,4080.2,17.899999999999636,2014-11-20,2014-11-20_proceedings.txt
Stortinget-20141120-095704_4080200_4108399,president jeg er glad for at eee komiteen har behandlet denne saken raskt og og effektivt det er forslag som vil bli godt mottatt eee i kommunenorge og som vil bidra til at vi får raskere og mere rasjonelle behandling av den type saker det blir replikkordskifte begrenset til fem replikker og og første replikant er representanten åsmund aukrustgate,president jeg er glad for at komiteen har behandla denne saka raskt og og effektivt det er forslag som vil bli godt mottatt eee i kommune noreg og som vil bidra til at vi får raskare og meir rasjonelle behandling av den typen sakerdet blir replikkordskifte begrense til fem replikker og og første replikant er representanten åsmund aukrust sausen,4080.2,4108.399,28.199000000000524,2014-11-20,2014-11-20_proceedings.txt
