file,text_bm,text_nn,start,end,duration,date,proceedingsfile
Stortinget-20141205-085651_142200_144600,detonerte tarutao,ose peråd president takk,142.2,144.6,2.4000000000000057,2014-12-05,2014-12-05_proceedings.txt
Stortinget-20141205-085651_265900_274400,da venter det på mmestad,nodvendig dansande,265.9,274.4,8.5,2014-12-05,2014-12-05_proceedings.txt
Stortinget-20141205-085651_342600_372000,jeg skal bare få mikrofon sko er lovlig satt det foreligger en rekke permisjonssøknader fra representantene jan arild ellingsen sverre myrli og hans olav syversen om permisjon i tiden fra og med åttende desember til og med tiende desember alle for å delta i transatlantisk forum for natos parlamentariske forsamling i washington fra representanten åsmund aukrust tina bru rigmor andersen eide ola elvestuen og skar grimstad,eg skal vere på mikrofonen sku eee lov lisettdet foreligger en rekke permisjonssøknader fra representanten jan arid ellingsen sverre mulig å han soloviversen om permisjon i tiden fra med åttande desember til og med tiende desember over for å delta i transatlantisk forum for natos parlamentariske forsamling i vosingten frei representanten åsmund aukrust tine bru igmor andersen eide ola elvestuen og oskar råd grimstad,342.6,372.0,29.399999999999977,2014-12-05,2014-12-05_proceedings.txt
Stortinget-20141205-085651_372000_398800,samt eee for den møtende vararepresentant for oslo ingunn gjerstad om permisjon i tiden fra og med åttende desember til og med tolvte desember alle for å delta i høynivådelen av den tyvende parts konferanse under f fns klimakonvensjon og den tyvende partskonferanse under kotoprotokollen i limafra fremskrittspartiets stortingsgruppe om permisjon for representanten kennet svensen i tiden fra og med åtte desember,samt for den møten å vare representant for oslo ingunn gjerstad om permisjon i tiden fra med åttende desember til og med tolvte desember alle for å delta i høgnivå delen av den typene partskonferanse under f fns klimakonvensjon og den tyvane partskonferanse under kuatoprotokollen i lima der har fremstegspartiet stortingsgruppe ein permisjon for representanten kennet svensen i tiden fram med åtte desember,372.0,398.8,26.80000000000001,2014-12-05,2014-12-05_proceedings.txt
Stortinget-20141205-085651_398800_426800,for som leder av stortingets ipu delegasjon å delta i parlamentarikermøte under den tyvende partskonferanse under fns klimakonvensjon i lima disse søknader foreslås behandlet straks og innvilget dette anses vedtatt qqq fra andre vararepresentant for oslo livia kors og salves foreligger søknad om fritak for å møte under representanten heikki eidsvoll holmås permisjon i dagene åttende og niende desember av velferdsgrunner,kva er de som leder av stortingets ipudelegasjon og delta i parlamentarikemøte under den tyvende parkskonferanse under fns klimakonvensjon i lima desse søknader foreslås behandles straks og innvilget dette anses vedtatt frå andre vararepresentant for oslo olivia corso saves foreligge søknad om fritak for å møte unne representanten heike eidsvold homos permisjon i dagene åtten nien i desember av velferdsgrunner,398.8,426.8,28.0,2014-12-05,2014-12-05_proceedings.txt
Stortinget-20141205-085651_426800_453300,denne søknaden foreslås behandlet straks og innvilget det anses vedtatt følgende vararepresentanter foreslås innkalt for å møte i permisjonstiden for akershus fylke are helseth og anne odenmarck for møre og romsdal fylke mette hanne kamhaug og steinar reiten for nordland fylke dagfinn henrik olsen og gretar johannes solefald for oslo og livia corsosalus pål eeri,denne søknaden foreslås behandles straks og innvilget det anses vedtatt følgende vararepresentanter foreslås innkalt for å møte i permisjonstiden for akershus fylke are helseth og anne odenmark for møre romsdalfylket mette hanne kamhaug og stener i reiten for nordland fylke dagfinn henrik olsen og grete johannes volfag for oslo olivia korte saves pål eeri,426.8,453.3,26.5,2014-12-05,2014-12-05_proceedings.txt
Stortinget-20141205-085651_453300_475800,gunn guri melby og anne katrine sjøsammer for rogaland fylke sisil knutsen hegdal dette anses også vedtatt til behandling foreligger de saker som er oppført på dagsorden nummer tjuefire før sakene på dagens kart tas opp til beslutning vil presidenten opplyse om at møtet om nødvendig fortsetter utover klokken seksten,gun guri melby og ann katrine sjøsamir på rogarlandfylket cisild knutsen heggdal dette anses også vedtatt til behandling foreligger dei saker som er oppført på dagsorden nummer tjuefire før sakene på dagens kart tas opp til beslutning vil presidenten opplyse om at møtet om nødvendig fortsetter utover klokken seksten,453.3,475.8,22.5,2014-12-05,2014-12-05_proceedings.txt
Stortinget-20141205-085651_479600_498000,sak en innstilling fra kontroll og konstitusjonskomiteen om bevilgninger på statsbudsjettet for tjuefemten kapittel under finansdepartementet og kommunal og moderniseringsdepartementet rammeområde fjorten innstilling ti s tjuefjorten tjuefemten jamfør proposisjon en s tjuefjorten tjuefemten,sak en innstilling frå kontroll og konstitusjonskomiteen om bevilgninger på statsbudsjettet for tjuefemten kapitte under finansdepartementet og kommunal og moderniseringsdepartementet rammeområde fjorten innstilling tis tjuefjorten tjuefemten jamfør proposisjon ens tjuefjorten tjuefemten,479.6,498.0,18.399999999999977,2014-12-05,2014-12-05_proceedings.txt
Stortinget-20141205-085651_502300_507600,første taler er martin kolberg komiteens leder,første taler er martin kolberg komiteens leder,502.3,507.6,5.300000000000011,2014-12-05,2014-12-05_proceedings.txt
Stortinget-20141205-085651_519200_548700,ærede president vi skal nå behandle kontroll og konstitusjonskomiteens budsjett som er ramme nummer fjorten dette er jo som stortinget kjenner til en av de minste rammene og antagelig det minst kontroversielle eee bevilgningene på denne rammen omfatter det kongelige hus og stortinget og dets underliggende organer og utgjør til sammen to komma to milliarder kroneren samlet komite står bak tilrådningen,er det president vi skal no behandle kontroll og konstitusjonskomiteens budsjett som er ramme nummer fjorten dette er jo som stortinget kjenner til ein av dei minste rammene og antakeleg det minst kontroversielle eee bevilgninga på denne rammen omfattar det kongelege hus og stortinget og des underliggande organ og utgjer til saman to komma to milliardar kroner ein samleskomite står bak tilrådninga,519.2,548.7,29.5,2014-12-05,2014-12-05_proceedings.txt
Stortinget-20141205-085651_548700_578500,og komiteens merknader er enstemmige jeg har vært saksordfører for budsjettkapittelet til stortinget og til riksrevisjonen og jeg la meg si noe kort om dette president bevilgning til stortinget utgjør i overkant av en komma fire milliarder kroner de største postene er driftsutgifter større ustyrskjøp og tilskudd til partigruppene det er beregnet at det vil koste åtte hundre og syttifem millioner kroner og drifte stortinget,og komiteens merknader er einstemmige eg har vore saksordførar for budsjettkapitlet til stortinget og til riksrevisjonen og eg la seier noko kort om dette president bevringing til stortinget utgjer i overkant av ein komma fire milliardar kroner dei største postane er driftsutgifter større utstyrskjøp og tilskot til partigruppene det er bereknat at det vil koste åtte hundre og syttifem millionar kroner og drift i stortinget,548.7,578.5,29.799999999999955,2014-12-05,2014-12-05_proceedings.txt
Stortinget-20141205-085651_578500_605100,neste årvidere er posten for større usyrkjøp og vedlikehold stor denne gangen på nærmere tre hundrede og femti millioner kroner noe som skyldes det omfattende arbeidet med å rehabilitere stortingets lokaler i prinsenskatte det er viktig for oss alle at vi har et veldrevet og velfungerende storting stortinget er arbeidsplass for representantsjon,neste år vidare posten for større utstyrkjøp og vedlikehold stor denne gongen på nærmare tre hundrede og femti millionar kroner noko som skyldast det omfattande arbeidet med å rehabilitere stortingets lokalar i prinsesskattendet er viktig for oss alle at vi har eit veldrive og velfungerande storting stortinget er arbeidsplass for representansjon,578.5,605.1,26.600000000000023,2014-12-05,2014-12-05_proceedings.txt
Stortinget-20141205-085651_605100_634400,i tillegg til er det en viktig møteplass for en lang rekke interesser skoleklasser besøk fra inn og utland og så videre men først og fremst er stortingets viktigste inst stortinget landets viktigste institusjon og landets viktigste bygg og i dette jubileumsåret har vi virkelig grunn til å være stolt av vår storting jeg vil derfor president fra mitt ståsted benytte anledningen til å berømme det flotte arbeidet som er lagt ned i tilknytning til to hundreårsjubileet,i tillegg til ære ein viktig møteplass for ei lang rekke interesser skoleklasser besøk frå inn og utland og så vidare men først og fremst er stortingets viktigaste innst stortinget landets viktigaste institusjon og landets viktigaste bygg og i dette jublemsåret har vi verkeleg grunn til å vere stolt av vårt storting eg vil derfor president frå mitt ståsted benytte anledninga til å berømme det flotte arbeidet som er lagt ned i tilknytning til to hundre årsjubileet,605.1,634.4,29.299999999999955,2014-12-05,2014-12-05_proceedings.txt
Stortinget-20141205-085651_634400_662400,for grunnloven som leder for kontroll og konstitusjonskomiteen har jeg hatt gleden og æren av å delta på en rekke arrangementer det har vært både inspirerende og lærerrikt jubileet har lykkes med å gjøre folk bedre kjent med de viktigste hendelsene på eishold for to hundre år siden på grunnlovens og på grunnlovens betydning for det samfunnet vi mer sommelig har bygget opp siden to for i løpet av disse to hundrede årene,for grunnlova som leder for kontroll og konstitusjonskomiteen har g hatt leden og æren av å delta på ein rekkearansjementr det har vore både inspirerande og lærerikt juble har lykkast med å gjere å få opp betre kjent med dei viktigaste hendelsene på svag for to hundre år sidan og på grunnlovas og på grunnlovens betydning for det samfunnet vi meir sommelig har bygt opp sidan to for i løpet av desse to hundrede år,634.4,662.4,28.0,2014-12-05,2014-12-05_proceedings.txt
Stortinget-20141205-085651_662400_690800,jeg tillater meg også minne om at også kontroll kontroll og konstitusjonskomiteen arbeidet hardt for å bidra til jubileet i forkant av syttende mai da komiteen behandlet forslagene om modernisering av språket i grunnloven og nye bestemmelser om menneskerettigheter vi kunne dermed feire selve jubileet men språklig innholdsmessig oppdatert grunnlov som kan nå ut til langt fler enn det som tidligere har vært tilfellet,eg tillet meg også minner om at også kontro kontroll og konstitusjonskomiteen arbeider hardt for å bidra til juble i forkant av syttande mai då komiteen behandla forslaga om modernisering av språket i grunnlova og nye bestemmelser om menneskerettighetervi kunne dermed feire sjølve juble med språkeleg innholdsmessig opptatt av grunnlov som kan nå ut til langt fleire enn det som tidlegare har vore tilfellet,662.4,690.8,28.399999999999977,2014-12-05,2014-12-05_proceedings.txt
Stortinget-20141205-085651_690800_719000,så til riksrevisjonen eee det er jo helt kjent at det er stortingets største eksterne kontrollorgan som skal bistå oss til å utføre det parlamentariske kontrollen dette er en formidabel oppgave som vi som parlamentarikere ikke er i stand til å håndtere alene selvriksrevisjonen leverer tolv til tretten forvaltningsrapporter hvert år og i tillegg en rapport,så til riksrevisjonen eee det er jo heilt kjent at det er stortingets største eksterne kontrollorgan som skal bista oss til å utføre det paramentaiske kontrollen dette er ein formidabel oppgåve som vi som parlamentarikar ikkje er istand til å handtere alene sell riksrevisjonen leverer tolv til tretten forvaltningsrapporter kvart år og i tillegg ein rapport,690.8,719.0,28.200000000000045,2014-12-05,2014-12-05_proceedings.txt
Stortinget-20141205-085651_719000_747100,om det statlige eierskapet i en rapport om og en rapport om regnskapsrevisjonen der hele statsforvaltningen har vært under lupen dette er solide og faglige tunge rapporter og utgjør ryggraden i kontrollkomiteens arbeid noen kan til tide mene at riksrevisjonen går for å eee for omfattende til verks men vi ser stadig eksempler på at riksrevisjonen bidrar til at forvaltningen bedrer seg,om det statlege eigarskapet i ein rapport om og ein rapport om rekneskapsrevisjonen der heile statsforvaltninga har vore under lupen dette er solide og faglege tunge rapportar og utgjer ryggraden i kontrollkomiteens arbeid nokon kan til tidleg menom at riksrevisjonen går for å eee for omfattande til verks men vi ser stadig eksempel på at riksrevisjonen bidrar til at forvaltninga betrer seg,719.0,747.1,28.100000000000023,2014-12-05,2014-12-05_proceedings.txt
Stortinget-20141205-085651_747100_775500,og det er nettopp det som er poenget komiteen har i inneværende år holdt kontrollhøringer i tre saker fra riksrevisjonen og vi ser fram til flere interessante og utfordrende rapporter fra riksrevisjonen også i totusenogfem og slutter oss til forslaget til bevilgninger til eee riksrevisjonen eee komiteens budsjettramme om omfatter også bevilgninger til de øvrige av stortingets unnleggende institusjoner,og den let opp det som er poenget komiteen har i inneverande år holt kontrollhøyringar i tre saker frå riksrevisjonen og vi ser fram til fleire interessante og utfordrande rapportar frå riksrevisjonen også i totusenogfem og slutta oss til forslaget til bevilgninger til eee riksrevisjonen eee komiteens budsjettramme om omfattar også bevilgninga til dei øvrige stortingets unnleggnde institusjonar,747.1,775.5,28.399999999999977,2014-12-05,2014-12-05_proceedings.txt
Stortinget-20141205-085651_775500_805200,det er sivilombudsmannen som er stortingets tillitsmann å føre kontroll med at det ikke begås urett mot den enkelte borger ombudsmannen har en viktig funksjon i vårt samfunn og vi nok vi og vi og vet nok bedre enn de fleste hvor forvaltningen svikter eller kommer til kort det er en viktig rolle vi ser gjerne at ombudsmannen sender flere meldinger til stortinget eosutvalget har den krevende jobben med å føre kontroll med de såkalte hemmelige tjenester,det er sivilombodsmannen som er stortingets tillitsmann og fører kontroll med at det ikkje begås urett mot dei enkelte vart ombodsmannen har ein viktig funksjon i vårt samfunn og vi nok vi og vi og veit nok betre enn dei fleste vår forvaltninga sviktar eller kommer til kort det er ein viktig rolle vi ser gjerne at ombodsmannen sender fleire meldingar til stortinget eosutvaget har den krevjande jobben med å føre kontroll med dei såkalla hemmelege tenester,775.5,805.2,29.700000000000045,2014-12-05,2014-12-05_proceedings.txt
Stortinget-20141205-085651_805200_830900,også dette er svært viktig demokratisk kontroll vi ser at budsjettet for totusenogfemten tar høyde for at utvalget og dets sekretariat er i vekst det er store utfordringer og stor oppmerksomhet mot eee eee mot landets eee etterretnings og sikkerhetstjenester og det er betryggende å ha en solid kontrollorgan som hele tiden følger med på at tjenestene opererer innenfor rammer,også dette er svært viktig demokratisk kontroll vi ser at budsjettet for totusenogfemten der høyde for at utvalet og det sekretarialt er i vekst det er store utfordringar og stor oppmerksomhet mot eee eee mot landets eee etterretnings og sikkerheitskjenester og det er betryggande å ha ein solid kontrollorgan som heile tida følgjer med på at tenestene opererer innanfor rammer,805.2,830.9,25.699999999999932,2014-12-05,2014-12-05_proceedings.txt
Stortinget-20141205-085651_830900_858000,innenfor de rammeverket som stortinget har gitt i lov og instruks ombudsmannen for forsvaret gjør et viktig arbeid for å sikre rettighetene til vernepliktige og personell i forsvaret og gjennom besøk og klagebehandling bidrar ombudsmannen til å effektivisere forsvaret i totusenogfemten skal det opprettes et nytt nasjonal institusjon for menneskerettigheter det bevilges i dag ni komma tre mine institusjonen,det innanfor dei rammeverket som stortinget har gitt i lov og instruks ombodsmannen for forsvaret gjer eit viktig arbeid for å sikre rettighetene til vernpliktig og personelle forsvaret og gjennom besøk og klagebehandling bidrar ombodsmannen til å effektivisere forsvareti totusenogfemten skal det opprettast nytt nasjonal institusjon for menneskerettigheter det bevilgast i dag ni komma tre mine institusjonen,830.9,858.0,27.100000000000023,2014-12-05,2014-12-05_proceedings.txt
Stortinget-20141205-085651_858000_887200,som organisatorisk skal ligge under stortinget og være lokalisert og administrativt til tilknyttet sivilombudsmannen vi ser fram til at denne institusjonen kommer i gang og slutter oss til forslaget til bevilgning eee president eee på dette på denne måten så eee anbefaler jeg eee kontrollkomiteens innstilling eee slik som den er lagt fram for stortinget ingen flere har eee bedt om ordet qqq,som organisatorisk skal ligge under stortinget og vere lokalisert og administrati tilknytte sivilombodsmannen vi ser fram til at denne institusjonen kommer i gang og slutter oss til forslaget til bevilgning eee president eee på dette på denne måten så anbefalar eg eee kontrollkomiteens innstilling eee slik som den er lagt fram for stortingetingen fleire har eee bedt om det,858.0,887.2,29.200000000000045,2014-12-05,2014-12-05_proceedings.txt
Stortinget-20141205-085651_887200_915000,og debatten i sak en er dermed eee ferdig sak to innstilling fra energi og miljøkomiteen eee om bevilgninger på statsbudsjettet for tjuefemten vedkommende olje og energidepartementet kommunal og moderniseringsdepank departementet og klima og miljødepartementet rammeområde tolv og tretten innstilling i s tjuefjorten tjuefemten jamfør proposisjon tjuefjorten tjuefemten,og eee debatten i sak ein er dermed eee ferdig sak to innstilling frå energi og miljøkomiteen eee om bevilgninger på statsbudsjettet for tjuefemten vedkom over energidepartementet kommunal og moderniseringsdepartementet og klima og miljødepartementet rammeområde tolv og tretten innstilling ni s tjuefjorten tjuefemten jamfør proposisjon s tjuefjorten tjuefemten,887.2,915.0,27.799999999999955,2014-12-05,2014-12-05_proceedings.txt
Stortinget-20141205-085651_915000_943900,etter ønske fra komiteen vil presidenten foreslå at debatten blir begrenset til en time og trettifem minutter og at taletiden blir fordelt slik på gruppene arbeiderpartiet tredve minutter høyre tjuefem minutter fremskrittspartiet femten minutter kristelig folkeparti fem minutter senterpartiet fem minutter venstre fem minutter sosialistisk venstreparti fem minutter og miljøpartiet de grønne fem minutter videre vil presidenten foreslå at det innenfor den fordelte taletid blir gitt anledning til replikkordskifte på inntifem replikker med svar etter innlegg fra hovedtalere,etter ønske frå komiteen vil presidenten foreslå at debatten blir begrense til ein time og trettifem minutter og at taletiden blir fordelt slik på gruppene arbeidarpartiet tredve minutter høyre tjuefem minutt til framstegspartiet i femten minutt til kristeleg folkeparti fem minutt til senterpartiet fem minutt til venstre fem minutter sosialistisk eidsi parti fem minutter og miljøpartiet dei grøne fem minutt vidare vil presidenten foreslå at det innenfor den fordelte taletid blir gitt anledning til replikkordskifte på inntil fem replikkar med svar etter innlegg frå hovudtakarar,915.0,943.9,28.899999999999977,2014-12-05,2014-12-05_proceedings.txt
Stortinget-20141205-085651_943900_960700,fra hver partigruppe og fremmer medlemmer av regjeringen videre vil det bli foreslått at de som måtte tegne seg på talerlisten utover den fordelte taletid får en taletid på tre minutter dette anses vedtatt første taler er komiteens leder ola elvestuen,frå arbeidarpartiet i gruppe og fram med medlemmer av regjeringa vidare vil det bli foreslått at dei som måtte teikne seg på talerlisten utover den fordelte taletid får ein taletid på tre minutter dette anses vedtattførste taler er komiteens leder ola elvestuen,943.9,960.7,16.800000000000068,2014-12-05,2014-12-05_proceedings.txt
Stortinget-20141205-085651_970900_996700,president først vil jeg takke komiteen eee og for arbeidet og spesielt da samarbeidspartiene høyre fremskrittspartiet og krf for den enigheten som vi nå også har kommet fram til i komiteen eee og den fleksibiliteten som er utvist og spesielt så vil jeg på vegne av komiteen takke komitesekretæren for det jeg vil kalle fantastisk hjelp og bistand under denne prosessen president,president først vil eg takke komiteen eee og for arbeidet og spesielt da samarbeidspartia høgre framstegspartiet og krf for den einigheita som vi nå også har kome fram til i komiteen eee og den fleksibiliteten som er utvist og spesielt så vil eg på vegner av komiteen takke komitesekretæren for det vil kalle fantastisk hjelp og bistand under denne prosessen president,970.9,996.7,25.800000000000068,2014-12-05,2014-12-05_proceedings.txt
Stortinget-20141205-085651_996700_1023900,jeg tror først det er viktig å putte den debatten vi har i dag inn i et større perspektiv forskere fra fns miljøprogram unep estimerer at vi deler orda med om lag hundre millioner andre arter under to millioner av disse er beskrevet i dag eee og livets mangfold forsvinner raskt i dag dør arter ut i et tempo som er oppe tusen ganger høyere enn naturlig fns miljøprogram har estimert at det hver dag forsvinner mellom hundre og femti og to på verdensbasis,eg trur først det er viktig å putte den debatten vi har i dag inn i eit større perspektiv forskar frå fns miljøprogprogram unep estimerer at vi deler jorda med om lag hundre millionar andre artar under to millionar av desse beskrevet i dag eee og livets mangfald forsvinn raskt i dag dør arter ut i eit tempo som er opp til tusen gonger høgare enn naturleg fns miljøprogram har estimert at det kvar dag forsvinner mellom hundre og femti og to på vedesbasis,996.7,1023.9,27.199999999999932,2014-12-05,2014-12-05_proceedings.txt
Stortinget-20141205-085651_1023900_1051000,bare på norsk rødliste er nesten to tusen fire hundre arter truet samtidig viser vitenskaplig funn fra fns klimapanel i pcc eee at trenden med økende globale ceotoutslipp må snus i løpet av nærmeste framtid dersom vi skal klare å unngå alvorlige klimaendringer viktige politiske grep må tas så raskt som mulig for å gjøre det mulig å redusere verdens samlede utslipp av klimagasser med mellom femti og minst åtti pronen tjue,berre på norsk røliste er nesten to tusen fire hundre og arter tru samtidig viser vitenskapleg funn frå fns klimapanel ipcc er at trenden med aukande globale ser og toutslepp må snus i løpet av nærmaste framtid dersom vi skal klare å unngå alvorlege klimaendringar viktige politiske grep må tas så raskt som mulig for å gjere det mulig å redusere ven samlade utslepp av klimagassar med mellom femti og minst åtti pronan tjue,1023.9,1051.0,27.100000000000023,2014-12-05,2014-12-05_proceedings.txt
Stortinget-20141205-085651_1051000_1080800,femti dette er dramatiske tall president femti prosent innen tjuetredve eee jeg mener statsbudsjettet som eee blir vedtatt er et svar på disse problemene og utfordringer ikke hele svaret ikke et godt nok svar da mener jeg da måtte vi vedtatt venstres alternative budsjett men et svar som danner et godt grunnlag for arbeidet det neste året eee og budsjettet er blitt eee betydelig styrka,femti dette er dramatiske tal president femti prosent innan tjuetredve eee ja meiner statsbudsjettet som eee blir vedtatt er eit svar på desse problema og utfordringa ikkje heile svaret ikkje eit godt nok svar det meiner eg då måtte vi vedta at venstres alternative budsjett men eit svar som danner eit godt grunnlag for arbeidet det neste året eee og budsjettet har blitt eee betyder det styrke,1051.0,1080.8,29.799999999999955,2014-12-05,2014-12-05_proceedings.txt
Stortinget-20141205-085651_1080800_1100700,eee etter at det første fram framlegget ble lagt frem fra regjeringa eee det har vært en økning på miljø og klima på nærmere en komma ni milliarder kroner hvor det er en betydelig satsing både på kollektivtransport og ved miljøvennlige transportløsninger for næringslivet president innebar budsjettet,eee etter at det første fram framlegget blei lagt fram frå regjeringa eee da var det ein økning på miljø og klima på nærmare ein komma ni milliardar kroner borde vere ein betydeleg satsing både på kollektivtransport over ein lø miljøvenlege transportløysingar for næringslivet president inneber budsjettet,1080.8,1100.7,19.90000000000009,2014-12-05,2014-12-05_proceedings.txt
