file,text_bm,text_nn,start,end,duration,date,proceedingsfile
Stortinget-20140930-115503_355900_382700,stortingets møte er lovlig satt og velkommen tilbake til stortinget vi er fortsatt i den hundre og femtiåttende sesjonen eee det foreligger to permisjonssøknader fra fremskrittspartiets stortingsgruppe om permisjon for representanten ingebjørg godskesen tirsdag tredevte september for å delta i europarådets parlamentariske forsamlings tjuefjortensesjon fjesborg,stortingets møte er lovleg satt og velkommen tilbake til stortinget vi er fortsatt i den hundre og femtiåtte s sasjon eee det foreligger to permisjonssøknader frå framstegspartiets stortingsgruppe om permisjon for representanten ingebjørg gotskisen tista treddefte september for å delta i europarådets parlamentariske forsamlings tjuefjorten sesjon fjesbor,355.9,382.7,26.80000000000001,2014-09-30,2014-09-30_proceedings.txt
Stortinget-20140930-115503_382700_409900,og fra kristelig folkepartis stortingsgruppe om permisjon for representanten rigmor andersen eide tos tisdag tredevte september for å delta i de forente nasjoners sekstiniende ordinære generalforsamling i new york disse søknader foreslås behandlet straks og innvilget og det anses vedtatt vararepresentantene for austagderne lange myr,og frå kristelig folkeparti stortingsgruppe om permisjon for representanten rigmor andersen eide tåls tista tredefte september for å delta i dei forente nasjonar sekstininde ordinære generalforsamling i ny jorg desse søknader foreslås behandlet straf og innhylet og det anses vedtatt vararepresentanten for austagdene langemyr,382.7,409.9,27.19999999999999,2014-09-30,2014-09-30_proceedings.txt
Stortinget-20140930-115503_409900_434100,og for møre og romsdal fylke steinar reiten foreslås innkalt for å møte i permisjonstiden det anses også vedtatt lene langemyr og steinar reiten er til stede og de vil ta sete statsråd siv jensen vil overbringe sju kongelige proposisjoner,og for møre og romstad og fylke steinar reiten foreslåast innkalt for å møte i permisjonstiden det anses også ved lene langemyr og steiner reiten er til stede og dei vil ta sete statsråd siv jensen vil overbringe sju kongelege proposisjonar,409.9,434.1,24.200000000000045,2014-09-30,2014-09-30_proceedings.txt
Stortinget-20140930-115503_439200_466200,statsråd siv jensen vær så god ærede president på vegne av regjeringen har jeg æren av å overbringe sju kongelige proposisjoner samtykke til godkjennelse av eøskomiteens beslutning nummer to hundre og tjueåtte tjuetretten av trettende desember tjuetretten om innlemmelse i eøsavtalen av forordning ef nummer eee ett tusen ogsytti totusenogni om det felles europeiske luftrom og eøskomite hundre og syttifem,statsråd siv jensen ver så god ærede president på vegne av regjeringa har eg ei æren av å overbringe sju kunglig proposisjonar samtykke til godkjennelse av eøfkomiteens beslutning nummer to hundre og tjueåtte tjuetretten av trettende desember tjuetretten om innlemmelse i eøsavtalen av forodning ef nummer eee eitt tusenogsytti totusenogni om det felles europeiske luftrom og eøskomite hundre og syttifem,439.2,466.2,27.0,2014-09-30,2014-09-30_proceedings.txt
Stortinget-20140930-115503_466200_494100,tjuefjorten av tjuesyvende juni tjuefjorten om innlemmelse i eøsavtalen av forordning eu seks hundre og syttisju totusenogelleve om nettverksfunksjoner for lufttrafikkstyring samtykke til godkjenning av eøskomiteens beslutning nummer hundre og trettitre tjuefjorten og tjuesyvende juni tjuefjorten om innlemmelse i eøsavtalen av kommisjonsforordning eu nummer tre hundre og tjueåtte tjuetolv om den tekniske spesifikasjonen for samtrafikkvne med hensyn til delsystemet,tjuefjorten av tusene juni tjuefjorten om innlemmelse i eøsavtalen av forøydning eu seks hundre og syttisju totusenogelleve om nettverksfunksjonar for luft trafikkstyring samtykke til godkjenning av skomiteens beslutning nummer hundre og trettitre tjuefjorten a tjusivne juni tjuefjorten om innlemmelse i eøsavtalen av kommisjonsforårdning eu nummer tre hundre og tjueåtte tjuetolv om den tekniske spesifikasjonen for samtrafikkvne med hensyn til delsystemet,466.2,494.1,27.900000000000034,2014-09-30,2014-09-30_proceedings.txt
Stortinget-20140930-115503_494100_519400,telematikkprogrammer for godstrafikk utbygging og finansiering av e trettini svega kjørn rådal i hordaland samtykke til godkjennelse av eøskomiteens beslutning nummer ett hundre og femtitre tjuefjorten av niende juli tjuefjorten om innlemmelse i eøsavtalen av direktiv tjueelleve tjuefire eu om anvendelse av pasientrettigheter ved helsetjenester over landegrensene,telematikkprogrammet for godstrafikk utbygging og finansieringa er trettini s vegar kjørande rådal i hordaland samtykke til godkjennelse av eøskomiteens beslutning nummer eitt hundre og femtitre tjuefjorten av niande juli tjuefjorten om innlemmelse i eøsavtalen av direktiv tjueelleve tjuefire eu om anvendelse av pasientrettigheter ved helsetjenester over landegrensene,494.1,519.4,25.299999999999955,2014-09-30,2014-09-30_proceedings.txt
Stortinget-20140930-115503_519400_547800,samtykke til å sette i kraft en endringsprotokoll til skatteavtalen mellom norge og brasil av tjueførste august nittenåtti undertegnet i brasilia tjuende februar tjuefjorten samtykke til å sette i kraft en skatteavtale mellom norge og bulgaria undertegnet i sofia tjueandre juli tjuefjorten samtykke til inngåelse av protokoll av tjuetredje juni tjuefjorten om russlands tiltredelse til konvensjonen av sekstende desember nittenåttiåtte om bygging og drift av et europeisk synkrotronstråleanlegg es rf,samtykket til å setje i kraft ein endringsprotokoll til skatteavtalen mellom noreg og brasil av tjueførste augusti nittenåtti undertent i brasilia tjuende februar tjuefjorten samtykke til å sette i kraft ein skatteavtale mellom noreg og bulgaria underteknt i sofia tjueandre juli tjuefjorten samtykke til ingolf protokoll av tjuetredje juni tjuefjorten om russlands tiltredelse til konvensjonen av sestende desember nittenåttiåtte om bygging og drift av eit europeisk synkrotronstråleanlegg ersrf,519.4,547.8,28.399999999999977,2014-09-30,2014-09-30_proceedings.txt
Stortinget-20140930-115503_550000_579000,proposisjonene vil bli behandlet på reglementsmessig måte til behandling foreligger dagsorden nummer åttiåtte som inneholder kun en sak og det er referat men være oppmerksom på at alle representantene skal undertegne protokollen fra det hundre og femtiåttende storting etter at vi er ferdig med møtet når det gjelder referatet så ligger det der ute og skal også være tilgjengelig på,proposisjonene vil bli behandla på reglementsmessig måte til behandling foreligger dagsorden nummer åttiåtte som innehalder tun ein sak og det er referat men ver oppmerksam på at alle representantane skal underteikne protokollen frå det hundre og femtiåtnde storting etter at vi er ferdig med møtet når det gjeld referatet så ligg det der ute og skal også vere tilgjengeleg på,550.0,579.0,29.0,2014-09-30,2014-09-30_proceedings.txt
Stortinget-20140930-115503_579000_604900,ngsappen presidenten skal prøve å gjøre dette eee såpass forståelig at man skjønner hva slags referatsaker som er oppe til behandling det er først eee tre hundre og seksti og det er s eee en rekke lover som er sanksjonert av statsministerens kontor eee femtende august tjuefjorten som foreslås vedlagt protokollen,stortingsappen eee president en skal prøve å gjere dette eee såpass forståleg at ein skjønner var slags referatsaker som er oppe til behandling det er først eee tre hundre og seksti og det er eee s eee ein rekke love som er sanksjonert av statsministerens kontor eee femtende agust tjuefjorten som foreslås vedlagt protokollen,579.0,604.9,25.899999999999977,2014-09-30,2014-09-30_proceedings.txt
Stortinget-20140930-115503_604900_630300,så er det tre hundre og sekstien eee hvor det også er statsministerens kontor som meddeler at flere lover er sanksjonert tjueniende august tjuefjorten det foreslås også vedlagt protokollen eee det er eee videre eee statsministerens kontor som meddeler om lover som er sanksjonert tolvte september tjuefjorten,så er det tre hundre og sekstiein eee vor det også ei statsministerens kontor som medele at fleire lover er sasjonelt tjueniende august tjuefjorten det foreslås også vedlagt protokollen eee det er eee vidare eee statsministerens kontor som meddeler om lover som er sanksjonert til oppte september tjuefjorten,604.9,630.3,25.399999999999977,2014-09-30,2014-09-30_proceedings.txt
Stortinget-20140930-115503_630300_656500,eee det foreslås også vedlagt protokollen det er eee representantforslag altså tre hundre og sekstitre fra karin andersen og heikki eidsvoll holmås det er tre hundre og sekstifire som er et representantforslag fra stortingsrepresentantene karin andersen og snorre serigstad valen begge de foreslås sendt arbei,eee det foreslås også vedlagt kroton det er eee representantforslag altså tre hundre og sekstitre frå karin andersen og heike eidsvold hornås der tre hundre og sekstifire som er eit representantforslag frå stortingsrepresentanten karin andersen og snoris erikstad wahlen begge dei foreslås sendt arbei,630.3,656.5,26.200000000000045,2014-09-30,2014-09-30_proceedings.txt
Stortinget-20140930-115503_656500_680200,det er et representantforslag fra per olaf lundteigen og marit arnstad eee og det er et fra ola elvestuen og flere andre representanter fra venstre så begge foreslås sendt energi og miljøkomiteen det er tre hundre og sekstisju som er et representantforslag fra flere venstrerepresentanter som også foreslås sendt energi og miljøkomiteen,det er er eit representantforslag frå per olaf lundteigen og marit arnstad eee og det er eit frå ola elvestuen eee og fleire andre representantar frå venstre og begge foreslås sendt energi og miljøkomiteen det er tre hundre og sekstisju smer eit representantforslag frå fleire venstrerepresentantar som også føreslår sendt energi og miljøkomiteen,656.5,680.2,23.700000000000045,2014-09-30,2014-09-30_proceedings.txt
Stortinget-20140930-115503_680200_709600,og videre et representantforslag fra sv som foreslås sendt energi og miljøkomiteen det er tre hundre og sekstini som også er et representantforslag fra eee blant annet rigmor aasrud som foreslås sendt familie og kulturkomiteen og det er tre hundre og sytti som er eee samtykke til å sette i kraft en endringsprotokoll til skatteavtalen mellom norge og brasil som foreslås sendt finanskomiteen,og vidare eit representantforslag frå sv som foreslås sendt energi og miljøkomiteen det er tre hundre og sekstini som også har eit representantforslag frå eee blant anna rigmor aasrud som foreslås sendt familie og kulturkomiteen og det er tre hundre og sytti som er eee samtykke til å sette kraft eee ein endringsprotokoll til skatteavtalen mellom noreg og brasil som foreslås sendt finanskomiteen,680.2,709.6,29.399999999999977,2014-09-30,2014-09-30_proceedings.txt
Stortinget-20140930-115503_709600_735400,det er tre hundre og syttien samtykke til å sette i kraft en skatteavtale mellom norge og bulgaria som foreslås sendt finanskomiteen det er tre hundre og syttito som er et representantforslag fra sverre myrli et cetera som foreslås sendt finanskomiteen det er eee forslag tre hundre og syttitre som er samtykke til godkjenning av en eøskomitebeslutning som foreslås sendt helse og omsorgskomiteen,det er tre hundre og syttiein samtykke til å sette kraft ein skatteavtale mellom noreg og bulgaria som foreslås sendt finanskomiteen det er tre hundre og syttito som er eit representantforslag frå sverre mulig eit setra som foreslås sendt finanskomiteen det er ei forslag tre hundre og syttitre som er samtykke til godkjenning av ein eøskomitbeslutning som foreslås sendt helse og omsorgskomiteen,709.6,735.4,25.799999999999955,2014-09-30,2014-09-30_proceedings.txt
Stortinget-20140930-115503_735400_762000,som foreligger utkast til innstilling for utenriks og forsvarskomiteen til uttalelse før innstilling avgis det er tre hundre og syttifire som også er et representantforslag fra blant annet kjersti toppe og olaug bollestad som foreslås sendt eee helse og omsorgskomiteen det er tre hundre og syttitre et representantforslag fra kjersti toppe og per olaf lundteigen som foreslås sendt helse,som foreligger utkast til innstilling for utenriks og forsvarskomiteen til uttalelse for innstilling av gift det er tre hundre og syttifire som må se eit representantforslag frå blant anna kjersti toppe og ola bollestad som foreslås sendt eee helse og omsorgskomiteen det er tre hundre og syttitre eit representantforslag frå city toppe og per olaf lundteigen som foreslås sendt helse,735.4,762.0,26.600000000000023,2014-09-30,2014-09-30_proceedings.txt
Stortinget-20140930-115503_762000_791500,eee det er forslag tre hundre og syttiseks om inngåelse av en protokoll eee foreslås sendt kirke utdannings og forskningskomiteen som forelegger sitt utkast til innstilling for utenriks og forsvarskomiteen til uttalelse før innstilling avgis tre hundre og syttisju et representantforslag fra blant annet stortingsrepresentantene christian tybring christian tynning bjørnø tone merete sønsterud marianne aasen som foreslås sendt,eee det er eee forslag tre hundre og syttiseks om inngåelse av ein tprotokol eee foreslås ein sirkeutdannings og forskingskomiteen som forelegger sitt utkast til innstilling for utenriks og forsvarskomiteen til uttalelse før innstilling avgis tre hundre og syttisju eit representantforslag frå blant anna stortingsrepresentanten kristian tybring kristian tynning bjørnø tone merete centre og marianne aasen som foreslåast sent,762.0,791.5,29.5,2014-09-30,2014-09-30_proceedings.txt
Stortinget-20140930-115503_791500_820400,kirke utdannings og forskningskomiteen det er tre hundre og syttiåtte som er et representantforslag fra senterpartiet som foreslås sendt kirke utdannings og forskningskomiteen tre hundre og syttini et representantforslag fra blant annet anders tyvand hans fredrik grøvan rigmor andersen eide et cetera som foreslås sendt kirke utdannings og forskningskomiteen tre hundre og åtti er riksrevisjonens undersøkelse om nav,sikeutdanings og forskningskomiteen det er tre hundre og syttiåtte som er eit representantforslag frå senterpartiet som foreslås sendt tilkeutdannings og forskingskomiteen tre hundre og syttini eit representantforslag frå blant anna anders tyvand hans fredrik grøvan rigmor andersen eide epsetra som foreslås sendt cirkeutdannings og forskingskomiteen tre hundre og åtti er riksrevisjonens undersøkelse om nav,791.5,820.4,28.899999999999977,2014-09-30,2014-09-30_proceedings.txt
Stortinget-20140930-115503_820400_840700,tre hundre foreslås sendt kontroll og konstitusjonskomiteen det samme gjelder tre hundre og åttien og det gjelder tre hundre og åttito som altså foreslås sendt kontroll og konstitusjonskomiteen og tre hundre og åttitre som også er en riksrevisjonssak som foreslås sendt kontroll og konstitusjonskomiteen det,tre hund foreslås sendt kontroll og konstitusjonskomiteen det same gjeld tre hundre og åttien og det gjeld tre hundre og åttito som altså foreslåast sendt ved kontroll og konstitusjonskomiteen og tre hundre og åttitre som også er ein riksrevisjonsak som foreslåast sendt kontroll og konstitusjonskomiteen det,820.4,840.7,20.300000000000068,2014-09-30,2014-09-30_proceedings.txt
Stortinget-20140930-115503_840700_865900,om lederlønninger fra sv som foreslås sendt næringskomiteen som forelegger sitt utkast til innstilling for kommunal og forvaltningskomiteen til uttalelse før innstilling avgis og det er en eøssak som er tre hundre og åttifem som foreslås sendt transport og kommunikasjonskomiteen som forelegger sitt utkast til innstilling for utenriks og forsvarskomiteen til uttalelse før innstilling avgis,om lederlønninger frå sv som foreslås sett næringskomiteen som forelegger sitt utkast til innstilling for kommunal og forvaltningskomiteen til uttalelse før innstilling avgis og det er ein eøssak som er tre hundre g åttifem som foreslås sendt transport og kommunikasjonskomiteen som forelegger sitt utkast til innstilling for utenriks og forsvarskomiteen til uttalelse før innstilling avgis,840.7,865.9,25.199999999999932,2014-09-30,2014-09-30_proceedings.txt
Stortinget-20140930-115503_865900_890400,og det er en enda en eøssak tre hundre og åttiseks som foreslås sendt transport og kommunikasjonskomiteen som forelegger sitt utkast til innstilling for utenriks og forsvarskomiteen til uttalelse før innstilling avgis så er det e trettini som foreslås sendt transport og kommunikasjonskomiteen der tre hundre og åttiåtte som er et representantforslag som foreslås sendt transport og kommunikasjonskomiteen,og det er ein enda ein eøsak tre hundre g åttiseks som foreslås sendt transport og kommunikasjonskomiteen som forelegger sitt utkast til innstilling for utenriks og forsvarskomiteen til uttalelse for innstilling avgift så er det ei trettini som foreslås sendt transport og kommunikasjonskomiteen der tre hundre og åttiåtte som er eit representantforslag som foreslås sendt transport og kommunikasjonskomiteen,865.9,890.4,24.5,2014-09-30,2014-09-30_proceedings.txt
Stortinget-20140930-115503_890400_918900,det er nok et representantforslag tre hundre og åttini fra sv om e atten vestkorridoren og det som foreslås sendt transport og kommunikasjonskomiteen det er tre hundre og nitti som er årsrapport fra stortingets delegasjon til nordisk råd for annet halvår tjuetretten og første halvår tjuefjorten som foreslås sendt utenriks og forsvarskomiteen og dette anses vedtatt eee,det er nok eit representantforslag tre hundre og åttini frå sv om eatten vestkorridoren og det som foreslås sendt transport og kommunikasjonskomiteen det er tre hundre og nitti som er årsrapport frå stortingets delegasjon til nordisk råd for anna halvår tjuetretten og første halvåret tjuefjorten som foreslåast sendt utanriks og forsvarskomiteen og dette anses vedtatt eee,890.4,918.9,28.5,2014-09-30,2014-09-30_proceedings.txt
Stortinget-20140930-115503_918900_948900,og da er det slik at stortinget er kommet til avslutningen av det hundre og femtiåttende storting som strekker seg til og med tredevte september derfor skal dere i dag undertegne protokollen det hundre og femtiåttende storting er den første sesjonen i inneværende valgperiode et høyt antall av representantene tok i fjor høst sete i stortinget for første gang og skal nå ta fatt på det hundre og femtiniende storting i morgen,og da er det slik at stortinget er komme til avslutninga av dei hundre og femtiåttnde storting som strekker seg til og med tredjee september der for skal vere i dag underteikna protokollen det hundre og femtiåttende storting er den første sesjonen i innvende valperiode eit høgt antal av representantane tok i fjor haust sete i stortinget for første gong og skal nå ta fatt både hundre og femtini storting i målet,918.9,948.9,30.0,2014-09-30,2014-09-30_proceedings.txt
Stortinget-20140930-115503_948900_977500,særlig dette året har vært og kommer til å bli begivenhetsrikt grunnlovstibileet fokus på menneskerettigheter og språklig endring av grunnloven representerer milepæler i den sesjonen som nå skal avsluttestallene forteller om stor aktivitet gjennom slo stortingsåret med spørretimespørsmål interpellasjoner skriftlige spørsmål og dokument åtte forslag stortinget har i løpet av denne sesjonen avholdt åttini møter,særleg dette året har vore å komme til å bli begynnelse rikt grunnlovsjubile fokus på menneskehetegheter og språkleg endring av grunnloven representerer milepæler i den sesjonen som nå skal avsluttast farne forteller om stor aktivitet gjennom slott stortingsåret med spørjetimespørsmål interpellasjoner skriftespørsmål og dokument åtteforslag stortinget har i løpet av denne sesjonen av hålt åttini meter,948.9,977.5,28.600000000000023,2014-09-30,2014-09-30_proceedings.txt
Stortinget-20140930-115503_977500_1003600,sju møter ble avsluttet i tidsrommet mellom folka seksten og atten i tillegg er det av hodt sytten kveldsmøter det vil si møter som varer utover klokka atten fire møter har gått utover den reglementsmessige tid klokka tjueto mens ett av disse har vært utover klokka tjuefire regjeringen har fremmet hundre og sekstifem saker for stortinget fordelt på sytt,sju møter bli avslutta i i tidsrommet mellom orka seksten og atten i tillegg er det av håsytten kveldsmøte det vil si møte som varer utover klokka atten fire møte har gått utover en reglementsmessie tid klokka tjueto mens eitt av desse har vore utover klokka tjuefireregjeringa har fremmet hundre og sekstifem saker for stortinget fordelt på sytt,977.5,1003.6,26.100000000000023,2014-09-30,2014-09-30_proceedings.txt
Stortinget-20140930-115503_1003600_1030099,seksti lovproposisjoner samt to kombinerte proposisjoner og tjuesju meldinger stortingsrepresentantene har fremmet hundre og fire representantforslag stortinget har behandlet tre hundre og elleve innstillinger fra komiteene regjeringen har bidratt til debatten i stortinget ytterligere med ti redegjørelserantall spørsmål til den ordinære spørretimen har vær,seksti lovproposisjonar samt to kombinerte proposisjonar og tjuesju meldingar stortingsrepresentantane har fremmet hundre og fire representantforslag stortinget har behandla tre hundre og elleve innstillingar frå komiteen regjeringa har bidrag til debatten i stortinget ytterlegare med ti redels antal spørsmål til den ordinære spørjetimen har var,1003.6,1030.099,26.49899999999991,2014-09-30,2014-09-30_proceedings.txt
Stortinget-20140930-115503_1030099_1058200,mens det har vært hundre og trettifem hovedspørsmål i den muntlige spørretimen regjeringen har i tillegg besvart syttiåtte interpellasjoner og fått ett tusen to hundre og sekstifem skriftlige spørsmål til besvarelse stortinget gjorde syttini anmodningsvedtak i inneværende sesjondet som har verdt å merke seg der er at vi skisserer på statistikken,mens det har vore hundre og trettifem ordspørsmål i den muntlige spørjetimen regjeringa har i tillegg besvart syttiåtte interpellasjonar og fått eitt tusen to hundre og sekstifem skriftlege spørsmål til besvarelsestortinget gjorde syttini avmodningsvedtak i inneværende sesjon det som har vore å merke seg der er at vi sku ser på statistikken,1030.099,1058.2,28.101000000000113,2014-09-30,2014-09-30_proceedings.txt
Stortinget-20140930-115503_1058200_1082600,så ser vi at dette tallet øker med mindretallsregjeringer og går kraftig ned i perioder med flertallsregjering stortinget har behandlet tolv grunnlovsforslag flere av dem er historiske vi har vedtatt en språklig fornyelse av grunnloven og en versjon av grunnloven på nynorsk grunnloven foreligger dermed i to likestilte målformer,så ser vi at dette talet øker med mindretalsregjeringa og går kraftig ned i periode med fleirtalsregjering stortinget har behandla to grunnlovsforslag fleire av dei er historiske vi har vedtatt ein språkleg fornyelse av grunnloven og ein versjon av grunnloven på nynorsk grunnloven foreligger dermed i to likestilte målformer,1058.2,1082.6,24.399999999999864,2014-09-30,2014-09-30_proceedings.txt
Stortinget-20140930-115503_1082600_1111700,slik har stortinget lagt til rette for en større bevissthet om innholdet i grunnloven i jubileumsåret vi har også gjort betydningsfulle grunnlovsvedtak om å styrke grunnlovens menneskerettighetsvern og mange har kalt det for den viktigste revisjonen av grunnloven siden attenfjortenmange vil si at eee endringene styrker grunnloven både som symbol og som et politisk dokument,slik har stortinget lagt til rette for ein større bevissthet om innhaldet i grunnloven i jubilemsåretvi har også gjort betydningsfulle grunnlovsvedtak om å styrke grunnlovens menneskerettighetsvern og mange har kalt det for den viktigaste revisjonen av grunnloven sidan attenfjortenmange vil si at eee endringane styrker grunnloven både som sibo og som eit politisk dokument,1082.6,1111.7,29.100000000000136,2014-09-30,2014-09-30_proceedings.txt
Stortinget-20140930-115503_1111700_1136500,det er positivt at vi i forkant av behandlingen i stortinget fikk en rik konstitusjonell debatt om grunnloven grunnloven har altfor sjelden vært gjenstand for offentlig debatt i norge i jubileumsåret oppnådde vi en debatt som fokuserte på det norske samfunns verdigrunnlag og på folkestyrets former og innhold og den folkelige oppslutningen har vært som alle her vet helt fantastisk,det er positivt at vi i forkant av behandlinga i stortinget fekk ein rik konstitusjonell debatt om grunnloven grunnloven har alt for selje vore gjenstand for offentleg debatt i noreg i jubileumsåret oppnådde vi ein debatt som fokuserte på det norske samfunns verdigrunnlav og på folkestyrets former og innhald og den folkelege oppslutninga har vore som alle her veit heilt fantastisk,1111.7,1136.5,24.799999999999955,2014-09-30,2014-09-30_proceedings.txt
