file,text_bm,text_nn,start,end,duration,date,proceedingsfile
Stortinget-20141120-095704_9643300_9669700,i budsjettforslaget til regjeringen så er det også foreslått en styrking av den høyere påtalemyndighet som skal gi muligheten til økt og bedre fagledelse vi foreslår å styrke den høyere påtalemyndigheten med nitten årsverk hvorav tolv år av årsverkene er statsadvokatembetet i tillegg så er det lagt inn eee midler for å sikre statsadvokatene eee konkurransedyktig lønn og for å eee skåne oss,i budsjettforslaget til regjeringa så har det også foreslått ein styrking av den høgre påtalemyndighet som skal gi muligheten til økt og betre fagledelse vi foreslår å styrke den høgre påtalemyndigheten med nitten årsverk vore av tolv o av årsverkene er statsadvokatembete i tillegg så har det lagt inn eee midler for å sikre statsadvokatene konkurransediktig lønn og for å eee skåme oss,9643.3,9669.7,26.400000000001455,2014-11-20,2014-11-20_proceedings.txt
Stortinget-20141120-095704_9669800_9692600,i saker om mistenkelig dødsfall som er etterforsket hvor politiet går inn for hengeleggelse er det nå også besluttet at videre spørsmål om henvende henleggelse nå skal avgjøres av statsadvokaten ikke av politiet men politiet skal gi en begrunnet tilrådning som grunnlag for statsadvokatens avgjørelse det følger av de nye retningslinjene fra riksadvokaten til statsadvokaten,i saker om mistenke dødsfall som har etterforska vår politiet går inn for hengeleggelse er det nå også besluttet at vidare spørsmål om henv henleggelse nå skal avgjerast av statsadvokaten ikkje av politiet men politiet skal gi ein begrunnet tilrådning som grunnlag for statsadvokatens avgjørelse det følger av dei nye retningslinjene for riksadvokaten til statsadvokaten,9669.8,9692.6,22.80000000000109,2014-11-20,2014-11-20_proceedings.txt
Stortinget-20141120-095704_9692600_9714700,riksadvokaten har også opprettet en arbeidsgruppe som skal undersøke etterforskningen og den påtalemessige behandlingen av dødsfallet i den konkrete eee saken interpellanten viser til fra dødsfallet fant sted og til etterforskning ble besluttet gjenopptatt undersøkelsen skal gjennomføres snarest mulig og det er satt en tidsfrist senest ut i januar totusenogfemten,riksadvokaten har også oppretta ein arbeidsgruppe som skal undersøke etterforskinga og den påtalemessige behandlinga av dødsfallet i den konkrete eee saka interpellanten viser til frå dødsfallet fan til stad og til etterforsking blei besluttet gjennopptatt undersøkelsen skal gjennomførast snarast mulig og det at en tidsfrist senast ut i januar totusenogfemten,9692.6,9714.7,22.100000000000364,2014-11-20,2014-11-20_proceedings.txt
Stortinget-20141120-095704_9714700_9739900,formålet med denne undersøkelsen president er å avdekke om det kan trekkes politi og påtale faglig læring ut fra det arbeidet som er gjort i denne nevnte perioden gruppen skal i sin rapport til riksadvokaten gi råd om hvordan eventuelle læringspunkter kan implementeres i politi og påtalemyndighet og slik kunne bidra til god kvalitet i arbeidet fremover så har interpellanten et godt poeng når hun sier at vi kanskje har lært for dårlig tidligere,formålet med denne undersøkelsen president er å avdekke om det kan trekkast politi og påtale fagleg læring ut frå det arbeidet som er gjort i denne nemnte perioden gruppen skal i sin rapport til riksadvokaten gi råd om korleis eventuelle læringspunkter kan implementerast i politi og påtalemyndigheit og slik kunne bidra til god kvalitet i arbeidet framover så har interpellanten eit godt poeng når han seier at vi kanskje har lært for dårleg tidlegare,9714.7,9739.9,25.19999999999891,2014-11-20,2014-11-20_proceedings.txt
Stortinget-20141120-095704_9739900_9764400,det viser også politianalysen at en har for dårlig læringsevner i politiet til å lære av egne feil og også lære av de som gjør det bedre dette er et arbeid som eee politidirektoratet nå har høyt fokus på for å sikre at best practice blir spredd samtidig som en skal lære av de fangle eee eee manglene og feilene som er blitt gjort,det viser også politianalysen at ein har for dårleg læringsevne i politiet til å lære av eigne feil og også lære av dei som gjer det betre dette er eit arbeid som eee politidirektoratet nå har høgt fokus på for å sikre at best praktis blir spredd samtidig som ein skal læra dei fangla eee me manglane og feila som er blitt gjort,9739.9,9764.4,24.5,2014-11-20,2014-11-20_proceedings.txt
Stortinget-20141120-095704_9764400_9793600,så har president spesialenheten for politisaker iverksatt en bred etterforskning på grunnlag og anmeldelse mot personer som deltok i den innledende delen av etterforskningen av den konkrete saken først når en kjenner eee utfallet av arbeidsgruppens undersøkelser og spesialenhetens eee etterforskning vil det være grunnlag for å trekke konklusjoner om hvordan saken ble behandlet i politiet og påtalemyndigheten jeg vil også understreke president at saken fortsatt er eee under etterforskning,så har eee president spesialenheten for politisaker i vekst ein brei etterforsking på grunnlag og anmedelse mot personar som deltok eee i den innledande delen av etterforskinga av den konkrete saka først når en kjenner eee utfallet av arbeidsgruppens undersøkelser og spesialenhetens eee etterforsking vil vere grunnlag for å trekke konklusjonar om kvar dei saka blei behandla i politiet og påtalemyndigheten eg vil også understreke president at saka fortsatt er eee under etterforskning,9764.4,9793.6,29.200000000000728,2014-11-20,2014-11-20_proceedings.txt
Stortinget-20141120-095704_9793600_9823600,helt uavhengig av dette så er det besluttet å opprette en egen gruppe ved kripos som skal ha til oppgave å gjennomgå ikke oppklarte saker såkalte cold case saker med sikte på å vurdere ytterligere etterforskningsskritt i gamle saker som er henlagt opprettelsen av gruppen henger sammen med et årelangt politisk engasjement kombinert med at stortinget nylig fjernet foreldelsesfristen på de mest alvorlige volds og sedelighetsforbrytelsene i mange slike saker så kan det være avgjørende at man ser på saken med friske nye øyne,heilt uavheng av dette så har det besluttet å oppretta ein eigen gruppe ved kripos som skal ha til oppgåver å gjennomgå ikkje oppklarte saker i såkalla kollkassaker med sikte på å vurdere ytterlegare etterforskningskitt i gamle saker som er hendlar opprettelsen av gruppene henger sama med eit årlag politisk engasjement kombinert med at stortinget nyleg fjerna foreldelsesfristen på dei mest alvorlege valds og sedelegheitsforbrytelsene i mange slike saker så kan det vere avgjerande at ein ser på saka med friske nye øyne,9793.6,9823.6,30.0,2014-11-20,2014-11-20_proceedings.txt
Stortinget-20141120-095704_9823600_9853200,og et helt nytt blikk for å komme videre en rapport fra politidirektoratet i totusenogtretten viser at det er behov for å se på både kapasitet og kvalitet i etterforskningen i politiet og etterforskningsarbeidets generelle vilkår rapporten foreslår blant annet å styrke etterforskningens posisjon i norsk politi denne rapporten følges nå opp i politidirektoratet i samarbeid med riksadvokaten en rekke tiltak som dessuten også inngår i politianalysens eee vurderinger,og eit heilt nytt blikk for å kome vidare ein rapport frå politidirektoratet i totusenogtretten viser at det er behov for å se på både kapasitet og kvalitet i etterforskinga i politiet og etterforskingsarbeidets generelle vilkår rapporten foreslår blant anna å styrke etterforskingas posisjon i norsk politi denne rapporten følgast nå oppe politidirektoratet i samarbeid med riksadvokaten ein rekke tiltak som dessutan også inngår i politianalysens eee vurderingar,9823.6,9853.2,29.600000000000364,2014-11-20,2014-11-20_proceedings.txt
Stortinget-20141120-095704_9853200_9878200,vil bli iverksatt dette omfatter blant annet harmonisering av politiets behandling av straffesaker standardisering av verktøy rutiner og metoder systematisk erfaringslæring og etablering av mer robuste solide og spesialiserte fagmiljøer jeg følger opp dette både i styler jeg følge opp dette i styringsdialogen med virksomhetene både gjennom de ordinære styringsdokumentene og i mine møter med virksomhetslederne,vil bli verksatdette omfattar blant anna harmonisering av politiets behandling av straffesaker standarisering av vardøy rutiner og metodar systematisk erfaringslæring og etablering av mer robuste solide og spesialiserte fagmiljø eg har følger opp dette både i sty eller eg følge op dette i styringsdialogen med virksomhetene både gjennom dei ordinære styringsdokumente og i mine møte med virksomhetslederane,9853.2,9878.2,25.0,2014-11-20,2014-11-20_proceedings.txt
Stortinget-20141120-095704_9878200_9908100,når det gjelder politiets arbeid med saker om vold i nære relasjoner inkludert vold mot barn er innsatsen betydelig intensivert den siste tiden det er tatt flere initiativ for å bedre politiets arbeid med slike saker både knyttet til forebyggende arbeid og til straffesaksbehandlingen saker om vold i nære relasjoner generelt og vold mot barn spesielt er kan være utfordrende for politi å etterforske og ofte blir politirollen satt på en prøve i disse sakene her betyr holdninger og kompetanse hås den enkelte tjenestemann mye,når det gjeld politiets arbeid med saker om vald i nære relasjonar inkludert vald mot barn er innsatsen betydeleg intensivert den siste tiden det har tatt fleire initiativ for å betre politiets arbeid med slike saker både knyttet til førebyggande arbeid og til straffesaksbehandlinga saker om vald i nære relasjonar generelt og vald mot barn spesielt er kan vere utfordrande for politiet å etterforske og ofte blir politirolla satt på ein prøve i desse sakene her betyr haldningar og kompetanse hos den enkelte tenestemann mykje,9878.2,9908.1,29.899999999999636,2014-11-20,2014-11-20_proceedings.txt
Stortinget-20141120-095704_9908100_9938100,kompetanse om og innsikt i problemområdet er av avgjørende betydning derfor jobber vi for å bedre kompetansen til norsk politi om vold i nære relasjoner inkludert vold og overgrep mot barn et viktig tiltak er ordningen med familievoldskoordinator i landets politidistrikt disse skal koordinere eee politidistriktets samlede innsats innen familievoldfeltet på samme vis er det opprettet seksuelle overgrepskoordinatorer i politidistriktene i noen distrikter er dette oppgaver som håndteres av samme person,kompetanse om og innsikt i problemområdet er av avgjerande betydning derfor jobbar vi for å betre kompetansen til norsk politi om vald i nære relasjonar inkludert vald og overgrep mot barn eitt viktig tiltak er ordninga med familievoldskordinator i lands politidistrikt desse skal koordinere eee politidistriktets samlede innsats innan familievald feltet på same vis er det oppretta eit seksuell overgrepskordinator i politidistrikta i nokon distrikta er dette oppgåver som handterast av same person,9908.1,9938.1,30.0,2014-11-20,2014-11-20_proceedings.txt
Stortinget-20141120-095704_9938100_9955300,flere distrikter har også egne team med en distriktsovergripende funksjon når det gjelder etterforskning av familievoldssaker eee og seksuelle overgrep det kan også opprettes egne team kong i konkrete etterforskningssaker og i de alvorligste sakene så yter eller kan kripos yte bistand,fleire distrikt har også eigne team med ein distriktsovergripande funksjon når det gjeld etterforsking av familievoldssaker eee og seksuelle overgrep det kan også opprettast eigne team on i konkrete etterforskingssaker og i dei alvorlegaste sakene så yter eller kan kripos yte bistand,9938.1,9955.3,17.19999999999891,2014-11-20,2014-11-20_proceedings.txt
Stortinget-20141120-095704_9955300_9984500,god etterforskning og oppfølging av sakene forutsetter at politiet er faglig oppdatert og vi har årlige samlinger for familievoldskoordinatorene som er et av de tiltakene som bidrar til økt kompetanse og erfaringsdeling den nasjonale kompetansedelingsportalen kode er også viktig og i tillegg så inngår vold i nære relasjoner som en del av politiets grunnutdanning dommeravhør av barn kan utgjøre en del av etterforskningen som bevis i en straffesak de fleste avhørene skjer i dag på et eee barnehus og alle politidistriktene har kompetanse innen barneavhør,god etterforsking og oppfølging av sakene forutsetter at politiet er fagleg oppdatert og vi har årlege samlingar frå familievoldskoordinatorane som er eitt av dei tiltaka som bidrar til økt kompetanse og erfaringsdeling den nasjonale kompetansedelings portalen kode er også viktig og i tillegg så inngår vald i nære relasjonar som ein del av polititsk grunnutdanning domra hr av barn kan utgjere ein del av etterforskinga som bevis i ein straffesak dei fleste avhørde skjer i dag på eit eee barnehus og alle politidistrikta har kompetanse inn barne avhør,9955.3,9984.5,29.200000000000728,2014-11-20,2014-11-20_proceedings.txt
Stortinget-20141120-095704_9984500_10007500,det har eee vært kritikk mot for lang ventetid president for barnehagefør det er en kritikk som regjeringen har tatt på alvor og gjennomført tiltak som nå har ført til at vi før tiltakene hadden gjennomsnittlig ventetid på toogfemti dager nå er vi nede i femogførti og før årsskiftet skal vi være nede i førti det er fortsatt for langt president men nå viser i hvert fall pilen riktig retning og det er resultatet av,det har eee vort kritikk mot for lang ventetid president for barnever det er ein kritikk som regjeringa har tatt på alvor og gjennomført tiltak som no har ført til at vi før tiltaka hadde gjennomsnittleg ventetid på toogfemti dagar nå er vi nede i femogførti og før årsskiftet skal vi vere nede i førti det er fortsatt på langt president men nå viser kvart fall til ein riktig retning og det er resultat av ein,9984.5,10007.5,23.0,2014-11-20,2014-11-20_proceedings.txt
Stortinget-20141120-095704_10007500_10030300,eee ordentlig dugnad gjennom politidistriktenes fokusering på dette og en skikkelig oppfølging i hele linjen hvor jeg har samtaler med politidirektøren om dette og politidirektøren følger dette opp med politimesterne i den dialogen de har så jobber nå også justis og beredskapsdepartementet med en ny lovproposisjon og tilhørende forskrift om en ny barneavhørsordning som kommer i neste år,eee og den ble dugnad gjennom politididistriktas fokusering på dette og ein skikkeleg oppfølging i heile linjen vore eg har samtale med de politidirektøren om dette og politidirektøren følger dette opp med politimeisteren i den dialogen dei har så jobber nå også justis og beredskapsdepartementet med ein ny lovproposisjon og tilhøyrande forskrift om ny barneavhørsordning som kommer i neste år,10007.5,10030.3,22.799999999999272,2014-11-20,2014-11-20_proceedings.txt
Stortinget-20141120-095704_10030300_10059300,der blir også spørsmålet om obligatorisk bruk av barnehus berørt og også eee spørsmålet om hvem som skal ha ansvar for avhørendevi innfører også risikovurderingsverktøy sara i andela alle landets politidistrikt som skal bidra til å avdekke risiko for ytterligere partnervold og til at nødvendige sikkerhetstiltak eee iverksettes i tillegg så jobbes det nå ut et nytt prosjekt sara for barn for å se hvordan en kan utnytte det samme type verktøyet,der blir også spørsmålet om obligatorisk bruk av barnehus berørt og også eee spørsmålet om ven som skal ha ansvaret for avhøyre vi innfører også risiko vurderingsverøyes sara i alle alle landets eee politidistrikt som skal bidra til å avdekke risiko for ytterlegare partnaald og til at nødvendige sikkerheitstiltak eee i verksettes i tillegg så jobbes det nå ut eit nytt prosjekt sara for barn for å se kvoleis ein kan utnytte det same type vartøye,10030.3,10059.3,29.0,2014-11-20,2014-11-20_proceedings.txt
Stortinget-20141120-095704_10059300_10083800,i eee forhold til barn som utsettes for vold så nevnte jeg president innledningsvis regjeringens eee nye tiltaksplan mot vold og overgrep mot barn og unge her styrker vi innsatsen i alle sektorer for det er ikke bare det polisiære eee sporet som er viktig i kampen mot vold og overgrep mot barn eee blant annet så iverksettes tiltak for å rydde opp i usikkerheten i hjelpeapparatet når det gjelder opplysningsplikt taushetsplikt,i eee forhold til barn som utsettast for vald så nemnde eg president innledningsvis regjeringas eee nye tiltaksplan mot vald og overgrep mot barn og unge her styrker vi innsatsen i alle sektorar for det er ikkje berre det polisiære eee sporet som er viktig i kampen mot vald og overgrep mot barn eee blant anna så iverksette tiltak for å rydde opp usikkerheiten i hjelpeapparatet når det gjeld opplysningsplikt taushetsplikt,10059.3,10083.8,24.5,2014-11-20,2014-11-20_proceedings.txt
Stortinget-20141120-095704_10083800_10109300,eee for å kunne identifisere flaskealser vil vi foreta en gjennomgang av saker om vold og seksuelle overgrep mot barn og fra anmeldelse til saken er ferdig behandlet i rettssystemet for å finne læringspunkter det vil bli nedsatt en es ekspertgruppe for å se på tilsvarende utvalg av saker og tiltakene som nå eee iverksettes både i regi av riksadvokaten og politidirektoratet og som selvfølgelig følges opp fra departementets side president vil bidra til at vi styrker oss alle,eee for å kunne identifisere flaskehalser vil vi foreta ein gjennomgang av saker om vald og seksuelle overgrep mot barn og framendelse til sakene ferdig behandla i rettssystemet for å finne læringspunkter der vi blir nedsett ein ekspertgruppe for å se på tilsvarande utval av saker og tiltaka som nå eee iverksettes både i regi av riksadvokaten og politidirektoratet og som selvfølgelig følges opp frå departementets side president vil bidrag til at vi styrker oss alle,10083.8,10109.3,25.5,2014-11-20,2014-11-20_proceedings.txt
Stortinget-20141120-095704_10109300_10122900,i alle ledd i politiets og påtalemyndighetens arbeid i saker om vold og overgrep mot barn neste taler er interpellanten representanten karin andersen deretter statsråd anders anundsen qqq andersen har nå en taletid på inntil tre minutter,i alle ledd i politiets og påtalemyndighetens arbeid i saker om vald og overgrep mot barnneste talar er interpellanten representanten karin andersen deretter statsråd anders amundsen andersen har nå ein taletid på inntil tre minutter,10109.3,10122.9,13.600000000000364,2014-11-20,2014-11-20_proceedings.txt
Stortinget-20141120-095704_10128100_10156400,ja president jeg takker for svaret og jeg forstår på det statsråden sier at han tar dette på største alvor eee og da handler det om alle de tingene som nå blir satt i gang nå og som har vært satt i gang før men det handler først og fremst å påse at det man sier og vedtar blir gjort og at hvis det ikke blir gjort,ja president eg takkar for svaret og eg forstår på det statsråden seier at han tar dette på største alvor eee og da handlar det om alle dei tinga som no blir sett i gang no og som har vorte sett i gang før men det handlar først og fremst å påse at det ein seier og vedtar blir gjort og at viss det ikkje blir gjort,10128.1,10156.4,28.299999999999272,2014-11-20,2014-11-20_proceedings.txt
Stortinget-20141120-095704_10156400_10184500,så må det skje noe og president jeg skjønner at statsråden ikke kan gå inn i de enkelte sakene men jeg savner kanskje litt i hans innlegg at han er litt mere kontant når det gjelder disse sakene enn det han ellers er i kriminalpolitikken for når det skjer gerne ting så har statsråden vært ganske klar talende på at når man gjør fæle ting som får ferle konsekvenser,så må det skje no og president eg skjønner at statsråden ikkje kan gå inn i det enkelte sakene men eg saner kanskje litt i hans innlegg at han er litt meir kontant når det gjeld desse sakene enn det han elles er i kriminalpolitikken for når det skjer gjerne ting så har statsråden vore ganske klartalande på at når ein gjer fæle ting som får fæle konsekvensar,10156.4,10184.5,28.100000000000364,2014-11-20,2014-11-20_proceedings.txt
Stortinget-20141120-095704_10184500_10210100,så må det få en konsekvens for deg sjøl også og jeg savner litt det i statsrådens innlegg så jeg er glad for at han nevner spesielt disse verktøyene som er sara og sara for barn men det er også verktøy som man i flere år har sagt skal være implementert som ikke blir det det må følges opp at det faktisk blir det og at dette blir kompetanse som de ulike polititjenestemenn har,så må det få ein konsekvens for dei sjøl også og eg a saner litt det i statsrådens innlegg så eg er glad for at han nemner spesielt desse vardtøyaneee som er sara og sara for barn men det er også vart au som ein i fleire år har sagt skal vere implementert som ikkje blir det det må følges opp at det faktisk blir det og at dette blir kompetanse som dei ulike polititenestemenn har,10184.5,10210.1,25.600000000000364,2014-11-20,2014-11-20_proceedings.txt
Stortinget-20141120-095704_10210100_10237600,for det er helt nødvendig at de har det at man ser at man ser etter at man forstår hva man ser og gripe fatt i det så jeg er helt enig med statsråden i det det gjelder jo her selvfølgelig å komme for seint så tidlig som mulig altså at man klarer å avverge er selvfølgelig det aller aller beste så president til dette med politiets organisering framover så forventer jeg,for det er helt nødvendig at vi har det at ein ser at ein ser etter at ein forstår kva ein ser og gripe fatt i der så eg er heilt einig med statsråden i det det gjeld jo her selvfølgelig å komme for seint så tidleg som mulig altså at ein klarer å avverje er følgeleg i det aller aller beste så president til eee dette med politiets organisering framover så forventar eg eig,10210.1,10237.6,27.5,2014-11-20,2014-11-20_proceedings.txt
Stortinget-20141120-095704_10237600_10267100,at dette får den prioriteten som statsråden nå sier det skal ha i arbeidet når man organiserer politiet eee på nye måter framover og da eee utfordrer jeg også statsråden til å si litt om det hvordan dette får konsekvenser for den nye politireformen på en slik måte at vi er sikker på at dette faktisk får prioritet i de enkelte politidistrikt og der politiarbeid utøves,at dette får den prioriteten som statsråden nå seier det skal ha i arbeidet når ein organiserer politiet eee på nye måtar framover og da eee utfordrar eg også statsråden til å seie litt om det korleis dette får konsekvensar for den nye politireforma på ein slik måte at vi er sikker på at dette faktisk får prioritet i dei enkelte politidistrikt og der politiarbeid utøvast,10237.6,10267.1,29.5,2014-11-20,2014-11-20_proceedings.txt
Stortinget-20141120-095704_10267100_10297100,så president er jeg glad for at statsråden understreker meldeplikten for det er det det er det er en meldeplikt for eee egentlig for oss alle når vi vet at barn blir eee og ser noe eee og at den står over taushetsplikten kan ikke sies for mange ganger for det blir brukt som en unnskyldning og så til slutt president fns barnekomite sier at når vi har,så president eg er glad for at statsråden understreker meldeplikta for dei er det det er det er ein meldeplikt for eee eigentleg for oss alle når vi veit at barn blir eee og ser noe eee og at den står over tausesplikta kan ikkje seiast for mange gonger for det blir brukt som ein mullskylding og så til slutt president fns barnekomite seier at når vi har,10267.1,10297.1,30.0,2014-11-20,2014-11-20_proceedings.txt
Stortinget-20141120-095704_10297100_10323400,inngått eee forpliktelse på barnekonvensjonen så skal man sette tilstrekkelige økonomiske ressurser for å iverksette tiltak da må barnehusene prioriteres høyere og da må også konkrete tiltak i eee handlingsplanen for eee mot vold mot barn eee følges av pengerda er neste taler statsråd anders amundsen deretter representanten,inngått eee forpliktelse på barnekonvensjonen så skal ein sette tilstrekkelege økonomiske ressursar for i verksette tiltak da må barnehus prioriterast høgre og da må også konkrete tiltak i eee handlingsplanen for eee mot vald mot barn eee følges av pengarda er neste taler statsråd anders anundsen deretter representanten,10297.1,10323.4,26.299999999999272,2014-11-20,2014-11-20_proceedings.txt
Stortinget-20141120-095704_10328400_10345900,anundsen vær så god ærede president jeg er i all hovedsak enig med alt det representan interpellanten nå sa fra talerstolen og jeg vil si lite grann i forhold til de konkrete områdene som en utfordret meg på det ene handler om hva slags oppfølging skal du ha eee i forhold til det å si at en satser på nå,aldersen ver så godard president eg er i all hovudsak einig med alt det representant interpellanten må sa frå talarstolen og vi ser litte gran i forhold til dei konkrete områda som ein utfordrar meg på det eine handlar om kva slags oppfølging skal du ha eee i forhold til det å sei at ein satsar på nå,10328.4,10345.9,17.5,2014-11-20,2014-11-20_proceedings.txt
