file,text_bm,text_nn,start,end,duration,date,proceedingsfile
Stortinget-20140325-095500_9182300_9200600,åpenbar mismatch mellom opposisjonen når de snakker både om at de skal bruke en komma fem milliarder i ufinansierte løfter og snakker om at opptrappingen av kvalitet er viktigst i barnehagenhvis kvalitet er viktigst og det er jeg helt enig i at det er det aller viktigste,openbar mismatch mellom opposisjonen og dei snakkar både om at dei skal bruke ein komma fem milliardar i ufinansierte løfter og snakker om at opptrappinga av kvalitet er viktigast i barnehagenviss kvalitet er viktigast og det er eg heilt einig i at det er det aller viktigaste,9182.3,9200.6,18.30000000000109,2014-03-25,2014-03-25_proceedings.txt
Stortinget-20140325-095500_9200600_9226600,det er at man har gode ansatte i barnehagen at man både har trygge fang og krypoppi og godt pedagogisk opplegg hvis det er viktigst så må det også prioriteresdet tverrfaglige barnehageløftet har gitt full barnehagedekning for rettighetsbarna rettighetsbestemmelsen i barnehageloven sikrer da at de som har født innen utgangen av august det året det søkes barnehageplass om har eee,det gjer at ein har gode ansatt i barnehagen at ein både har trygge fang og krype opp i og godt pedagogisk opplegg viss det er viktig så må det også prioriterastdet tverrfagleg barnehageløftet har gitt full barnehagedekning for rettighetsbarna rettighetsbestemmelsene i barnehageloven sikrar da at dei som har født innan utgangen av august året søkes barnehageplass om har eee,9200.6,9226.6,26.0,2014-03-25,2014-03-25_proceedings.txt
Stortinget-20140325-095500_9226600_9253500,augusteee det forslaget vi behandler nå det er så å si likt det forslaget som den rødgrønne regjeringen kom med eee helt på tampen av sin periode i regjeringskontorene man prioriterte det da ikke før stortingsvalget var tapt høsten totusenogtretten dagens oppdagsordning og jeg gjentar det er altså like god som den var under den rødgrønned,augusteee det forslaget vi behandlar no det er så si likt det forslaget som den raudgrøne regjeringa kom med eee heilt på tampen av sin periode i regjeringskontora og ein prioriterte då det ikkje før stortingsvalet var tapt hausten totusenogtretten dagens oppdagsordning og er gjentar det er altså like god som den var under den raudgrøned,9226.6,9253.5,26.899999999999636,2014-03-25,2014-03-25_proceedings.txt
Stortinget-20140325-095500_9253500_9280100,jeg forstår at eee at eee dagens eee rettighetsbestemmelse kan være frustrerende for en del barnefamilier derfor er det også regjeringas ambisjon å sikre økt fleksibilitet i opptaket men vi vil ikke gjøre det gjennom å gå for ordningen som skisseres i dette forslaget som vi mener er byråkratisk rigid og r,ja forstår at eee at eee dagens eee rettighetsbestemmelse kan vere frustrerande for ein del barnefamiliar derfor er det også regjeringas ambisjon å sikre økt fleksibilitet i opptaket men vi vil ikkje gjere det gjennom å gå for ordninga som skisserast i dette forslaget som vi meiner er byråkratisk regid og r,9253.5,9280.1,26.600000000000364,2014-03-25,2014-03-25_proceedings.txt
Stortinget-20140325-095500_9280100_9299900,det er også viktig å si at vi lot høringsforslaget gå fra den forrige regjeringa da man vi fått vite hva som eee hva forskjellige organisasjoner mener om forslaget om to opptak flertallet av høringsinstansene ønsker en utvidelse av retten til barnehageplass men det er stor uenighet om hvilken endring som er ønskelig,det er også viktig å si at vi låt høyringsforslaget gå frå den førre regjeringa dei har vi fått vite va som var forskjell i organisasjonar meiner om forslaget om to opptak fleirtalet av høyringsinstansane ønsker ein utvidelse av retten til barnehageplass men det er stor ueinigheit om kalken endring som er ønskeleg,9280.1,9299.9,19.799999999999272,2014-03-25,2014-03-25_proceedings.txt
Stortinget-20140325-095500_9299900_9313800,noen høringsinstanser ønsker to opptak mange er skeptiske allikevel til hva dette kommer til å føre til av byråkratisering i kommunene mens andre høringsinstanser anser løpende opptak som en bedre løsning,nokon høyringsinstanser ønsker to opptak mange er skeptiske og likevel til va dette kommer til å føre til av byråkratisering i kommunane mens andre høyringsinstansar anser løpene opptak som ein betre løysing,9299.9,9313.8,13.899999999999636,2014-03-25,2014-03-25_proceedings.txt
Stortinget-20140325-095500_9313800_9341100,atter andre høre instanser deriblant utdanningsforbundet som er den store eee eller det er en av de største organisasjonene som organiserer barnehagelærere i norge mener at kvaliteten i barnehagene må prioriteres før retten til plass kan utvides altså de mener at først og fremst så er det viktigste løftet i barnehagen det er kvalitet nå har regjeringen også sagt og jeg gjentar det at vi øke til stortinget med,atter andre høgre instansar deriblant utdanningsforbundet som er den store eee eller det ein av dei største organisasjonane som organiserer barnehagelærarar i noreg meiner at kvaliteten i barnehagane må prioriterast før retten til plass kan utvidast altså dei meiner at først og fremst så er det viktigast å løfte i barnehagen det er kvalitet no har regjeringa også sagt og eg gjentar det at vi eee ønke til stortinget med,9313.8,9341.1,27.30000000000109,2014-03-25,2014-03-25_proceedings.txt
Stortinget-20140325-095500_9341100_9365700,eee med både informasjon om dagens situasjon og eee og eee forslag for å øke fleksibiliteten men jeg syns utdanningsforbundet også viser til et sentralt poeng vi må sikre at fleksibilitet i opptaket ikke utvides på bekostning av kvaliteten i barnehagen og det er også da regjeringas politikk at vi skal prioritere og velge,eee med både informasjon om dagens situasjon og eee og eee forslag for å auke fleksibiliteten men eg synest utdanningsut også viser til eit sentralt poeng vi må sikre at fleksibilitet i opptaka ikkje utvidast på bekostning av kvaliteten i barnagen og det gjer også da regjeringas politikk at vi skal prioritere å velje,9341.1,9365.7,24.600000000000364,2014-03-25,2014-03-25_proceedings.txt
Stortinget-20140325-095500_9365700_9386500,regjeringens eee prioriterte tiltak for å øke kvaliteten i barnehagen går rett inn i det som er kjernen i at barna skal ha et sted å være som både er trygt og et sted hvor de kan utvikle seg nemlig løfte de ansattes kompetanse og det er et viktig prosjekt som denne regjeringa kommer til å forts på,regjeringas eee prioriterte tiltak for å auke kvaliteten i barnehagen går rett inn i det som er kjernen i at barna skal ha eit stad å vere som både trygt og eit stad der dei kan utvikle seg nemleg løfte dei ansattes kompetanse og det er eit viktig prosjekt som denne regjeringa kommer til å forts på,9365.7,9386.5,20.799999999999272,2014-03-25,2014-03-25_proceedings.txt
Stortinget-20140325-095500_9386500_9408700,president jeg eee synes det har vært en god debatt eee men jeg vil da fastholde på tross av mange argumenter motstanden mot to opptak i året og bare i parantes bemerke at det har heller aldri vært partiet høyres politikkda blir det replikkordskifte første replikant er rigmor aasrud,president jeg synest det har vore ein god debatt eee men jeg vil da fastholde på trassa mange argument motstanden mot to opptak i året og berre i parantes bemerka at det har heller aldri vore partiet høgres politikkar vidare replikkordskifte første replikant er rigmor aaserud,9386.5,9408.7,22.200000000000728,2014-03-25,2014-03-25_proceedings.txt
Stortinget-20140325-095500_9408700_9436450,president vi hører at høyre og og regjeringa vil satse på kvalitet i barnehagene og at man er bekymret for at det ikke er nok kvalitet for å kunne utvide tilbudet men sånn som det er nå så kutter jo regjeringa fire tusen ett hundre barnehageplasser eksisterende barnehageplasser fordi det er kontantstøttebarn som er der hvorfor kunne man ikke latt dem eee bevilgningen derer igjen sånn at det var flere,president vi hører at eee høgre og og regjeringa vil satse på kvalitet i barnehagene og at ein har bekymre for at det ikkje er nok kvalitet for å kunne utvide tilbodet men sånn som det er no så kuttar jo regjeringa fire tusen eitt hundre barnehageplassar eksisterande barnehageplassar for di det er kontantstøttebarn som er der kvifor kunne ein ikkje latt den eee bevilgninga der g igjen sånn at det var fordi,9408.7,9436.45,27.75,2014-03-25,2014-03-25_proceedings.txt
Stortinget-20140325-095500_9436450_9453100,e barnehageplasser eee tilgjengelig sånn at man kunne ha begynt enten man kaller det to barnehageopptak fleksible barnehageopptak eller løpende barnehageopptak for det er jo bemanning der allerede i dag man må jo ta ned bemanning nå og da må jeg også spørre røe isaksen om eee,re barnehageplassar eee tilgjengeleg sånn at ein kunne har bynt entan kallar det to barnehageopptak fleksible barna opptak av de løpende barnehageopptak for det er jo bemanning dei allereie i dag ein må jo ta ned bemanning nå og da må eg også spørje ro isaksen om eee,9436.45,9453.1,16.649999999999636,2014-03-25,2014-03-25_proceedings.txt
Stortinget-20140325-095500_9453100_9469800,den satsinga på kompetanse som utgjør femten hundre og fireognitti kroner per barnehage i norge hvor lenge skal vi vente eee for at vi skal få nok kompetanse sånn at vi kan eee bruke de fire tusen ett hundre plasser som er der nå statsråd isaksen,den satsinga på kompetanse som utgjer femten hundre og fire hundre til kroner per barnehage i noreg vor lenge skal vi vente eee for at vi skal få nok kompetanse sånn at vi kan eee bruke dei fire tusen eitt hundre plassar som er er nå statsråd isaksen,9453.1,9469.8,16.69999999999891,2014-03-25,2014-03-25_proceedings.txt
Stortinget-20140325-095500_9469800_9487550,president bare gjenta poenget mitt fra innlegget også at det er akkurat de samme rettighetene til barnehageplass i år som det var i fjor at det er ikke noe endring på det og så er det sånn at eee når kontantstøtten forbedres på samme måte som da den rødgrønne regjeringa la om kontantstøtten så gjør man beregninger av hvordan det vi,president berre gjenta poeng mitt frå innlegget også at det er akkurat dei same rettighetene til barnehageplass i år som det var i fjor og då er ikkje noko endring på det og så er det sånn at eee når kontantstøtta forbetrast på same måte som da den raudgrøne regjeringa la om kontantstøtta så gjer ein bereikninga av korleis det vil på,9469.8,9487.55,17.75,2014-03-25,2014-03-25_proceedings.txt
Stortinget-20140325-095500_9487550_9505300,virker etterspørselen etter barnehageplasser som også får konsekvenser for kommunene men når det er sagt så ser jo jeg og det gleder meg også at veldig mange kommuner satser offensivt på barnehageplasser flere kommuner har i dag også overbelegg det tror jeg er en veldig god politikk at man prioriterer å legge seg over statens minstekrav lokalt,verker etterspørselen etter barnehageplassar som også får konsekvensar for kommunane men når det er sagt så ser jo eg og det gleder meg oss at veldig mange kommuner satsar offensivt på barnhageplassar fleire kommunar har i dag også overbelegg det trur eg er ein veldig god politikk at ein prioriterer å legge seg over statens minstekrav lokalt,9487.55,9505.3,17.75,2014-03-25,2014-03-25_proceedings.txt
Stortinget-20140325-095500_9505300_9525100,når det gjelder kompetansen i barnehagene så er jeg helt enig i at vi må gjøre mer derfor satser vi mer nå i år noen gang enn det har vært gjort på kompetansebygging i barnehagene og vi har planer om å fortsette den satsingen fordi kvalitet og innhold i barnehagen er det viktigste prosjektet til denne regjeringa også ja president,når det gjeld kompetansen i barnehagene så er eg heilt einig at vi må gjere meir derfor satsar vi meir no i år nokon gong enn det har vore gjort på kompetansebygging i barnehagene og vi har planar om å fortsette den satsinga for det er kvalitet og innhald i barnehagen er det viktigaste prosjektet til denne regjeringa ja president,9505.3,9525.1,19.80000000000109,2014-03-25,2014-03-25_proceedings.txt
Stortinget-20140325-095500_9525100_9554700,de fire tusen ett hundre plassene som ble kutta på grunn av kontantstøtten det er jo plasser som er der allerede hvorfor kunne man ikke la de være der og så la de barna da som er født etter første september få lov å være med å bruke de plassene finansiert bare opprettholdt den finansieringa eee og hvorfor satser man eventuelt ikke mer på kompetanse når man legger så stor vekt på det eller de ti millionene man la inn i budsjettet statsråd isaksen,dei fire tusen eitt hundre plassar som blei kutta på grunn av kontantstøtta det er jo plassar som er der allereie vore for kunne ein ikkje la dei vera der og så la dei barn av dei som er født etter første september for lov å vera med å bruke dei plassa finansiert berre oppretthalde den finansieringa eee og korfor satsar ein eventuelt ikkje mer på kompetanse når ein legg så stor vekt på det eller dei ti millionar men la inn i budsjettet statsråd isaksen,9525.1,9554.7,29.600000000000364,2014-03-25,2014-03-25_proceedings.txt
Stortinget-20140325-095500_9554700_9581600,president eee til det første altså fra staten sin side så er det jo når når man beregner hvor mange plasser man skal gi kommunene støtte for så er det naturlig at man eee eee da trekker noe ut av ramma fordi man antar at flere vil søke om kontantstøtte når den ordninga blir forbedra det er på samme måte som man beregner altså den type regninger foregår hele tiden og så er det jo kommunene som bestemmer om de har lyst til å legge seg over det s understreker at,president eee til det første altså frå staten sin side så er det jo når når ein bereknar kor mange plassar ein skal i kommunane å støtte for så er det naturleg at ein eee eee da trekk noko ut av ramma for det ein antar at fleire vil søke om kontantstøtte når den ordninga blir forbetra det er på same måte som ein bereknar altså den type rening forgår heile tida og så er det jo kommunane som bestemmer om dei har lyst å legge seg over det st underset,9554.7,9581.6,26.899999999999636,2014-03-25,2014-03-25_proceedings.txt
Stortinget-20140325-095500_9581600_9609500,akkurat de samme reglene for rettighetsbarn gjelder i år som i fjor når det gjelder kompetanse så er jeg helt enig at vi kunne gjort enda mer vi la da på litt ekstra eee sammenlignet med det den rødgrønne regjeringa hadde lagt fram men kompetanseløftet i barnehagene er ikke ferdig med dette budsjettet kvalitet og innholdet i barnhagen barnehagene kommer til å være det store prosjektet for denne regjeringa ut hele perioden og forhåpentligvis kanskje en perio til også,akoratt dei same reglane for rettighetsbarn gjelder i år som i fjor når det gjeld kompetanse så er eg heilt anna at vi kunne gjort endå meir vi la det på litt ekstra eee samling med det den raudgrøne regjeringa hadde lagt fram men kompetanseløftet i barnehagene er ikkje ferdig med dette budsjettet kvalitetar innover barnebarn haga kommer tilå vere det store prosjektet for denne regjeringa ut heile perioden og forhåpentlegvis kanskje ein perio tillata,9581.6,9609.5,27.899999999999636,2014-03-25,2014-03-25_proceedings.txt
Stortinget-20140325-095500_9609500_9632600,raja president kvalitet til det store prosjektet så kunne man jo forstått det hvis de kutta bevilgningene til to opptak og brukte det på kvalitet i barnehagene istedenfor men det gjorde jo ikke det president det brukte det på helt andre ting kontantstøtte og og karirova som man tok penger ut av barnehagen ved første forsøk,både vega solhjelpresidents kvalitet til det store prosjektet så kunne ein ha forstått det viss dei kutta bevilgningene til to opptak og bruke det på kvalitet i barnehagen i staden for men det gjorde jo ikkje det president det brukte du på heilt andre ting kontantstøtte og kvadevar så ein tok pengar ut av barnehagen ved første forsjøk,9609.5,9632.6,23.100000000000364,2014-03-25,2014-03-25_proceedings.txt
Stortinget-20140325-095500_9632600_9656400,det er bare ikke sånn man starter et løft jeg tror heller det er statsministeren som har rett noen områder må nedprioriteres og barnehager er tydeligvis et av det så er det bra det er bra at de rødgrønne rettighetene for hvaler er det de rette at man hadde i fjor fortsatt gjelde de var ganske gode det ble innført i et bredt forlik men det spesielle er jo at vi har hatt en veldig bra enighet om at det må bli enda bedre,det er berre ikkje sånn ein startar eit løft eg trur heller det er statsministeren som har rett nokon område må nedprioriterast og barnehagen er tydelegvis etter det eee så er det bra det er bra at dei raudgrøne rettighetene for kallar dei det dei rettaste vi hadde i fjor fortsatt gjeld dei var ganske gode e blei innført i eit breitt forlik men det spesielle er jo at vi ha hatt ein veldig brei einig om at det må bli endå betre,9632.6,9656.4,23.799999999999272,2014-03-25,2014-03-25_proceedings.txt
Stortinget-20140325-095500_9656400_9678000,nå blei to opptak grundig eee eee avlyst kan man vel si her men serieadjektiver som jeg ikke rakk å å notere spørsmål da er betyr det at regjeringa da heller vil søke i retning av det krf og frp står for nemlig løpende opptatt eee løpende opptak det den forbedringe man ser isaksen,nå blei to opptak eee grundig eee avlyst kan ein vel seie her med ein serie a direktivet som eg ikkje er rokk å å notere spørsmålet er betyr det at regjeringa da heller vil søke i retninga der krf og frp står for nemleg løpande opptatt er løpande opptakt det er den forbetringa ein sergronisaksen,9656.4,9678.0,21.600000000000364,2014-03-25,2014-03-25_proceedings.txt
Stortinget-20140325-095500_9678000_9703800,president jeg gjentok de adjektivene to ganger eee sånn at det skulle være mulig å notere dem ned eee poenget var at vi vi eee avlyser to oppdrag for det fordi det er en byråkratisk ordning det er en veldig sentralstyrt ordning og det er en ordning som i verste fall vil gjøre at en del av den positive utviklinga i mange kommuner hvor man har et mer fleksibelt opptak enn det ene opptaket eee at at det kan komme til skade,president eg gjentok dei adirektiva to gonger eee sånn at det skulle vere mulig å notere det ned eee poenget vere at vi vi eee avlyser to opptak fordi fordi det er ein byråkratisk ordning det er ein veldig sentralstyrt ordning og det er ein ordning som i verste fall vil gjere at ein del av den positive utviklinga i mange kommunar og ein har eit meir fleksibelt opptak enn det eine opptaket eee at at det kan eee komme til skade,9678.0,9703.8,25.799999999999272,2014-03-25,2014-03-25_proceedings.txt
Stortinget-20140325-095500_9703800_9716800,eee det som står i regjeringsplattformen som vi forholder oss til det er at vi skal ha legge til rette for eller husker ikke akkurat formuleringa men et mer fleksibilitet i opptaket og og jeg syns eee representanten solhjell hadde jo en slags sånn,eee det som står i regjeringsplattforma som vi forholde oss til det er at vi skal ha legge til rette for eller skikk akkurat formuleringar men eit meir fleksibilitet i opptaket og og gje synest eee representanten soleil hadde den slags så,9703.8,9716.8,13.0,2014-03-25,2014-03-25_proceedings.txt
Stortinget-20140325-095500_9716800_9743500,tirade i stad med stad med om to opptak var mer enn nettopptak og fire opptak var mer enn to og så er jeg helt enig i det eee såpass langt strekker matematikkkunnskapene minne seg men det er jo like fullt sånn at hvis man ser ut i virkeligheten så ser man at på de kommunene som faktisk har mer fleksibilitet så vil det være en dårlig løsning å innføre en sentralstyrt toopptaksmodell i verste fall vil jo det føre til at foreldrene får mig,til rade i stad med stad med om to opptak var meir enn nettopptak og fire opptak var meir enn to og så er eg heilt einig i det eee såpass langt strekker matematikkunnskapen eminense men det er jo like følgt så at viss ein ser ut i verkelegheiten så ser me på dei kommunane som faktisk har meir fleksibilitet så vil det vere ein dårleg løysing å innføre ein sentralstyrt toopptaktsmodell i verste fall vil jo det føre til at foreldre får mig,9716.8,9743.5,26.700000000000728,2014-03-25,2014-03-25_proceedings.txt
Stortinget-20140325-095500_9743500_9772000,ja president eee jeg skjønner at vi må få avvente hva slags type modell som kommer jeg vil jeg tror det er helt feil at to opptak ville føre til eee mindre fleksibilitet eller ta fram muligheter i dag det ville tvert imot bety flere barnehageplasser i bånn noe som gjør at enda flere kommuner kanskje kunne legge på noe opp på de nasjonale rettighetene for grunnen til at jeg kan det i dag er at de har de det mulighetsrommet men president mitt andre spørsmål er ganske enkelt,president eg er sånn at vi må få avvente kva slags type modell som kommer eg vil eg trur det er heilt feil at topptak ville føre til eee mindre fleksibilitet eller ta fram muligheter i dag det ville tvert imot bety fleire barnehageplassar i bonn noko som gjer at enda fleire kommunar kanskje kunne legge på noko opp på dei nasjonale rettighetene for grunnen til at eg kan det i dag er at dei har dei det mulighetsrommet men president mitt andre spørsmål er ganske enkelt,9743.5,9772.0,28.5,2014-03-25,2014-03-25_proceedings.txt
Stortinget-20140325-095500_9772000_9796300,fordi jeg trur vi kun kan bli enige om jeg håper i alle fall at uavhengig av hvilken modell hvis flere foreldre raskere skal få barnehageplass så kreves det nok i flere barnehageplasser er det kunnskapsministerens ambisjon at det i det neste budsjettene skal bli flere barnehageplasser i norge ikke færrestatsråd isaksen ambisjonen president eee,fordi eg trur vi kun kan bli einig om eg håpar i alle fall at uavhengig av kva modell viss fleire foreldre raskare skal få barne ha ein plass så krevst det noko fleire barnehage plassar er det kunnskapsministerens ambisjon at det i den neste budsjetta skal bli fleire barnehageplassar i noreg ikkje fåre statsråd sjansen angy sjå president eee,9772.0,9796.3,24.299999999999272,2014-03-25,2014-03-25_proceedings.txt
Stortinget-20140325-095500_9796300_9819200,jeg har jo lest eee representanten solhjells bok om budsjettarbeid i regjeringa som var veldig interessant å ha med seg så kunnskapsministeren har store ambisjoner men dette skal også gjennom budsjettbehandling i regjeringa eee men det er helt åpenbart at altså bare bare vi bare vi skal opprettholde den rettigheten vi har i dag så vil vi måtte bygge flere plasser eee når barnekullene øker eee og det er klart at det er eee,eg har jo lest eee representanten soleis bok om budsjettarbeid i regjeringa som er veldig interessant å ha med seg så kunnskapsministeren har store ambisjonar men dette skal også gjennom budsjettbehandling i regjeringa eee men det er heilt openbert at altså berre berre vi berre vi skal opprettholde den rettigheten vi har i dag så vil vi måtte bygge fleire plassar eee når barnekulene aukar eee og det er klart at det er eee,9796.3,9819.2,22.900000000001455,2014-03-25,2014-03-25_proceedings.txt
Stortinget-20140325-095500_9819200_9837300,å se for seg at man skal få eee mer fleksibilitet hvis ikke kommunene også har mulighet til å faktisk få det til det mener jeg er et viktig poeng så var det bare en ting jeg har lyst til å nevne det er at det er det er viktig også med prioriteringer og jeg synes jo det er eee vi sløyfet av forslaget om to opptak,umulig å se for seg at ein skal få eee meir fleksibilitet i sikre kommunar også ha mulighet til å faktisk få det til det meiner eg er eit viktig poeng så var det berre ein ting av lyst til å nemne der at det er det er viktig også med prioriteringa og eg synest jo det er eee vi sløyfeta forslaget om to opptak,9819.2,9837.3,18.099999999998545,2014-03-25,2014-03-25_proceedings.txt
Stortinget-20140325-095500_9837300_9859200,vi fikk tre hundre millioner kroner ekstra til etter og videreutdanning av lærere en forskningsinnsats eksta på tre hundre millioner kroner det er klart det er ikke akkurat på barnehagesektoren men det er viktige investeringer for norge som land arild grande takk,vi fekk eee tre hundre millionar kroner ekstra til etter vidareutdanning av lære ein forskingsinnsats sekse på tre hundre millionar kroner det er klart de akkaurat på barnehagesektoren men det er viktige investeringar for noreg som land arild ander,9837.3,9859.2,21.900000000001455,2014-03-25,2014-03-25_proceedings.txt
Stortinget-20140325-095500_9859200_9888400,president statsråden er i eee flere svar eee på replikkordskiftet opptatt av å vise til det han kaller virkelighetens verden og en av dem som lever i virkelighetens verden vil jeg tro er byråd i bergen harald viktor håve som er ute i bergens tidende å fortelle om hvordan virkeligheten da oppleves for en kommune av en viss størrelse eee og der ser vi at bergen fikk et kutt på i overkant av atten millioner kroner eee og i forrige uke så kom søkertallet for barnehage og,president statsråden har i fleire svar eee på replikkordskiftet opptatt av å vise til det han kallar verkelegheitasveg den og ein av dei som lever i verklegheita verden vil eg tru er byråd i bergen harald viktor hove som er ute i bergens tidene og fortelle om korleis verkelegheita det opplever for ein kommune av ein viss størrelse eee og der ser vi at bergen fekk eit kutt på i overkant av atten millionar kroner eee og i fore uke så kom søkartalet for barnehage og,9859.2,9888.4,29.19999999999891,2014-03-25,2014-03-25_proceedings.txt
