file,text_bm,text_nn,start,end,duration,date,proceedingsfile
Stortinget-20140116-095725_12116200_12143900,så har det stor påvirkning på helsesituasjon og barnedødelighet når vi styrker jenters rett til utdanning så gir det konkrete resultater for hele samfunnet etter at hundre og fireogseksti land forplikta seg til education for ole molne i totusen så har antallet barn eee i skole økt med fire eee syvogførti millioner men likevel er det syvogfemti millioner som står uten tilgang til sko vi ser,så har det stor påverkning på helsesituasjon og banedødleghetnår vi styrker gjemt oss rett til utdanning så gir det konkrete resultatet for heile samfunnet etter at hundre og fire og seksti land forplikta seg til dukaten forolmålane i to tusen så har antalet barn eee i skole økt med fire eee sju over førti millionar men likevel er det suverfemti millionar som står utan tilgang til sko vi ser,12116.2,12143.9,27.69999999999891,2014-01-16,2014-01-16_proceedings.txt
Stortinget-20140116-095725_12143900_12173600,også at utfordringene knytta til å holde barna i skolen seksti millioner av de ungene eee som i verden som får tilgang til skole faller ut av skolen før det er nå fjerde klasse og ikke minst ser vi at mange titalls millioner gjennomfører skolegangen uten å tilegne seg de grunnleggende ferdighetene og dette viser tydelige behovet for å satse på kvalitet som flere av representantene nå har diskutert i dag og sørge for at det finnes nok kompetente lærere og verdenssamfunnet har en stor utfordring,også at utfordringane er knytt til å halde barna i skolenseksti millionar av dei ungane eee som i verda som får tilgang til skole faller ut av skolen før dei no fjerde klasse og ikkje minst ser vi at mange titals millionar gjennomfører skolegangen utan å tileigne seg dei grunnleggende ferdighetene og dette viser tydeleg behovet for å satse på kvalitet som fleire av representantane no har diskutert i dag og sørge for at det finst nok kompetente lærarar og verdssamfunnet har ein stor utfordring,12143.9,12173.6,29.700000000000728,2014-01-16,2014-01-16_proceedings.txt
Stortinget-20140116-095725_12173600_12201800,i høyre var det full oppslutning på landsmøtet vårt sist mai om at vi trenger en ny strategi for å møte utfordringene vi trenger økte bevilgninger til utstands eee utdanningsbistand og det er beklagelig at bistand til utdanning ikke har vært prioritert hos de rødgrønne i tillegg var det enighet om at norge må ta lederskap i diskusjonen om hva som skal være agendaen for de nye tusenårsmålene etter tyvefemten derfor president har det stor betydning at det nettopp er vår statsminister,i høgre var det full oppslutning på landsmøtet vårt sist mai om at vi treng ein ny strategi for å mødeutfordringane vi treng økte bevilgninga til utstands eee utdanningsbistand og det er beklageleg at bistanden til utdanning ikkje har vore prioritert hos dei raudgrøne i tillegg var det einigheit om at noreg må ta lederskap i diskusjonen om kva som skal vere agendaen for dei nye tusenårsmåla etter tyvefemten derfor president har det stor betydning at det nettopp har vår statsminister,12173.6,12201.8,28.19999999999891,2014-01-16,2014-01-16_proceedings.txt
Stortinget-20140116-095725_12201800_12229500,som skal være medleder for generalsekretær eee bankimons eee pådrivergruppe på tusen år små land og like viktig er de tydelige signalene som utenriksministeren nå gir president jeg er godt fornøyd med denne regjeringas vilje til å satse på utdanning som virkemiddel i bistands og utviklingsarbeidet det gjenspeiles både i regjeringsplattformen og i budsjettet det totale budsjettet for utdanning i eee tjuefjorten en komma åttilfire milliarder,som skal vere medle for generalsekretær eee bankimons eee pådrivargruppe på tusenårsmålae og like viktig er dei tydelege signalane som utanriksministeren nå gir president er godt fornøgd med denne regjeringas vilje til å satse på utdanning som verkemiddel i bistands og utviklingsarbeidet det gjenspeilast både i regjeringsplattforma og i budsjettet det totale budsjettet for utdanning i eee eee tjuefjorten ein komme åttifire milliardar,12201.8,12229.5,27.700000000000728,2014-01-16,2014-01-16_proceedings.txt
Stortinget-20140116-095725_12229500_12256600,det er en økning til utdanning på pluss to hundre og førti millioner kroner og det viser en vilje til kursomlegging i totusenogfjorten er det for første gang på åtte år en markant økning på dette området og en klar profil på å styrke jenters rettigheter til utdanning president det er på tide å komme videre i dette arbeidet den fjorten år gamle jenta kamp av akter og venninna hennes eee karim,det er ein økning til utdanning på pluss to hundre og førti millionar kroner og det viser ein vilje til kursomlegging i totusenogfjorten er det for første gong på åtte år ein markant økning på dette området og ein klar profil på å styrke gjentas rettigheter til utdanning president det er på tide å kome vidare i dette arbeidet den fjorten år gamle gjenta kampa akter og veninna hennes eee karim,12229.5,12256.6,27.100000000000364,2014-01-16,2014-01-16_proceedings.txt
Stortinget-20140116-095725_12256600_12284000,som begge fullt fullførte utdanningsprosjektet sjonglap i bangladesh i fjor sier klart og tydelig uten shonglap ville vi vært helt fortalt for tapt verdens barn og verdens jenter fortjener bedre president og president til representanten bård vegar solhjell så vil jeg si det at i dette arbeidet så trenger vi både kronene og gode innretninger på prosjektene takk,som begge fullt fullførte utdanningsprosjektet sjolopp i bangladesh i fjor sier klart og tydeleg utan sjånglap ville vi vere heilt betalt for tapt verdensbarn og verdens gjenter for tener betre president og president til representanten bå vega solheim så vil eg seie at i dette arbeidet så trenger vi både kronemen og gode innretningar på prosjekta takk,12256.6,12284.0,27.399999999999636,2014-01-16,2014-01-16_proceedings.txt
Stortinget-20140116-095725_12284000_12295800,ja takk da er neste taler interpellanten trine skei grande som får ordet inntil tre minutter og deretter siste taler utenriksminister børge brende,ja takk da er neste talar interpellanten trine si grande som får ordet inntil tre minutter og deretter siste talar utanriksminister børge brende,12284.0,12295.8,11.799999999999272,2014-01-16,2014-01-16_proceedings.txt
Stortinget-20140116-095725_12306200_12332700,skei grande vær så god president det er et kjent trøndersk slagord som heter at det er ikke noe som kjem til seg sjøl så heller ikke i den her satsinga her derfor så er jeg veldig glad for at eee eee utenriksministeren har vært klar på at skal man ha det målet man har eee for å styrke utdanning som en de,så eg gras god president det er eit kjent trøndersk slagord som heiter at dei ikkje noko som kjem til seg sjøl så heller ikkje i den her satsinga her derfor så er eg veldig glad for at eee eee utanriksministeren har vore klar på at skal ein ha det målet ein har eee for å styrke utdanning som ein de,12306.2,12332.7,26.5,2014-01-16,2014-01-16_proceedings.txt
Stortinget-20140116-095725_12332700_12358000,eee så må man for det første gjøre det som den forrige regjeringa ikke gjorde nemlig sette inn utdanning som en del av målsettingene eee for bistandspolitikken men man må også ta en lederrolle internasjonalt for å løfte utdanning inn på den internasjonale arenaen der norge må ha en ledende rolle vi må lede skal vi klare å få til eee en sånn satsing,eee så må ein for det første gjer det som den førre regjeringa ikkje gjer nemleg sett inn utdanning som ein del av målsettinga eee for bistandspolitikken men ein må også ta ein lederrolle internasjonalt for løfte utdanning in på den internasjonale arena der noreg må ha ein ledande rolle for vi må lede skal vi klare å få til eee ein sånn satsing,12332.7,12358.0,25.299999999999272,2014-01-16,2014-01-16_proceedings.txt
Stortinget-20140116-095725_12358000_12386400,og jeg trur at eee i jobbinga mi med denne interpellasjonen så har jeg hatt mye hjølp av de norske ngoene spesielt redd barna som jeg gjerne vil takke som har som jeg trur står klare for å være på lag med utenriksministeren for å komme i mål med en sånn type satsing og så har jeg holdt på med politikk såpass lenge president at jeg blir sjelden provosert av at folk blir enig med meg,og eg trur et eee i jobbinga med med denne intuellasjonen så har eg hatt mye hjelp av dei norske engan spesielt redd barna som eg gjerne vil takke som har som eg trur står klare for å vere på lag med utanriksministeren for å kome i mål med ein sånn type satsing og så har eg holdt på med politikk såpass lenge president etter er blir skjelden provoset av at folk blir einig med meg,12358.0,12386.4,28.399999999999636,2014-01-16,2014-01-16_proceedings.txt
Stortinget-20140116-095725_12386400_12409400,derfor så er jeg kjempeglad for at det har vært så brei enighet i stortinget i dag at så mange har valgt å delta og at så mange sier at dette er en av de viktigste satsingene eee innafor bistandssektoren det er kjempebra at stortinget har så brei enighet om herre satsinga kjempebra at en nå kjem inn på marsati og da kan vi kanskje,derfor så er eg kjempeglad for at det har vore så brei einigheit i stortinget i dag eit så mange har valt å delta og eit så mang seier at dette er ein av dei viktigaste satsingane eee innanfor bistand sektoren det er kjempebra eit stortinget har så brei einigheit om her satsinga det kjempebra et en no kjem inn på masada og det kan vi kanskje,12386.4,12409.4,23.0,2014-01-16,2014-01-16_proceedings.txt
Stortinget-20140116-095725_12409400_12432100,klare å komme i mål og som en ngoverden som er både kompetent og sulten og med et samla storting ja da bør utenriksministeren klare å komme i mål med å løfte dette så jeg vil gjerne takke for et så brei deltakelse i stortinget en så viktig debattsisteee siste taler er utenriksminister børge brende vær så god,klare å komme i mål då som me ein ngevegen som er både kompetent og sulten og med eit samla storting ja da bør utanriksministeren klar å komme i mål med å løfte dette så eg vil gjerne takke for eit så brei deltakelse i stortinget er ein så viktig debattsist siste talar er utenriksminister børge brendø ver så god,12409.4,12432.1,22.700000000000728,2014-01-16,2014-01-16_proceedings.txt
Stortinget-20140116-095725_12440800_12469400,president eee jeg syns dette har vært en eee veldig god og oppløftende runde og jeg syns stortinget har også slått fast en del viktige prinsipper knytta til det å satse på utdanning fremover i en utviklingssammenheng eee både generelt og spesielt eee for eee jenter representanten eee skei grande eee har tatt et eee viktig odd,president eee eg synest dette har vore ein veldig god og oppløftande runde eg synest stortinget har også slått fast ein del viktige prinsipp knytt til det å satse på utdanning framover i ein utviklingssamanheng eee både generelt og spesielt eee for eee gjenta representanten eee seige rande eee har tatt eit viktig,12440.8,12469.4,28.600000000000364,2014-01-16,2014-01-16_proceedings.txt
Stortinget-20140116-095725_12469400_12499300,eee initiativ eee som jeg setter stor pris på og representanten slo også da helt riktig fast at skal vi satse på utdanning fremover så må jo det også da klargjøres som en av de tematiske satsingene som faktisk da norge prioriterer eee hvis man da tar en satsning ut så betyr det jo da at man bruker mindre eee kraft også eee både i departementet i norad,eee initiativ som eg setter stor press på og representanten slo også da heilt riktig fast at skal vi satsar på utdanning framover så må jo det også da klargjøres som er ein av dei tematiske satsingane som faktisk da noreg prioriterer eee viss ein da tar ein satsing ut så betyr det jo da at ein bruker mindre eee kraft også eee både i departementet i norad,12469.4,12499.3,29.899999999999636,2014-01-16,2014-01-16_proceedings.txt
Stortinget-20140116-095725_12499300_12522000,på dette det er jo slik man da signaliserer en politisk satsing nå tas da utdanning inn som et satsingsområde og stortinget har da også allerede bidratt til at inneværende års eee statsbudsjett så har man økt satsinga med femten prosent også når det gjelder ressurser men så er det jo slik at eee man kan jo ikke stille seg blind på eee,på dette det er jo slik me ein da signaliserer ein politisk satsing no ta ei sta utdanning inn som eit satsingsområde og stortinget har da også allereie bidreg til at innevernet års statsbudsjett så har ein økt satsinga med femten prosent også når det gjelder ressursar men så er det jo slik at eee ein kan jo ikkje stille seg eee blind på eee,12499.3,12522.0,22.700000000000728,2014-01-16,2014-01-16_proceedings.txt
Stortinget-20140116-095725_12522000_12547500,bare tall fordi at det er mye på både innretning og at man da også bruker disse ressursene på en fornuftig måte men jeg tror ikke at det blir noe utvikling uten utdanning dette er måten da også gi eee den eee eee unge generasjonen en mulighet til da eee å skape seg et liv inntekt og arbeid,bere tal fordi at det er mye på både innretning og at ein da også bruker desse ressursane på ein fornuftig måte men eg trur ikkje at det blir noko utvikling utan utdanning dette er måten da også gi den unge generasjonen ein muligheit til det eee å skapelse eit liv inntekt og arbeid,12522.0,12547.5,25.5,2014-01-16,2014-01-16_proceedings.txt
Stortinget-20140116-095725_12547500_12576900,og ikke minst så blir dette en mye større utfordring nå fremover på gol på grunn av den globale eee demografien i mange utviklingsland president så er over femti prosent av befolkninga under tjue år globalt så er over femti prosent av befolkninga under tjuefem år så med all respekt eee president så vidt jeg kan se så er det få representanter for halvparten av den globale befolkninga rent aldersmessig her i salen men i alle fall så er det et stort,og ikkje minst så blir dette ein mykje større utfordring no framover på gol på grunn av den globale eee demografien i mange utviklingsland president så er over femti prosent av befolkninga under tjue år globalt så er over femti prosent av befolkninga under tjuefem år så med all respekt eee president så vidt eg kan se så er det få representantar for halvparten av den globale befolkninga reint aldersmessig her i salen men i allfall så er det eit stort,12547.5,12576.9,29.399999999999636,2014-01-16,2014-01-16_proceedings.txt
Stortinget-20140116-095725_12576900_12603600,ansvarsfølelse i denne salen for at de da også skal kunne gi et skikkelig tilbud til eee de som vokser opp og hvis du ikke har mulighet til å få tilgang på utdanning da har du i dagens globaliserte verden en veldig veldig begrensa fremtid så hvis norge nå gjennom å satse mer på utdanning i vårt utviklingsbudsjett at vi også utvikler en del programmdre land,ansvarsfullelse i denne sak for at dei da også skal kunne gi eit skikkeleg tilbod til dei som vaks opp og viss du ikkje har muligheit til å få tilgang på utdanning då har du i dagens globaliserte verden ein veldig veldig begrensa framtid så viss noreg no gjennom å satse meir på utdanning i vårt utviklingsbudsjett at vi også utviklar ein del programmdre land,12576.9,12603.6,26.700000000000728,2014-01-16,2014-01-16_proceedings.txt
Stortinget-20140116-095725_12603600_12627900,og hvis vi kombinerer det også med å få ambisiøse tusenårsmål etter tjuefemten innenfor utdanning som er mulig å måle fremgang knytta til utdanning og at utviklingslandene sjøl også tar et ansvar det har det jo også gjennom å ha et breiere skattegrunnlag slik at de kan ha mer ressurser til å satse på utdanning så kan vi få til noe her,og viss vi kombinere det også med å få ambisiøse tusenårsmål etter tjuefemten innanfor utdanning som er mulig å måle framgang knytt til utdanning og at utviklingslanda sjøl også tar eit ansvar det har dei også gjennom å ha breiare skattegrunnar sjekk at vi kan ha meir ressursar til å satse på utdanning så kan vi få til noko her,12603.6,12627.9,24.299999999999272,2014-01-16,2014-01-16_proceedings.txt
Stortinget-20140116-095725_12627900_12654300,da er debatten avsluttet sak seks er ferdigbehandlet og vi går videre til sak syv som er interpellasjon fra representanten lise christoffersen til samferdselsministeren det har den seinere tida vært stor oppmerksomhet rundt ulike forhold innen luftfarten spesielt når det gjelder lønns og arbeidsvilkår for piloter kabinansatte og bakkepersonale men også spørsmål om skatt og trygdeavgifter stoltenberg iiregjeringen vedtok tre hang,da er debatten avslutta sak seks er ferdigbehandla og vi går vidare til sak syv som er interpellasjon frå representanten lise christoffersen til samferdselsministeren det har den seinare tida vore stor oppmerksomhet rundt ulike forhog innan luftfarten spesielt når det gjeld lønns og arbeidsvilkår for piloty kabinavsatte og bakkepersonavet men også spørsmålet om skatt og trygda avgifter stoltenberg to regjeringa vedtok tre hang,12627.9,12654.3,26.399999999999636,2014-01-16,2014-01-16_proceedings.txt
Stortinget-20140116-095725_12654300_12681100,i den siste handlingsplanen jamfør revidert nasjonalbudsjett tyvetretten ble det blant annet vist til behov for skjerpet innsats for å trygge arbeidsvilkårene i luftfarten statsråd solvikolsen varslet media første november i år at han innen det vil si i fjor at han innen kort tid ville sende et brev til eukommisjonen for å få strammere felles regler på dette området hvilke tiltak vil statsråden ta initiativ til bnasjonalt,i den siste handlingsplanen jamfør revidert nasjonalbudsjett tyvetretten og ler det blant anna vist til behov for skjerpe til innsats for å trygge arbeidsvilkåra i luftfarten statsråd solvikolsen varsla media første november i år at han innan det vi sa i fjor at han innan kort tid ville sende eit brev til eukommisjonen for å få strammare felles reglar på dette området kva tiltak vil statsråden ta initiativ til brnasjonalt,12654.3,12681.1,26.80000000000109,2014-01-16,2014-01-16_proceedings.txt
Stortinget-20140116-095725_12681100_12690900,for å sikre ryddige lønns og arbeidsforhold og likeverdige konkurranseforhold i norsk og internasjonal luftfart lise christorsen vær så god,for å sikre ryddige lønns og arbeidsforhold og likeverdige konkurranseforhold i norsk og internasjonal luftfart lise christorsen ver så god,12681.1,12690.9,9.799999999999272,2014-01-16,2014-01-16_proceedings.txt
Stortinget-20140116-095725_12702100_12731000,president eee som jeg sa i interpellasjonen min under stoltenberg iiregjeringa så ble altså sosial dumping satt skikkelig på den politiske dagsordenen den første handlingsplanen kom i totusenogseks den andre kom i totusenogåtte og den direkte foranledningen det var det vi så av ny arbeidskraftinnvandring og økt innleie av arbeidskraft som følge av euutvidelsen,president eee som eg sa i eee interpulasjonnen under stoltenberg to regjeringa så blei altså sosial dumping satt skikkelege på den politiske dagsorden den første handlingsplanen kom i totusenogseks den andre kom i totusenogåtte og den didirekte foranledninga det var det vi såg av ny arbeidskraftinnvandring og økt innleia arbeidskraft som følge av euutvilelsen,12702.1,12731.0,28.899999999999636,2014-01-16,2014-01-16_proceedings.txt
Stortinget-20140116-095725_12731000_12759100,formålet med handlingsplanene var å hindre at utenlandske arbeidstakere ble utnytta i form av lavere eee lønninger og dårligere sikkerhets og arbeidsmiljøstandard enn det som er akseptabelt på det norske arbeidsmarkedet det medfører undergraving av norske lønns og arbeidsforhold og medfører en urettferdig konkurransesituasjon for seriøse bedrifter qqq i de to første handlingsplanene ble søkelyset først retta mot byggebransjen kystfarten og landbruket,formålet med handlingsplanane var å hindre at utanlandske arbeidstakarar blei utnytta i form av lavre eee lønningar og dårlegare sikkerheits og arbeidsmiljøstandard enn det som er akseptabelt på den norske arbeidsmarknaden det medfører undergraving av norske lønns og arbeidsforhold og medfører ein urettfeldig konkurransesituasjon for seriøse bedrifter i dei to første handlingsplanane blei søkelyse først retta mot byggebransjen kystfarten og landbruket,12731.0,12759.1,28.100000000000364,2014-01-16,2014-01-16_proceedings.txt
Stortinget-20140116-095725_12759100_12786400,deretter renholdsbransjen og hotell og restaurantbransjen offentlige innkjøp har også vært under lupen etter mange avsløringer av en heller tvilsom praksis både i stat og kommune evaluering av tiltakene viste at de har hatt en positiv effekt men virkeligheten viser at det er bare en ting som er helt sikkert at her nytter det ikke å hvile på laurbærnetderfor kom handlingsplan nummer tre ved framleggelsen av revidertt i tjuetretten,deretter renevoldsbransjen og hotell og resturangbransjen offentleg innkjøp har også vore under lupen etter mange avsløringar av ein heller tvilsam praksis både i stat og kommune evaluering av tiltaka viste at dei har hatt ein positiv effekt men virkeligheten viser at det er berre ein ting som er heilt sikkert at her nytter dei ikkje å vile på laurbærene derfor kom handlingsplan nummer tre ved framleggelse har revidertett i tjuetretten,12759.1,12786.4,27.299999999999272,2014-01-16,2014-01-16_proceedings.txt
Stortinget-20140116-095725_12786400_12815600,den bygde videre på de to tidligere handlingsplanene og fulgte opp stortingsmelding tjueni om et felles ansvar for et godt og anstendig arbeidsliv en hovedutfordring er det faktum at arbeidslivet i norge er blitt mer internasjonalisert vi har en relativt stor tilstrømming av arbeidskraft og vi har betydelige forskjeller i lønns og levekostnader mellom norge og mange andre land både innenfor det felles europeiske arbeidsmarkedet og sammenligna med land utenfor europa,den bygde vidare på dei to tidlegare handlingsplanane og fylgt opp stortingsmelding tjueni om eit felles ansvar for eit godt og anstendig arbeidsliv ein hovudutfordring er det faktum at arbeidslivet i noreg har blitt meir internasjonalisert vi har ein relativt stor tilstrømming av arbeidskraft og vi har betydelege forskjellar i løns og levekostnader mellom noreg og mange andre land både innanfor det felles europeiske arbeidsmarkeder og samanlikna med land utanfor europa,12786.4,12815.6,29.200000000000728,2014-01-16,2014-01-16_proceedings.txt
Stortinget-20140116-095725_12815600_12840900,i mange tilfeller opplever vi en lav organisasjonsgrad blant de ansatte noe som gjør arbeidet mot sosial dumping ekstra utfordrende der det finnes et regelverk mot sosial dumping finnes det også smarte sjeler som vet å manøvrere på en måte sånn at regelverket kan omgås det er ikke nødvendigvis tale om ulovligheter men ikke desto mindre må det være lov å spørre seg er det dette vi vil,i mange tilfelle opplever vi ein lav organisasjonsgrad blant dei ansatte noko som gjer arbeidet mot sosial ddømping ekstra utfordrande der det finnast eit regelverk mot sosial dumping finnest også smarte sjeler som veit og manuvrerer på ein måte sånn at regelverket kan omgås det er ikkje nødvendigvis taler om ulovlegheiter men ikkje desto mindre må det vere lov å spørje seg er det dette vi vil,12815.6,12840.9,25.299999999999272,2014-01-16,2014-01-16_proceedings.txt
Stortinget-20140116-095725_12840900_12868700,den nye i handlingsplan nummer tre var blant annet påpekninga av behovet for egne bransjeprogrammer for utsatte næringer skipsfarten er en av dem luftfarten en annen allmenngjøring av tariffavtaler er vanskelig å få til dels fordi næringen er regulert gjennom internasjonalt regelverk oppsplitta mellom mange land og dels fordi det mange steder ikke finnes tariffavtaler i det hele tatt og denne interpellasjonen gjelder altså spesieltrholda innafor luftfarten,den nye i handlingsplan nummer tre var blant anna påpeikningar av behovet for eigne bransjeprogram for utsette næringar skipsfart i arena av dei luftfarta er ein annan allmenngjering av tariffavtalar er vanskeleg å få til dels fordi næringane er regulert gjennom internasjonalt regelverk oppsplitta mellom mange land og dels fordi det mange stader ikkje finst tariffavtaler i det heiltatt og denne interpellasjonen gjeld altså spesieltrholda innanfor luftfarten,12840.9,12868.7,27.80000000000109,2014-01-16,2014-01-16_proceedings.txt
Stortinget-20140116-095725_12868700_12894800,og bakgrunnen er altså den seinere tidas betydelige oppmerksomhet rundt flere negative forhold innen luftfart spesielt når det gjelder lønns og arbeidsvilkår for piloter kabineansatte og bakkepersonale men også spørsmål om skatt og trygdeavgifter og vi har et ønske i arbeiderpartiet om å få fortgang i arbeidet med å finne ut hva storting og regjering både kan og vil gjøre for å bekjempe diss,og bakgrunnen er altså den seinare tidas betydelege oppmerksomhet rundt fleire negative forhold innan luftfart spesielt når det gjeld løns og arbeidsvilkår for pilotar kabinansatte og bakkepersonale men også spørsmålet om skatt og trygdeavgifter og vi har eit ønske i arbeidarpartiet om å få fortgang i arbeidet med å finne ut kva stortinget og regjering både kan og vil gjere for å bekjempe dess,12868.7,12894.8,26.099999999998545,2014-01-16,2014-01-16_proceedings.txt
