file,text_bm,text_nn,start,end,duration,date,proceedingsfile
Stortinget-20141120-095704_122700_125000,dette er selvstendig usett,ekeren emilsen,122.7,125.0,2.299999999999997,2014-11-20,2014-11-20_proceedings.txt
Stortinget-20141120-095704_339200_368000,stortingets møte er lovlig satt ærede medrepresentantertidligere stortingsrepresentant harald håve døde tjuefjerde jul tjueførste juli sekstifem år gammel han representerte venstre og hordaland og møtte som fast representant i perioden nittennittisju til totusen han satt i utenrikskomiteen og var medlem av stortingets delegasjon til nordisk råd,stortingets møte er lovlig satt ærde med representantar tidlegare stortingsrepresentant harald hove døde tjuefjerde jul tjueførste juli sekstifem år gammal han representerte venstre og hodaland og møtte som fast representant i perioden nittennittisju til totusen han sat i utdanningskomiteen og var medlem av stortingets delegasjon til nordisk råd,339.2,368.0,28.80000000000001,2014-11-20,2014-11-20_proceedings.txt
Stortinget-20141120-095704_368000_394600,han var også medlem av europautvalget hv var utdannet jurist fra universitetet i bergen de første årene etter studiet var han første amanuensis ved universitetet i bergen før han startet sin egen advokatvirksomhet i nittenåttini hans spesialfelt var offentlig rett og barnevern og han var medforfattet i flere utredninger og fne,han var også medlem av europautvalet hove var utdanna jurist frå universitetet i bergen dei første åra etter studie var den første amanuensis ved universitetet i bergen før han starta sin eigen advokatvirksomhet i nittenåttini hans spesialfelt var offentleg rett og barnevern og han var medforfattar til fleire utredningar og fa,368.0,394.6,26.600000000000023,2014-11-20,2014-11-20_proceedings.txt
Stortinget-20141120-095704_394600_423600,han var også senior foreleser ved universitetet i bergen hv var aktive venstre og i norsk politikk på alle nivåer han møtte tre perioder i fylkestinget flere år som leder av fylkestingsgruppen og han var i mange år en aktiv kommunepolitiker i hjembyen bergen han hadde i tillegg en lang rekke organisatoriske verv blant annet var han leder for hordaland venstre i fire år,han har også senordforlese ved universitetet i bergen påve var aktiv i venstre og i norsk politikk på alle nivåar han møtte tre perioder i fylkestinget fleire år som leder av fylkestingsgruppen og han var i mange år ein aktiv kommunepolitikar i hjenbyen bergen han hadde i tillegg ein lang rekke organisatoriske verv blant anna var han leder for hordaland venstre i fire år,394.6,423.6,29.0,2014-11-20,2014-11-20_proceedings.txt
Stortinget-20141120-095704_423600_452700,han var også leder eller medlem i et uttal av ulike programkomiteer i tillegg til å ha en rekke politiske verrer i venstre under og etter valgkampen i nittennittitre spilte han en uvurderlig rolle som sentral rådgiver og aktør resultatet av dette arbeidet førte til at norges eldteparti igjen ble representert på stortinget etter to perioder utenfor kv hadde også en rekke,han var også leder eller medlem i eit uttal av ulike program komite i tillegg til å ha ein rekkje politiske verv i venstre under og etter valkampen i nittennittitre spelte han ein uvurdeleg rolle som sentral rådgivar og aktør resultatet av dette arbeidet førte til at noregs eldste parti igjen blei representert på stortinget etter to perioder utanfor hove hadde også ein rekke,423.6,452.7,29.099999999999966,2014-11-20,2014-11-20_proceedings.txt
Stortinget-20141120-095704_452700_480000,fentlige verv og satt blant annet som medlem i opplæringsutvalget og i valglovutvalget han var medlem i utvalget for å utrede stortingets kontrollfunksjon i totusenogen til totusenogto i totusenogen til totusenogtre ledet han det regjeringsoppnevnte offentlighetsutvalget her vi kan kombinere sitt politiske engasjement for offentlighet og åpenhet med juridisk å høyt nivå,offentlege verv og satt blant anna som medlem i opplæringsutvalet og i valglovutvalget han var medlem i utvalet for å utrede stortingets kontrollfunksjon i totusenogein til totusenogto i totusenogein til totusenogtre lettande regjeringsoppnemnde offentleghetsbyrvaget her vil han kombinert sitt politiske engasjement for offentlegheit og openheit med juridisk å høgt nivå,452.7,480.0,27.30000000000001,2014-11-20,2014-11-20_proceedings.txt
Stortinget-20141120-095704_480000_507800,utvalgets innstilling ble i all hovedsak vedtatt av stortinget og er i det store og hele fremdeles gjeldende rett i totusenogåtte til totusenogni ledet han adopsjonsutvalget som skulle foreta en helhetlig gjennomgang av adopsjonspolitikken hv hadde et stort aran engasjement for demokrati for toleranse og bekjempelse av urettferdighet bådesjonalt og internasjonalt,utvalgets innstilling blei i all hovudsak vedtatt av stortinget og er i det store og heile fremdelis gjeldande rett i totusenogåtte til totusenogni lede an adopsjonsutvalget som skulle foruta ein helhetlig gjennomgang av adopsjonspolitikken hove hadde eit stort ar angasjement for demokrati for toleranse og bekjempelse av urettferdighet bådesjonalt og internasjonalt,480.0,507.8,27.80000000000001,2014-11-20,2014-11-20_proceedings.txt
Stortinget-20141120-095704_507800_536000,han hadde en spesiell evne til å belyse en sak fra flere sider på stortinget om egenskapene som som tilførte enhver debatt konstruktive innspill og kloke betraktninger til sin absolutte rett harald hv var et varmt og sosialt menneske som hele livet viste omsorg for menneskene rundt seg han var begavet med en sjelden evne til å få samtalepartnere til å føle seg i sentrum og han hadde et smittende og godt humør,han hadde ein spesiell evne til å belyse ein sak frå fleire sider på stortinget kom eigenskapane som som tilført ein var debatt konstruktive innspel og krokebetrakningar til sin absolutte rett harald hove var eit varmt og sosialt menneske som heile livet viste omsorg for menneske rundt seg han var begavet med en skjelden evne til å få samtalepartnar til å følgje seg i sentrum og han hadde eit smittande og godt humør,507.8,536.0,28.19999999999999,2014-11-20,2014-11-20_proceedings.txt
Stortinget-20141120-095704_536000_546900,hv var en person med stor arbeidsglede og arbeidskapasitet og han hadde stor livsglede vi lyser fred over harand håves minne,hove var ein person med stor arbeidsklede og arbeidskapasitet og han hadde stor livsglede vi lyser fred og vil høyra håves minne,536.0,546.9,10.899999999999977,2014-11-20,2014-11-20_proceedings.txt
Stortinget-20141120-095704_593100_612300,representantene marianne aasen gunnar gundersen geir toskedal sveinung rotevatn og svein roald hansen som har vært permitterte har igjen tatt sete representanten rasmus hansson vil framsette et representantforslag rasmus hansson vær så god,representantene marianne aasen gunnar gunnersen geir toskedal sveina rotevatn og svein roald hansen som har vore permiterte har gjentatt setet representanten rasmus hansen vil framsette eit representantforslag desmin hansen ver så god,593.1,612.3,19.199999999999932,2014-11-20,2014-11-20_proceedings.txt
Stortinget-20141120-095704_619900_637200,president på vegne av representanten eva kristin hansen representanten åsmund aukrust og meg selv har jeg gleden av å legge fram et forslag om å ta kapitelet om bærekraft tilbake inn igjen i nasjonalbudsjettet,president på vegner av representanten eva kristin hansen representanten åsmund aukrust og basel har eg gleda av å legge fram eit forslag om å ta kapittelet om berekraft tilbake inn igjen i nasjonalbudsjettet,619.9,637.2,17.300000000000068,2014-11-20,2014-11-20_proceedings.txt
Stortinget-20141120-095704_640300_666000,og eee forslaget vil bli behandlet på reglementsmessig måte til behandling foreligger de saker som er oppført på dagsorden nummer sytten sak en er eee redegjørelse om viktige eu og eøssaker av ministeren hun statsministerens kontor for samordning av eøssaker og forholdet til eu som må være den lengste tittelen i i i regjeringen tror presidenten,og eee forslaget vil bli behandla på reglementsmessig måte til behandling foreligger de saker som er offer på dagsorden nummer sytten sak ein er eee redegjørelse om viktige eu og esaker av ministeren ved statsministerens kontor for samordning av eøssaker og forover til eu som må vere den lengste tittelen i i i regjeringa trur presidenten,640.3,666.0,25.700000000000045,2014-11-20,2014-11-20_proceedings.txt
Stortinget-20141120-095704_666000_671100,og da gir presidenten ordet til statsråd vidar helgesen,og da gir presidenten ordet til statsråd vidar helgesen,666.0,671.1,5.100000000000023,2014-11-20,2014-11-20_proceedings.txt
Stortinget-20141120-095704_677400_680800,statsråd helgesen vær så god,statsråd helgesen ver så god,677.4,680.8,3.3999999999999773,2014-11-20,2014-11-20_proceedings.txt
Stortinget-20141120-095704_689900_717600,president da folks ønske om frihet rev berlinmuren for femogtyve år siden forandret til europa og norge vi visste ikke i november nittenniogåtti hvilken retning utviklingen ville ta dramatiske forandringer er lettere å forstå i ettertid i dag står vi igjen ved et historisk tidskille i europa men nå konfronteet lands ønske om frihet,president det folks eee ønsker om frihet rev berlinmuren for femogtyve år sidan forandre til europa og noreg vi viste ikkje i november nitten niogåtte i kva retning utviklinga ville ta dramatiske forandringar er eee lettare å forstå i ettertidi dag står vi igjen ved eit historisk tilskilje i europa men nå konfronteeit lands ønske om frihet,689.9,717.6,27.700000000000045,2014-11-20,2014-11-20_proceedings.txt
Stortinget-20141120-095704_717600_745700,med militære maktmidler og andre land ønsk utsettes for provokasjoner og grensekrenkninger europa er omkranset av ustabilitet og konflikt både i øst og i sør og er dessuten preget av store interne problemer vi vet ikke i dag hvordan europa ser ut om femogtyve år men vi vet at tunge norske interesser står på spill og vi vet at ikke noe samarbeid vil være viktigere for norges fremtid enn samarbeidet med eu,med militære maktmidler og andre land ønsk utsettast for provokasjonar og grensekrenkingar europa er omkransa av ustabilitet og konflikt både i aust og i sør og er dessuten prega av store interne problem vi veit ikkje i dag korleis europa ser ut som femogtive år men vi veit at tunge norske interesser står på spel og vi veit at ikkje noko samarbeid vil vere viktigare for noregs framtid enn samarbeidet med eu,717.6,745.7,28.100000000000023,2014-11-20,2014-11-20_proceedings.txt
Stortinget-20141120-095704_745700_772300,det er derfor norsk utenrikspolitikk begynner i europa regjeringens strategi for samarbeidet med eu i perioden tyvefjorten tyvesytten viser at det er stort samsvar mellom det som er viktig for norge og det som er viktig for eu eu og eøsspørsmål berører store deler av det norske samfunn og alle politikkområder vi har etablert regjeringens europautvalg for å sikre en sterk forankring og koordinering av eu eøssaktatsråder,der derfor norsk eee utanrikspolitikk begynner i europa regjeringas strategi for samarbeidet med eu i perioden tyvefjorten tyvesytten viser at det er stort samsvar mellom det som er viktig for noreg og det som er viktig for eu eu og eøsspørsmål berører store delar av det norske samfunn og alle politikkområde vi har etablert regjeringas europautval for å sikre ein sterk forankring og kordinering av eu evessaatsrådar,745.7,772.3,26.59999999999991,2014-11-20,2014-11-20_proceedings.txt
Stortinget-20141120-095704_772300_801600,og departementer i de viktigste europapolitiske spørsmålene hva må til for å skape vekst og sysselsetting hvordan bidra til å utvikle et digitalt indre marked og en moderne digital økonomi som fremmer både industri og forbrukerhensyn hvordan kan norsk næringsliv og forskningsmiljøer være med blant de fremste til å videreutvikle fremtidig innovasjon og konkurranseevne hvordan skal europa møte migrasjonsutfordringene hvordan skal vi bygge europas felles sikkerhet i en farligere tid president,og departementet i dei viktigaste europapolitiske spørsmåla kva må til for å skape vekst og sysselsetting var dei bidra til å utvikle eit digitalt indre marked og ein moderne digital økonomi som fremmer både industri og forbrukarensyn korleis kan norsk næringsliv og forskingsmiljøer vere med blant dei fremste til å vidareutvikle framtidig innovasjon og konkurranseevne korleis skal europa møte migrasjonsutfordringane korleis skal vi bygge europas helles sikkerhet i ein farlegare tid president,772.3,801.6,29.300000000000068,2014-11-20,2014-11-20_proceedings.txt
Stortinget-20141120-095704_801600_830100,dette er viktige spørsmål for norge og europa og i de kommende månedene vil eu arbeide med å gi sitt svar på dem eus nye ledelse er nå i gang med å utforme sitt arbeidsprogram og det er viktig for norske interesser at vi gir innspill i denne prosessen fire nyvinninger i det nye kommisjonsoppsettet er eee verd å merke seg for det første opprettes det en ny stilling som første visepresident med blant annet ansvar for bedre regulering og mindre byråkrati,dette er viktige spørsmål for noreg og europa og i dei kommande mondene vil eu arbeide med å gi sitt svar på dei eus nye ledelse er nå i gang med å utforme sitt eee arbeidsprogram og det er viktig for norske interesser at vi gir innspel i denne prosessen fire nyvinningar i det nye kommisjonsopsettet er eee verd å merke seg fordet første opprettast ein ny stilling som første viser president med blant anna ansvar for betre regulering og mindre byråkrati,801.6,830.1,28.5,2014-11-20,2014-11-20_proceedings.txt
Stortinget-20141120-095704_830100_856300,dette er sentralt også med norske øyne sett for et par måneder siden ble euregelverket nummer ti tusen tatt inn i eøsavtalen det forteller at vi er tjent med at eu vedtar smarte regler vi støtter kommisjonspresidense president junkers programerklæring om at eu bør være stort på de store tingene mindre på de små tingene for det andre har syv visepresidenter fått et koordinerings,dette er sentralt også med norske øyner sett for eit par månader sidan blei euregelverk nummer ti tusen tatt inn i eøsavtalen det fortelle det at vi er tent med at eu vedtar smarte reglar vi støttar kommisjons president junkers programverklæring om at eu bør vere stort på dei storetinga mindre på dei små tinga for det andre har syv vis president fått eit kordinerings,830.1,856.3,26.199999999999932,2014-11-20,2014-11-20_proceedings.txt
Stortinget-20141120-095704_856300_883000,med ledende europeiske politikere som ansvarlige kan vi forvente mer initiativkraft på områder som er viktige også for norge for det tredje ser vi nye sammensetninger av porteføljer på områder som er særlig viktige for norge en kommissær skal se energi og klimapolitikk i sammenheng og samarbeide med en vise president når det gjelder energiunionen og med en annen om bærekraftig utvikling miljø slås sammen med maritime spørsmå,med ledande europeiske politikarar som ansvarleg kan vi forvente meir initiativkraft på område som er viktige også for noreg for det tredje ser vi nye samansetningar av portefølgje på område som er særleg viktige for noreg egen kommisær skal se energi og klimapolitikk i samanheng og samarbeide med einvise president når det gjeld energiunionen og med ein annan om berekraftig utvikling miljø slås saman med maritime spørsmå,856.3,883.0,26.700000000000045,2014-11-20,2014-11-20_proceedings.txt
Stortinget-20141120-095704_883000_912800,for det fjerde vil kommissær johannes han som har fått ansvar for naboskapspolitikken og utvidelsesforhandlinger også få en rolle når det gjelder forholdet til efta eøslandene han vil derfor bli en viktig kontakt for norge det gjenstår å se hvordan disse organisatoriske grepene vi slå ut i praksis det er viktig og riktig å se ulike politikkområder i sammenheng men den nye eee strukturen fjerner eu enda lenger fra eee strukturen i eøsavtalen som jo er tuftet på eus gamle søylestruktur,for det fjerde vil kommisær johannes han som har fått ansvaret for naboskapspolitikken og utvidelsesforhandlingar også få ein rolle når det gjeld forhold til efta eøslandet han vil derfor bli ein viktig kontakt for noreg det gjenstår å se kor des desse organisatoriske grepa vil slå ut i praksis det er viktig og riktig å se ulike politikkområder i samanheng men den nye eee strukturen fjerner eu enda lenger frå eee strukturen nye eøsavtalen som jo ver tufte på eus gamle søylestruktur,883.0,912.8,29.799999999999955,2014-11-20,2014-11-20_proceedings.txt
Stortinget-20141120-095704_912800_941100,president eøsavtalen er hjørnestenen i norsk europapolitikk men den er en hjørnesten i en bygning som er i stadig ombygging for å holde liv i avtalen må vi eee knytte gode kontakter både med de nye kommissærene med det nye europaparlamentet og dessuten holde god bilateral kontakt med sentrale euland vårt omfattende samarbeid med tyskland er viktig vi trapper nå også opp samarbeidet med polen,president eøsavtalen er bjørnestenen i norsk eee europapolitikk men ein er ein hjørnesten i ein bygning som er i stadig ombygging for å halde liv i avtalen må vi eee knytte gode kontaktar både med dei nye kommisærene med det nye europaparlamentet og dessutan had de god bilaterakontakt med sentrale euland vårt omfattande samarbeid med tyskland er viktig vi trappar nå også opp samarbeidet med polen,912.8,941.1,28.300000000000068,2014-11-20,2014-11-20_proceedings.txt
Stortinget-20141120-095704_941100_968600,regjeringen ønsker å bruke det nordiske samarbeidet og det nordisk baltiske samarbeidet mer aktivt i europapolitikken den baltiske dimensjonen blir ikke minst viktig under det kommende latviske euformannskapet i et europa som er omgitt av usikkerhet og med store interne problemer er den nordisk baltiske regionen en suksesshistorie vi har vist evne til å reformere også i gode tider og bygge opp sterke og bærekraftige økonomier vi har et økonomisk og politisk verdifellesskap som o praktisk arbeidsfellesskap,regjeringa ønsker å bruke det nordiske samarbeidet og det nordisk baltiske samarbeidet meir aktivt i europapolitikken den baltiske dimensjonen blir ikkje minst viktig under det komande latviske euformannskapet i eit europa som er omgitt av usikkerheit om ei store interne problem er den nordiskbaltiske regionen ein suksesshistorie vi har vist evne til å reformere også i gode tider å bygge opp sterke og berekraftige økonomier vi har eit økonomisk og politisk verdifellesskap som ot praktisk arbeidsfellesskap,941.1,968.6,27.5,2014-11-20,2014-11-20_proceedings.txt
Stortinget-20141120-095704_968600_997200,denne den nye sikkerhetspolitiske situasjonen styrker betydningen av nordisk baltisk samarbeid også på det utenriks og forsvarspolitiske områder de nordiske statsministerne har erklært at de ønsker en tettere koordinering i europa spørsmål samarbeidsministeren har vedtatt en reform av nordisk ministerråd for å styrke samarbeidet om internasjonale spørsmål herunder eu eøs og på norsk initiativ holdt vi under nordisk rådsesjon i oktober det første nordiske europaministermøtet jeg er enige om at norden har viktige bidrag å gi,denne den nye sikkerheitspolitiske situasjonen styrker betydningen av nordisk partisk samarbeid også på det utanriks og forsvarspolitiske område dei nordiske statsministeren her er klart at dei ønsker ein tettare kordinering i europaspørsmål samarbeidsministeren har vedtatt ein reform av nordisk ministerråd for å styrke samarbeidet om internasjonale spørsmål her under eu eøs og på norsk initiativ holt vi under nordisk råd sesjonen i oktober det første nordiske europaministermøtet me er einige om at norden har viktige bidrag å gi,968.6,997.2,28.600000000000023,2014-11-20,2014-11-20_proceedings.txt
Stortinget-20141120-095704_997200_1027200,til det europeiske samarbeidet det gjelder ikke minst bidrag til å fremme vekst sysselsetting og innovasjon til eutoppmøtet attende desember forventes det at stats og regjeringssjefene får forelagt seg et forslag om en omfattende investeringspakke vi arbeider for at disse investeringene i størst mulig grad samsvarer med våre interesser ikke minst ettersom energiinfrastruktur og satsing på fornybar energi er ventet å bli viktige elementer i pakken,til det europeiske samarbeidet det gjeller ikkje minst bidrag til å fremme vekst sysselsetting og innovasjon til eee eutoppmøtet attende desember forventar dei at stats og regjeringssjefene får forelagt seg eit forslag om ein omfattande investeringspakke vi arbeider for at desse investeringane i størst mulig grad samsvarer med våre interesser ikkje minst ettersom energiinfrastruktur og satsing på fornybar energi er venta til å bli viktige element i faken,997.2,1027.2,30.0,2014-11-20,2014-11-20_proceedings.txt
Stortinget-20141120-095704_1027200_1056100,i tillegg har president junker satt som mål at kommisjonen i april tyvefemten skal legge frem en omfattende pakke som skal lede frem til et digitalt fellesmarked dette blir en viktig fremtidssatsing også for norge som gjennom eøsavtalen blir en del av dette markedet når europa trenger ny vekst så er det ikke minst fordi det er stor økonomisk og sosial ulikhet innad i eu eøsfinansieringsordningene bidrar til å redusere forskjeller i europa,i tillegg har president junker satt som mål at kommisjonen i april tjuefemten skal legge fram ein omfattande pakke som skal lede fram til eit digitalt fellesmarked dette blir ein viktig framtidssatsing også for noreg som gjennom eøsavtalen blir ein del av dette markedet når europa treng ny vekst så er det ikkje minst fordi det er stor økonomisk og sosial ulikhet innad i eu eøsfinansieringsordningae bidrar til å redusere forskjellar i europa,1027.2,1056.1,28.899999999999864,2014-11-20,2014-11-20_proceedings.txt
Stortinget-20141120-095704_1056100_1082200,ungdomsledighet og svak økonomisk utvikling preger mange av mottakerlandene regjeringen ønsker derfor særlig å styrke satsingen på utdanning og forskning innovasjon antreprenørskap klima energi og miljø i neste programperiode etter et lengre opphold i forhandlingene om nye eøsmidler har det nylig vært kontakt mellom partene avstanden mellom partene er fortsatt meget stor,ungdomsledighet og svak økonomisk eee utvikling pregar mange av mottakarlandet regjeringa ønsker derfor særleg å styrke satsinga på utdanning og forsking innovasjon antreprenørskap klima energi og miljø i neste programperiodeetter eit lengre opphald i forhandlingane om nye eøsmidel har det nyleg vore kontakt mellom partane avstanden mellom partane er fortsatt meget stor,1056.1,1082.2,26.100000000000136,2014-11-20,2014-11-20_proceedings.txt
Stortinget-20141120-095704_1082200_1110500,nye eøsmidler foregår parallelt med forhandlinger om markedsadgang for fisk norge har tradisjonelt bare fått små forbedringer i maked markedsadgangen gjennom forhandlingene med eu for regjeringen er det svært viktig å sikre bedre markedsadgang for sjømatnæringen vi har understreket overfor eu at videreføring av eøsbidragene forutsetter tilfredsstillende løsninger for fisk president vi står nå foran ytterligere en forhandlingsprosess med eu,nye eøsmiddelel foregår parallelt med forhandlingar om markedsavgang for fisk noreg har tradisjonelt berre fått eee små forbetringar i markeds markedsavgangen gjennom forhandlingane med eu for regjeringa er det svært viktig å sikre betre markedsavgang for sjømatnæringen vi har understreket overfor eu at vidareføring av eøsbidragen forutsetter tilfredsstillande løysingar for fisk president viss det nå får han ytterlegare ein forhandlingsprosess med eu,1082.2,1110.5,28.299999999999955,2014-11-20,2014-11-20_proceedings.txt
Stortinget-20141120-095704_1110500_1134500,eøsavtalens artikkel nitten forplikter partene til gradvis økt handel med landbruksprodukter innenfor rammene av partenes respektive landbrukspolitikk eu har nå vedtatt sitt mandat for forhandlingene og vi venter at disse vil bli innledet rett etter nytt år den nye forhandlingsrunden runden bunner i en enighet fra tyvetolv da norge gikk med på et krav fra eu om å forberede en ny artikkel nitten runde,eøsavtalens artikkel nitten forplikte partane til gradvis økt handel med landbruksprodukter innanfor rammene av partenes respektive landbrukspolitikk eu har nå vedtatt sitt mandat for forhandlingane og vi ventar at desse vil bli innlede trett etter nyttår den eee nye forhandlingsrunden runden bender i ein einigheit frå tyve tolv då noreg gjekk med på eit krav frå eu om å forberede ein ny artikkel i nittenrunde,1110.5,1134.5,24.0,2014-11-20,2014-11-20_proceedings.txt
