file,text_bm,text_nn,start,end,duration,date,proceedingsfile
Stortinget-20141120-095704_6378900_6406400,en sånn tvert imot unnlater de å bevilge ei krone av hver hundrelapp vi tjener til bistand og så foreslår de en altfor beskjeden sum innenfor den beskjedne bistandsrammen til klimafinansiering sv meiner videre at støtta til klimafinansiering må få en årlig opptrappingsplan fram mot tjuetjue president til slutt vil jeg minne om at alle penger vi bevilger som bistand skaltes skikkelig,kje velja ein sånn strategi tvert imot unnlate dei å bevilge ei krone av ver hundrelapp vi tener til bistand og så foreslår dei ein altfor beskjedne sum inn frå den beskjedne bistandsrammen til klimafinansieringsv meiner vidare at støtta til klimafinansiering må få ein årleg opptrappingsplan fram mot tjuetjue president til slutt vil eg minna om at alle pengar vi bevilga som bistand skaltast skikkeleg,6378.9,6406.4,27.5,2014-11-20,2014-11-20_proceedings.txt
Stortinget-20141120-095704_6406400_6435500,jeg vil minne regjeringen om at de har et stort ansvar for å følge opp forvaltningen av penger så godt til klimafinansiering og sørge for gode tiltak mot mislighold også i de internasjonale fonda som norge bevilger penger til det er verken i klimaet eller de fattige landas interesse at vi glømmer bort nulltoleransen mot korrupsjon og mislighold når vi nå diskuterer de store summene som er påkrevd fra verdens rikeste land,eg vil minna regjeringa om at dei har eit stort ansvar for å følga opp forvaltninga av pengar som går til klimafinansiering og sørger for gode tiltak mot mislighald også i dei internasjonale fonda som noreg bevilga pengar til det er verken i klima eller dei fattige landas interesser at vi gløymer bort nulltoleransen mot korrupsjon og mislighald når vi no diskuterer dei store summane som er påkrevd frå verdas rikaste land,6406.4,6435.5,29.100000000000364,2014-11-20,2014-11-20_proceedings.txt
Stortinget-20141120-095704_6435500_6460500,og også vi i sv imøteser flere kommende debatter om korleis oljefondet vårt som vi kaller det på folkemunne kan brukes som et enda bedre verktøy i den store viktige klimakampen der norge har både finansielle muskler og kompetanse til å ta et særskilt ansvar i den grønne gode strid,og også vi i sv imøteser fleire kommande debattar om korleis oljefunnet vårt som vi kallar det på folkemunne kan brukast som eit enda betre verkty i den store viktige klimakampen der noreg har både finansielle musklar og kompetanse til å ta eit særskilt ansvar i den grøne gode strid,6435.5,6460.5,25.0,2014-11-20,2014-11-20_proceedings.txt
Stortinget-20141120-095704_6460500_6468200,neste taler er representanten oskar j grimstad deretter representanten rasmus hansson qqq,neste talar er representanten oskar jo grimstad deretter representanten rasmus hansen,6460.5,6468.2,7.699999999999818,2014-11-20,2014-11-20_proceedings.txt
Stortinget-20141120-095704_6473700_6500600,grimstad vær så god president qqq norge er et av de landa som bidrag eee bidrar mest regna per kapita i klimaarbeidet og etter å ha deltatt som observatør i fns arbeid nå i månedstid og sett arbeidet jeg gir innafra ei rekke viktige områder så kan jeg også konkludere med at vi viser godt igjen i statistikkene om økonomiske bidrag også når det gjelder fond,grimsta ver så godpresident qqq noreg er eitt av dei landa som bidreg bidrar mest rekna per kapital i klimaarbeidet og etter å ha deltatt som observatør i fns arbeid no i ein månads tid og set arbeidet dei gjer innanfor ei rekke viktige område så kan eg også konkludere med at vi viser godt igjen i statistikkane og økonomiske bidrag også når det gjeld fond,6473.7,6500.6,26.900000000000546,2014-11-20,2014-11-20_proceedings.txt
Stortinget-20141120-095704_6500600_6527100,norfond er også et svært viktig gir også et svært viktig arbeid på fornybarsida og utenlands og i ei i ei rekke land og er et anna eksempel på norges bidrag på dette området norge har aktivt bidrege med utvikle utvikling av det internasjonale arbeidet på klimaområdet og ambisjonene videre er slett ikke reduserte s,nordfond er også eit svært viktig gjer også eit svært viktig arbeid på fornybarsida utanlands og i ei i ei rekke land og er eit anna eksempel på noregs bidrag på dette området noreg har aktivt bidreg med utvik utvikling av det internasjonale arbeidet på klimaområdet og ambisjonane vidare er slett ikkje reduserte s,6500.6,6527.1,26.5,2014-11-20,2014-11-20_proceedings.txt
Stortinget-20141120-095704_6527100_6554300,så at en nå foreslår en konkret klimaprosent som et mål er etter fremskrittspartiet si meining ei avstoring politiske ambisjoner gjennom en et prosentmål er en dårlig det er da det fokuserer på re ressursallokkering framfor fokus på det som er viktig effektiv og god ressurs plassering denne regjeringa har og vil fortsatt være globamste rekke,så at ein no føreslår ein konkret klimaprosent som eit mål er etter framstegspartiet si meining ei avsporing politiske ambisjonar gjennom ein eit prosentmål er ein dårleg det er då det fokuserer på re ressursalokering framfor fokus på det som er viktig effektiv og god ressurspplassering denne regjeringa har og vil fortsatt vere globamste rekke,6527.1,6554.3,27.199999999999818,2014-11-20,2014-11-20_proceedings.txt
Stortinget-20141120-095704_6554300_6582000,når det gjelder ressursbruk målt per kapital men å låse det som sagt til en eksekt eee eksakt prosent av bnp er rett og slett bare en dårlig eee ide så til slutt noen ord eee knytta til representanten ingunn gjerstad sitt innlegg der å ta opp problemer med korrupsjon vi ser i dag at store midler går til denne type arbeid og da er det svært viktig at ikke dette arbeidet blir øgt av at eee,når det gjeld eee ressursbruk målt per kapital men å låse det som sagt til ein seks eee eksakt prosent av bnp er rett og slett berre ein dårleg ide så til slutt nokre ord eee knytt til representanten ingunn gjerstad sitt innlegg der og o tek opp problemet med korrupsjon vi ser i dag at store midlar går til denne type arbeid og då er det svært viktig at ikkje dette arbeidet blir agt av at eee,6554.3,6582.0,27.699999999999818,2014-11-20,2014-11-20_proceedings.txt
Stortinget-20141120-095704_6582000_6601300,uærlige sjæle kjøme inn og fra forsyner seg av av ressursene til dette viktige arbeidet så å ha fokus på dette også er svært viktig takk neste taler er representanten rasmus hansson deretter statsråd tine sundtoft qqq,uærlege kjeler kjem inn og får forsyne seg av av ressursane til dette viktige arbeidet som har fokus på dette også er svært viktig takk neste talar er representanten rasmuns hansen deretter statsråd tine suntoftq,6582.0,6601.3,19.300000000000182,2014-11-20,2014-11-20_proceedings.txt
Stortinget-20141120-095704_6605400_6634900,hansson vær så god president eee i eee innstillingen til eee denne saken uttaler eee en samlet komite uten store reduksjoner i klimagassutslippene risikerer verden at samfunn og økosystemer over hele verden ødelegges det er derfor ep fns klimafond er opprettet med norge som en av pådriverne og poenget med klimafondet,alsamar så god president eee i eee innstillinga til eee denne saka utover eee ein samla komite utan store reduksjonar i klimagassutslippene risikerer verden at samfunn og økosystemet over heile verda øydeleggis der derfor fns klimafond er oppdrettet med noreg som ein av pådrivarane og poenget med klimaformet,6605.4,6634.9,29.5,2014-11-20,2014-11-20_proceedings.txt
Stortinget-20141120-095704_6634900_6654600,er altså at rike land skal gi penger til dette fondet slik at det kan investere i en mere bærekraftig utvikling i fattige land så vi kanskje kan klare å ris å å unngå de skumle eee effektene av klimaendring som komiteen påpeker,er altså rike land skal gi pengar til dette fore slik at de kan investere i ein meir berekraftig utvikling i fattige land så vi kanskje kan klare å desse å unngå dei skumle eee effekten av klimaendring som komiteen påpeikar,6634.9,6654.6,19.700000000000728,2014-11-20,2014-11-20_proceedings.txt
Stortinget-20141120-095704_6654600_6681100,eee klima og miljøminister tine sundtof påpeker i et brev til energi og miljøkomiteen nittenfemti fjorten det er stort behov for finansiering til utslippskutt og klimatilpasning i ute utviklingsland og regjeringen mener at norge skal spille en pådriverrolle komiteen eee viser på sin side til at forhandlinger om den internasjonale klimaavtalen går tregt og at det i stor grad er på grunn av dyp konflid,eee klima og miljøminister tine suntoff påpeikar i eit brev til energi og miljøkomiteen nittenfemtfjorten det er stort behov for finansiering av utsleppskutt og klimatilpasning i utti utviklingsland og regjeringa meiner at noreg skal spele ein pådriverrolle komiteen eee viser på sin side til at forhandlingar om den internasjonale klimaavtalen går tregt og at det i stor grad er på grunn av dyr konflid,6654.6,6681.1,26.5,2014-11-20,2014-11-20_proceedings.txt
Stortinget-20141120-095704_6681100_6702800,fordi det er misnøye med finansieringsviljen fra rike land og komiteen understreker også at det er viktig at norge fortsatt har en aktiv og ledende posisjon i arbeidet med fns klimafond og så videre så har altså regjeringen solberg bevilget to hundre millioner kroner til det veldig viktige fondet,fordi dei er misnøye med finansieringsviljen frå rike land og komiteen undersøker også at det er viktig at noreg fortsatt har ein aktiv og ledande posisjon i arbeidet med fns klimafond og så vidare så har altså regjeringa solberg bevil gitt to hundre millionar kroner til det veldig viktige fonnet,6681.1,6702.8,21.699999999999818,2014-11-20,2014-11-20_proceedings.txt
Stortinget-20141120-095704_6702800_6731300,eee mens eee det de rike landene ble enige om i københavn var altså et mål på hundre milliarder dollar to hundre millioner kroner er mindre enn det nå har i pcc eller nå har usa eee varslet tre milliarder dollar sverige kommer med en milliard frankrike med en milliard og så videre alle sammen mer eller betydelig mer enn det norge eee gir,eee mens eee det dei rike landa blei einige om i københavn var altså eit mål på hundre milliardar dollar to hundre millionar kroner er mindre enn det nå har ipcc eller nå har usa eee varslet tre milliardar dollar sverige kommer med ein milliard frankrike med ein milliard og så vidare av oss saman meir eller betydeleg meir enn det noreg eee gir,6702.8,6731.3,28.5,2014-11-20,2014-11-20_proceedings.txt
Stortinget-20141120-095704_6731300_6760000,dette er altså bakgrunnen for at miljøpartiet de grønne har foreslått at norge benytter det eksepsjonelle internasjonale virkemiddelet vi har i form av statens pensjonsfond utland og tar en bitte liten del av det fondet eee ut til å styrke fns klimafond på en måte som virkelig vil gjøre forskjellen kostnaden for spu vil være cirka,dette er altså bakgrunnen for at miljøpartiet dei grøne har føreslått at noreg benytter det eksepsjonelle internasjonale verkemiddelet vi har i form av statens pensjonsonn utland og tar ein bitter liten del av det foret eee ut til å styrke fns krimafond på ein måte som verkeleg vil gjere forskjell kostnaden for spu vil vere sirka,6731.3,6760.0,28.699999999999818,2014-11-20,2014-11-20_proceedings.txt
Stortinget-20141120-095704_6760000_6788400,to tredjedeler av den kapitalen som tilføres fondet i løpet av ett kvartal det vil altså ikke tære på fondet i det hele tatt å være et meget beskjedent inngrep i vår pensjonskapital kirkens nødhjelp har gjort beregninger eee for et par måneder siden av hva norges egentlige internasjonale klimagjelder,to tredjedelar av den kapitalen som tilføres fonna i løpet av eitt kvartal det vil altså ikkje tære på fonn i det heile tatt å vere eit meget beskjeden til inngrep i vår pensjonskapitalkirkans nødhjelp har gjort bereikningar eee for eit par månader sidan a var noregs eigentlege internasjonal og klima eller,6760.0,6788.4,28.399999999999636,2014-11-20,2014-11-20_proceedings.txt
Stortinget-20141120-095704_6788400_6817200,gitt at vi lever av å selge olje og gass og summene som den undersøkelsen kommer fram til er ganske astronomiske det er mange hundre milliarder kroner per år på flere områder en sum på tredve milliarder kroner er lite i forhold til den klimagjelen ki kirkens nødhjelp beregner at vi faktisk har men likevel har vi altså i dag fått høre,gitt at vi lever av å selje olje og gass og summene som den undersøkelsen komme fram til er ganske astronomiske der mange hundre milliardar kroner per år på fleire område ein sum på tredve milliardar kroner er lite i forhold til den klimahelen kilens nødge bereikner at vi faktisk har men likevel har vi altså i dag fått høyre,6788.4,6817.2,28.800000000000182,2014-11-20,2014-11-20_proceedings.txt
Stortinget-20141120-095704_6817200_6844300,en del sympatierklæringer men så unisone oppsummeringer av at eee klimafondet at oljefondet det kan vi altså ikke foreløpig bruke til å gjøre en virkelig forskjell i internasjonalt klimaarbeid det syns jeg president er sørgelig for det er jo akkurat det som preger norsk klimapolitikk bå og ute,ein del sympatiar erklæringar men så unison og oppsummeringar av at eee klimafondet eee at oljefonnet det kan vi altså ikkje foreløpig bruke til å gjere ein verkeleg forskjell i internasjonalt klimaarbeid det synest eg president er sørgeleg for det er jo akkurat det som pregar norsk klimapolitikk bå og ute,6817.2,6844.3,27.100000000000364,2014-11-20,2014-11-20_proceedings.txt
Stortinget-20141120-095704_6844300_6873300,at vi er ikke villig til å sette inn virkemidler som vi kan sette inn og vi er ikke villig til å sette inn virkemidler som virkelig gjør en stor fordel forskjell og da gjør jeg selvfølgelig et unntak for en god ting som norge gjør ute nemlig skogsatsingen men vi sitter altså foreløpig igjen i forhold til det fondet vi har vært med å opprette selv hvor vi ikke har den ledende rollen som både statsråden og komiteen vil at vi skal ha,at vi er ikkje villig til å sette inn verkemiddel som vi kan sette inn og vi er ikkje villig til å sette inn verkemiddel som verkeleg gjer ein stor fordel for skjell og det gjer selvsjølgelig eit unntak for ein god ting som noreg gjer ute nemleg skogsatsingen men vi sit altså forløpet igjen i forhold til det fonna vi har vore med å opprette sel vor vi ikkje har den ledende rollen som både statsråden og komiteen vil at vi skal ha,6844.3,6873.3,29.0,2014-11-20,2014-11-20_proceedings.txt
Stortinget-20141120-095704_6873300_6902700,og vi ikke bidrar til å bygge opp fondet på noen konstruktiv måte og vi sannsynligvis er i en situasjon hvor vi forsterker mistanken fra fattige land om at rike land som norge ikke er villig til å bidra jeg noterer i det minste at jeg er villige til å fortsette eee denne diskusjonen det er en god ting og så håper jeg at eee et flertall i stortinget,og vi ikkje bidrar til å bygge opp fondet på nokon konstruktiv måte og vi sannsynlegvis er i ein situasjon vår vi forsterkar mistanke frå fattige land om at rike land som noreg ikkje er villig til å bidraja ein noterer i det minste at det er vilje til å fortsette eee denne diskusjonen det er ein god ting og så håpar eg at eee eit fleirtal i stortinget,6873.3,6902.7,29.399999999999636,2014-11-20,2014-11-20_proceedings.txt
Stortinget-20141120-095704_6902700_6931200,ved neste korsvei vil være villig til å bruke de virkemidlene norge virkelig har til å gjennomføre den politikken norge hevder at vi har takk ønsker stats ønsker representanten å ta opp de forslag som han har handlet da har statsråden tatt opp de forslag han selv har referert neste taler er statsråd eee tine sunstof sundtoft som også er for hvert fall så langt siste inntegnede tall sundtof vær så god,ved neste korsveg vil vere villig til å bruke dei verkemiddelet noreg verkeleg har til å gjennomføre den politikken noreg hevdar at vi har takk ønsker stats ønsker representanten å ta opp dei forslag som han då har statsråden tatt opp dei forslag frå selvreferertil neste talar er statsråd eee tine sunstot sundtoft som oss eir for kvart fall så langt siste innteikna sunt opp var så god,6902.7,6931.2,28.5,2014-11-20,2014-11-20_proceedings.txt
Stortinget-20141120-095704_6931200_6957000,eee president vi er på vei inn i et avgjørende år for internasjonal klimapolitikk i paris skal verden om ett år enes om en ambisiøs klimaavtale avtalen skal hjelpe oss med å begrense global oppvarming til to grader en viktig forutsetning for å lykkes blir å sørge for økt finansiering til klimatiltak i utviklingsland i årene fremover,eee president vi er på veg inn i eit avgjerande år for internasjonal klimapolitikk i paris skal verden om eitt år einast om ein ambisiøs klimaavtale avtalen skal hjelpe oss med å begrense global oppvarming til to grader ein viktig forutsetning for å lykkast blir å sørge for økt finansiering til klimatiltak i utviklingsland i åra framover,6931.2,6957.0,25.800000000000182,2014-11-20,2014-11-20_proceedings.txt
Stortinget-20141120-095704_6957000_6978500,jeg er glad for at representanten hansson setter søkelys på dette de fattigste landene rammes hardest av klimaendringene de trenger støtte til å tilpasse seg og de trenger støtte til å legge om økonomiene sine slik at de kan få økonomisk vekst mede utslipp,eg er glad for at eee representanten hansen set oss søkelys på dette dei fattigaste landa rammes haust av klimaendringane dei treng støtte til å tilpasse seg og dei treng oss støtte til å legge om økonomian sine slik at dei kan få økonomisk vekst meve utslepp,6957.0,6978.5,21.5,2014-11-20,2014-11-20_proceedings.txt
Stortinget-20141120-095704_6978500_7006700,på klimatoppmøtet i københavn i totusenogni lovte rike land hundre milliarder dollar årlig innen tjuetjue til klimatiltak i fattige land som representanten hansson er inne på i sitt forslag blir det grønne klimafondet en viktig brikke i oppskaleringen mot hundre milliarder dollar norge vil annonsere sitt bidrag på imøte i det grønne klimafondet i berlin i dag,på klimatoppmøtet i københavn i totusenogni lovde rike land hundre milliardar dollar årleg innan tjuetjue til klimatiltak i fattige land som representanten hansen er inne på i sitt forslag blir det grønne klimafon ein viktig brikke i oppskaleringa mot hundre milliardar dollar noreg vil annonsere sitt bidrag på iomøte i det grøne klimafondet i berlin i dag,6978.5,7006.7,28.199999999999818,2014-11-20,2014-11-20_proceedings.txt
Stortinget-20141120-095704_7006700_7035600,dette er midler som kommer på toppen av et allerede høyt nivå norge er i verdenstoppen når det gjelder internasjonal klimafinansiering i år gir vi drøye fem milliarder kroner til utslippsreduserende tiltak og klimatilpasning i utviklingsland den største internasjonale klimasatsingen er regjeringens klima og skoginitiativ,dette er midler som kommer på toppen av eit allereie høgt nivå noreg er i verdstoppen når det gjeld internasjonal klimafinansiering i år gir vi drøye fem milliardar kroner til utsleppsreduserande tiltak og klimatilpassing i utviklingsland den største internasjonale klimasatsinga er regjeringas klima og skoginitiativ,7006.7,7035.6,28.900000000000546,2014-11-20,2014-11-20_proceedings.txt
Stortinget-20141120-095704_7035600_7065500,i budsjettet for totusenogfemten foreslår regjeringen tre milliarder kroner til skogsatsingen og jeg er svært tilfreds med at en omfattende evaluering viser at initiativet har god framdrift og måloppnåelse og som de vet har også regjeringen beslutta å videreføre denne satsingen fram til tjuetjue utvikling av rein energi i utviklingslån er en annen norsk hovedsatsing,i budsjettet for totusenogfemten foreslår regjeringa tre milliardar kroner til skogsatsinga og eg er svært tilfreds med at ein omfattande evaluering viser at initiativet har god framdrift og måloppnåelse og som det vett har også regjeringa beslutta å vidareføre denne satsinga fram til tjuetjue utvikling av rein energi i utviklingsland er ein annan norsk hovudsatsing,7035.6,7065.5,29.899999999999636,2014-11-20,2014-11-20_proceedings.txt
Stortinget-20141120-095704_7065500_7093700,i tjuefjorten har stortinget bevilga nesten en komma tre milliarder kroner til slike tiltak klimatilpasning er et viktig område der vi trapper opp vår innsats i tjuetretten økte innsatsen rettet mot tilpasning til om lag seks hundre millioner kroner men som representanten hansson påpeker er finansieringsbehovene enorme,i tjuefjorten har stortinget bevilga nesten ein komma tre milliardar kroner til slike tiltakklimatilpassing er eit viktig område der vi trappar opp vår innsats i tjuetretten økte innsatsen rettet mot tilpassing til om lag seks hundre millionar kroner men som representanten hansen påpeikar er finansieringsbehova enorme,7065.5,7093.7,28.199999999999818,2014-11-20,2014-11-20_proceedings.txt
Stortinget-20141120-095704_7093700_7119000,vi må få til et storstilt grønt skifte i globale investeringer både offentlige og private og jeg vil trekke fram tre nøkkelfaktorer for å få til et slikt skifte det første er at offentlige reguleringer sender et tydelig og langsiktig signal til investorer om at fremtiden tilhører aktiviteter med lave cotoutslipp,vi må få til eit storstilt grønt skifte i globale investeringar både offentlege og private og eg vil trekke fram tre nykkelfaktorar for å få til eit slikt skifte det første er at offentlege reguleringar sender eit tydeleg og langsiktig signal til investorar om at framtida tilhøyrer aktivitetar med lave seotoutslipp,7093.7,7119.0,25.300000000000182,2014-11-20,2014-11-20_proceedings.txt
Stortinget-20141120-095704_7119000_7146300,i sundvoldenerklæringen sa regjeringen at vi skal være en pådriver i arbeidet for å sette en internasjonal pris på karbon en pris på karbon vil øke klimavennlige investeringer både i rike og i fattige land den andre faktoren er smart bruk av offentlige penger slik at private investeringer vris i klimavennlig retning norfund regner utløst over,i sunnvolleklæringa sa regjeringa at vi skal vere ein pådrivar i arbeidet for å sette ein internasjonal pris på kva bon ein pris på ka bon vil øke klimavenleg investeringa både i rike og i fattige land den andre faktoren er smart bruk av offentlege pengar slik at private investeringar vris i klimavenleg retning nordfonn reknar utløyst over,7119.0,7146.3,27.300000000000182,2014-11-20,2014-11-20_proceedings.txt
Stortinget-20141120-095704_7146300_7172500,treogførti milliarder private kroner gjennom sine investeringer i rein energi i utviklingslån regjeringen øker overføringene til nordfør neste år med to hundre og femti millioner til totalt fjorten hundre og åtti millioner og minst halvparten av kapitalpåfyllingen i tjuefemten vil gå til investeringer i for,treogførti milliardar private kroner gjennom sine investeringar i rein energi i utviklingsland regjeringa aukar overføringane til nordfor neste år med to hundre og femti millionar til totalt fjorten hundre og åtti millionar og minst halvparten av kapitalpåfyllinga i tjuefemten vil gå til investeringar i for,7146.3,7172.5,26.199999999999818,2014-11-20,2014-11-20_proceedings.txt
Stortinget-20141120-095704_7172500_7200700,subsidier til fossile brensler er både kostbart og dårlig for klimaet likevel er størrelsen på disse subsidiene dessverre mange ganger høyere enn verdens samlede klimafinansiering og denne brøken må snus sist men ikke minst blir utviklingslånd og fremvoksende økonomier nødt til å ta et stort ansvar sjøl de må skape gode vilkår for å tiltrekke seg investeringer,subsidiatil fosile brensle er både kostbart og dårleg for klima likevel er størrelsen på desse subsidiane dessverre mange gonger høgare enn verdens samlade klimafinansiering og denne bruken må snus sist men ikkje minst blir utviklingsland og fremvoksen økonomiar nøytt til å ta eit stort ansvar sjøl dei må skape gode vilkår for å tiltrekke seg investeringar,7172.5,7200.7,28.199999999999818,2014-11-20,2014-11-20_proceedings.txt
Stortinget-20141120-095704_7200700_7225800,og de må sørge for at økonomisk vekst skjer med så lave utslipp som mulig de gode nyhetene er at disse grepene i i stor grad vil lønne seg uansett slik new climate economy rapporten nylig har vist men rapporten er også tydelig på at støtte fra offentlige kilder må øke og norge vil gjøre sin del,og dei må sørge for at økonomisk vekst skjer med så lave utslepp som mulig dei gode nyheitene er at desse grepa i s i stor grad vil lønne seg uansett slik neuclaimet økonomirapporten nyleg har vist men rapporten er også tydeleg på at støttet frå offentlege kilde må auke og noreg vil gjere sin del,7200.7,7225.8,25.100000000000364,2014-11-20,2014-11-20_proceedings.txt
Stortinget-20141120-095704_7226800_7250100,presidenten kan ikke se at noen har ønsket replikk da er og ingen har flere bedt om ordet da er debatten i sak fire avsluttet og vi går videre til sak fem innstilling fra energi og miljøkomiteen om representantforslag fra stortingsrepresentantene ola elvestuen andre n skjelstad og terje bre breivik om direktoratet for forvaltning og ikt difis rolle,presidenten kan ikkje se at nokon har ønsket replikk det er då ingen av fleire veit om ordet da er debatten i sak fire avslutta og vi går vidare til sak fem innstilling fra energi og miljøkomiteen om representantforslag frå stortingsrepresentantane ola elvestuen andre en skjelstad og terje brei breivik om direktoratet for forvaltning og ikt difis rolle,7226.8,7250.1,23.300000000000182,2014-11-20,2014-11-20_proceedings.txt
