file,text_bm,text_nn,start,end,duration,date,proceedingsfile
Stortinget-20141205-085651_4050100_4078200,så er jeg opptatt av at vi må få flere ben å stå på vi må sørge for at fastlandsindustrien får en større konkurranseevne eee og det bidrar vi til eee og vi må sørge for at fastlandsindustrien kan bidra eee med også lavere utslipp eee noe vi gjør gjennom enova og innovasjon norge så eee i sum så handler det fikk om at vi skal begynne å ha en styrt avvikling av oljesektoren med vi må bygge opp andre ben å stå på og bruk av avkastningen av fra petroleumsformuen til å få til det grønne skiftet også her hjemme,så er eg opptatt av at vi må få fleire ben å stå på vi må sørge for at fastlandsindustrien får ein større konkurranseevne eee og eee det bidrag vi til eee og vi må sørge for at fastlandsisynen kan bidra med også lavere utslepp eee når vi gjør gjennom enova og innovasjon noreg så eee i sum så handlar det slik om at vi skal byne ha ein styrt avvikling av ode sektoren med i må bygge opp andre ben å stå på og bruka avkastninga av frå petroleumsformuen til å få til det grønneskiftet også heier me,4050.1,4078.2,28.09999999999991,2014-12-05,2014-12-05_proceedings.txt
Stortinget-20141205-085651_4078200_4084900,dermed er replikkordskiftet omme og vi går videre på talerlisten neste taler er oskar j grimstad,dermed er replikkordskiftet omme og vi går vidare på taleliste neste talar er osser jod grimstad,4078.2,4084.9,6.700000000000273,2014-12-05,2014-12-05_proceedings.txt
Stortinget-20141205-085651_4095100_4124000,president under finansdebatten i starten av denne uka fikk vi høyre at årets budsjett er det beste klimabudsjettet nå kong og dette var understreka av flere vi auker i i biodrivstoff i veitrafikken hybridbiler blir jo betydeligere bille billigere og vi satser fortsatt på el reinelbiler i tillegg så styrker vi energifondet kraftig den blåblå regjeringa og samarbeidspartnerne legger også opp til å bedre rammevilkåra for bygging og produksjon av grønn energi,president under finansdebatten i starten av denne uka fekk vi høyre at årets budsjett er det beste klimabudsjettet nokon gong og dette vart understreka av fleire vi aukar i eee biodrifstofor vegtrafikken hybridbilar blir betydelegare billeg billegare og vi satsar fortsatt på el rekneelbilar i tillegg så styrker vi energifondet kraftig den blåbåde regjeringa og samarbeidspartnarane legg også opp til å betra rammevilkåra for bygging og produksjon av grøn energi,4095.1,4124.0,28.90000000000009,2014-12-05,2014-12-05_proceedings.txt
Stortinget-20141205-085651_4124000_4148300,gjennom blant annet å foreslå gunstigere avskrivingsregler for vindkraftanlegg samt høgere en slags punkt for grunnrente på små kraftverk dette vil føre til mer satsing på for fornybar gene energi og er svært gledelig men enda mer gledelig er denne regjeringas oppretting av den urett som eee blei til del hundre og sytti hundre og åtti småkrafteiere,gjennom blant anna å føreslå gunstigare avskrivingsreglar for vindkraftanlegg samt høgare innslagspunkt for grunnrente på småkraftverk dette vil føre til meir satsing på for fornybar ener eee energi og ei svært gledeleg men endå meir gledeleg er denne regjeringas oppretting av den urett som eee blei til del hundre og sytti hundre g åtti småkrafteigarar,4124.0,4148.3,24.300000000000182,2014-12-05,2014-12-05_proceedings.txt
Stortinget-20141205-085651_4148300_4172600,som vart nekta tilgang til sertifikatmarkedet tross klare lovnader om dette svært mange av disse utbyggerne står i fare for å miste eee hus og gård grunn at der aurønt flertall på stortinget som gjennom hele perioden ikke holdt sine klare lovnader den uretten måtte de blåblå regjering til for å rette opp og det gleder meg stort president,s vart nekta tilgang til safikatmarkeder trass klare lovnader om dette svært mange av desse utbyggarane står i fare for å miste eee hus og gard grunna eit reigrønt fleirtal på stortinget som gjennom heile perioda ikkje holdt sine klare lovnaderden uretten måtte dei blåblå regjering til for å ha rett opp og det gler meg stort president,4148.3,4172.6,24.300000000000182,2014-12-05,2014-12-05_proceedings.txt
Stortinget-20141205-085651_4172600_4199500,vi har lufta denne regjeringa muligheter for kraftutveksling med tyskland og storbritannia gjennom etablering av to nye utenlandske kabler som vil kunne gi en bedre utnyttelse av kraftsystemer samt bidra til økt verdiskapning disse kablene er i som viktig for at norge skal lykkes med satsinga på økt produksjon og fornybar energidenne regjeringa har også varsla forslag til innføring av skattefradrag for enøktldningene,vidare lyftar denne regjeringa muligheiter for kraftutviksling med tyskland og storbritannia gjennom etablering av to nye utanlandskablar som vil kunne gi ein betre utnyttelse av kraftsystem samt bidra til økt verdiskaping desse kablane er i sum viktig for at noreg skal lykkast med satsinga på økt produksjon av fornybar energidenne regjeringa har også varsla forslag til innføring av skattefrådrag for enøktldningane,4172.6,4199.5,26.899999999999636,2014-12-05,2014-12-05_proceedings.txt
Stortinget-20141205-085651_4199500_4219900,fram til en slik ordning er på plass foreslår regjeringa å gjøre enøkordninga til en rettighetsbasert ordning noe som er svært positivt i sum satser denne regjeringa på konkrete tiltak mens de rødgrønne er mest opptatt av å presisere alvorskråd og kreve tiltak og spesielt nå etter at de er ut a,fram til ei slik ordning på plass foreslår regjeringa å gjere enøk ordninga til en rettighetsbasert ordning noko som er svært positivt i sum satsar denne regjeringa på konkrete tiltak mens dei raudgrøne er mest opptatt av å presisera alvorsgrad og krevje tiltak og spesielt no etterat dei er ute,4199.5,4219.9,20.399999999999636,2014-12-05,2014-12-05_proceedings.txt
Stortinget-20141205-085651_4219900_4246700,denne høsten har vi også fått demonstrert alvoret ved flom og ras der mannen i rauma i møre og romsdal har vært sterkt fokusert på i flere medier også tv åknes tafjord beredskap iks er et interkommunalt selskap som har ansvaret for våk overvåking av fjellskred selskapet lokalisert i stranda kommune og eies av kommunene stranda og nordal rauma stordal ørskog ti kylven ålesund kommune,denne hausten har vi også fått demonstrert alvoret ved flom og ras der mannen i rauma i møre romsdal har vore sterkt fokusert på i fleire media også tv okning stav for og beredskap iks er eit interkommunalt selskap som er ansvaret for våk overvaking av fjellskred selskapet er lokalisert i strand og kommunar og eigast av kommunane stranda nordal reimar stordal ørskog sykylven og ålesund kommune,4219.9,4246.7,26.800000000000182,2014-12-05,2014-12-05_proceedings.txt
Stortinget-20141205-085651_4246700_4275300,og i eee i dag har selskapet i operativ overvåking av områdene oknes på stranda heggursaksler i nordal kommune og som nevnt mannen i rauma dette er svært aktuelt og vi veit at i disse dager blir det også laga en såkalt katastrofefilm spesielt om åknese derfor er det viktig at det er slik varslinger på plass for at disse som bor i nemnde kommune skal føle den tryggheta som det trengs for fortsatt eee,og eee i dag har selskapet opperativ overvaking av områda åknes på stranda heggurs aksla i nordal kommune og som nemnt mannen i reima dette er svært aktuelt og vi veit at i desse dagar blir det også laga ein såkalla katastrofefilm spesielt om åkneset derfor er det viktig at ei slik varsling er på plass for at desse som bur i nemde kommuner skal følgje den tryggheita som det trengst for fortsatt eee,4246.7,4275.3,28.600000000000364,2014-12-05,2014-12-05_proceedings.txt
Stortinget-20141205-085651_4275300_4304500,eee aktivitet også innenfor næringsliv som blir sterkt ramma om de terrase går så hadde vi god glede av å delta på den årlige desemberkonferansen i kristiansund også der møtte vi stor tiltru til denne regjeringa at hun vil sørge for stabile rammevilkår og lyse ut nye prospektive leiteareal den forsikringa ga statsråden også til glede for de to hundre og femti tusen arbeidsplassene dette representerer landet over,eee aktivitet også innanfor næringsliv som blir sterkt ramma om dette raset går så hadde eg i god glede av å delta på den årlege desemberkonferansen i kristiansund også der møtte vi stor tiltru til denne regjeringa at ho vil sørge for stabile rammevilkår og lyse ut nye prospektive leitareal den forsikringa gav statsråden også til glede for dei to hundre og femti tusen arbeidsplassane dette representerer landet over,4275.3,4304.5,29.199999999999818,2014-12-05,2014-12-05_proceedings.txt
Stortinget-20141205-085651_4304500_4329900,pluss det betydelige økonomiske bidrag til vårt velse velferdssamfunn som petroleumssektoren står for president det er mer uttrygge på den linja den nye lederen i arbeiderpartiet jens eee gahr jonas gahr støre representerer ved sine uttalelser om at store deler av petroleumsressursene må ligge igjen i bakken dette skaper uro og truere i bransje i omstilling,pluss det betydelege økonomiske bidrag til vårt velse velferdssamfunn som petroleumssektoren står forda president er meir utrygg på den linja den nye leiaren i arbeidarpartiet gjen gar jonas gahr støre representerer ved sine uttalelser om at store delar av petroleumsressursane må ligge igjen i bakken dette skapar uro og truare ei bransje i omstilling,4304.5,4329.9,25.399999999999636,2014-12-05,2014-12-05_proceedings.txt
Stortinget-20141205-085651_4329900_4355300,og er svært skadelig det er like skadelig som tidligere leider i arbeiderpartiet jens stoltenbergs nyttårstale der han slo fast at tida for stor kraftutbygginga var forbi det ødela svært mykje spesielt for rekruttering men som det er sagt av av flere her det er svært mykje å glese over i det framlagte statsbudsjettet og er svært glad for å være en av den partene i en i en fireparts,og er svært skadeleg det er like skadeleg som tidlegare leiar i arbeidarpartiet jens stoltenbergs nyttårstale der han slo fast at tida for store kraftoppbyggingar var forbi det udla svært mykje spesielt for rekruttering men som det er sagt av av fleire her det er svært mykje å gle seg over i det framlagde statsbudsjettet og eg er svært glad for å vere ein av den partane i ein i ein fyrpark,4329.9,4355.3,25.400000000000546,2014-12-05,2014-12-05_proceedings.txt
Stortinget-20141205-085651_4355300_4365700,i ei i ei regjering med fire samarbeidspartnere kan s kan legge fram i dag det åpnes for replikkordskifte første replikant er åsmund aukrust,ei i ei regjering med fire samarbeidspartnarar kan s kan legge fram i dagdet åpnes for replikkordskifte første replikant er åsmund aukrust,4355.3,4365.7,10.399999999999636,2014-12-05,2014-12-05_proceedings.txt
Stortinget-20141205-085651_4373100_4400700,president qqq vi legger bak oss et år hvor fns klimapanel har lagt fram eee den femte sin femte hovedrapport med all tydelighet så slås det nå fast qqq at det ikke lenger er noen form for tvil om klimaendringene er menneskeskapt og at konsekvensene er mer alvorlig enn hva vi tidligere har trodd dette enes nå hele verden om med unntak av noen representantr egen regjering,president vi legg bak oss eit år vår fns klimapanel har lagt fram er den femte sin femte hovudrapport med all tydelegheit så slås det nå fast at det krenge er nokon for ein fortvil om klimaendringane er mennskeskapt og at konsekvensene er meir alvorleg enn va vi tidlegare har trudd dette einast no heile verden om med unntak av nokon representantr eigen regjering,4373.1,4400.7,27.599999999999454,2014-12-05,2014-12-05_proceedings.txt
Stortinget-20141205-085651_4400700_4424400,representanten jan henrik fredriksen sa tidligere i år at fns klimapanel drev med kvasiforskning og stilte store spørsmålstegn ved deres funn hva er det som egentlig er fremskrittspartiets syn på fns klimapanel og kan representanten grimstad uten forbehold si at de klimaendringene vi ser er et resultat av av av av menneskelig aktivitet grimstad,representanten jan henrik fredriksen sa tidlegare i år at fns klimapanel driv med kvar si forsking og stilt store spørsmålsteikn ved deira funn kva er det som eigentleg er i framstegspartiets syn på fns klimapanel og kan representanten grimstad utan forbehald si at dei klimaandringa vi ser er eit resultat av av av av menneskeleg aktivitetgrimstad,4400.7,4424.4,23.699999999999818,2014-12-05,2014-12-05_proceedings.txt
Stortinget-20141205-085651_4424400_4452300,president eee fns klimapanel sier at det med nittifem til hundre prosent siccarihte er at eee menneskeskapte aktiviteter er med å påvirke klimaetnår det gjelder fremskrittspartiet og fremskrittspartiet holdning til til klima og klimadebatten så så blir jo eee vi fortalte at vi for nekta det det er ei sanit som som eee med store modifikasjoner fremskrittspartiet i sitt landsmøte vedtoer klart eee før vår,president eee fns klimapanel seier at det med nittifem til hundre prosent sikkerheit er at menneskeskapte aktivitetar er med og påverkar klimaet når det gjeld framstegspartiet og framste partiets haldning til til klima og klimadebatten så så blir jo vi fortalt at vi fornektar det det er ei sannheit som som eee med store modifikasjonar framstegspartiet i sitt landsmøte vedto ei klart eee føre var,4424.4,4452.3,27.900000000000546,2014-12-05,2014-12-05_proceedings.txt
Stortinget-20141205-085651_4452300_4476100,holdning som vi opererer etter og i samarbeid med de partnene som nå i dag er med å legge fram et statsbudsjett så har vi lagt fram det viktigste og det beste klimabudsjettet noen gang det kan jeg som representant for fremskrittspartiet eee være med på å understreke at det er svært glad for det klagde ikke der au grønne gjennom si periode,holdning som vi opererer etter og i samarbeid med dei partane som no i dag er med å legge fram eit statsbudsjett så har vi lagt fram det viktigaste og det beste klimabudsjettet nokon gong det kan eg som representant frå fremstepartiet eee vere med på å understreke at dei er svært glad for det klarde ikkje dei raudgrøne i energi periode,4452.3,4476.1,23.800000000000182,2014-12-05,2014-12-05_proceedings.txt
Stortinget-20141205-085651_4476100_4499100,der man i i dag kappes om å svartmåle og og elendighetsbeskrive framtida neste replikant er marit arnstad åsmund eee aukrust skal til ja eee president jeg merker meg jo at da representanten grimstad da legger en littlite fem prosentene av tvil,der ein i dag kapast om å svartmåle og og elendighetsbeskrive framtidaneste replikant er marit arnstad åsmund eee aukrust skal ha ein tilja eee president har eg merker meg jo at de representanten grimstad der ligg ikkje ein litelege til fem prosent av tvil,4476.1,4499.1,23.0,2014-12-05,2014-12-05_proceedings.txt
Stortinget-20141205-085651_4499100_4529100,hvis representanten grimstad hadde kommet til en lege og han sa at nittifem prosent sannsynlighet hadde bekreft så tror jeg nok at representanten grimstad hadde behan latt seg behandle ut ifra det så mitt spørsmål til representanten grimstad igjen er kan fremskrittspartiet uten noen form for forbehold ta inn over seg det alvoret fns klimapanel varsler verden om grimstad jeg presiserte eee sikkerhetsråda som eee som eee fns klimapanel eee,viss representanten grimstad hadde komme til ein lege og han sa at at nittifem prosent sannsynlegheit hadde kreft så trur eg nok at representanten grimstad hadde behand la seg behandle ut ifrå det så mitt spørsmål til representanten grimstad igjen er kan framstegspartiet utan nokon form for forbehald ta innover seg det alvoret effens klimapaneold varsler verden om grimsta presiserte eee sikkerheitsgrader som som efnskrimapanel eee,4499.1,4529.1,30.0,2014-12-05,2014-12-05_proceedings.txt
Stortinget-20141205-085651_4529100_4551600,og var nøyen på det eee og jeg har ingen problem med å seie at jeg er stolt av å stå bak det budsjettet som eee vi legger fram i dag som er den sterkeste klimasatsinga noen gang i motsetning til det som der au grønne klar det gjennom åtte år det er jeg svært glad for neste replikant er marit arnstad,og var nøye inn på det eee og eg har ingen problem med å seie at eg er stolt av å stå bak det budsjettet som eee vi legger fram i dag som er den sterkaste klimasatsinga nokon gong i motsetning til det som dei raudgrøne klare gjennom åtte år det er eg svært glad forneste replikant er marit arnstad,4529.1,4551.6,22.5,2014-12-05,2014-12-05_proceedings.txt
Stortinget-20141205-085651_4558200_4586600,president jeg kan ikke si andøya at jeg synes det er artig at frp står her i dag og er stolt over det dem meiner i et godt klimabudsjett fordi det betyr at verden går litt framover det betyr at frp har gått fra være dem som er skeptisk til klimapolitikken og ikke vil være med på klimaforliket til å være den som markedsfører regjeringa sitt budsjett på klima det er bra det viser på en måte at verden går framover men,president eg kan ikkje seie anna ne at eg synest det er artig at frp står her i dag og er stolt over det dei er inne i eit godt klimabudsjett fordi det betyr at eee verden går litt framover det betyr at frp har gått frå og rå dei som er skeptiske til klimapolitikken og ikkje vil vore med på klimaforliket til å vore den som markedsfører regjeringa sitt budsjett på klima det er bra eee det viser på ein måte at vegen går framover men,4558.2,4586.6,28.400000000000546,2014-12-05,2014-12-05_proceedings.txt
Stortinget-20141205-085651_4586600_4614700,så er spørsmålet også til representanten eee eee også til frp spørsmålet om skog fordi der har han valgt formuleringer som gjør at du kjem ikke til å kunne bruke skogen som et klimatiltak du kjem til å øke skogvernet men du kjem i og det men du kjem ikke til å kunne gjennomføre den skogplantinga du ønsker og som faglig er anbefalt både fra miljødirektoratet og landbruksdirektoratet i fellesskap,så er spørsmålet også til representanten eee eee også til frp spørsmålet om skog fordi der har han valt formuleringar som gjer at du kjem ikkje til å bruke skogen som eit klimatiltak du kjem til å økt skogvernet men du kjem i og det men du kjem ikkje til å kunne gjennomføre den skogplantinga du ønsker og som fagleg er anbefalt både framiljedirektoratet og landbruksdirektoratet i sellesskap,4586.6,4614.7,28.099999999999454,2014-12-05,2014-12-05_proceedings.txt
Stortinget-20141205-085651_4614700_4641800,eee det er på grunn av de formuleringene som går på at du skal utelukke vestlandet og nordnorge nord for saltfjellet og hvis du ikke eee tillater at du planter skog der da blir det ikke en skogplantidenute grimstad eee president eee jeg det er eee satt i gang ei rekke tiltak eee på klimasida og skog er også viktig det kan jeg være enig med representanten arnstad men eee dette er jo første og ei rekke budsjett som vi får sjida vil gi,eee det er på grunn av dei formuleringane som går på at du skal uteluk vestlandet og nordnoreg no for saltfjellet og viss du ikkje er tillate at du tanke skog der da blir det ikke ein skogplanting tiden ute grimstad eee president eee det er sett i gang ei rekke tiltak på klimasida og skog er også viktig det kan eg vere einig med representanten og ansa men eee dette er jo første av ei rekke budsjett så vi får sjida vil gi,4614.7,4641.8,27.100000000000364,2014-12-05,2014-12-05_proceedings.txt
Stortinget-20141205-085651_4641800_4671500,men jeg må si det at jeg er da er mer glad for den eee tilrettelegginga som det denne regjeringa står for når det gjelder fornybar delen og den auka produksjonen få vi får der i tillegg til at vi klarte å rette opp den lovnaden som senterpartiet også var med på når det gjaldt disse hundre og sytti hundre og åtte kraftverksutbyggerne som trass klare lovnader spesielt ifra senterpartiet ikke fikk det de vel over det vi klarte det med den anledning arnstad,men eg må seie at eg er då er meir glad for den til tilrettelegginga som det denne regjeringa står for når det gjeld fornybardelen og den auka produksjonen for vi får der i tillegg til at vi klarte å rette opp den lovnaden som senterpartiet også har vore med på når det galt is hundre og sytti hundre og åtte kraftverksutbyggarane som trass klare lovnader spesielt i frå senterpartiet ikkje fekk det dei valane vi klare det med denne anledning anstad,4641.8,4671.5,29.699999999999818,2014-12-05,2014-12-05_proceedings.txt
Stortinget-20141205-085651_4671500_4695600,ja jeg kan godt eee ja jeg har b jeg ba ikke men jeg kan godt fortsette ja altså for det første eee sier jeg jeg er glad for det som eee nå ble gjort overfor de småkrafteierne som ikke var inkludert i den grønne sertifikatordninga eee det er fortsatt mye uklarhet til hvordan eee dem vil bli behandla i sertifikatmarkedet framover og det skal vi komme tilbake til og videre i debatten,ja eg kan godt eee ja kor ja e e ha ba ikkje men det kan godt eee fortsett eee ja eee så for det første eee så er eg eg er glad for det som eee no blei gjort då fordi småkrafteigarane som ikkje var inkludert i den grønne sertifikatordninga eee det er fortsatt my uklarhet til korleis eee den vil bli behandla i serefekatmarkedet framover og det skal vi komme tilbake til og vidare i debatten,4671.5,4695.6,24.100000000000364,2014-12-05,2014-12-05_proceedings.txt
Stortinget-20141205-085651_4695600_4724100,men eee men men men jeg grimstad kan ikke helt slippe unna også klimapolitikken og skog eee skog i den sammenheng eee fordi han gikk raskt over til til energi og og de temaene som en føler seg vel med men han må svare på om det er sånn at du re kan risikere at du ikke får noen skogplanting eee med det som frp har vært med å skrive den her i innstillinga fordi det frp har vært med å skrive den her innstillinga vil si at en effektiv blokk eee blokkering for det som du faglig har anbefalt,men eee men men men e grimstad var i er heilt slepp unna også klimapolitikken og skoge skoge i den samanheng eee fordi han eee gjekk raskt over til til energi og og det tema som ein følelse er vel med men ein må svare på om det er sånn at du kan rise tre at du ikkje får noko skogplanting eee med det som frp har vore med å skrive i den her enn innstillinga fordi det frp har vore med og skrive den her innstillinga vil sette ein effektiv blokk eee blokkering for det som du fagleg har anbefalt,4695.6,4724.1,28.5,2014-12-05,2014-12-05_proceedings.txt
Stortinget-20141205-085651_4724100_4751000,når det gjelder eee skog og skogplanting gran tar opp to til tre ganger så mye karbon som det bjørskskogen gjør og hvis du på en måte skal nøy deg med å bare sjå på bjørskskogen på vestlandet og i nordnorge nord for salten så er det ikke så veldig mange områder å plante skog på så hva vil frp gjøre framover for å sikre skogplanting i tråd med faglige råd president som jeg sa så så eee denne regjeringa legger fram e tiltak,når det gjeld eee skog og skogplanting gran tar opp to til tre gong så mye kvar bon som det bjørkskogen gjer og viss du på måte skal nøye med å berre sjå på bjørkeskogen på vestlandet og i nordnoreg no i for salten så er det ikkje veldig mange område å plante skog på så kva vil frp gjere framover for å sikre skogplanting rå med fagleg råd president som eg sa så så eee ha denne regjeringa legg fram e tiltak,4724.1,4751.0,26.899999999999636,2014-12-05,2014-12-05_proceedings.txt
Stortinget-20141205-085651_4751000_4779500,og og skog vil nok bli en av de videre og framover det blei det til del denne gangen men til gjengjeld så satser vi som vi tidligere har sagt når det gjelder regnskog det er ikke det er ikke hinnaland men det er utenlands vi satser i brasil vi satser i indione indonesia og dette er svært viktige satsinger for å ta ned og for å å fange coto det den eee satsinga står vi fortsatt bak da er replikkordskiftet omme og vi går videre på talerlisten,og og skog vil nok bli ein av dei vidare framover det blei ikkje til det til del denne gongen men til gjengjeld så satsar vi som vi tidlegare har sagt når det gjeld regnskog det er ikkje det er ikkje innanlands men det er utanlands vi satsar i brasil vi satsar i indone indonesia og dette svært viktige satsingar for å ta ned og for å å fange seo to det den satsinga står vi fortsatt bak der replikk skifte omme og vi går vidare på taledisten,4751.0,4779.5,28.5,2014-12-05,2014-12-05_proceedings.txt
Stortinget-20141205-085651_4779500_4788700,neste taler er er rigmor andersen eide,neste taler er er rigmor andersen eide,4779.5,4788.7,9.199999999999818,2014-12-05,2014-12-05_proceedings.txt
Stortinget-20141205-085651_4801300_4831000,president fn sin klimarapport har vist oss at klimaendringene ikke skjer i ei fjern framtid det skjer nå så derfor er det behov for å forsterke klima og miljøtiltaka i budsjettet det har vi fått til både gjennom avtalen om finans i finansinnstillinga og gjennom arbeidet i dine komiteen avgiftspolitikken er et veilegna virkemiddel for å endre forbrukeratferd og påvirke folk si holdning,president fn sin klimarapport har vist oss at klimaendringane ikkje skjer i ei fjern framtid det skjer no så derfor er det behov for å forsterke klima og miljøtiltaka i budsjettet det har vi fått til både gjennom avtalen om finans i finansinnstillinga og gjennom arbeidet i denne komiteen avgiftspolitikken er eit veleigna verkemiddel for å endre forbrukarar tvert og påverke folk si haldning,4801.3,4831.0,29.699999999999818,2014-12-05,2014-12-05_proceedings.txt
