file,text_bm,text_nn,start,end,duration,date,proceedingsfile
Stortinget-20140325-095500_6841700_6871300,jeg ser med interesse av merknadene til arbeiderpartiets representanter at de er veldig opptatt av at fremskrittspartiet skrev i barnehagemeldingen stortingsmelding tjuefire tjuetolv tjuetretten jamført innstilling to hundre og åtti s tjuetolv tjuetretten og det er jo ganske så dekkende for hvorfor fremskrittspartiet ikke støtter forslaget om innføring av to barnehageopptak nettopp fordi vi mener som da at to opptak i året ikke er en fullgård løsning slik sett synes jeg det er veldig bra at de har skrevet det sine merknader,eg ser med interesse av merknad til arbeidarpartiets representantar at dei er veldig opptatt av at fremtepartiet skrev i barnehagemeldinga stortingsmelding tjuefire tjuetolv tjuetretten jamført innstilling to hundre og åtti eit tjuetolv tjuetretten og det er jo ganske så tekne for bord for at rentepartiet ikkje støtter forslaget om innføring av to barneopptaknettopp for dei dei menner som det at tvo opptak i år ikkje er ein fullgod løysingslik sett synest eg det er veldig bra at dei har skreve det sine merknader,6841.7,6871.3,29.600000000000364,2014-03-25,2014-03-25_proceedings.txt
Stortinget-20140325-095500_6871300_6901200,ved en slik modell som skisseres fra forslagsstillerne vil barn som fyller ett år rett etter et oppdrag fortsatt måtte vente det nærmere ett og et halvt år før man får plassfremskrittspartiet har alltid ment at den ideelle løsningen ville være løpende og fleksible opptak dette ville ivaretatt alle aldre etter fylte ett år men det er viktig å understreke at det per i dag finnes gode ordninger i flere kommuner som har plass og tar inn barn selv etter fillet år etter første september,ved ein slik modell som siterast frå forslagsstillarane vil barn som fyller eitt år rett etter eit opptak fortsatt måtte vente det nærmare eit og eit halvt år før ein får plassreserpartiet har alltid meint at den ideelle løysinga ville vere løpen og fleksible opptak dette ville vareta at alle aldre etter fylde eitt årmen det er viktig å understreka at det per i dag finst gode ordningar i fleire kommunar som har plass å tar inn barn sjel etter epilator etter første september,6871.3,6901.2,29.899999999999636,2014-03-25,2014-03-25_proceedings.txt
Stortinget-20140325-095500_6901200_6929000,dette fordi de kommunene som har ledig plass ser fordelen med å kunne få inn egenandelen og samtidig hjelpe sine innbyggere derfor er det viktig å innhente mer nøyaktig og treffsikker beregning og analyse av situasjonen for å se hva som skal til for å kunne innføre en mer fleksibel ordning president heller ikke utdanningsforbundet støtter en løsning om to barnehageopptak som forslagsstillerne nå ønsker utdanningsforbundet er enig med regjeringspartiene inkluderer fremskrittspartiet,dette fordi dei kommunar som har ledig plass er fordelen med å kunne få ein eigen andelen og samtidig hjelpe sine innbyggararderfor er det viktig å innhente mer ny aktiv og treffsikker berekning og anna lysa situasjonen for å sjå kva som skal til for å kunne innføre ein med pleksibl oyningpresident hellevik utdanningsforbundet støttar ein løysing om to barnegoptak som forslagsstillarane nå ønskerutdanningsforbondet er einig med regjeringspartia inkluderer fremsepartiat,6901.2,6929.0,27.800000000000182,2014-03-25,2014-03-25_proceedings.txt
Stortinget-20140325-095500_6929000_6958900,under høringen i forbindelse med budsjettbehandlingen i fjor høst kom det tydelig fram fra utdanningsforbundet hva de mente om den rødgrønne regjeringens forslag til gradvis opptrapping til to barnehageopptak la meg sitere noe av hva de skrev i sitt høringssvar til stortinget utdanningsforbundet skjønner intensjonen bak forslaget om en opptrapping til to opptak men mener det kommer for tidlig og at midlene heller må benyttes til tiltak som kan heve kvaliteten for de barna som allerede har plass i barnehagene,under høyringa i forbindelse med budsjettbehandlinga i fjor haust kom det tydeleg fram frå utdanningsforbundet var dei meinte om den raudgrøne regjeringas forslag til gradvis opptrapping til to barneopptakla meg sitere noko av va dei skrev i sitt høyringssvar til stortingetutdanningsforbonnet skjønn i intersjonen bak forslag om ein opptrapping til to opptak men meiner det komme fortidlig og at midden heller må bunye til tiltak som kan heve kvaliteten for dei barna som allereie har plass i barnevagne,6929.0,6958.9,29.899999999999636,2014-03-25,2014-03-25_proceedings.txt
Stortinget-20140325-095500_6958900_6987800,dersom det utviser flere opptak allerede nå uten at det bygges mer midler til kvalitetsfremmende tiltak risikerer vi ytterligere press på kvaliteten i sektoren med et dårligere barnehagetilbud som resultat utvidet rett til barnehageplass vil også gi et ytterligere press på den generelle bemanningen i barnehagene tallet på dispensasjoner fra kravet om godkjent barnehagelærerutdanning for styrer og pedagogisk leder har stabilisert seg på et overkant av fire tusen ansatteet historisk høyt nivå,dersom det utviser fleire opptak av red nå utan at det byggast meir midlerti kvalitetsfreme tiltak risikerer vi ytterlegare press på kvaliteten i sektoren med dårlege barnetilbod som resultatutviette barna jo plass vi også gitt yttelarepress på den generelle bemanninga i barnehagane talet på dispensasjonen frå kravet om godkjent barnehagelæreutdanning for styrre pedagogiske der har stabilisert seg på eit åvrkant av fire tusen ansatteer til historisk høgt nivå,6958.9,6987.8,28.900000000000546,2014-03-25,2014-03-25_proceedings.txt
Stortinget-20140325-095500_6987800_7015800,for å redusere antall dispensasjoner må det satses på kompetanseheving blant barnehageansatte det må rekrutteres flere til barnehagelærerutdanningen og allerede utdanne barnehagelærere må rekrutteres tilbake til barnehagene sitat slutt president stort klarere kan det ikke sies derfor har også denne regjeringen tatt dette på alvor i sitt budsjett vi prioriterer nettopp det utdanningsforbundet med flere mener er viktig,for å redusere antal dispensasjonar må det satsast på kompetanseheving blant barnehagar ansatte det må rekruttere fleire til barnehagelærutdanninga og rede utan barnehagelærar må rekrutterast tilbake i barnehagene sitat sluttpresident stor klare kan det like siesderfor har også denne regjeringa tatt dette på alvor i sitt budsjett vi prioriterer nettopp det utgangsforbondet med fleire meiner er viktig,6987.8,7015.8,28.0,2014-03-25,2014-03-25_proceedings.txt
Stortinget-20140325-095500_7015800_7043300,kvalitet nå før kvantitet som bare vil risikere å ramme de mest sårbare i vårt samfunn nemlig barna høyrefrpregjeringen styrket derfor budsjettet med hensyn til økt kompetanse til ansatte det er de ansatte som er den viktigste ressursen for denne regjeringen er det det men kanskje ikke for opposisjonenpresident jeg er enig i at det kan føles urimelig at det fortsatt vil kunne være barn som ikke får dagens modell,kvalitet nå før kvantitet som bere vil risikere å ramme dei mest sårbare i vårt samfunnnemleg barnahøgre og frpregjeringa styrker derfor budsjettet med hensyn til å ak kompetanse til ansatte der dei ansatte som den viktigaste ressursenfor denne regjeringa er det det men kanskje ikkje får oposisjonenpresident ja er einig i at de kan følgjast urimeleg at det fortsatt vil kunne vere barn som ikke få pd dagens modell,7015.8,7043.3,27.5,2014-03-25,2014-03-25_proceedings.txt
Stortinget-20140325-095500_7043300_7069100,men jeg kan love at jeg vil jobbe for et mer rettferdssystem som har et høyere fleksibilitet og ikke låser opp til to dator i året denne regjeringen er opptatt av at vi skal ha gode kvalitative tjenester derfor prioriterer vi det først det er faktisk barna vi snakker om de mest sårbare denne regjeringen har ikke i stand så forslaget når vi skal gå og så på de grader bekostning og barna,men eg kan love at ja vil jobbe for eit meir fell system som har høgre og fleksibilitet og ikkje låser opp til to dator i åredenne regjeringa er opptatt av at vi skal ha gode kvalitative tenester derfor prioriterer vi det først det er faktisk barna vi snakkar om det mest sårbaredenne regjeringa har ikkje sånn som forslaget når vi skal gå oss opp på dei grader bekostning og barna,7043.3,7069.1,25.800000000000182,2014-03-25,2014-03-25_proceedings.txt
Stortinget-20140325-095500_7069100_7091300,og vi setter på en måte de ansatte en enda sterke press og vi overlater våre minste med sårbare til noe som utenlandsformuen er sterkt kritiske til vi er opptatt av trygghet derfor sitter vi barna førstdet blir replikkordskifte første replikant er arild grande,og vi set måte dei ansatte er enda sekker press og vi overlater våre minste med sårbare til noko som utanfor er sterkt kritiske tilvi er opptatt av trygghet derfor set vi barna førsttil bin replikkordskifte første republikant ail grande,7069.1,7091.3,22.199999999999818,2014-03-25,2014-03-25_proceedings.txt
Stortinget-20140325-095500_7098200_7119200,ærede president det kan være mange i denne sal og i landet for øvrig som inner stinne ønsker seg løpende opptak eee og skal man noen gang nå det målet så er det jo ganske avgjørende hvis man sammenligner med å bestige et fjell om man går opp eller om man går ned viå opptrappingen,eee president det kan vere mange i denne sal og i landet for øvrig som eee innerst inne ønsker seg øpne opptak eee og skal ein nokon gong nå det målet så er det jo ganske avgjerande viss ein er saman inne med å bestige eit fjell om ein går opp eller om ein går ned viå opptrappinga,7098.2,7119.2,21.0,2014-03-25,2014-03-25_proceedings.txt
Stortinget-20140325-095500_7119200_7148200,og vi var helt ærlig på at første steg i forhold til løpende opptak vil være å få på plass to årlige opptak derfor la vi inn to hundre og førtito millioner kroner i statsbudsjettforslaget for totusenogfjorten for å starte stigningen eee i riktig retning men fremskrittspartiet og høyre trakk tilbake de pengene og begynte heller nedstigningen fremskrittspartiets medlemmer karakteriserte våre ambisjoner eee i da vi diskuterte i stortinget eee barnehagemeldingen i juni i fjor,og vi var heilt ærleg på at første steget for til løpende opptak vil vere å forla to årlege opptak derfor la vi inn to hundre og førtito millionar kroner i statsbudsjettforslaget for totusenogfjorten for å starte stigninga eee i riktig retning men framstegspartiet og høgre tre tilbake dei pengane og begynte eller nedstigninga framstegspartiets medlemmer karakterisert vore ambisjonar eee i det vi diskuterte i stortinget eee barnehagemeldinga i juni i fjor,7119.2,7148.2,29.0,2014-03-25,2014-03-25_proceedings.txt
Stortinget-20140325-095500_7148200_7176600,eee at våre ambisjoner var altfor passive hvordan vil morten stordalen karakterisere regjeringens politikk i så måte når vi veit at regjeringa trakk tilbake første steg i den retningen som han sjøl sier at fremskrittspartiet er så opptatt av president eee hvis man snakker om denne regjeringens ambisjonen så synes jeg den er veldig bra den tar faktisk inn over seg at man driver rovdrift på ansatte i barnehagene,eee at våre ambisjonar var altfor passiv korleis ville mårten storda kvaratisere regjeringas politikk i så måte når vi veit at regjeringa har trekt tilbake første steg i den retninga som han sjøl sei a framstegspartiet er så opptatt av president eee viss ein snakkar om denne regs ambisjon så synest eg den er veldig bra den tar faktisk inn over seg at ein eee driver overdrift på ansatte i barneagne,7148.2,7176.6,28.400000000000546,2014-03-25,2014-03-25_proceedings.txt
Stortinget-20140325-095500_7176600_7206600,tidenes høyeste ipa dispensasjoner i forhold til ufaglærte eee denne regjeringen vil ikke sette barna i risiko med å kjøre på ytterligere nå derfor så er kvalitet viktig eee og representanten grande tar til orde for eee denne oppbyggingen ja det var et budsjett som jeg sa som faktisk man ikke skulle styre etter eee vi forholder oss til en virkelig verden at vi ønsker faktisk kvalitet først å sikre de barna som har plass så skal vi jobbe for en mer løpende fleksible opptak,tidenes høyeste sit dispensasjonar på al til ufaglærte eee denne regjeringa vil ikkje sette barna i risiko med å køyre på ytter og derfor så er koket viktig eee og representanten grandø tar til gode for denne oppbygninga ja det vare eit budsjett med sag som faktisk ein ikkje skulle styre til eee vi forholder oss til den nytelige verden at vi ønsker faktisk paritet først å sikre dei barna som har pass så skal vi jobbe for å me løpande prisipig opptak,7176.6,7206.6,30.0,2014-03-25,2014-03-25_proceedings.txt
Stortinget-20140325-095500_7206600_7224400,og som representanten grande sier ja fremskrittspartiet var imot to opptak derfor om meldinga for at fremskrittspartiet mente vi ville ha et løpende og fleksibelt opptakgjenyfølging,og som representanten grande seier ja renteparkie var imot to opptak derfor det om meldinga fordi at relsepartiet meinte ville hatt løpan presibelt opptakjennyfølging etarar,7206.6,7224.4,17.799999999999272,2014-03-25,2014-03-25_proceedings.txt
Stortinget-20140325-095500_7229200_7254600,president da kan virke som representant stordalen meiner at utbygging av full kapasitet har gått på bekostning av kvaliteten i barnehagene og jeg har sjekka jeg har sjekka med undersøkelser som både kommuneforlaget og difi har gjennomført og derfor finnes det ingen indikasjoner på at kvaliteten er redusert hva bygger frp og stordalen sine,det kan verke som representant stordalen meiner at utbygging av full kapasitet har gått på bekostning av kvaliteten i barnehagane eg har sjekka eg har sjekka med undersøkelser som både kommuneforlaget og difor har gjennomført og derfor finst ingen indikasjonar på at kvaliteten er redusert kva byggjer frp og stordalen sine,7229.2,7254.6,25.400000000000546,2014-03-25,2014-03-25_proceedings.txt
Stortinget-20140325-095500_7254600_7275000,eee antakelser på president den bygger jeg på utdanningsforbundets høringsuttalelse til stortinget som er åpen for alle her i fjor høst eee og jeg regner med det at eee representanten også er opptatt av hva de sier det er en veldig offentlig høring og det er den man bygger på hvor de,eee antakelser på president den bygger på utdanningsforbundets høringsuttalelse til stortinget som er open for over her i fjor haust eee og eg reknar med det at representanten også er opptatt av va dei seier det er ein veldig offentleg høyring og det er den ein bygger på og de,7254.6,7275.0,20.399999999999636,2014-03-25,2014-03-25_proceedings.txt
Stortinget-20140325-095500_7275000_7289700,eee høyt nivå hvor man eee stabiliserte seg på overkant fire tusen ansatte som har dispensert for hold til utdanning og det velger jeg å tro de på og det synes jeg også representanten bør velge å tro på,eee høgt nivå er ein eee stabiliserer seg på ok av fil tusen ansatte som har dispansert frå til utdanningog det er velger å tro det på og det eg synest eg også representanten bør velje å tru på,7275.0,7289.7,14.699999999999818,2014-03-25,2014-03-25_proceedings.txt
Stortinget-20140325-095500_7293300_7320100,ja president jeg må si jeg overraske over morten stordal representanten morten storlands betegnelse på barnehager i norge i dag det drives rovdrift på de ansatte sier representanten stordal og jeg regner med at utdanningsministeren kommer til å si noe om det for hvis vi driver rovdrift på de ansatte så er det faktisk ganske alvorlig og da regner jeg med at utdanningsministeren kommer med noen kraftfulle signaler skal reduseres,ja president eg må seg overraske over morten storla representanten morten storlands betennelse på barnehagar i noreg i dag det drivst rovdrift både i ansatte seier representanten storhaug og eg reknar med at utdanningsministeren kommer til å seie om det for viss vi driv rovdrift på dei ansatte så er det faktisk ganske alvorleg og det reiknar med at utdanningsministeren kommer med nokon kraftfulle signalar skal reduseres,7293.3,7320.1,26.800000000000182,2014-03-25,2014-03-25_proceedings.txt
Stortinget-20140325-095500_7320100_7346900,president i vår regjeringstid så økte vi tilskuddet til kompetanse i barnehagene med nesten hundre og femti millioner kroner bare førti millioner det siste året så har altså fremskrittspartiregjeringa lagt fram eee eee eee et tilskudd på ti millioner kroner ekstra når vi ser det at man samtidig kutter med sju hundre millioner kroner så er det en økninga på kompetanse en av det her,president i vår regjeringstid så økte vi tilskottet av kompetanse i barnehagane med nesten hundre og femti millionar kroner berre førti millionar det siste året så har altså fremskrittspartiregjeringa lagt fram eee eit tilskot på ti millionar kroner ekstra når vi ser det at ein samtidig kutter med sju hundre millionar kroner så er det ein økninga på kompetanse eint av det her,7320.1,7346.9,26.799999999999272,2014-03-25,2014-03-25_proceedings.txt
Stortinget-20140325-095500_7346900_7374900,er representanten stordalen fornøyd med satsinga president eee når jeg tar ordet avdrift i munnen så er det i forhold til det forslaget som nå ligger hvis man skal gjøre som med forslagsstillerne og arbeiderpartiet da ønsker å øke til to opptak noe som utenlandsforbundet sterkt fraråder så vil jeg påstå at da går det på grensen mot det som man kan kalles rovdrift siden man allerede i dag driver på grensen,er representanten stordom fornøgd med satsingatordan president eee når eee eg tar ordet rovdrift i munn så er det i forhold til det forslaget som nå ligg viss ein skal gjere som forslagsstillarane og arbeidarpartiet då ønsker å auka til to opptak eee noko som utdansforbundet sterk fraråder så vil eg påstå at da går det på grensen mot det som ein kan kaas gravdrift timane reie i dag driv på grensene,7346.9,7374.9,28.0,2014-03-25,2014-03-25_proceedings.txt
Stortinget-20140325-095500_7374900_7399900,eee og i forhold til kvalitetsheving så kan jeg jo si det president at eee ja eee nå skal jeg huske på at de talla som re eee representanten rigmor aasrud legger fram det er forholdet til sin opptrappingsplan fra den forrige regjeringen eee når denne regjeringen ikke tar opptrappingsplan til to opptak men fortsatt øker i tillegg til den forrige regjeringen på kvalitet og kompetanse ja så er jeg fornøyd med regjeringens politikk,eee og i forde til kvalitetsheving så kan eg seie det president at eee ja eee nå skal eg spare dei tava som re eee representanten her ringmur aasrud legg fram det er forhold til sin opptrappingsplan frå den førre egjeringa eee når denne regjeringa ikkje tar opptrappingsplanen for to opptak men fortsatt auke i tillegg til den førre regjeringa på katt kompetanse ja så er eg fornøgd med regjeringas politikk,7374.9,7399.9,25.0,2014-03-25,2014-03-25_proceedings.txt
Stortinget-20140325-095500_7399900_7409600,da går vi tilbake til talerlista ved jørgen bekkevold deretter igjen i følging,nå går vi tilbake til talarlista ved gyrgen bekkevold deretter jenny følling har,7399.9,7409.6,9.700000000000728,2014-03-25,2014-03-25_proceedings.txt
Stortinget-20140325-095500_7414300_7440100,gode president et godt barnehagetilbud det er viktig eee både i form av at det er et tilbud somalle som ønsker det skal kunne få en barneplass at det er nok bemannet og at det er god pedagogisk kvalitet og innhold i barnehagene og,gode president eit godt barnehagetilbod det er viktig eee både i form av at det er eit tilbod som alle som ønsker det skal kunne få ein barneplass at det er nok bemannet og at det er god pedagogisk kvalitet og innhald i barnehageneog,7414.3,7440.1,25.800000000000182,2014-03-25,2014-03-25_proceedings.txt
Stortinget-20140325-095500_7440100_7468800,vi ønsker egentlig eee denne debatten svært velkommen og vil takke sv for å ha satt fokus på dette eee jeg håper virkelig ikke at barnehagepolitikken drukner eee i det sterke fokuset som regjeringen eee ønsker å ha på skole eee det er viktig fokus men hvis det går på bekostning av barnehagen og og det pedagogiske og gode kvalitetsinnholdet i barnehagen,vi ønsker eigentleg eee denne debatten svært velkommen og vil takke sv for å ha satt fokus på detteeeeja håper verkeleg ikkje at barnehavepolitikken drukner eee i eee det sterke fokuset som regjeringa eee ønsker å ha på skole eee det er viktig fokus men viss det går på på kostning av barnehagen og og det pedagogiske og gode kvalitetsinnholdet i barnehagen,7440.1,7468.8,28.699999999999818,2014-03-25,2014-03-25_proceedings.txt
Stortinget-20140325-095500_7468800_7496200,eee da bommer vi så jeg håper at kunnskapsministeren også vil ta med seg et sterkt fokus på dette feltet eee og når det snakkes om eee kompetanseheving blant lærere så eee håper jeg at kunnskapsministeren også har de ansatte i barnehagene eee i eee i tankene for der kre t trengs det ogsåompetanseheving,eee de bommer viså eg håpar jo at kunnskapsministeren også vil ta med seg eit sterkt fokus på dette feltet eee og når det snakkast om eee kompetanseheving blant lærarar så eee håpar eg at kunnskapsministeren også har dei ansatte i barnehagene eee i eee i tankene for der kre trengs då ogsåkompetanseheving,7468.8,7496.2,27.399999999999636,2014-03-25,2014-03-25_proceedings.txt
Stortinget-20140325-095500_7496200_7524900,i tillegg til mer fleksibilitet i opptakene er kvalitet og bemanning viktige stikkord i debatten rundt barnehagene og regjeringen har uttrykt at de nå ønsker å satse på en heving av kvalitet i barnehagene eee barnehagene skal være mer enn et oppbevaringssted og da trengs det en styrking av kompetansen i barnehagene men også en satsing på bemanning slik at de ansatte har tid til å være eee med barna,i tillegg til meir fleksibilitet til opptakne er kvalitet og bemanning viktig stikkord i debatten rundt barnehagene og regjeringa har uttrykt at dei no ønsker å satse på ein heving av kvalitetebarneagene eee barnehagen skal vere meir enn eit oppvaringssted og da trengs det ein styrking av kompetansen i barnehagenemen også ein satsing på bemanning slik at dei ansatte har tid til å vere eee med barna,7496.2,7524.9,28.699999999999818,2014-03-25,2014-03-25_proceedings.txt
Stortinget-20140325-095500_7524900_7553800,barnehagen er en viktig arena for eee barn når det gjelder utvikling få relasjonskompetanse og få et godt grunnlag før de starter på skolenog vi merker oss at regjeringspartiene uttaler at dette er et satsingspunkt for regjeringen og det håper jeg vi kan se bli fulgt opp for eee kristelig folkeparti så er fleksibilitet og valgfrihet viktig stikkord eee for,barnehagen er ein viktig arena for eee barn når det gjeld utvikling få relasjonskompetanse og få eit godt grunnlag før dei startar på skolenog vi merker jo oss at regjeringspartia uttaler at dette er eit satsingspunkt for regjeringa og det håpar eg vi kan se blir fylgt oppfor eee kristeleg folkeparti så er fleksibilitet og valgfrihet viktig stikkord eee for,7524.9,7553.8,28.900000000000546,2014-03-25,2014-03-25_proceedings.txt
Stortinget-20140325-095500_7553800_7581300,en og et av de viktigste virkemidlene for dette er nettopp barnehagenedagens ordning fører til at familier nå må planlegge livet ut fra om barna er født før eller etter første septemberdette er svært uheldig og fører til mye unødig stress og bekymring for småbarnsfamilieneto opptak,familiepolitikken og eit av dei viktigaste verkemiddela for dette er nettopp barnehagenedagens ordning fører til at familiar nå må planlegge livet ut frå om barnet har født før eller etter første septemberdette er svart uheldig og fører til mykje unødig stress og bekymring for småbarnsfamilianeto opptak,7553.8,7581.3,27.5,2014-03-25,2014-03-25_proceedings.txt
Stortinget-20140325-095500_7581300_7608400,ville ikke løst dette problemetdet ville bare ha gitt familiene eee to datoer og føde før slik at barnehageplassen da er sikkerhetkrf ønsker ikke å nøye oss med to opptak men vil at alle barn over ett år skal ha rett på plass i barnehage uavhengig når de er fø,vi le ikkje løst dette problemetdet ville berre ha gitt familiane eee to dato og føde før slik at barnehovuplassen da er sikkerheitkrf ønsker ikkje å nøye oss med to opptak men vil at alle barn over eitt år skal ha rett på plass i barnehage uavhengig då dei er fø,7581.3,7608.4,27.099999999999454,2014-03-25,2014-03-25_proceedings.txt
Stortinget-20140325-095500_7608400_7625100,dette gir reell fleksibilitet til familiene og vil føre til at de ikke trenger å planlegge fødsel men derimot får muligheten til å planlegge familiens hverdag etter at barna er ett år uten bekymring,dette gir reell fleksibilitet til familiane og vil føre til at dei ikkje treng å planlegge fødsel men derimot få muligheten til å planlegge familiens kvardag etter at barnet er eitt år utan bekymring,7608.4,7625.1,16.700000000000728,2014-03-25,2014-03-25_proceedings.txt
