file,text_bm,text_nn,start,end,duration,date,proceedingsfile
Stortinget-20141205-085651_7923700_7949600,og bør snarest skaffe seg flere bein å stå på enn olje fordi selv ikke fremskrittspartiet ser jo bort fra det faktum at i løpet av ikke altfor mange tiår så vil finnmark måtte det eee og vi ønsker finnmark en eee god forberedelse på den situasjonen miljøpartiet de grønne er ikke mot gruvedrift eee verken i finnmark eller i norge men vi er mot gruvedrift som er eee miljømessig uforsvarlig,og bør snarast skaffe seg fleire bein å stå på enn olje fordi ser like framstegspartiet seier jo bort frå det faktum at i løpet av ikkje altfor mange tiår så vil finnmark måtte det eee og vi ønsker finnmark ein god forberedelse på den situasjonen miljøpartiet grunn er ikkje mot gruvedrift eee verken i finnmark eller i noreg men vi er imot gruvedrift som er eee miljømessig uforsvarleg,7923.7,7949.6,25.900000000000546,2014-12-05,2014-12-05_proceedings.txt
Stortinget-20141205-085651_7949600_7976400,eee og det gjelder da altså for eksempel eee gruvedriften i repparfjord og vi skulle tro at miljøpartnei at eee fremskrittspartiet også er mot uforsvarlig eee gruvedrift når det gjelder kull på sålbard så er vi jo for det første i den situasjonen hvor eee det selskapet ser ut til å forsvinne av seg selv og hvis eee fremskrittspartiet tror at det er slutten for norsk eksistens på edet trist,eee og det gjeld da altså for eksempel eee gruvedrifta i repparfjord og vi skulle tru at miljøparti at framstegspartiet også er mot uforsvarleg eee gruvedrift når det gjeld kull på såvar så har vi jo i førtiførste i den situasjonen vår det selskapet ser ut til å forsvinaavseg sel og viss eee fremstegspartiet trur at det er slutten for norsk eksistens på edet trist,7949.6,7976.4,26.799999999999272,2014-12-05,2014-12-05_proceedings.txt
Stortinget-20141205-085651_7976400_7988700,miljøpartiet de grønne er overbevist om at svalbard har mange andre gode bein å stå på som ikke vil rokke det minste med norsk suverenitet neste replikant er representanten terje aasland deretter rigmor andersen eide,miljøpartiet grene er overvis om at svaberg har mange andre gode bein å stå på som ikkje vil rokke det minste med norsk syrinlitet neste replikant er representanten terje aasland deretter rigmor anusen eide,7976.4,7988.7,12.300000000000182,2014-12-05,2014-12-05_proceedings.txt
Stortinget-20141205-085651_7998800_8027400,aasland vær så god takk for det president selv om miljøpartiet de grønne på mange områder går eee skal vi si langt lengre enn arbeiderpartiet så har jeg lyst til å understreke til representanten rasmus hansson at jeg synes vi har hatt mange interessante samtaler i løpet av høsten og jeg syns også i det statsbudsjettet vi nå behandler har mange interessante fellestrekk eee knytta til blant annet forslag vi er jo sammen om hele elleve forslag eee og det synes jeg er bra,aasland ver så godtakk for det president sjøl om miljøpartiet dei grøne på mange område går eee skulle se langt lengre enn arbeidarpartiet så eg lyst til å understreke til representanten rasmus hansen at det synest vi har hatt mange interessante samtalar i løpet av hausten og eg synest også i det statsbudsjettet vi nå behandlar har mange interessante fellistrekk eee knytta til blant anna forslag vi er jo saman om heile elleve forslag eee og det synest eg er eee bra,7998.8,8027.4,28.599999999999454,2014-12-05,2014-12-05_proceedings.txt
Stortinget-20141205-085651_8027400_8051800,eee og jeg synes det er viktig at vi klarer å samle oss om viktige ting for eee tida framover eee så er jeg et eee spørsmål president om ikke det kunne vært litt fristende også for eee miljøpartiet de grønne å støtte ytterligere to forslag som er fremma det ene går på det her med kompetansen i den oljerelaterte delen av norsk næringsliv hvordan den kan brukes og hvordan den kan brukes på andre sektorer,eee g eg syns det er viktig at vi klarer å samle oss om viktige ting for eee tida framover eee så er eit spørsmål president om ikkje det kunne vore litt frist me også for miljøpartiet de grønne å støtte i ytterlegare to forslag som har fremma det eine går på det her med kompetansen i den årlegrelaterte delen av norsk næringsliv korleis den kan brukast eee og vorlande kan brukast på andre sektorar,8027.4,8051.8,24.400000000000546,2014-12-05,2014-12-05_proceedings.txt
Stortinget-20141205-085651_8051800_8071200,eee jeg vil utfordre eee representanten på det og eee det siste forslaget er forholdet til karbonfangst og lagring hvor vi trur at norge kan spille en vesentlig rolle ved å få opp et fullskala anlegg også i norge eee og jeg ville tru at det kunne også være innafor interessefeltet til miljøpartiet de grønne president vær så god,eee eg vil utfordre eee representanten på det og det siste forslaget er forhold til kvar bom fangst og lagring vore vi trur at noreg kan spele ein vesentleg rolle ved å få opp eit fullskala anlegg også i noreg eee og eg ville tru at det kunne også vere innanfor interessefeltet til miljøpartiet dei grøne president ver så god,8051.8,8071.2,19.399999999999636,2014-12-05,2014-12-05_proceedings.txt
Stortinget-20141205-085651_8071200_8100200,eee president eee for det første understreke at eee vi har også satt pris på både de signalene og de samtalene som er kommet fra eee arbeiderpartiet og vi ser fram til å videreutvikle eee det og utfordre arbeiderpartiet på å levere på mye av den interessante tenkinga som kommer samtidig som vi fortsatt gjerne vil samarbeide med høyre og fremskrittspartiet om en enda bedre miljøpolitikk som de jo jevnlig lover at de kan levere når det gjelder de to utfordringene fra eee representanten aasland eee,eee president for det første understreke at eee vi har også sett pris på både dei signalen og dei samtalane som er komme frå eee arbeidarpartiet og vi ser fram til å vidareutvikle eee det å utfordre arbeidarpartiet på å levere på mykje av den interessante tenkinga som kommer samtidig som vi fortsatt gjerne vil samarbeide med høgre og framstegspartiet om eee ein enda betre miljøpolitikk som dei jo jevnleg lover at vi kan levere når det gjeld dei to utfordringane frå representanten aasland eee,8071.2,8100.2,29.0,2014-12-05,2014-12-05_proceedings.txt
Stortinget-20141205-085651_8100200_8129400,eee så vil jeg for det første si at forslaget om å utnytte kompetansen i olje er et eee er et forslag som vi kanskje ikke har sett godt nok på og som jeg absolutt ser poenget med og som vi skal tenke nøye over om vi eee vil være med på når det gjelder karbonfangst og lagring så tillater ikke de resterende fjorten sekundene å svare nok på det men det er jo altså et felt hvor vi erkjenner teknologiens nødvendighet men vi er ikke enig i,eee så vil eg for det første seie at forslaget om å utnytte kompetansen i orre er eit eee er et forslag som vi kanskje ikkje har sett opp nok på og som eg absolutt ser poenget med og som vi skal tenke nøye over om vi eee vil vere med på når det gjeld kabonfangst og lagring så tillate ikkje de resterande fjorten sekunda å svare nok på det men det er jo altså eit felt vor vi erkjenner teknologiens nødvendigheit men vi er ikkje einige i,8100.2,8129.4,29.199999999999818,2014-12-05,2014-12-05_proceedings.txt
Stortinget-20141205-085651_8129400_8144100,at norge kan og skal være en pådriver for denne teknologien for vi mener dessverre at mongstadprosjektets havari tok eee grunnlaget vekk fra den argumentasjonen replikant er representanten rigmor,at noreg kom og skal vere ein pådrivar for denne teknologien for vi meiner dessverre at mantprosjektets havari tok eee grunnlaget vekk frå den arguxplikant er representanten rigmor,8129.4,8144.1,14.700000000000728,2014-12-05,2014-12-05_proceedings.txt
Stortinget-20141205-085651_8147100_8175600,eide vær så god ja president det er interessant å lese gjennom det grønneste alternative budsjett med omprioriteringer som gjør at en har enorme summer og fordeler det gjør samtidig at det nesten blir mest interessant å se hva partiet ikke velger å gi økte bevilgninger på en slik post i posten som går til friluftsformål der leser vi det uvanlige tallet null i økning fra de grønne,ver så god ja president det er interessant å lese igjennom det grønaste alternative budsjett med omprioriteringar som gjer at ein har enorme summar og fordeler det gjer samtidig at det nesten blir mest interessant å se kva partiet ikkje velger å gje økte bevilgninga på ein slik past til posten som går til frilutformål der leser vi det uvanlege talet nul i aking frå dei grøne,8147.1,8175.6,28.5,2014-12-05,2014-12-05_proceedings.txt
Stortinget-20141205-085651_8175600_8200700,krf har i budsjettavtalen fått gjennomslag for å styrke denne posten med ti million midlene skal gå til friluftslivets år skjærgårdstjenesten tilrettelegging for funksjonshemma i friluftsområder og driftsstøtte til friluftsorganisasjoner og da er undringa og spørsmålet mitt hva er grunnen til at de grønne velger å ikke prioritere dette viktige arbeidet rasmus hansson vær så god,krf har i budsjettavtalen fått gjennomslag for å styrke denne posten med ti million midlane skal gå til friluftslivets år skjærgårdstjenesten tilrettelegging for funksjon same i friluftsområdet og driftsstøtte til friluftsorganisasjonar og då er undringa av spørsmålet mitt kva er grunnen til at dei grøne velger å ikkje prioritere i dette viktige arbeidet kespeare ver så god,8175.6,8200.7,25.100000000000364,2014-12-05,2014-12-05_proceedings.txt
Stortinget-20141205-085651_8200700_8229100,eee president eee jeg starte med å si ett poeng til eee kristelig folkeparti flott at dere har klart å øke den posten eee og det tar seg ikke like flott ut at vi ikke har eee et like høyt tall i vårt budsjett eee så her har vi en utfordring vi skal ta med oss så vil jeg understreke at helheten i miljøpartiet de grønnes budsje eee budsjett jo er et budsjett for å både ta vare på norsk natur fri norsk natur,eee president eee jo starte med å si eitt poeng til eee kristeleg folkeparti flott at dette har klart å auke den posten eee og det tar sekk like flott ut at vi ikkje har eee eit like høgt tal i vårt budsjett eee så her har vi ein utfordring vi skal ta med oss så vil eg understreke at helheten i miljøpartiet de grønne budsje budsjett jo er eit budsjett for å både ta vare på norsk natur fri norsk natur,8200.7,8229.1,28.399999999999636,2014-12-05,2014-12-05_proceedings.txt
Stortinget-20141205-085651_8229100_8250100,nettopp av hensyn til folks bruk og friluftsliv eee det er viktigere enn å betale friluftslivet selv og vi har et budsjett som peker i retning av et samfunn hvor folk har mer tid eee på bekostning av materielt forbruk tid som ikke minst skal kunne brøkes til friluftsliv i den norskptatt av å betale,nettopp av hensyn til folks bruk og friluftsliv eee det er viktigare enn å betale frilufsliv sel og vi har eit budsjett som peikar i retninga eit samfunn der folk har meir tid eee på bekostning av materielt forbruk tid som ikkje minst skal kunne brukast til friluftsliv i den norsptatte av å tale,8229.1,8250.1,21.0,2014-12-05,2014-12-05_proceedings.txt
Stortinget-20141205-085651_8250100_8275200,eee og det kan også være vel så viktig som å bevilge midler direkte til friluftslivet men jeg anerkjenner at det er flott at kristelig folkeparti har fått presset fram eee en økning på denne postenda er tiden for replikkordskifte omme og vi går tilbake til den ordinære talerlista og neste taler er representa er statsråd tord lien statsråd lien vær så god,eee og det kan også vere vel så viktig som å bevilge meir direkte til prylesivet men eg anerkjenner at det er flott at kristeleg folkeparti har fått presset fram eee ein økning på denne postededa har tiden for replikkordskiftet omme går tilbake til den ordinære talarlista og neste talar er representanter statsråd tord lien statsråd lien ver så god,8250.1,8275.2,25.100000000000364,2014-12-05,2014-12-05_proceedings.txt
Stortinget-20141205-085651_8275200_8298100,president eee takk for det og la meg først begynne med å si takk til komiteen for godt arbeid og ikke minst eee takk til regjeringspartiene og til samarbeidspartiene for at vi ikke bare har fått et budsjett men at vi også har fått et godt budsjett eee på eee for energipolitikken eee for totusenogfemten,president eee takk for det og la meg først begynne med å seie takk til komiteen eee for godt arbeid og ikkje minst eee takk til regjeringspartia og til samarbeidspartia for at vi ikkje berre har fått eit budsjett men at vi også har fått eit godt budsjett eee på eee for energipolitikken eee for totusenogfemten,8275.2,8298.1,22.899999999999636,2014-12-05,2014-12-05_proceedings.txt
Stortinget-20141205-085651_8298100_8323600,produksjonen av olje og gass er norges største næring målt eee i verdiskapning målt i inntekter til statskassa og målt i eksportverdi det er også norges aller viktigste distriktsnæringinntekta fra denne virksomheta gir staten stort økonomisk handlingsrom å finansiere den norske velferdsstaten,produksjon av olje og gass er noregs største næring målt eee i verdiskaping målt i inntekter til statskassa og målt i eksportverdi det er også noregs aller viktigaste distriktsnæring inntekta frå denne anviksomheta gjer staten stort økonomisk handlingsrom og finansiere den norske velferdslova,8298.1,8323.6,25.5,2014-12-05,2014-12-05_proceedings.txt
Stortinget-20141205-085651_8323600_8349900,det synes jeg vi skal minne hver annet er om eee når vi i disse dager behandla det heile eee heile det norske statsbudsjettet for tjuefemten her i stortinget det er det er sånn og det vil forbli sånn at verdiene må skapes før de kan fordeles til eee vårt alles beste men næringa dent,det synest eg vi skal min kvar wandel om når vi i desse dagar behandla det heile eee heile det norske statsbudsjettet for tjuefemten hel i stortinget det er det er så og det vil for bli sånn at eee verdiane må skapast før dei kan fordelast til vårt alles beste men næringa denre,8323.6,8349.9,26.299999999999272,2014-12-05,2014-12-05_proceedings.txt
Stortinget-20141205-085651_8349900_8379600,psyklisk og den vil forbli psykisk vi har nå bak oss en periode hvor det har vært tilnærma permanent eee vekst fra år til år i investeringen vi står i et eee historisk toppnivå hva investeringer på norsk sokkel angår eee og både tretten fjorten og femten kommer til å gå inn i historien som blant de aller eee de årene med aller høyest investeringsnivå,psykisk og den vil for bli psykiskvi har nu bak oss ein periode kor det har vore tilnærma permanente vekst frå år til år i investeringa vi står vi eit historisk toppnivå kva investeringar på norsk sokkel angvar eee og både tretten fjorten og femten kommer til å gå inn i historia som blant dei aller eee dei åra med aller høyeste investeringsnivå,8349.9,8379.6,29.700000000000728,2014-12-05,2014-12-05_proceedings.txt
Stortinget-20141205-085651_8379600_8405900,samtidig så ser vi at denne veksten er i ferd med å flate ut det er allikevel sånn at det er et eee betydelig potensial for fortsatt verdiskapning på norsk sokkel og anslagene fra myndighetene sin side er at mer enn halvparten av ressursene p,samtidig så ser vi at denne veksten er i ferd med å flate ut det er allikevel sånn at det er eit eee betydeleg potensial for fortsatt verdiskaping på norsk sokker og anslaga frå myndigheitene si side er at meir enn halvparten av ressursane p,8379.6,8405.9,26.299999999999272,2014-12-05,2014-12-05_proceedings.txt
Stortinget-20141205-085651_8405900_8432700,derfor er det viktig at vi sikrer at vi får mest mulig ut av de feltene som er i produksjon vi må forstå ressursene på norsk sokkel godt og vi må sikre god ressursforvaltning for og å ivareta nasjonale interesser dette har regjeringa prioritert i budsjettet for tjuefemten og jeg er glad for at det aller meste har fått støtte fra stortinget så eee,derfor er det viktig at vi sikrar at vi får mest mulig ut av dei felta som er i produksjon vi må forstå ressursane på norsk sokkel godt og vi må sikre god ressursforvaltning for og å ivareta nasjonale interesserdette har regjeringa prioritert i budsjettet for tjuefemten og eg er glad for at det aller meste har fått støtte frå stortinget så,8405.9,8432.7,26.80000000000109,2014-12-05,2014-12-05_proceedings.txt
Stortinget-20141205-085651_8432700_8456900,samtidig som vi må ivareta eee hensynet til de store verdiene så må vi også ivareta hensynet til klima helse miljø og sikkerhet så tror jeg at for aktivitetsnivået i årene foran oss så er det viktig at det store prosjektet vi i fellesskap skal behandle neste år johan werdup går på tid så,samtidig som vi må ivareta eee hensynet til dei store verdiane så må vi også ivareta hensynet til klima helse miljø og sikkerheit så trur deg at for aktivitetsnivået i åra foran oss så er det viktig at det store prosjektet vi i fellesskap skal behandle neste år johans vadrup går på tid så,8432.7,8456.9,24.19999999999891,2014-12-05,2014-12-05_proceedings.txt
Stortinget-20141205-085651_8456900_8479000,når det gjelder fornybar energi president har regjeringa i budsjettet for tjuefemten lagt til rette for utbygging av mer fornybar energi gjennom endringer av flere rammebetingelser blant annet har regjeringa foreslått å innføre gunsteard avskrivingsregler for vindkraftanlegg vi har økt innslagspunktet for grunnrente for småkraft,når det gjeld fornybar energi president har regjeringa i budsjettet for tjuefemten lagt til rette for eee utbygging av mer fornybar energi gjera endringar av fleire landbetingelser blant anna har regjeringa foreslå at å innføre gunsta avskyringsreglar for vinkraftanlegg vi har økt innslagspunktet for grunnrente for småkraft,8456.9,8479.0,22.100000000000364,2014-12-05,2014-12-05_proceedings.txt
Stortinget-20141205-085651_8479000_8503700,og vi har gjort eee en rekke andre tiltak også etter det budsjettet ble lagt frem blant anna med tilpasninger i eller sertifikatordninga som flere av de andre talerene har vært eee inne på så har vi eee også foreslått eee president overføre transnovas oppgaver til enova det er jeg og glad for at får betydelig støtte i stortinget,og vi har gjort eee ein rekke andre tiltak også etter budsjettet blei lagt fram blant anna med tilpassingar i el sertivikatordninga som fleire av dei andre talarane har vore inne på så har vi eee også foreslå at eee president og overføre sosnova oppgåver tlenovr det er eg og glad for at får betydeleg støtte i stortinget,8479.0,8503.7,24.700000000000728,2014-12-05,2014-12-05_proceedings.txt
Stortinget-20141205-085651_8503700_8511400,og så kan man si at så holder jeg det mange som diskuterer det om overføringen til enova er stor nok,og så kan ein si at det så høre det er mange som diskuterer om overføringa til va er stor nok,8503.7,8511.4,7.699999999998909,2014-12-05,2014-12-05_proceedings.txt
Stortinget-20141205-085651_8511400_8534500,det er jo en diskusjon stortinget gjerne må ta men jeg har lyst til å minne om at eee det vå forelå en opptrappingsplan for fondet som finansiere en finansierer enova vi tok over den eee den er styrka det fondet allerede er styrka med mer enn åtte milliarder kroner utover den opptrappingsplanen som de lå rødgrønne partiene la til grunn for sitt arbeid,det er jo ein diskusjon om stortinget gjerne må ta men har lyst til å minne om at eee det v forelå ein opptrappingsplan for reformer som finansiel finansiere henebanaog vi tok over den den er styrka det fonna der det er styrka med meir enn åtte milliardar kroner utover den opptrappingsplanen som dei lå raudgrøne partia la til grunn for sitt arbeid,8511.4,8534.5,23.100000000000364,2014-12-05,2014-12-05_proceedings.txt
Stortinget-20141205-085651_8534500_8562600,vi har også i statsbudsjettet i år president eee lagt frem strategien for sjehontontjæring eee den la vi fram i forbindelse med statsbudsjettet der er det presentert et bredt eee spekter av aktivitet og hovedmålet er jo å identifisere tiltak som kan bedra til teknologiutvikling og kostnadsreduksjoner og jeg har lyst til å minne om at teknologisenteret på mongstad er fortsatt et bærende element,vi har også i statsbudsjettet i år president eee lagt fram strategien for å sjå ei atomantjeling eee den la vi fram i forbindelse med statsbudsjettet der erde presenterte eit breitt eee spekter aktivitet og hovudmålet er jo å identifisere tiltak som kan bidra til teknologiutvikling og kostnadsreduksjonar og eg har lyst å minne om at teknologisentret på mongstad er fortsatt eit barrande seljement,8534.5,8562.6,28.100000000000364,2014-12-05,2014-12-05_proceedings.txt
Stortinget-20141205-085651_8562600_8581700,i denne strategien så president hadde jeg tenkt å snakke om flom og skred men jeg regner med får god anledning til å gjøre det både i replikkordskiftet og seinere over dagen takk det blir replikkordskifte begrenset til fem replikker første replikant er representanten per rune henriksen,t i denne strategien så president har eg tenkt å snakke om flom og sped men eg reknar med å få god anledning til å gjere det både i replikkordskiftet og seinare ut over dagen takk det blir replikkordskifte begrense til fem replikker første replikant er representanten per rune henriksen,8562.6,8581.7,19.100000000000364,2014-12-05,2014-12-05_proceedings.txt
Stortinget-20141205-085651_8585200_8612700,henriksen vær så god takk eee president eee forvaltningen av vår petroleumsressurser skal sikre landet inntekter som statsråden påpekte men det skal også styrke norsk næringsliv industriell utvikling og sysselsetting på de femti årene de snart femti årene det har gått siden den første leitetillatelsen ble gitt så har vi bygget opp en stor leverandørindustri,ver så god takk eee president eee forvaltninga av våre petroleumsressursar skal sikre landet inntekter som statsråden påpeikte men det skal også styrke norsk næringsliv industriell utvikling og sysselsetting på dei femti åra dei snart femti åra det har gått sidan første leitetillatelsen blei gitt så har vi bygt opp ein storg leverandørindustri,8585.2,8612.7,27.5,2014-12-05,2014-12-05_proceedings.txt
Stortinget-20141205-085651_8612700_8640000,men etter at mange store kontrakter gikk til utlandet vinteren tjuetolv til tretten så ble det satt i gang flere prosesser som adresserte høyt kostnadsnivå i norsk leverandørindustri nå skal det snart deles ut kontrakter for utbyggingen av johan sverdrupfeltet den største enkeltinvesteringen i dette tiåret mye står på spill for en industri som i disse dager måla tusen av ansatte gå fordi vedlikehold modifikasjoner og andre prosjekter skyvesler kanselleres,men etter at mange store kontraktar gjekk til utlandet vinteren tjue tolv til tretten så blei det sett i gang fleire prosessar som er adressert til høgt kostnadsnivå i norsk leverandørindustri no skal det snart delast ut kontraktar for utbygginga av johan sværdrøfeltet den største enkelte investeringane i dette tiåret mye står på spel for ein industri som i desse dagar målar tusen av ansatte går fordi ved likehald modifikasjonar og andre prosjekt å skyvastler kansellerast,8612.7,8640.0,27.299999999999272,2014-12-05,2014-12-05_proceedings.txt
Stortinget-20141205-085651_8640000_8668800,som følge av kapitaldisiplin i oljeselskapene og fallende oljepriser hva gjør statsråden for å forsikre seg om at kontraktsbetingelsene på johan sverdrup og andre prosjekter blir utformet sånn at utbygging bidrar til å styrke norsk næringsliv sysselsetting og industriell utvikling statsråd tor wien vær så god president som eee representanten henriksen vil være kjent med så foreligger det en lang rekke både nasjonale lover og internasjonale avtaler som regulerer den her typen kontrakter,som følger av kapitaldiseplien i oljeselskapen og falen og oljeprisar kva gjer statsråden for å forsikre seg om at kontraktsbetingelsene på johan sverdrup og andre prosjekta blir utforma sånn at utbygging bidreg til å styrke norsk næringsliv sysselsetting og industriell utviklingstatsråd tøren ver så god president som eee representanten henriksen vil vere kjent med så foreligger det ein lang rekke både nasjonale lover og internasjonale avtalar som regulerer den her typen konfaktar,8640.0,8668.8,28.799999999999272,2014-12-05,2014-12-05_proceedings.txt
Stortinget-20141205-085651_8668800_8689100,det er imidlertid sånn at vi har sett at det har vært betydelige kostnadsutfordringer i norge både blant operatørene og hos leverandørene det er ingen av oss tjent med uansett eee hvilken eee hvilken del av bordet man setter rundt jeg er glad for at eee dette adresserer sterkt og klart både i leverandørindustrien,det er imidlertid sånn at eee vi har sedd at det har vore betydelege kostnadsutfordringar i noreg både blant operatørane og hos leverandørane det er ingen av oss tjent med uansett eee kven eee kva del av bordet ein set rundt eg er glad for at eee dette er adresseres sterkt og klart både i leverandørindustrien,8668.8,8689.1,20.30000000000109,2014-12-05,2014-12-05_proceedings.txt
