file,text_bm,text_nn,start,end,duration,date,proceedingsfile
Stortinget-20140325-095500_3800000_3829800,bidrar ofte til bedre beslutninger men det å ønske mest mulig åpenhet rundt slik påvirkning er også legitimt og trur jeg fører til best mulig beslutningslortinget er og skal være et åpent hus det er viktig men jeg finner noe grunn til å bemerke at når du i dag skal oppsøke stortinget og skal gjennom en metalldetektor legitimasjonskontroll innskriving i et besøksregister og deretter går forbi,bidrar ofte til betre beslutningar men det er å ønske mest mulig openheit rundt slik påverkninga også legitimt og trur eg fører til best mulig beslutningstortinget er og skal vere eit open hus det er viktig men eg finn nok grunntil bemerke at når du i dag skal oppsøke stortinget og skal gjennom ein metalldetektor legitimasjonskontroll innskriving er eit besøksregister og deretter går forbi,3800.0,3829.8,29.800000000000182,2014-03-25,2014-03-25_proceedings.txt
Stortinget-20140325-095500_3829800_3857300,landets toppolitikere og pressekorps sier vel neppe det at det blir en viss åpenhet rundt det besøksregisteret det største hinderet for å oppsøke stortinget da tror jeg vi skal sjå i helt andre retningerdet å få åpenhet rundt lobbiisme bidrar til et samfunn med mer innsikt for vanlige borgere i maktforholda og hvem som påvirkiske beslutninger,landets topppolitikarar og presse kops så er vel neppe det at det blir ein viss openheit rundt det besøksregisteret det største hinderet for å oppsøke stortinget då trur eg vi skal sjå heilt andre retningardet å få openheit rundt lobiisme bidrar til eit samfunn med meir innsikt for vanlege borgarar i maktforholda og kven som påverkiske beslutningar,3829.8,3857.3,27.5,2014-03-25,2014-03-25_proceedings.txt
Stortinget-20140325-095500_3857300_3884200,det er et viktig argument for åpenhet og det er et argument for at en alltid bør tilstrebe åpenhet så langt det er praktisk mulig eee jeg er vanskelig forstå president at den grensa stoppa vi at det som allere i dag eksisterer nemlig et besøksregister skal kunne utvikle en praktisk ordning for at er åpenhet rundt og han skal kunne få innsyn i og jeg vil også legge til at når vi nå har fått eigjering,det er eit viktig argument for openheit og det r eit argument for at ein alltid bør tilstrebe å openheit så langt det er faktisk mulig eee eg har vanskeleg for så president at den grensa stoppa ved at det som alle i dag eksisterer nemleg eit besøksregister skal kunne utvikle ein faktisk ordning for at det er openheit rundt og ein skal kunne få innsyn i og eg vil også legge til at når vi no har fått eigjering,3857.3,3884.2,26.899999999999636,2014-03-25,2014-03-25_proceedings.txt
Stortinget-20140325-095500_3884200_3912500,eee så gjør det noe som på mange måter er positivt i derefor sånn at mer makt blir flytta til stortinget det er bra men vi har også allerede merka at mer påvirkning og mer interessegruppe har flytta til stortingetdeter som tidligere har sagt i hovedsak en bra ting men det bør være åpenhet rundt det og jeg synes det er noe spesielt at når norsk presseforbund er for et lobbyregister redaktørforeninge er for kommunikasjonsforeninger er for,eee så er jo det noko som eee på mange måtar er positivt i den for sånn at meir makt bil fytta til stortinget det er bra men vi har også haereie merka at meir påverkning og meir interessegrupper har flytta til stortingetdet er som tidlegare har sagt i hovudsak ein bra ting men det bør vere openheit rundt det og eg synest det er noko spesielt at når norsk presseforbund er forrett loberegister redaktørforening er for kommunikasjonsforeininga er for,3884.2,3912.5,28.300000000000182,2014-03-25,2014-03-25_proceedings.txt
Stortinget-20140325-095500_3912500_3939600,transbarent international er for så er det vi politikere som skal sitte og være mot innsyn i lobiismen som foregår dette her har en funnet ulike måter å regulere på i ulike land det ulike politiske kulturer det er skit at norge skal foreta noen blåkopi av verken enkeltstater i usa eller andre land i europa men jeg kunne nok likevel ønske meg ei litt mer imotekomtskapet i det år,tøn peren til internasjonal er for så er det vi politikarar som skal sitte og vere mot innsyn i lovismen som føregår dette her har ein funne ulike måtar å regulere på i ulike land det er ulike politiske kulturar der ikke gitt at noreg skal føreta nok ein blåkopiar verken enkeltstatar i usa eller andre land i europa men eg kunne og likevel ønskte meg ei litt meir imøtekomtskapet i det og,3912.5,3939.6,27.09999999999991,2014-03-25,2014-03-25_proceedings.txt
Stortinget-20140325-095500_3939600_3968300,gå videre med det praktiske arbeidet i å faktisk utforme et register som passer til vår politiske kultur og til kulturen på dette huset det tror jeg ville styrka det norske demokratiet det ville gitt mer innsyn i maktforholda i samfunnet og det vært bra for omdømmet til alle oss som har vårt daglige virke her i stortingetrepresentanten har tatt opp det forslag som han selv har referert og neste taler er hans fredrik grøvan,gå vidare med det praktiske arbeidet i å faktisk utforme eit register som passar til vår politiske kultur og til kulturen på dette huset det trur eg ville styrke det norske demokratiet eg vil a gitt meir innsyn i maktforholda i samfunnet og det vore bra for omdømme til alle oss som har vårt daglege virke her i stortingetrepresentanten har tatt opp det forslag som han seie har referert og neste talar er hans fredrik grøvan,3939.6,3968.3,28.700000000000273,2014-03-25,2014-03-25_proceedings.txt
Stortinget-20140325-095500_3968300_3993100,deretter michael tetzschnergrøvan vær så god president eee fra kristelig folkeparti si side eee så vil vi påpeke at muligheten for direkte kontakt mellom innbyggerne og folkevalgte det er ei viktig side ved det å være et åpent eee storting,deretter mikail texsnirøvand ver så god president eee frå kristeleg folkeparti si side eee så vil vi påpeika at muligheten for direkte kontakt mellom innbyggjarane og folkevalde det er ei viktig side ved det å vere eit opent eee storting,3968.3,3993.1,24.799999999999727,2014-03-25,2014-03-25_proceedings.txt
Stortinget-20140325-095500_3993100_4015600,det er en grunnlegge grunnleggende demokratisk rettighet og for å påvirke beslutningstakere til egen eller andres fordel kontakten mellom innbyggerne næringsliv og organisert interesse på den ene sida og storting og regjering på den andre ja det er en nødvendig og legitim del av vårt demokratiske system,det er ein grunnlegg grunnleggende demokratisk rettighet og på å påverke beslutningstakarar til eigen eller andres fordelkontakten mellom innbyggjane næringsliv og organiserte interesse på den eine sida og storting og regjering på den andre ja det er ein nødvendig å legitim del av vårt demokratiske system,3993.1,4015.6,22.5,2014-03-25,2014-03-25_proceedings.txt
Stortinget-20140325-095500_4015600_4044300,lobbyvirksomhet er en viktig del av vårt demokrati det er viktig med åpenhet og innsyn like fullt ser vi ikke behov for verken å registrere eller regulere lobbyvirksomheten fordi det kan få noen uheldige konsekvenser og la meg nevne noen for det første en registreringsordning vil være ressurskrevende som også presidentskapet eee peker på,lobbyvirksomhet er ein viktig del av vårt demokrati det er viktig med openheit og innsynlike fullt ser vi ikkje behov for verken å registrere eller regulere lovgivirksomheten på dei det kan få nokon uheldige konsekvensar og la meg nemne nokon på det første ein registreringsordning vil vere ressurskrevjande som også presidentskapet eee peker på,4015.6,4044.3,28.700000000000273,2014-03-25,2014-03-25_proceedings.txt
Stortinget-20140325-095500_4044300_4074100,videre vil en sånn ordning kunne skape en høyere terskel for enkeltborgere når det gjelder det å ta kontakt med beslutningstakerne i dag kan enkeltborgere ta kontakt for å ta opp en eller flere saker uten at det knytter seg til en bestemt sak som storting stortinget har til behandling og for det tredje så vil en registreringsordning ikke være noe garanti på åpenhet i forhold til lobiisme i stortinget i departementene eller på statsministerens kontor,vidare ville ein sånn ordning kunne skape ein høgare terskel for enkeltborgare når det gjeld det å ta kontakt med beslutningstakaranei dag kan enkelt borgare ta kontakt for å ta opp ein eller fleire saker utan at det knytt seg til ein bestemt sak som stort stortinget har til behandlingog for det tredje så vil ein registreringsordning ikkje vere nokon garanti på openhet i forhold til lobisme i stortinget i departementa eller på statsministerens kontor,4044.3,4074.1,29.799999999999727,2014-03-25,2014-03-25_proceedings.txt
Stortinget-20140325-095500_4074100_4100500,en omfattende registreringsordning er vi tvert imot redd for kan føre til at møter og samtaler med beslutningstakerne i større grad enn nå finner sted utenfor stortinget eller departementene og som det også ble sagt ifra eee presidentskapet ingen av våre nordiske naboland har innført en sånn registreringsordning som foreslås av venstre ten,ein omfattande registreringsordning er vi tvert imot redd for kan føre til at møter og samtalar med beslutningstakarane i større grad enno finnast det utanfor stortinget eller departementeog som det også blei sagt ifrå eee presidentskapet ingen av våre nordiske naboland har innført ein sånn registreringsordning som foreslås av venstreten,4074.1,4100.5,26.40000000000009,2014-03-25,2014-03-25_proceedings.txt
Stortinget-20140325-095500_4100500_4129700,og konkludere sånn som stortinget eee gjør antagelig i dag forslagsstillerne har rett i at det allerede i dag ikke er mulig å komme inn verken i departementene eller på stortinget uten å registrere seg men forslaget fra venstre innebærer at en i tillegg skal registrere hvilken sak som skal diskuteres og hvem en møter på vegne av vi tror det er positivt med oppmerksomhet om temaet lobbiisme,og konkluderer sånn som stortinget eee gjer antageleg i dagforslags stillarane har rett i at det allereie i dag ikkje er mulig å komme inn verken i departementet eller på stortinget utan å registrere segmen forslaget frå venstre inneber at ein i tillegg skal registrere kva sak som skal diskuterast og vem ein møter på vegner av vi trur det er positivt med oppmerksomhet om temaet lobisme,4100.5,4129.7,29.199999999999818,2014-03-25,2014-03-25_proceedings.txt
Stortinget-20140325-095500_4129700_4155399,at det bidrar til bevisstgjøringer oss representanter rundt det at en sak har ulike aspekter men vi er og vi må være oss bevisst å reflektere over ulike etiske problemstillinger rundt det å være eee stortingsrepresentant lobbiisme har åpenbart positive sider lobbiister kan bidra med sin kunnskap og sine innfallsvinkler til aktuelle politiske saker,at det bidrar til bevisstgjering av oss representantar eee rundt det at ein sak har ulike aspektermen vi å og vi må vere oss bevisst og reflektere over ulike etiske problemstillingar rundt det å vere eee stortingsrepresentant visme har openbert positive siderlobigistar kan bidra med sin kunnskap og sine innfallsvinklar til aktuelle politiske saker,4129.7,4155.399,25.699000000000524,2014-03-25,2014-03-25_proceedings.txt
Stortinget-20140325-095500_4155399_4183500,det kan være en veldig viktig kilde til supplerende informasjon utover det som opplyses i vanlige saksdokumenter men dersom det politiske systemet kommer under stadig økende press av sterke profesjonsinteresser ulike former for organiserte særlige interesser og maktkonsentrasjoner i næringslivet ja så kan det være uheldig sett fra et demokratisk synspunkt og det er ikke bra dersom bestemte aktører i et marked,det kan vere ein veldig viktig kilde til supplerande informasjon utover det som opplyses i vanlege saksdokumentmen dersom det politiske systemet kommer under stadig aukande press av sterke proposjonsinteresser ulike formål for organiserte særinteresser og maktkonsentrasjonar i næringslivet ja så kan det vere uheldig sett frå eit demokratisk synes for og det e ikkje bra dersom bestemt aktørar i eit marked,4155.399,4183.5,28.100999999999658,2014-03-25,2014-03-25_proceedings.txt
Stortinget-20140325-095500_4183500_4212400,eller i en bransje skaffer seg skreddersydde rammevilkår gjennom lokkakontakt at det de siste årene har blitt stadig flere profesjonelle lobbyister og informasjonsbyråer som opptrer på vegne av sine klienter ja det kan forsterke dette og vi skal va være på vakt og forsterke særieinteresserså det er gode argumenter som taler for en registreringsordning og jeg er ikke i tvil om at hensikten med forslaget er god,eller i ein bransje skaffe seg skredda syde rammevilkår gjennom lukka rontakat dei dei siste åra har blitt stadig fleire proposjonelle lobistar og informasjonsbyråar som opptrer på vegner av sine klientar ja dei kan forsterke dette og vi skal va vere på vakt og på sterke særinteresserså det er gode argument som talar for ein registreringsordningog er ikkje i tvil om at hensikten med forslaget er god,4183.5,4212.4,28.899999999999636,2014-03-25,2014-03-25_proceedings.txt
Stortinget-20140325-095500_4212400_4240200,men vi i kristelig folkeparti mener at en registreringsordning ikke løser de utfordringene eee som vi har knytta til lobiismedet er i dag en lav terskel for å ta kontakt med en enkeltrepresentanter og det er positivt og det påhviler den enkelte representant eller gruppe innenfor det politiske systemet sjøl og setter grenser for hvem en vil møteåpenhet tillit henger sammen,men vi i kristeleg folkeparti meiner at ein registreringsordning ikkje løyser dei utfordringane eee som vi har knytta til obismeddet er i dag ein lavterskel på å ta kontakt med ei enkelte representantar og det er positivog det påvilar den enkelte representant el å gruppe innanfor dei politiske systemet sjøl og sette grenser på kvem ein vil møteopenheit tillit heng saman,4212.4,4240.2,27.800000000000182,2014-03-25,2014-03-25_proceedings.txt
Stortinget-20140325-095500_4240200_4268900,en registreringsår ordning vil aldri kunne gi en fullstendig oversikt over eller åpenhet om hvem som har kontakt med hvem og hva de snakker om derfor vil vi støtte presidentskapets innstilling i denne saken takk neste taler er representanten michael tetzschner deretter bård vegar solhjellkk,ein registreringsord ordning vil aldri kunne gi ein fullstendig oversikt over eller openheit om kven som har kontakt med vem og kva dei snakkar om derfor vil vi støtte presidentskapets innstilling i denne saka takneste talar er representanten michael teser deretter bort vegar solheim,4240.2,4268.9,28.699999999999818,2014-03-25,2014-03-25_proceedings.txt
Stortinget-20140325-095500_4269200_4292700,tetzschner vær så god takk president det er med en blanding av eee forundring og overraskelse og skuffelse jeg eee leser dette representantinitiativet fra venstre fordi det partiet er jo vanligvis en god alliert når det gjelder å eee være skeptisk til eee registreringsordninger,teksle ver så godtakk president der med ein blanding av eee forundring og overraskelse og skuffelse e eee les er dette representantinnitiativet frå venstre fordi eee det partiet er jo vanlegvis ein god adeertnog det gjelder å eee vere skeptisk til eee registreringsordninga,4269.2,4292.7,23.5,2014-03-25,2014-03-25_proceedings.txt
Stortinget-20140325-095500_4292700_4322300,eee men slike prinsipper må da tydeligvis vike eee når det da gjelder slike påfunn som dettejeg hadde lyst til å bemerke president at det forslaget som eee representanten rotevanten argumenterte for var til dels et helt annet enn det som faktisk er fremsatt og det vil jeg derfor eee referere mer utførlig det venstre vil ha stortinget med på det er,eee men slike prinsippet må det tydelegvis svike eee når det da gjeld slike påfunn som dette eg hadde lyst til å bemerke president at det forslaget som eee representanten rotevatnen argumenterte for var til dels eit heilt anna enn det som faktisk er fremsettog det vil derfor eee referere meir utførlig det venstre vil ha stortinget med på det er,4292.7,4322.3,29.600000000000364,2014-03-25,2014-03-25_proceedings.txt
Stortinget-20140325-095500_4322300_4347900,å registrere sitat den som oppsøker stortinget på vegne av seg selv eller andre for å påvirke stortinget i saker som er til behandling sitat slutt ja nå kan man jo eee sikkert gjøre sosiologiske undersøkelser av hvem som melder seg her nede på igjen jeg tror den sier veldig lite om hvem som har makt i samfunnet fordi de store,og registrerer sitat den som oppsøker stortinget på vegner av seg sel eller andre for å påverke stortinget i saker som er til behandling sitat sluttja nå kan ein jo eee sikkert gjere sosiologiske undersøkelser av ven som meldeskje her nede i få gjeneg trur den seier veldig lite om vem som har makt i samfunnet fordi dei store,4322.3,4347.9,25.599999999999454,2014-03-25,2014-03-25_proceedings.txt
Stortinget-20140325-095500_4347900_4373900,eee ressurssterke organisasjoner de har helt andre innganger til storting og styringsverk enn det å snakke med enkeltrepresentantereee så det er også slik at qqq de som he qqq kommer hit til stortinget etterpå de skal også da eee underkastes en slik registrering som da for å oppfylle formålet,eee ressurssterke organisasjonar dei har heilt andre innganger til stortinget og styringsverk enn det å snakke med enkelte representantaieee så det er altså slik at dei som har har qqq eee kommer hit til stortinget etterpå dei skal også da eee underkastast ein slik registrering som da for å oppfylle formålet,4347.9,4373.9,26.0,2014-03-25,2014-03-25_proceedings.txt
Stortinget-20140325-095500_4373900_4401100,eee og da kan man også tenke på de misbruksmulighetene som ligger i enhver registreringsordning det er jo det som er overvåkingssamfunnets dilemma det er jo at de fleste av de opplysningene vi gir fra oss iver fra oss i god tro på at det skal brukes til ett formål og så tyde det ut og bli brukt i helt andre formål og så er det summen av disse registreringene som gjør at vi får et totalt eee gjennomst samfunn,eee og da kan ein også tenke på på dei eee misbruksmolighetene som ligg i ein ver registreringsordning det er jo det som er overvåkningssamfunnets dilemma det er jo at dei fleste av dei opplysninga vi gir frå oss giv frå oss i god tru på at det skal brukast til eitt formål og så tyter det ut og blir brukt i heilt andre formål og så er det summen av desse registreringa som gjer at vi får totalt eee gjennomst samfunn,4373.9,4401.1,27.200000000000728,2014-03-25,2014-03-25_proceedings.txt
Stortinget-20140325-095500_4401100_4428500,jeg eee vil president også si at dette er jo også å sammenligne eee møteformen eller at møteformen nå skal bli en eee registreringsgjenstand var da med inngående eller utgående telefonsamtale skal man da akseptere at noen kan kan lytte med for for at man skal være oppmerksom på at man kan bli eee kontrollert på at man hele tiden eee gjør det beste for for for land og folke hva med mailer,jeg eee vil president også seie at dette er jo også samligne eee møteforma eller at møteforma nå skal bli ein eee registreringsgenstad eee var da med inngåande utgåande telefonsamtalar skal ein da akseptere at nokon kan kan lytte med fore for at ein skal vere oppmerksam på at ein kan bli eee kontrolert på at ein heile tida eee gjer det beste for for eee for landet og folkeee var me melei,4401.1,4428.5,27.399999999999636,2014-03-25,2014-03-25_proceedings.txt
Stortinget-20140325-095500_4428500_4456400,eller var med eee korrespondanse til stortinget brev hvor stortinget da hittil av gode grunner står utenfor den vanlige offentlighetsloven fordi vi ikke har noe forvaltningsorganpresident jeg syns at forslaget mangler eee prinsipiell gjennomtenkning og at man eee pådrar seg større problemer og det ser vi jo også i de land som har prøvd å gjøre noe lignende,eller var med eee eee korrespondanse til stortinget brev var i stortinget da hitil av gode grunner står utanfor den vanlege offentlegheitslova fordi vi ikkje har noko forvaltningsorganpresident eg synest at forslaget mangla eee prinsipiell gjennomtenkning og at ein eee pådrar seg større problemet og det ser vi oss i dei land som har prøvd å gjere no likne,4428.5,4456.4,27.899999999999636,2014-03-25,2014-03-25_proceedings.txt
Stortinget-20140325-095500_4456400_4483600,dette forslaget er faktisk mer vidtgående fordi det også ser for seg at man skal la seg registrere på evnene og de fleste av oss vet jo at en samtale eee i hvert fall er det slik eee når det gjelder min gjeste president at jeg jeg vet jo ikke alltid hvilken retning en samtale uttaler seg utvikler seg og så må man altså da etterpå å rapportere om om eee eee hva dette nå kan ha vært,dette forslaget er faktisk meir vidtgåande fordi det også ser for seg at ein skal la seg registrere på emnet og dei fleste av oss veit du at en samtale eee i kvart fall er det slik eee eee når det gjeld min ester president at eee eg vedtok alltid kven retning ein samtale uttaler seg eee utvikler seg og så må ein altså da etterpå å rapportere om om eee va dette no kan ha vore,4456.4,4483.6,27.200000000000728,2014-03-25,2014-03-25_proceedings.txt
Stortinget-20140325-095500_4483600_4510000,og så er det jo en grunnleggende problem også og det er jo at man kaster eee skal vi si over bord den siste forestillingen om at representanter faktisk er innvalgt på et eget verdisyn at de er forpliktet overfor lojaliteten til stortingets spilleregler og og sitt eget verdisett sine egne programmer det er ikke slik at man ruller rundt ogn,og så er det jo en grunnleggende problem også og det er jo at ein kastar eee skal si over bord den siste førestillinga om at representantar faktisk er innvald på eit eige verdisyn at dei er forpliktet overfor lojaliteten til eee stortingets spelereglar og eee og sitt eige verdi sett i sine eigne programmedet er ikkje slik at ein rullar rundt ogn,4483.6,4510.0,26.399999999999636,2014-03-25,2014-03-25_proceedings.txt
Stortinget-20140325-095500_4510000_4526500,fordi man altså eee høfl ja høflighetsgrunner og inter og fordi man interesse for å holde kontakt med sine velgere innvilger i i møter men det betyr jo ikke at man dermed blir agenter for vedkommende eee og eee synspunkt,fordi me er altså eee høf ja høfligheitsgrunner og inter og fordi me han er interesse for å halde kontakt med sine veljarer innvilger i i møte men det betyr og at ein dermed blir agentar i frå vedkommande eee synspunkt,4510.0,4526.5,16.5,2014-03-25,2014-03-25_proceedings.txt
Stortinget-20140325-095500_4526500_4545100,eee såpass trend er stortingsrepresentanter alle til at de at veldig mye av deres kontakt med eee velgerne går jo ut på å forklare dem hvorfor ting ikke kan følges opp hvorfor man ikke kan få det akkurat slik man vil eee slik at eee president jeg må si at,eee såpass trende er stortingsrepresentantar alle til at dei at veldig mye av deiras kontakt med eee veljarar går jo ut på å forklare dei bort for ting ikkje kan følgjast opp kvifor ein ikkje kan få detakrate slik eee ein vil eee slik at eee president jeg må seie at,4526.5,4545.1,18.600000000000364,2014-03-25,2014-03-25_proceedings.txt
Stortinget-20140325-095500_4545100_4574800,jeg setter pris på innstillingen fra presidentskapet dette forslaget må vi glemme snarest mulig og det er jo ikke noe bidrag heller til en opplyst diskusjon om hva slags offentlighet vi vil ha i landet jeg syns overskriften har eee en undertittel som ikke har vært fremme men det er jo egentlig mistillit til integriteten hos eee de folkevalgte i nasjonalforsamlingeneneste taler er representanten bård vegar solhjell deretter rasmus hansson,ei set pris på innstillinga frå presidentskapet dette forslaget må vi glemme snarast mulig og det er kunne bidrag heller kje ein opplyst diskusjon om kva slags offentlegheit vi vil ha i landet eg synest overskriftene har eee ein undertittel som ikke har vore framme men det er jo eigentleg mistillit til integriteten hos eee dei folkevalde i nasjonalforsamlinganeste talar er representanten bård vegar solheim deretter rasmus hansen,4545.1,4574.8,29.699999999999818,2014-03-25,2014-03-25_proceedings.txt
Stortinget-20140325-095500_4574800_4600200,solhjell vær så god qqq ja president jeg regner med at eee jeg så representanten rotevatn har tegna seg så jeg regna med at han eee vil svare for det her forsøket på å innføre overvåkingssamfunnet i norge som jeg forstod var eee noen sin tolkning av forslaget,soler ver så godja president eg rekner med at representanten rotevatn har teikna seg så er eg reknar med at han eee vil svare for det her forsøket på å innføre overvakingssamfunnet i noreg som eg forstod var eee nokon sin tolking av forslaget,4574.8,4600.2,25.399999999999636,2014-03-25,2014-03-25_proceedings.txt
