file,text_bm,text_nn,start,end,duration,date,proceedingsfile
Stortinget-20140116-095725_8115000_8135800,det dreier seg om konvensjonelle våpen og ammunisjon særlig håndvåpen og lette våpen ulovlig omsetning av og slurvete eller ukontrollert salg med slike våpen er en viktig årsak til store menneskelige lidelser over hele kloden i f i står det få i dokumentet fra eee utenriksdepartementet,det dreier seg om konvensjonelle våpen og amunisjon særleg handvåpen og lette våpen ulovleg omsetning av å slurvete eller ukontrollert sa med slike våpen er ein viktig årsak til store menneskelege lidelse over heile klonen i f i stålet i dokumentet frå eee utanriksdepartementet,8115.0,8135.8,20.800000000000182,2014-01-16,2014-01-16_proceedings.txt
Stortinget-20140116-095725_8135800_8152200,ams tryde tretia er et viktig virkemiddel i arbeidet for en mer ansvarlig handel med våpen og et bidrag i arbeidet for å få redusert ulovlig omsetning av slike våpen en enstemmig komite understreker at avtalen er en viktig del av grunnlaget,amstrad titi er eit viktig verkemiddel i arbeidet for ein meir ansvarleg handel med våpen og eit bidrag i arbeidet for å få redusert ulovleg omsetning av slike våpen ein enstemmig komite understreker at avtalen er ein viktig del av grunnlaget,8135.8,8152.2,16.399999999999636,2014-01-16,2014-01-16_proceedings.txt
Stortinget-20140116-095725_8152200_8178600,for det globale arbeidet med å få redusert væpnet vold og menneskelige lidelser avtalens anvendelsesområde omfatter som minimum de syv våpenkategoriene i fns register over konvensjonelle våpenvedtaket om avtalen i fns generalforsamling representerte slutten på en lang prosess som formelt sett begynte med resolusjon sekstifire førti,for det globale arbeidet med å få redusert vepnett vald og menneskelege lidelser avtalens anvendelsesområde omfattar som minimum dei sy våpenkategoriane i fns register over konvensjonelle våpenvedtaket om avtalen i fns generalforsamling representerer til slutten på ein lang prosess som formelt sett begynte med resolusjon sekstifire førti,8152.2,8178.6,26.400000000000546,2014-01-16,2014-01-16_proceedings.txt
Stortinget-20140116-095725_8178600_8208000,resolusjonen ga mandatet til forhandlinger med sikte på inngåelse av en juridisk bindende avtale om handel med konvensjonelle våpen de påfølgende årene var det flere forberedende møter i fn før en fire ukers fnkonferanse om avtalen fra andre til tjueåttende juli i tjuetolv her kom man imidlertid ikke i mål men annen april året etter etter mange mellomspill ble avtalen altså arms trade criti vedtatt,resolusjonen gav mandatet til forhandlingar med sikte på inngåelse av ein juridisk bindende avtale om handel med konvensjonelle våpen dei påfølgande åra var det fleire forberedande møte i fn før ein fire ukes fnkonfuranse om avtalen frå andre til tjueåttande juli i tjuetolv her kom ein imidlertid ikkje mål men annan april året etter etter mange mellomspel blei avtalen altså arms tay city vedtatt,8178.6,8208.0,29.399999999999636,2014-01-16,2014-01-16_proceedings.txt
Stortinget-20140116-095725_8208000_8235200,norge har under forhandlingene arbeidet for en sterk avtale med humanitær innretning og avtalen er en sterk avtale med humanitær innretning selv om den kunne vært mer omfattende eee norge argumenterte under forhandlingene for at avtalen burde omfatte alle konvensjonelle våpen og ammunisjon og deler av komponenter resultatet ble altså at avtasområde,noreg har under forhandlingane arbeidet for ein sterk avtale med humanitær innretning og avtalen er ein sterk avtale med humanitær innretning sjølv om den kunne vore meir omfattande eee noreg argumenterte under forhandlingane for at avtalen burde omfatte alle konvensjonelle våpen og ammunisjon og deler av komponentar resultatet blei altså at avtasområde,8208.0,8235.2,27.200000000000728,2014-01-16,2014-01-16_proceedings.txt
Stortinget-20140116-095725_8235200_8261000,som minimum omfatter de syv våpenkategoriene i fns eget register over konvensjonelle våpen i tillegg til håndvåpen og lette våpen avtalen vil forhåpentligvis bidra til mer samarbeid åpenhet og ansvarlighet hos partene når det gjelder handel med våpen og andre strategiske og forsvarsrelaterte varerså til slutt president,som minimum omfattar dei sy våpenkategoriane i fns eige register over konvensjonelle våpen i tillegg til handvåpen og lette våpenavtalen vil forhåpentlegvis bidra til meir samarbeid openheit og ansvarlegheit hos partane når det gjeld handel med våpen og andre strategiske og forsvarsrelaterte varerså til slutt president,8235.2,8261.0,25.799999999999272,2014-01-16,2014-01-16_proceedings.txt
Stortinget-20140116-095725_8261000_8288200,komiteen har merket seg at avtalen ikke medfører lovendringer dette fordi avtalens bestemmelser om eksportkontroll kan gjennomføres med hjemmel i lov om kontroll med eksport av strategiske varer tjenester og teknologi med videre men utenriks departementet varsler at de vil gå gjennom det samlede regelverket på områder for å se på en mulig harmonisering av våpenavtalen og ulike regelverket,komiteen har merket seg at avtalen ikkje medfører lovendringar dette fordi avtalens bestemmelser om eksportkontroll kan gjennomførast med hjemmel i lov om kontroll med eksport av strategiske varer tenester og teknologi med vidare men utanriksdepartementet varslar at dei vil gå gjennom det samlede regelverket på område for å se på ein mulig harmonisering av våpenavtalen og ulike regelverket,8261.0,8288.2,27.200000000000728,2014-01-16,2014-01-16_proceedings.txt
Stortinget-20140116-095725_8288200_8314299,jeg viser her til utenrikskomiteens behandling av den årlige stortingsmeldingen om eksportkontroll og internasjonalt ikkespredningssamarbeid som kommer opp i stortinget senere denne våren her understrekes det at norsk eksportkontroll og den praksisen vi har på det området ivaretar avtalens forbuds og vurderingskriterier som nedfelt i blant annet ar,eg viser her til utanrikskomiteens behandling av den årlege stortingsmeldinga om eksportkontroll og internasjonalt ikkjespreiingssamarbeid som kommer opp i stortinget seinare denne våren her understrekast det at norsk eksportkontroll og den praksisen vi har på det området ivaretar avtalens forbods og vurderingskriterier som nedfelt i blant anna ar,8288.2,8314.299,26.09900000000016,2014-01-16,2014-01-16_proceedings.txt
Stortinget-20140116-095725_8314299_8341700,og her dermed så anbefaler jeg den enstemmige innstillingen ingen flere har bedt om ordet og sak fem er ferdigbehandla vi går til sak seks interpellasjon fra representanten trine skei grande til utenriksministeren qqq i regjeringsplattformen loves det at regjeringen solberg skal innta en global lederrolle innen arbeidet med utdanning for alle undertegnede deler den ambisjonen for på norges vegne og mener dette vil være et viktig bidrag for å sikre at all rett til skolegang,og he dermed så anbefangar ei den enstemmige innstillingaingen fleire har bedt om ordet og sak fem er ferdigbehandla vi går til sak seks interpolasjon frå representanten tine skei grande til utanriksministeren i regjeringsplattforma lovast det at regjeringa solberg skal innta ein global lederrolle innan arbeidet med utdanning for alle underteikne deler denne ambisjonen for på noregs venger og meiner dette vil vere eit viktig bidrag for å sikre at aln rett til skolegang,8314.299,8341.7,27.40099999999984,2014-01-16,2014-01-16_proceedings.txt
Stortinget-20140116-095725_8341700_8371000,riktignok har det skjedd store fremgang siden education for for ol målene og tusenårsmålene om utdanning ble satt men fremdeles er femtisyv millioner barn uten tilgang på skole og nesten to hundre millioner barn faller ut eller har ikke tillegne seg grunnleggende lese og regneferdigheter før de begynner i fjerdeklasse disse barna har det vanskeligste utgangspunktet av alle de lever i områder preget av konflikt og krig er berørt av natur kostrokatastrofer de har nedsatt funksjonsevne,riktig nok har det skjedd store framgang sidan edukeisjen for for å måla og tusenårsmåla om utdanninga blei sett men sen delast dei femtisju millionar barn utan tilgang på skole og nesten to hundre millionar barn faller ut eller har ikkje tilheng seg grunnleggjande lese og rekneferdigheiter før dei begynner i fjerde klasse desse barna har det vanskelegeste utgangspunktet av alle dei lever i område prega av konflikt og krig er berørt av naturkost katastrofer dei har nedsett funksjonsemne,8341.7,8371.0,29.299999999999272,2014-01-16,2014-01-16_proceedings.txt
Stortinget-20140116-095725_8371000_8400300,eller tilhørende på språklig minoritet de er de fattigste og mest morganiserte hvilken strategi har utenriksministeren for å utøve en global lederrolle i å fremme utdanning for alle trine skei grande president i denne salen har man de siste to hundre årene hvert fall i parlamentet i stortinget det ei norge de siste to hundre årene tatt ganske mangmodige grep,eller tilhøyra ein på språkleg minoritet det gjer dei fattigaste og mest marganiserte kva strategi har utanriksministeren for å utøve en global lederrolle i å fremme utdanning for alle trine schei grande president i denne salen har ein dei siste to hundre åra kvart fall i parlamentet i stortinget de i noreg dei siste to hundre åra tatt ganske mange modige grep,8371.0,8400.3,29.299999999999272,2014-01-16,2014-01-16_proceedings.txt
Stortinget-20140116-095725_8400300_8429700,for utdanning når venstre vart stifta for om noen dager hundre og tredve år sia så var det å bygge opp en skole og utdanning for alle norske barn en av de viktigste jobbene man starta med eee man gikk fra å være et enormt fattig land der man ikke helt hadde forståelse for hvorfor alle barn nødvendigvis skulle holde på å lære seg og skrive og regne til å begynne en kunnskapsnasjon,for utdanning når venstre vart stifta for eee om nokon dagar hundre og tredve år sidan så var det å bygge opp ein skole og utdanning for alle norske barn ein av dei viktigaste jobbane men starta med eee ein gjekk frå å vere eit enormt fattig land der ein ikkje heilt hadde forståelse for korfor alle barn nødvendigvis skulle halde på å lære seg og skriv og rekne til å begren kunnskapsnasjon,8400.3,8429.7,29.400000000001455,2014-01-16,2014-01-16_proceedings.txt
Stortinget-20140116-095725_8429700_8459000,er i ja president jeg syns vi av og til skal snu oss tilbake og huske på at når man først begynte på med den felles offentlige grunnskolen som venstre var med å grunnla i norge så var det liten forståelse hos mange voksne for hvorfor barn absolutt skulle lære seg å skrive og regne dem som aldri skulle holde i et ark i løpet av sin yrkeskarriere og som førte til at familiene ble fattigere fordi at barna gikk på skole og ikke kunne jobbe,vi er i dag ja president eg synest vi av og til skal snu oss tilbake og hugs på at eee når ein først bynde på med ein felles offentlege grunnskolen som venstre var med og grunnla i noreg så var det liten forståelse hos mange vaksne for korfor barn absolutt skulle lære seg å skrive og rekne den som aldri skulle halde i eit ark i løpet av sin yrkeskariere og som følge til at familiane vart fattigare fordi at barna gjekk på skole og ikkje kunne jobbe,8429.7,8459.0,29.299999999999272,2014-01-16,2014-01-16_proceedings.txt
Stortinget-20140116-095725_8459000_8482800,likevel ble det gjort modige valg i herre salen likevel valgte man å prioritere det og nå snakker vi om at kunnskapen vår er vår viktigste nasjonale formue dette er veldig viktige satsinger for å bringe land ut i fattigdom kunnskap og utdanning er sjølve nøkkelen for å ha en god fungerende økonomi,likevel vart det vårt modige valet her i salen likevel valde ein å prioritere det og no snakkar vi om eit kunnskapen vår er vår viktigaste nasjonale formø dette er veldig viktige satsingar for å bringe land ut i fattigdom kunnskap og utdanning er sjølve nøkken for å ha ein god fungerande økonomi,8459.0,8482.8,23.799999999999272,2014-01-16,2014-01-16_proceedings.txt
Stortinget-20140116-095725_8482800_8509700,for å sørge for at vi har næringsutvikling i de enkelte landene som gjør at du kan skape velferd for framtida kunnskap er kjempeviktig for hver enkelt sin helse eee i fjor ferie vi stemmerettsjubileet president mange av de kvinnene som kjempa fram kvinnelig stemmerett i norge hadde også helsepolitikk og kunnskap om folkehelse som sine viktigste tema ijement,for sørg for at vi har næringsutvikling i dei enkelte landa som gjer at du kan skape velferd for framtida kunnskap er kjempeviktig for ver enkelt sin helse eee i fjor fører vi stemmerettsjubileet president mange av dei kvinnene som kjempa fram kvinneleg stemmerett i noreg har også helsepolitikk og kunnskap om folkehelse som sine viktigaste tema isjement,8482.8,8509.7,26.900000000001455,2014-01-16,2014-01-16_proceedings.txt
Stortinget-20140116-095725_8509700_8539400,det er viktig for miljø og det er viktig for klimaet at borgerne har kunnskap om hvilke virkninger eee naturen har på oss og hvilke virkninger vi kan ha på naturen det er viktig for utvikling av demokrati at borgerne både har kunnskap om styresett men også mulighet til å påvirke og det er viktig for likestilling at alle jenter og alle gutter får lik rett til utdanning,det er viktig for miljø og det er viktig for klima at borgarane har kunnskap om kva verkningar eee naturen har på oss og kva virkningar vi kan ha på naturen det er viktig for utvikling av demokrati eit borgara både har kunnskap om styresett men også mulighet til å påverke og det er viktig for likestilling at alle gjentar og alle gutar får lik rett til utdanning,8509.7,8539.4,29.69999999999891,2014-01-16,2014-01-16_proceedings.txt
Stortinget-20140116-095725_8539400_8565700,derfor så bør utdanning være hjørnesteinen i enhver utviklingspolitikk og sia tusenårsskiftet president har antall barn som går ut uten skolegang blitt halvert det har blitt mer likhet mellom hvor mange jenter og hvor mange gutter som får utdanning men den hvilende økninga,derfor så bør utdanning vere hjørne stein i ein var utviklingspolitikk og sidan tusenårsskiftet president har antal barn som går ut utan skolegang blitt halvert det har blitt meir likheit mellom kor mange gjentar og kor men guttar som får utanning men den vidende økninga,8539.4,8565.7,26.30000000000109,2014-01-16,2014-01-16_proceedings.txt
Stortinget-20140116-095725_8565700_8595100,grunnen til at vi har kommet så langt er at det har vært en målretta koordinert nasjonal eee koordinering fra nasjonale myndigheter for å klare å få til løftet skal vi komme i mål president så kreves det at man tørs og satse videre for fremdeles er det femtisju millioner barn som ikke går på skole og mange som får skolegang får skolegang av dårlig kvalitet seksti millioner barn,grunnen til at vi har kome så langt er at det har vore ei målretta kordinert nasjonal eee de kordnæring for dei nasjonale myndigheiter for å klare å få tilrøfte skal vi komme i mål president så krevst det eit mein turs og sats vidare for framdeles så er det femtisju millionar barn som ikkje går på skole og mange som får skolegang får skolegang av dårleg kvalitet seksti millionar barn,8565.7,8595.1,29.399999999999636,2014-01-16,2014-01-16_proceedings.txt
Stortinget-20140116-095725_8595100_8619600,dropper ut av skole før fjerde klasse det gir begrepet dropouts et litt anna perspektiv hundre og tredve millioner barn begynner i fjerdeklasse uten å beherske grunnleggende leseferdigheter det er det også noen som gjør i norsk skole det viktigste for å bekjempe det er å ha gode lærere i absolutt alle land,droppe ut av skole for fjerde klasse det gir begrepet dropp åt eit litt anna perspektiv hundre og tredve millionar barn byrne i fjerde klasse utan å beherske grunnleggande leseferdigheter det er det også nokon som gjer i norsk skole det viktigaste for å bekjempe det er å ha gode lærarar i absolutt alle land,8595.1,8619.6,24.5,2014-01-16,2014-01-16_proceedings.txt
Stortinget-20140116-095725_8619600_8648100,da må man bygge en moderne lærerutdanning man må utvikle læreplaner og man må bygge kapasitet innafor de enkelte utdanningsfeltene president jeg trur at vi trenger cirka en komma sju millioner flere lærere i verden for å klare å gjøre den store oppgaven vi har foran ossnorge har stor troverdighet på at vi har hatt sterk satsing på barnerettigheter over lang tid,der må ein bygge ein modern lærarutdanning ein må utvikle læreplanar og ein må bygge kapasitet innanfor dei enkelte utdanningsfeltapresident eg trur at vi treng cirka ein komma sju millionar fleire lærarar i verden for å klare å gjere den store oppgåven å gjere for a ossnoreg har stor truverdigheit på at vi har hatt sterk satsing på barnerettigheter over lang tid,8619.6,8648.1,28.5,2014-01-16,2014-01-16_proceedings.txt
Stortinget-20140116-095725_8648100_8677600,vi har hatt en gratis og universell offentlig skole helt fra venstre grunnla den for hundre og tredve år sia vi har vært pådriver for barns rettigheter globalt over eee tiår og det er faktisk sånn at beskyttelse og omsorg og rett til medbestemmelse er like viktig del av skolegangen som sjølve det å kunne lese og skrive i dag ser vi mange plasser rundt omkring i verden et fysisk avstraffelse,vi har hatt ein gratis og unnversell offentleg skole heilt frå venstre grunnlage for hundre og tredve år sidan vi har vore pådrivar for barns rettigheter globalt over eee ti år og det er faktisk sånn eit beskyttelse og omsorg og rett til medbestemmelse er like viktig del av skolegangen som sjølve det å kunna lese og skrive i dag ser vi mange plassar rundt omkring i verda eit fysisk avstraffelse,8648.1,8677.6,29.5,2014-01-16,2014-01-16_proceedings.txt
Stortinget-20140116-095725_8677600_8706700,og ydmikkelse er en del av skolehverdagen for veldig mange skolebarn det går ut over livskvaliteten dere har en frykt og skam gjør heller ikke at vi får til god læring og formidling av verdier og menneskesyn som vi må stå opp for er viktig å bidra inn med i forhold til utdanninga unge skal lære og ha respekt for andre i skolen og da må den skolen også respektere dem,og udmjukelser er ein del av skolevardagen for veldig mange skolebarn det går ut over livskvaliteten emma men frykt og skam gjer heller ikkje at vi får til god læring og formidling av verdiar og menneskesyn som vi må stå opp for er viktig å bidra inn med i forhold til utdanninga unge skal lære og ha respekt for andre i skolen og da må den skolen også respektere dei,8677.6,8706.7,29.100000000000364,2014-01-16,2014-01-16_proceedings.txt
Stortinget-20140116-095725_8706700_8734000,hvordan skal vi forvente at det blir utvikla demokratiske verdier i en skole hvis man alltid blir utsatt for den sterkestes rett og hvordan skal vi få til likestilling i verden hvis vi har en skole som behandler jenter og gutter uliktdet å myndiggjøre den enkelte borger også når den borgeren er en liten jente eller en liten gutt det er å løfte alle,korleis skal vi forvente at det blir utvikla av demokratiske verdiar i ein skole viss ein alltid blir utsett for den sterkeste rett og korleis skal vi få til likestilling i verden viss vi har ein skole som behandlar gjenta og guttar ulikt det er å myndiggjere den enkelte borger også når den borgen er ein liten jente ler ein liten gut det er å løfte alle,8706.7,8734.0,27.299999999999272,2014-01-16,2014-01-16_proceedings.txt
Stortinget-20140116-095725_8734000_8763000,og alle jenter må få lov til å begynne på skole nå har vi hatt en oppvåkning mye i verdenspolitikken på grunn av det som malala har gjort det hun har stått for og det hun var utsatt for skutt av taliban på vei til skole og var ikke noe tilfeldig ve offer dessverre er det mange eksempler det er farlig å være jente og gå på skole mange steder i verden og det er krefter som er ute at det å skape frykt,og alle gjentar me å få lov til å bynde på skolen nå har vi hatt ein oppvakning my i verdenspolitikken på grunn av det som malala har gjort det ho har stått for og det ho vore utsett for skutt av taliban på veg til skole og var i no tilfeldige offer dessverre er det mange eksempel det er farleg å vereente å gå på skoler mange stadar i verda og det er krefter som er utetter og skap frykt,8734.0,8763.0,29.0,2014-01-16,2014-01-16_proceedings.txt
Stortinget-20140116-095725_8763000_8792600,eee hos kvinner for å ikke tillegne seg kunnskap i rett selv for at kunnskapsrike kvinner skal ta vakt i samfunnet regjeringa har sagt at dem vil arbeide for jenters rett til utdanning mange steder tyder det eee er det også da viktig å satse på kvinnelige lærere både som rollemodeller men også fordi er sikkerheten til den enkelte elev det er altfor mange jenter i skoler rundt omkring i verden,eee hos kvinner for å ikkje telen seg kunnskap i rett sel for at kunnskapsrike kvinner skal ta vakt i samfunnetregjeringa har sagt at dei vil arbeide for jentes rett utdanning mange stader tyder det er er det også da viktig å satse på kvinnlege lærarar både som rollemodellar men også fordi er sikkerheiten til den enkelte elev det er altfor mange gjentar i skolar rundt omkring i verda,8763.0,8792.6,29.600000000000364,2014-01-16,2014-01-16_proceedings.txt
Stortinget-20140116-095725_8792600_8822200,som er utsatt for seksuell trakassering og seksuell oppmerksomhet fra mannlige lærere jenter er også de mest sårbare i kriser og konflikter skoler skal være beskyttelses og opplevelses arena særlig for dem som er mest utsatt for trusler og det ofte gjenta og det får noen interessante andre følger av når jenter får skolegang jenter som har ifølge unicef så ser dem et jente som har ungdomsskole,som er utsett for seksuell trakassering og seksuell oppmerksomhet frå mannlege lærarar i ente er også dei mest sårbare i kriser og konfliktar skola skal vere beskyttelses og opplevelses arena særleg for dei som er mest utsett for truslar og det er ofte enda og det får nokon interessante andre følger av når gjenta for skolegang jenta som har i følgerunnesef så ser me eit gjentar som har ungdomsgordet,8792.6,8822.2,29.600000000000364,2014-01-16,2014-01-16_proceedings.txt
Stortinget-20140116-095725_8822200_8851200,har oppdelt seks ganger mindre sjanse til å bli utsatt for å være barnebrud enn dem som ikke har det dem føder barn senere hvert ekstra år på skolen reduserer risikoen for spebarnsdødelighet mellom om fem og ti prosent et barn som har en lesekyndimor har femti prosent større rang sjanse til å leve mer enn fem år og i afrika sør for sahara kun en komma åtte millioner barns liv vært redda,har opptil seks gonger mindre sjanse til å bli utsett for å vere barnebrud enn dei som ikkje halde dei føder barn seinare vart ekstra år på skolen redusere risikom for spøbarnsdødeleghet mellom lom fem og ti prosent eit barn som har ein lesekyndig mor har femti prosent større rang sjanser til å leve meir enn fem år og i afrika sør for så har de kun ein komma åtte millionar barns liv vert redda,8822.2,8851.2,29.0,2014-01-16,2014-01-16_proceedings.txt
Stortinget-20140116-095725_8851200_8879100,om bare mødrene hadde fullført ungdomsskolen derfor så bør norsk bistand prioritere grunnskole framover altfor mange land prioriterer å donere til høyere utdanning og det går på på bekostning av barns skolegang det er viktig å bygge opp det er grunnlaget i et samfunn som er med å løfte alle skal man klare å få til utvikling i samfunnet akkurat som det vi valgte å gjøre i norge,om bere mødrene hadde fullført ungdomsskolen etter så bør norsk bistand prioritere grunnskole framover alt for mange løyn prioriterer å donere til høgre utdanning og det går på på bekostning av barn skolegang det er viktig å bygge opp det er grunnlaget eit samfunn som er med å løfte i alle skal me ein klar å få til utvikling i samfunnet akkurat som det bli valt å gjere i noreg,8851.2,8879.1,27.899999999999636,2014-01-16,2014-01-16_proceedings.txt
Stortinget-20140116-095725_8879100_8905300,for hundre og tredve år siaså når jeg tar opp den herre interpellasjonen i dag president så er det ikke for å overbevise statsråden jeg trur egentlig han er overbevist men jeg etterspør en strategi for lederskap for å nå herre målet hvem er det vi skal alliere oss med og hvilke arenaer skal vi oppsøke for å skape en god arbeidsdeling mellom oss og så skaper det to dil,for hundre og treda seså når eg tar opp den her interpellasjonen i dag president så er det ikkje for å overbevise statsråden eg trur eigentleg han er ovis men eg etterspør ein strategi for lederskap for å nå her er målet kven er det vi skal alliere oss med og vaka arena skal vi oppsøkte for å skap ein god arbeidstelling mellom oss og så skaper det to del,8879.1,8905.3,26.19999999999891,2014-01-16,2014-01-16_proceedings.txt
Stortinget-20140116-095725_8905300_8928400,det er ikke nødvendigvis de landene som skår i best på styresett og demokrati som er de landene som trenger mest hjelp for å få til skolegang og når vi skal velge ut land å jobbe med så er det ofte de sårbare statene de statene i konflikt som ikke er de populære mottakerlandene som er de landene som faktisk trenger mest hjelp på herre,det er ikkje nødvendigvis dei lanane som skårer best på styresett og demokrati som er dei lønnene som treng mest hjelp for å få til skole gangog når vi skal ha velge ut land å jobbe med så er det ofte dei sårbare statane dei statane i konflikt som ikkje er dei populære mottakarlønnane som er dei lønnene som faktisk treng mest hjelp på here,8905.3,8928.4,23.100000000000364,2014-01-16,2014-01-16_proceedings.txt
