file,text_bm,text_nn,start,end,duration,date,proceedingsfile
Stortinget-20140930-115503_1136500_1166300,norge gikk inn i mirakelåret attenfjorten som en del av danmark underlagt et kongelig enevelde vi gikk ut av attenfjorten i en tilnærmet likeverdig union med sverige med parlament og med et helt nytt politisk system grunnloven la et fundament for utviklingen av demokratiet og velferden i vårt land nå går grunnlovsjubileet mot slutten et par viktige arrangementer gjenstår,noreg gjekk inn i mirakel året attenfjorten som ein del av danmark underlagt eit kongelig enevelde vi gjekk ut av attenfjorten i ein tilnærma likeverdig union med sverige med parlament om eit heilt nytt politisk system grunnloven la eit fundament for utviklinga av demokratiet og velferda i vårt land no går grunnlovsjubileet mot slutten eit par viktige aransjementet gjenstår,1136.5,1166.3,29.799999999999955,2014-09-30,2014-09-30_proceedings.txt
Stortinget-20140930-115503_1166300_1194200,vi skal feire to hundreårsdagen for stortingets første sammentreden syvende oktober og vi skal markere to hundre år for novembergrunnloven men like mye som en feiring av fortiden bør jubileet være en investering for framtiden og da gjenstår det for bare på presidenten å takke alle som har vært involvert i stortingets virksomhet i året som gikk for en flott innsats som re alle kan være stolte av,vi skal føre to hundreårsdagen for stortingets første samantreden syn oktober og vi skal markere to hundre år for november grunnloven men like mykje som ein færing av fortiden bør juble vere ein investering for framtiden og da gjenstår det for bare på presidenten og takke alle som har vore involvert i stortingets virksomhet i året som gjekk for ein flott innsats som det alle kan vere stolte av,1166.3,1194.2,27.90000000000009,2014-09-30,2014-09-30_proceedings.txt
Stortinget-20140930-115503_1194200_1214300,ikke minst så vil presidenten takke alle de nye representantene for en stor aktivitet i folkestyrets tjeneste med dette så erklærer jeg det hundre og femtiåttende storting får endelig avsluttet og vi kan med god samvittighet undertegne protokollen som nå blir lagt på bordet foran dere og møtet,ikkje minst så vil presidenten takka alle dei nye representantane for ein stor aktivitet i folkestyrets teneste med dette så er klar i ei det hundre og femtiåttnde storting for endeleg avslutta og vi kan med god som vitja eit underteikne protokollen som nå blir lagt på bordet forandere og møtet,1194.2,1214.3,20.09999999999991,2014-09-30,2014-09-30_proceedings.txt
Stortinget-20140930-115503_1220700_1223200,ja qqq,teke president,1220.7,1223.2,2.5,2014-09-30,2014-09-30_proceedings.txt
Stortinget-20140930-115503_1234800_1237800,elevenes fortsettes,hagesektoren president,1234.8,1237.8,3.0,2014-09-30,2014-09-30_proceedings.txt
Stortinget-20140930-115503_1256800_1263500,tjenester forsøstrene president os,ande freres,1256.8,1263.5,6.7000000000000455,2014-09-30,2014-09-30_proceedings.txt
