file,text_bm,text_nn,start,end,duration,date,proceedingsfile
Stortinget-20141205-085651_12461900_12490700,denne høsten har vært preget av flere permitteringer og oppsigelser grunnet til et lavere aktivitetsnivå på sokkelen heldigvis har mange av dem som mistet jobben raskt funnet nytt arbeid også i mitt hjemfylke rogaland enten i olje og gassindustrien eller utenfor mange bedrifter har også benyttet denne anledningen til å tilegne seg kompetanse de lenge har hatt utfordringer med å få tak i det er foreløpig ingenting som tyder på at vi vil se en stor vekst i ledighetstallene fremover men vi må følge nøye med,denne hausten har vore prega av fleire permiteringar og obesigelser grunna til eit lavre aktivitetsnivå på sokkern heldigvis har mange av dei som misser jobben raskt funnet nytt arbeid også i mitt gjenfylke rogeland enten i gassindustrien eller utanfor mange bedrifter har også benytte denne anledninga til å tilleie ei kompetanse dei lenge har hatt utfordringar med å få tak i det forløy vi ingenting som tyder på at vi vil se ein stor vekst i ledigheitstala framover men vi må følge nøye med,12461.9,12490.7,28.80000000000109,2014-12-05,2014-12-05_proceedings.txt
Stortinget-20141205-085651_12490700_12518100,petroleumsnæringen er en psykelisk næring og vi kan forvente at aktivitetsnivået igjen vil ta seg opp i fremtiden det er viktig at den omstillingen som nå skjer ikke fører til betydelig tap av kompetanse i næringen president den kostnadsutviklingen som har pågått i flere år innenfor industrien var ikke lenger bærekraftig bransjen er nå inne i en nødvendig prosess som tar sikte på å redusere kostnadene noe som vil være viktig for å styrke løn i prosjekter offshore,petroleumsnæringa er ein syklisk næring og vi kan forvente at aktivitetsnivået igjen vil tas opp i framtida det er viktig at den omstillinga som nå skjer ikkje fører til betydeleg tap av kompetanse i næringapresident den kostnadsutviklinga som har pågått i fleire år innan for industrien var ikkje lenger berekraftig bransjen er nå inne i ein nødvendig prosess som tar sikte på å redusere kostnadene noko som vil vere viktig for å styrke løn i prosjektet of sjå,12490.7,12518.1,27.399999999999636,2014-12-05,2014-12-05_proceedings.txt
Stortinget-20141205-085651_12518100_12547500,og opprettholde utbyggingsaktiviteten fremoverkostnadskutt i industrien må likevel ikke under noen omstendigheter gå på bekostning av det gode sikkerhetsnivået på norsk sokkel vi skal være verdensledende på hms på norsk sokkel president det eksisterer en utbredt misforståelse om at to tredjedeler av petroleumsressursene må bli liggende i bakken om vi skal nå togradersmålet noen mener også at dette betyr norsk olje og gass og at den må også bli liggende,og opprettholde utbyggingsaktiviteten framoverkostnadskutt i industrien må likevel ikkje under nokon omstendigheter gå på bekostning av dei gode sikkerheitsnivået på norsk sokkel vi skal vere verdsledande på hms på norsk sokkelpresident det eksisterer ein utbredt misforståelse om at to tredjedelar av petroleumsressursene må bli liggende i bakken om vi skal nå togradersmålet nokon meiner også at dette betyr norsk ove og gass og at den må også bli liggande,12518.1,12547.5,29.399999999999636,2014-12-05,2014-12-05_proceedings.txt
Stortinget-20141205-085651_12547500_12574000,dette er en misforståelse som gjentas ofte i sommer ble til og med lederen i arbeiderpartiet tolket dithen at han mente dette heldigvis var han tydeligere på et senere tidspunkt og slo fast at dette i hovedsak gjelder kull to tredeler av de fossile ressursene må bli liggende om vi skal nå målet vårt to tredeler av disse ressursene i verden er kull olje og gass vil fortsatt være en betydelig demtida,dette er ein misforstålel som gjentas ofte i sommar blei til og med lederen i arbeidarpartiet tåke dit hen at han meine dette heldigvis var han tydelege på eit seinare tidspunkt og slo fast at dette i hovudsak gjeld køll to tredjedeler av dei fosile ressursane må bli liggjande om vi skal nå målet vårt to tredjedeler av desse ressursane i verda er tull olje og gass vil fortsatt vere ein betydeleg detida,12547.5,12574.0,26.5,2014-12-05,2014-12-05_proceedings.txt
Stortinget-20141205-085651_12574000_12600800,og gass er en fornuftig og effektiv bro til fornybarsamfunnet men en verden med strengere klimapolitikk vil stille større krav til hva som kan tillates av utslipp også fra de fossille fossile kildene som benyttes norge er godt rustet til å møte denne fremtiden vi produserer olje og gass med et lavt karbonavtrykk sammenlignet med andre lands produksjon vi har verdens høyeste seotagift på nors norsk sokkeltepliktig,og gass er ein fornuftig og effektiv bro til fornybarsamfunnet men ein verd med strenge klimapolitikk vil stille større krav til va som kan tillatast av utslepp også frå dei fosili fossile kildene som benyttes noreg er godt rusta til å møte denne framtiden vi produserer olje og gass med eit lavt karbonavtrykk samaniit med andre lands produksjon vi har verdens høyeste sio tav på norsk norsk sokkeltepliktig,12574.0,12600.8,26.799999999999272,2014-12-05,2014-12-05_proceedings.txt
Stortinget-20141205-085651_12600800_12627500,i fremtiden er det den produksjonen med lavest utslipp som vil være mest konkurransedyktig en god klima og miljøpolitikk for norsk olje og gassproduksjon er derfor ikke bare viktig for verdens klima det er også viktig for å opprettholde konkurransekraften til norsk næringsliv jeg mener vi har grunn til å være stolte av vårt miljøfokus innenfor næringen og den fantastiske teknologiutviklingen vi finner her det er også denne teknologiutviklingen som vil hjelpe amfunnet,i framtida er det den produksjonen med laves utslepp som vil vere mest konkurransedyktig ein god klima og miljøpolitikk for norsk oe gassproduksjon er derfor ikkje berre viktig for verds klima det er også viktig for å opprettholde konkurransekrafta til norsk næringsliv dei meiner vi har grunn til å vere stolte av vårt miljøfokus innanfor næringa og den fantastiske teknologiutviklinga vi finn her det er altså denne teknologiutviklinga som vil hjelpe amfunnet,12600.8,12627.5,26.700000000000728,2014-12-05,2014-12-05_proceedings.txt
Stortinget-20141205-085651_12627500_12656800,og som gjør at norsk olje og gass kan være en del av løsningen og ikke problemet og så vil jeg si den debatten vi har om at regjeringen ikke er offensiv nok eee gitt den situasjonen næringen står i nå så vil jeg bare minne om at kanskje det aller aller aller viktigste ikke kanskje en gang det er det det viktigste for næringen er forutsigbarhet og gode rammevilkår det er det som er vårt vår oppgave som myndigheter å støtte opp om og sikre for framtidaferhat guven deretter stine renate håheim,og som gjer at norsk ode og gass kan vere ein del av løysinga og ikkje problemet og så vil eg si i den debatten vi har om eee at regjeringa ikkje er offensiv nok eee gitt den situasjonen næringa står i nå så vil eg berre minne om at kanskje det aller aller aller viktigaste rike kanskje gang det er det det viktigaste for næringa er forutsigbarhet og gode rammelkår der det som er vårt vår oppgåve som myndigheiter å støtta opp om å sikre på framtidaferat kuen deretter stine renate hoheim,12627.5,12656.8,29.299999999999272,2014-12-05,2014-12-05_proceedings.txt
Stortinget-20141205-085651_12656800_12663900,guven dere taler i den denne sal har eee en taletid på inntil tre minutter,gunnar dau talaren denne saka har ein taletid på inntil tre minutt,12656.8,12663.9,7.100000000000364,2014-12-05,2014-12-05_proceedings.txt
Stortinget-20141205-085651_12668700_12697600,ærede president det er gledelig å sjå at den her regjeringa har valgt å videreføre petroleumsvirksomheten på grunnlag av meldinga regjeringa stoltenberg ii la frem men det savnes vilje til å styre den næringa her basert på ny og oppdatert kunnskap for oss i arbeiderpartiet er det viktig å legge til rette for vekst og nye arbeidsplasser i hele landet gjennom en aktiv nærings og arbeidslivspolitikk på bakgrunn,eide president det er gurdedeleg å sjå at den her regjeringa har valt å vidareføre petroleumsvirksomheten på grunnlaget av meldingar regjeringa stoltenberg to la fram men det sakna vilje til å styre den næringa her basert på ny og oppdatert kunnskapfor oss i arbeidarpartiet er det viktig å legge til rette for vekst og nye arbeidsplassar i heile landet gjennom ein aktiv nærings og arbeidslivspolitikk på bakgrunn,12668.7,12697.6,28.899999999999636,2014-12-05,2014-12-05_proceedings.txt
Stortinget-20141205-085651_12697600_12723600,av mindre aktivitet i oljenæringa har det oppstått store u utfordringer for de berørte aktørene for at vi som politikere skal avhjelpe en situasjon med nedbemanninger og permitteringer så må vi ha på plass stabile og gode rammebetingelser ikke bare for selskapene men også for de mange tusen ansatte i næringa,av mindre aktivitet og oljenæringa har det oppstått store u utfordringar for dei berørte aktørane for at vi som politikarar skal avhjelpe ein situasjon med nedbemanning og permiteringar som må vi ha på plass stabile og gode rammebetingelser ikkje berre for selskapa men også for dei mange tusen ansette i næringa,12697.6,12723.6,26.0,2014-12-05,2014-12-05_proceedings.txt
Stortinget-20141205-085651_12723600_12751200,det er mangel på forståelse av konkurranseutsatt næringsutfordringer hos denne regjeringa president i trøndelag har store bedrifter som raneson og ibel gått til masse oppsigelser på grunn av lav ordreinngang virkemidlet slike aktører hadde i sånne vanskelige situasjoner tidligere var midlertidige permitteringer dette dessverre ikke eee mulig,det mangel på forståelse av konkurranseutsett næringsutfordringar hos denne regjeringa presidenti trøndelag har store bedrifter som renere og abel gått til masse oppsigelser på grunn av lav ordring verkemiddel slike aktørar hadde i sånne vanskelege situasjonar tidlegare var midlertidet permiteringar dette dessverre ikkje eee mulig,12723.6,12751.2,27.600000000000364,2014-12-05,2014-12-05_proceedings.txt
Stortinget-20141205-085651_12751200_12779500,lengre med den regjeringa som har svekka permitteringsregelverket og gjort det dyrere å permittere ansatte dette for å kunne spare penger for siden å gi dette som skattekutt til de som har mest fra før avdet er grunnleggende usosialt for de mange høyt kompetente og dyktige mennesker plutselig står uten levebrødet sitt og en serviceindustri som mister god kompetanse,lengre med den regjeringa som har svekka permiteringsregelverket og gjort det dyrere å permitere ansatte dette for å kunne spare pengar for sidan å gi dette som skattekutt til dei som har mest framfør av det er grunnleggende usosialt fordi mange høgd kompetente og dyktige menneske plutseleg står utan levebrødet sitt og er ein servisindustri som mistar god kompetanse,12751.2,12779.5,28.299999999999272,2014-12-05,2014-12-05_proceedings.txt
Stortinget-20141205-085651_12779500_12808900,vi og arbeiderpartiet er også bekymret for at energiindustrien er blitt slephendt på hms og nødvendige vedlikehold for å spare penger i en lavkonjunktur som vi har nå det er derfor utrolig viktig den her regjeringa sette i verk tiltak for å eliminere dette etterslepet at den her regjeringa i sitt tildelingsbrev til petroleumstilsynet har fjerna henvisninga til norges ambisjon om å være verdensledende innen hms på sokkelen,vi av arbeidarpartiet er også bekymra for at energiindustrien har blitt slitent på hms og nødvendige vedlikehald for å spare pengar i ein lavkonjunktur som vi har no det er derfor utruleg viktig den her regjeringa sette i verk tiltak for å eliminere dette ettersleppet at den her regjeringa i sitt tildelingsbrev til petroleumstilsynet har fjerna henvisningar til noregs ambisjon om å vere verdsledande innan hms på sykkel,12779.5,12808.9,29.399999999999636,2014-12-05,2014-12-05_proceedings.txt
Stortinget-20141205-085651_12808900_12833600,er en klar svekkelse av ambisjonene på et svært viktig område president for å avhjelpe situasjonen for leverandørindustrien ber vi derfor eee eee om at regjeringa kommer tilbake til stortinget i totusenogfemten i revidert statsbudsjett med en sak om dette takkda er det stine renate håheim deretter helge pedersen,er ein klar svekkelse av ambisjonane på eit svært viktig områdepresident for å avhjelpe situasjonen for leverandørindustrien ber vi derfor eee eee om at regjeringa kommer tilbake til stortinget i totusenogfemten i revidert statsbudsjett med ein sak om dette takkdå er det stine renate håheim deretter helge pedersen,12808.9,12833.6,24.700000000000728,2014-12-05,2014-12-05_proceedings.txt
Stortinget-20141205-085651_12841800_12871800,takk president arbeiderpartiet vil ta norge i en mer miljøvennlig retning med mer til jernbane miljøteknologi skogvern og økt satsing på kollektiv og sykkel vi veit at stadig flere mennesker vilger å leve hele eller deler av livene sine i storbyene våre denne veksten i storbyen gir muligheter som kommer hele landet til gode arbeiderpartiet er derfor opptatt av å utvikle de unike mulighetene som finnes i våre største byområder,takk president arbeidarpartiet vil ta noreg i ein meir miljøvenleg retning med meir til jernbane miljøteknologi skogvern og økt satsing på kollektiv og sykkel vi veit at stadig fleire mennesker velger å leve heile eller delar av liva sine i storbyane våre denne veksten i storbyen gir muligheter som kommer heile landet til gode arbeidarpartiet er derfor opptatt av å utvikle dei unike mulighetene som finst i våre største byområde,12841.8,12871.8,30.0,2014-12-05,2014-12-05_proceedings.txt
Stortinget-20141205-085651_12871800_12898900,samtidig så utfordrer befolkningsveksten oss vi ser nå at vi har store utfordringer med boligmangel i de store byene som presser prisene opp og gjør at altfor mange ikke kommer seg inn på boligmarkedet og vi ser at transportbehovene øker og når vi veit at verdens byer står for sytti prosent av de globale klimagassutslippene så blir det helt åpenbart at byene våre er sentrale iklimakrisen,samtidig så utfordrar befolkningsveksten oss vi ser no at vi har store utfordringar med boligmangel i dei store byane som presser prisene opp og gjer at alt for mange ikkje kommer seg inn på bolemarkedet og vi ser at transportbehovet aukar og når vi veit at verden spyr står for sytti prosent av dei globale klimagassutslippene så blir det heilt openbert at byane våre er sentrale iklimakrisen,12871.8,12898.9,27.100000000000364,2014-12-05,2014-12-05_proceedings.txt
Stortinget-20141205-085651_12898900_12927800,skal vi lykkes i klimakampen må på transport persontransportveksten i storbyene tas med kollektiv sykkel og gange og arbeiderpartiet mener at tiden er overmoden for å bruke sterkere virkemidler for en miljøvennlig vekst i byene vi vil føre en offensiv storbypolitikk som bidrar til et grønt skifte og som samtidig gjør at hverdagen til folk går i hop det må bli enklere å ta kollektiv til og fra jobb og det må bli tryggere å både gå og sykle i byene,skal vi lykkast i klimakampen må på transport persontransport veksten i storbyane tast med kollektiv sykkel og gange og arbeidarpartiet meiner at tiden er overmoden for å bruke sterkare verkemiddel for ein miljøvennleg vekst i byane vi vil føre ein offagensiv storbypolitikk som bidrar til eit grønt skifte og som samtidig gjer at vardagen til folk går i hop det må bli enklare å ta kollektiv til og frå jobb og det må bli tryggare å både gå og sikle i byane,12898.9,12927.8,28.899999999999636,2014-12-05,2014-12-05_proceedings.txt
Stortinget-20141205-085651_12927800_12952000,dessverre så ser det ut til at regjeringa ikke helt har tatt inn over seg at vi må gjøre større grep i storbyene regjeringa har kun foreslått sytti millioner til bymiljøavtaler og i tillegg kutt til viktige sykkelsatsinger arbeiderpartiet mener vi må ta to store grep vi må ta staten må ta et større ansvar for utbygging av kollektiv i storbyene våre,dessverre så ser det ut til at regjeringa ikkje heilt har tatt innover seg at vi må gjere større grep i storbygde regjeringa har kun føreslått sytti millionar til bymiljøavtalar og i tillegg kutt til viktige sykkelsatsinga arbeidarpartiet meiner vi må ta to store grep vi må ta staten må ta eit større ansvar for utbygging av kollektiv i storbygavåre,12927.8,12952.0,24.200000000000728,2014-12-05,2014-12-05_proceedings.txt
Stortinget-20141205-085651_12952000_12980100,og vi er nødt til å bygge mer rundt kollektivknutepunktene det blir litt meningsløst når høyresida i bærum stemmer ned en forslag etter forslag om eksempelvis å bygge mer langs kolsåsbanen arbeiderpartiet mener derfor at staten etter dialog med kommunene skal finansiere opp til sytti prosent av investeringene på viktige infrastrukturtiltak hvis kommunene forplikter seg til boligbygging langs knutpunktene,og vi er nøydd til å bygge mer rundt kollektivknutepunkta det blir litt meningslaust når høgresida i bærum stemmer ned ein forslag etter forslag om eksempelvis å bygge meir langs kolsåsbanen arbeidarpartiet meiner derfor at staten etter dialog med kommunane skal finansiere opp til sytti prosent av investeringane på viktige infrastrukturtiltak viss kommunane forpliktar seg til bolebygging langs knutpunkte,12952.0,12980.1,28.100000000000364,2014-12-05,2014-12-05_proceedings.txt
Stortinget-20141205-085651_12980100_13009500,det er jo et slags kindregg eee president fordi det bidrar til både miljøvennlig vekst i storbyene samtidig som det blir flere boliger og hverdagen til folk flest blir enklere tre gode ting på en gang og vi følger også opp med penger vi har foreslått en milliard kroner mer enn regjeringa til de viktige bymiljøavtalene så helt til slutt president så vil jeg si at for oss som jobber med kommunal politikk til det daglige,det er jo eit slags eee kinderegg eee president fordi det bidrar til både miljøvennleg vekst i storbyane samtidig som det blir fleire boliger og kvardagen til folk flest blir enklare tre gode ting på ein gong og vi følger også opp med pengar vi har foreslått ein milliard kroner meir enn regjeringa til dei viktige bymiljøavtalane så heilt til slutt president så vil eg si at for oss som jobbar med kommunal politikk til det daglege,12980.1,13009.5,29.399999999999636,2014-12-05,2014-12-05_proceedings.txt
Stortinget-20141205-085651_13009500_13032500,så er eee arbeiderpartiets forslag om femti millioner til kartlegging av norsk natur svært gledelig i dag er bare en fjerdedel av norsk natur kartlagt det gjør arealforvaltningen betydelig mye vanskeligere i mange kommuner så det syns vi er kjempebra både for å unngå konflikter og for å gjøre det billigere og smarterehelga pedersen deretter sveinung rotevatn,så er eee arbeidarpartiets forslag om femti millionar til kartlegging av norsk natur svært gledeleg i dag er bare ein fjerdel av norsk natur kartlagt det gjer arealforvaltninga betydeleg mye vanskelegare i mange kommunar så det synest vi er kjempebra både for å unngå konfliktar og for å gjere det billigare og smart ve helga pedersen deretter svine jovan,13009.5,13032.5,23.0,2014-12-05,2014-12-05_proceedings.txt
Stortinget-20141205-085651_13038600_13064400,president jeg tar ordet på grunn av situasjonen til villaksen og nærmere bestemt tanalaksen over tid så har utviklinga for villaksen i tana vært dårligere enn i sammenlignbare norske vassdrag situasjonen er spesielt alvorlig for bestandene i de øvre delene av vassdraget,president eg tar ordet på grunn av situasjonen til villaksen og nærmare bestemt tanalaksen over tid så har utviklinga for villaksen i tana vore dårlegare enn i samanleggbare norske assdrag situasjonen er spesielt alvorleg for bestandane i dei øvre delane av vassdraget,13038.6,13064.4,25.799999999999272,2014-12-05,2014-12-05_proceedings.txt
Stortinget-20141205-085651_13064400_13092100,og det skyldes i all hovedsak et for omfattende fiske laksefisket i tanavassdraget har siden attensyttitre vært regulert gjennom bilaterale avtaler mellom norge og finland den nåværende avtalen trådte i kraft i nittennitti og det er enighet med finland om at den nå bør oppdateres og tilpasses nasjonale og internasjonale prinsipper og retningslinjer forkseforvaltninga,og det skyljast i all hovudsak eit for omfattande fiske laksefisket i tanamassdraget har sidan attensyttitre vore regulert gjennom bilaterale avtaler mellom noreg og finland den noverende avtalen trådde i kraft i nittennitti og det er einigheit med finland om at det nu bør oppdaterast og tilpasses nasjonale og internasjonale prinsipp og retningslinjer forkseforvaltninga,13064.4,13092.1,27.700000000000728,2014-12-05,2014-12-05_proceedings.txt
Stortinget-20141205-085651_13092100_13115900,og hovedformålet med forhandlingene vil være å sikre at fisket i vassdraget til enhver tid er bærekraftig i tjueti så blei det altså oppnådd enighet mellom den norske og finske regjeringa om å starte reforhandlinger om tanaavtalen av nittenåttini etter to og et halvt år med forhandlinger er det så langt vi vet ikke utsikter til ny avtale om fisket i tanavassdraget,og hovudformålet med forhandlingane vil vere å sikre at fisket i vassdraget til enver tid er berekraftig i tjueti så blei det altså oppnått einigheit mellom den norske og finske regjeringa om å starte reforhandlingar om taneavtalen av nittenåttini etter to og eit halvt år med forhandlingar er det så langt vi veit ikkje utsikter til ny avtale om fisket i tanavassdraget,13092.1,13115.9,23.799999999999272,2014-12-05,2014-12-05_proceedings.txt
Stortinget-20141205-085651_13115900_13138500,i vår spurte miljøvernministeren om fremdrifta i forhandlingene og statsråden svarte da at konklusjonene ville bli trukket i september tjuefjorten nå er vi i desember tjuefjorten og fortsatt er ingen konklusjoner trukket når forhandlingene ikke har ført frem så bør det settes mere trykk og flere ressurser inn i reforhandlingene om tana overens,i vår spurta miljøvernministeren om framdrifta i forhandlingane og statsråden svarte då at konklusjonane ville bli trukket i september tjuefjorten nu er vi i desember tjuefjorten og fortsatt er ingen konklusjonar trukke når forhandlingane ikkje har ført fram så bør det settast meir trykk og fleire ressursar inn i reforhandlingane om tana overens,13115.9,13138.5,22.600000000000364,2014-12-05,2014-12-05_proceedings.txt
Stortinget-20141205-085651_13138500_13163400,komsten og jeg håper derfor at miljøvernministeren eee her i dag kan si noe om hvordan hun har tenkt å løyse de forhandlingene og ny avtale om fisket i tana elvas grenseelvområde og eee også svaret på om hun vil ta initiativ til å si opp avtalen dersom forhandlingene ikke fører fremda er det sveinung rotevatn og deretter tina bru,komsten og eg håpar derfor at miljøvernministeren eee her i dag kan seie noko om korleis ho har tenkt å løyse dei forhandlingane og ny avtale om fisket i tanaelvas grenseelvområde og eee også svare på om ho vil ta initiativ til å seie opp avtalen dersom forhandlingane ikkje fører fremda er det svin hovudvåpen og deretter tine bru,13138.5,13163.4,24.899999999999636,2014-12-05,2014-12-05_proceedings.txt
Stortinget-20141205-085651_13176800_13204200,takk president eee jeg tar ordet for å etter å ha hørt den debatten så synes det som en del representanter eee fra arbeiderpartiet lever i den villfarelsen at jeg har levert et ambisiøst klima og miljøbudsjett for det første så er det litt vanskelig å vite hvem jeg skal forholde meg til president er det representanten aukrust som var det et innlegg som sikker at representantenle reist seg og klappe for vi sånn,takk president eee eg tar ordet for å etter å ha høyrt denne debatten så synest eg som ein del representantar eee frå arbeidarpartiet lever i den villfarelsen at det er levert eit ambisiøst klima og miljøbudsjett for det første så er det litt vanskeleg å vite kven eg skal forholde meg til president er det representanten aukrust som hadde eit innlegg som sikkert representantenle reiste seg å klappa for viss han,13176.8,13204.2,27.400000000001455,2014-12-05,2014-12-05_proceedings.txt
Stortinget-20141205-085651_13204200_13230300,kunne det eee det representanten henriksen som leverer et innlegg som norsk olje og gass ville reist seg og klappe for om de var til stede skal jeg forholde meg til arbeiderpartiet sitt primære statsbudsjett president eller skal jeg forholde meg til den justerte versjonen av budsjettet tilleggsproposisjonen om det vil som jeg så seg nødt til å komme med etter å ha sett hvor ambisiøst det borgerlige budsjettforliket blei innafor miljø innafor flyktningpolitikk innafor utdan,kunne det eller er det representanten henriksen som leverer eit innlegg som norsk olje og gass ville reise seg å klappe for om dei var til stede skal eg forholde meg til arbeidarpartiet sitt primære statsbudsjett president eller skal eg forholde meg til den justerte versjonen av budsjettet tilleggsproposisjonen om det vil for det står seg nødt til å komme med etter å ha sett kor ambisiøst dei borgerlege budsjettfor like blei innanfor miljø innanfor flyktningpolitikk innanfor utdan,13204.2,13230.3,26.099999999998545,2014-12-05,2014-12-05_proceedings.txt
