file,text_bm,text_nn,start,end,duration,date,proceedingsfile
Stortinget-20160203-095323_6767300_6795500,og siden i fjor høst har tyrkia også selv deltatt i luftangrepene mot bakkemål i syria qqqbøhler ja jeg takker for svaret president det er eee eee riktig at eee det var et angrep i nå eee i vinter i eee hovedstaden i tyrkia og at i og det ifølge aftenposten så var det da for første gang at eee i tyrkia,og sidan i fjor haust har tik også sel deltatt i luftangrepe mot bakkemål i syrien møhler ja eee takkar for svaret president det her eee eee riktig at eee det var eit angrep i no eee i vinter i hovudstaden i tyrka og at i når du ifølge aftenposten så var det da for første gong at det i tyrka,6767.3,6795.5,28.199999999999818,2016-02-03,2016-02-03_proceedings.txt
Stortinget-20160203-095323_6795500_6821900,eee gjennomført eee angrep mot is eller isil på på i i i syria og jeg håper jo at det vil være en utvikling som blir eee klarere at eee tyrkia trapper opp sin innsats men det er dokumentert i omfattende eee reportasje blant annet i aftenposten hvordan eee det importeres tusenvis av isstyrker via denne åpne,eee gjennomført angrep mot is eller isil på på i i i syria og eg håpar jo at det vil vere ein utvikling som blir eee klarere at tyrka trapper opp sin innsats men det er dokumentert omfattande eee reportasje blant anna i aftenposten worde eee det importerast tusenvis av estyrkar via denne opne,6795.5,6821.9,26.399999999999636,2016-02-03,2016-02-03_proceedings.txt
Stortinget-20160203-095323_6821900_6851700,av eee tyrkiske grenser mot syria som ligger åpen for det og eee og det er beskrevet et system med en portvakt og så videre og og eee dette er jo så avgjørende for kampen mot terror både i syria men også her i europa at det ikke er en ferdsel ut og inn der at jeg eee vil eee spørre hvordan man når man sier man har tatt opp med tyrkia eee hvo mer inngående om man har fortalt hvordan egentlig situasjonen er,av eee tyrkiske grense mot syria som ligg open for det og eee og de beskriv et eit system med ein portvakt og så vidare og og dette er jo så avgjerande for kampen mot terror både i syria men også her i europa at det ikkje er ein fengsel ut og inn der at ei eee vil eee spørje vorden ein om ein seier ein har tatt opp med tyrka eee ve med inngåande om ein har fortalt borda eigentleg situasjonar,6821.9,6851.7,29.800000000000182,2016-02-03,2016-02-03_proceedings.txt
Stortinget-20160203-095323_6851700_6875400,statsråd isaksen preside president eee jeg har jo da ikke detaljer om eee samtalene mellom eee tyrkia eee og utenriksministeren men eee mer overordnet eee sett så eee kan jo dette også henge sammen med flyktningsituasjonen og tyrkia har jo tatt imot flere flyktninger,asaisasenpresid president eee ja høyr de ikkje detaljar om eee samtalane mellom eee tyrka eee og utanriksministeren men eee mer overordna sett så eee kan jo dette også henge saman med flyktningsituasjonen og tyrka har jo tatt imot fleire flyktningar,6851.7,6875.4,23.699999999999818,2016-02-03,2016-02-03_proceedings.txt
Stortinget-20160203-095323_6875400_6898400,eee de fleste syrere oppholder seg i urbane strøk der eee cirka tre hundre tusen som oppholder seg i leire også eee så vet vi at tyrkiske myndigheter også er opptatt av grensene sine eee det er også en problemstilling knyttet til tyrkiske myndigheter og dialogen med tyrk med kurdiske representanter den dialogen er dessverre lagt på is,eee dei fleste syre oppholder seg i urbane strøk der eee cirka tre hundre tusen små oppholder seg i leire også eee så veit vi at tyrkiske myndigheiter også er opptatt av grensene sine eee det er også ein problemstilling knytt til tyrkiske myndigheiter og dialogen med tyrk med kurdiske representantar den dialogen er dessverre lagt på is,6875.4,6898.4,23.0,2016-02-03,2016-02-03_proceedings.txt
Stortinget-20160203-095323_6898400_6924400,etter to år med våpenvil og tilhørende dialog så kom det i fjor sommer igjen til direkte konfrontasjoner mellom pkk og tyrkiske sikkerhetsstyrker fra norsk side så mener vi at partene burde gjenoppta den fredlige dialogen bøhler jeg takker for eee for svaret og og har forståelse for at det er kunnskapsministeren som svarer da og ikke er inne i detaljene men i dette området her så vil jeg gjerne si at,etter to år med våpenvile og tilhøyrande dialog så kom det i fjor same gjen til direkte konfrontasjonar mellom pkk og tyrkiske sikkerheitsstyrker frå norsk side så meiner vi at partane burde gjenoppta den fredelege dialogenbøhlerg takker for for svaret og har forståelse for at det er kunnskapsministeren som svare og ikkje inne i detaljane men i dette området her så vil gjerne si at,6898.4,6924.4,26.0,2016-02-03,2016-02-03_proceedings.txt
Stortinget-20160203-095323_6924400_6948300,er jo de som på bakken yter den mest effektive motstanden mot is i i eee i syria og eee de de behersker jo hele grenseområdet på syrisk side langs tyrkiske grensa utenom disse nitti eller over nitti kilometrene og det er tyrk det er jo ikke pkk men kurdiske ypgstyrker som eee kjemper her og det er helt klart at tyrkia også,er jo dei som på bakken yter den mest effektive motstanden mot is i i i syria og det dei beherskar jo heile grenseområdet på syrisk side eee langs tyrkiske grensa utanom desse nitti eller over nitti kilometerane og det er uttykt det er jo ikkje pkk med den kurdiske ypgstyrke som eee kjemper her og dei har klart at tyrk også,6924.4,6948.3,23.900000000000546,2016-02-03,2016-02-03_proceedings.txt
Stortinget-20160203-095323_6948300_6976700,eee med militære midler holder eee eee kurderne tilbake i forhold til å kunne beherske også disse delene av grenseområdene på syrisk side og derved få kontroll med med importen og eksporten av av fremmedkrigere så så eee det er en dobbelkommunikasjon fra fra tyrkias side som jeg tror er åpenbar for det internasjonale samfunnet obama må til try ty til veldig sterkt press for at det i hele tatt skulle slippes i noe forsterkninger da kampen om kobane sto via tyrkia,eee med militære midler holder eee kurane tilbake i forhold til å kunne beherske også desse delen av grenseområda på syrisk side og der vi får kontroll med med importen og eksporten av av fremmedkrigarar så så eee det er ein dobbelkommunikasjon frå frå tyrka side som eg trur eg er openbar for det internasjonale samfunnet obame om å til tryt tyte veldig sterkt press for at det helta skulle slippe si noe forsterkningar da kampen om kobane sto vi av tyke,6948.3,6976.7,28.399999999999636,2016-02-03,2016-02-03_proceedings.txt
Stortinget-20160203-095323_6976700_7002400,så jeg vil bare appellere til eee til regjeringen om å gjøre det klarere at man må få slutt på dobbelkommunikasjon fra tyrkias side presidenten ber om at taletid over isaksen president eee jeg vil nok ikke være passende om jeg begir meg ut i en analyse av eee verken den internasjonale situasjonen eller norsk utenrikspolitikk men bare understreke at jeg heller ikke kan eee skrive under på,så jeg vil berre appulere til eee til regjeringa om å gjere det klarere at ein eee må få slutt på dobbelkommunikasjon frå tyrkias side presidenten ber om taletid overlet isaksen president eee vil eg ikkje vere passande og me begimeg ut i ein analyse av eee verken den internasjonale situasjonen eller norsk utanrikspolitikk men berre understreka at eg heller ikkje kan eee skrive under på,6976.7,7002.4,25.699999999999818,2016-02-03,2016-02-03_proceedings.txt
Stortinget-20160203-095323_7002400_7026000,eee ordbruken til representanten bøhler om eee om dobbeltkommunikasjon eee jeg tror jeg skal nøye meg med å konstatere at norge har en eee bekymring for situasjonen i regionen eee dette påvirker også oss det er en av de største humanitære krisene men det er også en sikkerhetstrussel mot norge eee blant annet gjennom eee fremmedkrigerne,eee ordbruken til representanten bøhler om eee om dobbelkommunikasjon eee eg trur eg skal nøye meg med å konstatere at noreg har ein bekymring for situasjonen i regionen eee dette påverkar også oss det er ein av dei største humanitære krisene men det er også ein sikkerhetstrussel mot noreg eee blant anna gjennom eee fremmedkrigarane,7002.4,7026.0,23.600000000000364,2016-02-03,2016-02-03_proceedings.txt
Stortinget-20160203-095323_7026000_7051500,og at norge har en eee nær og eee tett dialog med tyrkia eee eksemplifisert gjennom utenriksministerens besøk i ankara tolvte januar eee og at det også er naturlig iom at tyrkia er en av våre natoallierte da går vi til spørsmål nummer tre fra representanten heikki eidsvoll holmås til klima og miljøministeren som besvares av helse og omsorgsministeren på vegne av klima og miljøvernministeren,og at noreg har ein eee nær og eee tett dialog med tyrka eksemplifisert gjennom utanriksministerens besøk i ankara tolvte januar eee og at det også er naturleg i og med at tyrk er ein av våre nato allierte da til spørsmål nummer tre frå representanten heiki eidsvold hamos til klima og miljøministeren som besvares av helse og omsorgsministeren på vegner av klima og miljøvernministeren,7026.0,7051.5,25.5,2016-02-03,2016-02-03_proceedings.txt
Stortinget-20160203-095323_7056400_7083700,ja president da holder jeg meg til manus og stille følgende spørsmål gruveselskapet nordic mining har varslet at de starter med boringer i engebøfjellet i nausdal til tross for at regjeringen ennå ikke har behandlet klagen på utslippstillatelsen i statsråd klagen til eftadomstolen om brudd på vanndirektivet er heller ikke behandlet mener statsråden det er greit å starte opp gruvevirksomheten selv om ikke klagene er avg statsråd bent høie,ja president då holder eg meg til manus å stille følgjande spørsmål gruveselskapet nordic meining har varsla at dei starta med boringar i engebøfjellet i nesdal til tross for at regjeringa enno ikkje har behandla ei klage inn på utsleppstestatelsen i statsråd klagen til efterdomstolen om brudd på vanndirektivet er heller ikkje behandla meiner statsråden det er greit å starte opp gruvevirksomheten sjøl om ikkje klagene er av takfråd bent høie,7056.4,7083.7,27.300000000000182,2016-02-03,2016-02-03_proceedings.txt
Stortinget-20160203-095323_7083700_7110800,president eee da holder jeg og meg til mane å svare på spørsmålet og jeg har fått opplyst at nordic minings heleide dataselskap nordic rotele har til hensikt å starte et borrogram på pro borreprogram i februar og mars totusenogseksten for å oppgradere ressursestimatene for engbøfjellet nordic rutile har utvinningsrett etter mineralloven til forekomsten i engbefjellet utvinningsretten innebærer at mføre boringer,president da holder eg og meg til manus og svare på spørsmålet og eg har fått opplyst at nordic meinis heleide datorselskap nordic rutil har til hensik til å starta eit borgramobprogram i februar mars totusenogseksten for å oppgradere ressurs estimatene frå engebøfjellet nordek rutil har utvinningsrett etter mineralloven til forekomsten i engebøfjellet utvinningsretten inneber at mføra baringar,7083.7,7110.8,27.100000000000364,2016-02-03,2016-02-03_proceedings.txt
Stortinget-20160203-095323_7110800_7140700,å ta ut mindre mengder masser for å gjennomføre undersøkelser som inngår i en forberedende fase til drift det er ikke nødvendig med tillatelse etter forurensningsloven for å gjennomføre undersøkelsesarbeider som for eksempel boring for øvrig kan det bemerkes at vedtak om tillatelse etter forurensningsloven til gruvevirksomheten i engebøfjellet ikke har blitt gitt utsatt iverksettelse på grunn av klagene det betyr at nordic mining har anledning til å ta i bruk tillatelsen deres selv om klagen ikke er avgjort,og ta ut mindre mengder masse for å gjennomføre undersøkelser som inngår i den forberede fasar til drift det er ikkje nødvendig med tillatelse ette foresingslovan for å gjennomføre undersøkelsarbeidet som for eksempel borring for øvrig kan det b merkast at vedtak om tillatelse et forrensingslova til gruvevirksomheten i engebøfjellet ikkje har blitt gitt utsett i verksettelse på grunn av klagene det betyr at nordisk meining har anledning til å ta i bruk til laten som deira sjølv om klagen ikkje er avgjort,7110.8,7140.7,29.899999999999636,2016-02-03,2016-02-03_proceedings.txt
Stortinget-20160203-095323_7140700_7165200,at beklaget til esa endrer ikke på selskapets utvinningsrett og heller ikke vår vurdering av utsatt iverksettelse holmås president fjorden våre er noe av det kjæreste har vi har og derfor så takker jeg for svaret fra eee fra statsråden og det er jo også derfor eee at aksjonistene akkurat nå er borte og protesterer i eee i mot gruvedumpingen i førdefjorden,at det klage det er sa endrar ikkje på selskapets utvinningsrett og heller ikkje vår vurdering av utsett i verksettese om år president fjorden vår er no av det kjæraste eg har vi har og derfor så takkar eg for svaret frå eee frå statsråden og det er også derfor eee at aksjonisten akkurat no er borte og protesterer i eee i mot gruvedumpinga i førdefjorden,7140.7,7165.2,24.5,2016-02-03,2016-02-03_proceedings.txt
Stortinget-20160203-095323_7165200_7180700,eee og bers vekk og jeg synes det er bra at ungdommen og de lokale er å gir så til klar tilbakemelding så selv om vi noe som ønsker å bruke fjordene våre til å dumpe gruveavfall i så må vi et minimere grundig saksbehandling gruveselskapet nussir,eee og bera vekk eg synes det er bra at ungdomane og dei lokale er og gir så tilb klar tilbakemelding så sånn om vi noko som ønsker å bruke fjordene våre til å dope gruva falle i så må e mini vere grundig saksbehandling gruveselskapet nussir,7165.2,7180.7,15.5,2016-02-03,2016-02-03_proceedings.txt
Stortinget-20160203-095323_7180700_7201900,utslippstillatelse for koberggruve og tjue deponi i repparfjorden er hammerfest i finnmark og i utslippstillatelsen så blir selskapet påløkt å gjøre en miljørisikoanalyse for hvilke konsekvenser dette vil ha for førdefjorden i sunnfjord rundt tretten hundre kilometer lenge sør mitt spørsmål er derfor er det grunn for venner og livet førdefjorden til å frykte forurensningen fra den planlagte dump i finnmark,utsleppstillatelsen frå kopargruve og sjuedeponi i repparfjorden nær hamafest i finnmark og i utsleppstillatelsen så blir selskapet pålø til å gjere ein miljørisikoanalyse på kva konsekvensar dette vil ha for førdefjorden i sulfjord rundt tretten hundre kilometer lenger sør mitt spørsmål er derfor er det grunn for vernar av livet i førdefjorden til å frykte forurensinga frå den planlagde dump i finnmark,7180.7,7201.9,21.199999999999818,2016-02-03,2016-02-03_proceedings.txt
Stortinget-20160203-095323_7201900_7231700,eller er det et uttrykk for regjeringens politikk når man gir utslippstillatelser til gruveselskapet på autopilot gjennom å klippe og lime fra den ene tillatelsen til den andre statsråd høie eee president eee jeg for håper for forståelse fra representanten på at eee det er et spørsmål eee som eee jeg som eee statsråd ikke kan svare på en eee svare på når det gjelder et spørsmål som går på en annen statsråd sitt ansvarsområde og på et så detaljnivå at jeg ikke har oversikt over det herre nå holmås,eller er det eit uttrykk for regjeringas politikk når me gir utsleppstillatelser til gruveselskap på autopilot gjennom å klippe og lime frå den eine tillatelsen til den andre statsråd høgre eee president eee eg får håpe å forstå også frå representanten på at det det er eit spørsmål eee eee som eee eg som eee statsråden ikkje kan svara på ein eee svar på når det er eit spørsmål som går på ein ansvarsråd sitt ansvarsområde og kva er så detaljnivå at eg ikkje har oversikt over det her og no hold mor,7201.9,7231.7,29.800000000000182,2016-02-03,2016-02-03_proceedings.txt
Stortinget-20160203-095323_7231700_7250100,det er jo jeg får respektere det svaret fra fra bent høie eee men eee hvis jeg kan stille et oppfølgingsspørsmål til berg høie som handler om hans rolle som helseminister for som helseminister så er de er jo bent høie kjent med at det å forebygge skader det er langt å foretrekke fremfor å reparere skader,eee eg får respektere det svaret frå frå vertøyet eee men viss eg kan stille til oppfølgingsspørsmål til å bera høye som handlar om hans rolle som helseminister for som helseminister så er de er jo bent høge kjent med at det er å førebygge skade det er langt å føretrekke framfor å reparere skader,7231.7,7250.1,18.400000000000546,2016-02-03,2016-02-03_proceedings.txt
Stortinget-20160203-095323_7250100_7279900,og noe av det vanskeligste og dyreste en miljøvernministeren i regjering gjør er å for sør å re forsøke å reparere gamle skader i norske fjorder massiv dumping av gruva farlig førde og fjorden vil legge store områder av fjordbyen død og hindre at nytt liv får fotfeste og i tjuefjorten så skrev derfor miljødirektoratet de miljøfaglige hensynene tilsier at innsigelsen som er reist mot planen om deponering av gruveavfall i førdefjorden i sogn og fjordane bør tas til følge en av grunnene er at truer arter som blålang og pigghård gyter oppvekstområder i det planlagte deponiet,og no er det vanskeleg så dyreste ein miljøvernminister i regjeringa gjer er å forsøke forsøke å reparere gamle skader i norske fjordar massiv dumping av gruveavfall i førdøfjorden vil legge store område av fjordbønder dø og hindre at nytt liv får fotfeste og i tjuefjorten så skrev derfor miljødirektoratet dei miljøfaglege hensyn tilsier at innsigelsen som er reist mot planen om deponering av gruveavfall i førefjorden i sogn og fjordane bør tast til følge ein av grunnane er at truede arter som blålange og pig hhar gyte oppvekstområda i det planlagde deponiet,7250.1,7279.9,29.799999999999272,2016-02-03,2016-02-03_proceedings.txt
Stortinget-20160203-095323_7279900_7309000,venstreleder trine skei grande sier følgende om gruvedumping førdefjorden jeg skal bruke hver trevl i kroppen min for å stoppe dette mitt spørsmål er derfor har regjeringen støtte i sitt parlamentariske grunnlag venstre og kristelig folkepartiet til å tillate sjødeponi i førdefjordstatsråd høie president eee dette er en eee sak som eee som eee avgjøres av eee av regjeringen og klima og miljødepartementet ga femte juni totusenogfemten etter søknaden for nadic mining,venstreleiar trine skei grande seier følge om gruvedumping i førdefjorden eg skal bruke ver trevl i kroppen min for å stoppe dette mitt spørsmål er derfor har regjeringa støtte i sitt parlamentariske grunnlag venstre og kristeleg folkepartiet til å tillate sjødeponi i førdefjorden statsråd høie president eee dette er ein sak som eee som eee avgjers av eee av regjeringa og klima og miljødepartementet gav femte juni totusenogfemten etter søknaden for nådig meining,7279.9,7309.0,29.100000000000364,2016-02-03,2016-02-03_proceedings.txt
Stortinget-20160203-095323_7309000_7334400,tillatelse etter forøyslovens grue virksomhet gjengbefjellet og tillatelse med vilkår ble gitt på grunnlag av de anbefalingene fra miljødirektoratet av trettende februar totusenogfemten alle de spørsmålene som representanten her tar opp har jo selvfølgelig vært grundig vurdert i forkant eee av dette og at den regjeringen sin oppfatning er at dette er en eee næringsvirksomhet som det går an å drive innen forbi,tillatelse etter foreslås og gruveverksomhet i engebøfjellet og tillatelse med vilkår blir gitt på grunnlag av dei anbefalingane frå miljødirektoratet av trettende februar totusenogfemten alle dei spørsmåla som representanten her tar opp har jo selvfølgelig vart grundig vurdert i forkant av dette og at ein eee regjeringa si oppfatning er at dette er ein næringsvirksomhet som det går an å driva innanforbi,7309.0,7334.4,25.399999999999636,2016-02-03,2016-02-03_proceedings.txt
Stortinget-20160203-095323_7334400_7363700,eee de det regelverket som vi har i norge knytta til eee til til forurensningsloven og så er det og viktig at arbeidsplasser på vestlandet er helt avgjørende eee dette er og noe som har sterk støtte i sitt eee i lokalmiljøet som helseminister så er i hvert fall veldig trygg på at det har noen jobb å gå til det er veldig viktig for helseda går vi til spørsmål fire representanten marianne aasen til helse og omsorgsminister bent høie aasen,eee dei eee det regelverket som me har i noreg knytt til eee til til forurensingslova og så er det og viktig at arbeidsplassar på vestlandet er heilt avgjerande eee dette er og noko som har sterk støtte i sitt eee eee i lokalmiljø som helseministeren så er i kvart fall veldig trykk på at det han har jobb å gå til det er veldig viktig for helse nå går i ke spørsmål fire representanten marianne aasen til helse og omsorgsminister bent høie aasen,7334.4,7363.7,29.300000000000182,2016-02-03,2016-02-03_proceedings.txt
Stortinget-20160203-095323_7363700_7393500,president forskning er å redde liv ved at nye medisiner utvikle utvikles slik at mange kan leve lenger og med bedre livskvalitet disse medisinene er dyre og flere pasienter har den siste tiden stått fram og fortalt om kreftmedisiner som er godkjent i norge men som ikke refunderes her i motsetning til i mange andre land de kan koste opp mot femti tusen kroner per dose,president forskinga på rede liv ved at nye medisiner utvikla utviklast slik at mange kan leve lenger og med betre livskvalitet dise medisinen er dyre og fleire pasientar har den siste tida stått fram og fortalt om kreftmedisinar som er godkjent i noreg men som ikkje refunderast her i motsetning til mange andre land dei kan koste på opp mot femti tusen kroner per dose,7363.7,7393.5,29.800000000000182,2016-02-03,2016-02-03_proceedings.txt
Stortinget-20160203-095323_7393500_7422500,arbeiderpartiet har foreslått at norge tar initiativ på europeisk nivå til å få til et innkjøpssamarbeid hvordan stiller statsråden seg til det statsråd bent høie president utvikling av nye metoder nye medisiner og nye behandlingsformer er grunnleggende positivt det gir mulighet til å behandle flere pasienter og nye pasientgrupper samtidig kan det være en utfordring å forene de mulighetene som den medisinskteknologiske utvikling tilbyr med de ressursene som helsetjenesten hadde rådighet,arbeidarpartiet har føreslått at noreg ta initiativ på europeisk nivå til å få til eit innkjøpssamarbeid vore stille statsråden sei til det statsråd bent høge president utvikling av nye metodar nye medisinar og nye behandlingsformar er grunnleggjande positivt det gir mulighet til å behandle fleire pasientar og nye pasientgrupper samtidig kan vera ein utfordring å forene dei mulighetene som den medisinsk teknologiske uttrykk tilbyr med dei ressursane som helsetjenesten hadde rådighet,7393.5,7422.5,29.0,2016-02-03,2016-02-03_proceedings.txt
Stortinget-20160203-095323_7422500_7452300,vi har derfor etablert nasjonale systemer og regler i norge for å sikre en likeverdig tilgang til legemidler i spesialisthelsetjenesten og gjennom de trygde baserte refusjonsordningene andre europeiske land står in forbi akkurat de samme utfordringene knytta til å forene muligheter og ressurser samarbeid mellom europeiske land på legemiddelområdet vil kunne være et bidrag til å dempe disse utfordringene temaet blir og regelmessig diskutert på de uformelle euministermøtene i eu og møtene i oecd,me har derfor etablert nasjonale systema og reglar i noreg for å sikre ein likeverdig tilgang til legemiddel i spesialistteneste og gjennom dei trygde baserte refeksjonsordningane andre europeiske land står forbi akkar dei same utfordringane knytt til forene muligheter og ressursar samarbeidet mellom europeiske land på legemiddelområde vil kunne vere eit bidrag til å dempa desse utfordringane temaet blir og regelmessig diskutert på dei uformelle euministermøtane i eu og møtene i cd,7422.5,7452.3,29.800000000000182,2016-02-03,2016-02-03_proceedings.txt
Stortinget-20160203-095323_7452300_7480200,som jeg deltar på jeg er kjent med at verdens helseorganisasjon i europa vil invitere til et møte høsten totusenogseksten om strategisk innkjøp av legemidler med sikte på at europeiske land kan utvikle informasjon og lærer av hverandre og på nordisk nivå er det oppmerksomhet om disse spørsmålene og i høst beslutta de nordiske ministrene i nordisk ministerråd å kartlegge landets erfaringer på legemiddelområdet og identifisere gjennom det muleter for samarbeid framover,som me deltar på eg er kjent med at verdas helseorganisasjon i europa ville invitera til eit møte hausten totusenogseksten om strategiske innkjøp av legemiddel med sikte på at europeiske land kan utvikle informasjon og lære av kvarandre og på nordisk nivå er det oppmerksomhet om desse spørsmåla og i haust beslutta dei nordiske ministeren i nordisk ministerråd å kartlegge landets erfaringar på legemiddelområde og identifisere gjennom det mulheter for samarbeid framover,7452.3,7480.2,27.899999999999636,2016-02-03,2016-02-03_proceedings.txt
