file,text_bm,text_nn,start,end,duration,date,proceedingsfile
Stortinget-20161026-095635_6574300_6604300,bare fra totusenogfemten til totusenogseksten så fikk hundre tusen husstand av tilbud om fiberaksess som ikke hadde hatt før det ble investert to komma sju milliarder kroner i fibernettet i tjuefemten som en økning på to hundre millioner kroner for året før altså et jevnt et godt og høyt nivå på dette og for meg så handler det om å sørge for at det er attraktivt for telekom aktørene å investere i norge framfor å gjøre dette til en debatt om hva som er den statlige støtteordningen så er det riktig at det kommet mer søknad om støtte,berre frå totusenogfemten til totusenogseksten så fekk hundre tusen husdannar tilbod om fibres som ikkje hadde før det blei investert to komma sju milliardar kroner i fibra nett i tjuefemten som er ein økning på to hundre millionar kroner for året før altså eit gjemt eit godt og høgt nivå på dette og for meg så handlar det om å sørge for at det attraktivt for telekomaktørane å investera i noreg framfor å gjere dette til ein debatt om kva som er den statlege støtteordninga så er det riktig at det har komme inn meir søknader om støtte,6574.3,6604.3,30.0,2016-10-26,2016-10-26_proceedings.txt
Stortinget-20161026-095635_6604300_6617300,til utbygging av av nett i distriktene enn det der er penger til men det er ikke nytt av tjuefemten ei heller i tjueseksten sånn har det vært i alle år under denne ordningen har vært og når senterpartiet styrte,til utbygginga av nett i distrikta ein del der er pengar til men det er ikkje nytt av eee tjuefemten ei heil tjueseksten sånn har det vore i alle åra i denne ordninga har vore og når senterpartiet styrte,6604.3,6617.3,13.0,2016-10-26,2016-10-26_proceedings.txt
Stortinget-20161026-095635_6617300_6646400,men det viktige her er jo å sjå hva er det totale tilbudet for ingenting er bedre for meg enn om staten ikke trenger bruk ei krone rett og slett fordi at man har fått regelverket til å bli enklere sånn at kostnadene går ned og flere steder så er det lønnsomt for selskapene å investere uten å tenke på om staten bidrar med penger til dette og det er noe av det vi har brukt mest tid på sørge for at vi prøver å få forenkle og graveregler harmonisere de som gjør at bransjen ser at det blir billigere et eksempel bransjen sjøl bruker,men det viktige her er jo sjå kva den totale tilbodet for ingenting er betre for meg enn om staten ikkje treng bruka ei kroner rett og slett fordi at me har fått regelverket til å bli enklare og sånn at kostnadene går ned og fleire stader så er det lønsamt for selskapa å investera utan å tenke på om staten bidrar med pengar til dette og det er noko av leg me har bukt mest tid på sørgafor at me prøver for å forenkla og gravereglar harmonisera dei som gjer at bankjen ser at det blir billigare eit eksempel bransjen sjøl bruker,6617.3,6646.4,29.099999999999454,2016-10-26,2016-10-26_proceedings.txt
Stortinget-20161026-095635_6646400_6669600,det at vi skulle hadde brukt det strengeste gravet regelverket for å grave ned fiber når du hadde bygd ut fibernettet rundt eller ut fra alta som er ganske mange mil langt så vil det da kosta nesten en milliard kroner med de billigste reglene så koster det under hundre millioner og derfor er regelverket her langt viktigere enn støtteordningen men støtteordningen har vi fordi at den gir et ekstra puss,det er at du sjøl hadde bok det strengaste graveregelverket for å grava ned fiber når du hadde bygd ut fibernettet rundt eller utforalta som er ganske mange mil langt så ville det kosta nest ein milliard kroner med dei billigaste reglane så kostar det under hundre millionar og derfor er regelverket her langt viktige enn støtteordninga men støtteordninga har med fordi at den gir eit ekstra puss,6646.4,6669.6,23.200000000000728,2016-10-26,2016-10-26_proceedings.txt
Stortinget-20161026-095635_6669600_6682800,i de områdene der markedet seinest ville komme til å løyse dette sjøl og det er viktig for oss å være med og stimulere alle deler av landet og derfor har vi ordningen men ikke under noen regjering har du klart å finansiere alle søknader hvert år når de har kommet,i dei område der markedet seinast ville kome til å løyse dette sjøl og det er viktig for oss å vere med å stimulera alle delar av landet og derfor har me ordninga men ikkje unner nokon regjering har do klart å finansiere alle søknader kvart år når dei har komt,6669.6,6682.8,13.199999999999818,2016-10-26,2016-10-26_proceedings.txt
Stortinget-20161026-095635_6682800_6708700,anne tingelstad wøien til første oppfølgingsspørsmål vær så god ja president eee det er nok riktig som statsråden sier at det hele tida vil være et stort behov der ute som vi sikkert aldri kan dekke men legge til at den rødgrønne regjeringa brukte cirka en milliard på breibåndsutb bygging de åra som nå satt i regjering og så må jeg legge til og at vi må huske på at iphone kom i totusenogni ipad i totusenogti altså behovet har hatt en har hatt en voldsom økning,anne tingelstad vegen til første oppfølgingsspørsmål ver så god ja president eee det er nok eee riktig som statsråden seier at det heile tida bør vere eit stort behov der ute som vi sikkert aldri kan dekke me legg til at den raudgrøne regjeringa brukte cirka ein milliard på breibandsutbygbygging i åra som no satt i regjering og så må eg legge til og at vi må hugse på at aifond kom i totusenogni aiped i totusenogti altså behovet har hatt ein har hatt ein valdsam økning,6682.8,6708.7,25.899999999999636,2016-10-26,2016-10-26_proceedings.txt
Stortinget-20161026-095635_6708700_6734400,men i oppland så er det altså det ell mest elendige fylke å bo i når det gjelder eee bredbåndshastighet i totusenogtolv så hadde vi fire komma tre megabitt det er langt opp til nitti i tjueseksten andre kvartal så hadde vi femten komma tre altså vi bor i et område der det ikke er lønnsomt med utbygging eee og det er en kjempefrustrasjon for eee mange deler i landet i mange steder som det er distrikts der de i distriktene,men i oppland så er det altså det e mest elendige fylket å bu i når det gjeld eee breibandshastigheit i totusenogtolv så hadde vi fire komma tre megabit det er langt opp til til nitti i tjueseksten andre kvartal så hadde vi femten komma tre altså vi bur i eit område der det ikkje er lønnsamt med utbygging eee og det er ein kjempefrustrasjon for eee mange deler i landet i mange stiller seg i distrikts dei i distrikta,6708.7,6734.4,25.699999999999818,2016-10-26,2016-10-26_proceedings.txt
Stortinget-20161026-095635_6734400_6761700,i før tida så fikk vi framført både elektrisitet og telefon til alle be hele befolkningen gjennom et eget system for statlig eierskap og regionalt og lokalt eierskap eller utpå er statsråden interessert i å se på en sånn type løsningstatsråd ketil solvikolsen vær så god president jeg tror ikke engang senterpartiet tenkte på en sånn løsning når de faktisk styrte men la meg allikevel sjå litt på oppland konkret da når en gir inntrykk av at eee ting står dårlig tilgrunn av dagens regjering,i føre tida så fekk vi framført både elektrisitet og telefon til alle heile befolkninga gjennom eit eige system for statleg eigarskap og regionalt og lokalt eigarskap er lur per statsråden interessert til å se på ein sånn type løysingstatsråd ketil solvik olsen ver så god president eg trur ikkj ein gong senterpartiet tenkte på ein sånn løysing når dei faktisk styrte men la a liggevel sjå litt på oppland konkret då når han gir inntrykk av at ting står dårleg til grunn av dagens regjering,6734.4,6761.7,27.300000000000182,2016-10-26,2016-10-26_proceedings.txt
Stortinget-20161026-095635_6761700_6786800,fordi at i totusenogseksten så vil staten bidra med sju komma to millioner kroner til å støtte bredbåndutbygging i oppland i totusenogfemten så støtta vi med femten komma tre millioner kroner til sammenligning så støtta senterpartiet fylket med seks komma ni seks komma seks og fem komma en millioner kroner altså lavere støtte i de tre årene siste tre årene med rødgrønn styre enn i de årene som vi har styrt,fordi at i totusenogseksten så vil staten bidra med sju komma to millionar kroner til å støtta breibaneutbygging i oppland i totusenogfemten så støtta me med femten komma tre millionar kroner til samanlikning så støtta senterpartiet fylket med seks komma ni seks komma seks og fem komma ein millionar kroner altså lavere å støtte i dei tre åra siste tre åra med med raudgrønt styre enn i dei årane som me har styrt,6761.7,6786.8,25.100000000000364,2016-10-26,2016-10-26_proceedings.txt
Stortinget-20161026-095635_6786800_6816700,derfor har jeg ingenting å skjemmes over når det gjelder de virkemidlene med bruk mot oppland det andre som er viktig i det som jeg nevnte det å sørge for at markedet gjør den jobben i størst mulig grad og det gjør de til gangs der du på for eksempel fire gdekning i oppland hadde en dekning på to komma eee på ni prosent i totusenogtretten så har du nå nittien prosent i totusenogseksten så sjøl om en på ingen måte er i mål så har vi sett en fantastisk utvikling i de årene der vi har hatt ansvar for detanne telstad veien vær så god,derfor har eg ingenting å kjemmast over når det gjeld dei verkemiddel me bruk mot oppland det andre som er viktig det som eg nemnde er å sørge for at markedet gjer den jobben i størst mulig grad og det gjer det til gangs der du på for eksempel fire eige dekning i oppland hadde ein dekning på to komma eee på ni prosent i totusenogtretten så var det nå nittiein prosent i totusenogseksten så sjøl om ein på ingen måte i mål så har me sett ein fantastisk utvikling i dei årane der me har hatt ansvar for dette kusta vegen ver så god,6786.8,6816.7,29.899999999999636,2016-10-26,2016-10-26_proceedings.txt
Stortinget-20161026-095635_6816700_6843300,ja altså jeg forstår at statsråden synes det er sårt at jeg qqq at jeg prøver å se legge skylda på han men det var ikke min hensikt hensikten som jeg sa også innven innledningsvis er at behovet har vært hadde hatt en voldsom behovsøkning ute og vi meiner at oppland og hedmark og de andre fylkene som ligger i lag og så har en like stor skal ha en like stor mulighet for å delta i den digitale verden som resten eller så får vi et digitalt klasseskille det er vi opptatt av å løse og da må vi gjøre det gjennom,ja altså eg forstår det at statsråden synest det r svårt at eee qqq at det prøver oss eee legge skylda på han men det er ikkje min hensikt hensikta som eg sa også inn innledningsvis er at behovet har vore hadde hatt ein valdsam behovsøkning ute og vi meiner at oppland og hedmark og dei andre fylka som ligg i lag har ein like stor skal ha ein like stor muligheit for å delta i den digitale verda som resten eller så får vi eit digitalt klasseskilje det er vi opptatt av å løyse og det må vi gjera det gjennom,6816.7,6843.3,26.600000000000364,2016-10-26,2016-10-26_proceedings.txt
Stortinget-20161026-095635_6843300_6866900,eee statlige tilskuddsmidler det som er utfordringen i dag det er jo at tilbydere bygger parallelle lett eee parallelle nett det ønsker vi å unngå ikke at telenor kommer og graver eigrøft og så kommer til å graver ein ei grøfte sida i de kommersiell lønnsomme områdene vi er interessert i å se hvordan kan vi greie å få på plass utbygging i de områdene som i dag anses som,eee statleg tilsynsmiddel det som er utfordringane i dag det er jo at tilbydarar bygger paralelle lett parallelle nett det ønsker vi å unngå ikkje at telenor kommer å graver eigruft og så kommer tele og graver ein av ei grøft sidetak i dei kommersielt lønnsame områda vi er interessert til å seia borleis kan vi greie å få på plass utbygging i dei områda som i dag anses som,6843.3,6866.9,23.599999999999454,2016-10-26,2016-10-26_proceedings.txt
Stortinget-20161026-095635_6866900_6884400,ikke så på eee lønnsomme og nå veit jeg og at statsråden har sendt på høring en ny i ny lov en breibyggingsutlov der du skal der det tar til orde for enkelte eee endringer men eee og jeg skal komme sikkert til nærmere tilbake til det vil vel statsråden også gjøre ja,ikkje så pa eee lønnsame og nå veit eg at statsråden har sendt på høyring ein ny i ny lov ein breibyggingsut lov der det skal der dei tar til orde for enkelte eee endringar men eee eee og eg skal komme sikkert til å nærme dette bak så at dei vil vere statsråden også gjere det,6866.9,6884.4,17.5,2016-10-26,2016-10-26_proceedings.txt
Stortinget-20161026-095635_6884400_6912800,ketil solvikolsen vær så god ja president det er heilt riktig at vi allerede har sendt på hø ute på høring en lov som skal prøve å ordne opp i noen av de tingene som blir påpekt her sørge for at det er lettere å få tilgang til de ulike infrastrukturene men i det jeg har lest fra representanten wøien i avisene så har det vært en massiv kritikk mot dagens regjering der han gir inntrykk av at oppland er glemt men de tallene jeg har viser altså at oppland får mer i støtte under vår regjering til bygging av fiber,ket soli posen så gå ja president det er heilt riktig at me allereie har sendt på høy ute på høyring ein lov som skal prøve å ordne opp i nokon av dei tinga som blir påpeikt eg sørger for at det er lettare å få tilgang til dei mulege infrastrukturane men i det eg har lest frå representanten vøyen i avisene så har det vore ein massiv kritikk mot dagens regjering der ein gir inntrykk av at oppland er glemt men dei talane eg har viser altså at oppland får meir i støtte under vår regjering til bygging av fiber,6884.4,6912.8,28.400000000000546,2016-10-26,2016-10-26_proceedings.txt
Stortinget-20161026-095635_6912800_6938800,enn det en gjorde under representanten wøiens egen regjeringstid med senterpartiet i regjering så den kritikken blir da rimelig kunstig når tallene faktisk viser det motsatte og så er jeg heilt enig i at oppland er ikke de som er fremst på dette når det gjeld ser på statistikken de ligger fortsatt litt pitterskudd i forhold til mange andre men vi ser altså en vekstrate som er større her og det er eee en for eksem,enn det ein gjorde under representanten løens eigen regjeringstid med med senterparti regjering så den kritikken blir då rimeleg kunstig når talane faktisk viser motsette og så er eg heilt einig i at oppland er ikkje dei som er fremst på dette når det gjeld ser på statistikken dei ligg fortsatt litt bitteskydd i forhold til mange andre men me ser altså ein vekstrate som er større her og der eee ein for eksem,6912.8,6938.8,26.0,2016-10-26,2016-10-26_proceedings.txt
Stortinget-20161026-095635_6938800_6960900,så hadde en altså ni prosent dekning for innbyggerne i totusenogtretten nittien prosent dekning i totusenogseksten og det tyder på at der skjer mye riktig her og med regjeringens innsatsda er det slik at spørsmål fire bortfaller fordi utenriksministeren er bortreist og vi går da videre til spørsmål nummer fem,så hadde ein altså ni prosent dekning for innbyggjarane i totusenogtretten nittiein prosent dekning i totusenogseksten og det tyder på at da skjer mykje riktig her og med regjeringas innsatsda er det slik at spørsmål fire bortfaller fordi utanriksministeren er bortreist og vi går da vidare til spørsmål nummer fem,6938.8,6960.9,22.099999999999454,2016-10-26,2016-10-26_proceedings.txt
Stortinget-20161026-095635_6960900_6989900,som er fra representanten svein roald hansen til ministeren for samordning av eøssaker og forholdet til eu svein roald hansen vær så god president jeg tillater meg å stille følgende spørsmål til ministeren for samordning av eøssaker og forholdet til eu storbritannia varsler at de går ut av eusamarbeidet det innebærer at de også går ut av eøs delen av det indre marked ifølge artikkel hundre og tjuesju i eøsavtalen skal en avtalepart gi minst tolv måneders varsel,som er frå representanten svein roald hansen til ministeren for samordning av eøssaker og forholdet til eu er roald hansen ver så god president eg tillat meg å stille følgende spørsmål til minister for samordning av i eøs saker og forhold til eu storbritannia varslar at dei går ut av eusamarbeidet det inneber at dei også går ut av eøsdelen av det indre marked i følge artikkel hundre og tjuesju eøsavtalen skal eine avtaleparti minst to månaders varsel,6960.9,6989.9,29.0,2016-10-26,2016-10-26_proceedings.txt
Stortinget-20161026-095635_6989900_7014100,den britiske statsministeren har varslet at de iverksetter paragraf femti i eutraktaten i mars tjuesytten avviklingen av rettigheter og forpliktelser i eu og eøs bør være mest mulig identiske forhandlingene bør da skje parallelt eller i samarbeid mellom eftalandene og eulandene har regjeringen tatt dette opp med kommisjonen og storbritannias eee statsråd elisabeth astbakken vær så god,den bridiske statsministeren har varsla at dei verksette paragraf femti i eutraktaten i mars tjuesytten avviklinga av rettigheter forpliktelser i eu og eøs bør vere mest mulig identiske forhandlingane bør da skje paralelt eller i samarbeid mellom efteland og euland har regjeringa tatt dette opp med kommisjonen og storbritannia eee statsråd elisabeth askbakker ver så god,6989.9,7014.1,24.200000000000728,2016-10-26,2016-10-26_proceedings.txt
Stortinget-20161026-095635_7014100_7042600,president storbritannia vil etter uttreden av eu også tre ut av eøs etter å ha gitt varsel om dette i henhold til eøsavtalens artikkel hundre og tjuesju eøsavtalen inneholder ikke bestemmelser om at det skal forhandles om en utmeldingsavtale slik som artikkel femti i eutraktaten artikkel hundre og tjuesju sier også at de gjenværende avtalepartene skal sammenkalle til en diplomatisk konferanse for å vurdere de endringene det måtte være nødvendig å gjøre i avtalen,president storbritannia vil etter uttreden av eu også tre ut av eøs etter å ha gitt varsel om dette i henhold til eøsavtalens artikkel hundre og tjuesju eøsavtalen inneheld ikkje bestemmelser om at det skal forhandlast om ein utmeldingsavtale slik som artikkel femti i eutraktaten artikkel hundre og tjuesju seier også at gjenvernets avtalepartane skal samankalla til ein diplomatisk konferanse for å vurdere dei endringane det måtte vere nødvendig å gjere i avtalen,7014.1,7042.6,28.5,2016-10-26,2016-10-26_proceedings.txt
Stortinget-20161026-095635_7042600_7068000,denne bestemmelsen aktualiseres for første gang når storbritannia forlater eu og etter alt å dømme også vil forlate eøs norge er ikke part i de kommende utmeldingsforhandlinger mellom eu og storbritannia men vi blir direkte berørt fordi eøsavtalen regulerer i dag store deler av vårt økonomiske samkve med storbritannia britisk uttredning av eu vil også få betydning for eus videre utvikling og dermed også for norge,denne bestemmelsen aktualiserast for første gong når storbritannia for lat til eu og etter alt å døme også vil forlate eøs noreg er ikkje part i dei komande utmeldingsforhandlingar mellom eu og storbritannia men vi blir direkte berørt fordi eøsavtalen regulerer i dag store delar av vårt økonomiske samkvem med storbritannia britisk uttreden av eu vil også få betydning for eus vidare utvikling og dermed også for noreg,7042.6,7068.0,25.399999999999636,2016-10-26,2016-10-26_proceedings.txt
Stortinget-20161026-095635_7068000_7097600,for regjeringa er det avgjørende viktig å sikre et velfungerende eøssamarbeid etter britisk utredning av eu samtidig er vår ambisjon et minst like godt og bredt forhold til storbritannia som vi har i dag derfor er vi nå i gang med å kartlegge og vurdere norske interesser i lys av brexit regjeringa har også en tett dialog med storbritannia og eu for å formidle norske synspunkter og både statsministeren utenriksministeren næringsministeren og eee undertegnede har de siste ukene hatt møter både med våre britiske ol kollegaer,for regjeringa er det avgjerande viktig og sikre eit velfungerande eøssamarbeid etter britisk uttreden av eu samtidig er vår ambisjon eit minst like godt og breitt forhold til storbritannia som vi har i dag derfor er vi nu i gang med å kartlegge og vurdere norske interesser i lys av breksit regjeringa har også eint tett dialog med storbritannia og eu for å formidle norske synspunkt og både statsministeren utanriksministeren næringsministeren og eee underteikne det har dei siste uka hatt møte både med våre britiske kollega,7068.0,7097.6,29.600000000000364,2016-10-26,2016-10-26_proceedings.txt
Stortinget-20161026-095635_7097600_7127300,andre sentrale medlemsland og representanter for eus institusjoner der brexit har vært det sentrale temaet det sentrale budskapet fra norsk side har nettopp vært å synliggjøre eøsdimensjonen ved brexit og at det er viktig med løpende dialog og at vi blir konsultert sånn at overgangsordninger og fremtidige rammer for forhold til storbritannia og eu også passer inn i en bredere eøssammenheng det er viktig å minne om at det indre marked består av trettien medlemmer ikke tjueåtte,andre sentrale medlemsland og representantar for eus institusjonar der breksis har vore ei sentrale tema det sentrale bodskapet frå norsk side har nettopp vore å synleggjere eøsdimensjonen ved breksit og at det er viktig med løpande dialog og at vi blir konsultert sånn at overgangsordninga og framtidige rammer for forhold i storbritannia og eu også passe inn i ein breiare eøssamanheng det er viktig å minne om at det innleg market består av trettiein medlemmar ikkje tjueåtte,7097.6,7127.3,29.699999999999818,2016-10-26,2016-10-26_proceedings.txt
Stortinget-20161026-095635_7127300_7153700,norge er som eøsdeltakel ikke et ordinært tredjeland vi har møtt stor forståelse for dette synet ikke minst fordi det også i eu så stor at det også er i eus og storbritannias interesse at de løsningene som fremforhandles ikke skaper nye utfordringer for relasjonene med land utafor eu og som er med i det indre marked norge vil derfor sammen med sine efta eøspartnere ta initiativ til å innkalle til en,noreg er som eøesdeltakel ikkje eit ordinært tredje land vi har møtt stor forståelse for dette synet ikkje minst fordi det også i eu s og stor at det også er i eus og storbritannias interesse at dei løysingane som fremforhandles ikkje skape nye utfordringar for relasjonane med lang utanfor eu og som er med i det indre marked noreg vil derfer samen med sine eftaevestpartnaar ta initiativ til å innkalle til ein,7127.3,7153.7,26.399999999999636,2016-10-26,2016-10-26_proceedings.txt
Stortinget-20161026-095635_7153700_7182100,og jeg vil ta initiativ til en første dialog eee og drøfting eee om dette når jeg møter mine kollegaer fra island og listrand i brussel fjortende november i forbindelse med det halvårlige eøsrådsmøtet svein roald hansen til første oppfølgingsspørsmål vær så god president jeg takk takker for svaret det er bra at regjeringen har begynt å ta kontakter både med medlemsland med storbritannia eee og med eukommisjonen,og eg vil ta initiativ til ein første dialog eee og drøfting eee om dette når eg møter mine kollegar frå island og listan i bryssel fjortende november i forbindelse med det halvårlege eøsrådsmøtetså er ein do alliansen til første oppfølgingsspørsmål ver så god president eg takk takkar for svaret det er bra at regjeringa har bynt å ta kontaktar både med eee medlemsland med storbritannia eee og med eukommisjonen,7153.7,7182.1,28.400000000000546,2016-10-26,2016-10-26_proceedings.txt
Stortinget-20161026-095635_7182100_7207600,og har som intensjon at man skal holde tett kontakt men jeg mener at det er ikke tilstrekkelig jeg mener at man må eee fra eftalandenes side de tre eftalandene sammen må eee reise spørsmålet og kravet om mulighetene for å ha en plass ved det bordet om ikke annet som som observatør eee det er eee riktig hva formalitetene sier,og har som intensjon at ein skal halde tett kontakt men eg meiner at det er ikkje tilstrekkeleg jeg meiner at ein må eee frå etter landets side dei tre efterlande saman må eee reise spørsmålet og kravet og mulighetene for å ha ein plass ved det bordet om ikkje anna som som observatør eee det er eee riktig va formaliteten seier,7182.1,7207.6,25.5,2016-10-26,2016-10-26_proceedings.txt
Stortinget-20161026-095635_7207600_7234900,eee og eee statsråden sa at man skal ta initiativ til å innkalte en diplomatisk konferanse når varslet kommer om utredning av eøsavtalen det er bra men hun understreket at det står ikke at det skal føres forhandlinger jeg antar at man i den konferansen ikke bare skal på disse mida jeg tror man skal ha samtaler om det man står ovenfor eee og man må ikke la seg binde at ordet forhandlinger ikke er nedfelt i eøsavtalensbeth hasbakken vær så god,eee og eee statsråden sa at ein skal ta initiativ til innkalt i den diplomatiske konferanse når varslet kommer om utrede eøsavtalen det er bra men hon understreket at det står ikkje at det skal førast forhandlingar eg antar at ein gjer ein konferansen ikkje berre skal prise mi da eg trur ein skal ha samtalar om det ein står ovenfor eee og ein må ikkje la seg binne at ordet forhandlingar ikkje er nedfelt i eøsavtalensbet asbakken ver så god,7207.6,7234.9,27.299999999999272,2016-10-26,2016-10-26_proceedings.txt
