file,text_bm,text_nn,start,end,duration,date,proceedingsfile
Stortinget-20160203-095323_4727100_4757000,eee ved at du har med deg en hjemmelekse fra skolen for eksempel at barn og foreldre skal lese sammen et kvarter eller tyve minutter hver dag audun lysbakken til oppfølgingsspørsmål vær så god president jeg er også forleksa at dette er ikke en diskusjon for eller mot øvingsarbeidet det en diskusjon om hvordan vi organiserer øvingsarbeidet eee om det skal gjøres hjemme eee der eee det er foreldrene som skal følge opp eller om det skal gjøres på skolen sånn at alle får den samme muligheten til oppfølging fra,eee ved at du ham det ein hjemlekse frå skolen for eksempel at barn og foreldre skal lese saman eit kvarter eller tyve minutter kvardag audun lysbakken til oppfølgingsspørsmål ver så god president eg er også for leksa og dette er ikkje ein diskusjon for eller mot øvingsarbeidt det ein diskusjon om korleis vi organiserer øvingsarbeidet eee om det skal gjerast hjemme eee der det er foreldra som skal følge opp eller om det skal gjerast på skolen sånn at alle får den same muligheten til oppfølging frå,4727.1,4757.0,29.899999999999636,2016-02-03,2016-02-03_proceedings.txt
Stortinget-20160203-095323_4757000_4777600,en kvalifisert lærer eee vi er ikke for en skole uten leksa vi er for en skole med skolelekser istedenfor hjemmelekser eee jeg tror statsråden undervurderer styrken i det engasjementet som er eee ute blant folk det er en enorm oppslutning om eee en rekke ulikete,ein kvalifisert lærar eee vi er ikkje for ein skole utan lekser og vi er for ein skole med skolelekser i stelma for jermelekser eee eg trur statsråden undervurderer styrken i det engasjementet som er eee ute blant folk det er ein enorm oppslutning om eee ein rekkje ulikete,4757.0,4777.6,20.600000000000364,2016-02-03,2016-02-03_proceedings.txt
Stortinget-20160203-095323_4777600_4806200,infact gjorde en meningsmåling i juni som viste at sekstifem prosent støttet forslag om å utvide skoledagen med en time for at hjemmeleksene kan gjøres på skolen med lærer til stede og da tenker jeg at å være konservativ kan jo ikke bety at man er mot forandring eee og mitt enkle spørsmål er jo om statsråden jeg skjønner at han ikke vil endre dagens system men han kan han vurdere å ta initiativ til forsøk med en annen måte eee å gjøre leksene vær så,infekt gjorde ein meningsmåling i juni som viste at sekstifem prosent støtte ut forslaget om å utvide skollagen med ein time for at hjemmeleksene kan gjerast på skolen med lærar til stader og da tenker eg at å vere konservativ kan jo ikkje bety at ein er mot forandring eee og mitt enkle spørsmål er jo om statsråden er sjønner at han ikkje vil endre dagens system men han kan han vurdere å ta initiativ til forsøk med ein annan måte eee og gjere lese ver så god,4777.6,4806.2,28.599999999999454,2016-02-03,2016-02-03_proceedings.txt
Stortinget-20160203-095323_4806200_4836000,pre president jeg jeg tror også at oppslutningen om dette er eee jeg tror nå for eksempel høyere enn oppslutningen om sv så det er nok potensiale i denne saken her eee men men eee mitt poeng er at i mange år så har det vært en diskusjon om leker eee og jeg tror at det aller beste til å vurdere dette det er skolen og pedagogen og de som er faglig ansvarlige og det betyr også at hvis en skole eee lærerne profesjonen på en skole ønsker å ha forsøk med dette så behøver de ikke engang sende en søknad til departementet de kan rett og slett gjøre det,pre president ja jeg trur også at oppslutninga om dette her eee eg trur nære for eksempel høyrer ein oppslutninga om sv så det er nok potensiale i denne saka her eee men men eee mitt poeng er at i mange år så har det vore ein diskusjon om leksi eee og jeg trur at det aller beste til å vurdere dette det er skolen og pedagogen og dei som er fagleg ansvarlege og det betyr også at viss ein skole eee lærarne profesjonen på ein skole ønsker å ha forsøk med dette så behøver de ikjen gong sende ein søknad til departementet dei kan rett og slett gjere det,4806.2,4836.0,29.800000000000182,2016-02-03,2016-02-03_proceedings.txt
Stortinget-20160203-095323_4836000_4853400,eee og så er det sånn at vi har jo en leksehjelpordning den var veldig rigid under de rødgrønne nå er det blitt mer fleksibel så kommunene kan sette inn leksehjelpen der de trenger det men så er det også sånn at evalueringen av den ordningen viser at det har ikke noe effekt for å utjevne forskjeller basert på foreldren eee altså barnas hjemmebakgrunn,eee og så er det sånn at vi har jo ein lekshjelpordning den var veldig rigid under dei raudgrøne no har det blitt meir fleksibel så kommunane kan sette inn lekshjelpen der dei treng det men så er det også sånn at evalueringa av den ordninga viser at det har ikkje noko effekt for de utgjevne forskjellar basert på foreldre eee altså barnas hjemmebakgrunn,4836.0,4853.4,17.399999999999636,2016-02-03,2016-02-03_proceedings.txt
Stortinget-20160203-095323_4853400_4882400,så så evalueringen av leksehjelpsordningen viser at den sannsynligvis ikke har noen stor effekt men så skal jeg gi eee representanten lysbakken det at hvis man innfører en heldags skole som jeg er mot altså hvis elevene skal være på skolen alle sammen til tre eller fire eller noe sånt så mener jeg også at det er fornuftig at man har leksene på skolen det blir tilleggsspørsmål og første tilleggsspørsmål kommer ifra representanten siv elin hansen deretter tone merete sønsterud,så så evalueringa av leksehjelpsordninga viser at den sansynlegvis ikkje har nokon stor effekt men så skal eg gi eee representanten lysbakken det at viss ein innfør ein heildaksskole som me er mot også viss elevane skal vere på skolen alle saman til tre eller fire eller noko sånt så meiner eg altså at det er fornuftig at ein har leksene på skolendet blir tilleggsspørsmål og første tilleggspørsmål kommer ifrå representanten siv elin hansen deretter tone merete sønsterud,4853.4,4882.4,29.0,2016-02-03,2016-02-03_proceedings.txt
Stortinget-20160203-095323_4886800_4912800,hansen vær så god president forsker ved statistisk sentralbyrå marth rønningen analyserte matematikk og naturfagsresultatene til over åtte tusen norske fjerdeklassinger hun fant ut at elevene med lav sosioøkonomisk bakgrunn som får mye lekser gjør det dårligere enn elever med tilsvarende bakgrunn som får mindre lekser også andre studi,hansen ver så god president forskar ved statistisk sentralbyrå marte rønningen analyserte matematikk og naturfagsresultatan til over åtte tusen norske fjerdeklassingar ho fent ut at elevane med lav sosioøkonomisk bakgrunn som for mye lekser gjer det dårlegare enn elevar med tilsvarande bakgrunn som får mindre lekser også andre studi,4886.8,4912.8,26.0,2016-02-03,2016-02-03_proceedings.txt
Stortinget-20160203-095323_4912800_4938700,utafor skolen er det jo stor forskjell på hvor god hjelp elevene får med øvingsarbeidet og det har også statsråden sagt eee tidligere i dag eee men jeg lurer på hvilke konkrete grep kunnskapsministeren vil gjøre for å hindre at organiseringa av øvingsarbeidet forsterker sosiale forskjeller og til og med gir lavere læringsutbytte for en betydelig gruppe elever statsråd torbjørn røe isaksen vær så god president jeg har,utanfor skolen er det jo stor forskjell på kor god hjelp elevane får med øvingsarbeidet og det har også statsråden sagt tidlegare i dag eee men eg lurar på kva konkrete grep kunnskapsministeren vil gjere for å hindre at organiseringa av øvingsarbeidet forsterkar sosiale forskjellar og til og med gi lavre læringsutbytte for ein betydeleg gruppe elevar statsråd torbjørn isaksen ver så god president ja ha,4912.8,4938.7,25.899999999999636,2016-02-03,2016-02-03_proceedings.txt
Stortinget-20160203-095323_4938700_4962600,allerede allerede nevnt at eee eee årsakene til at jeg er for lekser men så er jo da eee det po po altså systemet er bygd opp sånn at dette er et valg som profesjonen lærerne skoleledelsen tar eee det er der ansvaret er plassert eee så er jeg skeptisk til de som sier at jo men fordi at eee leker gitt på gal måte,allereie allereie nemnt at eee eee årsakane til at dei er for leksi men så er jo da eee det på po altså systemet er bygd opp sånn at dette er eit va som profesjonen lærane skoleledelsen tar eee der der ansvaret er plassert eee så er eg skeptisk til dei som seier at jo men fordi at eee lekser gitt på gal måte,4938.7,4962.6,23.900000000000546,2016-02-03,2016-02-03_proceedings.txt
Stortinget-20160203-095323_4962600_4978700,altså hvis det er nye ting de skal gjennomgå særlig så kan det forsterke de sosiale forskjellene at man dermed skal fjerne leker for jeg tror ikke at eee veldig mange foreldre vil slutte å gjennomgå skoledagen skolearbeidet lese med barna eller gjøre andre ting bare for at skolen ikke har gitt en eksplisitt beskjed om det,altså viss det er nye ting du skal gjennomgå særleg så kan det forsterke dei sosiale forskjellene at ein dermed skal fjerde lekser for eg trur ikkje at veldig mange foreldre vil slutte å gjennomgå skoledagen skolearbeidet lese med barna eller gjere andre ting berre for at skolen ikkje har gitt ein eksplisitt beskjed om det,4962.6,4978.7,16.099999999999454,2016-02-03,2016-02-03_proceedings.txt
Stortinget-20160203-095323_4978700_5004000,eee men hvis det er sånn så så er da spørsmålet hvordan skal jeg som statsråd sikre at alle lærere i norge gir lekse på en riktig måte altså at det er repetisjon om at du ikke er avhengig av å få hjelp igjen fra til lære noe nytt da gir du leksene på en feil måte svaret på det er tillit vi har altså eee kvalifiserte eee godt utdanna lærere i dette landet som er fullt i stand til å ta både diskusjonen og denne beslutningen selv,eee men viss det er sånn så så er så det spørsmålet vorde skal gje som statsråd sikre at alle lærarar i noreg gir lekser på ein riktig måte altså at det er repetisjon at du ikkje har avlingar å få hjelp igjen for at å lære noko nytt da gir du leksene på ein feil måte svaret på det er tillit vi har altså eee kvalifiserte eee godt utdanna lærarar i dette landet som er fullt i stand til å ta både diskusjonen og denne beslutningen selv,4978.7,5004.0,25.300000000000182,2016-02-03,2016-02-03_proceedings.txt
Stortinget-20160203-095323_5004000_5009200,og neste tilleggsspørsmål er fra representanten tone sønsterud,og neste tilleggspørsmål er frå representanten tone søndstyre,5004.0,5009.2,5.199999999999818,2016-02-03,2016-02-03_proceedings.txt
Stortinget-20160203-095323_5014100_5033500,sønsterud vær så god president arbeiderpartiet er ikke imot lekser men vi må mener det må bli gitt gode lekser poenget er at leksen vi leksene må bli brukt som et mye virkemiddel for å fremme elevenes læring lekser skal ikke være det du ikke rakk og gjør i skoletida men tilpasse det oppgaver som elevene har nytta jøvepå på egenhånd,sønstru ver så god president arbeidarpartiet er ikkje imot lekser men vi må meiner det må bli gitt gode lekser poenget er at leksem leksen må bli brukt med eit my verkemiddel for å fremme elevens læring lekse skal ikkje vere det at du ikkje rakk å gjere i skoletida med in tilpassa de oppgåver som eleven har nytta hovet på på eigen hand,5014.1,5033.5,19.399999999999636,2016-02-03,2016-02-03_proceedings.txt
Stortinget-20160203-095323_5033500_5059400,alle elever har ikke mulighet til å få hjelp og støtte til leksene slik sv også er opptatt av og det er et tiltak som organisert leksehjelp viktig for å sikre like muligheter og bidra ikke minst til sosial utjevning derfor har vi tatt til orde for å utvikle lips lekshjelpsordninger som en integrert del av skoledagen slik at elevene kan løre seg ferdig med mesteparten av arbeidsoppgavene før de kommer igjen og dette må også gjelde på ungdomstrinnet,alle elevar har ikkje mulighet til å få hjelp å støtte til leksene slik sv også ar oppdata og der tiltak som organisert lekshjelp viktig for å sikre like muligheter å bidra ikkje minst i sosial utjevning derfor har vi ta til orde for å utvikle les lekkshjelpsoydningar som ein integrert del av skoldagen slik at elevene kan øye seg ferdig med mesteparten av arbeidsoppgåvene før det kommer igjen og dette må altså gjelde på ungdomstrinne,5033.5,5059.4,25.899999999999636,2016-02-03,2016-02-03_proceedings.txt
Stortinget-20160203-095323_5059400_5083200,hva mener statsråden om en slik ordning eee mener man han fortsatt at det bare skal være frivillig opp til hver enkelt skole eller vi kunne man tenke seg å se på at dette blir en mer fastere ordning eee i framtida statsråd torbjørrøe isaksen vær så god president jeg mener at hvis elevene skal være lengre på skolen så skal det være fordi at de har skolefag med en kvalifisert lærer og faglig innhold,kva meiner statsråden om ein slik ordning eee meiner me han fortsatt at det bare skal vere frivillig opp til kvar enkelt skole eller kunne ein tenke seg å se på at dette blir ein meir fastere øydning eee i framtidastatsråd turguisaksen ver så god president ja meiner at viss elevane skal vere lenge på skolen så skal det vere fordi at dei har skolefag med ein kvalifisert lærar og fagleg innhop,5059.4,5083.2,23.800000000000182,2016-02-03,2016-02-03_proceedings.txt
Stortinget-20160203-095323_5083200_5098700,eee og det eee hvis hvis hvis man skal forstå arbeiderpartiets forslag så må jo det være at qqq man enten bruker mer av skoletimene i dag på å gjøre lekser eller at man legger til nærmest en ekstra leksetime som er obligatorisk for alle elevene hvor du skal gjøre leksene da medre å legge til fagtimer,eee og det vi vi viss ein skal forstå arbeidarpartiets forslag så må jo det vere at qqq ein enten bruker mer av skoletime i dag på å gjere lekser eller at ein legg til nærmast ein ekstra leksetime som er obligatorisk for alle elevane vore skal gjere leksene eg mtre å ligge til fagtimer,5083.2,5098.7,15.5,2016-02-03,2016-02-03_proceedings.txt
Stortinget-20160203-095323_5098700_5114950,vi har jo nå lagt til flere naturfagstimer i inneværende års budsjett vi vet at det for eksempel er mange som mener at det er for få eee matematikktimer på ungdomstrinnet hvis vi skal ha en lengre skoledag så mener jeg at det skal være skoletimer med kvalifiserte faglærere og et faglig innhold og,vi har jo nå lagt fleire naturfagstimer i innværneog års budsjett og vi veit at det for eksempel er mange som meiner at det er for få eee matematikktime på ungdomstrin viss vi skal ha ein lengre skoledag så meiner eg at det skal vere skoletime med kvalifiserte faglærar og eit fagleg innhald og,5098.7,5114.95,16.25,2016-02-03,2016-02-03_proceedings.txt
Stortinget-20160203-095323_5114950_5138200,så må de lærerne eee i god diskusjon med andre i profesjonen på den enkelte skole vurdere hvordan de skal legge opp leksearbeidet og derfor er mitt svar til de mange elevene jeg møter som eee ofte tar opp om vi ikke kan gjøre noe med at det er så mye lekser det er ta dette opp med skolen dette er ikke et ansvar som kunnskapsdepartementet kommer til å gå inn og detaljregulere her stoler vi på lærernes faglige skjønn,så må dei lærane eee i god diskusjon med andre i profesjonen på den enkelte skoler vurdere korleis dei skal legge opp leksarbeidet og derfor er mitt svar til dei mange elevane i ei møte som eee ofte tar opp om me ikkje kan gjere no med at dere nye lekser det er ta dette opp med skolen dette er ikkje eit ansvar som kunnskapsdepartementet kommer til å gå inn og detaljregulere her stor vi på lærarane faglege søn,5114.95,5138.2,23.25,2016-02-03,2016-02-03_proceedings.txt
Stortinget-20160203-095323_5138200_5146800,og vi går til neste hovedspørsmål og siste hovedspørsmål som er fra representanten anette tret,og vi går til neste hovudspørsmål og siste hovudspørsmål som er frå representanten anette tret,5138.2,5146.8,8.600000000000364,2016-02-03,2016-02-03_proceedings.txt
Stortinget-20160203-095323_5149800_5179400,trettebergstuen vær så god og det ser ut som eee røe isaksen kan bli stående president det kan han en av de største nedturene denne regjeringen har gitt velgerne sine det må være gapet mellom barnehageløftene de ga før valget og det de faktisk reve leverer i posisjon med barnehageforliket så fikk vi en historisk utbygging av barnehageplasser med lovfesta rett til plass for ettåringer slik at det skulle være sikra barnehageplass,trettebergstuen ver så god og det ser ut som eee røe isaksen kan bli ståande president det kan han ein av dei største neturane denne regjeringa har gitt eee veljane sine det må vere gapet mellom barnehageløfte det gav for valet og det dei faktisk krev leverer i posisjonen med barnehageforliket så fekk vi ein historisk utbygging av barnehageplassar med lovfesta rett til plass for ettøringar slik at det skulle vere sikra barnhageplass,5149.8,5179.4,29.599999999999454,2016-02-03,2016-02-03_proceedings.txt
Stortinget-20160203-095323_5179400_5205900,vi fikk maksprisen slik at familiene skulle ha råd til å ha barna sine i barnehagen den rødgrønne regjeringa vi bygde ut barnehageplasser over hele landet og vi jobba parallelt med kvaliteten i barnehagene i totusenogfjorten budsjettet tok vi det naturlige neste skrittet å starte på jobben med to barnehageopptak høyres landsmøte ga velgerne et løftptak,vi fikk eee maksprisen slik at familien skulle ha råd til å ha barna sine i barnehagen den eee raudgrøne regjeringa vi bygde ut til barnlageplassar over heile landet og vi jobbar parallelt med kvaliteten i barnehagene i totusenogfjortenbudsjettet tok vi det naturlege nesse skrittet og starta på jobben med to barnehageopptak høgres landsmøte gav veljarane eit løfpdak,5179.4,5205.9,26.5,2016-02-03,2016-02-03_proceedings.txt
Stortinget-20160203-095323_5205900_5227000,det står i programmet deres og representanter fra regjeringspartiet kritiserte denne valgkampen arbeiderpartiet for å kun ville ha to opptak det holdt ikke for høyre de skulle innføre løpende velgerne ble lurt det første høyre jule i regjering var å avlyse innføringen av to barnehageopptaknehagebudsjettet,det står i programmet deira og representantar frå regjeringspartiet kritiserte gjen av valkampen arbeidarpartiet for å kun ville ha to opptak det alt ikkje får høyre dei skulle innføre løpande velane blei lurt det første høgre gjorde i regjering var å avlyse innføringa av to barneagopptakne hagebudsjettet,5205.9,5227.0,21.100000000000364,2016-02-03,2016-02-03_proceedings.txt
Stortinget-20160203-095323_5227000_5255200,løpende opptak må velgerne se langt etter valgløftet er avlyst resultatet etter to år med blåblå regjering er tvert imot lengre barnehagekøer og høyere priser hva vil statsråden si til de velgerne som stemte på høyre fordi dere lovte løpende barnehageopptak innrømmer statsråden at dette var valgflesk om ikke hvorfor har vi ikke sett mot til det statsråd torbjørn røe isaksen vær så god,løpande opptak må veljane seg langt etter valløftet er avlyst resultatet etter to år med blåblå regjering er tvert imot lengre barnehagekør og høgre priser kva vil statsråden seie til dei veljarane som stemde på høgre fordi der dei lovde løpande varne oppta hag opptak innrømmer statsråden at dette var valt flesk om ikkje vorfor har vi ikkje sett noko til detstatsråd torbjørn istensen ver så god,5227.0,5255.2,28.199999999999818,2016-02-03,2016-02-03_proceedings.txt
Stortinget-20160203-095323_5255200_5271600,president etter noe over to år med denne regjeringa og dette samarbeidsflertallet på stortinget så er det flere plasser i barnehagene i dag enn det var under de rødgrønne det er rekordhøy satsing på kvalitet og innhold i barnehagene og,president etter eee no over to år med denne regjeringa og dette samarbeidsfleirtalet på stortinget så er det fleire plassar i barnehagen i dag enn det var når dei raudgrønne det er rekordhøg satsing på kvalitet og innhald i barnehagane og,5255.2,5271.6,16.400000000000546,2016-02-03,2016-02-03_proceedings.txt
Stortinget-20160203-095323_5271600_5294200,kanskje aller viktigst de som har dårligst råd i det norske samfunnet har fått en moderasjonsordning altså fått billigere barnehageplasser og det er ikke avhengig av lokal velvilje fra lokale politikere det er en rett for alle foreldre i norge og det var også det de f eee partiene gikk til valg på at det skulle være billigere med barnehageplasser for de som hadde dårligst råd,kanskje aller viktigast dei som har dårlig rå i det norske samfunnet har fått ein moderasjonsordning altså fått billigare barnehageplassar og det er avhengig av lokal velvilje frå lokale politikarar det er rett for alle foreldre i noreg og det var også det dei partia gjekk tilbake på at det skulle vere billar med barnehageplassar for dei som hadde dårlegast rå,5271.6,5294.2,22.599999999999454,2016-02-03,2016-02-03_proceedings.txt
Stortinget-20160203-095323_5294200_5315900,så er det helt riktig at både høyre og fremskrittspartiet hadde i sine programmer at man skulle ha et mer løpende opptak eee og måten å gjøre det på er jo å gi kommunene midler til flere plasser og så må kommunene disponere dette sånn at man for eksempel kan ta imot barn som ikke da formelt sett har rett til barnehageplass eee basert på det de rødgrønne i sin tin vente var ful barnehagedekning,så var det heilt riktig at både høgre og framstegspartiet hadde sine program er at ein skulle ha eit meir løpende opptak eee og måten å gjere det på er jo å gi kommunane midler til fleire plassar og så må kommunane disponere dette sånn at ein for eksempel kan ta imot barn som ikkje da formelt sett har rett til barnehageplass eee basert på det dei raudgrøne i syn tid meint å vare ful barnehagedekning,5294.2,5315.9,21.699999999999818,2016-02-03,2016-02-03_proceedings.txt
Stortinget-20160203-095323_5315900_5333300,men så har vi etter budsjettforliket med krf og venstre ikke minst takket per innsats fra kristelig folkeparti også fått flere barnehageplasser igjen eee i totusenogseksten så kom det et midler til tre hundre og tre tusen fire hundre nye barnehageplasser og det betyr,men så har vi etter budsjettforliket med krf og venstre ikkje minst sakke lar innsats frå kristeleg folkeparti også fått fleire barnehageplassar igjen eee i totusenogseksten så kom det eit midler til tre hundre og tre tusen fire hundre nye barnehageplassar og det betyr,5315.9,5333.3,17.400000000000546,2016-02-03,2016-02-03_proceedings.txt
Stortinget-20160203-095323_5333300_5360700,at etter det budsjettforliket så er det også mulighet til å utvide grensen det var ikke regjeringas primærstandpunkt men det er noe som eee var et kompromiss mellom de fire samarbeidspartiene og et gjennomslag da for kristelig folkeparti og for venstre og det betyr at barn som nå er født i september og oktober også vil få plass samtidig så betyr det også at kommunene har mulighet til å ha mer fleksibilitet også for andre barn som ikke fortttil plass,at dette det budsjettforliket så er det også mulighet til å utvide grensene det er ikke regjeringas primærstandpunkt men det er noko som eee var eit kompromiss mellom dei fire samarbeidspartia og eit gjennomslag da for kristeleg folkeparti og for venstre og det betyr at barn som nå er fødde i september og oktober også vil få plass samtidig så betyr det også at kommunane har mulighet til å ha meir fleksibilitet også for andre barn som ikkje for tt til plass,5333.3,5360.7,27.399999999999636,2016-02-03,2016-02-03_proceedings.txt
Stortinget-20160203-095323_5360700_5389200,anette trettebergstuen til oppfølgingsspørsmål vær så god president eee mens kø barnehagekøene gikk ned under den rødgrønne regjeringen så vokser køene under denne regjeringen det minst nå barnehagekøene er på over åtte tusen barn det er resultatene etter to år med denne bråloregjeringen i tillegg har prisene gått opp for de fleste dette milevis fra de barnehageløftene dere ga velgerne før valget eee,og etter trette vestuen til oppfølgingsspørsmål ver så god president eee mens kø barnehagekøene gjekk ned under den raudgrøne gjeringa så vaksur køane under denne regjeringa det vi nå barnhagekøen er på over åtte tusen barn det er resultata etter to år med denne doloregjeringa i tillegg har prisene gått opp for dei fleste dette er milevis frå dei barnehageløfte der det gav veljane før valget eee,5360.7,5389.2,28.5,2016-02-03,2016-02-03_proceedings.txt
Stortinget-20160203-095323_5389200_5414900,det var venstre og krf som i budsjettforliket fikk tvunget regjeringen til å gi rettigheter til barnehageplass også for de født i september og oktober arbeiderpartiet går lenger og gir rettigheter til alle født før nyttår i valgkampen så sa representanter for regjeringspartiet høyre at høyre setter mennesker foran systemet vi vil ha løpende opptak hele året istedenfor datahysteriet med rettigheter til en bestemt dato,det var venstre og krf som i budsjettforliket fekk tvinge regjeringa til å gi rettigheter til barnageplass også fordi født i september og oktober arbeidarpartiet går lenger og gir rettigheter til alle født før nytt år i valkampen så sa representanten frå regjeringspartiet høgre at høgre seter mennesker for oss systemet vi vil ha løpende opptak heile året i staden for data og hysteriet med rettigheter til ein bestemt dato,5389.2,5414.9,25.699999999999818,2016-02-03,2016-02-03_proceedings.txt
