file,text_bm,text_nn,start,end,duration,date,proceedingsfile
Stortinget-20161026-095635_4422200_4446100,president representanten viser til havressursloven og og den ligger fast eee ressursene i havet er fellesskapet eee og det er også regjeringas politikk eee mye av dette får vi nå eee store gjennomganger på vi har store saker som ligger til behandling både kvoteutvalget eidesen eee vi har pliktkommisjonens rapport,president representanten viser til havressurslova og og den ligg fast eee ressursane i havet er fellesskapet eee og det er også regjeringas politikk eee mye av dette får vi no eee store gjennomgangar på vi har store saker som ligg til behandling både kvoteutvalget i disten eee vi har replikkkommisjonens rapport,4422.2,4446.1,23.900000000000546,2016-10-26,2016-10-26_proceedings.txt
Stortinget-20161026-095635_4446100_4474300,og en rekke saker nå og det har aldri vært så stor debatt rundt norsk fiskeri og framtida for eee for å ta ut eee ressursene av havet deltakerloven ligger fast men den blir utfordra det er heilt riktig særlig i forhold til det som ligger i pliktkommisjonens rapport men dette er en uti vurdering dette er ute til høring eee og representanten og stortinget vil få ta den debatten senere nå er det altså sånn,og ein rekke saker nu og det har aldri vore så stor debatt rundt norsk fiskeri og framtida for eee for å ta ut eee ressursane av havet deltakarlova ligg fast men den blir utfordra det er heilt riktig særleg i forhold til det som ligg i plikkkommisjonens rapport men dette er ein ute vurdering dette er ut til høyring eee og representanten og stortinget vil få ta den debatten seinare no er det altså sånn,4446.1,4474.3,28.199999999999818,2016-10-26,2016-10-26_proceedings.txt
Stortinget-20161026-095635_4474300_4503000,vi kan gjerne gå tilbake til førti og femtitallet eee som resulterte i at vi bygde jo opp eee eee mange insu industriinstitusjoner eee stort fiskeri langs kysten vår eee det ble gjort eee etter krigen i tråd med å bygge opp eee samfunnene få bosetting sikkerhetspolitikk var inne i bildet det var den gangen at den subsidierte veldig mye innafor dette denne næringa disse subsidiene er nå fjerna,vi kan gjerne gå tilbake til førti og femtitalet eee som resulterte i at vi bygde opp eee mange in industriinnstitusjonar eee stort fiskeri langs kysten vår eee det blei gjort etter krigen i tråd med å bygge opp eee samfunna få busetting sikkerheitspolitikk var ein i bildet det var den gongen at ein subsidierte veldig mykje innanfor dette denne næringa desse subsidane er no fjerna,4474.3,4503.0,28.699999999999818,2016-10-26,2016-10-26_proceedings.txt
Stortinget-20161026-095635_4503000_4530200,eee og nå er altså resultatet av at det går rimelig godt eee i norsk fiskeri det går betydelig godt innafor norsk havbruk og det er altså sånn at kysten eee kystfiske og andelen når det gjelder torsken for eksempel så har den ligget i noen lunde fast sia sytti åttitallet eee jeg er jo akkurat like opptatt av eee at ressursene en langs kysten vår,eee og no er også resultatet at det går rimeleg godt eee i norsk fiskeri det går betydeleg godt innanfor norsk havbruk og det er autså sånn at kysten eee kystfiske og andelen når det gjeld torsken til eksempel så har den ligge nokon lunde fast sidan syttiåttitalet eee eg er akkert like opptatt av at ressursane lagkystorisk,4503.0,4530.2,27.199999999999818,2016-10-26,2016-10-26_proceedings.txt
Stortinget-20161026-095635_4530200_4552400,og det viser også at dette året så har det aldri blitt landa mere fisk i nordnorge som det gjør nå og jeg ser at vi er i en situasjon der at vi går i fra outsorcing til homsorcing det at norsk eee sjømatindustri nå blir konkurransedyktig og det at vi flytter også mye av prosessene hjemrtiden ute knag fylkesnespresident eee,og det viser også at dette året så har det aldri blitt landa meir fisk i nordnoreg som det gjer no og eg ser at vi er i ein situasjon der at vi går ifrå outsourcing til homsorcing det at norske eee sjømatindustri nu blir konkurransedyktig og det at vi flyttar oss så mye prosessane gjen tiden ute knar fylkenes president eee,4530.2,4552.4,22.199999999999818,2016-10-26,2016-10-26_proceedings.txt
Stortinget-20161026-095635_4552400_4579500,mitt utgangspunkt var det som har vært de stolte norske tradisjonene på eee forvaltninga av havet og det har vært to sto sentrale prinsipper som har bidratt til at vi har en helt unik kystkultur i dette landet her en helt unik verdiskaping langs hele kysten i motsetning til veldig mange andre land som har fulgt en helt anna linje eee som har ført til at kystkulturen blir lagt ned eee og at verdiskapinga også har gått ned det at disse,mitt utgangspunkt var det som har vore det stolte norske tradisjonane på eee forvaltninga av havet og det har vore to sto sentrale prinsipp som har bidrege til at vi har ein heilt unik kystkultur i dette land her ein heilt unik verdiskaping langs hele kysten i motsetning til veldig mange andre land som har følgt ein heilt anna linje eee som har ført til at kystkulturen blir lagt ned eee og at verdiskapinga også har gått ned det er at desse,4552.4,4579.5,27.100000000000364,2016-10-26,2016-10-26_proceedings.txt
Stortinget-20161026-095635_4579500_4607600,prinsippene i dag utfordres er enkelt å se fiskerettigheter samles på stadig færre hender og folk også effektivt nektes fra å delta i det lukka fisket i bare i løpet av det året som har gått mens fiskeriministeren har vært statsråd så har det som tidligere var en fiskekvote som koster eventyrlig en komma fire millioner i finnmark har nå økt til to komma fire millioner kroner ett år senere der stenger ute,prinsippa i dag utfordrast er enkelt å se fiskerettigheter samlast på stadig færre hender og folk også effektivt nektast frå å delta i det lukka fisket i berre løpet av det året som har gått mens fiskeriministeren har vore statsråd så har det som tidlegare då ein fiskekvote som kosta eventyrleg ein komma fire millionar i finnmark har no økt til to komma fire millionar kroner eitt år seinare der stenger ute,4579.5,4607.6,28.100000000000364,2016-10-26,2016-10-26_proceedings.txt
Stortinget-20161026-095635_4607600_4633100,eee kystsamfunnene fra å delta i fisket og det er kun om få aktører igjen bekymrer dette fiskeriministeren nevneverdig statsråd sandberg ja president eee fiskekvotene har hatt en økning over lengre tid eee og så kan man si han er bekymra overfor dem eee men det er klart at det er et resultat av politikk og det gir også resultater eee det er jo ingen som har høkt hatt høyere inntektsvekst enn inn norske fiskere,eee kystsamfunna frå å delta i fisket og det kunn om få aktørar igjen bekymrar dette fiskeriministeren nemneverdig statsråd er president eee fiskekåtane har hatt ein økning over lenger tid eee og så kan me seia han jo bekymra og for de eee men det er klart at det er eit resultat av politikk og det gir også resultata eee det er jo ingen som har høg hatt høgre inntektsveksting enn norske fiskarar,4607.6,4633.1,25.5,2016-10-26,2016-10-26_proceedings.txt
Stortinget-20161026-095635_4633100_4661500,hvis du eee sammenligner norske fiskere og med landbasert industri for eksempel så har jo dem hatt en betydelig høyere inntektsvekst eee og så er det sånn at industrien har slitt og det er jo det som har vært utgangspunktet ved stortingsmelding ni eee ti eee altså sjømatindustrimeldinga så var jo det regjeringa hadde fokus på det her fordi at hvis vi skal lykkes framover nå så må vi også styrke industriens eee lønnsomhet det er jo det som vil være at legges til grunn for å skape industri og vekst eee i distriktene,viss du samlinger norske fiskarar med landbasert industri for eksempel så har jo dei hatt ein betydeleg høgare inntektsvekst eee og så er det sånn at industrien har slitt og det er jo det som er til utgangspunktet med stortingsmeldinga i ei tid eee som har sjømatindustrimeldinga så var jo det regjeringa hadde fokus på dei fordi at viss vi skal lykkast framover nu så må vi også styrke industriens eee lønnsomhet det er jo det som vil vore å leggast til grunn for å skape industri og vekst i distrikta,4633.1,4661.5,28.399999999999636,2016-10-26,2016-10-26_proceedings.txt
Stortinget-20161026-095635_4661500_4691100,ulønnsomme arbeidsplasser skaper jo ikke trygghet langs kysten lønnsomme arbeidsplasser imidlertid vil skape vekst og jeg må si som fiskeriminister så heldig som jeg er få lov til å reise rundt i går så var jeg i steigen og åpne et settefiskanlegg jeg ble invitert stadig verk til å åpne ulike anlegg langs kysten vår nå så det er en betydelig optimisme og positivit positivitet der ute det åpnes for tilleggsspørsmål og første tilleggsspørsmål er fra kjersti bergstø deretter ingrid heggø,ulønnsamme arbeidsplassar skapar uke trygghet langs kysten lønnsame arbeidsplassar i midlertid vil skape ei vekst og er me si som fiskeriminister så er heldig me er for lot reise rundt i går så var eg i steigen og opna eit settefiskanlegg eee bli invitert stadig vek til opne ulike anlegg langs kysten ores nu så det er ein betydeleg optimisme og positivit eee positivitet der utedo åpnast for tilleggsspørsmålet og første tilleggsspørsmålet her frå eg kirsti bergstø deretter ingrid heggø,4661.5,4691.1,29.600000000000364,2016-10-26,2016-10-26_proceedings.txt
Stortinget-20161026-095635_4693100_4721500,bergstøgode president industrien eee trenger leveranser pliktkommisjonen den har nylig kommet med sin anbefaling til hvordan systemet bør se ut og intensjonen bak regelverket kjenner vi det har alltid vært at trålerne skal få fiske mot at dem leverer fisk på land og bidrar til aktivitet i kystsamfunnene nå ser vi et uthult eee regelverk der kystsamfunn taper og trålerne tjener gode penger eee og,bergstøgode president industrien eee treng leveranse pliktkommisjonen den har nyleg komme med sin anbefaling til korleis systemet bør se ut eee og intensjonen bak regelverket kjenner vi der har alltid vore at trålaren skal få fiske mot at dei lever fisk på land og bidrag til aktivitet i kystsamfunna no ser vi eit uthule regelverk der kystsamfunn taper og trålerane tener gode pengar eee og,4693.1,4721.5,28.399999999999636,2016-10-26,2016-10-26_proceedings.txt
Stortinget-20161026-095635_4721500_4741800,pliktkommisjonen er enig i den her analyse men likevel så har dem landa på et forslag der tråleren skal få nitti prosent av verdiene og kystsamfunna blir sittende igjen med liten tiendel det legges altså opp til et system det er langvarig ran av fellesskapets ressurser og mangel på overholdelse av for,pliktkommisjonen er einig i den her analysa men likevel så har dei landa på eit forslag eee der trolla skal få nitti prosent og verdien og kystsamfunna blir sittande igjen med ein liten tiendel det leggast altså opp til eit system der langvarig ran av fellesskapets ressursar og mangel på overholdese av for,4721.5,4741.8,20.300000000000182,2016-10-26,2016-10-26_proceedings.txt
Stortinget-20161026-095635_4741800_4768700,og da president lurer jeg på om statsråden forstår kystsamfunnene som nå frykter at rederne skal få nitti prosent mens dem sjøl blir sittende igjen med skarve ti prosent statsråd sandberg president konklusjonen fra rapporten det er jo det at man skal ta ifra trålerane og gi til kystsamfunnet det er jo det som er konklusjonen her eee rapporten konkluderer også med at u,og da president lurer på om statsråden forstår kystsamfunna som no fryktar at redarane skal få nitti prosent mens dei sjøl blir sitande igjen med skarve ti prosentstatsråd sandberg president konklusjonen frå rapporten det er jo det at ein skal ta ifrå trollera og gi til kystsamfunnet det er jo det som er konklusjonen her eee rapporten konkluderer også med at ur,4741.8,4768.7,26.899999999999636,2016-10-26,2016-10-26_proceedings.txt
Stortinget-20161026-095635_4768700_4797200,er årsaken til den situasjonen vi står i blant annet den rødgrønne regjeringa og tidligere regjeringer eee rapporten sier faktisk rett og slett at politikere har vært unnfallen og har laga et uthula system og så er mitt utgangspunkt som fiskeriminister la i totusenogseksten å sørge for noe som vi alle sammen er enige om å få noe som fungerer og noe som er forutsigbart og alle politikere,er årsaka til den situasjonen vi står i blant anna den raudgrøne regjeringa og tidlegare regjeringa eee rapporten ser faktisk ettersett at politikarar har vore unnfan og har laga eit uthola system og så er mitt utgangspunkt som fiskeriminister la i totusenogseksten og sørge for noko som vi alle saman er einige om å få noko som fungerer og noko som er forutsigbart og alle politikarar,4768.7,4797.2,28.5,2016-10-26,2016-10-26_proceedings.txt
Stortinget-20161026-095635_4797200_4823500,alle politiske partier jeg snakker med sier at pliktene fungerer ikke og det er mitt utgangspunkt nå er dette ute på høring så det blir helt feil av meg å legge noen slags føringer på det men intensjonene her det er å flytte noe av ressursene tilbake til kystsamfunnene og det finnes det ulike metoder jeg var i debatt og har vært massiv debatt med sv sv har vært skamfull over det man er filer heggø eee og nå skal jeg føle,alle politiske partia har snakka med seier at pliktene fungerer ikkje og det er mitt utgangspunkt no er dette ut på høyring så det blir heilt feila med å legge nokon slags køyringar på da men intensjonane her det er å flytte noko av ressursane tilbake til kystsamfunna og det finnast det er ulike metodar eg var i debatt og har vore masse i debatt med sv full ril heggø skal,4797.2,4823.5,26.300000000000182,2016-10-26,2016-10-26_proceedings.txt
Stortinget-20161026-095635_4830200_4857000,deretter line henriette hjemdal heggø takk president eee å styrke industrien er vi alle enige om men da må industrien få fiske og jeg vil og minne om at det stoltenbergregjeringa overtok i totusenogfem så var det faktisk innført evigvarende kvote det fikk vi reversert å stoppe av leveringsplikta den var omgjort til tilbudsplikt av fiskeri høyre,der etter linen i det time heggøtakk president eee å styrka industrien er vi alle einige om men da må industrien få fisk eee og eg vil og minne om at de stoltenbergregjeringa overtok i totusenogfem så var det faktisk innført evigvarande kvote det fekk vi reversert å stoppa leveringsplikta den var omgjort til tilbodsplikt av fiskeri høgre,4830.2,4857.0,26.800000000000182,2016-10-26,2016-10-26_proceedings.txt
Stortinget-20161026-095635_4857000_4883900,de punkterte leveringsplikte det slår og kommisjonen fast mandag i dagsnitt atten så viste statsråden eee til at lokalsamfunn har det vanskelig under omstilling eee og vi står ikke i parallellosituasjonen på vestlandet eee og det som har ski på kysten i nord eee på grunn av pliktene eee best sine problem skuldes jo i all hovedsapris,det punkterte leveringsplikta det slår og kommisjonen fast måndag i dagsnytt atten så viste statsråden til at lokalsamfunn har det vanskeleg under omstilling og vis det og te parallellen mellom situasjonen på vestlandet eee og det som må skje på kysten i nord eee på grunn av pliktene eee best sine problem skuldast jo i all hovudsapris,4857.0,4883.9,26.899999999999636,2016-10-26,2016-10-26_proceedings.txt
Stortinget-20161026-095635_4883900_4906800,kvifer må melbu og stamsund før buset på ei omstilling når det aldri før har vært landa så mye fisk i nord statsråd sandberg ja president jeg peker ikke på eksakte eee lokalsamfunn men disse samfunnene som som representanten peker på har jo hatt utfordringer o har utfordringer i dag på grunn av,kvifor må melbu og stamsun førebu seg på ei omstilling når det aldri før har vore landa så mykje fisk i nord så amberg president her peikar ikkje på eksakte eee lokalsamfunn men desse samfunna som som representanten peikar på har jo hatt utfordringar har utfordringar i dag på grunn av,4883.9,4906.8,22.900000000000546,2016-10-26,2016-10-26_proceedings.txt
Stortinget-20161026-095635_4906800_4934100,at ulike regjeringer har uthula et system som hadde til intensjon å skape vekst og forutsigbarhet landskysten våre det har man ikke lykkes med derfor så var det jo også trur jeg at stortinget ba meg å sette ned en pliktkommisjonen som skulle sjå på alle disse pliktene samordna nå har denne pliktkommisjonen levert sin rapport så registrerer jeg selvfølgelig at eee noen har konkludert rapporten kom,at ulike regjeringar har uthola eit system som hadde til intensjon og skape vekst og forutsigbarhet langs kysten re det har ein ikkje lykkast med derfor så var det også trur eg at stortinget bad meg sette inn i ein pliktkommisjon som skulle sjå på alle desse pliktene samordna no har denne pliktkommisjonen levert sin rapport så registrerer seg følgelig at nokon har konkludert rapporten kom,4906.8,4934.1,27.300000000000182,2016-10-26,2016-10-26_proceedings.txt
Stortinget-20161026-095635_4934100_4963000,men det må jeg bare respektere men min intensjon er fortsatt at både melbu og andre samfunn langs kysten vår skal ha forutsigbarhet og ha muligheter til å få leveranse av råstoff og vokse og det er jeg optimistisk nok til å tru på hvis man fint fram til en løsning eee i forhold til både pliktene og kvoteutvalget som skal levere sin rapport og det er en rekke andre ting jeg kunne snakke om infrastruktur også i denne forbindelse for å styrke da lønnsomheten og veksten lag kysten vår,men det må eg berre respektere men min intensjon er fortsatt at både melbu og andre samfunn langs kyst mores skal ha forutsigbarhet og ha muligheter til å få leveranse av råstoff og vekse og det er optimistisk nok til å tru på viss ei fint fram til ein løysing eee i forhold til både pliktene og kvoteutvalget som skal levere sin rapport og den rekke andre ting eg kunne jo snakke om infrastruktur også i denne forbindelse for å styrke det lønnsomheten og veksten alkystmåres,4934.1,4963.0,28.899999999999636,2016-10-26,2016-10-26_proceedings.txt
Stortinget-20161026-095635_4963000_4966700,neste tilleggsspørsmål er fra line henriette hjemdal,neste tilleggsspørsmål er frå line henrete gjendal,4963.0,4966.7,3.699999999999818,2016-10-26,2016-10-26_proceedings.txt
Stortinget-20161026-095635_4970100_4998200,president et av de viktigste prinsippene innenfor norsk fiskeripolitikk er at fiskeressursene skal tilhøre folket at fiskeren skal få betalt og at fiskeressursene skal komme kystsamfunnene til gode president jeg regner med at statsråden er enig i disse grunnleggende prinsippene men så vet vi også at økt bearbeiding skaper økt verdiskaping,president eit av dei viktigaste prinsippa innanfor norsk fiskeripolitikk er at fiskeressursane skal tilhøyre folket at fiskaren skal få betalt og at fiskeressursane skal komme kystsamfunna til gode president eg rekner med at statsråden er einig i desse grunnleggjande prinsippa men så veit vi altså at økt bearbeiding skaper økt verdiskaping,4970.1,4998.2,28.099999999999454,2016-10-26,2016-10-26_proceedings.txt
Stortinget-20161026-095635_4998200_5028000,og da er mitt spørsmål president til statsråden hva vil statsråden gjøre for å øke eller legge til rette for økt verdiskapning av våre flotte fiskeriressurserstatsråd sandberg ja president eee det trur jeg at vi skal lø finne fram til i fellesskap eee og nå har vi mange store oppgaver foran oss og jeg trur at eee regjeringa i fellesskap med stortinget skal finne de løsningene som skaper det nå er det altså sånn at det går veldig godt av eee rekordomsetning i kystfisket i nord,og da er mitt spørsmål president til statsråden kva vil statsråden gjere for å øke eller legge til rette for økt verdiskaping av våre flotte fiskeriressursar sandberg ja president det trur eg at vi skal lø finne framtid i fellesskap eee og nå har vi mange store oppgåver foran oss og eg trur at eee regjeringa i fellesskap med stortinget skal finne dei løysingane som skaper det no er det altså sånn at det går veldig godt opp eee rekordomsetning i kystfisket i nord,4998.2,5028.0,29.800000000000182,2016-10-26,2016-10-26_proceedings.txt
Stortinget-20161026-095635_5028000_5051800,rekruttering går veldig bra kystfiskerlaget fiskerlaget eee rapporterer at nå går det rimelig greit vi slår nye rekorder heile tida eee det har aldri vært landa mere fisk i nord rettighetene i en litt annen debatt der at man flytter rettigheter men det var det jo også på førtifemtitallet da var det noen kapitalsterke her i oslo som sørga for å bygge opp og hadde eierskap i i langs kysten vår men når det gjelder bearbeiding,rekruttering går veldig bra kystfiskelaget fiskelaget rapporterer at no går det urimelegheit vi slår nye rekordar heile tida eee det har aldri vore landa mer med fisk i nord rettighetene i ein litt annan debatt der at ein flyttar rettighetene men det var det jo også på førti og femtitalet da var det nokon kapitalsterke her i oslo som sørga for å bygge opp og hadde eigarskap i i langs kysten års men når det gjeld biarbeiding,5028.0,5051.8,23.800000000000182,2016-10-26,2016-10-26_proceedings.txt
Stortinget-20161026-095635_5051800_5070200,så er vi altså i en situasjon der at vi er avhengig av markedene våre så jeg trur ikke at vi politikere skal nærmest vedta hvil åssen produktene skal sjå ut og den bearbeidingsplikten som arbeiderpartiet innførte i sin tid den har i hvert fall ikke ført til det beste eller øke lønnsomheten eee og konkurranseevnen til norsk sjømatindustri,så er vi altså ein situasjon der at vi avheng av markeder og eg trur ikkje at vi politikarane skal nærmast vedta kva osen produktane skal sjå ut og den bearbeidingsplikta som arbeidarpartiet innførte i sin tid den har kvart fall kje ført til det beste eller auka lønnsomheita e og konkurranseevna til norsk sjømatindustri,5051.8,5070.2,18.399999999999636,2016-10-26,2016-10-26_proceedings.txt
Stortinget-20161026-095635_5070200_5086300,eee så jeg tror at hvis vi ser på alle disse tre pliktene sammen nå eee så tror jeg vi finner løsninger fordi at mulighetene finnes i i stort monn langs kysten vår i forhold til å skape både bosetting mer arbeidsplasser og økt sysselsetting neste tilleggsspørsmål er fra pål farstad,eee så her trur eg at viss vi ser på alle desse tre pliktane saman nu eee så trur eg vi finn løysingar for det at mulighetene finst i i i stort monn langs kysten åre i folket skaper både busetting mer arbeidsplassar og økt sysselsettingneste tilleggsspørsmål er frå på farsta,5070.2,5086.3,16.100000000000364,2016-10-26,2016-10-26_proceedings.txt
Stortinget-20161026-095635_5095300_5123200,president det har vært brei het om norsk eee fiskeripolitikk på stortinget at fiskeressursene tilhører fellesskapet og at verdiene som skapes tilfaller våre lokalsamfunn fiskerisamfunn og ikke minst norsk økonomi slik vil jeg ha det også i framtida norge er velsigna med særs dyktige fiskere som høster ressursene bærekrftig og vi har ei,president det har vore brei einigheit om norsk eee fiskeripolitikk på stortinget at fiskeressursane tilhøyrer fellesskapet og at verdiane som skapast tilfaller våre lokalsamfunn fiskerisamfunn og ikkje minst norsk økonomi slik vil eg ha det også i framtida noreg er velsigna med særs dyktige fiskarar som haustar ressursane berekrftig og vi har ei,5095.3,5123.2,27.899999999999636,2016-10-26,2016-10-26_proceedings.txt
Stortinget-20161026-095635_5123200_5151300,god fiskeriforvaltning når det gjelder fiskerene så gjeld er det både sharpflåten kystflåten og havfiskeflåten viktig å understreke president for venstre så er det også viktig at det holdes fast på dagens fordeling av kvoterettigheter mellom kyst og havfiskeflåten basert på et spredt og bredt eierskap til båt og bruk dette vil også være viktig for landindustrien,god fiskeriforvaltning når det gjeld fiskarane så gjeld er det både sjapplåten kystflåten og havfiskeflåten viktig å understreke president for venstre så er det også viktig at det held oss fast på dagens fordeling av kvoterettigheter mellom kyst og havfiskeflåten basert på eit spreitt og breitt eigarskap til båt og bruk dette vil også vere viktig for landindustrien,5123.2,5151.3,28.100000000000364,2016-10-26,2016-10-26_proceedings.txt
Stortinget-20161026-095635_5151300_5181100,så spørsmålet president er fiskeriministeren opptatt av å sikre at framtidig bredt eierskap til fiskefartøy og rettigheter til å drive fiske ikke blir samla på få hender statsråd sandberg ja president det eee der er vi helt enig i eee og jeg har heller ikke signalisert at det er noe politisk parti eller politikere som ønsker å endre på den fordelinga vi har i dag og det er jo de jeg har prøvd å peke på litt tidligere også den fordelinga eee eller andelen av ressursene våre som ligger i kystsamfunnet våre har ligget,så spørsmålet president er fiskeriministeren opptatt av å sikre eit framtidig breitt eigarskap til fiskefartøy og rettigheter til å drive fiske ikkje blir samla på få hender amberg ja president det eee det er vi heilt einig i eee og heller ikkje signalisert at det er noko politisk parti eller politikarar som ønsker å endre på den fordelinga vi har i dag og det er jo det eg prøver å peikar på litt tidlegare også den fordelinga eee eller andelen av ressursane våre som ligg til kystsamfunnet av voris har ligg i,5151.3,5181.1,29.800000000000182,2016-10-26,2016-10-26_proceedings.txt
