file,text_bm,text_nn,start,end,duration,date,proceedingsfile
Stortinget-20161026-095635_148600_154100,presidentvalg i sitt,takelsen er,148.6,154.1,5.5,2016-10-26,2016-10-26_proceedings.txt
Stortinget-20161026-095635_212100_237600,stortingets møte er lovlig satt det foreligger to permisjonssøknader fra henholdsvis representanten geir jørgen bekkevold om permisjon i tiden fra og med fjerde november til og med tiende november og fra representanten torstein tvedt solberg om permisjon i tiden fra og med åttende november til og med tiende november begge for å delta som valgobservatører for ccs parlamentariske forsamling under presidentvalget i usa,stortingets møte er lovlig satt det foreligger to permisjonsveknader frå hendesvis representanten geir jørgen bekkevold om permisjon i tida fram fjerde november til og med tiande november og frå representanten torstein tvedt solberg om permisjon i tiden fram i åttende november til og med tiende november begge for å delta som agopservatører for ccs parlamentariske forsamling under presidentvalet i usa,212.1,237.6,25.5,2016-10-26,2016-10-26_proceedings.txt
Stortinget-20161026-095635_237600_258600,disse søknadene foreslås behandlet straks og innvilget og det anses vedtatt vararepresentantene for rogaland fylke øystein langholm hansen og for telemark fylke hanne thurmer foreslås innkalt for å møte i permisjonstiden det anses også vedtatt representanten helge andre njåstad vil fremsette et representantforslag he,desse søknader foreslås behandlings drags og inn vilgi og det anses vedtatt vare representanten frå rogaland fylke er sten lang om hansen og for telemark fylke hanne tyrmer foreslås innkalt for å mete permisjonstiden det anses også vedtatt representanten helge ande nevstad vil fremsette eit representantforslag he,237.6,258.6,21.00000000000003,2016-10-26,2016-10-26_proceedings.txt
Stortinget-20161026-095635_264400_289300,takk president eee på vegne av stortingsrepresentantene ingebjørg godskesen harald tom nesvik ingjerd schou michael tetzschner frank j jensen og meg sjøl har jeg gleden av å sa ta fram et forslag om å tillate stryking av listekandidater ved fylkesting og kommunestyre valgtakk forslaget vil bli behandlet på reglementsmessig måte til behandling foreligger de saker som er oppført på dagsorden nummer tolv,takk president eee på vegner av stortingsrepresentantane inger byr godskesen harald tom nesvik innev skau michael tener frank jod jensen og meg sjøl har eg gleda av å sette fram eit forslag om å tillate stryking av listekandidatar ved fylkesting og kommunestyreval takk forslaget vil bli behandla på reglementsmessig måte til behandling foreligger de saker som er oppført på dagsøyda nummer tolv,264.4,289.3,24.900000000000034,2016-10-26,2016-10-26_proceedings.txt
Stortinget-20161026-095635_289300_311400,sak en muntlig spørretime stortinget mottok mandag meddelelse fra statsministerens kontor om at statsrådene ketil solvikolsen monica mæland og per sandberg vil møte til muntlig spørretime de annonserte regjeringsmedlemmer er til stede og vi er klar til å starte den muntlige spørretimen og vi starter da med hovedspørsmål fra representanten sverre myrli,sak er ein muntleg spørjetime stortinget mottok manda meddelelse fra statsministerens kontor om at statsrådene ketil solvikolsen monica mæland og per sandberg vil møte til muntlig spørjetime dei annonserte regjeringsmedlemmer er til stede og vi er klar til å starte den muntlige spørjetime og vi startar da med hovudspørsmål frå representanten sverre mylig,289.3,311.4,22.099999999999966,2016-10-26,2016-10-26_proceedings.txt
Stortinget-20161026-095635_318200_348000,takk for det president jeg har et spørsmål til samferdselsministeren samferdselsministeren møter mange kritiske røsteromdagen til prestise prestisjeprosjektet sitt den såkalte jernbanereformen men noen er i alle fall fornøyd og det er rådgivnings og konsulentbransjen som nå håver inn millioner på det som skjer vi får eee president et nytt direktorat,takk for det president ja har eit spørsmål til samferdselsministeren samferdselsministeren møter mange kritiske røyster om dagen til prestis prestiseprosjektet sitt den såkalte jernbanereformen men nokon er i alle fall fornøgd og det er rådgivings og konsulentbransjen som nå håvar inn millionar på det som skjer vi får eee president eit nytt direktorat,318.2,348.0,29.80000000000001,2016-10-26,2016-10-26_proceedings.txt
Stortinget-20161026-095635_348000_375100,jernbanedirektoratet vi får et nytt foretak i all enkelthet jernbaneinfrastrukturforetaket som skal forkortes bane nor sf og for å unngå misforståelser så sier vi at departementet nå bruker begrepet jernbaneinfrastrukturforetaket bane nor sf nsb splittes opp vi får et nytt skap,jernbanedirektoratet vi får eit nytt føretak i all enkeltheit jernbaneinfrastrukturforetaket som skal forkortas bane nor sf og for å unngå misforståelser så seier eg at departementet nå bruker begrepet jernbaneinfrastrukturforetaket bane nor sf nsb splittast opp vi får eit nytt skap,348.0,375.1,27.100000000000023,2016-10-26,2016-10-26_proceedings.txt
Stortinget-20161026-095635_375100_404200,vi får et nytt vedlikeholdsselskap vi får et nytt billetteringsselskap med nye direktører med nye styrer og tilhørende styrehonorarer president dette koster penger mye penger og det fremkommer også av statsbudsjettet hvis vi summerer det som står i statsbudsjettet og det som,vi får eit nytt eee velikehaldsselskap vi får eit nytt biliteringsselskap med nye direktørar med nye styrer og tilhøyrande styrehonorar president dette kostar pengar mye pengar og det framkommer også av statsbudsjettet viss vi summerer det som står i statsbudsjettet og det som,375.1,404.2,29.099999999999966,2016-10-26,2016-10-26_proceedings.txt
Stortinget-20161026-095635_404200_431700,nå skjer i nsb vil det antageligvis bare i tjuesytten brukes i størrelsesorden fem hundre millioner kroner jeg gjentar fem hundre millioner kroner bare i direkte kostnader til jernbanereformen og det før reformen har trådt i kraft så spørsmålet mitt er rett og slett president kan samferdselsmi redegjøre,nå skjer i nsb vil det antaglegvis berre i tjuesytten brukast i størrelsesorden fem hundre millionar kroner a gjentar fem hundre millionar kroner berre i direkte kostnader til jernbanereforma og det er før reforma har trått i kraft så spørsmålet mitt er ett og slett president kan samferdselsmi redegjere,404.2,431.7,27.5,2016-10-26,2016-10-26_proceedings.txt
Stortinget-20161026-095635_431700_457000,for hva jernbanereformen koster å implementere statsråd ketil solvikolsen president jeg er veldig glad for å få snakket om jernbanereformen fordi at vi trenger en bedre jernbane i dette landet en jernbane som ei rute som folk stoler på og som får mer gods over for vei og det er jo det som har vært hovedtilnærmingen vår etter mange år der forfallet på jernbanen økt år for år,for va jernbanereforma kostar å implementere statsråd kjente solvikolsen president eg er veldig glad for å få snakke om jernbanereforma fordi at me treng ein betre jernbane i dette landet ein jernbane som eee ei rute som folk stolar på og som får meir gods over frå veg og det er jo det som er våre hovedtilnærming v oss etter mange år der forfallet på jernbanen økt år for år,431.7,457.0,25.30000000000001,2016-10-26,2016-10-26_proceedings.txt
Stortinget-20161026-095635_457000_486200,under sverre myrli sin regjering så økte forfallet med en milliard kroner årlig det betyr altså at jernbanen var i dårligere stand når året var slutt enn nå og begynte der har vår vår viktigste prioritering var å få orden på infrastrukturen derfor har vi nesten dobla vedlikehold og fornyelse av jernbanen nå bedre med jernbanen så investerer vi mer enn noen gang før og vi planlegger nye jernbanespor til eee større områder og med mer penger enn noen gang før,a under sverre myrlig i sin regjering så økte forfallet med ein milliard kroner årleg det betyr altså at jernbanen var i dårlegare sanne år var slutt enn å ha bynte det har vore vår viktigaste prioritering var å få orden på infrastrukturen derfor har me nesten dobla vedikehald og fornyelse av jernbanen nå betre med jernbanen så investerer me meir enn nokon gong før og me planlegg nye jernbanespor til større område og med meir pengar enn nokon gong før,457.0,486.2,29.19999999999999,2016-10-26,2016-10-26_proceedings.txt
Stortinget-20161026-095635_486200_516000,så det blir en bedre fysisk jernbane med kjøpe nye materiell eee med bytte ut sporveksler av alt dette den andre delen av jernbanesatsingen og jernbanereformen det er bedre organisering og det er det som så eee representanten myrli her misliker etter at en har sett problem som har eksistert i mange år ja i mange tiår så har tidligere regjeringa valgt å likevel ikke gjøre noe med dette ja ikke siden nittennittiseks har man gjort noe vesentlig med jernbanen,så det blir ein betre fysisk jernbane med kjøp nye arteriell eee me bytte ut sporvekslar og alt dette den andre delen av jernbanesatsinga og jernbanereforming det er betre organisering og det er det som som representanten myrli her misligt etter at ein har sett problem som har eksistert i mange når ja i mange tiår så har tidlegare regjeringa vore å ligga ikkje gjere noko med dette ja ikkje sidan nittennittiseks har han gjort noko vesentleg med jernbanen,486.2,516.0,29.80000000000001,2016-10-26,2016-10-26_proceedings.txt
Stortinget-20161026-095635_516000_543300,vi oppretter ikke masse nye ting som aldri har eksistert før men det vi gjør det er at vi får tydeligere ansvarsfordeling der du i dag har litt ansvar i nsb litt i jernbaneverket litt i departementet og litt rundt omkring så sørger vi for at vi tar den organisasjonen som er i nsb i dag laget et eget selskap som får en egen slang organisasjon kort vei fra ledelse til de ansatte bbe mer effektivt,me opprett ikkje masse nye ting som aldri har eksistert før men det me gjer det er at me får tydelegare ansvarsfordeling der du i dag har litt ansvar i nsb litt i jernbane verket litt i departementet og litt rundt omkring så sørger meg for at me tar den organisasjonen som er i nsb i dag laga til eit eige selskap så får ein eigen slangorganisasjon kort veg frå ledelse til dei ansette bba meir effektivt,516.0,543.3,27.299999999999955,2016-10-26,2016-10-26_proceedings.txt
Stortinget-20161026-095635_543300_572300,så framstår det som at det har dukket opp noe som aldri har vært før og det hører jeg representanten myrli seie men alle disse organene fins i dag men i en stor mastodont som heter nsb der vi vil få slanke små organisasjoner med tydeligere ansvar med det at staten sitter på toppen og sier hvordan jernbanen skal fungere myrlijaa president nå er eee nok meninga med stortingets spørretime at stortinget skal stille spørsmål,så framstår det som at det har dukka opp noko som aldri har vore før og det rigerepresentanten myrli seier men alle desse organa finst i dag men i ein stor mastodont som heiter nsb der me vil få slanke små organisasjonar med tydelegare ansvar men der staten sit på toppen og seie korleis jernbanen skal fungera mylja president nå er eee nok meiningar med stortingets spørjetime at stortinget skal stille spørsmål,543.3,572.3,29.0,2016-10-26,2016-10-26_proceedings.txt
Stortinget-20161026-095635_572300_600200,og regjeringsmedlemmene skal svare fortrinnsvis på det stortinget stiller spørsmål om jeg stilte ett konkret spørsmål samferdselsministeren snakka om alt mulig annet og det skjønner jeg for jeg har sett det organisasjonskartet han nå presenterer for hvordan jernbanen blir sedet senest ut det er ikke enkelt å holde tunga rett i munnen men siden han da hadde problemer med å oppfatte spørsmålet så enkelt og greit en gang til,og regjeringsmedlemane skal svare fortrinnsvis på det stortinget stiller spørsmål om eg har stilt eit konkret spørsmål samferdselsministeren snakkar om alt mulig anna og det skjønner jeg for eg har sett dei organisasjonskartet han nå presenterer for korleis med jernbanen bli se ut senest ut det er ikkje enkelt å halde tunga rett imun men sidan han da hadde problem med demå oppfatte spørsmålet så enkelte greit ein gong til,572.3,600.2,27.90000000000009,2016-10-26,2016-10-26_proceedings.txt
Stortinget-20161026-095635_600200_626900,hva koster det å gjennomføre jernbanereformen statsråd ketil solvikolsen på kort sikt så koster det litt penger og omorganisere fordi at du skal gå igjennom og sjå på hva det som ikke virker og hvordan løser man de problemene de pengene syns jeg er verdt å bruke fordi det å sitte og sjå på at ting ikke fungerer men ikke gjør noe med det det er den dyreste løsningen av alle det å få mer effektivitet det å få en eee slankere organisasjon det betyr at aniserer,va koster det å gjennomføre jernbanereformastatsråd ketil solvikolsen på kort sikt så kostar det litt pengar å omorganisera fordi at du skal gå gjennom og sjå på kvar som ikkje verkar og korleis løyser me dei problema dei pengane som eg er vart bruka fordi det sit og sjå på at ting ikkje fungerer men ikkje gjer noko med det det er den dyraste løysinga av alle det er å få meir effektivitet det å få ein slankar organisasjon det betyr at aniserer,600.2,626.9,26.699999999999932,2016-10-26,2016-10-26_proceedings.txt
Stortinget-20161026-095635_626900_655200,og det har vi lagt inn i budsjettet at det vil koste noen hundretalls millioner kroner det vi gjør alt i alt men bare å sjå hva som vi ha har allerede fått ut fra nsb nsb har sagt at fordi at en og omorganiserer jernbanesektoren totalt sett så kan nsb ta vekk rundt tre hundre mellomledere det betyr at ja kommer det noen myndighetspersoner i noe av det som vi har ansvar for absolutt men kan du fjerne folk fra andre deler av jernbanesektoren i absolutt og i dobbelt,og der har me lagt ned i budsjettet at det vil kosta nokon hundretals millionar kroner i det me gjer alt i alt men bare sjå kva som me har allereie fått ut frå nsb nsb har sagt at fordi at ein og omorganiserer jernbanesektoren totalt sett så kan nsb ta vekk rundt tre hundre mellom ledarar det betyr at ja kommer det nokon myndigheitspersonar i nokon av det som me har ansvar for ja absolutt men kan du fjerna folk frå andre delar av jernbanesektoren ja absolutt og i dobbelt,626.9,655.2,28.300000000000068,2016-10-26,2016-10-26_proceedings.txt
Stortinget-20161026-095635_655200_685000,og det betyr at du må ikke bare sjå på de utgiftene som statsbudsjettet påløper seg men du må og sjå på de besparelsene som aktørene i jernbanesektoren får og da kommer de ut i en veldig god gevinst over tiddet åpnes for tilleggsspørsmål og første tilleggsspørsmål er fra eirik sivertsen deretter hans fredrik grøvan eirik sivertsen ja president jeg skal følge opp på spørsmålet om kostnader til jernbanesatsing,og det betyr at du må ikkje berre sjå på dei utgiftene som statsbudsjettet på løper seg men om og sjå på dei besparelsene som aktørane i jernbanesektoren får og då kom me ut i ein veldig god gevinst over tid det åpnes for tilliks spørsmålet og første tilleggsspørsmål er frå eirik sivertsen deretter er hans fredrik grøvan eirik sivertsenja president eg skal følgje opp på spørsmålet om kostnader til jernbanesatsing,655.2,685.0,29.799999999999955,2016-10-26,2016-10-26_proceedings.txt
Stortinget-20161026-095635_685000_713200,men jeg synes det er på sin plass først president å påpeke at når statsråden skryter av hvordan man jobber med etterslepet på jernbane så viderefører man etterslepet fra tjueseksten over i tjuesytten ifølge hans eget eee budsjett på mandag president så skrev bergens tidende om kostnadene ved å lage en ny tunnel på i ulriken i bergen den beskriver et anslag på overskridelser på en og en halv milliard eee kroner,men eg synest det på sin plass først president og påpeikar at når statsråden skryt av hor dei må jobbe med etterslepet på jernbane så vidarefor ein etterslepet frå tjueseksten og over tjuesytten ifølge hans eige eee budsjett på månda president så skreiv bergens tidene om kostnadane ved å lage ein ny tunell på i ulriken i bergen den beskriver eit anslag på overskridelser på ein og ein halv milliard eee kroner,685.0,713.2,28.200000000000045,2016-10-26,2016-10-26_proceedings.txt
Stortinget-20161026-095635_713200_736000,for meg så er det eee langt utover den kostnadsramma som stortinget er informert om eee tidligere og jeg har tre spørsmål til statsråden i den sammenheng president hvor lenge har statsråden visst om at kostnadsoverskridelsen faktisk eee foreligger og i hvilken størrelsesorden eee den har værtstatsråd solvikolsen,for meg så er det eee langt ut over en kostnadsrama som stortinget er informert om tilhøyr og eg har tre spørsmål til statsråden i den samanheng president kor lenge har statsråden vist om at kostnadsoverskridelsen faktisk eee foreligger og i vaa størrelseso den har vore statsråd solvikolsen,713.2,736.0,22.799999999999955,2016-10-26,2016-10-26_proceedings.txt
Stortinget-20161026-095635_736000_765600,ja president jeg har informert stortinget så fort den kunnskapen hun har kommet meg til høyre det betyr at det ligger omtalt i statsbudsjettet som stortinget nå har til behandling at kostnadsrammene sannsynligvis vil bli oversteget så har vi og informert om at vi satt i gang en vanlig prosess på det med kvalitetssikring fra eksterne folk for å se oss i kortene så stortinget vil bli informert så fort de tallene fins men eee representanten sivertsen kan og gå sjekka i totusenogseksten budsjettet der var det og informasjon som antyda dette,ja president eg har informert stortinget så fort den kunnskapen har kome meg til øyre det betyr at det ligg omtalt i statsbudsjettet som stortinget nå til behandling at kostnadsrammene sannsynlegvis vil bli overstige så har me og informert om at me sette i gang ein vanleg prosess på det med kvalitetssikring frå eksterne folk for å sjå seg kvartane så stortinget vil bli informert så fort dei talane finst men representanten sivertsen han og å sjekka i totusenogseksten budsjettet der var det og informasjon som antyda dette,736.0,765.6,29.600000000000023,2016-10-26,2016-10-26_proceedings.txt
Stortinget-20161026-095635_765600_794200,sånn at stortinget har ikke blitt eee lurt på noen måte sjøl om arbeiderpartiet har det som håper i fra tiden gi inntrykk av at de ikke vet noen ting men den informasjonen står altså i stortingsproposisjonen så vil jeg og nevne i og mat sivertsen tok det i sin innledning at det både i totusenogfemten seksten og sytten sa bevilgningene til jernbanevedlikehold vårt så stor at forfallet ikke øke totusenogfemten var det året som jernbaneverket sjøl sa at dette er det første store vedlikeholdsåret etter mange år med økt forfall under de rødgrønne,sånn at stortinget har ikkje blitt eee lurt på nokon måte sjøl om arbeidarpartiet har det som me håper i for tidning inntrykk av at dei ikkje veit nokon ting men denne informasjonen står altså i stortingsproposisjonen så vil eg og nemna i og med at sivertsen tok dei i sin innledning at både i totusenogfemten seksten og sytten så har bevilgningene til jernbane for likehald vore så stor at forfall ikkje øker totusenogfemten var det året som jernbaneverket sjøl sa at dette er det første store vedlikehaldseåret etter mange år med økt forfall under dei raudgrøne,765.6,794.2,28.600000000000023,2016-10-26,2016-10-26_proceedings.txt
Stortinget-20161026-095635_794200_816800,som blei forfallet nå redusert for første gang og jeg bare minne om at totusenogsytten budsjettet sjøl om det er litt lavere enn i seksten så er det allikevel høgere enn i totusenogfemten så var det store vedlikeholdsoveneste tilleggsspørsmål er fra hans fredrik grøvan deretter marit arnstadgrøvan president,så blei forfallet nå redusert for første gong og eg berre minne om at totusenogsytten budsjettet sjøl om det er litt lavere enn i seksten så har det likevel høgare enn i totusenogfemten så var det store vedlikehaldaste tilleggsspørsmål etter hans fredrik grøvan deretter marit arnstad grevane president,794.2,816.8,22.59999999999991,2016-10-26,2016-10-26_proceedings.txt
Stortinget-20161026-095635_816800_842200,jernbanereformen legger til rette for at jernbanen kan bli en sentral del av løsningen på befolkningsøkningen og at veksten i godstransport kan skje på en klimavennlig måte og det er synd at arbeiderpartiet ikke har innsett dette men la oss helle være konstruktive å se framover i jernbanemeldinga ble det uttrykt at kjøreveisavgiftene som skulle innføres måtte utformes på en måte som tok hensyn til den krevende situasjonen godsnæringa befinner seg i,jernbanereformen legg og til rette for at jernbanen kan bli ein sentral del av løysinga på befolkningsøkningen og at veksten i godstransport kan skje på ein klimavennleg måte og det er syn at arbeidarpartiet ikkje er innsett dette med la oss heller å vere konstruktive og se framover i jernbanemeldinga blei det uttrykt at kjørevegsavgifta som skulle innførast måtte utformast på ein måte som tok hensyn til den krevjande situasjonen godsnæringa befinner seg i,816.8,842.2,25.40000000000009,2016-10-26,2016-10-26_proceedings.txt
Stortinget-20161026-095635_842200_871000,ja det heter til og med i melding at denne avgiften bare i begrensa grad vil belaste godstrafikken nå er næringen og alle miljøer som er opptatt av å få mer gods over fra vei til bane og sjø sterkt bekymra for at kjøreveisavgiften skal bli en ny avgift som vil redusere godsmengden på bane kan statsråden bekrefte at gods på bane ikke skal belastes med kjøreveiavgift statsråd solvi solvikolsen president det er viktig for eee oss,ja det heter til og med i meldinga at denne avgifta berre er begrensa grad vil belaste godstrafikken nå er næringa og alle miljøa som er opptatt av å få meir gods over frå veg til bane og sjø sterkt bekymra for at kjørevegsavgifta skal bli ein ny avgift som vil redusere godsmengda på bane kan statsråden bekrefte at gods på bane ikkje skal belastast med kjørevegsavgiftstatsråd o solvik president det er viktig for oss,842.2,871.0,28.799999999999955,2016-10-26,2016-10-26_proceedings.txt
Stortinget-20161026-095635_871000_895900,både for regjeringen men jeg og oppfatter de som har eee vi har støtte fra i stortinget at vi ikke legger nye kostnader nye nettokostnader på jernbanen kjøreveisavgiften det er en en system der vi skal gi insentiv til at den som eier skinnene har en utgift hvis de ikke leverer kapasitet på skinnene jeg var på nor norsk jernbaneforbunds årsmøte for to dager siden,både for regjeringa men og og oppfattar dei som har eee me har støtte frå i stortinget at me ikkje legg nye kostnader nye nettokostnader på jernbanen kjørevegsavgifta det er ein ein system der me skal gi insentiv til at den som eig skinnene har ein utgift viss dei ikkje leverer kapasitet på kinnet eg var på no norsk jerbaneforbunds årsmøte for to dagar sidan,871.0,895.9,24.899999999999977,2016-10-26,2016-10-26_proceedings.txt
Stortinget-20161026-095635_895900_925300,de påpekte sjøl at når togene står fordi at infrastrukturen ikke virker så koster det nesten ingenting for jernbaneverket som eier skinnet men det koster mye for nsb som har passasjerene og for cargonett som har godset og ved å ha en kjøreveisavgift der du faktisk får en erstatning til nsb fra jernbaneverket da har du det økonomiske insentivet som har mangla til at jernbaneverket gjerne prioriterer vedlikeholdet sitt litt annerledes og ikke minst oppe tiden annerledes men jeg er helt enig i det underliggende spørsmålet man må sørge for at dette ikke blir en belastning,dei påpeiker sjøl at når toget står fordi at infrastrukturen ikkje verke så kostar det nesten ingenting frå jernbaneverket som eig sine men det kostar mye for nsb som har pasasjerane og for kargo nett som har godset og ved å ha ein kjørevegsavgift der du faktisk får ein erstatning til nsb frå jernbaneverket då har du det økonomiske insentivet som har manglar til at jernbane verke gjerne prioriterer vedlikehalder sitt litt andre ledes og ikkje minst oppetid den andrele men eg er heilt einig i det underliggande spørsmålet når me sørger for at dette ikkje blir ein belastning,895.9,925.3,29.399999999999977,2016-10-26,2016-10-26_proceedings.txt
Stortinget-20161026-095635_925300_934200,faggodstrafikken og det jobber vi med neste tilleggsspørsmål er fra marit arnstad deretter,for godstrafikken og det jobbar me med neste tilleggsspørsmål er frå medit arnstad deretter,925.3,934.2,8.900000000000091,2016-10-26,2016-10-26_proceedings.txt
Stortinget-20161026-095635_938800_965900,president den streiken som nå pågår for fjerde uke på jernbanen har nær sammenheng med regjeringas jernbanereform nsb bekrefta i dagsrevyen fredag fredags kveld at dem ikke kan innfri krav om utdanning for lokførere fordi det vil svekke dem i konkurransen med anna aktører når jernbanen blir konkurranseutsatt og det blir jo gjerne sånn at den må konkurrere enen til de reisende,t den streiken som no pågår for fjerde uke på jernbanen har nær samanheng med regjeringa si jernbanereformsv bekrefta i dagsrevyen fredagen fredags kveld at dei ikkje kan ginntre krav og utdanning for lokførarar fordi det vil svekke dei i konkurransen med andre aktørar når jernbanen blir konkurranseutsett og det blir jo gjern sånn at må konkurrere enden til reisene,938.8,965.9,27.100000000000023,2016-10-26,2016-10-26_proceedings.txt
