file,text_bm,text_nn,start,end,duration,date,proceedingsfile
Stortinget-20161026-095635_2311500_2340300,eee men for toget sin del så er bremsene nå satt på eee og det reises tvil faktisk om byggingen til hamar altså det indre intercity utbyggingen og for strekningen videre fra hamar til lillehammer faktisk er dette da snakk om hele doverbanen og fra og opp til trondheim så eee er det nå betydelig usikkerhet som statsråden sjøl sier eee om om å komme dit og særlig innen tjuetredve,eee men for toget sin del så er bremsene nå satt på eee og det reises tvil faktisk om bygginga til hamar altså det indre intercityutbygginga og for strekninga vidare frå hamar til lillehammer faktisk er dette snakk om heile doverbanen og frå eee og opp til trondheim så eee er det no betydeleg usikkerheit som statsråden sjøl seier eee om eee om å kome dit og sæle innan tjuetredve,2311.5,2340.3,28.800000000000182,2016-10-26,2016-10-26_proceedings.txt
Stortinget-20161026-095635_2340300_2367300,eee og statsråden reiser eee spørsmål ved hvordan vi planlegger det er vel og bra eee men nå er spørsmålet om vi faktisk vil eee om vi heller vil vei eee mer enn jernbane så kan statsråden garantere at vi skal til lillammer med dobbeltspor innen tjuetredve statsråd ke ketil solvikolsen altså inn til stortinget gjennom nye vedtak president så følger vi opp de vedtakene som har blitt gjort så skal det behandles en nasjonal transpt neste sommer,eee og statsråden reise eee spørsmål ved vordande planlegg i det er veldig bra eee men nå er spørsmålet om vi faktisk vil eee om vi heller vil vege eee med ein jernbane så kan statsråden garantere at vi skal til lilamme med dobbeltspor innan tjuetredvestatsråd setle solvikolsen altså inntil stortinget ga nye vedtak president så følger me opp dei vedtaka som har blitt gjort så skal det behandlast ein nasjonal transt neste sommar,2340.3,2367.3,27.0,2016-10-26,2016-10-26_proceedings.txt
Stortinget-20161026-095635_2367300_2396600,den vil gi nye føringer som eventuelt bekrefter gamle føringer eventuelt forsterke de eller endre de så derfor kan ikke jeg gi noen garanti om hva som ligger i tjuetretti men jeg kan si at vi jobber i dag i tråd med de vedtak stortinget har gjort og målet vårt er jo å få en jernbane som er mer attraktiv enn den vi har i dag at flere frivillige velger å reise med jernbanen og dermed kan ta vekk belastningen på veiene at vi får mer gods på jernbane sånn at de vogntogene som i dag kjører mil på mil,den vil gi nye føringar som eventuelt bekreftar gamle føringar eventuelt forsterke ding eller endra dei så derfor kan ikkje eg i nokon garanti om kva som ligg i tjuetretti men eg kan seie at me jobbar i dag i tråd med dei vedtak stortinget har gjort og målet vårt er jo å få ein jernbane som er meir attraktive enn det me har i dag at fleire frivillig vel å reise med jernbanen og dermed kan ta vekk belastinga på vegane at me får meir gods på jernbane sånn at dei mange toga som i dag køyrer mil på mil,2367.3,2396.6,29.299999999999727,2016-10-26,2016-10-26_proceedings.txt
Stortinget-20161026-095635_2396600_2423500,at de kan heller bruke av jernbanen i framtida men da må vi få en jernbane som der du egentlig ikke bare trenger nytt men du trenger å vedlikeholde det du har for det som har vært godsnæringens største ankepunkt har ikke vært mangel på dobbeltspor men det har vært at togene står at signalanlegg og lignende ikke fungerer og der meiner jeg at vi har gjort et kraftig løft langt utover det som den andre hadde planlagt når det gjelder vedlikehold på grunn av at venstre og krf høyre og frp har funnet sammen i bud,at dei kan heller bruka jernbane i framtida og men då må me få ein jernbane som det du eig ikkje berre treng nytt men du treng over likehaldet det du har for det som har vore godsnæringas største ankepunkt er ikkje vore mangel på dobbeltspor men det har vore at tåkene står at signalane eg og liknande ikkje fungerer og der meiner eg at me har gjort eit kraftig løft langt ut av det som den andre hadde planlagt når det gjeld vedlikehald på grunn av at venstre og krf høgre og frp har funne saman i bud,2396.6,2423.5,26.90000000000009,2016-10-26,2016-10-26_proceedings.txt
Stortinget-20161026-095635_2423500_2429300,vi går da videre på hovedspørsmålene og neste hovedspørsmål er fra geir pollestad,vi går da vidare på hovudspørsmåla neste hovudspørsmål er fra geir poldestad,2423.5,2429.3,5.800000000000182,2016-10-26,2016-10-26_proceedings.txt
Stortinget-20161026-095635_2436000_2465800,president jeg har spørsmål til næringsministeren regjeringa sin næringspolitikk er først og fremst å ikke ha en næringspolitikk ordninger som er retta inn mot enkeltnæringa kuttes systematisk næringspolitikken skal nøytraliseres norge har en betydelig industri og forskning knyttet til romfart og romvirksomhet dette er framtidsretta høyteknologiske arbeidsplasser romindustrien omsetter for sju milliarder kroner i året,president eg har spørsmål til næringsministeren regjeringa sin næringspolitikk er fyrst og fremst ikkje å ha ein næringspolitikk ordningar som er retta inn mot enkeltnæringar kuttast systematisk næringspolitikken skal nøytraliserast noreg har ein betydeleg industri og forsking knytta til romferd og romvirksomhet dette er framtidsretta høgteknologiske arbeidsplassar romindustrien omsette for sju milliardar kroner i året,2436.0,2465.8,29.800000000000182,2016-10-26,2016-10-26_proceedings.txt
Stortinget-20161026-095635_2465800_2495100,norge har et godt utgangspunkt for å utvikle dette videre for å utløse og vekst er det to eee ting som er viktig at norge bidrager til de frivillige programmer i den europeiske romfartsorganisasjonen esa dette gir norske eee bedrifter og norsk industri kontrakter og oppdrag næringsministeren sitt svar til industrien er foreslått et kutt på sytti prosent i norges deltakelse i programmet det andre tiltaket er nasjonale følgemidler,noreg har eit godt utgangspunkt for å utvikle dette vidare for utanlandsa vekst er det to eee ting som er viktig at noreg bidreg til dei frivillige programma i den europeiske romferdsorganisasjonen esa dette gjer norske eee bedrifter og norsk industri kontraktar og oppdrag næringsministeren sitt svar til industrien er å foreslå eit kutt på sytti prosent i noregs deltakelse i programma det andre tiltaket er nasjonale følgemidel,2465.8,2495.1,29.299999999999727,2016-10-26,2016-10-26_proceedings.txt
Stortinget-20161026-095635_2495100_2524200,de er avgjørende for at norsk omfandsesindustri kan delta i den internasjonale konkurransen næringsministeren sitt svar er å foreslå å kutte førti prosent i disse midla til neste år det er sånn at for hver krone staten putter inn så får en eee industrien fem kroner i eee retur en sånn politikk for å bygge norsk industri og kompetanse ligger senterpartiet det er tydeligvis ikke høyre og fremskrittspartiet,dei er avgjerande for at norsk romfartsindustri kan delta i den internasjonale konkurransen næringsministeren sitt svar er å foreslå å kutta førti prosent i desse midla til neste år det er sånn at for kvar krone staten puttar inn så får ein eee industrien fem kroner i eee retur ein sånn politikk for å bygga norsk industri og kompetanse like senterpartiet det gjer tydelegvis ikkje høgre og framstegspartiet,2495.1,2524.2,29.09999999999991,2016-10-26,2016-10-26_proceedings.txt
Stortinget-20161026-095635_2524200_2549600,for det er ikke tvil med åpne over så legger regjeringa ned lønnsomme høgteknologiske arbeidsplasser i norge det kan være i namo i kongsberg gruppen og en rekke bedrifter rundt om i landet så mitt spørsmål til næringsministeren er kan næringsministeren forklare hvorfor det er så viktig for henne å bygge ned norsk romfartsnæring statsråd monica mæland,for det er ikkje tvil med opna aue så legg regjeringa ned lønsame høgteknologiske arbeidsplassar i noreg det kan vere i nammo i kongsberg gruppen og ein rekke bedrifter rundt om i landet så mitt spørsmål til næringsministeren er kan næringsministeren forklara kvifor det er så viktig for henne å bygga ned norsk romferdsnæringstatsråd monica mæland,2524.2,2549.6,25.40000000000009,2016-10-26,2016-10-26_proceedings.txt
Stortinget-20161026-095635_2549600_2577200,ja president eee jeg er opptatt av først og fremst ha en næringspolitikk som virker og derså derfor så tør vi å gjøre ganske grundige gjennomganger av de virkemidlene vi har på staten sånn og derfor så har man og sett at vi etter ssbs analyser har eee nedskalert tematiske programmer og oppskalert landsdekkende brede programmer det er god eee næringspolitikk fordi det treffer alle næringer i hele landet så er jeg helt enig mede representanten pollestad,ja president eee eg er opptatt av først og fremst av ein næringspolitikk som verkar og derså derfor så tør vi å gjere ganske grundige gjennomganger av dei verkemiddela vi har på staten sånn og derfor så har ein no sett at vi etter ssbs analyser har eee nedskalert tematiske programma og oppskalert landsdekkende bree programma det er god eee næringspolitikk fordi det treffar alle næringar i heile landet så er eg heilt einig mede representanten pollestad,2549.6,2577.2,27.59999999999991,2016-10-26,2016-10-26_proceedings.txt
Stortinget-20161026-095635_2577200_2596600,i at det å satse på romprogrammet og romforskning er viktig vi har en beliggenhet og en topografi som gjør at vi i særlig grad har nytte av det og vi har en vik viktig romindustri men det er altså sånn når vi skal lage budsjetter så er vi nødt til å prioritere det er vanskelig,i at det å satse på romprogram og romforsking er viktig vi har ein beliggenhet og ein tokografi som gjer at vi i særleg grad har nytte av det og vi har ein viktig viktig romindustri men det er altså sånn når vi skal lage budsjetta så er vi nøydd til å prioritere det er vanskeleg,2577.2,2596.6,19.40000000000009,2016-10-26,2016-10-26_proceedings.txt
Stortinget-20161026-095635_2596600_2626500,det er krevende men vi må gjøre det fra regjeringens side så har prioritet nummer en vært å møte den situasjonen vi har på sør og vestlandet i form av tiltak gjennom fjoråret året og for neste år det andre er å bidra til at næringslivet greier å gjennomføre helt nødvendige omstillinger og det gjør vi ved å videreføre den kraftige satsingen vi har på landsdekkende programmer som vi vet virker og som treffer alle næringer også eee romfartsnæringene,det er krevjande men vi må gjere det frå regjeringas side så har prioritet nummer ein vore å møte den situasjonen vi har på sør og vestlandet i form av tiltak gjennom fjoråret året og for neste år det andre er å bidra til at næringslivet greier å gjennomføre helt nødvendige omstillingar og det gjer vi ved å vidareføre den kraftige satsinga vi har på landsdekkande programma som vi veit verkar og som treffer alle næringar også eee romfartsnæringane,2596.6,2626.5,29.90000000000009,2016-10-26,2016-10-26_proceedings.txt
Stortinget-20161026-095635_2626500_2646000,eee og derfor så er det slik at vi bruker en milliard kroner i året på romfartsprogrammer vi er med i egnos galileo eee companies store viktige programmer for norge og vi har og følgemidler som er foreslått nedjustert rett og slett fordi at de har mindre nytteeffekt,eee og derfor så er det slik at vi bruker ein milliard kroner i året på romfartsprogramm vi er med i eigne skal eleo eee kopen store viktige programma for noreg og vi har og følgemiddel som er foreslått nedjustert rett og slett fordi at dei har mindre nytteeffekt,2626.5,2646.0,19.5,2016-10-26,2016-10-26_proceedings.txt
Stortinget-20161026-095635_2646000_2675400,eee enn det andre programmer har også kan romindustrien hente midler fra de landsdekkende programmene til liks med alle andre og man kan ikke minst hente hjem mye større bidrag fra horison vi har en industri som i for liten grad greier å hente hjem bidrag fra eee vår europeiske satsing det bruker forskningsrådet nå mye ressurser på å hjelpe industrien men vi er helt enig i at dette er viktig men noe annet har også vært viktigere for oss pollestad,eee enn det andre programma har og så kan rommeindustrien hente midlar frå dei landtekne programmet til liks med alle andre og men kan ikkje minst hente hjem mye større bidrag frå horasen vi har ein industri som i for liten grad greier å hente gjem bidrag frå eee vår europeiske satsing de bruker forskingsrådet nå myr ressursar på å hjelpe industrien men vi er heilt einig i at dette er viktig men no anna har også vore viktigare for osspornestad,2646.0,2675.4,29.40000000000009,2016-10-26,2016-10-26_proceedings.txt
Stortinget-20161026-095635_2675400_2704600,jeg vil takke for eee svaret det er jo eee litt spesielt å høre at næringsministeren argumenterer så tungt eee for dette eee og kjem med så dramatiske konklusjoner som et sytti prosent kutt i de frivillige programmer til esa som førti prosent kutt i følgemidlene dette skjer altså mens eee stortinget venter på en romfartsstrategi og dette vil jo ha virkning mange år framover,eg vil eee takka for eee svaret det er jo eee litt spesielt å høyra at næringsministeren argumenterer så tungt eee for dette eee og kjem med så dramatiske konklusjonar som eit sytti prosent kutt i dei frivillige programmets som førti prosent kutt i følgemiddla dette skjer altså mens eee stortinget ventar på ein romferdsstrategi og dette vil jo ha verkning mange år framover,2675.4,2704.6,29.199999999999818,2016-10-26,2016-10-26_proceedings.txt
Stortinget-20161026-095635_2704600_2731100,den beslutningen som blir tatt i eee hast når det gjelder sør og vestlandet ja så er det jo nettopp sånn at det er mange bedrifter på sør og vestlandet som ser er det muligheter inn forbi eee romfart disse mulighetene vraker eee regjeringa med dette forslaget så mitt spørsmål er igjen eee meiner næringsministeren at dette g,den beslutninga som blir tatt i eee haust når det gjeld å sør og vestlandet jo så er det jo nettopp sånn som mange bedrifter på sør og vestlandet som ser er det muligheter inn forbi eee romfart desse mulighetene vrakar eee regjeringa med dette forslaget så mitt spørsmål er igjen eee meiner næringsministeren at dette g,2704.6,2731.1,26.5,2016-10-26,2016-10-26_proceedings.txt
Stortinget-20161026-095635_2731100_2759000,eller er det finansministeren som har vunnet denne runden statsråd mæland ja president jeg tar fullt ut ansvar for næring og fiskeridepartementenes eee budsjett jeg har vært tydelig på at vi har vært nødt til å prioritere og det aller viktigste nå det er at mennesker som har mistet jobben sin på sør og vestlandet kommer i arbeid så er det og viktig at industrien i hele landet greier å gjennomføre nødvendige omstillinger og vi ser altså at dette er programmer so virker som treffer,eller er det finansministeren som har vunne denne runda statsråd mæland ja president eg tar fullt ut ansvar for næring og fiskeridepartementets eee budsjett eg har vore tydeleg på at vi har vore nøydd til å prioritere og det aller viktigaste no det er at menneske som miste eit jobbene på sør og vestlandet kommer i arbeid så er det og viktig at industrien i heile landet greier å gjennomføre nødvendige omstillingar og vi ser altså at dette er programmet so verkar som treffar,2731.1,2759.0,27.90000000000009,2016-10-26,2016-10-26_proceedings.txt
Stortinget-20161026-095635_2759000_2787000,alle næringer i hele landet vi brukte ikke eventyrlige år på å forberede oss på tøffere tider det ser vi nå vi er sårbare og vi må gjennom en omstilling så mener jeg og at romfartssatsingen er viktig vi bruker en milliard kroner i året og vi ser og at industrien kan hente midler fra andre programmer enn de som er tematisk knyttet opp til denne industrien men dette er også tøffe prioriteringer som vi er nødt til å gjøre og da er noe viktigere enn noe annet,alle næringar i heile landet vi bruker ikkje eventyrleg år på å forberede oss på tøffere tider det ser vi no vi er sårbare og vi må gjennom ein omstilling så meiner eg og at romferdssatsinga er viktig vi bruker ein milliard kroner i året og vi ser og at industrien kan hente midlar frå andre programma enn dei som er tematisk knytt opp til denne industrien men dette er altså tøffe prioriteringar som vi er nøydt til å gjere og då er noko viktig renoant,2759.0,2787.0,28.0,2016-10-26,2016-10-26_proceedings.txt
Stortinget-20161026-095635_2787000_2794600,det åpnes for tilleggsspørsmål og første tilleggsspørsmål er fra marit arnstad qqq deretter odd omland,doknes for tilleggsspørsmål og første tilleggsspørsmål er fra marit arnstad deretter odd omland,2787.0,2794.6,7.599999999999909,2016-10-26,2016-10-26_proceedings.txt
Stortinget-20161026-095635_2798700_2823800,arnstadpresident jeg må i sannhet si at det er mye underlig med det her kuttet eee nå sier da statsråden at dessverre må vi prioritere og da erkjenner jeg jo da at vi prioriterer altså ned noe av det som er noe av det mest høyteknologiske og fornuftige vi driver med blant anna romindustrien eee men samtidig som seksten jo i budsjettet så priser en jo industrien den delen av industrien opp og ned,arnstadpresident eg må i sannhet se at det er mye underleg med det her kuttet eee no seier da statsråden at dessverre må vi prioritere og da erkjenner eg jo da at vi prioriterer altså ned noko av det som gjer noko av det mest høgteknologiske og fornuftige vi driv med førde kan ja romindustri eee men samtidig så seier ein jo budsjettet så prisene jo i industrien den delen av industrien opp og ned,2798.7,2823.8,25.100000000000364,2016-10-26,2016-10-26_proceedings.txt
Stortinget-20161026-095635_2823800_2851000,eee og så vil han da kutt og en har også varsla også at det kan komme framtidige kutt i industrien det er det ene som underlig det andre som ynderlig er jo at en da kutter i forkant av den breie strategien som en skal få når det gjelder romindustrien som kunne ha gitt et grunnlag for hvordan veien videre skal utformes statssekretæren til stats eee til statsråden sier at jeg erkjenner også at den lavere deltakelsen kjem til å giil norske industri,eee og så ver ein det kutt og ein har også varsla oss å at det kan komma framtidige kutt i industrien det er det eine som er yndeleg det andre so mynderleg er jo at ein da kuttar i forkant av den breie strategien som en skal få når det gjeld romindustrien som kunne ha gitt eit grunnlag for korleis vegen vidare skal utformast statssektæren til stats eee til statsråden seier at eee erkjenner også at ein lavre deltakelsen kjem til å gitil norske industri,2823.8,2851.0,27.199999999999818,2016-10-26,2016-10-26_proceedings.txt
Stortinget-20161026-095635_2851000_2874900,ja at regjeringa med åpne auge har kuttet i tiltak men dem har ingen konsekvenser vet ikke hvilke konsekvenser det faktisk vil ha det eneste en prøver å gjømme seg bak er at mi at du har at du setter opp imot midler til sør og vestlandet men det her er jo også midler som leverandørindustrien er svært opptatt av og spørsmålet er hvordan konsekvenser eee vil det få har regjeringa foretatt noen beregning av det statsråd mæland ja eee,ja at regjeringa må opne auga kutte i tiltak men dei har ingen konsekvensar eg veit ikkje kva konsekvensar det faktisk vil ha det eineste ein prøver å gjømme seg bak er at me at du har at du set deg opp imot midlar til sør og vestlandet men det her er jo også midlar som leverandørindustrien er svært opptatt av og spørsmålet er korleis konsekvensar eee vil det få har regjeringa foretatt ein berekning av det statsråd mæland ja eee,2851.0,2874.9,23.90000000000009,2016-10-26,2016-10-26_proceedings.txt
Stortinget-20161026-095635_2874900_2899000,president det er faktisk sånn at vi skal delta i like stor grad neste år som det vi gjør i år det foregår ingen kutt for neste år det vi har varslet er at deltakelsen i den f i den frivillige programmet eee til esa fra atten vil bli redusert det har vi vært tydelig og ærlig på som jeg sier dette er tøffe prioriteringer vi må nå gjøre eee noe for å motvirke akuttsituasjonen knyttet til arbeidsledighet,president det er faktisk sånn at vi skal delta i like stor grad neste år som det vi gjer i år det foregår ingen kutt for neste år det vi har varslet er at deltakelsen inn i den frivillige programmet eee til esa frå atten vil bli redusert det har vi vore tydeleg og ærlig på som me seier dette er tøffe prioriteringar vi må no gjere eee noko for å motteke akuttsituasjon knytte til arbeidsledighet,2874.9,2899.0,24.09999999999991,2016-10-26,2016-10-26_proceedings.txt
Stortinget-20161026-095635_2899000_2915950,så gjør vi noe for å møte omstillingsbehovet i næringslivet i hele landet og vi har også brukt ganske mye krefter på å la eee ssb gjennomføre virkemiddelbruken vår i innovasjon norge i forskningsrådet og det er de store landsdekkende programmene som også treffer romindustrien som,så gjer vi noko for å møte omstillingsbehovet i næringslivet i heile landet og vi har også brukt ganske mykje krefter på å la eee ssb gjennomføre i verkemiddelbruken vår i innovasjon noreg i forskningsrådet og det er dei store landtekkende på ommane som også treffar romindustrien som,2899.0,2915.95,16.949999999999818,2016-10-26,2016-10-26_proceedings.txt
Stortinget-20161026-095635_2915950_2941500,dekker eee de målene vi har best da er det de vi har satset på så skal vi delta i esa vi skal fortsatt ha en stemme der vi skal påvirke programmene og vi har retur eee til de programmene og vi kan oppnå retur ved også å benytte andre virkemidler både i norge og i euneste tilleggsspørsmål er fra odd omland deretter pål farstad,dekker eee dei måla vi har best da er det de vi har satsa på så skal vi delta i esa vi skal fortsatt ha ein stemme der vi skal påverke programmene og vi har retur eee til dei programma og vi kan oppnå retur ved også benytte andre verkemiddel både i noreg og i euneste tilleggsperson der frå odd omland er dette på farsta,2915.95,2941.5,25.550000000000182,2016-10-26,2016-10-26_proceedings.txt
Stortinget-20161026-095635_2941500_2966800,ja president eee sånn som vi leser statsbudsjettet så legges det opp eee til å redusere norges bidrag til esas frivillige programmer fra en heil såkalt nni andel til en hvert andel og i høringen så blei det fra flere hold eee påpekt hvor store konsekvenser dette ville få for eee norsk onvirksomhet og ni frodig har uttrykk for at sytti prosent kutt i eee,ja president eee sånn som me les i statsbudsjettet så leggast det opp til å redusere noregs bidrag til esa frivillige programma frå ein heil såkalla nniandel til ein kvart andel og i høyring så blei det frå fleire hald påpeikt kor store konsekvensar dette ville få for eee norsk rundvirksomhet og ni frå diga uttrykk for at sytti prosent kutt i,2941.5,2966.8,25.300000000000182,2016-10-26,2016-10-26_proceedings.txt
Stortinget-20161026-095635_2966800_2994000,deltagelsen au ville bety sytti prosent kutt i de industrielle oppdragene og at det på sikt kunne medføre at norsk eee romvirksomhet ble avvikla allerede første desember er det et viktig ministerrådsmøte i esa hva kommer regjeringen til å meddele dette møtet når det gjelder størrelsen på norges deltagelse i esas fi frivillige statsråd mæland,deltakelsen au ville bety sytti prosent kutt i dei industrielle oppdragene og at det på sikt kunne medføre at norske rommevirksomhet blei avvikla allereie fyrste desember er det eit viktig ministerrådsmøte i esa kva kom regjeringa til å meddela dette møtet når det gjeld størrelsen på noregs deltakelse i ess frivillige statsråd mæland,2966.8,2994.0,27.199999999999818,2016-10-26,2016-10-26_proceedings.txt
Stortinget-20161026-095635_2994000_3020400,ja president eee vi vil jo meddele det som blir stortingets vedtak i budsjettet eee og det er det vi har invitert stortinget til å mene noe om i budsjettet som er lagt frem eee hvis man mener at romindustrien blir nedlagt som følge av dette så mener jeg det er helt feil hvis eee vi satser altså over en milliard kroner i året vi deltar i alle store viktige programmer og vi skal og delta videre i eten,ja president eee vi vil jo meddele det som blir stortingets vedtak i budsjettet eee og det er det vi har invitert stortinget til å meine noko om i budsjettet se lagt fram eee viss ein meiner at romindustrien blir nedlagt som følge av dette så meiner eg det er heilt feil viss vi satsar altså over ein milliard kroner i året vi deltar i alle store viktige programma og vi skal og delta vidare i eten,2994.0,3020.4,26.40000000000009,2016-10-26,2016-10-26_proceedings.txt
Stortinget-20161026-095635_3020400_3049400,og perioden fireårsperioden videre så er det foreslått en lavere deltagelse enn i dagneste tilleggsspørsmål er fra pål farstad deretter torgeir knag fylkesnes barstad det er gledelig president å kunne ta opp tråden fra forrige spørretime om eee romforskning og romsatsing at vi også kan få næringsministeren sitt syn på,og perioden fireårsperioden vidare så er det foreslått ein lavare deltakelse enn i dagneste tilleggspørsmål der frå pol og farstan deretter tørgeknag fylkenes wara det er gledelig president å kunne ta opp tråden frå forrige spørjetimet om eee romforsking og romsatsing at vi også kan få næringsministeren sitt syn på,3020.4,3049.4,29.0,2016-10-26,2016-10-26_proceedings.txt
