file,text_bm,text_nn,start,end,duration,date,proceedingsfile
Stortinget-20180109-095530_3437400_3463800,så langt debtors prison av robert kuttner president markedskreftenes fire friheter fri bevegelse av varer tjenester kapital og arbeidskraft overstyrer folkevalgte sine mulighet gjennom vedtak i stortinget til å korrigere de svake sidene ved markedsøkonomien og det er noe av hovedproblemet som vi står oppi og som det må økt fokus på eøsavtalen ø,så langt debitors prisen av robert kuttnyr president markedskreftenes fire friheter fri bevegelse av varer tenester kapital og arbeidskraft overstyrer folkevalde sine mulighet gjennom vedtak i stortinget til å korrigere dei svake sidene ved markedsøkonomien og det er noko av hovudproblemet som vi står oppi og som det må økt fokus på eøsavtalen ø,3437.4,3463.8,26.40000000000009,2018-01-09,2018-01-09_proceedings.txt
Stortinget-20180109-095530_3463800_3481400,for den norske modellen forutsetter at folkevalgte kan korrigere markedskreftene og videre president eøsavtalen ødelegger mulighetene for full sysselsetting og norske lønns og arbeidsvilkår fordi at vi har et felles arbeidsmarked med land som har så stor forskjellighet,for den norske modellen forutsetter at folkevalde kan korrigere markedskriftene og vidare president eøsavtalen ødelegger mulighetene for full sysselsetting og norske lønns og arbeidsvilkår fordi at vi har eit felles arkarbeidsmarked med land som har så stor forskjellighet,3463.8,3481.4,17.59999999999991,2018-01-09,2018-01-09_proceedings.txt
Stortinget-20180109-095530_3481400_3508000,at det er helt naturlig at mennesker kommer da til norge for å dermed få økte muligheter i sine liv eøsavtalen innebærer så store systemfeil at det må avløses president neste taler er michael tetzschner tetzschner er sakens ordfører vær så godpresident de to siste innleggene gir jo anled anledning til å refll,at det er heilt naturleg at mennesker kommer da til noreg for å dermed få økte muligheter i sine liv eøsavtalen inneber så store xxx at det må avløses president neste talar er michael petserte sakas ordførar ver så godpresident des to siste innlegga gir jo anled anledning til å reflil,3481.4,3508.0,26.59999999999991,2018-01-09,2018-01-09_proceedings.txt
Stortinget-20180109-095530_3508000_3535100,kvitte seg med markedsøkonomien som har gitt oss velferd sikre arbeidsplasser og finansieringsgrunnlag for velferdsstaten så er det selvfølgelig lettere å gjøre det på egenhånd da kan man jo se til lukkede land som helt stenger seg ute fra fra verden det kan vel jo være av de alternativene som senterpartiet vil eee ha utredet eller så må jeg jo på slutten av denne debatten president at eee,kvitil seg med markedsøkonomien som har gitt oss eee velferd sikre arbeidsplassar og og finansieringskilde for velferdsstaten så er det selvfølgelig lettare å gjere det på eigen hand det kan ein jo eee se til lukkede land som eee heilt stenger seg ute frå frå verden eee det kan vel vere dei alternativa som senterpartiet vil eee ha utredet eller så må eg jo på slutten av denne debatten president at eee,3508.0,3535.1,27.09999999999991,2018-01-09,2018-01-09_proceedings.txt
Stortinget-20180109-095530_3535100_3563900,den har jo vært litt forutsigelig eee bortsett fra at det også har kommet nye representanter i forsamlingen som utmerker seg ved å kanskje ikke helt ha klart for seg når man bruker eksemplene som datalagringsdirektivet som ble vedtatt her i stortinget ble altså da eee underkjent av eus egen domstol ut fra prinsippene eee og avveiingsbestemmelsene som er de samme i mk,den har jo vore litt forutsigeleg eee bort sett frå at det også har kommet nye representantar i forsamlinga som utmerker seg ved og kanskje ikkje heilt ha klart for seg når ein bruker eksempel som datalagringsdirektivet som blei vedtatt her i stortinget blir altså da eee underkjent av eus eigen domstol ut frå prinsipp eee og avvenningsbestemmelsene som er det same i mk,3535.1,3563.9,28.800000000000182,2018-01-09,2018-01-09_proceedings.txt
Stortinget-20180109-095530_3563900_3592700,altså respekten for privatliv så der er et eksempel på at vi brukte en lokal handlefrihet på en måte som eee eudomstolen ikke eee tilrådde og derfor ble det ikke i den eee form ellers så reagerer jeg president på at man sier at x y og z avtaler ikke er forelagt det norske folk nei det er fordi vi har et representativt demokrati hvor forskjellige uttrykksformer og synspunkter kommer frem der jo også denne debatten et eksempel på men det jeg ville bruke mine siste,altså respekten for privatliv så der er eit eksempel på at vi brukte ein lokal handlefrihet på ein måte som eee eudomstolen ikkje eee tilråd og derfor blei det ikkje i den eee formen eller så reagerer jeg president på at ein seier at ksi og set avtaler ikkje er forlagt til norske folk nei det er fordi vi har til representativt demokrati vore forskjellige uttrykksformer og synspunktet kommer frem det også denne debatten eit eksempel på men det eg ville bruke det siste,3563.9,3592.7,28.799999999999727,2018-01-09,2018-01-09_proceedings.txt
Stortinget-20180109-095530_3592700_3622300,eee minutter til president det var å henlede oppmerksomheten på arbeiderpartiets innlegg her for det kommer jo altså da et massivt angrep på hele vår markedstilknytning for øvrig med utgangspunkt i noe så uskyldig som et representantforslag jeg vil gjøre presidenten oppmerksom på at vi har en bestemmelse om at presidenten kan anmode deltakerne i debatten om å holde seg til saken men det er altså representantforslaget som ikke har flertall i denne sal som vi behandler,eee minutter til president det varde henlede oppmerksomheten på eee arbeidarpartiets innlegg her for det kommer altså da eit massivt eee angrep på heile vår eee markedstilknytning eee for øvrig med utgangspunkt i no som skyldes som eit representantforslag eg vil gjere presidenten oppmerksom på at vi har ein bestemmelse om at presidenten kan anmode eee deltakar i debatten om å halde seg til saka og det er også i representantforslaget som ikkje har fleirtal i denne sal som vi behandlar,3592.7,3622.3,29.600000000000364,2018-01-09,2018-01-09_proceedings.txt
Stortinget-20180109-095530_3622300_3645600,og ikke alt mulig annet men det må jeg likevel si at når da eee komiteleder bruker sin taletid til å angripe høyre når vi er sammen i innstillingen om å forsvare eøsavtalen og ikke ser det at det er hensiktsmessig å bruke tid på å utrede alternativer nå også fordi den usikkerheten det kan bidra til i seg selv så eee så eee blir jeg forundret,og ikke alt mulig han men det må jeg likevel si at når da eee komitelede bruker sin taletid til å angripe høgre når vi er saman i innstillinga om å forsvare eøsavtalen og ikkje ser det at det er hensiktsmessig å bruke tid på å utrede alternativer nå også fordi den usikkerheita det kan bidra til i seg selv så så blir det forundre,3622.3,3645.6,23.299999999999727,2018-01-09,2018-01-09_proceedings.txt
Stortinget-20180109-095530_3645600_3672000,og samtidig når man av samme innlegget ikke hører et eneste realargument for den innstillingen som arbeiderpartiet har satt sitt navn under og da vil jeg gi arbeiderpartiet en eee et lite varsel hvis de overlater disse debattene så til de de skal samarbeide med i regjering og ikke stiller opp for de synspunktene vi har eee når det gjelder det som har skaffet oss v,og sam tidig når ein har same innlegg ikkje høyrer eit einaste realargument for den innstillinga som arbeidarpartiet har satt sitt nav nu ner og da vil eg gi arbeidarpartiet ein eit lite varsel viss dei overlate desse debattane så til de de skal samarbeide med regjering og ikkje tilrop for dei synspunkta vi har eee når det gjeld det som har skaffa oss eee v,3645.6,3672.0,26.40000000000009,2018-01-09,2018-01-09_proceedings.txt
Stortinget-20180109-095530_3672000_3685600,så kan vi få et alternativ eventuelt etter et annet valg med et annet flertall som arbeiderpartiet må basere seg på som blir en stor overraskelse for det norske folkneste taler er svein roald hansen deretter kjersti toppe,så kan vi jo få eit alternativ eee eventuelt etter eit anna val med eit anna fleirtal som arbeidarpartiet må basere seg på som blir en stor overraskelse for det norske folkneste talar er svein roald hansen deretter er det kjersti toppe,3672.0,3685.6,13.599999999999909,2018-01-09,2018-01-09_proceedings.txt
Stortinget-20180109-095530_3693000_3721900,hansen president eee kjernen i eøsavtalen er å sikre norsk næringsliv best mulig adgang til vårt viktigste eksportmarked og derfor er spørsmålet når man snakker om alternativer og som ingen har berørt i debatten et alternativ som skal være bedre for hva og for hvem det får vi aldri noe svar på det argumentet som brukes er demokrati,hansen president eee kjernen i eøsavtalen er å sikre norsk næringsliv best mulig adgang til vårt viktigaste eksportmarke og derfor er spørsmålet når me snakkar om alternativet og som ingen har berørt i debatten eit alternativ som skal vere betre for var og for vem det får vi aldri noko svar på det argumentet som brukast er demokrati,3693.0,3721.9,28.90000000000009,2018-01-09,2018-01-09_proceedings.txt
Stortinget-20180109-095530_3721900_3745700,og det er helt riktig vi har valgt en modell som ikke gir oss representasjon i de styrende organer i i i eu og dermed mindre innflytelse som vi kunne ha hatt men så må vi ikke glemme at når vi behandler innstillingen fra eee utenriks eee komiteens eee om budsjettet for neste år så står det år om annet,og det er heilt riktig vi har valt ein modell som ikkje gir oss representasjon i dei styrande organet i eee i eu og dermed mindre innflytelse som vi kunne ha hatt men så må vi ikkje gløyme at når vi behandlar innstillinga frå eee utanrikskomiteens eee om budsjettet for neste år så står det år om anna,3721.9,3745.7,23.799999999999727,2018-01-09,2018-01-09_proceedings.txt
Stortinget-20180109-095530_3745700_3773300,at norge er tjent med at forholdet mellom land er regulert av internasjonale traktater konvensjoner og institusjoner og tenk på havretten hva den har betydd for oss så når representanten nina barstad sier at lover skal vedtas nasjonalt ja det går an å mene det selvsagt men hvordan skal man da få til et forpe samarbeid mellom land,at noreg er tent med at forholdet mellom land er regulert av internasjonale traktater konvensjonar og institusjonar og tenk på havretten va den har betydd for oss så når representanten nina barstad seier at lover skal vedtas nasjonalt ja det går han å meine det er selvsagt men korleis skal ein då få til forpl samarbeid mellom land,3745.7,3773.3,27.600000000000364,2018-01-09,2018-01-09_proceedings.txt
Stortinget-20180109-095530_3773300_3801700,om vi ikke er villige til å gi fra oss noe suverenitet som kan utøves i fellesskap gjennom internasjonale eee organer og traktater hvordan skal vi da få gjennomført tiltak mot klimaendringer eller mot eee skatteparadiser vaclav havel han sa da tsjekkia gikk inn i eu jeg oppgir gjerne noe av vår suverenitet til fordel for en felles suverenitet som må utøves i forhold til,om vi ikkje er villig til å gifra oss noko suverenitet som kan utøves i fellesskap gjennom internasjonale eee organer og traktater borde i skal vi da få gjennomført tiltak mot klimaendringar eller mot eee skatteparadiser var slags havel han sa der sjekka gjekk inn i eu eg oppgir gjerne noko av vår suverenitet til fordel for ein felles suverenitet som må utøves i forhold til,3773.3,3801.7,28.399999999999636,2018-01-09,2018-01-09_proceedings.txt
Stortinget-20180109-095530_3801700_3831500,eee utfordringer som bare kan løses i fellesskap så sa representanten steinar ness at eøsavtalen undergraver den norske modellen med mindre forskjeller og tillit mellom oss det gjør den slettes ikke det handler om nasjonal politikk som vi i stor grad har lyktes med gjennom disse årene og som vi skal slåss om på den nasjonale arena men det er noen forhold av de kreftene som drar i feil retning,eee utfordringar som berre kan løysast i fellesskapet så sa representanten steinar ness at eøsavtalen undergrev den norske modellen med mindre forskjeldir og tillit mellom oss nei det gjer den slett til sikke det handlar om nasjonal politikk som vi i stor grad har lykkast med gjennom desse åra og som vi skal slåss om på den nasjonale eee arena men det er nokon for og av dei kreftene som drar i feil retning,3801.7,3831.5,29.800000000000182,2018-01-09,2018-01-09_proceedings.txt
Stortinget-20180109-095530_3831500_3859600,som bare kan løses i fellesskap for eksempel hvordan får vi til rettferdig skattlegging av eee av internasjonale store konserner hvordan bekjemper vi bruk av skatteparadiser så sier sigbjørn gjelsvik hvorfor skal vi tviholde på eøs jo president vi skal det fordi det er best for norsk næringslivs eksportmuligheter og som plattform for vårt omfattende samarbeid med eu og eulandene for øvrig,som bere kan løyses i fellesskap for eksempel vor lei får vi til rettferdig skattlegging av eee av internasjonale store konserner korleis bekjemper vi bruk av skatteparadiser så seier sigbjørn gjelsvik vorfor skal vi tviholde på eøs jo president vi skal det fordi det er best for norsk næringslivs eksportmuligheter og som plattform for vårt omfattande samarbeid med eu og eulandet for øvrig,3831.5,3859.6,28.09999999999991,2018-01-09,2018-01-09_proceedings.txt
Stortinget-20180109-095530_3859600_3882000,og representanten nicholas wilkinson han sier at eøs blir udemokratisk tredd ned over hodene på folk mener wilkinson at vedtak vi gjør i denne saken salen er udemokratiske og tres ned over hodene på folkneste taler er kjersti toppe deretter statsråd marit berger røsland kjersti toppe,og representanten nicholai wilkesen han seier at eøs blir udemokratisk skjedd ned over hovudet på folk meiner vilkensen at vedtak vi gjer i denne saka salen er udemokratisk og tres ned over hodene på folkneste talar er er kjersti toppe deretter statsråd eee marit berget rusland kjersti toppe,3859.6,3882.0,22.40000000000009,2018-01-09,2018-01-09_proceedings.txt
Stortinget-20180109-095530_3884400_3907000,takk eee president eee senterpartiet foreslår at det blir satt ned et offentlig utvalg som skal gjennomgå konsekvensene av at storbritannia går ut av eu og norge sine alternativer til eøsavtalen og forslaget blir stemt ned flertallet ser det ikke som hensiktsmessig å igangsette et arbeid på nåværende tidspunkt men hva tidspunkt vil da egentlig passe,takk eee president eee senterpartiet føreslår at det blir sett ned eit offentleg utval som skal gjennomgå konsekvensane av at storbritannia går ut av eu og noreg sine alternativ til eøsavtalen og forslaget blir stemt ned fleirtalet ser det ikkje som hensiktsmessig å igangsette eit arbeid på noverande tidspunkt men kva tidspunkt vil då eigentleg passa,3884.4,3907.0,22.59999999999991,2018-01-09,2018-01-09_proceedings.txt
Stortinget-20180109-095530_3907000_3933200,eee de vil ikke bidra til usikkerhet om eøsavtalen eee fordi at den er grunnleggende viktig for norge og norges økonomiske interesser men hvem sine interesser statsråden viser i sitt svar til at de at det ikke kan nedsette et offentlig utvalg fordi at offentlig utvalg vil bidra til det offentlige ordskiftet e,eee dei vil ikkje bidra til usikkerheit om eøsavtalen eee fordi at den er grunnleggjande viktig for noreg og noregs økonomiske interesser men kven sine interesser statsråden viser i sitt svar til at dei at det ikkje kan nedsettes eit offentleg utval fordi eit offentleg utval vil bidra til det offentlege ordskiftet ei,3907.0,3933.2,26.199999999999818,2018-01-09,2018-01-09_proceedings.txt
Stortinget-20180109-095530_3933200_3954800,eee men det ble vist til at forhandlingene eee er sensitive og jeg trodde at vi snakka om demokrati eøsavtalen ødelegger den norske modellen trusselen mot framtidig offentlige tjenestetilbud eee i i norge blir omtasekampen femte januar,eee men eee det blir vist til at forhandlingane eee er sensitive og eg trudde at vi snakka om demokrati eøsavtalen øydelegg den norske modellen trugselen mot framtidige offentlege tenestetilbod i i noreg blir omtasekampen femte januar,3933.2,3954.8,21.600000000000364,2018-01-09,2018-01-09_proceedings.txt
Stortinget-20180109-095530_3954800_3980400,eee et utvalg skal vurdere om det bør innføres nye regler som hindrer at det offentlige får bedre vilkår enn private bedrifter de konkurrerer med på grunn av eee eee eøs og eee det er et eee det er oppsiktsvekkende at vi må forholde oss til at det er et problem eee at kommunene driver eee barnehage eee,eee eit utval skal vurdera om det bør innføres nye regler som hindrer at det offentlige får bedre vilkår enn private bedrifter dei konkurrerer med på grunn av eee eee eøs og eee det er eit det er oppsiktsvekkjande at vi må forholde oss til at det er eit problem eee at kommunar driv barnehagar eee,3954.8,3980.4,25.59999999999991,2018-01-09,2018-01-09_proceedings.txt
Stortinget-20180109-095530_3980400_4001400,og det er konkurransen som eee som teller i dag så er pasientrettighetsdirektivet gjennomført i norsk rett det var aldri noe folkekrav eee i norge om å bli en del av et felles europeisk helsevesen ingen parti hadde dette som ei kam pang kampsak og uavhengiglertallet,og det er konkurransen som eee som teller i dag så er pasientrettsdirektivet gjennomført i norsk rett det var aldri noko folkekrav eee i noreg om å bli ein del av eit felles europeisk helsevesen ingen parti hadde dette som ei kamppan kampsak og uavhengigleirtalet,3980.4,4001.4,21.0,2018-01-09,2018-01-09_proceedings.txt
Stortinget-20180109-095530_4001400_4013200,som er for eee eøs er for eller imot markedsretting av norsk helsevesen så blir norsk helsevesen markedsretta som følge av eøsavtalen,eee som er for eøs er for eller imot markedsretting av norsk helsevesen så blir norsk helsevesen markedsretta som følge av eee eøsavtalen,4001.4,4013.2,11.799999999999727,2018-01-09,2018-01-09_proceedings.txt
Stortinget-20180109-095530_4013200_4042300,eee flertallet manet til ro om eøs eee for å ikke skape usikkerhet men det er så masse usikkerhet eee når vi har eøsavtalen at det burde være opplagt at vi kunne utrede eee alternativet vi kan kjøpe på antibiotikaresistens som er en stor utfordring som både helsedirektoratet og legeforeningen advarte oss mot når vi gikk inn i det felles europeiske eee helsemarkedet,eee fleirtalet manar til ro om eøs eee for å ikkje skapa usikkerheit men det er så masse usikkerheit eee når vi har eøsavtalen at det burde vera opplagt at vi kunne utrede eee alternativet vi kan sjå på antibiotikaresistens som er ein stor utfordring som både helsedirektoratet og legeforeningen advarte oss mot når vi gjekk inn i den felles europeiske helsemarkedet,4013.2,4042.3,29.100000000000364,2018-01-09,2018-01-09_proceedings.txt
Stortinget-20180109-095530_4042300_4071300,hvorfor kan ikke vi utrede alternativ eee til til det eee det er ingen saklige argument det er berre en frossen politisk eee vilje som skal forsvare eøsavtalen sjøl når vi har en heilt ny situasjon eee når storbritannia har gått ut og det er på gang nye avtaler som og norge kunne vært en del av takk neste taler er statsråd marit berger røsland deretter per olaf lundteigen,kvifor kan ikkje vi utrede alternativ eee til til det eee det er ingen saklege argument det er berre ein frosen politisk vilje som skal forsvara eøsavtalen sjøl om vi har ein heilt ny situasjon eee når eee storbritannia har gått ut og det er på gang nye avtalar som og noreg kunne vore ein del av takkneste talar er statsråd marit berge røsland deretter per olaf lundteigen,4042.3,4071.3,29.0,2018-01-09,2018-01-09_proceedings.txt
Stortinget-20180109-095530_4071300_4095200,røsland president vil bare oppklare noen spørsmål som har dukket opp i løpet av debatten ja det har blitt sagt at eee at vi stemmer eller at vi ikke ønsker denne utredningen fordi vi ikke ønsker kunnskap om eøs og det er selvfølgelig ikke riktig vi ønsker kunnskap om eøs vi ønsker debatt om eøs vi ønsker offentlig ordskifte om eøs,land president vil berre oppklære nokon eee spørsmål som er dykt opp å løpa debatten og det er blitt sagt at eee at vi stemmer eller at eee vi ikkje ønsker denne utredninga fordi vi ikke ønsker kunnskap om eøs eee og det er selvfølgelig eee ikkje riktig vi ønsker kunnskap om eøs vi ønsker debatt om eøs vi ønsker offentleg ordskifte om eøs,4071.3,4095.2,23.899999999999636,2018-01-09,2018-01-09_proceedings.txt
Stortinget-20180109-095530_4095200_4122600,eee bare nevne ett konkret eksempel på på dette med forskning eee det skal snart være en utlysning nå i forskningsprogrammet europa i endring og da vil brexit og konsekvenser av brexit være et sentralt tema for for det det som er et spørsmålet her i dag er jo om vi ønsker å signalisere fra norsk side at på grunn av brexit så ønsker norge å sette i g egen prosess,eee berre nemne eit konkret eksempel på på dette med forskning eee det skal snart vere ein utlysning nå i forskningsprogrammet europa i endring eee og da vil breksitt og konsekvensar av breksit vere eit sentralt tema for eee for det det som er eit spørsmålet her i dag er jo om vi ønsker å signalisere fra norsk side at på grunn av breksitt så ønsker noreg å sette i g eigen prosess,4095.2,4122.6,27.400000000000546,2018-01-09,2018-01-09_proceedings.txt
Stortinget-20180109-095530_4122600_4151600,med å utrede vårt forhold til eu nå og jeg er glad for at det signalet kommer ikke fra denne salen og at den brede støtten om eøsavtalen består for jeg tror vi ville fått mange spørsmål og mange det hav hadde vekket oppmerksomhet om norge hadde brukt brexit som en eee forklaring på at vi ønsket å se på vår egen eøstilknytning eee og det er interessant at eee at senterpartiet,me utrede vårt forhold til eu nå eee og eg er glad for at det signala kommer ikkje frå denne salen og at eee den breie støtta og med eøsavtalen eee består eee for eg trur vi ville fått mange spørsmål og mange det hadde vekket oppmerksomhet om noreg hadde brukt breksit som ein eee forklaring på at vi ønsker å se på vår eigen eøstilknytning eee og det er interessant at eee at senterpartiet,4122.6,4151.6,29.0,2018-01-09,2018-01-09_proceedings.txt
Stortinget-20180109-095530_4151600_4181500,mener det er vi kan vise til at brexit gir noen muligheter eee og jeg har ennå ikke fått helt klarhet i hvilke muligheter er det brexit eee har gitt senterpartiet eller som som ligger på bordet som de mener at norge skal eee skal ta tak i det er eee blitt sagt en del om om eøsavtalen og hvordan den kom i stand det er helt riktig det at at eøsavtalen ble laget i en,meiner det er dei kan vise til at breksik gir noko muligheter eee og eg har enno ikkje fått heilt klarhet i kva muligheter er det breksit eee har gitt senterpartiet eller som som ligg på bordet som dei meiner at noreg skal eee skal ta tak i eee det er eee blitt sagt ein del om om eøsavtalen og vorland den kom i stand og det er klart at det er litt riktig det at at eøsavtalen blei laget igjen,4151.6,4181.5,29.899999999999636,2018-01-09,2018-01-09_proceedings.txt
Stortinget-20180109-095530_4181500_4210300,på si en i en annen situasjon det var en situasjon hvor det var vel tolv euland syv eftaland og en helt annen forhandlingssituasjon mellom de to blokkene den gang tre land gikk inn i eu sverige finland østerrike sveits sa med knapt flertall ne nei til eøs og som dere vet så ble da tre land igjen på på eøssiden så tror jeg vi skal være altså det er det er mye å si om det men men grunnleggende sett så,på på sida ein i ein annan situasjon det var i situasjonen for det var vel to euland syv efterland ein heilt annan forhandlingssituasjon mellom dei to blokkene den gong eee tre land gjekk inn i eu sverige finland østerrike sveits sa med knapt fleir an ne nei til eøs og som dei veit så blei det tre land igjen på på eøssiden så trur eg vi skal vere altså der eee det er mykje å si om det men men grunnleggende sett så,4181.5,4210.3,28.800000000000182,2018-01-09,2018-01-09_proceedings.txt
Stortinget-20180109-095530_4210300_4240200,har dette vært en utrolig viktig avtale for norsk næringsliv og for norske næringsinteresser eee og det er bare å gå å spørre eee norsk næringsliv om hva de mener om eøsavtalen så får du ganske entydig svar at den er viktig eee og hvis vi skulle nå eee vært reelle i å skulle se på alternativer så måtte vi gått til eu og sagt at vi ønsker å si opp eøsavtalen det er ikke sånn at vi kan forhandle et alternativ til en eøsavtale med eu mens vi har eøsavtalen på plass det er ikke sånn at eu godtar,har dette vore ein utruleg viktig avtale for norsk næringsliv og for norske næringsinteresser eee og det er berre å gå å spørre eee norsk næringsliv kva dei meiner om eøsavtalen så får du ganske entydig svar at den er viktig eee og viss vi skulle nå eee vorte deleg og skulle se på alternativet så måtte vi gått til eu og sagt at eee vi ønsker å side på eøsavtalen det er ikkje sånn at vi kan forhandle eit alternativ til ein eøsavtale med eu mens vi har eøsavtalen på plass det er ikkje sånn at eu godtar,4210.3,4240.2,29.899999999999636,2018-01-09,2018-01-09_proceedings.txt
