file,text_bm,text_nn,start,end,duration,date,proceedingsfile
Stortinget-20181113-095516_4246500_4273900,at arbeiderpartiet så klart står opp for eøsavtalen også i dagens debatt og i lys av den øvrige opposisjonens innlegg hittil president er også det heilt nødvendig for det er et paradoks når eee representanten fra rødt omtaler eøsavtalen den viktigste talen vi har,at arbeidarpartiet så klart står opp for eøsavtalen også i dagens debatt og i lys av den øvrige opposisjonens innlegg hit til president er også det heilt nødvendig for det er eit paradoks når eee representanten frå raudt omtalar eøsavtalen den viktigaste htalen vi har,4246.5,4273.9,27.399999999999636,2018-11-13,2018-11-13_proceedings.txt
Stortinget-20181113-095516_4273900_4302300,som en husmannskontrakt vel vitende om at det er vårt største eksportmarked vi tross alt snakka om og den avtale vi sjøl har inngått og som stortinget behandla når vi tek inn forordninga i og spesielt president når en da følger opp med å si at vi gir bort sørlandsbanen til enkeltmenn som skal inn og driver den,som ein husmannskontraktvel vitande om at det er vårt største eksportmarked vi trass alt snakkar om og den avtalen vi sjøl har inngått og som stortinget behandlar når vi tek inn forordninga i og spesielt president når ein då følger opp med å seie at vi gir bort sørlandsbanen til engelskmenn som skal inn og drive den,4273.9,4302.3,28.400000000000546,2018-11-13,2018-11-13_proceedings.txt
Stortinget-20181113-095516_4302300_4330100,president de hadde tjent heile stortinget tror jeg om en forholdt seg til realiteter i stedenfor å oppkonstruere saker de overhodet understreker overhodet ikke er grunnlag for president ja hittil er et utenlandsk selskap vunnet kontrakta på å operere sørlands ba i ti år,president då hadde tent heile stortinget trur eg om ein forholdt seg til realitetar i staden for å oppkonstruere saker det å ver hode understreka overhodet ikkje er grunnlag for president ja hittil har eit utanlandsk selskap vunne kontraktar på å operere sørlandsbaa i ti år,4302.3,4330.1,27.800000000000182,2018-11-13,2018-11-13_proceedings.txt
Stortinget-20181113-095516_4330100_4359100,staten skal fortsatt eie infrastrukturen staten skal fortsatt legge togsete staten skal fortsatt eie grunnlaget for drift og vedlikehold og ansvaret for å gjennomføre det og staten skal fortsatt kjøpe togtjenestene president akkurat som når norske nsb konkurrerer og vinne kontrakter på opererer jernbane i sverige vi kjøper ikke vi overtekenke jernbanen av det vi driver,staten skal fortsatt eige infrastrukturen staten skal fortsatt eige togseta staten skal fortsatt eige grunnlaget for drift og vedlikehald og ansvaret for å gjennomføre det og staten skal fortsatt kjøpe togtenestene president akkurat som når norske nsb konkurrerer og vinne kontrakter på å operere jernbane i sverige vi kjøper ikkje vi overteke den svenske jernbanen av det vi driv,4330.1,4359.1,29.0,2018-11-13,2018-11-13_proceedings.txt
Stortinget-20181113-095516_4359100_4388500,forretningsutvikling på tvers av landet grenser fordi det skaper mer verdier for folk og land derfor er det spesielt også merke seg president den tilnærmingen som både senterpartiet og sv har til det som nå skjer på jernbanen for det er ikke en gedigen privatisering av norsk jernbane som skjer det er en økt konkurranse som å gi det beste tilbudet til innbyggerne våre og også på en måte som gjør,forretningsutvikling på tvers av landegrenser fordi det skapar meir verdiar for folk og land derfor er det spesielt også merkeleg president den tilnærminga som både senterpartiet og sv har til det som no skjer på jernbane for det er ikkje ein gedigen privatisering av norsk jernbane som skjer det er ein økt konkurranse om å gi det beste tilbodet til innbyggjarane våre og også på ein måte som gjer,4359.1,4388.5,29.399999999999636,2018-11-13,2018-11-13_proceedings.txt
Stortinget-20181113-095516_4388500_4415700,at stor at stortinget kan bruke pengene som en bruker på offentlig budsjett til å styrke tilbudet istedenfor å betale unødig mykje for det tilbudet vi allerede får president det gir bedre tjenester til folk og spesielt på jernbanesektoren det viktig fordi norge er ikke aleine på ei øde øy vår høst vår største havoteborg,at stor at stortinget kan bruke pengane som ein brukar på offentlege budsjett til å styrke tilbodet i staden for å betale unødig mykje for det tilbodet vi allereie får president det gir betre tenester til folk og spesielt på jernbanesektoren er det viktig fordi noreg er eit jo å leine på ei ødeøy vår høst vår største hamøteborg,4388.5,4415.7,27.199999999999818,2018-11-13,2018-11-13_proceedings.txt
Stortinget-20181113-095516_4415700_4444300,hvis vi skal frakte gods på jernbane så trenger vi grense try kryssende trafikk for de som har besøkt eee narvik og har sett verdien av ofotbanen som veldig monge snakka flotte om i det store og daglig det er grensepasserende trafikk harmonisert regelverk tjener norge når vi snakker om økt godstransport over lunga av standard på nordlandsbanen sørover og skal kryssinga på kongsvingerbanen så betyr det faktisk at harmonisert regelverk tjener norske interesser president,viss vi skal frakte gods på jernbane så treng vi grensetrykk kryssande trafikk for dei som har besøkt eee norvik og har sett verdien av ofotbanen som veldig mange snakkar flott om i det store daglige det er grensepasserande trafikk harmonisert regelverk tener noreg når vi snakkar om økt godstransport og var lange avstandar på nordlandsbanen sørover og så kryssingar på kong singerbanen så betyr det faktisk at harmonisert regelverk tener norske interesser president,4415.7,4444.3,28.600000000000364,2018-11-13,2018-11-13_proceedings.txt
Stortinget-20181113-095516_4444300_4473400,og det er det det handler om det handler ikke om en et ønske fra regjeringen om å gi vekt suverenitet til eu det handler om å sørge for at norske bedrifter norsk næringsliv og norske passasjerer kan oppleve et harmonisert regelverk som gjør hverdagsreiser enklere eller nytte transporten mer konkurransedyktig og president da kan en prøve å gjøre lite til en ideologisk debatt,og det er det det handlar om det handlar ikkje om ein eit ønske frå regjeringa om å gi veks suverenitet til eu det handlar om å sørge for at norske bedrifter norsk næringsliv og norske passasjerar kan oppleve eit harmonisert regler som gjer kvardagsreise enklare eller nyttetransporten meir konkurransedyktig og president då kan ein prøve å gjere dette til ein ideologisk debatt,4444.3,4473.4,29.099999999999454,2018-11-13,2018-11-13_proceedings.txt
Stortinget-20181113-095516_4473400_4501400,for eller mot eøsavtalen for eller mot handel om værer foreller mot om økonomien i norge i praksis skal fortsette å vekse eller om man skal gå den andre veien men president det hadde tjent stortinget hvis en førte en ærlig og redelig argumentasjon og derfor meiner for eksempel at når artikkel sytt nummer seks i sikkerhetsdividirektivet slår fast at statens jernbarnetilsyn har rett,for eller mot eøsavtalen for eller mot handel med omverda for eller mot om økonomien i noreg i praksis skal fortsette å vekse eller om ein skal gå den andre vegen men president det hadde tent stortinget viss ein førte ein ærleg og redeleg argumentasjon og derfor meiner eg for eksempel at når artikkel sytten nummer seks i sikkerheitsdidirektivet slår fast at statens gjer barnetilsyn har rett,4473.4,4501.4,28.0,2018-11-13,2018-11-13_proceedings.txt
Stortinget-20181113-095516_4501400_4525100,tilstans av usikker drift og at den ikke kan overprøve stavere og at nasjonal sikkerhetsmyndighet skal være gjenstand for nasjonal prøving president så er det merkelig at sosialistisk venstreparti har behov for å gi inntrykk av det stikk motsatte det åpnes da opp for replikkordskifte første replikant er sverre myrli,tilstands av usikker drift og at den ikkje kan overprøvast av vera og at nasjonal sikkerheitsmyndigheit skal vere gjenstand for nasjonal prøving president så er det merkeleg at sosialistisk venstreparti har behov for å gi inntrykk av det stikk motsette då var det tap for replikkordskifte første replikant er svære mili,4501.4,4525.1,23.700000000000728,2018-11-13,2018-11-13_proceedings.txt
Stortinget-20181113-095516_4530200_4558800,myrli vær så god takk for det president da jeg hører samferdselsministeren så er han åpenbart helt ukritisk til jernbanepakke fire det er altså ingen problematiske sider ved den pakka skal vi tru samferdselsministeren og regjeringa norge har fire grensekryssende jernbanestrekninger ofotbanen merakerbanen kongsvingerbanen og østfoldbanen,mili ver så godtakk for det president der eg høyrer samferdselsministeren så er han openbert heilt ukritisk til jernbanepakke fire det her altså ingen problematiske sider ved den pakka skal vi tru samferdselsministeren og regjeringa noreg har fire grensekryss jernbanestrekningar og fått barn merakkerban kong svingeban og østfordbarn,4530.2,4558.8,28.600000000000364,2018-11-13,2018-11-13_proceedings.txt
Stortinget-20181113-095516_4558800_4588600,jeg har aldri oppfatta at det er det norske regelverket i dag som er til hinder for at vi har mer jernbanetrafikk på de strekningene på ofotbanen er det mangel på kapasitet det trengs flere kryssingsspor og etter hvert dobbeltspor samme på kongsvingerbanen trengs eee bedre kapasitet på meråkerbanen trengs det elektrifiseres og vi trenger en ny og moderne jernbanestrekning mellom halden og gøteborg så spørsmålet mitt er president hva,eg har aldri oppfatta at det er det norske regelverket i dag som er til hinder for at vi har meir jernbanetrafikk på dei strekninga på ofotbanen er det mangel på kapasitet det trengst fleire kryssingsspor og etter kvart dobbeltspor same på kongsvingerbanen trengst eee betre kapasitet på meråkerbanen trengst det elektrifiserast og vi trenger ein ny og moderne jernbanestrekning mellom halden og gøteborg så spørsmålet mitt er president var,4558.8,4588.6,29.800000000000182,2018-11-13,2018-11-13_proceedings.txt
Stortinget-20181113-095516_4588600_4616500,er problematisk med dagens regelverk hvilke norske regler er det som i dag er til hinder for mer jernbanetrafikk over grensa statsråd dale president la meg bare oppklare en ting først det er ikke slik at de ikke var problematiske sider ved jernbanepakk fire det var slik at det har vært flere utfordringer med jernbanepakk fire som norske myndigheter jobber ganske grundig med og sagt at vi må ha forbedringer på før vi kan gå t stortinget og anbefale,er problematisk med dagens regelverk kvale norske reglar er det som i dag er til hinder for mer jernbanetrafikk over grensa president la meg berre oppklare ein ting først det er ikkje slik at det ikkje har vore problematisk side av jernbane park fire det er vare slik at det har vore fleire utfordringar med jernbane pakkfire som norske myndigheiter jobbar ganske grundig med og sagt at vi må ha forbetringar på før vi kan gå ti stortinget å anbefale,4588.6,4616.5,27.899999999999636,2018-11-13,2018-11-13_proceedings.txt
Stortinget-20181113-095516_4616500_4644400,jernbanepakkire men så har jeg jo også sagt eee herifra tidligere president at det som synes nytt for arbeiderpartiet det er at vi faktisk får gjennomslag hvor det er mulig arbeiderpartiet glemt hvordan det fungerer i praksis men det er alt sånn at når eu tilpassa si lovgivning på dette til de norske argumenta ser altså motstanden også fra vår side naturligvis dempet av det president så meiner jeg at,jernbane park fire men så har eg jo også sagt eee her ifrå tidlegare president at det som synest nytt for arbeidarpartiet det er at vi faktisk får gjennomslag og det er mulig arbeidarpartiet har glømt korleis det fungerer i praksis men det er altså sånn at når eu tilpassar si lovgiving på dette til dei norske argumenta så er altså motstanden også frå vår side naturlegvis dempa av det president så meiner eg at,4616.5,4644.4,27.899999999999636,2018-11-13,2018-11-13_proceedings.txt
Stortinget-20181113-095516_4644400_4670800,den den regelverksutforminga vi har i norge det er et nødvendig nivå på sikkerhet på norsk jernbane det skal vi fortsatt ivareta det hensyn trekk ved jernbanepakkfire men med et standardisert regleverk på tvers av landegrenser kan flere aktører operere og vi kan med det utvikle jernbanen også i framtida president myrli ja president det var interessant for da skjønner jeg på samferdselsministeren at norge har altså fått endra,den den regelverksutforminga vi har i noreg det er eit nødvendig nivå på sikkerheit på norsk jernbane det skal vi fortsatt i vareta det hensyn teke vi jernbanen pakfire men ved eit standarisert regelverk på tvers av landegrenser kan fleire aktørar operere og vi kan med det utvikle jernbana også i framtida presidentmyja president det var interessant for da sjønne eg på samferdselsministeren at noreg har altså fått endra i,4644.4,4670.8,26.400000000000546,2018-11-13,2018-11-13_proceedings.txt
Stortinget-20181113-095516_4670800_4700800,da vil jeg gjerne at samferdselsministeren orienterer om på hvilke punkter er det norge har fått gjennomslag for endringer i jernbanepakke fire sammenligna med det som lå som utgangspunkt da pakka i sin tid ble presentertstatsråd dale president det skal med glede av både sumariskno og når sto vi kjem til stortinget med den endelige jernbanepakken et av de tinga vi for eksempel var kritisk til den gangen var om vi i tilstrekkelig grad fikk ta hensyn og krav,da vil eg gjerne at samferdselsministeren orienterer om på kva punkter eller noreg har fått gjennomslag for endringar i jernbanepakke fire samanlikna med det som lå som utgangspunkt da pakka i si tid blei presentert statsråd dale president eg skal me glede både sumarisk no og når sto vi kjem til stortinget med den endelege jernbane parken eit av dei tinga vi for eksempel var kritiske til inngangen ber om vi i tilstrekkeleg grad fekk ta hensyn og krav,4670.8,4700.8,30.0,2018-11-13,2018-11-13_proceedings.txt
Stortinget-20181113-095516_4700800_4730200,som vi har spesielle behov for i norge for eksempel knytta til eee vinterutfordringer og sikkerhetsdimensjonen som følge av det et områder vi er vel tydelig overfor eee eukommisjonen på at her må vi ha større fleksibilitet for norge fordi vi må individuelt tilpasse regelverket vårt på det sånn at vi har materiell som tåler den norske vinteren som skyldes seg vesentlig for eksempel fra hvordan ser ut nenya sjøl i europa et konkret eksempel,som vi har spesielle behov for i noreg for eksempel knytta til eee vinterutfordringar og sikkerheitsdimensjonen som følge av det eit område vi har vore tydelege overfor eee eukommisjonen på at her må vi ha større fleksibilitet for noreg fordi vi må individuelt tilpasse regelverket vårt på det sånn at vi har materiell som tåler den norske vinteren som skiljer seg vesentleg for eksempel frå kor ein ser ut lenger sør i europa eit konkret eksempel,4700.8,4730.2,29.399999999999636,2018-11-13,2018-11-13_proceedings.txt
Stortinget-20181113-095516_4730200_4742300,på hvordan norge har fått gjennomslag flere kjem vi tilbake til når vi leverer den endelige forslaget til stortingetneste replikant er bengt fastrene,på korleis noreg har fått gjennomslag fleire kjem tilbake til nå en vi leverer den endelege forslaget til stortingetneste replikant er bengt hast rene,4730.2,4742.3,12.100000000000364,2018-11-13,2018-11-13_proceedings.txt
Stortinget-20181113-095516_4753000_4779600,fastrene president hvis eee jernbanepakke fire blir vedtatt i norge så vil det jo i praksis bety at man avgir myndigheter fra norske folkevalgte til eu både over hvordan den norske jernbanen skal organiseres og gis sikkerhetsanliggende vi legger jo egentlig da opp til eee,fast rene president viss eee jernbane pakket fire bli vedtatt i noreg så vil det jo i praksis bety at ein avgir myndigheiter og norske folkevalde til eu både vordande norske jernbanen skal organiserast og is sikkerheitsanliggnar vi legg jo eigentleg da opp til eee,4753.0,4779.6,26.600000000000364,2018-11-13,2018-11-13_proceedings.txt
Stortinget-20181113-095516_4779600_4807500,dette betyr i praksis at obligatoriske anbud ved persontrafikken på jernbane direkte kjøp av persontogtjenester vil som hovedregel ikke være tillatt pakken krever også at det åpnes for fri kommersiell konkurranse på persontrafikken med noen begrensninger som statsråden fremhever men som reelt sett ikke betyr noen ting norske folkevalgte vil ikke lenger kunne bi ev endre måten jernbanen organiseres på uten det kommer i konflikt med eus regler,dette betyr i praksis at obligatoriske anbod for persontrafikke på jernbane direkte kjøp av persontogtenester vil som hovudregel ikkje vere tillat pakken krever også at det opnast for fri kommersiell konkurranse på persontrafikken med nokon begrensningar som statsråden fremover men som reelt sett ikkje betyr nokon ting norske folkevalde vil ikkje lenger kunne bie endre måten jernbane organiserast på utan det kommer i konflikt med eus reglar,4779.6,4807.5,27.899999999999636,2018-11-13,2018-11-13_proceedings.txt
Stortinget-20181113-095516_4807500_4836900,og gir en risiko for stevne til eudomstolen da har dagens regjering langt på vei gjort eee gjort gjennom jernbanereformen forskjellen er at vi fortsatt har muligheten til å gjøre endringer hvis vi finner at det er fornuftig statsråden her at det er ikke er fornuftig og hva mener han egentlig om dette statsråd dale president det er egentlig ganske oppløfte for hvis motstanden eee mot jernbanepakke fire i stortinget basert på en del av den argumentasjonsrekka i stadig høyre,og gir ein risiko for stemne til eudomstolen da har dagens regjering langt på veg gjort eee gjort gjennom jernbanereforma forskjellen er at vi fortsatt har muligheten til å gjere endringar viss vi finner at det er fornuftig statsråden hevdar at det er ikkje er fornuftig og va meiner ein eigentleg om dette statsråd dale president eg er eigentleg ganske oppløfta for viss motstanden mot jernbane pakk fire i stortinget basert på ein del av den argumentasjonsrekka vi stadig høyrer,4807.5,4836.9,29.399999999999636,2018-11-13,2018-11-13_proceedings.txt
Stortinget-20181113-095516_4836900_4858800,så kjem det til å snu når en ser det endelige forslaget fra regjeringa hvert fall hvis en baserer seg på den faktiske velser forelagt å ikke forhåndskonkludere slik det høres ut som flere partier nå gjør for det vi er opptatt av er at vi skal ha et harmonisert regelverk som styrker konkurransekrafta til norsk jernbane,så kjem det til å snu når ein ser det vennlege forslaget frå regjeringa kvart fall viss ein baserer seg på det ein faktisk kvar seg forelagt og ikkje forhandskonkludere slik det høyrest ut som fleire parti no gjer for det vi er opptatt av at vi skal ha eit harmonisert regelverk som styrker konkurransekrafta til norsk jernbane,4836.9,4858.8,21.900000000000546,2018-11-13,2018-11-13_proceedings.txt
Stortinget-20181113-095516_4858800_4887700,og i sum så er det hovedutfordringa til norsk jernbane president at en taper konkurransekraft spesielt på nærings transportevere derfor å grense kryssende problem eee grense kryssende trafikk et viktig argument for det det andre er at vi har jo gjennomført en reform etter basert på at vi har be eu har bedt oss om gjedet med for vi meinte det var rett for norsk jernbane og så er det helt rett at eudirektivet legge opp til at vens forsøk skal bruke konkurranse men den kan også direkte tildele der det åpenbart gir det beste tilbudet så president,og i sum så er det hovudutfordringa til norsk jernbanne president at ein taper konkurranskraft spesielt på næringstransport ser vi det derfor er grensekryssande problem eee grensekrys trafikk eit viktig argument for det det andre er at vi har jo gjennomført ein reform ikkje basert på at vi har eu har bedt oss om å gjere med for vi meinte det var rett for norsk jernbane og så er det heilt rett at eudirektivet legg opp til at en fortsatt skal bruke konkurranse men ein kan også direkte tildele der det openbert gir det beste tilbodet så president,4858.8,4887.7,28.899999999999636,2018-11-13,2018-11-13_proceedings.txt
Stortinget-20181113-095516_4887700_4912600,norge er fortsatt stor handlefrihet også til jernbanepakk fire og det er fint hvis opposisjonen også inn seg detresident det er jo riktig at direkte tildeling i teorien eee kan benyttes hvis lokale og regionale myndigheter som ivaretar integrert transport også det gjelder både infrastruktur og det gjelder togtransport kan bruke direkte kjøp det må det altså ikke være landsdekkende gjelder for eksempel oslo sporveier,noreg er fortsatt stor handlefriheit også etter jernbane pakk fire og det fint viss opposisjonen også innser dette president det er jo riktig at direkte tildeling i teorien eee kan benyttast viss lokale og regionale myndigheiter som ivaretar integrert transport altså det gjeld både infrastruktur og det el togtransport kan bruke direkte kjøp det må altså ikkje vere landtekn gjeld for eksempel oslo sporvegar,4887.7,4912.6,24.900000000000546,2018-11-13,2018-11-13_proceedings.txt
Stortinget-20181113-095516_4912600_4938000,og jernbanepakke fire krever jo vanntette skott mellom infrastruktur og operasjon så dette unntaket gjelder jo ikke for jernbanen hvis det finnes en interessert operatør er jo lite relevant eee når persontrafikken til nsb har gått med store overskudd det har jo vært midlertidig tildelingen på maks to til fem år ved for eksempel konkurser det er jo fortsatt mulig men er det det som kommer til å bli hovedregelen i,og jernbane pakket fire krev jo vanntette skott mellom infrastruktur og operasjon så dette unntaket gjeld jo ikkje for jernbanen viss det finst ein interessert operatør er jo lite relevant når persontrafikken til nsb har gått med store overskot det har jo vore midlertid i tildelinga på maks to til fem år ved for eksempel konkursar det er jo fortsatt mulig men er det det som kommer til å bli hovudregelen nei,4912.6,4938.0,25.399999999999636,2018-11-13,2018-11-13_proceedings.txt
Stortinget-20181113-095516_4938000_4967800,norge kan jo beholde nasjonale sikkerhetskrav så lenge ira eller kommersielle aktører ikke hevder at gjeldende forskrifter hemmer konkurransen eller interoperabiteten er det det som er meningen dessuten så kan jo eukommisjonen alltid varsles ved inngåelse av direkte kontrakter i tilfeller der en har innvendingerstatsråd dale president takk for anledninga til å føre et replikkordskifte som hittil stort sett handler om feil retning eee det er altså sånn at når en sier at,noreg kan jo behalde nasjonale sikkerheitskrav så lenge era eller kommersielle aktørar ikkje hevdar at gjeldande forskrifter hemme konkurransen eller interopelabiteten er det som er meininga dessutan så kan jo eukommisjonen alltid varsles ved inngåelse av direkte kontraktar i tilfellet der ein har innvendingastatsråd dalepresident takk for anledninga til å føre eit replikkordskifte som hittil stort sett handlar om feilretting det er altså sånn at når ein seier at,4938.0,4967.8,29.800000000000182,2018-11-13,2018-11-13_proceedings.txt
Stortinget-20181113-095516_4967800_4993500,nsb går med stor overskudd ja det har nsb gjort som følge av at staten har kjøpt togtjenester for milliarder av kroner i året direkte fra selskapet så ser vi at når det blir utsatt for konkurranse så halverer også de sine tilbud noe som gjør at vi kan få mer tog for pengene bedre frekvens eller utbygging av infrastruktur i staden gjennomgående bra for norsk jernbane president,nsb går med store overskot ja det eee har nsb gjort som følge av at staten har kjøpt togtenester for milliardar av kroner i året direkte frå selskapet så ser vi at når dei blir utsett for konkurranse så halverer også dei sine tilbod noko som gjer at vi kan få meir togforpengane betre frekvens eller utbygging av infrastruktur i staden gjennomgåande bra for norsk jernbane president,4967.8,4993.5,25.699999999999818,2018-11-13,2018-11-13_proceedings.txt
Stortinget-20181113-095516_4993500_5022900,og så kan en jo spørre seg ja hvis det er så eee skrekkelig å skulle utsette jernbanen for denne konkurransen som vi nå ser virker for eksempel på sørlandsbanen president hva er det som gjør at det fungerer utmerket godt på andre områder i kollektivtransporten for eksempel i bussmarkedet det er ikke konsistens og sammenheng i argumentasjon fra senterpartiet og det er et større problem president enn innføring av jernbane pakk fire neste replikant er arne nævra deretter ingalill olsen,og så kan ein jo spørje seg ja viss det er so eee skrekkeleg å skulle utsette jernbanen for denne konkurransen som vi no ser verka for eksempel på sørlandsbanen president kva er det som gjer at det fungerer utmerkt godt på andre område i kollektivtransporten for eksempel i busmarkedet det er ikkje konsistens og samanheng i argumentasjonen frå senterpartiet og det er eit større problem president en innføring av jernbane pakkfireneste replikant er arne nævra deretter ingalill olsen,4993.5,5022.9,29.399999999999636,2018-11-13,2018-11-13_proceedings.txt
