file,text_bm,text_nn,start,end,duration,date,proceedingsfile
Stortinget-20181113-095516_8076600_8104300,foregangsland for senterpartiet men det burde være det så en sen når en slik avtale ikke er god nok i de forhandlingene som eee som storbritannia har hatt nå etter eee brexit neste år markerer vi tjuefem år med eøs eøsavtalen og avtalen den har tjent oss godt den trygge norsk økonomi den trygger norske arbeidsplasser over det ganske land og har gitt en hel generasjon muligheten til å ta utdanning,foregangsland for senterpartiet men det burde vere det så ein sedan når ein slik avtale ikkje er god nok i dei forhandlingane som eee som storbritannia har hatt no etter eee breksit neste år markerer vi tjuefem år med ø eøsavtalen og avtalen den har tent oss godt den trygge norsk økonomi den trygge norske arbeidsplassar over det ganske land og har gitt ein seg generasjon muligheten til å ta utdanning,8076.6,8104.3,27.699999999999818,2018-11-13,2018-11-13_proceedings.txt
Stortinget-20181113-095516_8104300_8124100,eee få skolegang som man ikke nødvendigvis har fått i norge eller å supplere den skolegangen som man ellers eee kan få da eee ute i europa eee og det har også vært mulig å arbeide men også etablere seg fritt i hele eøsområdet med rett til trygdeytelser og eee helsebehandling,eee få skolegang som ein ikkje nødvendigvis har fått i noreg eller å upplever den skolegangen som ein elles eee kan få da eee ute i europa eee og det har også vore mulig å arbeide men også etablere seg fritt i heile eøsområdet med dette trygdytelser og eee helsebehandling,8104.3,8124.1,19.800000000000182,2018-11-13,2018-11-13_proceedings.txt
Stortinget-20181113-095516_8124100_8152400,president vi er avhengig av eee velfungerende handel både for å få importert de varene vi trenger men også eee tjenester som vi har behov for i norge men ikke minst for å få eksportert det vi produserer og som gjør det mulig for bedrifter å holde til i norge bo i distriktene og arbeide eee i hele eee vårt land vårt nærmeste og viktigste marked eee er europa og næringslivet trenger nettopp denne forutsigbarheten,president vi er avhengig av eee velfungerande handel både for å få importert i varene vi trenger men også eee tenester som vi har behov for i noreg men ikkje minst for å få eksportert det vi produserer og som gjer det mulig for bedrifter å halde til i noreg bu i distrikta og arbeidet eee i heile eee vårt land vårt nærmaste og viktigaste marked eee er europa og næringslivet treng nettopp denne forutsigbarheten,8124.1,8152.4,28.299999999999272,2018-11-13,2018-11-13_proceedings.txt
Stortinget-20181113-095516_8152400_8182400,og like konkurransevilkår og eøsavtalen er jo nettopp det rammeverket som gir eee eee eller sørger for nettopp dette noen har ment at dersom vi trer ut av eu så kan vi forhandle nettopp om en skreddersydd avtale med eu hvor vi kan plukke de rosinene vi liker og la de andre like ligge storbrittannias forsøk på å finne en løsning som tjener dem bø best mulig i forbindelse med utmeldingen av eu viser at så enkelt er det ikke men det er mulig at senterpartiet er besnæret,og like konkurransevilkår og eøsavtalen er jo nettopp det rammeverket som gir eee eller sørger for nettopp dette nokon har ment at dersom vi tre ut av eu så kan vi forhandle nettopp om den skreddersydd avtale med eu og vi kan plukke dei rosinene ved like og la dei andre like liggje store brit torana forsøk på å finne ei løysing som tener den bø best mulig forbindelse med utmeldinga av eu viser at så enkelt er det ikkje men det er mulig at senterpartiet er besnære,8152.4,8182.4,30.0,2018-11-13,2018-11-13_proceedings.txt
Stortinget-20181113-095516_8182400_8186900,eee av dette takk president neste taler sverre myrli,eee av desse takk crisidenneste talar sverre myrli,8182.4,8186.9,4.5,2018-11-13,2018-11-13_proceedings.txt
Stortinget-20181113-095516_8197100_8224500,myrli qqq takk for det president venstres abid raja sa i sitt innlegg tidligere i debatten at arbeiderpartiet vakler i sitt standpunkt det er grunn til å lytte når venstrefolk snakker om å vakle i politikken president i heljan ble det markert at det var hundre år sia første verden tok slutt,myrlitakk for det president venstres abid raja sa i sitt innlegg tidlegare i debatten at arbeidarpartiet vaklar i sitt standpunkt det er grunn til å lytte når venstre folk snakker om å vakle i politikken president i helgen blei det markert at det var hundre år sidan første verda tok slutt,8197.1,8224.5,27.399999999999636,2018-11-13,2018-11-13_proceedings.txt
Stortinget-20181113-095516_8224500_8250900,dessverre skulle det gå bare tjue år før europa på nytt ble kastet ut i en blodig verdenskrig etter andre verdenskrig var europa forandre det var et nytt europa som fra nitten femogfør skulle bygges opp igjen landene som i generasjoner hadde kriget mot hverandre skulle i stedet samar,dessverre skulle det gå bere tjue år før europa på nytt blei kasta ut i ein blodig verdskrig etter andre verdskrig var europa forandre det var eit nytt europa som frå nittenfemogfør skulle byggast opp igjen lande som i generasjonar hadde krige mot verandre skulle i stader samar,8224.5,8250.9,26.399999999999636,2018-11-13,2018-11-13_proceedings.txt
Stortinget-20181113-095516_8250900_8278000,land som handler med hverandre går ikker til krig det var erfaringene fra mange kriger som gjorde at landet i europa stokka korta på nytt og bestemte seg for å bygge opp et demokratisk og framtidsrettet europa og president derfor er handelspolitikk viktig at land handler og samhandler er viktig,land som handlar med varandre går ikkje til krig det var erfaringane frå mange krigar som gjorde at landet i europa stokka korta på nytt og bestemte seg for å bygge opp eit demokratisk og framtidsrette europa og president derfor er handelspolitikk viktig at land handlar og samhandlar er viktig,8250.9,8278.0,27.100000000000364,2018-11-13,2018-11-13_proceedings.txt
Stortinget-20181113-095516_8278000_8299900,men det må sjølsagt være innafor et regelverk og det må være et regelverk som aksepteres og respekteres president etter andre verdenskrig oppbyggingen av europa ny all atlantisk forsvarsallianse og vi fikk nato,men det må sjølsagt vera innanfor eit regelverk og det må vera eit regelverk som aksepterast og respekterastpresident etter andre verds krig oppbyggingen av europa ny al atlantisk forsvarsallianse og vi fekk nato,8278.0,8299.9,21.899999999999636,2018-11-13,2018-11-13_proceedings.txt
Stortinget-20181113-095516_8299900_8329200,jeg skulle likt og visst på de sytti åra som har gått hvor mange ganger det fra denne talerstolen er sagt at usa er vår viktigste partner eller vår viktigste allierte ja president usa er viktig usa er veldig viktig og oppryddingen for å bruke et sånt begrep i europa og den rollen usa tok var viktig og er viktig men verden har endret seg,e skulle likt å visst på dei sytti åra som har gått vår mange gonger derfor at denne talarstolen er sagt at usa er vår viktigaste partnar eller våre viktigaste allierte ja president usa er viktig usa er veldig viktig og oppryddinga for å bruke eit sånt begrep i europa og den rollen usa tok var viktig og er viktig men verden har endre seg,8299.9,8329.2,29.30000000000109,2018-11-13,2018-11-13_proceedings.txt
Stortinget-20181113-095516_8329200_8359100,usa har endret seg og europa har endret seg derfor kan vi ikke bare fortsette å si akkurat det samme som vi sa for sytti år sia etter min mening må vi i større grad erkjenne at våre nordiske naboland og tyskland er svært viktige partnere for norge og de blir viktigere og viktigere i stadig flere saker ser vi at norge og tyskland er på lag store tyskland og vesle norge,usa har endre seg og europa har endre seg derfor kan vi ikkje berre fortsette å si akkurat det same som vi sa for sytti år sidan etter min meining må vi i større grad erkjenne at våre nordiske naboland og tyskland er svært viktige partnar av noreg og det blir viktigare og viktigare i stadig fleire saker ser vi at noreg og tyskland er på lag store tyskland og vesle noreg,8329.2,8359.1,29.899999999999636,2018-11-13,2018-11-13_proceedings.txt
Stortinget-20181113-095516_8359100_8385000,ja faktisk er det slik at tyskland ikke sjelden taler norges sak i eu president arbeiderpartiet er for internasjonal handel for internasjonalt samarbeid og for eus men det betyr ikke at vi ukritisk er for alt som kommer fra eu når vi er sterkt uenige må vi kunne si nei,ja faktisk er det slik at tyskland ikkje skjeldan talar noregs sak i eu president arbeidarpartiet er for internasjonal handel for internasjonalt samarbeid og for eøs men det betyr ikkje at vi ukritisk er for alt som kommer frå eu når vi er sterkt ueinige må vi kunne seie nei,8359.1,8385.0,25.899999999999636,2018-11-13,2018-11-13_proceedings.txt
Stortinget-20181113-095516_8385000_8410500,derfor kommer arbeiderpartiet til å stemme imot de fem direktiver og forordningene som utgjør jernbanepakke fire eøspartiet arbeiderpartiet kommer til å gjøre det og grunnen til det er at vi er sterkt imot at all jernbanetrafikk må konkurranseutsettes så hørte jeg at samferdselsministeren i innlegget sitt tidligere i dag eller om det var i en replikkordskifte,derfor kommer arbeidarpartiet til å stemme imot dei fem direktiva og forordningane som utgjer jernbanepakke fire eøspartiet arbeidarpartiet kommer til å gjera det og grunnen til det er at vi er sterkt imot at all jernbanetrafikk må konkurranse utsettast så høyrte eg at samferdselsministeren i innlegget sitt tidlegare i dag eller om det var ei replikkordskifte,8385.0,8410.5,25.5,2018-11-13,2018-11-13_proceedings.txt
Stortinget-20181113-095516_8410500_8439000,uttalte og framstilte det nærmest som at vi sjøl kan velge om vi vil konkurranseutsette jernbanetrifikk trafikken eller direkte tildele til operatører men president det stemmer ikke det er kun unntaksvis og det har departementet sjøl redegjort informasjon til stortinget det er kun unntaksvis og i svært spesielle situasjoner at en kan direkte tildele kontrakter i stedet,uttalte og framstilte det nærmast som at vi sjølve kan velje om vi vil konkurranseutsette jernbanetrtrafikken eller direkte tildele til operatørar men president det stemmer ikkje det er kun unntaksvis og det har departementet sjøl redegjort i informasjon til stortinget det kun unntaksvis og i svært spesielle situasjonar at ein kan direktetildele kontrakter i stader,8410.5,8439.0,28.5,2018-11-13,2018-11-13_proceedings.txt
Stortinget-20181113-095516_8439000_8463800,for å konkurranseutsette så president vi skal nøye lese gjennom referatet og gå gjennom hva samferdselsministeren sa men jeg trur han gitt gikk ganske mye lengre enn det det er rom for slik direktivene skal tolkes så president vil jeg til slutt si noen ord om den såkalte mobilitetspakka som vil få dramatiske konsekvenser hvis den blir vedtatt,for konkurranseutsette så president vi skal nøye lese gjennom referatet og gå gjennom va samferdselsministeren sa men eg trur han gi gjekk ganske mykje lengre enn det det er rom for slik direktiva skal tolkast så president vil eg til slutt seie nokon ord om den såkalte mobilitetspakka som vil få dramatiske konsekvensar viss den blir vedtatt,8439.0,8463.8,24.799999999999272,2018-11-13,2018-11-13_proceedings.txt
Stortinget-20181113-095516_8463800_8488100,ved at det vil medføre en sterk liberalisering av det såkalt såkalte kabotasjeregelverket kabotasje er altså utenlandske transportører som kan kjøre innenlands transport nasjonal transport i et annet land la meg også presisere president at det i m i mobilitetspakke gjelder både lastebil og buss,ved at det vil medføre ein sterk liberalisering av det såkal såkalte kabotasjeregelverket kabotasje er altså utanlandske transportørar som kan køyre innanlandsk transport nasjonal transport i eit anna land la meg også presisere president at det i mob i mobilitetspakkar gjeld både lastebil og buss,8463.8,8488.1,24.30000000000109,2018-11-13,2018-11-13_proceedings.txt
Stortinget-20181113-095516_8488100_8508200,det er mye fokus på lastebilnæringa og det er bra men det gjelder altså rutebil og busstrafikk også med de foreslåtte liberaliseringene så vil det nærmest bli fritt fram for internasj for kabotasjekjøring i norge det ville blitt dramatisk for norsk transportnæring neste taler,det er mykje fokus på lastebilnæringa og det er bra men det gjeld altså rutebil og busstrafikk også med dei føreslåtte liberaliseringae så vil det nærmast bli fritt fram for internasjo for kabotasjekøyring i noreg det ville blitt dramatisk for norsk transportnæringneste talar,8488.1,8508.2,20.100000000000364,2018-11-13,2018-11-13_proceedings.txt
Stortinget-20181113-095516_8517700_8545300,sande ja gode president få ting er viktigere for norge enn samarbeidet med europa og eøsavtalen er bedre bjelken i dette samarbeidet avtalen kom i stand etter krav fra et enstemmig storting og enstemmig fagbevegelse alle var ikke enige i resultatet men kravet var enstemmig for alle så at vi kunne ikke leve videre med den handelsavtalen vi hadde som utsetter industrien vår for sta dumpinganklager,sanbergja gode president få ting er viktigare for noreg enn samarbeide med europa og eøsavtalen er berebjelken i dette samarbeidet avtalen komme i stand etter krav frå eit enstemmig storting og enstemmig fagbevegelse alle var ikkje einige i resultatet med kravet var enstemmig for alle såg at me kunne ikkje leva vidare med den handelsavtalen vi hadde som utsette industrien vår for sta dumpinganklaga,8517.7,8545.3,27.599999999998545,2018-11-13,2018-11-13_proceedings.txt
Stortinget-20181113-095516_8545300_8567900,innen arbeidslivet har dette samarbeidet mellom enogtredve europeiske land gitt oss mange nyvinninger så arbeids og sosialministeren pekte på i sitt innlegg reglene for virksomhetsoverdragelse som revolusjonerte det norske arbeidslivet krav til skriftlige arbeidsavtaler masseoppsigelse styrking av retten til informasjon og konsultasjon,innan arbeidslivet har dette samarbeidet mellom ein og trede europeiske land gitt oss mange nyvinningar som arbeids og sosialministeren peike på i sitt innlegg reglane for virksomhetsoverdragelse som revolusjonerte det norske arbeidslivet krav til skriftlege arbeidsavtalar massoppsigelse styrking av retten til informasjon og konsultasjon,8545.3,8567.9,22.600000000000364,2018-11-13,2018-11-13_proceedings.txt
Stortinget-20181113-095516_8567900_8592700,og jeg vil legge til sjøl bedre regler for likestilling retten for lik lik rett for vikarer som for faste ansatte i innleiebedriften og ikke minst retten til f konsernfaglig tillitsvalgsamarbeid over lands og landegrensene for å peke på noen viktige regler og ikke en dag etter vi fikk eøsavtalen har vi hatt høgere arbeidsledighet enn vi hadde før eøsavtalen,og eg vil legga til sjøl betre reglar for likestilling retten for lik lik rett for vikarar som for fast ansatte i innlegg bedriften og ikkje minst retten til få konsernfagleg tillitsvaldsamarbeid over lands landegrensene for å peika på nokre viktige reglar og ikkje ein dag etter vi fekk eøsavtalen har me hatt høgare arbeidsledighet enn me hadde før i eøsavtalen,8567.9,8592.7,24.80000000000109,2018-11-13,2018-11-13_proceedings.txt
Stortinget-20181113-095516_8592700_8621100,statsråden pekte og på det felles arbeidsmarkedet i europa jeg meiner at dette er noe av det viktigste med eøsavtalen det skal ikke være vanskeligere å flytte fra oslo til paris for å ta seg en jobb enn det skal være å flytte fra oslo til bergen men for å få dette til så må vi ha et knirkefritt eee regelverk vi kreve like regler og lik lønn men dette tar tid og i mellomtiden må vi sørge for at oppslutning og avtalen vært opprettholdt president,statsråden peikar og på dei felles arbeidsmarkedet i europa eg meiner at dette er noko av det viktigaste med eøsavtal det skal ikkje vere vanskelegare å flytta frå oslo til paris for å ta seg ein jobb enn det skal vera flytta frå oslo til bergen men for å få dette til så må me ha eit knirkefritt eee regelverk med krev like reglar og lik lønn men dette tar tid og i mellomtid må me sørga for at oppslutning avtalen vert oppretthald president,8592.7,8621.1,28.399999999999636,2018-11-13,2018-11-13_proceedings.txt
Stortinget-20181113-095516_8621100_8646600,lønningene i polen øker sterkere enn de i norge gir det er bra for da utliggende forskjeller men det er ikke bra når polakker kommer hit å fortrenge nordmenn for da at de kan jobbe til lavere lønn enn oss det er sosial dumping og ingenting er mer ødeleggende med tanke på vårt forhold til eu enn da når vi opp når arbeidstakere oppne lever at stadig vekk flere havner på minstelønnssatsene,lønningane i polen auka sterkare enn det noreg gjer det er bra for da utlikna forskjellar men det er ikkje bra når polakkar kommer hit å fortrenge nordmenn for det at vi kan jobba til lavare lønnen oss det er sosial dumping og ingenting er meir øydeleggjande med tanke på vårt forhold til eu enn da når me opp når arbeidstakarar oppnlever at stadig vekk fleire hamnar på minstelønssatsane,8621.1,8646.6,25.5,2018-11-13,2018-11-13_proceedings.txt
Stortinget-20181113-095516_8646600_8669300,spør de britene som stemte for å få lov at eum hvorfor de stemte så de gjorde så svarer cirka førti prosent og at den viktigste grunn var å få kontroll på innvandring tredve prosent sta for de var den nest viktigste grunn altså sytti prosent sa at den viktigste eller nett viktigste grunn til at de stemte nei til eu skyldes innvandring for eu,spør det britane som stemte for å få la til eum korfor dei stemte som dei gjorde så svarar cirka førti prosent at den viktigaste te grunn var å få kontroll på innvandring tredve prosent sa at det for dei var det nest viktigaste grunn altså sytti prosent sa at den viktigaste eller nett viktigaste grunn til at dei stemde nei til eu skyldes innvandringa frå eu,8646.6,8669.3,22.69999999999891,2018-11-13,2018-11-13_proceedings.txt
Stortinget-20181113-095516_8669300_8691600,nå tror ikke jeg at det er gitt at britene melder seg ut av eu det er store krav for en ny folkeavstemning og det kul jeg ikke forundre meg om et nytt ja ja til å bli bli eu varresultatet president med det aktivitetsnivået vi har i norge har vi et behov for arbeidsinnvandring og vi vil ha behov for arbeidsinnvandring framover,no trur ikkje eg at det er gitt at britane melder seg ut av eu det er store krav for ein ny folkeavstemming og som ikkje forundre meg om eit nytt eee ja ja til å bli bli eu vart resultatet president med det aktivitetsnivå me hatt i noreg har me eit behov for arbeidsinnvandring og me vil ha behov for arbeidsinnvandring framover,8669.3,8691.6,22.30000000000109,2018-11-13,2018-11-13_proceedings.txt
Stortinget-20181113-095516_8691600_8717800,og da er det viktig at vi dem opp på sosial dumping for om ikke vi klarer da så kampen mot sosial dom da dumping sa snart synonymt med motstanden mot eøs og det er ikke samfunnet tjent med noe har vi gjort i den seinere tid innskjerping i arbeidsmiljøloven med krav til faste stillinger er viktig fjerning av nulltimaskontrakten er viktig begge end,og då er det viktig at me demmer opp for sosial dumping for om ikkje me klarar det så ver kampen mot sosial dum da dumping a snart synonymt med motstand mot eøs og det er ikkje samfunnet kjent med noko har me gjort i den seinare tid innskjerping i arbeidsmiljøloga med krav til fast i stillinga er viktig fjerninga og nulltimarskontrakten er viktig begge end,8691.6,8717.8,26.19999999999891,2018-11-13,2018-11-13_proceedings.txt
Stortinget-20181113-095516_8717800_8745800,motsatt var da når tariffnemnda mot lo sine stemmer fjerna allmenngjøringsbestemmelsen og rett til betalte hjemreise for utstasjonerte arbeidstakere i verftsindustrien dagens ordning sto seg godt med bakgrunn i høyesterett sin tolkning av eftadomstolen sin ue uttale at esa er uenig endrer ikke det her esa er verken et euorgan eller en domstol på alle disse områdene synes det regjeringa våre får ta fatt,motsett varda nå tariffnemnda mot lo sine stemmer fjerna allmenngjeringsbestemmelsen og rett til betalte gjenreise for utstasjonerte arbeidstakar i verdsindustrient dagens ordning stod seg godt med bakgrunn i høyesrett sin tolking av efterdomstolen sin u uttale at es er ueinig endrar ikkje i det her eser verken eit euorgan eller ein domstol på alle desse områda synest eg regjeringa vore få ta fatt,8717.8,8745.8,28.0,2018-11-13,2018-11-13_proceedings.txt
Stortinget-20181113-095516_8745800_8767500,for ytterligere å skje på kampen mot sosial dumping har eu vedtatt et revidert utstasjoneringsiv dette blir presentert som lik lønn for likt arbeid på samme sted her må regjeringen hive seg rundt og snarest erstatte arbeidet med implementeringen i det norske lovverket slik at bestemmelsen kan være i funksjon så tidlig som g å reglene tillater,for ytterlegare å kje på kampen mot sosial dumping har eu vedta eit revidert utstasjonæringstiv dette blir presentert som lik lønn for likt arbeid på same stad her må regjeringa hiva seg rundt og snarast er starta arbeid med implementering i det norske lovverket slik at bestemmelsen kan vera i funksjon så tidleg som g og reglane tillate,8745.8,8767.5,21.700000000000728,2018-11-13,2018-11-13_proceedings.txt
Stortinget-20181113-095516_8767500_8787700,bedre kontroll og sanksjoner er kanskje det viktigste dette etterlyses og av eu i den nye utstasjonering direktivereform lære slik sanksjonene skal være effektive stå i rimelig forhold til overtredelsen og ha avskrekkende virkning og vi ser på arbeidstilsynet,betre kontroll og sanksjon er kanskje det viktigaste dette etterlysast og av eu i den nye utstasjoneringsdirektivreform ler slik sanksjonane skal vere effektive stå i rimeleg forhold til overtredelsen og ha avskrekkande virkning og me ser på arbeidstilsynet,8767.5,8787.7,20.200000000000728,2018-11-13,2018-11-13_proceedings.txt
Stortinget-20181113-095516_8787700_8810300,er de høyest kan vi i høyeste grad stille spørsmål om vi har kraftig nok sanksjoner om de er tilstrekkelig avskrekkende jeg tror vi kunne hatt spart mykje penger om at de har hatt kraftigere sanksjonsmuligheter og arbeidstilsynet sine muligheter for bøtelegging er for byråkratisk og putlet og vorte burde vært utvikla,er det i høgre kan vi høgels grad stilla spørsmål om vi har kraftig nok sanksjonar om dei er tilstrekkeleg avskrekkande eg trur me kunne hatt spart mykje pengar om hadde hatt kraftigare sanksjonsmuligheter og arbeidstilsynet sine muligheter for bøtlegging er for byråkratisk og putlete og vorte burde vore utvikla,8787.7,8810.3,22.599999999998545,2018-11-13,2018-11-13_proceedings.txt
Stortinget-20181113-095516_8810300_8826500,og kontroll må det vil være derfor styrker arbeiderpartiet i vårt alternative budsjett både bevilgninger til arbeidstilsynet akrimsenter og vi vil ha flere av de takk neste taler elsemay botten og er min nummer taletid heretter tre minutter,og kontroll målivere derfor styrker arbeidarpartiet vårt alternative budsjett både bevilgninger til arbeidstilsynet akrimsenter og me vil ha fleire av dei takk neste talar elsemay botten og eg minner om at taletida heretter er tre minutt,8810.3,8826.5,16.200000000000728,2018-11-13,2018-11-13_proceedings.txt
Stortinget-20181113-095516_8833400_8862800,botten president fns klimapanels en og en halv graders rapport er et alvorlig varsku om at verden må handle enda raskere og enda mer kraftfullt for å redusere klimagassutslippa derfor så haster det med å styrke innsatsen både heim og ut for verden har dem siste tiåra opplevd endringer i klimasystemet ved at den globale gjennomsnittstemperaturen øker snø og is smelter og havet stiger og blir surere,botnenpresident fns klimapanels ein og ein halv graders rapport er eit alvorleg varsku om at verden må handla enno raskare og enno meir kraftfullt for å redusere klimagassutsleppa derfor så hastar dei med å styrke innsatsen både hem og ut for verden har dei siste tiåra opplevd endringar i klimasystemet ved at den globale gjennomsnittstemperaturen aukar snø og is smeltar og havet stig å bli surare,8833.4,8862.8,29.399999999999636,2018-11-13,2018-11-13_proceedings.txt
Stortinget-20181113-095516_8862800_8889100,hetebølger tørke flom sykloner og skogbrann viser hvor utsatte økosystemer og menneskene er for endringer i klimaet uten handling styrer vi mot fire grader ved slutten av det her århundret det vil gi katastrofale konsekvenser fortsatt økende klimautslipp kan gjøre at parisavtalens målsetting om maks en og en halv grader global oppvarm,hetebølge tyrke flom syklonar og skogbrann viser kor utsette økosystema og menneska er for endringar i klima utan handling styrer vi mot fire grader ved slutten av det her århundret det vil gi katastrofale konsekvensar fortsatt økende klimautslepp kan gjera at parisavtalens målsetting om maks ein og en halv grader global oppvarm,8862.8,8889.1,26.30000000000109,2018-11-13,2018-11-13_proceedings.txt
