file,text_bm,text_nn,start,end,duration,date,proceedingsfile
Stortinget-20180109-095530_4240200_4266900,at noen land sier at dette er avtalen vi har i dag vi vil gjerne se om vi kan få noe litt bedre men vi ønsker å ha dagens avtale i bakhånd så det vi hadde gjort da hvis vi hadde vært eee ønsket reelt å se på alternativet var at vi måtte begynt med å kvitte oss med dagens eøsavtaleda er neste foreløpig siste inntegna taler per olaf lundteigen,at nokon land seier at dette er avtalen vi har i dag vi vil gjerne se om vi kan få no litt betre men vi ønsker å ha dagens avtale i bak ho så det vi hadde gjort da viss vi hadde vore eee ønskt eit reelt å se på alternativet var at vi måtte bynt med å kvittas med dagens evesavtal da er neste foreløpig siste inntekne taler per olav lundteigen,4240.2,4266.9,26.699999999999818,2018-01-09,2018-01-09_proceedings.txt
Stortinget-20180109-095530_4269100_4295500,lundteigen president på veldig mange områder så er norge en stormakt og det er i de store europeiske landenes interesse å ha en gjensidig godt forhold til norge så når noen prøver å framstille sånn at norge må bare ta til rette med det som andre tilbyr e,unnteke president på veldig mange område så er noreg ein stor makt og det er i dei store europeiske landas interesse å ha ein gjensidig godt forhold til noreg så når nokon prøver å framstille sånn at noreg må berre ta til rette med det som andre tilbyr i,4269.1,4295.5,26.399999999999636,2018-01-09,2018-01-09_proceedings.txt
Stortinget-20180109-095530_4295500_4322300,underdanig holdning som ikke er i tråd med det som er den politiske og realøkonomiske virkeligheten britene har funnet ut at eøsavtalen er ikke noen alternativ og det som viser seg også i norge er at svakhetene da ved eøsavtalen blir tydeligere og tydeligere og jeg refererte til den eee franske sosialdemokraten jacques delors som hadde en megetse med,underdanig holdning som ikkje er i tråd med det som er den politiske og realøkonomiske virkeligheten brite har finne ut at eøsavtalen er ikkje nokon eee alternativ og eee det som viser seg også i noreg er at svakhetene da eøsavtalen blir tydelege og tydelegare og e har refererte til den eee franske sosialdemokraten saktelar som hadde ein megese med,4295.5,4322.3,26.800000000000182,2018-01-09,2018-01-09_proceedings.txt
Stortinget-20180109-095530_4322300_4351800,samspillet med gro harlem brundtland og etableringen av eøsavtalen jacques delors ser systemproblemene i det som er dagens eu og det eøsavtalen bygger på president det er et faktum som eee flere partier burde ta innover seg jeg tok ordet fordi at eee representanten michael tetzschner sa at senterpartiet ønska å kvitte seg med markedskreftene jeg kan nok en gang berolige representanten med at det kommer ikke til å skje vi er eee,samspelet med roalembunplan og etablering av eøsavtalen sjakta lår ser systemproblem i det som er eee dagens eee eu og eee det eøsavtalen bygger på president det er eit faktum som eee fleire parti burte ta innover seg eg tok ordet fordi at representanten michael ketur sa at senterpartiet ønsker å kvitte seg med markedskriftene eg kan nok ein gong berolige representanten om at det kommer ikke til å skje vi er,4322.3,4351.8,29.5,2018-01-09,2018-01-09_proceedings.txt
Stortinget-20180109-095530_4351800_4380700,representanter for eee urkapitalismen det har jeg sagt mange ganger før men en urkapitalisme som må korrigeres og det er vi knallharde på president at den kapitalismen må korrigeres gjennom folkevalgte organer og det var det som var innholdet i mitt innlegg nemlig blandingsøkonomien jeg vet at høyre ønsker en friest mulig markedskrefter og dermed minst mulig korrigering av markedskreftene derfor er for høyre eøsavtalen svært hensiktsmessig,representantar for eee urkapitalismen det har eg sagt mange gonger før men en urkapitalisme som eee må korrigerast og det er vi knallar det på president at den kapitalismen må korrigerast gjennom folkevalde organet og det var det som var innhaldet i mitt innlegg nemleg blandingsøkonomien eg veit at høgre ønsker ein fri mulig markedskrefter og dermed minst mulig korrigering av markedskreftene derfor er for høgre eøsavtalen svært hensiktsmessig,4351.8,4380.7,28.899999999999636,2018-01-09,2018-01-09_proceedings.txt
Stortinget-20180109-095530_4380700_4410500,frp har mere vanskeligheter for sjelen til mange frpere er jo å ha en korrigert en kontrollert arbeidsinnvandring ikke en fri arbeidsinnvandring så frp er ute i vanskelig farvann når det gjelder eøsavtalen men det som virkelig er utfordringa det er for arbeiderpartiet og kristelig folkeparti for der er jo eøs en torpedo mot grunnverdiene eøsavtalen er en torpedo mot grunnverdiene ikke minst for arbeiderpartiet,frp har meire vanskelegheiter for skjelen til mange frparar er jo å ha ein korrigert ein kontrollert arbeidsinnvandring ikkje ein fri arbeidsinnvandring så frp er ute i vanskelege farvann når det gjeld eøsavtalen men det som verkeleg er utfordringa det er for arbeidarpartiet og kristeleg folkeparti for der er jo eøs ein torpedo mot grunnverdiene eøsavtalen er ein torpedo mot grunnverdiene ikkje minst for arbeidarpartiet,4380.7,4410.5,29.800000000000182,2018-01-09,2018-01-09_proceedings.txt
Stortinget-20180109-095530_4410500_4439100,en er en torpedo mot det velorganiserte arbeidslivet med full sysselsetting og norske lønns og arbeidsvilkår vi ser det president at det er umulig å sikre full sysselsetting av norske lønns og arbeidsvilkår når det er friest mulig arbeidsinnvandring fra land som har helt annerledes forhold enn i norge det er rein og skjær logikk president det er interessant det som representanten tetzschner sa at arbeiderpartiet ikke stiller opp for eøsavtalen,ein er ein torpedo mot det velorganiserte arbeidslivet med full sysselsetting av norske lønns og arbeidsvilkår vi ser det president at det er umulig å sikre full sysselsetting og norske lønns og arbeidsvilkår når det er friest mulig arbeidsinnvandring frå land som har heilt annelies forhold enn i noreg det er rein og skjær logikk president det er interessant det som representanten tet synest sa at arbeidarpartiet ikkje stiller opp for eøsavtalen,4410.5,4439.1,28.600000000000364,2018-01-09,2018-01-09_proceedings.txt
Stortinget-20180109-095530_4439100_4459300,det er jo da et tegn på at tvilen brer seg i arbeiderpartiet ikke minst i grunnorganisasjonen i arbeiderpartiet ikke minst i fagbevegelsen i arbeiderparti og det er vi veldig glade for president og vi ønsker debatten videre omkring dette systemet som må avløses fortest mulig president neste taler er steinar ness deretter s,det er jo da eit teikn på at tvilen brer seg i arbeidarpartiet ikkje minst i grunnorganisasjonen i arbeidarpartiet ikkje minst i fagvegelse i arbeidarpartiet og det er vi veldig glade for president og vi ønsker debatten vidare omkring dette systemet som må avløysast fortis mulig presidentdet talar er stena rnes deretter s,4439.1,4459.3,20.199999999999818,2018-01-09,2018-01-09_proceedings.txt
Stortinget-20180109-095530_4465500_4492200,ness vær så god gode president qqq jeg tror jeg ville være bra for det politiske ordskiftet om vi var enige om det vi var enige om og diskuterte det vi faktisk er usamde om altså norge har hatt handel og samarbeid med våre naboland før eøsavtalen vi skal sjølsagt ha handel og samarbeid med våre naboland den dagen e lenger,de ver så godgode president qqq eg trur det ville vere bra for det politiske ordskiftet om vi var einige om det vi var einige om og diskuterte det vi faktisk er usamde om altså noreg har hatt handel og samarbeid med våre naboland før eøsavtalen vi skal sjølvsagt ha handel og samarbeid med våre naboland den dagen e lenger,4465.5,4492.2,26.699999999999818,2018-01-09,2018-01-09_proceedings.txt
Stortinget-20180109-095530_4492200_4520100,regulere handel og samarbeid mellom våre land norge har et omfattende samarbeid omfatta handel omfattende handel regulert gjennom andre avtaleformer enn eøsavtalen med ei lang rekke andre land og gir dette til en debatt om hvorvidt norge skal ha handel og samarbeid med andre land er heilt på sida ave reelle motsetningene,regulerer handel og samarbeid mellom våre land noreg har eit omfattande samarbeid omfatta handel omfattende handel regulert gjennom andre avtaleformer enn i eøsavtalen med ei lang rekke andre land og gjere dette til ein debatt om kor vidt noreg skal ha handel og samarbeid med andre land er heilt på sida avei reelle motsetningane,4492.2,4520.1,27.900000000000546,2018-01-09,2018-01-09_proceedings.txt
Stortinget-20180109-095530_4520100_4548700,og kan hun flere av den politiske usemja som ligger i botnen for denne debatten hva er problemet med eøsavtalen blir det spurt om med hva er alternativet alternativet til eøsavtalen er sjølsagt å ar organisere vår handel med eulanda på samme måten som vi ar organiserer vår handel med andre land utafor eu uten at det griper inn i vår nasjonale lovgivning og vår handelfrihet,og kamuflerer den politiske usemja som ligg i botnen for denne debatten kva er problemet med eøsavtalen blir det spurt om og kva er alternativet alternativet til eøsavtalen er sjølvsagt å ar organisere vår handel med eulanda på same måten så vi or organisere vår handel med andre land utanfor eu utan at det grip inn i vår nasjonale lovgjeving og vår handlefrihet,4520.1,4548.7,28.599999999999454,2018-01-09,2018-01-09_proceedings.txt
Stortinget-20180109-095530_4548700_4576000,på viktige områder jeg er heilt overtydd om som det er sagt her at eøsavtalen ikke var tenkt som et varig alternativ til norsk ja eventuelt norsk eumedlemskap men mer å sklie inn hvis vi går tilbake igjen til sv og omstridt i nittennittito om innhold i eøsavtalen så er det jo slik at eøstilhengerne har tatt feil på alle punkt og av den verknaden,på viktige område eg er heilt overtydd om som det er sagt her at eøsavtalen ikkje var tenkt som eit varig alternativ til norsk eventuelt norsk eumedlemskap men meir ei sklie inn viss vi går tilbake igjen til det som var omstridt i nittennittito om innhaldet i eøsavtalen så er det jo slik at i eøstilhengjarane har tatt feil på alle punkt og av den verknaden,4548.7,4576.0,27.300000000000182,2018-01-09,2018-01-09_proceedings.txt
Stortinget-20180109-095530_4576000_4604500,som e eøs motstanderne sa så kan jo en lure på om det var fordi at eøstilhengern om de som forhandla fram avtalene ikke hadde nødvendig kompetanse og oversikt til å overskue de konsekvenser som blant anna torbjørn eee professor eckof og mung og andre meinte låg i disse rettsreglene eller fordi at de ikke trudde at denne avtalen skulle vare så lenge at det kom opp på bordet,som eøsmotstandarane sa så kan jo ein lure på om det var fordi at eøstilhengjarane dei som forhandla fram avtalen ikkje hadde nødvendig kompetanse og oversikt til å overskue dei konsekvensane som blant anna torbjørn eee professor eckhoff og mange andre meinte låg i desse rettsreglane eller fordi at dei ikkje trudde at denne avtalen skulle vare så lenge at det kom opp på bordet,4576.0,4604.5,28.5,2018-01-09,2018-01-09_proceedings.txt
Stortinget-20180109-095530_4604500_4633100,jeg er overtydd om at de visste hva de gjorde og de mente ikke at denne avtalen skulle være et såkalla varig alternativ så til slutt om norsk næringsliv som då er for eøsavtalen det kjenner jo vi alle og de argumenterer jert for eøsavtalen og ser seg tent med den og de advarer da mot hva som vil skje uten av eøsavtale nå er det slik at eøsavtalen ble inngått før vi hadde debatten om norsk eumedlemskap i nittennittifire,eg er overtydd om at dei visste kva dei gjorde dei meinte ikkje at denne avtalen skulle vere eit såkalla varig alternativ så til slutt om norsk næringsliv som då er for eøsavtalen det kjenner jo vi alle og dei argumenterer djervt for eøsavtalen og ser seg tent med den og dei advarer då mot kva som vil skje utan ei eøsavtale no er det slik at eøsavtalen vart inngått før vi hadde debatten om norsk eumedlemskap i nittennittifire,4604.5,4633.1,28.600000000000364,2018-01-09,2018-01-09_proceedings.txt
Stortinget-20180109-095530_4633100_4660100,og noe av det som gleder meg som eumotstandar eu reise rundt og treffe alle de næringslivsleiere nhofolk og høgrefolk som advarte mot at vi ikke ville kunne handle med eu uten et eumedlemskap og som no er godt tent uta uten det takk neste taler er sigbjørn gjelsvik deretter svein roald hansen,og noko av det som gler meg som eumotstandar er jo å reise rundt og treffe alle dei næringslivsleiarar nhofolk og høgrefolk som advarte mot at vi ikkje ville kunne handle med eu utan eit eumedlemskap og som no er godt tent uta utan det takk neste talar er sigbjørn gjelsvik deretter er svein roald hansen,4633.1,4660.1,27.0,2018-01-09,2018-01-09_proceedings.txt
Stortinget-20180109-095530_4663100_4687400,president eee representanten hansen bruker som eee begrunnelse for hvorfor det er viktig å slå ring om eøsavtalen hensynet til norsk næringsliv nok en gang så kjem ikke det noe dokumentasjon på hva det skulle innebære altså når det gjelder markedsadgang for varer så har en altså for industrivarer hatt tollfri adgang til eumarkedet sia nittensyttisju på fisk så innebar eee,president eee representanten hansen eee bruker som eee begrunnelse for korfor det er viktig å slå ring om eøsavtalen hensynet til norsk eee næringsliv nok ein gong så kjem ikkje noko dokumentasjon på kva det skulle innebere også når det gjeld markedsførgang for vare så har ein også for industrivarer hatt tollfri adgang til eumarkedet sidan nittensyttisju på fisk som innebar,4663.1,4687.4,24.299999999999272,2018-01-09,2018-01-09_proceedings.txt
Stortinget-20180109-095530_4687400_4696100,det som var endringa med eøsavtalen kontra den handelsavtalen som en hadde før i gjennomsnitt cirka to prosent endring itning,det som var endringa med eøsavtalen kon tre den handelsavtalen som en hadde før i gjennomsnitt cirka to prosent endring itning,4687.4,4696.1,8.700000000000728,2018-01-09,2018-01-09_proceedings.txt
Stortinget-20180109-095530_4696100_4722700,og eee for fjoråret så var jo det satt en ny eksportrekord for norsk sjømat nærmere hundre milliarder kroner i eksportverdi opp tre prosent i fra forrige re rekordår som var året før og når det gjelder handel med tjeneste så ha eee representanter i fra senterpartiet konkret spurt eu eøsministeren om hun kan framlegge noe dokumentasjon på at norge har fått økt tenest tjenesteekssom,og eee for fjoråret så var jo det satt ein ny eksportrekord for norsk sjømat nærmare hundre milliardar kroner i eksportverdi opp tre prosent ifrå forrer rekordår som var året før og når det gjeld handel med tenester så har eee representantar frå senterpartiet konkret spurt eu eøsministeren må kan framlegge noko dokumentasjon på at noreg har fått økt tenest teneste ekssom,4696.1,4722.7,26.599999999999454,2018-01-09,2018-01-09_proceedings.txt
Stortinget-20180109-095530_4722700_4743800,japan sammenligna med land som usa sammenligna med land som sveits som følge av at norge har hatt eøsavtalen det er ikke framlagt noe dokumentasjon på det tvert imot så får vi bare et svar tilbake igjen at ulike land har ulik økonomi ulik struktur at det er vanskelig å sammenligne mellom land det er ikke framlagt noe do som viser det,japan samanlikna med land som usa samanlikna med land som sveits som følge av at noreg har hatt eøsavtalen det er ikkje framlagt noko dokumentasjon på det tvert imot så får vi berre eit svar tilbake igjen at ulike land har ulik økonomi ulik struktur at det er vanskelege samlinger mellom land er ikkje framlagt noko do som viser det,4722.7,4743.8,21.100000000000364,2018-01-09,2018-01-09_proceedings.txt
Stortinget-20180109-095530_4743800_4772700,til representanten hansen som viste internasjonale avtaler konvensjoner traktater ja sjølsagt skal norge delta i internasjonalt samarbeid det har vi lang tradisjon for å gjøre og noe av det som er utfordringen med eøsavtalen er jo nettopp at det er jo å gripe inn i forhold til anna internasjonalt samarbeid som norge har forplikta seg til blant anna den internasjonale arbeidsorganisasjonen ilo konkret ilo hundre og syvogtredve norge var norsk høyesterett,til representanten hansen som viste internasjonale avtaler konvensjon av traktata ja sjølvsagt skal noreg delta i internasjonalt samarbeid det vi lang tradisjon for å gjere og noko av det som er utfordrande med eøsavtalen er jo nettopp at det er jo og gripe inn i forhold til anna internasjonalt samarbeid som noreg har forplikta seg til blant anna den internasjonale arbeidsorganisasjonen ilo konkret ilo hundre og sjuogtredve noreg og norsk høgste rett,4743.8,4772.7,28.899999999999636,2018-01-09,2018-01-09_proceedings.txt
Stortinget-20180109-095530_4772700_4801900,har bøyd nakken for eøs når det gjelder havnearbeiderne registrerte havnarbeidere sin fortrinnsrett til lossing og lasting ved norske havner som følge av at eøsavtalen står over både norske grunnloven og står og overfor de forpliktelsene som vi har igjennom ilo til representanten tetzschner som føler det er ubehagelig at representanter fra andre parti ikke står tilstrekkelig opp for den innstillinga som flertallet eee står bak i den salen her vel,har bygd nakken for eøs når det gjeld hamnarbeidarane registrerte hamnarbeidarar sin fortrinnsrett til lossing og lasting ved norske hamner som følge av at eøsavtalen står over både den norske grunnlova og står og overfor dei forpliktelsene som vi har gjennom i lom til representanten petcner som eee følgde ubehageleg at representantar frå andre parti ikkje står tilstrekkeleg opp for den innstillinga som fleirtalet eee står bak i den salen her vel,4772.7,4801.9,29.199999999999818,2018-01-09,2018-01-09_proceedings.txt
Stortinget-20180109-095530_4801900_4828400,han trenger ikke gå lenger enn til internt i sitt eget parti noen av de som har gitt mest direkte støtte til senterpartiet sitt inta initiativ er altså europabevegelsen og europ europabevegelsen sin leder eee heidi nordby lunde eee som sier i en uttalelse at europabevegelsen støtter forslag om et regjeringsoppnevnt utvalg og jeg registrerer jeg at representanten nordby lunde dessverre ikke er til stede i salen i dag og kan gjøre greie for,han treng ikkje gå lengre enn til internt i sitt eige parti nokon av dei som har gitt mest direkte støtte til senterpartiet sitt innta initiativ er altså europavegelsen og euro europavegelsen sin leder eee heide norbø lunde eee som seier i ein uttalelse at europavegelsen støttar forslag om eit regjeringsoppnemnt utval registrerer at representanten norbø lunde dessverre ikkje er til stede i salen i dag og kan gjere greie for,4801.9,4828.4,26.5,2018-01-09,2018-01-09_proceedings.txt
Stortinget-20180109-095530_4828400_4854100,alternativet til eøsavtalen og mulighetene som oppstår eee ved å gå ut av eøsavtalen det er jo nettopp å gripe mulighetene til å styrke demokratiet styrke norsk nærings eee og samfunnsliv styrke mulighetene til å fatte beslutninger i den salen her til eee til eee støtte for norske interesserneste taler er svein roald hansen deretter michael tetzschner,alternativet til eøsavtalen og mulighetene som oppstår eee det å gå ut av eøsavtalen det er jo nettopp å gripe mulighetene til å styrke demokratiet styrke norsk nærings eee og samfunnsliv styrke mulighetene til å fatte beslutninger i den salen her til til eee støtte for norske interesserneste talar er svein roald hansen deretter er michael tetsner,4828.4,4854.1,25.700000000000728,2018-01-09,2018-01-09_proceedings.txt
Stortinget-20180109-095530_4859300_4881700,president representanten lundteigen sa at det er ikke sånn at norge bare skal godta det som tilbys når man forhandler avtaler nei selvsagt ikke men når det gjelder alternativ til eøs så er det et skille om man vil være innenfor eller utenfor det indre marked,hansenpresident representanten lundteigen sa at det er ikkje sånn at noreg berre skal godta det som tilbod om ein forhandlar avtale ei selvsagt ikkje men når det gjeld alternativ til eøs så er det eit skilje om ein vil vere innanfor eller utanfor dei indre marked,4859.3,4881.7,22.399999999999636,2018-01-09,2018-01-09_proceedings.txt
Stortinget-20180109-095530_4881700_4908200,og vil man være innenfor en del av det indre marked som norge er igjennom eøsavtalen så må man godta spillereglene i det indre marked der er det ikke noe å gå på skal man være med i europamesterskapet i fotball så kan vi ikke insistere på at offsideregelen ikke gjelder for norge fordi vi er så flinke med flopasninger men når man er utenfor det indre marked så har man en forhandlingssituasjonte,og vil ein vere innanfor den del av det indre marked som noreg er innom eøsavtalen så må ein godta spillereglene i det indre marked der er det ikkje å gå på skal ein vere med i europamesterskapet i fotball så kan vi ikkje insistere på at ofsaiddegen like gjelder for noreg fordi vi gjer så forlikte med forpassningar men når ein er utanfor di indre marked så har ein ein forhandlingssituasjonte,4881.7,4908.2,26.5,2018-01-09,2018-01-09_proceedings.txt
Stortinget-20180109-095530_4908200_4935000,eee og så og så og så videre så sier lundteigen at eee eøsavtalen er en torpedo mot eee sosialdemokratiske verdier altså de årene som har gått siden vi inngikk eøsavtalen president det har jo vært en glanstid for norsk økonomi og der igjennom norsk velferd og ikke minst gjennom de åtte årene hvor senterpartiet arbeiderpartiet og sammen,eee og så og så eee og så vidare så seier det innteikna at eee eøsavtalen er ein torpedo mot eee sosialdemokratiske verdier altså dei åra som har gått sidan min i eøsavtalen president det har jo vore ein glans tid for norsk økonomi og der igjennom norsk velferd og ikkje minst gjennom dei åtte åra vor senterpartiet arbeidarpartiet og saman,4908.2,4935.0,26.800000000000182,2018-01-09,2018-01-09_proceedings.txt
Stortinget-20180109-095530_4935000_4963600,og hvor nettopp arbeidsinnvandringen var et viktig bidrag til alt det vi fikk gjort eee den gangen jeg er så forundret president over senterpartiets eee stadige angrep på eøsavtalen og forsøk på å å å svekke den altså senterpartiet burde være eøsavtalens varmeste forsvarer fordi den gir jo og norsk næringsliv det redskap dering eksportnæringslivet trenger til vårt viktigste marked,og vår nettopp arbeidsinnvandringa var eit viktig bidrag til alt det vi fekk gjort eee den gongen eg er så forunder president over senterpartiets eee stadige angrep på eøsavtalen og forsøk på å å svekke den altså senterpartiet burde vere eøsavtalens varmeste forsvarer fordi den gir norsk næringsliv det redskap næringsliv eksportnæringslivet treng det vårt viktigaste marked,4935.0,4963.6,28.600000000000364,2018-01-09,2018-01-09_proceedings.txt
Stortinget-20180109-095530_4963600_4993200,og så beskytter den landbruket har alternativet til eøsavtalen vil for å ivareta norske handelsinteresser vil være medlemskap og ikke noe annet så sier representanten gjelsvik at jeg er ikke noe det er det er liksom ikke noe bevis på at en handelsavtale vil være dårligere for næringslivet altså det felles regelverket er jo nøkkelen til det,og så beskytter den landbruken var alternativet til eøsavtalen vil for å ivareta norske handelsinteresser vil vere medlemskap og ikkje noko anså eee seier eee representanten gjelsvik at en no det det er liksom ikkje nok bevis på at ein handelsavtale vil vere dårleg for næringslivet altså det felles regelverket er jo nykkene til det,4963.6,4993.2,29.599999999999454,2018-01-09,2018-01-09_proceedings.txt
Stortinget-20180109-095530_4993200_5018500,å kunne eee konkurrere på like vi vilkår og så sier han vi skal selvsagt samarbeide og delta i internasjonalt samarbeid ja det er bra men kjernen er er man villig til å oppgi noe suverenitet og hvis man ikke er det så vil landene gjøre som de vil når det kommer til hælinga se hva vi står ovenfor nå med ny president i usa løper fa fra forpliktelser på fo forpliktelser,å kunne eee konkurrere på like ve vilkår og då seier han vi skal selvsagt samarbeide og delta i inntaka samarbeid ja det er bra men kjernen er er ein ville opp i no suverenitet og viss ein ikkje er det så vil landet gjere som dei vil når det kommer til herdinga så kva vi står om for no med ein ny president i usa løper frå fo frå forpliktelser på fo forpliktelser,4993.2,5018.5,25.300000000000182,2018-01-09,2018-01-09_proceedings.txt
Stortinget-20180109-095530_5018500_5048500,og han mener at brexit gir muligheter president så lurer jeg på om han følger med på debatten som går borte i storbritannia jeg har mø hatt møter med kolleger fra storbritannia i ulike sammenhenger og det inntrykket man sitter med det er at de har ingen omforent oppfatning og oppfatning om hva slags avtale de ønsker skal erstatte medlemskap det blir veldig spennende å se hvor dette ender neste taler er michael tetzschner deretter sigbjørn gjelsvik,og han meiner at breksit i muligheter president så lurer eg på om ein følger meg på debatten som går bort i storbritannia eg har mø hatt møter med kolleger frå storbritannia i ulike samanhengar og det inntrykket ein sit med det er at dei har ingen omforent omfatning og oppfatning om kva slags avtale dei ønsker skal erstatte medlemskap det blir veldig spennande å sjå kva dette er nerneste talar er mikael tetsne deretter sigbjørn gjelsvik,5018.5,5048.5,30.0,2018-01-09,2018-01-09_proceedings.txt
Stortinget-20180109-095530_5060700_5066700,tetzschnerpresident at skal vi se om den kan heve seg,takk president at skal vi se om den kan heve seg,5060.7,5066.7,6.0,2018-01-09,2018-01-09_proceedings.txt
