file,text_bm,text_nn,start,end,duration,date,proceedingsfile
Stortinget-20181113-095516_12839000_12865100,eee eus eee eee eventuelle oppbygning den må komme som et supplement til og ikke til erstatning for eller konkurrere med nato eee og når regjeringa eee begynner å nærme seg en beslutning eller konklusjon så vil selvfølgelig stortinget også bli eee konsultert om det så president helt til slutt til svein roald hansen eee det er jo sånn i det som nå,eee eus eee eee eventuelle oppbyggning den må komme som eit supplement til å ikkje til erstatning for eller konkurrere med nato eee og når regjeringa eee begynner å eee nærme seg ein beslutning eller konklusjon så vil selvfølgelig stortinget også bli eee konsultert om det så president heilt til slutt til svein roald hansen eee det er jo sånn i eee det som no,12839.0,12865.1,26.100000000000364,2018-11-13,2018-11-13_proceedings.txt
Stortinget-20181113-095516_12865100_12885800,at vi har samarbeida og samarbeidet veldig tett både med storbritannia og med eusida og det er jo nettopp for at de avtalene som inngås skal speile eee den avtalen storbritannia og eu inngår det er for at så mye som mulig skal være så likt som mulig eee det det er i dag og det er nettopp derfor vi har ført de eee diskusjonent,at vi har samarbeida og samarbeide veldig tett både med storbritannia og med eu sida og det er jo nettopp for at dei avtalene som inngår skal speile eee den avtalen storbritannia og eu inngår det er for at så mye som mulig skal vere så likt som mulig eee det det er i dag og det er nettopp derfor vi har ført dei eee diskusjonenlt,12865.1,12885.8,20.69999999999891,2018-11-13,2018-11-13_proceedings.txt
Stortinget-20181113-095516_12885800_12911300,så til spørsmålet om artikkel hundre og tjuesju og det eee diplomatiske konferansen det er noe vi forsøkte eee sterkt å få til men det var altså ikke politisk vilje i eu eller storbritannia og særlig ikke i storbritannia til å eee diskutere dette rett og slett f ut fra argumentet om at de uansett skulle ut av eøs og de ønska ikke å komplisere eee en vanskelig forhandling ytterligere for dette handler jo om,så til spørsmålet om artikkel hundre og tjuesju og den eee diplomatiske konferansen det er noko vi forsøkte eee sterkt å få til men det var altså ikkje politisk vilje i eu eller storbritannia og særleg ikkje i storbritannia til å eee diskutere dette rett og sett ut frå argumentet om at dei uansett skulle ut av eøs og dei ønsker å komplisere eee ein vanskeleg forhandling ytterligare for dette handlar jo om,12885.8,12911.3,25.5,2018-11-13,2018-11-13_proceedings.txt
Stortinget-20181113-095516_12911300_12925600,å ha en konferanse om eventuelle endringer i eøsavtalen som følge av en utrede den så lenge de skulle helt ut av eøs så var vurderinga deres at de ikke ønska detneste taler er statsråd anniken hauglie deretter sigb,og ha ein konferanse om eventuelle endringar i eøsavtalen som følge av en utrede så lenge dei skuhelt ut av eøs så var vurderinga deira at dei ikkje ønsker detneste talar er statsråd anniken hauglie deretter sig,12911.3,12925.6,14.300000000001091,2018-11-13,2018-11-13_proceedings.txt
Stortinget-20181113-095516_12930600_12945000,hauglie statsråd hauglie takk for det president og takk for eee en lang og viktig eee debatt jeg vil også understreke at eee regjeringen er jo opptatt av eøsavtalens legitim,hauglie statsråd hauglidtakk for det president og takk for eee ein lang og viktig eee debatt eg vil også understreka at eee regjeringa er jo opptatt av eøsavtalens legitim,12930.6,12945.0,14.399999999999636,2018-11-13,2018-11-13_proceedings.txt
Stortinget-20181113-095516_12945000_12974900,vi ønsker jo en levende opplyst debatt om eu og isspørsmål det er jo derfor vi er to fagstatsråder her i dag sammen med utenriksministeren og det er jo derfor vi også deltar i de andre redegjørelsene som holdes i europautvalget og andre steder selv har jeg jo deltatt i europautvalget to ganger om arbeidslivsspørsmål og det er jo derfor vi også engasjere oss så sterkt i debattene både i eee i europa og i norden også,vi ønsker jo ein levande opplyst debatt om eu og ei spørsmål det er jo derfor vi gjer to fagstatsråder her i dag saman med utanriksministeren og det er derfor vi også deltar i dei andre redene som forest i europatoget og andre steder sjel har eg deltatt i europatoget to gonger om arbeidslivsspørsmål og det er jo derfor vi også engasjerer sos så sterkt i debatten både i eee eee i europa og i norden også,12945.0,12974.9,29.899999999999636,2018-11-13,2018-11-13_proceedings.txt
Stortinget-20181113-095516_12974900_13001900,for å nettopp styrke norges eee posisjon og for å ivareta norske interesser ikke minst på arbeidslivsområdet men det er også derfor vi engasjerer oss sterkt i arbeidslivspolitikken som diskuteres eee i oecd i ilo og da norge ble invitert til å delta på gtjuemøtet eee i fjor det er i vår interesse president at standarden heves internasjonalt men dag har vist,for å nettopp styrke noregs eee posisjon og for ivareta norske interesser ikkje minst på arbeidslivsområdet men det er altså derfor vi engasjerer oss sterkt i arbeidslivspolitikken som diskuterast eee i ocd i ilo og der noreg blei invitert til å delta på gtjuemøtet eee i fjor det er i vår interesse president at eee standaren hevast internasjonalt men dag har vist,12974.9,13001.9,27.0,2018-11-13,2018-11-13_proceedings.txt
Stortinget-20181113-095516_13001900_13028100,et er viktig å understreke at også i norge har vi fått styrket våre interesser og rettigheter som følge av eee eu eee eller eøsavtalen den norske innsatsen mot arbeidskrim er viktig for norge men den er også viktig for eee europa vi revurderer nå i disse dager arbeidslivsstrategien vår sammen med partene håndhevingsdirektivet som eee blir implementert i fjor gjør det jo lettere for os,eg viktig understreke at eee også i noreg vi får styrke våre interesser og rettigheter som følge av eee eu eøsavtalen den norske innsatsen mot arbeidskre er viktig for noreg men den er også viktig for eee eee europa vi revurderer no i desse dagar arbeidslivstrategien vårt saman med partane handhevingsdirektivet som eee blir implementert i fjor gjer det jo lettare for os,13001.9,13028.1,26.200000000000728,2018-11-13,2018-11-13_proceedings.txt
Stortinget-20181113-095516_13028100_13057200,eee å bekjempe arbeidslivskriminalitet det er bra for oss og det er bra for europa men vi skal selvfølgelig iverksette enda flere tiltak for å eee begrense og redusere omfanget av grenseoverskridende arbeidslivskriminalitet et konkret eksempel nå er jo at arbeidstilsynet og og og vegdirektoratet skal jo nå samarbeide om å slå ned på ulovlige lønns og arbeidsvilkår for transport i transportbransjen det er bra for norge men det er også bra for utenlandske arbeidstakere som i dag,eee og bekjempe arbeidslivskriminalitet det er bra for oss og det er bra for europa men vi skal selvfølgelig i veg sette endå fleire tiltak for å eee begrense og redusere omfanget av grenseoverskridende arbeidslivskriminalitet eit konkret eksempel nå er jo at arbeidstilsynet og og eee og eee vegdirektoratet skal nå samarbeide om å slå ned på ulovlege lønns og arbeidsvilkår for transport i transportbransjen det er bra for noreg men det også bra for utanlandske arbeidstakarar som i dag,13028.1,13057.2,29.100000000000364,2018-11-13,2018-11-13_proceedings.txt
Stortinget-20181113-095516_13057200_13086900,har hvor hvorav mange av de i dag har dårlige lønns og arbeidsvilkår så som i sum så er det viktig at vi fra denne i denne sal også tar innover oss eus betydning for norge hvor viktig eøsavtalen er for norske eee arbeidsplasser men eøsarbeidet er jo ikke en statisk statisk arbeid president det er en dynamisk prosess hvor vi kan velge å bi bidra eller ikke bidra og regjeringen velger da også å bidra til at også arbeidstakernes rettigheter styrkes i europa,har vor vora mange av dei i dag har dårleg løns og arbeidsvilkår så i som i sum så er det viktig at vi frå denne i denne sal også tar innover oss eøs betydning for noreg kor viktig eøsavtalen er for norske eee arbeidsplassar men eøsarbeidet auka ein statiske statisk arbeid president det er ein dynamisk prosess og vi kan velge å bi bidra eller ikkje bidra og regjeringa velger det også å bidra til at også arbeidstakandes rettigheter styrkast i europa,13057.2,13086.9,29.69999999999891,2018-11-13,2018-11-13_proceedings.txt
Stortinget-20181113-095516_13086900_13114400,neste taler er representanten sigbjørn gjelsvik gjelsvik har hatt ordet to ganger tidligere og får ordet til en kort merknad begrenset oppad til ett minutt neste taler deretter er heidi nordby lunde gjelsvik ja president jeg lytta med interesse på innlegget til martin eee kolberg der han blant anna sa at det er betydelige dilemma kl eøs,neste talar er representanten sigbjørn gjelsvik gjelsvik har hatt ordet to gonger tidlegare og får ordet til ein kort merknad begrense to på av til eitt minutt neste talar deretter er heidi nordby lunde gjelsvikja president eg lytta med interesse på innlegget til martin eee kollberg der han blant anna sa at det er betydelege delemma kl eøs,13086.9,13114.4,27.5,2018-11-13,2018-11-13_proceedings.txt
Stortinget-20181113-095516_13114400_13144300,men da er jo spørsmålet til arbeiderpartiet hva er det som er arbeiderpartiet sitt svar på den virkeligheten som en nå opplever når en får en høyesterettsdom som blir satt til side når regjeringa bøyer nakken når flertallet i tariffnemnda bøye nakken mot lo sine stemmer og undergreve arbeidsfolk i norge sine rettigheter avdeling fem i fellesforbundet har konkludert de som har forsvart eøsavtalen med nebb og klør,men då er jo spørsmålet til arbeidarpartiet kva er det som er arbeidarpartiet sitt svar på den verkelegheiten som ein no opplever når ein får ein høystetsrettsdom som blir sett til side når regjeringa bøyer nakken når fleirtalet i tarifnemda bøyer nakken mot lo sine stemmer og undergreve arbeidsfolk i noreg sine rettigheter avdeling fem i fellesforbundet har konkludert dei som har forsvart eøsavtalen med nebb og klør,13114.4,13144.3,29.899999999999636,2018-11-13,2018-11-13_proceedings.txt
Stortinget-20181113-095516_13144300_13165400,si nå at vi må ut av eøs og hva er det da som er arbeiderpartiet sitt svar i den situasjonen hvis en ikke vil stå skulder ved skulder med roar abramsen i avdeling fem og senterpartiet å sier at det nå er nok nok i forhold til eøsavtalen presidentneste taler er representanten heidi nordby lunde deretter m,seier no at vi må ut av eøs og kva er det då som er arbeidarpartiet sitt svar i den situasjonen viss ein ikkje vil stå skulder ved skulder med roar abramsen i avdeling fem og senterpartiet å seie at det no er nok nok i forhold til eøsavtalen presidentneste talar er representanten heidi nordby lundø deretter m,13144.3,13165.4,21.100000000000364,2018-11-13,2018-11-13_proceedings.txt
Stortinget-20181113-095516_13173700_13196400,nordby lunde president dette her er jo en av de mange debattene vil jeg tro hvor mange hører det de vil hører og leser det de vil lese litt uavhengig av hva som de egentlig forstår hva intensjonen er i sommer så hadde eee jeg et utspill i dagsavisen hvor det stod i ingressen at tida er innafor en ny eudebatt,norby lundø president dette her er au ein av dei mange debattane vil eg tru vore mange høyrer det dei vil høyrer og leser det dei vil lese litt uavhengig av kva som dei eigentleg forstår kva intensjonen er i sommer så hadde eee eit utspel i dagsavisen vor det sto i ingressen at tida er innanfor ein ny eudebatt,13173.7,13196.4,22.69999999999891,2018-11-13,2018-11-13_proceedings.txt
Stortinget-20181113-095516_13196400_13225200,dette mener heidi nordby lunde skrev dagsavisen og der jeg fikk støtte fra forsker svein melby både i dagsavisen og i en påfølgende debatt med representanten liv signe navarsete så ble det oppklart ganske tydelig hva som var bakgrunnen for det poenget var at med en trusselen fra putin i øst handelskriken fra trump i i vest migrasjonsutfordringene i sør og økende populisme i nord burde nettopp tvinge fram en debatt om vårt nærmeste og mest naturlige verdifellesskap,dette meiner heide nord blunde skriv dagsavisen og der eg fekk støtte frå forskar svein melby både i dagsavisen og i ein påfølgande debatt med representanten liv signe navarsete så blei det oppklart ganske tydeleg kva som var bakgrunnen for det poenget var at med ein trusselen frå putin i aust handelskrien frå trump i i vest migrasjonsutfordringane i sør og økende populisme i nord burde nettopp tvinge fram ein debatt om vårt nærmaste og den mest naturleg verdifellesskap,13196.4,13225.2,28.80000000000109,2018-11-13,2018-11-13_proceedings.txt
Stortinget-20181113-095516_13225200_13252600,når eu har vedtatt sanksjoner mot russland så har norge fulgt disse fordi sammen så står vi se sterkere mot en aggressor som gjør det motsatte av normale sikkerhetspolitikken nemlig å destabilisere i sine egne nærområder russlands nærområder er norges nærområder et sikkerhetspolitisk samarbeid er ikke et nullsumspill slik senterpartiets medlem av utenriks og forsvarskomiteen ser ut til å tro å styrke eus sikkerhetspolitiske samaker ikke nato,når eu har vedtatt sanksjonar mot russland så har noreg følgt desse fordi saman så står vi sterkare mot ein agressor som gjer det motsette av normalne sikkerheitspolitikken nemleg å destabilisere i sine eigne nærområder russlands nærområde er noregs nærområde eit sikkerheitspolitisk samarbeid er ikkje eit nullsumspel slik senterpartiet til medlem av utanriks og forsvarskomiteen ser ut til å tru å styrke eus sikkerheitspolitiske samaker ikkje nato,13225.2,13252.6,27.399999999999636,2018-11-13,2018-11-13_proceedings.txt
Stortinget-20181113-095516_13252600_13279900,tvert om derfor samarbeider nato og eu allerede om over tyve prose prosjekter som går på alt fra dimensjonering av havner veier og bruer logistikk rundt forflytning av personer og materiell internt samt å bygge ned hindre i eee form av lovverk som for eksempel forbud mot et annet lands materiell på eget territorium det er ikke noe ønske fra noen av sidene om å duplisere disse kapasitetene men å sikre nødvendig fly og forflytninger dee bli nødvendig,tvert om derfor samarbeider nato og eu allereie om over tyve prosjek prosjekt som går på alt frå dimensjonering av hamner vegar og bruer logistikk rundt forflytning av personar og materiell internt samt å byggje ned hindre i form av lovverk som for eksempel forbod mot eit anna lands matereell på eige territorium det er ikkje å ønske frå nokon av side om å duplisere desse kapasitetane men å sikre nødvendig flyt og forflytningar dele bli nødvendig,13252.6,13279.9,27.299999999999272,2018-11-13,2018-11-13_proceedings.txt
Stortinget-20181113-095516_13279900_13286900,norges sikkerhet begynner i europa og hvis eu knaker i sammenføyningene så gjør også det norge mer utsatt,noregs sikkerheit bynder i europa og viss eu knakar i samanføyingane som gjer også det noreg meir utsett,13279.9,13286.9,7.0,2018-11-13,2018-11-13_proceedings.txt
Stortinget-20181113-095516_13286900_13313300,et trygt fritt og økonomisk sterkt europa ikke bare forebygge konflikter som jeg tidligere sa eee som tidligere reir dette kontinentet i i filler men gjør også at vi som nasjonalstater eee står sterkere sammen mot eee eksterne trusler det er europeiske samarbeid og fellesskapet styrker nato men det er nato som er hjørnesteinen i norsk sikkerhets og forsvarspolitikk det ene utelukker med andre ord ikke det andre og skal heller ikke være,eit trygt fritt og økonomisk sterkt europa ikkje berre førebygger konfliktar som me tidlegare sa eee som tidlegare der dette kontinenta i i filler men gjør også at vi som nasjonalstatar eee står sterkare saman mot eksterne trusseler det er europeiske samarbeid og fellesskapet styrker nato men det er nato som er gjernesteinen i norsk sikkerheits og forsvarspolitikk det eine utelukker med andre ord ikkje det andre og skal heller ikkje vere,13286.9,13313.3,26.399999999999636,2018-11-13,2018-11-13_proceedings.txt
Stortinget-20181113-095516_13313300_13331500,dette ble eee sagt veldig tydelig i sommer og jeg synes det er litt forunderlig at det da kommer tilbake igjen på stortingets talerstol når man vet at det faktisk er feilneste taler er representanten martin kolberg deretter utenriksminister ine eriksen søreide,dette blir eee sagt veldig tydeleg i sommar og eg synest det er litt for undeleg at det da kommer tilbake igjen på stortingets talarstol når ein veit at det faktisk er feilneste talar er representanten martin koberg deretter utenriksminister ine eriksen søreve,13313.3,13331.5,18.200000000000728,2018-11-13,2018-11-13_proceedings.txt
Stortinget-20181113-095516_13335700_13365500,kolberg gode president eee først en opprettelse en feil jeg sa at geirmo var i transportarbeiderforbundet det har han jo ikke han har i norges lastpileierforbund det blei det mer presist og riktig beklage dette eee så til eee slutt bare dette jeg sier at det er betydelig dilemmaer og jeg hører hva arbeidsministeren sier og jeg hører hva samferdselsministeren sier det er ikke sånn at jeg ikke hører det,aberggode president eee først ein opprettelse en feil i ei sak er må vare transportarbeiderforbund og det gjer han jo ikkje han har i noregs lastbileforbund eee blei det meir presist og riktig beklagar dette eee sotle er slutt berre dette eg seier at det er betydelege dilemmar og eg høyrer kva arbeidsministeren seier og gje høyre var samferdsministeren seier det ikkje sånn at eg ikkje høyrer det,13335.7,13365.5,29.799999999999272,2018-11-13,2018-11-13_proceedings.txt
Stortinget-20181113-095516_13365500_13393100,men det er en kjenn erkjennelse som vi kanskje skal ha i fellesskap og det er hvordan kan det være slik at vi nå opplever altså sånn som dagens sak da med alle lastbilene hvor folk bor i lastebilen sin i ukesvis lager mat sin på primus inn i lastebilen og jobber for knappere og glansbilder hvorfor er vi kommet dit det spørsmålet bør,men der ein kjenne erkjennelse som vi kanskje skal ha i fellesskap og der vorda kan det vere slik at vi no opplever altså sånn som dagens saka med alle lastbilen vår folk bur i lastbilen sin dei ukesvis lagar mat inn på primbus inne i lastbilen og jobber for knappar og glansbilder vorfor er vi kome dit det spørsmålet bør,13365.5,13393.1,27.600000000000364,2018-11-13,2018-11-13_proceedings.txt
Stortinget-20181113-095516_13393100_13412700,norges nasjonalforsamling stiller seg og det bør ikke ha noe partipolitisk kniving om og det ville jeg syns det har vært greit om samferdselsministeren kunne reagere på før vi avslutter neste taler er utenriksminister ine eriksen søreide deretter leif audun sande,noregs nasjonalforsamling stiller seg og det bruker han no partipolitisk kniving om og det ville eg synest det var greitt om samferdsministeren kunne reagere på før vi avsluttaneste talar er utanriksminister ine eriksen søreide deretter leif audun sande,13393.1,13412.7,19.600000000000364,2018-11-13,2018-11-13_proceedings.txt
Stortinget-20181113-095516_13416400_13429200,utenriksminister søreide ja president eee i tillegg til å takke for debatten så vil jeg bare opplyse om en ting jeg glemte å si sa og det som jeg hadde planlagt å si og det var at jeg har invitert med klima og miljøminister ola elvestuen,utanriksminister så er redja president eee i tilegg til å takke for debatten så vil eg berre opplyse om ein ting eg glemte å si sa og det som hadde planlagt å si og det var at eg har invitert med klima og miljøminister ola elvestuen,13416.4,13429.2,12.800000000001091,2018-11-13,2018-11-13_proceedings.txt
Stortinget-20181113-095516_13429200_13451500,til europautvalget eee den tredevte november for å snakke om disse klimaspørsmålene som flere hadde spørsmål om eee fordi vi er begge av den oppfatning at det er eee noe som både er viktig for stortinget å være orientert og konsultert om men det er i tillegg selvfølgelig også noe som er viktig for norge så eee eee klima og miljøministeren eee er da tiltenkt å komme til europautvalget tredvte,til europautvalet eee den tredevte november for å snakke om desse klimaspørsmåla som fleire hadde spørsmål om eee fordi vi er bergande den oppfatninga at det er eee noko som både er viktig for stortinget å vere orientert og konsultert om men det er i tillegg eee selvfølgelig oss noko som er viktig for noreg så eee klima og miljøministeren er da tiltenkt å kome til europautvaget tredevte,13429.2,13451.5,22.299999999999272,2018-11-13,2018-11-13_proceedings.txt
Stortinget-20181113-095516_13451500_13459600,neste taler er representanten leif audun sande deretter liv sign,eee novemberneste talar er representanten leif audun sandø deretter liv sign,13451.5,13459.6,8.100000000000364,2018-11-13,2018-11-13_proceedings.txt
Stortinget-20181113-095516_13465600_13492100,sande ja her president arbeiderpartiet trur på eøsavtalen og hvor vei til europa er gjennom den eee så var det ifra representant gjelsvik her nevnte det som skjedde i avdeling fem i bergen som plutselig sa nei til eee eøsavtalen og ville ha den oppsagt det er jo en gang slik i norsk fagbevegelse at det ulen,sander ja president arbeidarpartiet trur på eøsavtalen og vår veg til europa er gjennom den eee så vart det ifrå representanten gjelsvik her nemnt det som skjedde i avdeling fem i bergen som plutseleg sa nei til eee eøsavtalen og ville ha den oppsagt det er ein eingong slik i norsk fagbevegelse at det er ulen,13465.6,13492.1,26.5,2018-11-13,2018-11-13_proceedings.txt
Stortinget-20181113-095516_13492100_13511900,og lokongressen har gang etter gang etter gang sagt sin støtte til eøsavtalen og i eee det forbundet som jeg for eksempel kom i som enstemmige landsmøtevedtak for at vi trenger eøsavtalen fordi vi veit det at industriinvo vil bli utradert om vi ikke har hatt den tilgangen til det indre markedet,og ellokongressen har gang etter gang etter gang sagt synn støtte til eøsavtalen og i det forbode som eg for eksempel kommer som einstemmige landsmøtevedtak for at vi treng eøsavtale fordi vi veit at industrien vår vil bli utradert om vi ikkje hadde hatt den tilgangen til dei indre markedet,13492.1,13511.9,19.799999999999272,2018-11-13,2018-11-13_proceedings.txt
Stortinget-20181113-095516_13511900_13522400,og det som repres det som abrahamsen andre fellesforbundet har reagert opp er en del tilfeller av sosial dumping som gjør at det er vanskelig for deg,og det som repres det som abrahamsen og andre fellesforbun har reagert opp er ein del tilfelle av sosial dumping som gjer at det er vanskeleg for dei,13511.9,13522.4,10.5,2018-11-13,2018-11-13_proceedings.txt
Stortinget-20181113-095516_13522400_13549500,og derfor så er skal eøsavtalen ha troverdighet i norsk norge blant norsk befolkning så er det viktig at vi på en best mulig måte tar fatt i de eee utslagene av sosial dumping som vi ser men ved å bruke alle de virkemidlene vi har for å demme opp for sosial dumping og klar om i dag så har eøsavtalen en god sending i det norske folk men det neste historiene da som har,og derfor så er skal eøsavtalen ha troverdighet i norsk noreg blant norsk befolkning så er det viktig at me på ein best mulig måte ta fat i dei eee utslaga av sosial dumping som me ser me må bruke alle dei verkemiddel me har for å demme opp for sosial dumping og klarer med det så har eøsavtalen ein god stending i det norske folk men det verste historiane de som har,13522.4,13549.5,27.100000000000364,2018-11-13,2018-11-13_proceedings.txt
Stortinget-20181113-095516_13549500_13573100,dårlige forhold arbeidstilsyn og rapporter som viser at vi ikke klarer å takle godt nok som gjør at han kommer i miskreditt og da er det viktigste at alt å få så ha et godt regelverk godt tilsyn da vil den ha god sendinger i norske folk og som den for øvrig har neste taler er representanten liv signe navarsete deretter per olaf lundteigen,dårlege forhold arbeidstilsynet og rapportar som viser at me ikkje klarar å takla godt nok som gjer at han kommer inn viss kredit og da er det viktigast at alt å få ha eit godt regelverk godt tilsyn då vil den ha god sending i det norske folk og som den forøvrig harneste talar er representanten liv signe navarsete deretter per olaf kluntheigen,13549.5,13573.1,23.600000000000364,2018-11-13,2018-11-13_proceedings.txt
Stortinget-20181113-095516_13578200_13606000,navarsete har hatt ordet to ganger tidligere og får ordet til en kort merknad begrenset oppad til ett minutt navarsete tusen takk eee president eee jeg må eee ta et inn lite innlegg til heidi lunde nordby jeg for alle truksmåla som representanten eee lunde nordbyr ramsa opp alle truksmåla er handla om nato hittil har norsk bra en brei norsk tisk hverdag,navarsete har hatt ordet to gonger tidlegare og får ordet til ein kort merknad begrense tap på av til eitt minutt navarsete tusen takk eee president eee eg må ta eit inn litt innlegg til heidi lunde nordby for alle trugsmåla som representanten eee lunde nordby ramsa opp alle truksmåla er handlar om nato hit dei har norsk brei ein brei norsk tisk kvardag,13578.2,13606.0,27.799999999999272,2018-11-13,2018-11-13_proceedings.txt
