file,text_bm,text_nn,start,end,duration,date,proceedingsfile
Stortinget-20191213-085502_7568800_7594900,så vil nå få svært lang reisevei til ny sin nye arbeidsplass mange av de flere titalls mil og finne fleksible løsninger sånn at de kan beholde kontorsted i dersom de har hatt i sin kommune istedenfor og å måtte bli langpendlere som for øvrig er og noen av de som blitt straffa svært hardt av den regjeringa her president neste taler er sakens ordfører w,som vi no får svært lang reiseveg ten sin nye arbeidsplass mangen av dei fleire titals mil å finne fleksible løysingar sånn at dei kan behalde kontorstad i dersom dei har hatt i sin kommune i staden for og om å tet bli langpendlarar som forøvrig er og noken av dei som blitt straffa svært hart av den regjeringa her presidentneste talar er sakas ordførar ve,7568.8,7594.9,26.099999999999454,2019-12-13,2019-12-13_proceedings.txt
Stortinget-20191213-085502_7600400_7627700,solheim president det var i alle fall en nok et noe mer defensivt senterparti og det hadde jo virkelig den her saken fortjent fordi at mykje av det som er sagt i fra den talerstolen fra deres side har jo ingen ingen bunn i sannheten der kan en for øvrig da si det at representanten gjelsvik egen kommune gikk jo sammen med shasa allerede i totusenogelleve om å danne felles skatteoppkontor eksempler er mangedet eee president,soleim president det var i alle fall ein noko eit noko meir defensivt senterparti og det hadde jo verkeleg det her i saka for tent for at mikke av det som er sagt ifrå den talerstolen for demme si sida ha har jo ingen ingen bunn i sandheten eg kan forøvrig i da seie det at representanten gjelvsvik eigen kommune gjekk ut saman med skersmålet reia i totusenogelleve om å få denne felles skatte opevkontor eee eksempel er mangedet president,7600.4,7627.7,27.300000000000182,2019-12-13,2019-12-13_proceedings.txt
Stortinget-20191213-085502_7627700_7657600,og derfor så står fortsatt min utfordring tilbake til til senterpartiet ønsker virkelig ønske å legge makt bak åra ja så skulle må dere jo da påføre altså eller si da at alle kommunene skal ha et eget kontor for det er jo det som er eneste logiske konsekvens av det dere faktisk sier den logiske konsekvensen av at nærhet er så viktig betyr at jo flere kontor jo jo bedre to hundre og tjuesju kan jo mulig være nok slags fem hundre kontor det å komme et ordføreropprop det er helt riktig,og derfor så står fortsatt min utfordring tilbake til til senterpartiet og s er verkeleg ønsker å legge makt bak orda og så vi må det jo da påføre eller seier det at alle kommunar skal ha eige kontor for et er jo det som er einaste logiske konsekvens av det det faktisk seier den logiske konsekvensen av at nærheit er så viktig betyr at jo fleire kontor jo jobba betre to hundre og tjuesju kan jo mulig er nok så lag fem hundre kontor det har komme eit ordføraropprop det er heilt riktig,7627.7,7657.6,29.900000000000546,2019-12-13,2019-12-13_proceedings.txt
Stortinget-20191213-085502_7657600_7684600,vi skal alltid lytte når lokaldemokratiets valgte eee ønsker å gjøre endringer og ønsker å påvirke eee stortinget jeg mener at det her er en god reform så ser det også at førtifire prosent av dem ordførerne som har signert har jo allerede slått sammen sine kontor med en eller flere nabo nabokommuner også senterpartiets egen vararepresentant i fra mitt fylke geir inge lien har hun signert på oppropet samtidig som at han har felles skatteoppr,vi skal alltid lytte når lokaldemokratiets valde eee ønsker å gjera endringar og ønsker å påverke eee stortinget eg med at det her er ein god reform så skjer det også at førtifire prosent av dei ordførane som har signert har jo allereie slått saman sine kontor med ein eller fleire nabo nabokommunar også senterpartiets eigen vararepresentant ifrå mitt fy fylke geir inge lien har jo signert på oppropet samtidig som at han har felles skatteoppr,7657.6,7684.6,27.0,2019-12-13,2019-12-13_proceedings.txt
Stortinget-20191213-085502_7684800_7712400,og når dem og nå og når senterpartiet kjem inn på danmark det er stor forskjell på den her reformen og hvordan utgangspunktet var for den her reformens jei gjennomføring d eee med danmark kontra norge i norge så har vi som utgangspunkt det samme systemet brukes av skatteetaten og dem kommunale eee skatteoppkreverne derfor så er det faktisk bare en effektivisering å slå sammen at man bruker det samme systemet så utgangspunktnoe heilt heilt anna,og når en og når når senterpartiet kjem inn på danmark det er stor forskjell på den her reforma og kva utgangspunktet var for den her reformas gje gjennomføring d eee med danmark kontra noreg i noreg så har vi som utgangspunkt det same systemet brukast av skattetaten og den kommunale skatteoppkrevjarane derfor så er det faktisk berre ein effektivisering å slå saman at ein bruka det same systemet som utgangspunktnok heilt heilt anna,7684.8,7712.4,27.599999999999454,2019-12-13,2019-12-13_proceedings.txt
Stortinget-20191213-085502_7712400_7733400,men min utfordring står eee fortsatt hvorfor vil ikke senterpartiet etablere flere kontor legge inn penger i sine statsbudsjetter på det nå blir det statliggjort nå kan man vedta det på stortinget at man skal ha flere kontor i kongerike norge til slutt president en stemmeforklaring og en rettelse i innstillinga regjeringspartia vil ikke støtte noen av dem fors da dem løse for her i salen,men min utfordring står fortsatt kvorfor vil ikkje senterpartiet etablere fleire kontor legge inn pengar i sine statsbudsjett på det nå blir det statleg jor og kan ein vedta det på stortinget at me skal ha fleire kontor i kongerike noreg er skyld president ein stemmefløring og ein rettelse i innstillinga regjeringspartia vil ikkje støtte ein mån av den fors av dei lause for her i salen,7712.4,7733.4,21.0,2019-12-13,2019-12-13_proceedings.txt
Stortinget-20191213-085502_7733400_7761800,det som måtte være om spørsmål omkring ansattes arbeidshverdag i denne nye arbeidsgiveren så er jeg sikker på at eee regjeringa vil diskutere det her med dem ansattes organisasjoner og jeg er trygg på at skatteetaten også vil strekke seg langt for å ivareta eee dyktige ansattes behov i en sånn omstillingsprosess og så er det også en en rettelse eee og det er da i avgiftsvedtaket for engangsavgift paragraf to avgiftsgruppe g,det som måtte vera om spørsmål omkring eee ansattes arbeidsfarlag i dei nye arbeidsgivaren så er eg sikker på at eee regjeringa vil diskutere det her med dei ansatte organisasjonar og er trygg på at skattetaten også vil strekke seg langt for å ivareta eee dyktige ansattes behov i ein sånn omstillingsprosess og så har det også ein ein rettelse eee og det da i avgiftsvedtaket for eingongsavgift paragraf to avgiftsgruppe g,7733.4,7761.8,28.400000000000546,2019-12-13,2019-12-13_proceedings.txt
Stortinget-20191213-085502_7761800_7779500,eee så skal altså motoreffekt være angitt i kilowatt og ikke i kilogram eee og slagvolum skal altså da være kubikk sentimeter og ikke i kilo takk takk for den oppklaringa da er neste taler eee tryde brosvik,eee så skal altså motoreffekt vera angitt i kilovatt og ikkje i kilogram eee og slagvolum skal altså da vere kubis sentimeter og ikkje i kilo takk takk for den oppklaringa da er neste talar trude brosvik,7761.8,7779.5,17.699999999999818,2019-12-13,2019-12-13_proceedings.txt
Stortinget-20191213-085502_7790900_7812200,president det en del jeg ikke forstår blant anna påstanden om at krf er med i en kuttkonkurranse eee det var og en feil som ble sagt at det er hundre millioner kut vestland,brosvik president det er ein del eg ikkje forstår blant anna påstanden om at krf er med i ein kuttkonkurranse eee det var og ein feil som blir sagt at det er hundre millionar kut vestland,7790.9,7812.2,21.300000000000182,2019-12-13,2019-12-13_proceedings.txt
Stortinget-20191213-085502_7812200_7836500,eee det er hundre millioner kutt til hordaland og så er nei pluss til hordaland og så er det hundre millioner kutt til sognogfjordane så det går ut i null men president eee det som virkelig er utfordrende det er det som går på klima det er den største saka som vi må ha større opmerksom på og det som ville være nyttig for klimaet,eee det er hundre millionar kutt til hordaland og så er nei pluss til hordaland og så er det hundre millionar kutt til sogn og fjordane så det går ut i null men president eee det som verkeleg er utfordrande det er det som går på klima det er den største saka som vi må ha større merksem på og dette ville vore nyttig for klima,7812.2,7836.5,24.300000000000182,2019-12-13,2019-12-13_proceedings.txt
Stortinget-20191213-085502_7836500_7866500,det var om en i fra denne sal fikk på plass gode ordninger som tok bort den store økonomiske risikoen som ligger i å være først med for eksempel kollektivanbud som krever nullutslipp og der er vestland i første rekke både på ferje og hurtig båter regjeringa har i budsjettet en god merknad om dette og det er viktig at den blir fulgt raskt opp både for fylka si skull,det var om ein i frå denne sal fekk på plass gode ordningar som tok bort den store økonomiske risikoen som ligg i å vere først med for eksempel kollektivanbod som krev nullutslepp og der er vestland i første rekke både på ferje og hurtigbåtar regjeringa har i budsjettet ein god merknad om dette og det er viktig at den blir følgt raskt opp både for fylka si skuld,7836.5,7866.5,30.0,2019-12-13,2019-12-13_proceedings.txt
Stortinget-20191213-085502_7866500_7874800,men mest for klimaet takk da er neste taler statsr,men mest for klima takk da er neste talar statsr,7866.5,7874.8,8.300000000000182,2019-12-13,2019-12-13_proceedings.txt
Stortinget-20191213-085502_7882900_7910200,statsråd jensen president jeg trodde egentlig at eee debatten om skatteoppkreverne skulle komme i neste saken men eee det ser ut som vi tar det nå og derfor så vil jeg bare si noen få ord om den eee det har jo vært mange påstander eee fra denne talerstolen i løpet av debatten og mange av de er regelrett gale president mener påstanden er jo at man hele tiden henviser til eee danmarkelt umulig,statsråd jensen president eg trudde eigentleg at eee debatten om skatteoppgjeverane skulle komme inn i neste saka men eee det ser ut som vi tar nå og derfor så vil eg berre seie nokon få ord om eee den eee det har jo vore eee mange påstander frå denne talarstolen i løpet av debatten om mange og det er regelrett gale president den eine påstanden er jo at ein heile tida henviser til danmarkhelt umulig,7882.9,7910.2,27.300000000000182,2019-12-13,2019-12-13_proceedings.txt
Stortinget-20191213-085502_7910200_7937700,eee å ha en relevant sammenligning med danmark eee qqq hovedårsaken til at danmark fikk problemer med sin omlegging var at de arvet og driftet en lang rekke kommunale innkrevingssystemer og som de eee har og de har også hatt problemer med å utvikle et nytt fellessystem i norge har vi det det er altså et system som brukes og er utviklet av skatteetaten så da er på en måte den eeenikasjonen oppklarte,eee å ha ein relevant samanlikning med danmark eee d hovudårsaken til at danmark fekk problemet med sin omlegging var at dei i arve og drifte et ein lang rekke kommunale innkrevingssystemer og som det eee har og dei har også hatt problemet med å utvikle eit nytt fellessystem i noreg har vi det altså eit system som eee brukast og er utvikla av skattetaten så da er for men otte den eeenikasjonen oppklart,7910.2,7937.7,27.5,2019-12-13,2019-12-13_proceedings.txt
Stortinget-20191213-085502_7937700_7964800,så er altså dette en reform som i all hovedsak har som hensikt å styrke eee kampen mot arbeidslivskriminalitet svart økonomi styrke rettssikkerheten og legge til rette for større grad av likebehandling jeg hører senterpartiet prøver å skape et inntrykk av at denne fleksibiliteten som man har blir borte eee ved at man overfører skatteoppkrevingen til skatteetaten det er altså feil man vil ha akkurat det sae være noen forskjell,så er altså dette ein reform som i all hovudsak har som hensikt å styrke eee kampen mot arbeidslivskriminalitet svart økonomi og styrke rettssikkerheten og legge til rette for større grad av likebehandling eg høyrer senterpartiet prøver å skape eit inntrykk av at denne fleksibiliteten som ein har eee blir borte eee ved at ein eee overfører skatteoppkrevjinga til skatteetaten det er altså feil ein vil ha akkurat det sa ver nokon for seg,7937.7,7964.8,27.100000000000364,2019-12-13,2019-12-13_proceedings.txt
Stortinget-20191213-085502_7964800_7991600,men man vil legge til rette for større grad av likebehandling for skatteyterne og det mener jeg er et sunt prinsipp det bør i hvert fall ikke være sånn president at noen får mer fleksible løsninger fordi de kjenner skatteoppgreveren det synes å være senterpartiets tilnærming dette og det er jeg imot jeg mener at skatteyterne har krav på den samme rettssikkerheten uansett hvor i landet de befinner seg og så sa senterpartiets leder veldig opptatt age,men ein vil legge til rette for større grad av likebehandling for skatteyterne og det meiner eg er eit sunt prinsipp det bør i kvart fall ikkje vere sånn president at nokon får meir fleksible løysingar fordi dei kjenner skatteoppkrevedet synest å vere senterpartiet stil nemne dette og det er imot eg meiner at skatteytarane har krav om den same rettssikkerheita uansett var i landet dei befinner seg og så sa senterpartiets lee veldig opptatt age,7964.8,7991.6,26.800000000000182,2019-12-13,2019-12-13_proceedings.txt
Stortinget-20191213-085502_7991600_8021600,men stanger har altså ikke egen skatteoppkrever president de har interkommunalt samarbeid med hamar og det har de hatt siden tjuetolv denne eee skatteetaten skal altså nå fortsatt være på hamar men hamarkontoret blir altså styrket med fem årsverk som følge av denne omleggingen og det betyr jo i realiteten at man styrker den ordningen som eee trygve slagsvold vedum sto og hyllet fra denne talerstolen og det syns jeg kan være greit å merke seg så er det da denne såkalte,men stange har altså ikkje eigen skatteoppkreve president vi har interkommunalt samarbeid med hamar og det har dei hatt sidan tjuetolv denne eee skatteetaten skal altså må fortsett vere på hamar men hamarkontoret blir altså styrket med fem årsverk som følge av denne omlegginga og det betyr jo i realiteten at ein styrker den ordninga som eee tryggve statsråd vedum sto og hylle frå denne talarstolen og det synest eg kan vere greitt å merke seg så er det da denne såkate,7991.6,8021.6,30.0,2019-12-13,2019-12-13_proceedings.txt
Stortinget-20191213-085502_8021600_8042800,massive sentraliseringen som senterpartiet snakker om vel jeg hadde altså et replikkordskifte med representanten gjelsvik under finansdebatten syvogtyvende november da var gjelsvik veldig opptatt av at man skulle gjøre eee effektiviseringer bruke eee kutt i konsulenter og så videre og da spurte jeg representanten eee om eee han trodde det var sånn are kunne tas i oslo,massive sentraliseringa som senterpartiet snakkar om velja hadde altså eit replikkordskifte med representanten gjelsvik under finansdebatten syvotuvende november da var e gjelsvik veldig opptatt av at ein skulle gjere eee effektiviseringar bruke kuttkonsulentar og så vidare og da spruta eg representanten eee om eee han trudde det var sånn arre kunne tast i oslo,8021.6,8042.8,21.199999999999818,2019-12-13,2019-12-13_proceedings.txt
Stortinget-20191213-085502_8042800_8069700,og da sa representanten gjelsvik og jeg skal sitere han ja det er fornuftig å redusere byråkrati uansett hvor det er i norge slik at vi kan frigjøre penger for å styrke andre tjenester det mente han syvogtyvende november nå går han til kamp mot det å frigjøre ressurser som kan brukes på å styrke politiet barnehagene andre viktige tjenester jeg synes president dette er rde støtte den,og da sa representanten gjelsvik og eg skal sitere han ja det er fornuftig å redusere byråkrati uansett vor det er i noreg slik at vi kan frigjøre penger for å styrke andre tenester det meinte han suv og tuende november nå går han til kamp mot det å frigjere ressursar som kan brukast på å styrke politiet barnehagen andre viktige tenester i ei synest president dette er urde støtte den,8042.8,8069.7,26.899999999999636,2019-12-13,2019-12-13_proceedings.txt
Stortinget-20191213-085502_8069700_8097200,neste taler er trygve slagsvold vedum vedum president erfaringen med mange av reformene til dagens regjering er at det har blitt solgt inn som noe og virkeligheten er blitt noe annet det tydeligste eksempelet er jo den såkalte nærpolitireformen og når du leser den store eee faglige boka som politihøgskolen hart om politireformen så,neste talar er trygve slagsvold vedum president erfaringa med mange av reforma i dagens regjering er at det ha blitt selde inn som nokon og vikegata er blitt no ana det tydelegaste eksempel er jo den såkalte nærpolitireformen og når du les den store eee faglege boka som politiskolen hart om politireforma så,8069.7,8097.2,27.5,2019-12-13,2019-12-13_proceedings.txt
Stortinget-20191213-085502_8097200_8125800,det er jo en av hovedkonklusjonene er tiden sentralisering av norsk politi mens allikevel stor regjeringa kalte det her er en nærpolitireform mens det var sentralisering og byråkratisering regionreformen har kjempedyr byråkratiserende kostbart vart solgt inn som skulle være effektivisering så når du begynner å se på de ulike reformene som regjeringen har gjennomført så har det ikke vært avbyråkratiserende det har ikke vært kostnadsbesparende det har vært byråkratiserende men regjeringen har så blind tro på at hvis det bare gjennomføres sentraliserende grep,eg ein av hovudkonklusjonane tidenes sentralisering av norsk politi men så likevel så stor regjeringa valde det her er ei nærportreform mens det var sentralisering og byråkratisering regionreforma har kjempe dyrt byråkratisere kostbart vart soting som skulle vere effektivisering så når du mennes ser på dei ulike reforma som regjeringa har gjennomført så har det ikkje vore avbyråkratiserande det hakka vore kostnadsbesparande har vore byråkratiserande men regjeringa har så blind tru på at viss de bare gjennomføre sit sentraliserande grep,8097.2,8125.8,28.600000000000364,2019-12-13,2019-12-13_proceedings.txt
Stortinget-20191213-085502_8125800_8154300,så kommer gevinster ut der er det lite faglig belegg for og når vi har vært så tydelig i diskusjonen om kommunal skatteoppkreving så er det fortsatt vi mener at hele kommunen løse denne oppgaven på en veldig god måte det viser statistikken at de har veldig høy innkrevingsgrad høyere enn en statlig og de sikkert i statlig er dårlig men si at de kommunale har vært svært svært gode så mener vi denne burde vært en styrke at man kjenner lokale forhold selvfølgelig vet jeg utmerket godt at eee skatteinnkrevinga på hamar er en del av et felles skattekontor,så kommer gevinster ut på det lite fagleg belegg for og når vi har vore så tydeleg i diskusjonen om kommunal skatteoppgreving så ærerikt vi meiner at kommunar løs er nokon på en veldig god måte det viser statistikken at det har veldig høg innkrevingsgrad høgre enn den statleg dei sikkert stadar er dårleg men sier kommunal har vore svært svært gode så meiner vis denne burde vore ein styrke at ein kjenner lokale forhold så følger et eg ut godt at eee skattekrina på hamar er ein del av eit felles skattekontor,8125.8,8154.3,28.5,2019-12-13,2019-12-13_proceedings.txt
Stortinget-20191213-085502_8154300_8183400,eee med nabokommunene fordi kommunene har funnet at det er en god samarbeidsløsning i mitt område gode lokale bette og du kan da snakke direkte og det er lett å få kontakt med med den de ulike saksbhandlerere på det lokale skattekontoret for mitt område og så ser vi det var på et lokalt skattekontor på koppang eee her for to uker siden de har skattekontor for midtøsterland kommune der er det fire stykker som jobber som driver med skatteinnkrever for ko storadalen og nabokommunene en god løsning,eee med navekommune fordi kommunen har funnet at det er ein god samarbeidsløysing i mitt område eee gode lokale bete og du kan da snakke med direkte o de er lett å få kontakt med med den dei ulike saksforein på det lokale skattekontoret for mitt område og så ser vi det var vår eit lokalt skattekontor på koppang eee her eee for de to veker sidan der skattekontoret for eee midtsiden kommune der er det fire stykke som jobbar som driv me skattekr for ko e storedalen og navokommunane ein god løysing,8154.3,8183.4,29.099999999999454,2019-12-13,2019-12-13_proceedings.txt
Stortinget-20191213-085502_8183400_8213299,og det som nå skjer når eee det kontoret skal legges ned med det grepet som regjeringa gjør er at de skal få kontorsted enten på hamar eller kongsvinger det er tolv mil eller nitten mils kjøring daglig pendling selvfølgelig i praksis nesten helt umulig å gjennomføre og det skaper sentralisering av arbeidsplasser og det er jeg bekymra for og du får eee en skatteoppkreving som kjenner dårligere til lokale forhold og det er det det her handler om hvis du bare gå konkret og se hvordan det slår ut og så skal vi velge også legge gosia litt til på slutten fordi jeg hørte det vetlevang solheim sa om,og det som nå skjer når eee det kontoret skal leggast ned med det grepet som regjeringa gjer er at dei skal få kontor fleir enten på hava eller kongsvinger det er tolv mil eller i nitten milskøyring daglivending så eg føler det i praksis nesten heilt umulig å å gjennomføre og det skaper sentralisering av vertplassar og deter eg bekymra for og det for ein skatteopkrevjaren kjenner dårleg til lokale forhold og det er det det handlar om vise berre gå konkret og så var det det slår ut og så skal eg velge og så ligg godsida litt til på slutten fordi har høyrte det vetle wang soleim sa om eee,8183.4,8213.299,29.89900000000125,2019-12-13,2019-12-13_proceedings.txt
Stortinget-20191213-085502_8213299_8238900,arbeidstakere i skatteetaten før til sjuende og sist så handler politikk alltid om folk og og jeg har vært veldig bra hvis regjeringspartiene og regjeringa kunne se på om man kan gjøre lokale tilpasninger som gjør at noen av de som får størst utslag for et arbeidssted kunne beholde kontorsted hvert fall en overgang for den refo de har jo ikke kommet i gang med det konkrete arbeidet overfor mange av de og klart at det er noen som kanskje kan få sånn tolv tjue mils avstand da blir det veldig krevende,arbeidstakar i skatteetaten førtisju og sist så handlar politikk alltid om folk og eee og de vore veldig bra viss regjeringspartia og regjeringa kunne se på om ein kun gjere lokale tilpassingar som gjer at nokon av dei som får størst utslag for eit arbeidstad kunne behalde kontorstad kvart fall ein overgang for den få dei har ikkje kome til gang med det konkrete arbeidet då for mange av dei og kvart at det er nokon som kanskje kan få sånn to tjue mils avstand da blir det veldig krevjande,8213.299,8238.9,25.60099999999875,2019-12-13,2019-12-13_proceedings.txt
Stortinget-20191213-085502_8238900_8263400,og derfor så ønsker jeg å gjøre det som vi har som eee forslag nummer fire til et oversendelsesforslag som gjør at ikke det kan brukes motsatt vei i den videre behandlinga og jeg håper at det det lå en reell åpning nå i det soleim sa da har ingen flere bedt om ordet og debatten i sakene en og to er dermed avslutta sak tre innstilling fra finanskomiteen om bevilgninger på statsbudsjettet for tjuetjue,og derfor så ønsker å gjere det som vi har som forslag nummer fire til eit overstegsforslag som jer at ikke det kan brukast motsett veg i den vidare behandlinga eg håpar at det låg ein regel opning i det solheim sade har ingen fleire bedt om ordet og debatten i sakene er nato er dermed avslutta sak tre innstilling frå finanskomiteen om bevilgninga på statsbudsjettet for tjuetjue,8238.9,8263.4,24.5,2019-12-13,2019-12-13_proceedings.txt
Stortinget-20191213-085502_8263400_8291600,vedrørende rammeområde nitten tilfeldige utgifter og inntekter rammeområde tjues stortinget finansadministrasjon med videre rammeområde tjueto utbytte med videre samt garantier under finansdepartementet statsbudsjettets nitti poster statslån og kapitlene som gjelder overføring til og fra statens pensjonsfond pensjonsfond utland innstilling fem s tjuenitten tjuetjue jamfør proposisjon en s tjuenitten tjuetjue og proposisjon en s tillegg to tjuenitten tjuetjue,vedrørende rammeområde nitten tilfellige utgifter og inntekter rammeområde tjue stortinget finansadmininistrasjon med vidare i rammeområde tjueto utbyte med vidare samt garantia under finansdepartementet statsbudsjettet nitti postar statslån kapitlan som gjeld overføring til å frå statens pensjonsfond pensjonsfond utland innstilling fems tjuenitten tjuetjue jamfør proposisjon ens tjuenitten tjuetjue og proposisjon ens tillegg to tjuenitten tjuetjue,8263.4,8291.6,28.200000000000728,2019-12-13,2019-12-13_proceedings.txt
