file,text_bm,text_nn,start,end,duration,date,proceedingsfile
Stortinget-20191213-085502_10770700_10799800,og lovforslaget som er til behandling om handler nettopp om det innledningsvis vil jeg knytte noen kommentarer til påstanden om at lovforslaget svekker pasient og brukerrettighetene alle pasienter kan i dag klage til fylkesmannen hvis de mener at de ikke får forsvarlig helsehjelp i spesialisthelsetjenesten dersom en pasient har krav på nødvendig helsehjelp skal helsepersonell gjøre en individuell vurdering av helsehjelp,og lovforslaget som er til behandling om eee handlar nettopp om det innledningsvis så vil eg knytta nokon kommentar til påstanden om at lovforsvaget svekker pasientar å bruke rettighetene alle pasientar kan i dag klage til fylkesmannen viss dei meiner at dei ikkje får forsvarleg helsehjelp i spesialisthelsetenesta dersom ein pasient har krav på nødvendig helsehjelp skal helsepersonell gjera ein individuell vurdering av helsehjelp,10770.7,10799.8,29.099999999998545,2019-12-13,2019-12-13_proceedings.txt
Stortinget-20191213-085502_10799800_10828600,dette endres ikke med lovforslaget systemet for nye metoder må forholde seg til retten til nødvendige spesialisthelsetjenester og systemet kan derfor ikke si nei til metoder som innebærer at pasienter uten av innføring av metoden vil få et uforsvarlig tilbud jeg har registrert at flere hevder at lovforslaget handler om å lovfeste og sementere dagens system for nye metoder,dette endrast ikkje med lovforslaget systemet for nye metodar må forholde seg til retten til nødvendige spesialisthelseteneste og systemet kan derfor ikkje seie nei til metodar som inneber at pasientar utan av innføring av metoden vil få eit uforsvarleg tilbodeg har registrert at fleire hevdar at lovforslaget handlar om å lovfeste og sementera dagens system for nye metodar,10799.8,10828.6,28.80000000000109,2019-12-13,2019-12-13_proceedings.txt
Stortinget-20191213-085502_10828600_10857500,det er ikke riktig lovforslaget handler om å lovfeste at de regionale helseforetakene skal sørge for et felles system som tar stilling til hvilke metoder som skal tilbys i spesialisthelsetjenesten lovbestemmelsen angir ikke hvordan et sånt system skal være innretta bare at regionene skal ha et felles system denne løsningen sikrer muligheten til å videreutvikle og forbedre dagens system,det er ikkje riktig lovforslaget handlar om å lovfaste at dei regionale helseføretaka skal sørge for eit felles system som tar stilling til kva metodar som skal tilbys i spesialisthelsetjenesten lovbestemmelsen angir ikkje korleis eit sånt system skal vere innretta berre at regionen skal ha eit felles system denne løysinga sikrar muligheten til å vidareutvikle og forbetre dagens system,10828.6,10857.5,28.899999999999636,2019-12-13,2019-12-13_proceedings.txt
Stortinget-20191213-085502_10857500_10884700,lovforslaget inneholder derfor ikke regul eee regulering av verken beslutningsforum bestillerforum eller detaljer rundt metodevurderinger og så videre det betyr at når stortinget i dag vedtar at ordningen skal evalueres så vil den evaluering være veldig nyttig i nettopp å se på behov for endringer og justeringer på de forhold og ingen av de endringene i justeringen vil være hindra av det lovforslos i dag,lovforslaget innehalder derfor ikkje regu eee reguleringa verken beslutningsforum bestillar forum eller detaljar rundt metodvurderingar og så vidare det betyr at når stortinget i dag vedtar at ordninga skal evaluerast så vil den evaluveringa vere veldig nyttig i nettopp og ser på behov for endringar og justeringar på deforhold og ingen av dei endringane i justeringane vil vere hindra av det lovforslos i dag,10857.5,10884.7,27.200000000000728,2019-12-13,2019-12-13_proceedings.txt
Stortinget-20191213-085502_10884700_10913700,jeg merker meg at flertallet i komiteen ber regjeringen om å sørge for en evaluering og det er selvfølgelig noe som er kommet til å følge opp dagens system for nye metoder kan videreutvikles og forbedres på enkelte områder er det har betydelige utviklingspotensial spesielt med tanke på persontilpassa medisin så er jeg svært opptatt av å videreutvikle og forbedre systemet for å håndtere den utviklingen og en evaluering som nå blir bedt om i år,eg merkar meg at fleirtalet i komiteen ber regjeringa om å sørge for ein evaluering av det eee som følgeleg nokon som er komme til å følge opp dagens system for nye metodar kan vidare utviklast og forbedrast på enkelte omar er det betydelege utviklingspotensial spesielt med tanke på persontilpassa medisin så er eg svært opptatt av å bidervikle og forbetre systemet for å handtere den utviklinga og ein evaluering som en no blir bedt om i gjord,10884.7,10913.7,29.0,2019-12-13,2019-12-13_proceedings.txt
Stortinget-20191213-085502_10913700_10943300,vil nettopp gi kunnskap og informasjon om hvordan systemet best kan tilpasses denne utviklingen jeg registrerer at mindretallet ønsker en evaluering før en eventuell lovfesting og jeg mener at det er ikke noe grunn til å avvente evalueringen som sagt fordi jeg mener at lovforslaget vil bidra til å skape et godt rettferdig og likeverdig fordelt helsetilbud inn forbi de ressursene vi har tilgjengelig dersom vi avvente eller ikke vedta disse lovforslagene,vil nettopp gi kunnskap og informasjon om korleis systemet best kan tilpasses denne utviklinga eg registrerer at mindretalet ønsker ein evaluering før ein eventuell lovfesting og eg meiner at det er ikkje nokon grunn til å avvente evalueringa som sagt fordi eg meiner at lovforslaget vil bidra til å skapa eit godt rettferdig og likeverdig fordelt helsetilbod inn for bygdi ressursane me har tilgjengeleg dersom me avventer eller ikkje vedta desse lovforslaga,10913.7,10943.3,29.599999999998545,2019-12-13,2019-12-13_proceedings.txt
Stortinget-20191213-085502_10943300_10972800,jeg er bekymra for at vi vil gå i motsatt retning det blir større forskjeller mer uforutsigbarhet og mindre rettferdige helsetjenester jeg mener det er avgjørende at vi har et felles system mellom helseregionene som er tydelige på hvor ansvar for å fatte disse beslutningene ligger den som har ansvar for tjenesten å sikre faglig forsvarlig te tjenestetilbud må og ha ansvar for finansieringen og foreta nettopp prioriteringen i forbi de rammene som det er stortinget sitt ansvar å vedta,eg bekymra for at ein vil gå i motsett retning det blir større forskjellar meir uforutsigbarhet og mindre rettferdige helsetenester eg meiner det er avgjerande at me har eit felles system mellom helseregionane som er tydeleg på kor ansvaret for å fatta desse beslutningane ligg den som har ansvar for tenesten og sikre fagleg forsvar i te tenestebod må og ha ansvar for finansieringa og foreta nettopp prioriteringane for bidi rane som det er stortinget sitt ansvar å vedta,10943.3,10972.8,29.5,2019-12-13,2019-12-13_proceedings.txt
Stortinget-20191213-085502_10972800_11001500,alle andre alternativer som helt eller delvis skillet mellom den som har ansvar for tjenesten og den som skal betale for tjenesten vil være dårligere alternativer enn dagens organisering ingen av disse løsningene vil kunne være bærekraftig på sikt og ingen av de løsningene vil heller kunne ivareta de prinsippene for prioritering som stortinget tidligere slutta seg til dette kan i sin tur innebære at framtidig helsetjeneste hvis en går inn på den,alle andre alternativ som heilt eller delvis skiljer mellom den som har ansvar for tenesten og den som skal betale for tenesten vil vere dårlege alternativa enn dagens organisering ingen av desse løysingane vil kunne vere berekraftig på sikt og ingen av dei løysingane vil heller kunna ivareta dei prinsippa for prioritering som stortinget tidlegare slutta seg til dette kan i sin tur innebere at framtidige helsetjenester viss ein går inn på den,10972.8,11001.5,28.700000000000728,2019-12-13,2019-12-13_proceedings.txt
Stortinget-20191213-085502_11001500_11030600,retningen vil bli dårligere og true og rettferdigheten i dagens system president for å sikre likeverdig tilgang til spesialisthelsetjenester har stortinget slått fast at helseregionen skal innrette sitt tjenestetilbud i tråd med prinsippene for prioritering dette lovforslaget handler i stor grad om hvordan man skal operasjonalisere dette arbeidet inn forbi de prinsippene som stortinget tidligere har vedtatt de vanskelige problemstillingene,retningen vil bli dårlegare og trua og rettferdigheten i dagens system president for å sikre likeverdig tilgang til spesialist jølvstenester har stortinget slått fast at helseregionen skal innrette sitt tenestilbod i tråd med prinsippa for prioritering dette lovforslaget handlar i stor grad om korleis ein skal operasjonalisera dette arbeidet innan forbi di prinsippa som stortinget tidlegare har vedtatt dei vanskelege problemstillingane,11001.5,11030.6,29.100000000000364,2019-12-13,2019-12-13_proceedings.txt
Stortinget-20191213-085502_11030600_11051000,og beslutningene de forsvinner ikke men det vil bli vanskeligere å oppfylle stortingets vedtatte prinsipper om det ikke gis støtte til de som faktisk skal stå i disse beslutningene daglig og dette lovforslaget gir nettopp en slik støtteda er da klart for replikkordskifte første replikant,og beslutninga dei forsvinn ikkje men det vil bli vanskelegar å oppfylle stortingets vedtatte prinsippa om det ikkje gir støtte til dei som faktisk skal stå i desse beslutningane dagleg og dette lovforslaget gir nettopp ein slik støttedå er det klart for replikkordskifte fyrste replikant,11030.6,11051.0,20.399999999999636,2019-12-13,2019-12-13_proceedings.txt
Stortinget-20191213-085502_11054800_11083900,hagebakken president eee pasient og organisasjonene og flere elleve totalt de elleve som har uttalt seg om denne saken i tillegg til det regionale helseforetaka eee kjem med massiv motstand om at vedtaket skal gjøres nå og jeg dette er organisasjoner som er jo nettopp opptatt av rettferdighet og det som eee som statsråden eee prater om men en vil altså ha en evaluering først,hagebakken president eee pasient og organisasjonene og fleire elleve totalt dei elleve som har uttalt seg om denne saka i tillegg til dei regionale helseføretaka eee kjem massiv motstand om at vedtaket skal gjerast no og i har dette orsasjonar som er ein etappe opptatt av rettferdigheten og det som eee som statsråden eee pratar om men ein vil altså ha ein evaluering først,11054.8,11083.9,29.100000000000364,2019-12-13,2019-12-13_proceedings.txt
Stortinget-20191213-085502_11083900_11111200,eee og hvorfor velger statsråden å sette de disse organisasjonene synspunkter helt til side og kjøre dette fram i det tempoet som eee her gjøres statsråd høiepresident for det første så vil jeg understreke at denne saken ikke kjørt fram i noe høyt tempo tvert imot en har brukt god tid både i departementet men jeg registrerer og at stortinget og komiteen har brukt lenger enn tiken enn det som er vanlig,eee og vor for vel statsråden å setta de eee desse organisasjonane synspunkter heilt a side og køyre dette fram i det tempo som eee her gerastatsråd høpresident for det første så vil eg undersea at denne saka ikkje kjøyr fram i noko høgt tempo tvert imot ein har brukt god tid både i departementet men eg registrerer og at stortinget og komiteen har brukt lengre tika enn det som er vanleg,11083.9,11111.2,27.30000000000109,2019-12-13,2019-12-13_proceedings.txt
Stortinget-20191213-085502_11111200_11138400,jeg er på tilsvarende saker og gått grundig inn i saken så er det sånt at jeg opplever at både i vår høringsrunden og i komiteen sin høring så er det ikke sånn at eee mye av innvendingene som kommer handler om selve prinsippet som ligger til grunn for at man må ha et felles system for å ta disse beslutningene det handler veldig mye om hvordan dagens system er organisert og de utfordringene som damøte framover,eee på tilsvørande saker og gått grundig inn i saka så er det sånt at eg opplever at både i vår høyringsrundten og i komiteens sinn høyring så er det ikkje sånt at mye av innvendingane som kommer handlar om sjølve prinsippet som ligg til grunn for at me må ha eit felles system for å ta desse beslutningane det handlar veldig mykje om korleis dagens system er organisert og dei utfordringane som damøta framover,11111.2,11138.4,27.19999999999891,2019-12-13,2019-12-13_proceedings.txt
Stortinget-20191213-085502_11138400_11166900,det blir i dag ikke lovregulert stortinget vedtar i dag en evaluering og det betyr at i det kontinuerlige forbedringsarbeidet av sjølve systemet så vil vi selvfølgelig da og bruke evalueringen nå jeg har flere ganger sagt at vi for eksempel har utfordringer med å gjøre eee bes eee sj dette systemet mer rusta til å møte utviklingen mot persontilpassa medisinke ja president eee vi i arbeiderparti synes det og er,det blir i dag ikkje lovregulert stortinget vedtar i dag ein evaluvering og det betyr at det kontinuerlege forbetringsarbeidet av sjølve systemet så vil me sjølvfølgeleg då og bruke evalueringa no eg har fleire gonger sagt at me for eksempel har utfordringar me går eee s eee s dette systemet meir rusta til å møte utviklinga mot persontilpassa medisin høgebakken ja president eee vi i arbeidarpartiet synest og er,11138.4,11166.9,28.5,2019-12-13,2019-12-13_proceedings.txt
Stortinget-20191213-085502_11166900_11189300,fornuftig å ha en evaluering før vi slår fast prinsippet nå sjøl om eee sjøl om det er riktig mye av det høye sier i i så måte det synes vi er en viktig kvalitetssikring men eee det er jo ikke noe flertall i stortinget for å fjerne beslutningsforum og da spør jeg igjen hvorfor har ikke regjeringa tid til å vente på evalueringenstatsråd høie,fornuftig å ha ein evaluering før vi slår fast prinsipp sjøl om eee sjøl om det er riktig me å det høge sier i i så måte det synest vi her ein viktig kvalitetssikring men eee det er au eit nok fleirtal i stortinget for å fjerne beslutningsforum og da spør eg igjen korfor har ikkje regjeringa tid til å vente på hevaringa statsråd høie,11166.9,11189.3,22.399999999999636,2019-12-13,2019-12-13_proceedings.txt
Stortinget-20191213-085502_11189300_11215100,president fordi jeg oppfatter at evalueringen ikke vil handle om selve prinsippet som og representanten er inne på arbeiderpartiet er jo og enig i det der er ikke noen uenighet i stortinget om at vi har behov for å ha dette og det er viktig for de som gjør denne jobben at vi faktisk lovfester dette prinsippet og den oppfølgingen av den prioriteringsmeldingen som og stortinget har slutta seg til og når da innvendingene handler om forhold som ikke,president fordi eg oppfattar er at evalueringa ikkje vil handla om sjølve prinsippet som og representanten inne på arbeidarpartiet jo og einig i det da er ikkje nokon ueinigheit i stortinget om at me har behov for å ha dette og det er viktig for dei som gjer denne jobben at me faktisk lovfestar dette prinsippet og den oppfølginga av den prioriteringsmeldinga som og stortinget har slutta seg til og når då innvendingane handlar om forhold som ikkje,11189.3,11215.1,25.80000000000109,2019-12-13,2019-12-13_proceedings.txt
Stortinget-20191213-085502_11215100_11243100,eee i dag vil bli berørt av dette lovvedtaket så er det ingen grunn til å skyve på dette i tid eee dette er det behov for å få lovfestet hagebakkepresident når denne eee evalueringen gjennomføres og hvis det er noe i den som skulle tilsi eee at eee det bør bli større åpenhet i disse prosessene som vi og arbeiderpartiet har gått inn for eee vil statsråden da,eee i dag vil bli berørt av eee dette lovvedtaket så er det ingen grunn til å skyve på dette i tid eee dette er det behov for å få lovfestagebakken president nå er denne evalueringa gjennomførast og vis er no i den som skulle til seg eee at eee det bør bli større openheit i desse prosessane som vi i arbeidarpartiet har gått inn for eee vil statsråden da,11215.1,11243.1,28.0,2019-12-13,2019-12-13_proceedings.txt
Stortinget-20191213-085502_11243100_11272700,være villig til å sørge for at det blir større åpenhet i dag eee synes vi det er et demokratisk problem faktisk eee og det er krevende som helsepolitiker å heller ikke få innsyn i disse svært viktige prosesser for veldig mange høie president eee prinsippet for åpenhet eee gjelder eee på dette området dersom der er utfordringer er selvfølgelig knytta til eee priser eee og eee avtaler med industrien,vera villig til å sørge for at det blir større openheit i dag synest vi det er eit demokratisk problem faktisk eee og det krevjande som helsepolitikar i å heller ikke få innsyn i desse svært viktige prosessar for veldig mange statsråd høge president prinsippet for openheit gjeld eee på dette området der som det er utfordringar er selvfølgeleg knytta til eee prisar eee og eee avtalar med industrien,11243.1,11272.7,29.600000000000364,2019-12-13,2019-12-13_proceedings.txt
Stortinget-20191213-085502_11272700_11298000,eee der er det sånn at det må følg må selvfølgelig helseforetakene følge loven eee og det gjør de men jeg har og vært veldig tydelig på at eee hvis vi står om forbi et avveining mellom prinsippet om alltid åpenhet mot avveininger mot å måtte seie nei til nye metoder for pasienter fordi åpenhet vil kreve en så høy pris at vi ikke kan ta metoden i bruk så setter jeg pasienten først,eee der er det sånn at der må føl må selvfølgelig helsefordaka følge loven eee og det gjer dei men eg har og vore veldig tydeleg på at viss me står om forbi avveging mellom prinsippet om alltid openhet mot avhendinga mot å måtte seie nei til nye metodar for pasientar fordi openheit vil krevja ein så høg pris at me ikkje kan ta metoden i bruk så set eg pasienten først,11272.7,11298.0,25.299999999999272,2019-12-13,2019-12-13_proceedings.txt
Stortinget-20191213-085502_11298000_11325100,men jeg jobber internasjonalt og norge er et land som nå jobber veldig tungt internasjonalt sammen med andre land f og har batt eee støttespiller blant annet til en resolusjon om dette i verdens helseorganisasjon for å få til felles løsninger for å sikre mer åpenhet på dette området så det er det som vi jobber fordi dette det som representanten er rette og spør det kreve mer eee internasjonalt samarbeid neste replikant,men eg jobbar internasjonalt og noreg er eit land som nå jobber veldig tungt internasjonalt saman med andre land og har med støttespilar blant anna til ein resolusjon om dette i verdas helseorganisasjon for å få til felles løysingar for å sikre meir openheit på dette området så det er det som er jobb fordi dette det som representanten her etterspør det krev meir eee internasjonalt samarbeidneste replikant,11298.0,11325.1,27.100000000000364,2019-12-13,2019-12-13_proceedings.txt
Stortinget-20191213-085502_11333100_11356800,toppe takk eee takk president eee helseministeren har avfeiet tilbakemelding om at lovfesting vil hindre utvikling og tilgang til persontilpassa medisin eee i innstillinga så ble det vist et svar fra departementet om eee en bestilt utredning eee der de regionale helseforetakene peker på noen forutsetninger som må endres for det første at,toppetakk eee takk eee president eee helseministeren har av seg til bakemelding om at lovfesting vil hindra utvikling og tilgang til persontilpassa medisin eee i innstillinga så blei det vist til svar frå departementet om eee ein bestilt utredning eee der dei regionale helse fortakane peiker på nokon forutsetningar som må endrast for det første at eee,11333.1,11356.8,23.69999999999891,2019-12-13,2019-12-13_proceedings.txt
Stortinget-20191213-085502_11356800_11378300,metodene som eee bør at metodene bør innføres midlertidig før de har markedsføringstiltalelse eee og at anna type de dokumentasjon enn kliniske studier bør kunne brukes som effektdokumentasjon og for det andre at det bør tilrettelegges for midlertidig innføring av nye metodeluering over tid,metodane som eee bør at metodane bør innførast midlertidig før dei har marknadsføringstiltaelse eee og at anna type de dokumentasjon en kliniske studie bør kunne brukast som effekt dokumentasjon og for det andre at det bør til retteleggast for midlertidig innføring av nye metodaluering over tid,11356.8,11378.3,21.5,2019-12-13,2019-12-13_proceedings.txt
Stortinget-20191213-085502_11378300_11404300,i statsråden sitt svar så er han unnvikende på disse forutsetningene og jeg vil eee be om en om en eee om statsråden kan garantere for stortinget at disse forutsetningene snarest blir innfreddstatsråd høie president eee vi jobber hele veien nå med å forbedre eee systemet for både nye metoder for å tilpasse e,i statsråden sitt svar så er han eee unnvikande på desse forutsetningane og eg vil be om ein om ein eee om statsråden kan garantera for stortinget at desse forutsetningane snarast blir innfridd statsråd høiepresident me jobbar heile vegen no med å forbetra eee systemet for både nye metodar for å tilpasse,11378.3,11404.3,26.0,2019-12-13,2019-12-13_proceedings.txt
Stortinget-20191213-085502_11404300_11432200,og av forbedringer i helseregionene for å være bedre forberedt på dette området eee så og der er ingenting i dette lovvedtaket som gjøres i dag som vil eee hindre en sånn eee sånn utvikling der er ganske s mange eee forskjellige utfordringer som må løses for at eee vi skal være enda bedre forberedt og ta i bruk persontilpasse medisin eee når det gjelder det som representanten tar opp som handler veldig mye om hvilk type avtaler han inngår med,og vi har forbetringar i helseregionane for å vere betre forberedt på dette området eee så eee og det er ingenting i dette lovvedtaket som gjest i dag som vil eee hindra ein sånn eee sånn utvikling der er ganske s mangen eee forskjelleg utfordringar som må løysast for at me skal var endå betre forberedt og ta i bruk persontilpassemedesin eee når det gjeld det som representanten tav som handlar veldig mykje om kva type avtalar hein inngår med,11404.3,11432.2,27.900000000001455,2019-12-13,2019-12-13_proceedings.txt
Stortinget-20191213-085502_11432200_11456700,med industrien så er det noe som en hele vei må eee må vurdere hvilke typer avtaler er den eee skal inngå nettopp og for å sikre eee god tilgang og til person tilpassa medisin så må det veies opp mot at ikke en lar industrien få lov til å få fritt spillerom til å lage avtaler som undergraver mulighetene våre for å drive med prioritering og sammenligninger av metoder for eksempel toppe,med industrien så er det no som ein heilveg må eee må vurdera kva typar avtaler er det ein eee skal inngå nettopp og for å sikre eee eit god tilgang og til persontilpassa medisin så må det vera s opp mot at ikkje ein lar industrien få lov til å få fritt spelemåom til å laga avtalar som undergraver muligheten for oss for å drive med prioritering og samanlikningar av metodar for eksempeltoppe,11432.2,11456.7,24.5,2019-12-13,2019-12-13_proceedings.txt
Stortinget-20191213-085502_11456700_11472400,president ja takk eee i eee i høringen så var det jo eee unison kritikk eee mot eee eee systemet for nye metoder utenom helseforetakene sjøl som forsvarte det og det var og eee ingen som eee støtter det på hn i i komiteen,eee takk eee i i høyringa så var det jo eee unison kritikk eee mot eee eee systemet for nye metodar utan om helseføretaka sjøl som forsvarte det og det var og eee ingen som støtta det på ha i i komiteen,11456.7,11472.4,15.699999999998909,2019-12-13,2019-12-13_proceedings.txt
Stortinget-20191213-085502_11472400_11494600,eee og når hun leser proposisjonen så er det jo lite i proposisjonen eee som tyder på at regjeringen har forstått den store mistilliten det er mot systemet for nye metoder ute der som står ikke om kritikk så står det at på side femten i proposisjonen at kritikken kan på mange måter være et uttrykk for at vårt prioriteringssystem virker,eee og når du leser proposisjonen så er det jo lite i proposisjonen eee som tyder på at regjeringa har forstått den store mistilliten det er mot systemet for nye metodar ute det som står i om kritikk så står det at eee på side femten i proposisjonen at kritikken kan på mange måtar vera eit uttrykk for at vårt prioriteringssystem verkar,11472.4,11494.6,22.200000000000728,2019-12-13,2019-12-13_proceedings.txt
Stortinget-20191213-085502_11494600_11519000,eee og jeg eee må rett og slett spørre statsråden hvordan kan det gå an og ikke ha fått med seg eee at dette systemet har så sterke innvendinger mot seg ute og eee hvorfor eee i på det alle dager er det ikke gjort en evaluering før eee statsråden kommer denne saka til stortinget statsråd høie president eee,eee og eg må rette til eit spørje statsråden korleis kan det gå an og ikkje har fått med seg eee at dette systemet har så sterke innvendingar mot seg ute og eee korfor i på til alle dagar er det ikkje gjort ein evaluering før eee statsråden komme denne saka til stortinget statsråd høie president eee,11494.6,11519.0,24.399999999999636,2019-12-13,2019-12-13_proceedings.txt
