file,text_bm,text_nn,start,end,duration,date,proceedingsfile
Stortinget-20191213-085502_295300_319500,stortingets møte er eee lovlig satt representantene telle finger mørland trond helleland eirik sivertsen une bastholm og ole andre myhrvold som har vært permitterte har igjen tatt sete fra arbeiderpartiets stortingsgruppe foreligger to permisjonssøknader for representanten ingalill olsen om sykepermisjon i tiden fra og med sekstende desember og inntil videre og for representanten eirik sivertsen som om permisjon i dagene sekstende og syttende desember,stortingets møte er eee lovleg satt representantene telle finge møhland trond helleland eirik sivertsen une basso og ole andre myhrvold som har vore permiterte har igjen tatt sete frå arbeidarpartiet stortingsgruppe følge to permesjonsseknader for representanten inger lill olsen om sykepermisjon i tida fra med sekstende desember og inntil vidare og for representanten eirik sivertsen som om permisjon i dagene sekstende og syttende desember,295.3,319.5,24.19999999999999,2019-12-13,2019-12-13_proceedings.txt
Stortinget-20191213-085502_319500_345900,for i sin kapasitet som leder av delegasjonen for arktisk parlamentarisk samarbeid og delta på europarådets møte i rovanhjemmet i finland disse søknader foreslås behandlet straks og innvilget og det anses vedtatt vararepresentanten for finnmark steinar karlstrøm foreslås fortsatt innkalt for å møte tiden sekstende desember og inntil videre og vararepresentanten for nordland kjellidar juvik foreslås innkalt for å møte i dagene sekstende og syttende desember det,for i sin kapasitet som lever av delegasjonen for arktisk parlamentarisk samarbeid og delta på europarådets møte i rovanhjemi i finland disse søknader foreslås på andre straks og innvilget og det anses vedtatt vare representanten for finnmark stene kallstrøm foreslåt fortsatt innkalt frå møtet i tiden sekstande desember og inntil vidare og var representanten for nordland kjell idar juvik fortsatt sin kalt frå møtet i dagene seistende og syttande desember det,319.5,345.9,26.399999999999977,2019-12-13,2019-12-13_proceedings.txt
Stortinget-20191213-085502_345900_373000,til behandling foreligger de saker som er oppført på dagsorden nummer trettitre etter ønske fra finanskomiteen vil sakene en og to behandles under ett sak en innstilling fra finanskomiteen om skatter og avgifter og toll tjuetjue innstilling tre s tjuenitten tjuetjue jamfør prop en l s tjuenitten tjuetjue og prop en s tjuenitten tjuetjue sak to innstilling fra finanskomiteen om skatter og avgifter og toll tjuetjue lovsaker innstnitten tjuetjue,til behandling forlegger dei saker som er oppført på dagsouden nummer tretti tre etter ønske frå finanskomiteen vil sakne ein og to behandlast under eitt sak ein innstilling frå finanskomiteen om skatter og avgifter å tolv tjuetjue innstilling tre s tjuenitten tjuetjue jamfør propp ein lls tjuenitten tjuetjue og propp ein s tjuenitten tjuetjue sak to innstilling frå finanskomiteen om skatter og avgifter på tolv tjuetjue lovsaker innstnitten tjuetjue,345.9,373.0,27.100000000000023,2019-12-13,2019-12-13_proceedings.txt
Stortinget-20191213-085502_373000_402000,jamfør prop en s tjuenitten tjuetjue etter ønske fra komiteen vil presidenten ordne debatten slik fem minutter til hver partigruppe og fem minutter til medlemmer av regjeringen videre vil det innenfor den fordelte taletid bli gitt anledning til inntil fire replikker med svar etter innlegg fra partienes hovedtalere og seks replikker med svar etter innlegg fra medlemmer av regjeringen og de som måtte tegne seg på talerlisten utover den fordelte taletid får en taletid på inntil tre minutter første taler er vetle wang soleim som er eee sakenes ordfører,jamfør kropp ein tjuenitten tjuetjue etter ønske fra komiteen vil presidenten ordna debatten slik fem minutt til var partigruppe og fem minutter til medlemmer av regjeringa vidare vil dei innføre den fordelte taletida blir gitt anledning til inntil fire replikkar med svar etter innlegg frå partia hovudtalarar og seks replikker med svar etter innlegg frå medlemmar av regjeringa og dei som måtte ta inn seg på talerlisten utover den fordelte taletid får ein taletid på inntil tre minutt første talar er vetle wang solheim som er sakenes ordførar,373.0,402.0,29.0,2019-12-13,2019-12-13_proceedings.txt
Stortinget-20191213-085502_407400_431800,soleim takk eee for det president før jeg begynner med skattedebatten eee så vil jeg i dag fra denne denne talerstol rette oppmerksomheten til møre og romsdal og sundmøre der blir i dag krigshelt og veteran ragnar ulstein bisatt på statens bekostning med hans kongle heit krumprinson forsvarsministeren og forsvarssjefen til stede eller etter en takk til ragna rullestein,soleimtakk eee for det president for eg begynna med skattedebatten eee så vil eg i dag frå dei en denne talerstol rette oppmerksomheten til møre og romsdal og sunnmøre der blir i dag krigshelt og veteranen ragnar ullstein bisatt på statens bekostning med hans kongeleg heit krompinsen forsvarsministeren og forsvarssjefen til stede eg er lett ein takk til ranar ulstein,407.4,431.8,24.400000000000034,2019-12-13,2019-12-13_proceedings.txt
Stortinget-20191213-085502_431800_460500,for den innsatsen han har lagt ned for norge både under krigen som sterkt delaktig i motstandsbevegelsen etter krigen som er en av våre dyktigste menn i uniform og deretter som et viktig tidsvitne som sprer kunnskap og innsikt i krigens år mine varmeste tanker går til familie venner og øvrige pårørende så over til neste års skatteopplegg president jeg vil takke finanskomiteen for et godt samarbeid jeg er glad for at vi nå er en flertallsregjering jeg trur både posisjon og opposisjon,for ein innsats han har lagt ned for noreg både under krigen som sterkt delaktig i mottaksreglsen etterkrigen som ein har vore dyktigaste menn i uniform og deretter som eit viktig tidsvitne som spreid kunnskap og innsikt i krigens år mine varmestankar går til familie vennar og øvrige på runeså over til neste års skatteopplegg president eg vil takke finanskomiteen for eit godt samarbeid eg er glad for at vi no er ein fleirtalsregjering eg trur både posisjonen og opposisjon,431.8,460.5,28.69999999999999,2019-12-13,2019-12-13_proceedings.txt
Stortinget-20191213-085502_460500_488500,glede oss over et noe mer romslig tidsløp fram til både finansdebatt og skattedebatt og jeg vil samtidig takke komitesekretariatet som alltid gjør en utmerket jobb denne regjeringa har med neste års budsjett senka skattene og avgiftene i det her landet med tjuefem komma fem milliarder kroner sia den tiltrådte i tjuetretten etter min mening skal ikke staten ta inn mer penger fra vanlige folk og bedrifter før alle andre midler er uttømt,gledas over eit noko meir romseleg tidsløp eee fram til både finansdebatt og skattedebatt og eg vil samtidig takke komitesekreriatet som alltid gjer ein utmerket jobb denne regjeringa har med neste års budsjett senka skattane og avgiftene i det hele landet med tjuefem komma fem milliardar kr kroner sidan ein tiltrådt i tjuetretten etter mi melding skal ikkje staten ta inn meir pengar frå vanlege folk og bedrifter for alle andre midlar er uttømt,460.5,488.5,28.0,2019-12-13,2019-12-13_proceedings.txt
Stortinget-20191213-085502_488500_517600,og det er noe av hovedforskjellen vi ser i denne sal i dag president venstresida tyr altså først til det virkemiddelet som jeg mener må komme sist nemlig skatteøkninga det ønskes ingen reformer ingen effektiviseringer ingen ny nye måter å tenke på og i alle fall ikke kutt eller omlegginger der man prioriterer det ene over det andre denne denne re regjeringa jobba i hvert budsjett med å snu hver en stein for å skape mer handlingsrom i budsjettet,og det er noko av hovudforskjellen vil skjer i denne sal i dag president venstre sida tyr altså først det verkemiddelet som eg meiner må komma sist nemleg skatteøkninga det ønska eee ingen reformar ingen effektiviseringar ingen nye nye måtar å tenkje på og gjelde for ikje akutt eller omleggingar dei ein prioriterer det eine over det andre denne denne re regjeringa jobbar i kvart budsjett med å snu kvar i stein for å skape meir handlingsrom i budsjetta,488.5,517.6,29.100000000000023,2019-12-13,2019-12-13_proceedings.txt
Stortinget-20191213-085502_517600_546700,uten å øke skatten jernbanereformen er det siste gode konkrete eksempelet staten går nå fra å betale til å få betalt for jernbanedrift og gjøre skatteoppkreverne statlig et anna tiltak som vil eee sparres for nesten fire hundre millioner kroner i året når tiltaket er fase inn helt let meg så kort gå inn på deler av innstillinga den regjeringa leverer på klima vi ser nå at den formidable endringa i nybilsalget holder seg,utan å auke skatten i jernbanereforma er det siste gode konkrete eksempelet staten går no frå å betala til å få betalt for jernbanedrift å gjera skatteoppkreveren statleg eit anna tiltak som vil sparast for nesten fire hundre millionar kroner i året når tiltaket er i ein fasa inn heilt let meg så kort gå inn på å dele av innstillinga denne regjeringa leverer på klima vi ser no at den formidable endringar i nybilsalget held seg,517.6,546.7,29.100000000000023,2019-12-13,2019-12-13_proceedings.txt
Stortinget-20191213-085502_546700_574500,nesten halvparten av alle solgte biler er nullutslippskjøretøy noe som betyr at regjeringas avgiftslettelser fungerer vi følger opp eee regjeringsplattformen ved å innføre prising av utslipp der det ikke før har vært det her det betyr at for noen så blir det en ny avgift men regjeringas politikk på det her området er forutsigbar og vi skal gjennom det grønne skiftet president og da må utslipp være bgt med en kostnad,nesten halvparten av alle solgte bilar er nullerslipskøyretai noko som betyr at regjeringas avgiftslettelser fungerer vi følger opp eee regjeringsplattforma ved å innføre prising av utslepp der det ikkje før har vore der det betyr at for nokon så blir det ein ny avgift men eee regjeringas politikk på det her området er forutsigbar og vi skal gjennom det grøne skiftet president og da må utslepp vera bgt med ein kostnad,546.7,574.5,27.799999999999955,2019-12-13,2019-12-13_proceedings.txt
Stortinget-20191213-085502_574500_600200,flertallet foreslår at innføringa av veibruksavgift på alt biodrivstoff utsettes til sommeren samtidig som at omsetningskravet da øker slik at det ikke blir omsatt mindre biodrivstoff enn den faktiske omsetninga året før det her gir næringsliv og kollektivselskaper bedre tid på å forberede seg og man kan inngå i en tett dialog med regjeringa om hvordan å komme i havn med vårt felles mål,fleirtalet foreslår at innføringa av vegbruksavgift på alt biodrivstoff utsettast til sommaren samtidig som at omsetningskravet da aukar slik at det ikkje blir omsett mindre biodrivstoff enn i faktiske omsetninga året for det her i næringsliv og kollektivselskap betre tid på forberedelse og ein kan inngå i ein tett dialog med regjeringa om kva om komma i hamn med vårt felles mål,574.5,600.2,25.700000000000045,2019-12-13,2019-12-13_proceedings.txt
Stortinget-20191213-085502_600200_625800,enstemmig går komiteen inn for re regjeringas forslag om å frita varer som gis bort til veldedige formål for særavgift vi vedtar i dag at det her skal kunne tre i kraft i fra og med første desember i år noe som kan bety en mer gledelig jul for mange det er ikke riktig at produsenter av ulike varer heller velger å distrubuere varene framfor å gi dem bort til dem som har minst,enstemming går komiteen inn for eee regjeringas forslag om å frita vare som gisbort til veldedige formål for særavgift vi vedtar i dag at det her skal kunne tre i kraft ifrå med første desember i år noko som kan bety ein meir gledeleg jul for mange det er ikkje riktig at produsentar av ulike varer heller velje å distruere varane framfor å gi den bort til dei som har minst,600.2,625.8,25.59999999999991,2019-12-13,2019-12-13_proceedings.txt
Stortinget-20191213-085502_625800_655200,komiteen kjem i sin innstilling også inn på kraftskatteutvalgets forslag flertallets holdning er at stortinget ikke har fått en sak til behandling ennå og vi vil derfor avvente er regjeringas framlegg men det vi har sagt i innstillinga er at utvalgets forslag har skapt usikkerhet i bransjen og at de forventer at regjeringa kjem tilbake til stortinget så snart som mulig etter høringsfristens utløp men saken ligger til behandling i regjeringa,komiteen kjem i sin innstilling også inn på kraftskatteutvalets forslag fleirtalets haldning er at stortinget ikkje har fått ein sak til behandling enno og vi vil derfor avvente regjeringas framlegg men det vi har sagt i innstillinga er at utvalets forslag har skapt usikkerheit i bransjen og at dei forventar at regjeringa kjem tilbake til stortinget så snart som mulig etter høyringsfristens utløp men saka ligg til behandling i regjeringa,625.8,655.2,29.40000000000009,2019-12-13,2019-12-13_proceedings.txt
Stortinget-20191213-085502_655200_681900,og når jeg ser at også mindretallet i komiteen vil ha vurdert deler av vannkraftbeskatninga så virker det for meg som at en enstemmig sal forventer at eee regjeringa skal komme tilbake med en sak til stortinget og med det tar jeg op dem forslaga som høyre er en del av president takk det åpnes opp for replikkordskifte og første replikant er eee ingrid heggø deretter trygve,og når det skjer at også mindretalet i komiteen vil ha vurdert deler av vannkraftbeskatninga så verkar det for meg som at ein einstemmig sal forventar at regjeringa skal komme tilbake med ein sak til stortinget og med det tar opp dei forslaga som høgre er ein del av president takkdet opnast opp for replikkordskifte og første replikant er eee ingrid heggø deretter trygve,655.2,681.9,26.699999999999932,2019-12-13,2019-12-13_proceedings.txt
Stortinget-20191213-085502_687200_713600,heggø president eee både i næringsliv og offentlig sektor trenger langsiktige forutsigbare rammebetingelser eee og kraftskatteutvalget sine forslag om skroting av konsesjonsordningene redusert eiendomsskatt og grunnrente for småkraft det har skapt stor uro noe representanten og var inne på i sitt innlegg og det har vært en mas,heggø president eee både næringsliv og offentleg sektor treng langsiktige forutsigbare rammebetingelser eee og kraftskatteutvalget sine forslag om skrotinget av konsesjonsordningane redusert eigedomsskatt og grunnrente for småkrafta har skapt stor uro noko representanten og var inne på i sitt innlegg og det har vore mas,687.2,713.6,26.399999999999977,2019-12-13,2019-12-13_proceedings.txt
Stortinget-20191213-085502_713600_740600,i tjuesytten så sto et samla storting sammen om konsesjonsordningene og for at eiendomsskatten på vasskraft skulle ligge fast momsutvalget og og forslag om grunnrente på havbruk det var skrota straks av både eee stortingsrepresentanter og regjeringsmedlemmer da er det all grunn til uro og lyder heilt hulte saken,i tjuesytten så stod eit samla storting saman om konsesjonsordningane og for at eigedomsskatten på vasskraft skulle ligge fast momsutvalet og og forslag om grunnrente på havbruk det vart skrota straks av både stortingsrepresentantar og regjeringsmedlemer då er det all grunn til uro og lyder heilt hultne saka,713.6,740.6,27.0,2019-12-13,2019-12-13_proceedings.txt
Stortinget-20191213-085502_740600_766000,ikke en gang kan være med på en merknad om at tidligere vedtak står fast president men plutselig må vente avvente i høring kan representanten likevel gi en garanti for at bransjen blir lytta til konsesjonsordninga eiendomsskatten og grunnrente på småkraft blir stående fast president eee som jeg sa i mitt innlegg den her saken ligger til behandling i eee regjeringa,ikkje ein gong kan vere med på ein merknad om at tidlegare vedtak står fast president men plutseleg må vente avvente ei høyring kan representanten likevel gi ein garanti for at dei bransjen blir lytta til konsesjonsordninga eigedomsskatten og grunnrente på småkraft blir ståande fastpresidentee som eg sa i mitt innlegg den her saka legg til behandling i eee regjeringa,740.6,766.0,25.399999999999977,2019-12-13,2019-12-13_proceedings.txt
Stortinget-20191213-085502_766000_795700,og så ser jeg og og og vi ser helt klart at noen en av forslaga som er fremma har skapt usikkerhet i bransjen derfor så ber vi regjeringen komme tilbake til stortinget så fort som mulig men så ser jeg også at mindretallet ønsker at man skal se videre på g innretninga på grunnrenteskatten og det betyr også at hvis man ønsker å se videre på nå så må regjeringa komme tilbake til stortinget med nå ergo ser det etter mitt skjønn enstemmig storting som ønska stortinget at regjeringa skal komme tilbake til eee stortinget med et forslag og så er det slik president vi ser på det her av en grunn,og så skjer det og og og vi ser heilt klart at noko dei forslaga som er fremma har skapt usikkerheit i bransjen derfor så ber vi reigon komme tilbake til stortinget så fort som mulig og så ser eg også at mindretalet ønsker at ein skal sjå vidare på innretninga på grunneieskatten og det betyr også at viss ein ønsker å sjå vidare på nå så må regjeringa kome tilbake til stortinget no ergo er dette misjen einstemmig stortinget som ønska stortinget at regjeringa så kommer tilbake til stortinget med eit forslag og så er det slik president vi ser det på det her av ein grunn,766.0,795.7,29.700000000000045,2019-12-13,2019-12-13_proceedings.txt
Stortinget-20191213-085502_795700_824000,og det er mange som mener det at utvalget har ikke svart på den oppgaven dem har fått desto viktigere er det jo du bruker den høringstida vi har nettopp å få innspill på ja hva er det da man menneske skulle ha stått der for målet om at vi fortsatt skal bygge ut mer samfunnsøkonomisk lønnsomme vannkraftverk består jo målet med at man skal reinvestere der det er lønnsomt består jo så ergo bli tida at vi har nå viktigere til å høre fra alle sammen hva skulle da heller ha stått hvis man er uenig i det som stårheggø,og det er mange som meiner det at utvalet har ikkje svart på det oppgåva ein har fått desto viktigare er det å du bruker den høyringstida vi har nettopp å få innspel på ja kva er det det ein ennå skulle ha stått der for målet om at vi fortsatt skal bygge ut meir samfunnsøkonomisk lønnsomme vannkraftverk består jo målet me at ein skal reinvestere der det er lønnsamt består jo så erge å bli tid at vi har no viktigare til å høyre ifrå alle saman kva skulle det heller har stått i viss ein er ueinig i det som står heggø,795.7,824.0,28.299999999999955,2019-12-13,2019-12-13_proceedings.txt
Stortinget-20191213-085502_824000_849100,president jeg forstår at det er gått i vranglås på denne saken så jeg skal ikke få følge noe mer men høyre har i tidligere tider hevda at kommunalt sjølstyre de har stått deres hjertet ned den ene int ene inntektskilda som kommunene sjøl råder over er nettopp eiendomsskatten det lille handlingsrommet som kommunene hadde det innskrenka blant annet ved redusert maksimal sats,president eg forstår at du er gått i vranglås på denne saka så eg skal ikkje forfølgja noko meir men høgre har i tidlegare tider hevda at kommunalt sjølvstyre det har stått deira hjerte nær den eine in eine inntektskjelda som kommunane sjøl råd over er nettopp eigedomsskatten det lille handlingsrommet som kommunane hadde det innskrenka blant anna ved redusert maksimal sats,824.0,849.1,25.100000000000023,2019-12-13,2019-12-13_proceedings.txt
Stortinget-20191213-085502_849100_878800,regjeringa si manglende kompensasjon ved bortfall av den såkalte maskinskatten er et anna eksempel og nå at høyre ikke kan avklare om eiendomsskatten skal stå fast ved vannkraften noe de meinte i tjuesytten det som skulle være full kompensasjon for kommunene på maskinskatten er vorte til atten prosent kompensasjon for enkelte av industrikommunene ifølge ks sine tall i sum så er dette alvorlige angrep på lokalt sjølstyre,regjeringa si manglande kompensasjon ved bortfall av den såkalla maskinskatten er eit anna eksempel og no at høgre ikkje kan avklare om eigedomsskatten skal stå fast ved vannkraft noko dei meinte i tjuesytten det som skulle vere full kompensasjon for kommunane på maskinskatten er vorte til atten prosent kompensasjon for enkelte av industrikommunane ifølge ks sine tal i sum så er dette alvorlege angrep på lokalt sjølvstyre,849.1,878.8,29.699999999999932,2019-12-13,2019-12-13_proceedings.txt
Stortinget-20191213-085502_878800_906800,hva skulle det det at høyre nå er vårt motstander av lokalt sjølstyre for kommunene presidentoleim president vi er ikke motstandere av lokalt sjølstyre i i kommunene tvert imot vi mener det at kommunene skal få større muligheten til å gjøre nettopp det man sjøl ønsker og når vi da ser at dem kommuneopplegga som den her regjeringa fremma er jevnt over bedre enn det dem rødgrønne fremma i sine år så betyr det at kommunene har mer for frihet og nettopp vedta det man sjøl ønsker,kva skuldast det at høgre no har vore motstandar av lokalt sjølvstyre for kommunane president soleim president vi er ikkje motstandar av lokalt sjølvstyre i komunen tvert imot vi meiner det at kommunane skal få større muligheten til å gjera nettopp det ein sjøl ønsker og når me i dag ser at den kommuneopplegge som dei har regjeringa fremma er gjemt over betre enn det dei raudgrøne fremma i sine år som betyr at kommunane har meir fyfrihet og nettopp veta det ein sjøl ønsker,878.8,906.8,28.0,2019-12-13,2019-12-13_proceedings.txt
Stortinget-20191213-085502_906800_935000,neste års kommuneopplegg gir oss ei økning i frie inntekter på en komma tre milliarder som kommunene kan velge å bruke på det man ønsker og så er det helt riktig vi før vi fører en politikk der vi ønsker å stramme inn på kommunene sin mulighet til å beskattlegge vanlige folk sine boliger som et eiendomsskatteobjekt vi strammer også inn på muligheten kommunene har for å ilegge skatt på det som vanlige bedrifter har for å ha maskiner om bord i sin de i sin bedrift,neste års kommuneopplegg gir oss ei økning i frie inntekter på ein komma tre milliardar som kommunaen kan velje å bruke på det ein ønsker og så e det heilt riktig vi før vi fører ein politikk der vi ønsker å stramme inn på kommunane sin mulighet til å beskattlegge vanlege folk sine bolgar som eit eigedomsskatteobjekt vi strammar også inn på muligheita kommunane har for å ilegge skatt på det som vanlege bedrifter har for å ha maskinar ombord i sin be i sin bedrift,906.8,935.0,28.200000000000045,2019-12-13,2019-12-13_proceedings.txt
Stortinget-20191213-085502_935000_952900,eee jeg meiner at det her er en en enorm lettelse for næringslivet at man i s at når man har maskiner berre at man har maskiner som står det går som skaper verdier så skal man altså bli ilagt en skatt for det det mener er feil og det er heldigvis eee næringslivet er helt enig med å si neste replikant qqq er trygve slagsvold vedum,eee eg meiner at det her er ein ein enorm lettelse for næringslivet at ein is at når ein har maskinar berre ein har maskinar som står og går så skapar verdiar så skal ein også bli ilagt ein skatt for det det meiner eg er feil og det er heilegvis eee næringslivet er heilt einig med seineste replikant er trygve slagsvold vedum,935.0,952.9,17.899999999999977,2019-12-13,2019-12-13_proceedings.txt
Stortinget-20191213-085502_956300_985300,president de kommunale skatteoppkreverne har vært eee effektive men har det jo også hatt mulighet til å ta hensyn spesielt de selvstendig næringsdrivende som kan hatt eee likviditetsmessige utfordringer ved deler av året det har gitt en veldig høy innkrevingsgrad eee helt på topp samtidig som det har gitt mulighet for å ta noen menneskelige hensyn i løpet av et år men frp og høyre har jo et hovedprosjekt eee med dagens regjering der sentralisering,vedum president dei kommunale skatteoppkrevjarane har vore eee effektive men har også fått mulighet til å ta hensyn spesielt i tilsend næringsliv som kan ha hatt eee likviditetsmessig utfordring med deler av året det har gitt ein veldig høg innkrevingsgrav eee heilt på topp samtidig som det har gitt mulighet for å ta nokon menneskele hensyn i løpet av eit år men frp og høgre har jo eit hovudprosjekt eee med dagens regjering det er sentralisering,956.3,985.3,29.0,2019-12-13,2019-12-13_proceedings.txt
Stortinget-20191213-085502_985300_1014700,og her skal det gå da fra to hundre og syvogtyve til femtiseks eee skattekontor klassisk sentralisering man har forøvd det samme i danmark og man så i danmark at eee man klarte å kreve inn mindre skatt og at staten tapte massiv store beløp på det vi eee har et spørsmål til eee soleimer for det er mange av de som nå blir berørt av denne voldsomme sentraliseringsreformen som får enormt lang reisevei eee vil regjeringspartiene være villig til å se på fleksible ordninger for de som får,og her skal det gå da frå to hundre og syvogtyve til femtiseks eee skattekontor klassisk sentralisering men ein har prøve det same i danmark og ein såg i danmark at ho klarte å kreve ein mindre skatt og at staten har tatt en massiv se og store beløp på det vi har eitt spørsmål til eee soleim her frå mange av dei som no blir berørt av denne valdsutseringsreforma som får enormt langt reiseveg eee vil regjeringspartia vere villig til å se på fleksible ordningar for dei som får,985.3,1014.7,29.40000000000009,2019-12-13,2019-12-13_proceedings.txt
