file,text_bm,text_nn,start,end,duration,date,proceedingsfile
Stortinget-20190507-095514_12776700_12803300,eee men at altså han har trådt ut av kontroll og konstitusjonskomiteen det er sånn at når vi står her nå så er det egentlig tjueårsjubileum for når denne saken starter hvor han starter med et eee møte mellom de nordiske forsvarsministrene i nittennittini som var enige om å starte utviklinga av eter,eee men at det alt så han vart rått ut av kontroll og konstitusjonskomiteen det er sånn at når vi står her no så har det eigentleg tjueårsjubileum for når den saka startar for han starta med eit møte mellom dei nordiske forsvarsministrane i nittennittini som var einige om å starte utviklinga av eiter,12776.7,12803.3,26.599999999998545,2019-05-07,2019-05-07_proceedings.txt
Stortinget-20190507-095514_12803300_12830800,i paraktesbemerka president et enhetselo helikopter som jeg nå trur finnes i tjuesju varianter eee og starte på eee utviklinga av det eee prosjektet eee til grunn for den behandlinga vi har nå så ligger det en grundig rapport ifra riksrevisjonen eee som refererer til flere proposisjoner og dertil hørende innstillinger ee stortinget,i paisbemerka president eit enhets helikopter som er no trur finnast i tjuesju variantar eee og starta på utviklinga av det prosjektet eee til grunn for den behandlinga vi har no så ligg det ein grundig rapport ifrå riksrevisjonen eee som refererer til fleire proposisjonar og dertil høyrande innstillingar ee stortinget,12803.3,12830.8,27.5,2019-05-07,2019-05-07_proceedings.txt
Stortinget-20190507-095514_12830800_12857300,opprinnelig president så var det sånn at vi totusenogåtte skulle ha mottatt åtte helikopter til kystvakten og seks helikopter til fregattene på det tidspunktet riksrevisjonens rapport ble avslutta i månedsskiftet sytten eeeatten eee så var det altså seks foreløpig og ett i endelig versjon som hadde kommet til,oprinnelig president så var det sånn at vi totusenogåtte skulle ha mottatt åtte helikopter til kystvaktar og seks helikopter til fregatane på det tidspunktet riksrevisjonens rapport blei avslutta eee månadskiftet sytten eee atten eee så var det altså seks eee forleby og eitt i endeleg versjon som hadde kome til,12830.8,12857.3,26.5,2019-05-07,2019-05-07_proceedings.txt
Stortinget-20190507-095514_12857300_12886500,og president la meg starte med med forutsetninga det blei sagt at eee i fra stortingets side at eee vi skulle basere oss på eee eller kjøpehelikopter som i størst mulig grad var basert på kjent teknologi og at materiellet skulle være ferdig utvikla president så blei det altså valgt eee et nytt helikopter fra en produsent som ikke tidligere,og president landet starta med med forutsetningar det blei sagt at ifrå stortingets side at vi skulle basere oss på eller kjøpe helikopter som i størst mulig grad var basert på kjend teknologi og at materielle skulle vere ferdig utvikla president så blei det altså valt eee eit nytt helikopter frå ein produsent som ikkje tidlegare,12857.3,12886.5,29.200000000000728,2019-05-07,2019-05-07_proceedings.txt
Stortinget-20190507-095514_12886500_12914500,hadde produsert helikoptre det er nok eee en av mange årsaker til den statusen som i dag er eee skrevet inn i riksrevisjonens rapport og i vår innstilling at eee helikopter er sterkt forsinka de gir færre flytimer enn forventa de har høyt vedlikeholdsbehov og høye driftskostnader,hadde produsert helikoptre det er nok eee ein av mange årsaker til den statusen som i dag er skrive inn i riksrevisjonsrapport og i vår innstilling at eee helikoptra stakk for skinka det gir færre flytimar enn forventa det er høgt vedlikehaldsbehov og høge driftskostnader,12886.5,12914.5,28.0,2019-05-07,2019-05-07_proceedings.txt
Stortinget-20190507-095514_12914500_12943800,og en ting som er alvorlig i tillegg til det ved at denne saken jo har gått over så veldig mange år og over en rekke statsråders perioder som statsråd er at en fellesnevner er at reportering til stortinget om forsinkelser årsaker til forsinkelser har vært eee begrensa i tillegg eee president så er det sånn at det er lett å se,og ein ting som er alvorleg i tillegg til det ved at det henne saka jo har gått over så veldig mange år og over ein rekke statsråders periode som statsråd er at ein fellesnemner er at rapportering til stortinget om forsinkelser og orsaker til forsinkelse har vort eee begrensa i tillegg eee president så er det sånn at det er lett å se,12914.5,12943.8,29.299999999999272,2019-05-07,2019-05-07_proceedings.txt
Stortinget-20190507-095514_12943800_12971100,at seine leveranser skyldes leverandøren og det er alle enige om men det riksrevisjonen mener at de har funnet i tillegg er at norske myndigheter sjøl kan ha bidratt til forsinkelsene eee fra eee leverandør og det var et av temaene som eee kom fram i de eee høringene vi hadde president,at seine leveranser skiljast leverandøren og det er alle einige om men det riksrevisjonen meiner at det her finn i tillegg er at norske myndigheiter sjøl kan ha bidrege til forsinkelsene eee frå eee leverandør og det var eit av temane som eeeee kom fram i dei høyringane vi hadd president,12943.8,12971.1,27.30000000000109,2019-05-07,2019-05-07_proceedings.txt
Stortinget-20190507-095514_12971100_13000200,eee vi starta når det gjaldt statsråder med uten tid tidligere forsvarsminister godal som eee jo var den som i la i veldig stor grad eee hadde saksforberedelsene til kontraktinngåelsen og som vi spurte blant annet om det med kjent leverandør og stortingets hensyn som har tatt der og det er lett å konstatere i dag at de hensyn stortinget hadde lagt til grunn i for liten grad blei fulgt eee eee opp eee,eee vi starta når det gjaldt statsrådet med utan tid tidlegare forsvarsminister godal som eee jo var den som i la i veldig stor grad eee hadde saksforberedelsene til kontraktsinngåelsen og som mi spørte blant anna om det med kjent leverandør av stortingets hensyn som har tatt der og var lett å konstatere i dag at dei hensyns stortinget hadde lagt til grunn i for liten grad blei følgt eee eee opp eee,12971.1,13000.2,29.100000000000364,2019-05-07,2019-05-07_proceedings.txt
Stortinget-20190507-095514_13000200_13021600,eee selv om det og er riktig å bemerke eee president at et fellestrekk igjennom denne saken er at de betingelser som har blitt presentert i fra forsvarsdepartementet heller ikke har vært politisk strid i stortinget så det er altså sånn at de forutsetningene som stortinget la til grunn var selvfølgelig kjent for stor men når valget blei gjort,eee sjøl om eee det er er riktig og bemerke president at eit fellestrekk gjennom denne saka er at dei betingelser som har blitt presentert i frå forsvarsdepartementet heller ikkje har vore politisk strid i stortinget så da er det altså sånn at dei forutsetningane som stortinget la til grunn var selvfølgeleg kjent for stor men nå valget blei gjort,13000.2,13021.6,21.399999999999636,2019-05-07,2019-05-07_proceedings.txt
Stortinget-20190507-095514_13021600_13050400,så var det og kjent med eee hvilke hvilke tolkninger av de eee av de eee premissene som var lagt inn godal baserte seg som jeg sa på forarbeid ifra nordisk forsvarsministermøte og videre gjennom forsvarets faglige eee råd og det var altså da statsråd eee i kristin kron devold som var den statsråden som faktisk undertegna kontrakten president i totusenogen,så var det jo kjent med eee kva kva tolkingar av dei eee av dei eee premissene som var lagt eee inn eee gode baserte er som eg sa på forarbeid ifrå nordisk forsvarsministermøte og vidare gjennom forsvarets faglege eee råd og det var altså da statsråd eee kristin gun devold som var den statsråden som faktisk underteikna kontrakten president i totusenogein,13021.6,13050.4,28.799999999999272,2019-05-07,2019-05-07_proceedings.txt
Stortinget-20190507-095514_13050400_13078500,og det som kanskje var det mest påfallende med hennes eee eee bidrag i høringa var nettopp det at hun understreka at til henne og det var altså snakk om en hel fireårsperiode president i hennes tid så hadde hun bare fått ett notat rett i etterkant av kontraktinngåelsen som gjaldt altså enognittihelikoptrene og der ser vi og ka kanskje president noe av årsaken til de utfordringene vi er i for det var altså de første fire åra,og det som kanskje var det mest påfallande med hennes eee eee bidrag i høyringa var nettopp det at ho understreka at henne og det var altså snakk om ein heil fireårsperiode president i hennes tid så hadde ho berre fått eitt motat rett i etterkant av kontrakt ingasen som gjeld altså enognitti helikoptrane og der ser vi og kan kanskje president nok av årsaka til dei utfordringane vi gjer for det var altså dei første fire åra,13050.4,13078.5,28.100000000000364,2019-05-07,2019-05-07_proceedings.txt
Stortinget-20190507-095514_13078500_13105500,som skulle til reg legge til rette for to viktige ting det ene var design valg av løsninger spesifikasjoner til produsenten som norge ønska å ha og det andre var å legge til rette for mottaket av de helikoptrene som skulle komme og når statsråden sjøl understreker at og i liten grad har vært borte i den saken i løpet av fire år så er vel det en god illustrasjo utfordringa,som skulle til legg legge til rette for to viktige ting det eine var disin vag av løysingar spesifikasjonar til produsenten som noreg ønsker å ha og det andre var å legge til rette for mottaket av dei helikoptrane som skulle komma og når statsråden sjøl understrekar at og i liten grad har vore borte i den saka i løpet av fire år så er vel det ein god illustrasjo utfordringar,13078.5,13105.5,27.0,2019-05-07,2019-05-07_proceedings.txt
Stortinget-20190507-095514_13105500_13132000,for i de fire åra så burde statsråden vært mye bort i det å skaffe bemanning til kompetanse til spesifikasjoner og så videre og forberede mottaksorganisasjoner eee deretter kom statsråd eee anne grete strøm eriksen eee og i hennes periode så eee var det altså i totusenogfem allerede en forventa forsink,for i dei fire åra så burte statsråden vore mye borti det å skaffe bemanning til kompetanse til spesifikasjonar og så vidare og forberede mottaksorganisasjon eee deretter kom statsråd eee ana gretestrøm eriksen eee og i hennes periode så var det altså i totusenogfem eee allereie ein forventa forsink,13105.5,13132.0,26.5,2019-05-07,2019-05-07_proceedings.txt
Stortinget-20190507-095514_13132000_13160200,eee men i løpet av perioden fram til totusenogsju president så var den forsinkelsen økt til fire år og og i den perioden påpeker riksrevisjonen at det var liten grad av informasjon om utsettelser og årsaker til utsettelser til eee stortinget eee deretter overtok grete faremo eee og det blei ytterligere eee forsinkelser det vi har valgt å,eee men i løpet av perioden fram til totusenogsju president så var den forsinkelsen økt til fire år og og i den perioden påpeikar riksrevisjonen at det var liten grad av informasjon om utsettelser og årsaker til utsettelser til eee stortinget eee deretter og prokrete farmor eee og det blei ytterlegare eee forsinkelser det vi har valt å,13132.0,13160.2,28.200000000000728,2019-05-07,2019-05-07_proceedings.txt
Stortinget-20190507-095514_13160200_13188800,omtale litt positivt president i eee rapporten og det er det og en enighet om er at når espen barth eide blei statsråd i totusenogelleve så satte han i gang et arbeid for å vurdere å oppheve kontrakten eee fordi at en da så at forsinkelsene var store leveransene var seine og en begynte vel og å se at produksjonen sto noe tilbake for det som hadde vært eee det forventa,omtale litt positivt president i eee rapporten og det er og ein einigheit om er at når espen vart eide blei statsråd i totusenogelleve så sette han i gang eit arbeid for å vurdere å oppheve kontrakten eee fordi at ein da så at forsinkelsen var store leveransen vart seine og ein bynte vel og se at produksjonen stod no tilbake for det som hadde vore eee det eee forventa,13160.2,13188.8,28.599999999998545,2019-05-07,2019-05-07_proceedings.txt
Stortinget-20190507-095514_13188800_13216400,eee og i den sammenhengen så blei det gått gjennom eee alternativer eee både for kystvakta og fra gatene og hvem alternativet som fantes og hvorvidt de kunne tilfredsstille eee det norske eee behovet det var en faglig gjennomgang der blant annet eee forsvarets logistikkorganisasjon var sterkt inne i bildet men det elde altså med og og det var først når da anne grete strøen igjen hadde blitt statsråd,eee og i den samanhengen så blei det gått gjennom eee alternative eee både for kystvakta og fregattene og ven alternativet som fantast og vo vidt dei kunne tilfredstille eee det norske eee behovet det var ein eee fagleg gjennomgang der blant anna eee forsvarets logissikk organisasjon var sterkt inne i bildet men det elda altså med og det var først når da anne grete strøen igjen hadde blitt statsråd,13188.8,13216.4,27.600000000000364,2019-05-07,2019-05-07_proceedings.txt
Stortinget-20190507-095514_13216400_13245900,at det fagmilitære rådet den gangen og etter den gjennomgangen som var satt i gang av espen barth eide var at de skulle gå videre med nh nitti og eee i den eee sammenhengen så er det ganske interessant å se hva eee for tidligere forsvarssjef general harald sunde sier i høringa som den forrige kontrollkomiteen hadde om fregatvåpnes operative evne da uttalte tidligere forsvarssjefsunde,at fagmilitære rada den gongen og etter den gjennomgangen som var sett i gang av espen bart eide var at dei skulle gå vidare med nh nitti og eee i den eee samanhengen så er det ganske interessant å se kva eee for tidlegare forsvarssjef gunner a høyra og sunde sier i høyringa som den forre kontrollkomiteen hadde om fre at våpnetsoperative enne det uttalte tidlegare forsvarssjef sunde,13216.4,13245.9,29.5,2019-05-07,2019-05-07_proceedings.txt
Stortinget-20190507-095514_13245900_13275200,at eee etter at alle analyser og gjennomganger både i forsvaret og departementet falt konklusjonen på at vi måtte fortsette med ennitti helikopteret dette er en stor tragedie sa sunde og det er egentlig en ganske god oppsummering og beskrivelse av hele eee saken eee qqq,at etter at alle analyser og gjennomgangar både i forsvaret og departementet fall konklusjon på at vi måtte fortsette med einognitti helikoptrar dette er ein stor tragedie sa sundet og det er eigentleg ein ganske god oppsummering og beskrivelse av heile eee saka eee,13245.9,13275.2,29.30000000000109,2019-05-07,2019-05-07_proceedings.txt
Stortinget-20190507-095514_13275200_13301700,så eee var det eriksen søreide som blei statsråd som vi og har eee positivt eee omtalt i eee innstillinga med bakgrunn i at til tross for den konklusjonen om da går videre med en ht så tok i hvert fall hun noen grep for å få bedre eee bedre orden for strukturen og oppfølginga av prosjektet blant annet ved at det fra flo flo blei skilt ut for,så eee var det eriksen søreide som blei statsråd som e og har eee positivt eee omtalt i innstillinga med bakgrunn i at etter trass far den konklusjonen om det går vidare med ein halti så tok i kvart fall ho om grep for å få betre eee betre ordning for strukturen og oppfølginga av prosjektet blant anna ved at det frå f flo blei skilde ut for,13275.2,13301.7,26.5,2019-05-07,2019-05-07_proceedings.txt
Stortinget-20190507-095514_13301700_13325600,eee som fikk som egen oppgave blant annet å skulle følge det herre eee prosjektet at det skulle være ny gjennomgang av kontraktene eee og så videre det som er noe av det ille i det herre prosjektet er og de dårlige kontraktene det er jo faktisk sånn at det når det gjelder dagmulkter for manglende leveranser,eee som fekk som eigen oppgaver blant anna å skulle følgje det her eee prosjektet at det skulle vere ny gjennomgang av kontraktane eee og så vidare det som er noko det ille i det her prosjektet er og dei dårlege kontraktane det er jo faktisk sånn at når det gjeld dagmultar for manglande leveranser,13301.7,13325.6,23.899999999999636,2019-05-07,2019-05-07_proceedings.txt
Stortinget-20190507-095514_13325600_13352300,så var det i all hovedsak brukt opp i hvert fall i totusenogelleve veldig mye av det allerede i totusenogåtte det betyr at en har altså ikke igjen sanksjoner for å eee for å sette makt bak krav om at nå må leveransene eee komme det var eee også betydelige svakheter ved kontraktene og det var betydelige svakheter ved kvalitetssikringa i,så var det i all hovudsak brukt opp i kvart fall i totusenogelleve veldig mye av det allereie i totusenogåtte og det betyr at ein har altså ikkje igjen sanksjonar for å eee for å sette makt bak krav om at nå må leveransene eee komme det var eee også betydeleg svakheit ved kontraktane og det var betydeleg svakheter ved kvalitetssikringa i,13325.6,13352.3,26.69999999999891,2019-05-07,2019-05-07_proceedings.txt
Stortinget-20190507-095514_13352300_13379300,eee forsvarssjef bruun hansen så har i høring at det i flo eee i altså forsvarets logistikkorganisasjon som hadde ansvaret for eee å ta imot og implementere helikoptra i perioden tjuetolv til tjuefemten nok peke på noe av forklaringen nemlig at det var liten bemanning at det var mange andre på prosjekter på gang parallelt eee at de fik oppbemanne,eee forsvarssjef brun hansen sa i høyringa at det er i flo eee i altså forsvarets logistikkorganisasjon som hadde ansvaret for eee å ta imot og implementere eee helikoptrar i perioden tjuetolv til tjuefemten nok peika på noko av forklaringa nemleg at det var liten bemanning at det var mange andre på prosjekt på gang parallelt eee at dei fek opemanne,13352.3,13379.3,27.0,2019-05-07,2019-05-07_proceedings.txt
Stortinget-20190507-095514_13379300_13407700,men at det var vanskelig å skaffe den kompetansen som skal til for å kunne håndtere et så stort eee prosjekt det er blant de ting som også kan ha bidratt til norges bidrag til forsinkelse fra leverandøren nemlig ved at design og utviklingstiltak blei skadelidende som forsvarssjefen sjøl sa i høringa,men at det var vanskeleg å skaffe den kompetansen som skal til for å kunne handtere eit så stort eee prosjekt det er blant dei ting som også kan ha bidrag til noregs bidrag til forsinkelse frå leverandøren nemleg ved at decin eee og utviklingstiltak blei skadelidande som forsvarssjefen sjø sa i høyringa,13379.3,13407.7,28.400000000001455,2019-05-07,2019-05-07_proceedings.txt
Stortinget-20190507-095514_13407900_13435600,vi står altså nå i en situasjon eee der vi har et eee noen få av et helikopter som vi skulle hatt eee levert eee der det viser seg at vi får f få flytimer ut av eee investeringer det var altså forventa når vedtaket blei fatta at vi skulle ha fire hundre og tredve flytimer per årdet faktisk så langt,vi står altså no i ein situasjon eee der vi har eit eee nokon få ai helikopter som vi skulle hatt eee levert eee der det viser seg at vi får f frå flytimar ut av eee investeringa det var altså forventa når vedtaket blei fatta at vi skulle ha fire hundre og tredve flytimar per årsom faktisk så langt,13407.9,13435.6,27.700000000000728,2019-05-07,2019-05-07_proceedings.txt
Stortinget-20190507-095514_13435600_13461400,på riktignok da noen få helikopter er nitti timer eee og det hører med til historia at eee de qqq eee problemene som vi har i forhold til leverandør eee er det samme problem som andre land har både når det gjelder seinereveranser eee faktisk flytid som er lavere enn forutsatt og så videre,på rike ok da nok få helikopter er nitti timar eee og det høyrer med til historia at eee dei eee problema som vi har i forhold til leverandør eee er det same problem som andre land har både når det gjeld sæneleleveranser eee faktisk flytimar lavare enn forutsett og så vidare,13435.6,13461.4,25.799999999999272,2019-05-07,2019-05-07_proceedings.txt
Stortinget-20190507-095514_13461400_13489100,eee det før det er et betydelig større vedlikeholdsbehov og høye driftskostnader eee i forhold til det som var forventa når det gjelder vedlikeholdsteame så er vi vel i dag oppe på femten ganger det forventa vedlikeholdsbehovet president eee komiteen har eee eee tatt eee riksrevisjonens eeen og anbefalinger eee,eee det det er eit betydeleg større vedlikeholdsbehov og høge driftskostnader eee i forhold til det som er forventa når det gjeld vedlikehaldstimar så er vi vel i dag oppe på femten gonger der det forventa vedlikehaldsbehovet president eee komiteen har eee tatt eee riksrevisjonens eee og anbefalingar eee,13461.4,13489.1,27.700000000000728,2019-05-07,2019-05-07_proceedings.txt
Stortinget-20190507-095514_13489100_13517700,eee til eee å gjort dette vårt eee vårt vår innstilling eee vi konstaterer at det er vist en rekke svakheter eee ved prosjektet eee at det i utgangspunktet at den gikk for lite inn i anbefalinger av kontraktsgrunnlaget i totusenogen at kvalitetssikringa ikke fanga opp eee svakhetene at stortingets forutsetninger som jeg har vært inne på,eee til eee og gjort dette vårt vårt vår innstilling eee vi konstaterer at det viser ein rekke svakheiter ved prosjektet eee at eee det er i utgangspunktet at den gjekk for lite inn i anbefalingar av kontrastgrunnlaget i totusenogein at kvalitetssikringa ikkje fanga opp eee svakhetene at stortingets forutsetningar som vi har vore inne på,13489.1,13517.7,28.600000000000364,2019-05-07,2019-05-07_proceedings.txt
Stortinget-20190507-095514_13517700_13547000,ikke er fulgt opp tilstrekkelig at det ikke blei stilt krav om dokumentert driftssikkerhet at garantien for vedlikeholdsvennlighet først gjøres gjeldende fra tjuetjueto at det er mangel på reservedeler at først eee forsvarets logistikkorganisasjon og deretter forsvarsmateriell har godtatt alle forsinkelser og følgelig svekka muligheten for,ikkje er følgt opp tilstrekkeleg at det ikkje blei stilt krav om dokumentert driftssikkerheit at garantien for velikehaldsvennligheit først gjerast gjelde frå tjuetjueto at det mangla på reservedelar at først eee forsvarets logistikkorganisasjon og deretter forsvarsmateriell har godtatt alle forsinkelser og følgeleg svekker muligheten for,13517.7,13547.0,29.299999999999272,2019-05-07,2019-05-07_proceedings.txt
Stortinget-20190507-095514_13547000_13575200,og si opp eee avtalen at manglende kunnskap og forståelse eee i flo og fma har vært gjennomgående eee at eee vedlikeholdsforsyningsstudie eller materiell driftsplan eee og for reservedeler eee da den kom til baiderfoss i eee ikke er på plass eee og en rekke andre punkter som er kritiske og som vi altså gjentar som,å seie opp eee avtalen at manglande kunnskap og forståelse eee i flo og frma har vore gjennomgåande eee at eee eee vedlikehaldsforsyningsstudet eller materielldriftsplan eee og for reservdelar eee der me kom til bedepåsieee ikkje er på plass eee og ein rekke andre punkta som er kritiske og som vi altså gjentar som,13547.0,13575.2,28.200000000000728,2019-05-07,2019-05-07_proceedings.txt
Stortinget-20190507-095514_13575200_13602400,kritikkverdige president det er eee litt spesielt at vi ender opp med et forslag til et konkret eee romertallsvedtak i denne saken denne gangen det er ikke vanlig men det er enstemmighet om at denne gangen er nødvendig og det forslaget sier at stortinget ber regjeringa om å holde stortinget løpende oppdatert om denfølginga av saken,kritikkverdige president er eee litt spesielt at vi endar opp med eit forslag til eit konkret romartalsvedtak i det henne saka det her me gongen eee det er ikkje vanleg men det er einstemmigheit om at det enegangen er nødvendig og det forslaget seier at stortinget ber regjeringa om å halde stortinget løpande oppdatert om denfølging av saka,13575.2,13602.4,27.19999999999891,2019-05-07,2019-05-07_proceedings.txt
Stortinget-20190507-095514_13602400_13630800,herunder komme tilbake til stortinget på egna måte med vurderinger av om alternative helikopter kan være mer formålstennlige for deler av luftforsvarets behov grunna forventa driftskostnader og flytid og eee president eee det er en som sagt et enstemmig forslag til vedtak og det er vårt eee vår forventning at forsvarsministeren nå holder et eee tett eee i tett kontakt med særlig da,herunder kommer tilbake til stortinget på eine måte med vurderingar av om alternative helikopter kan vera meir formålskjennleg for delar alufforsvarets behov grunna forventa driftskostnader og flyte og president eee det er ein som sagt einstemmig forslag til vedtak og det er vårt eee eee vår forventning at forsvarsministeren nå holder eit eee tett eee tett kontakt med særleg da,13602.4,13630.8,28.399999999999636,2019-05-07,2019-05-07_proceedings.txt
Stortinget-20190507-095514_13630800_13659300,forsvars og utenrikskomiteen som er fagkomiteen på det herre saksområdet eee for å se om det er noe vei ut av å komme til bedre løsninger for den framtidige drift enn det riksrevisjonens rapport sånn som han nå foreligger og sånn som innstillinga foreligger gir grunn til å frykte takk president neste taler er representanten svein harberg deretter nils t bjørke qqq,forsvars og utanrikskomiteen som er fagkomiteen på vere saksområdet eee for å se om det er noko veg ut av å komma til betre løysingar for den framtidige i drift enn det riksrevisjonens rapport sånn som han no foreligger og sånn som innstillinga foreligger gir grunn til å fritt takk presentneste talar er representanten svein harberg deretter nils t bjørkest,13630.8,13659.3,28.5,2019-05-07,2019-05-07_proceedings.txt
