file,text_bm,text_nn,start,end,duration,date,proceedingsfile
Stortinget-20191022-095533_1687700_1716200,harlems yrkesutøvelse som advokat er altså personlig og på det tydeligste selv avvist i stortingets åpne høring så er det heller ikke et eee mistillitsforslag til eee til harlem som ligger på bordet fra rødt det er et tillitsforslag til vervet som sivilombudsmann et forslag om å utlyse vervet på ny å konstituere en ombudsmann fra sivilombudsmannens kontor,harlems yrkesutøvelse som advokat er altså personleg og på det tydelegaste sel avvist i stortingets opne høyring så har det heller ikkje eit mistillitsforslag til eee til hal eim som ligg på bordet frå rødt det er eit tillitsforslag til vervet som sivilombodsmann eit forslag om å utlyse vervet på ny e og kor stuerein ombodsmann frå sivilombodsmannens kontor,1687.7,1716.2,28.5,2019-10-22,2019-10-22_proceedings.txt
Stortinget-20191022-095533_1716200_1741500,inntil videre og alle som eee bryr seg om tilliten til sivilombudsmannen som embete bør kunne se at det er problematisk å ansette en kontroversiell kandidat eee i fravær av andre vurderte søkere derfor håper jeg at stortinget vil være med på å utvide prosessen og dermed også være med på å styrke vervets legitimitet,inntil vidare og alle som bryskar om tilliten til sivilombodsmannen som embete bør kunne se at det er problematisk og ansette ein kontroversiell kandidat eee i fråver av andre vurderte søkarar derfor håper eg at stortinget vil vere med på å utvide prosessen og dermed også ver med på å styrke vervets legitimitet,1716.2,1741.5,25.299999999999955,2019-10-22,2019-10-22_proceedings.txt
Stortinget-20191022-095533_1741500_1769000,samtidig vil også be regjeringa om å klargjøre sin posisjon og offisielt trekke forslaget til innskrenkninger av offentlighetsloven og sivilombudsmannsloven sånn at embetet forhåpentligvis blir aktuelt for flere søkere også for de som ikke har prøvd å vingeklippe vervet tidligere men tvert imot jobber for enda mer åpenhet offentlighet,samtidig vil eg altså be regjeringa om å klargjøre sin posisjon og offisielt trekke forslaget til innskrenkingar av offentlegheitslova og sivilombodsmannslova som at embetet for håpentleg vis blir aktuelt for fleire søkarar også for dei som ikkje har prøvd å vingeklippe vervet tidleg med tvert imot jobbar for enda mer openheit offentlegheit,1741.5,1769.0,27.5,2019-10-22,2019-10-22_proceedings.txt
Stortinget-20191022-095533_1769000_1797700,og med det president så tar jeg opp eee rødts forslag da har representanten tatt opp de forslag han refererte til da har ingen flere bedt om ordet og debatten i sak en er dermed avslutta sak to innstilling fra valgkomiteen om valg av nytt varamedlem til stortingets delegasjon til efta parlamentarikerkomiteene og den felles eøsparlamentarikerkomiteen innstilling tjuetre s tjuenitten tjuetjue,og med det president så tar eg opp rødts forslag da har representanten tatt opp dei forslag han refererte til da har ingen flere bedt om ordet og debatten i sak ein er dermed avslutta sak to innstilling frå valkomiteen om valg av nytt varamedlem til stortingets delegasjon til efta parlamentarikerkomiteen og den felles eøs parlamentarikerkomiteen innstilling tjuetre s tjuenitten tjuetjue,1769.0,1797.7,28.700000000000045,2019-10-22,2019-10-22_proceedings.txt
Stortinget-20191022-095533_1797700_1827300,ingen har bedt om ordet og debatten i sak to er dermed avslutta sak tre interpellasjon fra representanten ingrid heggø til olje og energiministeren og presidenten leser interpellasjonen i bygdelag og esamfunn rundt om i noreg er utbygging av vindkraft i ferd med å skape ei mistru og et tap av tillit til sentrale styresmakter som er veldig alvorlige tusenvis av norske borgere føler avmakt raseri og ju fortviling over det de opplever som statlige godkjente overgrep,ingen har bedt om ordet og debatten i sak to er dermed avslutta sak tre interpellasjon frå representanten ingrid heggø til ogle og energiministeren og presidenten les interpellasonen i bygdelag og i samfunn rundt om i noreg er utbygginga av vinkraft i ferd med å skape ei mistru og ei tapa tillit til sentrale styresmakter som er veldig alvorleg tusenvise norske borgarar føler avmakt til raseri og jup fortviling over det dei opplever som statleg godkjente overgrep,1797.7,1827.3,29.59999999999991,2019-10-22,2019-10-22_proceedings.txt
Stortinget-20191022-095533_1827300_1857000,mot natur av mennesker at grunnleggende lovverk som skal verne mennesker dyr og natur blir til sidesett og oversett utbygginger skjer i strid med kommuneplaner med store avvik og endra føresetnader og blir iverksatt før ankebehand ankehåndhaming er ferdig dette gjelder både nye prosjekt og endring av opphavlege konsesjonssøknader folkeopprøret på haramsøy frøya bremanger og i mange andre bygdelag og i samfunn gir sterkt inntrygg,mot natur og menneske at grunnleggende lovverk som skal verne menneske dyr og natur blir tilsidesett og oversett utbyggingar skjer i strid med kommuneplanar med store avvik og endra føresetnader og blir i verksett for ankebehan ankehandsaming er ferdig dette gjeld både nye prosjekt og endring av opphavlege konsesjonssøknader folkeopprøret på haramsøy freia bremanger og i mange andre bygdelag og i samfunn gjer sterkt inntrykk,1827.3,1857.0,29.700000000000045,2019-10-22,2019-10-22_proceedings.txt
Stortinget-20191022-095533_1857000_1875200,og ikke minst hvordan de føler seg behandla av nve og olje og energidepartementet hva er statsråden sitt svar til tusenvis av norske borgere som opplever at statlige vedtak går sterkt ut over helse livskvalitet bu bulyst og tillit så da gir jeg ordet til interpellanten ingrid heggø vær så god,og ikkje minst korleis dei føle seg behandla av nve og und energidepartementet kva er statsråden sitt svar til tusenvis norske borgarar som opplever at statlege vedtak går sterkt ut over helse livskolthet bu bulyst og tillit så da gir det orde til interpellanten ingrid heggø ver så god,1857.0,1875.2,18.200000000000045,2019-10-22,2019-10-22_proceedings.txt
Stortinget-20191022-095533_1884300_1913200,gode president i historien om norge så har tilgangen på fornybar kraft lenge våre norge sitt store fortrinn med utgangspunkt i rein og billig vannkraft har små stader rundt om i distriktsnorge fått stor industri produsert på væres reineste energi på samme vis så er vi nordmenn stolte av vår vakre rein og ubyrarde natur friluftslid,gode president i historia om noreg så har tilgangen på fornybar kraft lenge vore noreg sitt store fortrinn med utgangspunkt i rein og billig vannkraft har småstadar rundt om i distriktsnoreg fått stor industri produsert på verdas reinaste energi på same vis så er vi nord med stolte av vår vakre reine og uberødde natur friluftsliv,1884.3,1913.2,28.90000000000009,2019-10-22,2019-10-22_proceedings.txt
Stortinget-20191022-095533_1913200_1942200,og nærleiken til naturen det er en del av den norske folkesjela og den mest hurtigvoksende næringa i norge er reiseliv basert på naturen vår det jeg setter fokus på i denne interpellasjonen er vindkraftutbygginga at utbygging av vindkraft er i ferd med å skape en nistru og et tap av tillit til sentrale styresmakter som er veldig alvorlig,og nærleiken til naturen det er ein del av den norske folkeskjela og den mest hurtigvoksande næringa i noreg er reiseliv basert på naturen vår det eg set fokus på i denne interpellasjonen er vindkraftutbygginga at utbygginga av vinnkraft er i ferd med å skapa ein mistru og eit tap av tillit til sentrale styresmakter som er veldig alvorleg,1913.2,1942.2,29.0,2019-10-22,2019-10-22_proceedings.txt
Stortinget-20191022-095533_1942200_1971600,samstundes så vil vi ha mer rein energi president nasjonal rammeplan for vindkraft skulle være et kon konfliktdempende tiltak men det var en augeopnard landet rundt så var nesten alle fylker også involvert i planen rammeplanen og utpekingen av området var analyse på et heilt overordna nivå,samstundes så vil vi ha meir rein energi president nasjonal rammeplan for vinnkraft skulle vere eit kon konfliktdempande tiltak men det vart ein augeopnad landet rundt så var nesten alle fylkar også involvert i planen rammeplanen og utpeikinga av området var analyse på eit heilt overordna nivå,1942.2,1971.6,29.399999999999864,2019-10-22,2019-10-22_proceedings.txt
Stortinget-20191022-095533_1971600_2000400,og det utpeke området hadde et samla areal på tjueni tusen kvadratkilometer nå er det i flere måneder våre stor usikkerhet der lokalbefolkninga frykter de ble overkjørt det ble stilt store spørsmålstegn ved regjeringa si håndtering av rammeplanen og prosessen om hver nå når rammeplanen er skrota motstanden i folket,og dei utpeika området hadde eit samla areal på tjueni tusen kvadratkilometerno har det i fleire månader vore stor usikkerheit der lokalbefolkninga fryktar dei vert overkøyrt det vert stilt store spørsmålsteikn ved regjeringa si handtering av rammeplanen og prosessen om kva no når rammeplanen er skrota motstanden i folket,1971.6,2000.4,28.800000000000182,2019-10-22,2019-10-22_proceedings.txt
Stortinget-20191022-095533_2000400_2029200,aker har regjeringa lyst til å lært har regjeringa tek inn over seg hvi før tusenvis av norske borgere føler avmakt raseri og jup fortviling over der det oppleves som statlig godkjente overtramp mot natur og mennesker at grunnleggende lovverk som skal verne mennesker dyr og natur vært tilsidigsett,aukar har regjeringa lysta å lært har regjeringa teke innover seg kvifor tusenvis av norske borgarar føler avmakt raseri og jup fortviling og ver det dei opplever som statleg godkjende overtramp mot natur og menneske at grunnleggjande lovverk som skal verne menneske dyr og natur vert tilsidesett,2000.4,2029.2,28.799999999999955,2019-10-22,2019-10-22_proceedings.txt
Stortinget-20191022-095533_2029200_2058500,vært oversett statsråden har sagt at konsesjonsvilkåra skal gjennomgås på nytt og at søknadene vært sett på vent inntil det kommer avklaringer på konsesjonssystemet men lite sagt om hva nye kriterier skal inn og hva vet vektinga av de ulike kriteriene lite sagt om dette gjelder alle konsesjoner som er innvilga men ikke igangsett,vart oversett statsråden har sagt at konsesjonsvilkåra skal gjennomgåast på nytt og at søknadene vert sett på vent inntil det kom avklaringar på konsesjonssystemet men lite sagt om kvar nye kriteria skal inn og kva vert vektinga av dei ulike kriteriane lite sagt om dette gjeld alle konsesjonar som er innvilga men ikkje i gang sett,2029.2,2058.5,29.299999999999955,2019-10-22,2019-10-22_proceedings.txt
Stortinget-20191022-095533_2058500_2086199,lite er sagt om frysvedtaket også gjaldt utviding og fornying av konsesjoner men statsråden har sagt at det er det stor motstand skal det ikke bli giver konsesjon dersom dette er rett da burde vel alle søknader der det er stor motstand vært avslått nå istedenfor at de v sett på menn,lite er sagt om frysvedtaket også gjeld utviding og fornying av konsesjonen men statsråden har sagt at der det stor motstand skal det ikkje bli give konsesjon dersom dette er rett då burde vel alle søknader der det er stor motstand verte avslått nå i staden for at dei v sett på ven,2058.5,2086.199,27.69900000000007,2019-10-22,2019-10-22_proceedings.txt
Stortinget-20191022-095533_2086199_2114100,og så må det eventuelt søkes på nytt etter nye kriterier da ville i alle fall regjeringa synliggjort at den faktisk har lytta til folkeopprøret til alle som har sagt nei nå sitter de fleste med ei kjensle av at regjeringa har kjøpt seg et pusterom og at en sitat med manglende tillit og uroer over om en faktisk vært lytta til i praksis hs statsråden er sitert rett,og så må det eventuelt søkast på nytt etter nye kriterier då vil det i alle fall regjeringa synleggjort at ein faktisk har lytta til folkeopprøret til alle som har sagt nei no sit de fleste med ei kjensle av at regjeringa har kjøpt seg eit puste rom og at ein sit att med manglande tillit og uroa over om ein faktisk vert lytta til i praksis vs statsråden sitert rett,2086.199,2114.1,27.90099999999984,2019-10-22,2019-10-22_proceedings.txt
Stortinget-20191022-095533_2114100_2137200,i nrk så er det framleis grunn til uro for der sier han sitat at han ser et behov for å gjøre noe med konsesjonssystemet nettopp for å gjøre et godt system enda bedre for å forebygge konflikter som vi har sett det har vært rundt enkelte utbygginger av vindkraft sitat slutt et godt system bedre,i nrk så er det framleis grunn til uro for der seier han sitat at han ser eit behov for å gjere noko med konsesjonssystemet nettopp for å gjere eit godt system enda betre for å forebygge konflikter som vi har sett det har vore rundt enkelte utbyggingar av vindkraft sitat slutt eit godt system betre,2114.1,2137.2,23.09999999999991,2019-10-22,2019-10-22_proceedings.txt
Stortinget-20191022-095533_2137200_2166600,utsagner vitner litt om at statsråden har teke inn over seg den massive kritikken fra folk som påpeker at det føler seg overkjørede og maktedslausedet har skjedd ei markant endring i folk sitt syn på vindkraft spesielt det siste år halvåret den sterke motstanden og kritikken av ulike vindkraftprosjekt viser at det er god lokal forankring av potensielle prosjekt det er både riktig og viktig,utsagna vitnar lite om at statsråden har teke innover seg den massive kritikken frå folk som påpeikar at det føler seg overkøyrde og makteslausedet har skjedd ei markant endring i folk sitt syn på vinnkraft spesielt det siste år halvåret den sterke motstanden og kritikken av ulike vinnkraftbrodsjekt viser at ei god lokal forankring av potensielle prosjekt det er både riktig og viktig,2137.2,2166.6,29.40000000000009,2019-10-22,2019-10-22_proceedings.txt
Stortinget-20191022-095533_2166600_2191700,president det har skjedd ei rivende utvikling innen vindmølle på storleik på arealbruk det godteker store avvik og endrer forutsetninger fra opprinnelige konsesjonssøknader mange stader befolkninga føler seg lurt når det i s i si tid vart sagt ja til lyktestolper og de får et eifeltårn i fjellheimen sin,president det har skjedd ei rivande utvikling innan vinmølle på storleik på arealbruk det er godtek store avvik og endra forutsetningar frå opprinnelige konsesjonssøknader mange stadar befolkninga føler seg lurt når dei s i si tid vart sagt ja til lyktestolpar og dei får eit eifeltonn i fjellheimen sen,2166.6,2191.7,25.09999999999991,2019-10-22,2019-10-22_proceedings.txt
Stortinget-20191022-095533_2191700_2220900,derfor må det forettakes en gjennomgang av regelverket knytta til etablering av vindkraft med spesiell fokus på lokal forankring og innflytelse denne gjennomgangen bør også suppleres med en gjennomgang av de lokale ringverknadene av anlegget det er viktig for den nasjonale energidebatten om framtidas energibehov vært utreda her trengs det mer kunnskap jeg er som sagt glad for at rammeplanen var skrota,derfor må det få retakast ein gjennomgang av regelverket knytt til etablering av vinnkraft med spesielt fokus på lokal forankring og innflytelse denne gjennomgangen bør også supplerast med ein gjennomgang av dei lokale ringverknadene av anlegga det er viktig for den nasjonale energidebatten om framtidas energibehov vert utreda her trengst det meir kunnskap eg er som sagt glad for at rammeplanen vart skrota,2191.7,2220.9,29.200000000000273,2019-10-22,2019-10-22_proceedings.txt
Stortinget-20191022-095533_2220900_2248900,men nå må vi få en samla helskaplig plan der vind vatn og nett vært sett i en sammenheng naturen må og få en egenverdi for det som uroer når rammeplanen vært skrinlagt er om man får et nytt et bit for bit utbygging og der en framleis godtekr at områder til vindkraft vært valgt av utbyggeren som inngår avtale med grunneierne lenge før konsesjonssøknaden vært innsendt,men no må vi få ein samla heilskapleg plan der vind vatten og nett vert sett i eins samanheng naturen må og få ein eigen verdi for det som er uroa når rammeplanen vert skrinlagt er om ein får eit nytt eit dit forbitutbygging og der ein framleis skotek at område til vinnkraft vert valt av utbyggaren som inngår avtale med grunneigarane lenge før konsesjonssøkna vert innsend,2220.9,2248.9,28.0,2019-10-22,2019-10-22_proceedings.txt
Stortinget-20191022-095533_2248900_2278900,når en i tillegg vet at flere utbygginger skjer i strid med kommuneplaner med store avvik og endra føresetnader og anleggsverkstert iverksett før før anker handsaming er ferdig ja da vitner ikke dette om god offentlig kontroll president eller om et godt system president i bygdelag og øysamfunnet rundt om i norge utbygging av vindkraft i ferd med å skape en mistru og tap av tillit,når denne tillegg veit at fleire utbyggingar skjer i strid med kommuneplanar med store avvik og endra føresetnader og anleggsverksem vert i verksett før før ankehandsaming er ferdig ja då vitnar ikkje dette om god offentleg kontroll president eller om eit godt systempresident i bygdelag og øysamfunn rundt om i noreg er utbygginga av vinnkraft i ferd med å skapa ei mistru og tap av tillit,2248.9,2278.9,30.0,2019-10-22,2019-10-22_proceedings.txt
Stortinget-20191022-095533_2278900_2302700,og hvordan skal folk få tillit til at de vært hørt hvis frysavgjera som er innvilga har mange unntak i tjuetjue og tjuetjueen går svært mange konsesjoner ut disse konsesjonene givende under heilt annet kunnskapsgrunnlag og andre føresetnader og burde etter mitt syn termineres når konsesjonstida utgår,og korleis skal folk få tillit til at dei vert høyrt viss frysavgjerar som er innvilga har mange unntak i tjuetjue og tjuetjueein går svært mange konsesjonar ut desse konsesjonane er givne under heilt anna kunnskapsgrunnlag og andre føresetnader og burde etter mitt syn terminerast når konsesjonstida utgår,2278.9,2302.7,23.799999999999727,2019-10-22,2019-10-22_proceedings.txt
Stortinget-20191022-095533_2302700_2331200,disse konsesjonene må i alle fall ikke automatisk videreføres og utvides etter gamle konsesjonsvilkår er statsråden sammen med det president et en sitt naturpanel har publisert klare åtvaringer om at endra arealbruk er den største trusselen mot artsmangfoldet på jorda en større trussel enn klimaendringene og det er ikke bare at vindmøllene vår er større planeringer rundt hvert,desse konsesjonane må i alle fall ikkje automatisk vidareførast og utvidast etter gamle konsesjonsvilkår er statsråden sa med det president fn sitt naturpanel har publisert klare åtvaringar om at endra arealbruk er den største trusselen mot arts mangfaldet på jorda ein større trussel enn klimaendringane og det er ikkje berre at vindmølle er vårt større planering rundt kvart,2302.7,2331.2,28.5,2019-10-22,2019-10-22_proceedings.txt
Stortinget-20191022-095533_2331200_2358200,turbintårn er nå om lag ei halv fotballbane og så kjem tilkomstveg og oppstillingsplass det er store og svært synlige naturinngrep vi snakker om for å ta et eksempel arealer som er omsøkt til vindkraft langs sogn i fjorden er på førtitre kvadrat kilometer de er over fem tusen fotballbane det er enoral,turbintoren er no omlag halv fotballbane og så kjem tilkomstveg og oppstillingsplass det er store og svært synlege naturingrep vi snakkar om for å ta eit eksempel arealet som er omsøkt til vinnkraft langs sognefjorden er på førtitre kvadratkilometer det er over fem tusen fotbollbaner det er enoral,2331.2,2358.2,27.0,2019-10-22,2019-10-22_proceedings.txt
Stortinget-20191022-095533_2358200_2383700,og hva sitter han att med av ro lokale ringvirknader aukanettleiet utbygging av vindkraft på guleslettene i bri mangel ga i auka nettleie fordelt på innbyggerne til nettselskaper med hundre og sytti millioner og de fleste har fått med seg at eiendomsskatten har denne regjeringa sett under press like en hva som inngår av produksjonsutstyr i skattegrunnlaget,og kva sit han attmed av ro lokale ringverknadar aukar nettleiget utbygging av vinkraftog gulesletteni bremanger ga ei auka nettleige fordelt på innbyggjarane til nettselskapet med hundre og sytti millionar og dei fleste har fått med seg at eigedomsskatten har denne regjeringa sett under press like eins kva som inngår av produksjonsutstyr i skattegrunnlaget,2358.2,2383.7,25.5,2019-10-22,2019-10-22_proceedings.txt
Stortinget-20191022-095533_2383700_2411400,folk opplever at en får lite igjen til fellesskapet for å stille naturen til rådvelde og du auker motstanden president det er unisont at en ikke skal bygge i urøren natur det er det einig i men jeg vil og slå et slag for de som har stilt naturen sin til disposisjon for fellesskapet tidligere for eksempel ved vannkraftutbygging den naturmangfoldet netter i ferd med å komme tilbake så rein natu eee burger gro,folk opplever at ein får lite gjen til fellesskapet for å stilla naturen til råvelde og då aukar motstanden president det er det unner sont at ein ikkje skal byggje i urørd natur det er deg einige i men ein vil og slå eit slag for dei som har stilt naturen sin til disposisjon for fellesskapet tidlegare for eksempel ved vannkraftutbygging der naturmangfaldet netter i ferd med å komme tilbake så ei natu er byrje og gro,2383.7,2411.4,27.700000000000273,2019-10-22,2019-10-22_proceedings.txt
Stortinget-20191022-095533_2411400_2440700,her er naturen enda mer sårbar også her må innbyggerne sine krav til nok er nok på gjennomslag konsekvensene av vindkraftutbygging må synliggjøres for befolkninga der blei nok nasjonal rammeplan på mange måter en ane åpner for mange for det har skjedd så store endringer i befolkninga sitt syn på vindkraft bare det siste halvåret det er synliggjort at inngrepet og føreslegende ar areal er enorme stor leiker,her er naturen enda meir sårbar også her må innbyggarane sine krav til nok er nok få gjennomslag konsekvensane av vindkraftutbygging må synleggjerast for befolkninga der blei nok nasjonal rammeplan på mange måtar ein augna opnar for mange for det har skjedd så store endringar i befolkninga sitt syn på vinnkraft berre det siste halvåret det er synleggjort at inngrepa og føreslegne ar areal er enorme storleikar,2411.4,2440.7,29.299999999999727,2019-10-22,2019-10-22_proceedings.txt
Stortinget-20191022-095533_2440700_2470200,og det er mange paradoks ved vindkraftutbygging kan en nytte graven maskiner i myr melderen bonde ikke kan dyrke en eneste ny kvadratmeter myr utslipp veter noe av begge deler hvor den krevde total rekneskap på coto virale utbygginger vi fører skatte og avskrivningsreglene så veldig forskjellig på vatn og vin president arbeiderpartiet har lenge etterlyst en heilskaplig samla plan,og det er mange paradoks eee ved vindkraftutbygging kan ein nytte gravemaskinar i myr medan ein bonde ikkje kan dyrke ein einaste ny kvadratmeter myr utslepp verte no av begge delar burde ein krev totalrekneskap på sehoto ved alle utbyggingar kvifor er skatte og avskrivingsreglane så veldig forskjellig på vatnen og vind president arbeidarpartiet har lenge etterlyst ein heilskapleg samla plan,2440.7,2470.2,29.5,2019-10-22,2019-10-22_proceedings.txt
Stortinget-20191022-095533_2470200_2484500,der vind vatn og nett vært sett i sammenheng vil statsråden ta denne utfordringada er neste ta taler statsråd kjell,der vind vatten og nett vert sett i samanheng vil statsråden ta denne utfordringadå er neste ta talar statsråd kjell,2470.2,2484.5,14.300000000000182,2019-10-22,2019-10-22_proceedings.txt
Stortinget-20191022-095533_2490900_2519600,statsråd freiberg vær så god president la meg innledningsvis få understreke at jeg tar engasjementet rundt vindkraft eee på største alvor og på bakgrunn av høringa av forslaget om nasjonal rammer for vindkraft kraft så har regjeringa nylig varsla at vi ikke kommer til å gjennomføre en nasjonal ramme med de utpeka områdene eee for ny vindkraft,statsråd friberg ver så god president la meg innledningsvis få understreke at dei har det engasjementet rundt vindkraft eee på største alvor og på bakgrunn av høyringa av forslaget om nasjonal ramme for vinkrikraft så har regjeringa nyleg varsla at vi ikkje kommer til å gjennomføre ei nasjonal ramme med dei utpeika områda eee for ny vindkraft,2490.9,2519.6,28.699999999999818,2019-10-22,2019-10-22_proceedings.txt
Stortinget-20191022-095533_2519600_2546900,så er det som eee representanten heggø viser til der jeg også varsla endringer i konsesjonsbehandlinga som jeg kommer tilbake til vindkrafta som nå bygges som nå bygges ut det er et resultat av en villet politikk i to tiår så er det sånn at forskjellige regjeringer og storti lagt til rette,så er det som eee representanten heggø vise til der eg også varslar endringar i konsesjonsbehandlinga som eg kommer tilbake til vindkrafta som ny bygges som no byggast ut det er eit resultat av ein villa politikk i to tiår så er det sånn at forskjellige regjeringar og storti lagt til rette,2519.6,2546.9,27.300000000000182,2019-10-22,2019-10-22_proceedings.txt
Stortinget-20191022-095533_2546900_2576100,for utbygging av vindkraft og jeg vil minne om at de rødgrønne regjeringspartiene allerede i totusenogfem hisoriamoria erklæringa foreslo at regjeringa vil innføre et pliktig grønt elsertifikatmarked regjeringa stoltenberg ii fremma i totusenogelleve forslag om et felles elsertifikatmarked sammen med sverige el,for utbygging av vindkraft og eg vil minne om at dei lagrene regjeringspartia allereie i totusenogfem i soria modiarklæringa foreslo at regjeringa vil innføre eit pliktig grønt eller setvikatmarked regjeringa stoltenberg to fremma i totusenogelleve forslag om eit felles elsetvikatmarked samans med sverige eller,2546.9,2576.1,29.199999999999818,2019-10-22,2019-10-22_proceedings.txt
