file,text_bm,text_nn,start,end,duration,date,proceedingsfile
Stortinget-20191213-085502_3817300_3847300,har president i denne salen fordeler vi milliarder til gode formål vi har et godt velferdssamfunn som tar vare på de som faller utafor det ønsker vi alle at vi fortsatt skal ha men i denne salen skaper vi ikke verdier det gjør tusenvis av grundere vanlige arbeidsfolk og bedriftseiere som kjent må verdier skapes før de kan deles noen er super ikke men de fleste bedriftseiere er ikke det de driver små og mellomstore bedrifter de skaper arbeidsplasser og gir oss store skatteinntekter representanten sa at eee politikk er å ville,akre president i denne salen fordeler vi milliarder til gode formål gjer eit godt velferdssamfunn som tar vare på dei som får utanfor det ønsker vi alle at vi fortsatt skal ha men i denne salen skapar vi ikkje verdier det gjer tusenvis agrundre vanleg arbeidsfolk og bedriftseiere som kjent må verdier skapes før di kan delast nokon super ikkje men dei fleste bedriftseigar er ikkje det dei driv for små og mellomstore bedrifter dei skaper arbeidsplassar og gir oss store skatteinntekter representanten sa at eee politikk er å ville,3817.3,3847.3,30.0,2019-12-13,2019-12-13_proceedings.txt
Stortinget-20191213-085502_3847300_3876300,når sv sitter da da i sitt alternative statsbudsjett vil øke skatten med nesten treogtyve milliarder kroner trur hun da at det vil føre til at flere private bedrifter vil startes og vil flere bedrifter lykkes med sånne klamme skatteøkninger for eee bedrifter rundt omkring i landet president kaski president det som også er en eee jeg kan skal si ofte gjentatt eee sannhet eee om man vil i den her salen her det er at det er bare næringslivsledere det er kapitalistene som skaper verdier,når sv sit da i sitt alternative statsbudsjett vil auke skatten med nesten tre og tove milliardar kroner trur dei da at det vil føreta at fleire private bedrifter vil startes og vil flere bedrifter lykkast med sånne klamme skatteøkninger for eee bedrifter rundt omkring i landet presidentskipresident det som og er ein ganske seg ofte gjentatt eee samheit eee om ein vil i denne salen her det er at det er berre næringslivsledere det kapitalistane som skaper verdier,3847.3,3876.3,29.0,2019-12-13,2019-12-13_proceedings.txt
Stortinget-20191213-085502_3876300_3902800,president fra høyresida så får vi høre at du må liksom være en rik jernemann på vestlandet for å skape en verdi president vi i sv vi mener at det er folk som jobber ute i norge som skaper verdiene det er arbeiderne som skaper verdier derfor så senker sv skatt på inntekt på arbeid i det budsjettet her mens vi øker skatt på arv vi øker skatt på formueet,president for å heie sidan så får vi høyre at du må liksom vere ein lik gjerne mann på vestlandet for å skape ein verdi president vi i sv vi meiner at det er folk som jobbar ute i noreg som skapar verdiane det arbeidarane som skaper verdier derfor så senker sv skatt på inntekt på arbeid i det budsjettet her mens vi auker skatt på arv vi aukar skatt på format,3876.3,3902.8,26.5,2019-12-13,2019-12-13_proceedings.txt
Stortinget-20191213-085502_3902800_3931600,viljen innebærer at du får et skattesystem som faktisk bidrar til verdiskapning som faktisk innebærer at du også kan tilrettelegge for flere arbeidsplasser og ikke bare sylte ned penger i eiendom som vi ser at skjer i norge i dag og jeg president eee qqq sy så opplever at vi hadde mye verdiskapning og at det også ble skapt arbeidsplasser under den rødgrønne regjeringa når skattesystemet var mer omfordelende enn i dagneste replikant er abid q raja,vil innebere at du får eit skattesystem som faktisk bidrar til verdiskaping som faktisk inneber at du også kan tilrettelegge for fleire arbeidsplassar og ikkje berre sylte ned pengar i eigedom som vi ser at skjer i noreg i dag og eg president eee qqq som opplevde at vi hadde nye verdiskaping og at det også blei skapte arbeidsplassar under den raudgrøne regjeringa når skattesystemet var meir omfordelande enn i dag neste replikant er abid eee kyrete,3902.8,3931.6,28.799999999999727,2019-12-13,2019-12-13_proceedings.txt
Stortinget-20191213-085502_3931600_3957200,deretter trude brosvik raja ja president eee i sitt alternative budsjett eee eee så øker svs skatter og avgifter med tjueto komma åtte milliarder kroner det vil være veldig lammende for norsk næringsliv det er veldig dårlig samtidig er sv opptatt av grønn omstilling og det er veldig bra,deretter trude bråsvikrajaja president eee i sitt alternative budsjett eee eee så økar sv skattedaifter med tjueto komma åtte milliardar kroner det vil vere veldig lamne for norsk næringsliv det er veldig dårleg samtidig er sv opptatt av grøn omstilling og det er veldig bra,3931.6,3957.2,25.59999999999991,2019-12-13,2019-12-13_proceedings.txt
Stortinget-20191213-085502_3957200_3985700,men hvordan tenker representanten at det grønne skiftet skal gjennomføres uten økonomisk vekst i privat sektor og dermed uten evne til å satse på den teknologien som vi jo nå trenger for å nå parisavtalen kaski president jeg er oppriktig overraska hvis representanten raja mener at hvis bare eee kjell inge røkke blir nullskatteyter eller spetalen betaler mindre i skatt så får du mer grønt skifte i norge at det er det som skal til,me boris tenker representanten at det grøne skiftet skal gjennomførast utan økonomisk vekst i privat sektor og dermed utan nemne til å satse på den teknologien som vi jo nå treng for å nå parisavtalens president eg er oppriktig å overraska viss representanten redere meiner at viss bare eee kjell inge røkke blir nullskatteyter eller spetalen betaler mindre i skatt så får du meir grønt skifte i noreg alt det er det som skal til,3957.2,3985.7,28.5,2019-12-13,2019-12-13_proceedings.txt
Stortinget-20191213-085502_3985700_4014000,at vi må gi store skattegaver til de aller rikeste i samfunnet de aller øverste på toppen for å lykkes med det grønne skiftet det er en grov misoppfatning president eee det som skal til for å lykkes med det grønne skiftet det å tørre å satse på klimaløsninger det å stimulere til teknologiutvikling det å gjøre nysene om til et stort investeringsbank for grønne løsninger i næringslivet det å eee tørre å,at vi må gi store skatte gaver til dei aller rikaste i samfunnet dei aller verste på toppen for å lykkast med det grøne skiftet det er ein grov misoppfatning president eee det som skal til for å lykkast med det grøne skiftet det er å høyra å satse på klimaløysingar det å stimulere til teknologiutvikling det å gjere nysne om til eit stort investeringsbank for grønne løysingar i næringslivet det og eee tørre og,3985.7,4014.0,28.300000000000182,2019-12-13,2019-12-13_proceedings.txt
Stortinget-20191213-085502_4014000_4037900,å satse på treforedlingsindustrien i norge å ta i bruk hele verktøykassa det er ikke å bruke samfunnets midler fellesskapets midler til skattegaver til de på toppen som den her regjeringa har valgt å gjøre hvis det hadde vært en suksessfaktor så skulle vi tro at de tjuefem milliarder kronene som er gitt i skattekutt hovedsakelig til de aller rikeste hadde gitt større utslippskutt i norgesiste replikant er trude brosvik,og satse på t foredlingsindustrien i noreg å ta i bruk heile verktøykassa det er ikkje å bruke samfunnets mindler fellesskapets minde til skattegaver til dei på toppen som den her regjeringa har valt å gjere viss det hadde vore ein suksessfaktor så skulle vi tru at dei tjuefem milliardar kronene som har gitt i skattekutt hovudsakleg til dei alle rikeste hadde gitt større utsleppskutt i noregsiste replikant er eee trude brossvik,4014.0,4037.9,23.90000000000009,2019-12-13,2019-12-13_proceedings.txt
Stortinget-20191213-085502_4045600_4070100,vik president eee jeg syns egentlig denne skattedebatten bygger litt på hakkiplater om eee skattelette til de rikeste eee og den viser bakover i tid dette er første eee året der krf er med i regjeringa og er med å legge dette budsjettet,brossvik president eee eg synest eigentleg denne skattedebatten bygger litt på hakkiplata om eee skattelette til dei rikaste eee og den viser bakover i tid dette er første eee året der krf er med i regjeringa og er med og legg dette budsjettet,4045.6,4070.1,24.5,2019-12-13,2019-12-13_proceedings.txt
Stortinget-20191213-085502_4070100_4098700,innrømmer sv at det ikke er netto skatteauke i dette budsjettet eller hva meiner sv er netto skatteauken i budsjettet for tjuetjue kaski eee president når eee den her regjeringa eee qqq ulike medlemmer holdt på å si siden tjuetretten har gitt skattekutt til eee landets aller rikeste så fortsetter det jo å skje sjøl om det ikke kommer nye skattekutt på toppen,innrømmer sv at det ikkje er netto skatteauke i dette budsjettet eller kva meiner sv er netto skatteauken i budsjettet for tjuetjue kaski president når eee den her regjeringa eee me ulike medlemer haldt på seg sidan tjuetretten har gitt skattekutt til eee landets alle rikeste så fortsetter det jo å skje sjøl om det ikkje kommer nye skattekutt på toppen,4070.1,4098.7,28.59999999999991,2019-12-13,2019-12-13_proceedings.txt
Stortinget-20191213-085502_4098700_4116399,for hvert eneste år nå så får de s de aller rikeste en mindre skatteregning enn det de fikk tidligere hvert eneste år så summerer det her seg opp så når eee vi kan summere opp til sammen nå at de aller de tusen aller rikeste i norge med størst formue de rike president har,for kvart eine står no så får dei s dei alle rikeste ein mindre skatterekning enn det dei fekk tidlegare kvart einast år så summerer det her seg opp så når eee vi kan summere opp til saman nu at dei aller tusen aller rikeste i noreg med størst formoder rike president tar fådd,4098.7,4116.399,17.699000000000524,2019-12-13,2019-12-13_proceedings.txt
Stortinget-20191213-085502_4116399_4138500,eee en milliard kroner i sammen til skattekutt så vil jo det fortsette å summeres opp også framover det er derfor sv fortsatt er opptatt av det og det kommer vi til å fortsette å være fordi for hvert eneste år så får fellesskapet inn mindre inntekter som vi kunne bruke til sykehus som er krovt underfinansiert til kommunene som sitter og kutter i disse dager i skolebudsjett og i budsjett til helse og omsorg,eee ein milliard kroner i saman til skattekutt så vil jo det fortsette å summerast opp også fremholder eg derfor sv fortsatt er opptatt av det og det kommer vi til å fortsette å vere fordi for kvart eineste år så få ei fellesskapet i mindre inntekter som vi kunne bruke til sykehus som er kråvd underfinansiert til kommunane som sit og kuttar i desse dagar i skolebudsjett og i budsjett til helse og omsorg,4116.399,4138.5,22.100999999999658,2019-12-13,2019-12-13_proceedings.txt
Stortinget-20191213-085502_4138500_4166200,vi kunne ha brukt de pengene på å unngå de usosiale kuttene som også krf har vært med å signere under på gjennom de siste årene president og det hadde vært en bedre satsingda er replikkordskiftet omme vi går tilbake til talerlisten og neste taler er abid q raja raja eee presidenonomisk frihet er avgjørende,vi kunne ha brukt dei pengane på å unngå dere sosiale kuttane som også krf har vore med å signere under på gjennom dei siste åra president og det hadde vore ein betre satsingdet er replikkordskiftet omme vi går tilbake til talerlisten og neste talar er abid kureserajaeee presidenonomisk frihet er avgjerande,4138.5,4166.2,27.699999999999818,2019-12-13,2019-12-13_proceedings.txt
Stortinget-20191213-085502_4166200_4194300,for å la folk eee leve selvvalgte liv for å kunne leve et liv i reell frihet et liv der vi bestemmer selv hvilken yrkesvei vi skal ta hvor vi skal bo og hvordan vi skal bruke fritiden vår friheten til å leve selvvalgte liv får vi bare i samfunn der økonomisk frihet er garantert yrkesvalg og karriere er utover familielivet en av de viktigste delene av livet til de aller fleste vi tilbringer mer tid på jobb enn noen annen arena og det vi gjør bidrar til å definere også mennesker,for å la folk eee leve sjølvalt liv for å kunne leve eit liv i reell frihet eit liv der vi bestemmer sekken yrkesveg vi skal ta vore vi skal bu og korleis vi skal bruke fritida vår friheten til å leve selvate liv får vi berre i samfunn der økonomisk frihet er garantert yrkesval og kariere er ut over familielivet ein av dei viktigaste delen av livet til dei aller fleste vi tilbringer meir tid på jobb enn nokon annan arena og det vi gjer bidrar til å definere oss som mensker,4166.2,4194.3,28.100000000000364,2019-12-13,2019-12-13_proceedings.txt
Stortinget-20191213-085502_4194300_4220900,det har alltid vært enklere for folk med mer privileg privilegert bakgrunn å starte egen bedrift satse på egen ide de har tatt utdanningen og kapitalen som skulle til og samtidig vet vi at talent ikke fordeles etter familiebakgrunn vi er derfor avhengig av å utløse kreativiteten i hele befolkningen hvis vi skal få til et næringsliv som skaper muligheter for folk og som driver gjennom det grønne skiftet vi nå står midt oppi venstre har alltid være,det har alltid vore enklare for folk med meir privile priviligert bakgrunn å starte eigen bedrift satse på ein eigen ide dei har hatt utdanninga og kapitalen som skulle til og samtidig veit vi at talent ikkje fordelast etter familiebakgrunn vi har derfor avhengig av å utløyse kreativiteten i heile befolkninga viss vi skal få til eit næringsliv som skaper muligheter for folk og som driv gjennom det grøne skiftet vi nå står midt oppe i venstre har alltid vore,4194.3,4220.9,26.599999999999454,2019-12-13,2019-12-13_proceedings.txt
Stortinget-20191213-085502_4220900_4248300,eee skatte og avgiftspolitikken skal legge til rette for tilgangen til å starte egen bedrift og satse på egne ideer vi vil ikke at muligheten til å forfølge egne ambisjoner drømmer skal være forbeholdt de få det skal ikke være et klasseskille knyttet til å starte for seg selv det skal heller ikke være enklere å flytte utenlands for å ta forretningsideer videre norge skal eee være verdens mest grundervennlige destinasjon det er grunnen til at venstre har stått på for deonsordningen vi i dag har,eee skatte og avgiftspolitikken skal ligge til rette for tilgangen til å starte eigen bedrift og satse på eigne ider vi vil lik at muligheten til å forfølgje eigne ambisjonar drømmer skal vere forbalt i få det skal ikkje vere eit klasseskilje knytt til å starte for seg selv det skal heller ikkje vere enklare å flytte utanlands for å ta forretningsidear vidare noreg skal eee vere verdas mest grundervennlege destinasjon det er grunn til at venstre har stått på for dejonsordninga vi i dag har,4220.9,4248.3,27.400000000000546,2019-12-13,2019-12-13_proceedings.txt
Stortinget-20191213-085502_4248300_4272600,vi har møtt stor motstand underveis men vi vet at det er avgjørende instrument for å sikre at det er i norges eee framtidas ideer at det er i norge framtidas ideer blir skapt og videreutviklet nå får vi doblet opsjonsfordelen per ansatt og vi har utvidet eee antall ansatte i bedrifter som eee omfattes av ordninga dette er gode endringer eee men vi er langt fra i mål opsjonsordningen er,vi har møtt stor motstand under vegs men vi veit at det er avgjerande instrument for å sikre at det er i noregs framtidas ider at her i noreg framtidas ideer blir skapt og vidareutvikla nå får vi doblet opsjonsfordelen per ansatt og vi har utvidet antal ansatte i bedrifter som omfattas av ordninga dette er gode endringer eee men vi er langt frå i mål opsjonsordninga er,4248.3,4272.6,24.300000000000182,2019-12-13,2019-12-13_proceedings.txt
Stortinget-20191213-085502_4272600_4297100,det viktigste virkemiddelet vi har for å sikre at innovasjonsbedrifter i oppstartfasen kan tiltrekke seg og holde på talentene vi har møtt mange talesegrundere eee som kan fortelle at for å få og holde på de beste folkene i en tid der de ennå ikke går med overskudd og kan betale må de kunne tilby dem noe annet det samme gjelder skattefunn president en ordning opprettet for å gi støtte til innovasjon i privat næringsliv,det viktigaste verkemiddelet vi har for å sikre at innovasjonsbedrifter i oppstartfasen kan tiltrekke seg og halde på ta rentene vi har møtt mange talelse grundere eee som kan fortelje at for å få å halde på dei beste folka i ein tid der dei ennå ikkje går med overskot og kan betale må dei kunne tilby det no ant det same gjeld skattefunnet president er en ordning oppretta for å gi støtte til innovasjon i privat næringsliv,4272.6,4297.1,24.5,2019-12-13,2019-12-13_proceedings.txt
Stortinget-20191213-085502_4297100_4321100,dette er en ordning som er åpen for store og små bedrifter men vi styrker nå ordningen med hundre og femti millioner endringen innebærer en økt timesats fra seks hundre til sju hundre kroner og en forenkling av satser og kontrollmekanismer alt dette kommer først og fremst små og mellomstore bedrifter til gode som mer eee eee enn store vil også kjenne på effekten av mindre byråkrati og økt timesats,dette er ei ordning som er open for store og små bedrifter men vi styrker nå ordninga med hundre og femti millionar endringa inneber ein økt eee timesats frå seks eee hundre til sju hundre kroner og ein forenkling av satsar og kontrollmekanismer alt dette kommer først og fremst eee små og mellomstore bedrifter til gode som meir er er ein store vil også kjenne på effekten av mindre byråkrati og økt timesats,4297.1,4321.1,24.0,2019-12-13,2019-12-13_proceedings.txt
Stortinget-20191213-085502_4321100_4348800,venstresida i i denne salen kritiserer gjerne det de omtaler som skattekutt til de rikeste men å satse målrettet på grundere slik regjeringen gjør med disse grepene er bra for hele samfunnet staten har en viktig rolle men det er i det private næringsliv at verdiene skapes og innovasjon skjer vi som politikere eee skal skape rammen for at innovasjon eee kan lykkes det gjør vi ved å følge d eee utbedringene,venstresida i i denne salen kritiserer gjerne det dei omtalar som skattekutt til dei rikeste men å satse målrettet på grunnre slik regjeringa gjer med desse grepa er bra for heile samfunnet staten har ei viktig rolle men det er i det private næringslivet at verdiane skapast og innovasjon skjer vi som politikarar eee skal skape rammen for at innovasjonen eee kan lykkast det gjer vi ved å følge d eee utbetringane,4321.1,4348.8,27.699999999999818,2019-12-13,2019-12-13_proceedings.txt
Stortinget-20191213-085502_4348800_4377900,president mange av oss i denne salen eee og særlig eee regjeringspartiene har besøkt veldig mange innovasjonsbedrifter både i distriktene og i byene og de bidrar med millioner eee som betaler nettopp for eee offentlige skoler for sykehus i fellesskapet de skaper klimavennlige løsninger og bygger arbeidsplasser for alle de som har n drøm og jobber med noe som gjør verden til et bedre sted å være de er arbeidssomme eee de er ydmyke og de er idealistiske er hardt arbeid,president mange av oss i denne salen eee og særlege eee regjeringspartia har besøkt veldig mange innovasjonsbedrifter både i distrikta og i byane og dei bidrar med millionar eee som betaler nettopp for eee eee offentlege skoler for psykisk til fellesskapet dei skapar klimavennlege løysingar og bygger arbeidsplassar for alle dei som har ein drøm å jobbe med noko som gjer verda til eit betre stad å vere det gjer arbeidssomme eee dei er ydmjuke og dei er idealistiske er vårt arbeid,4348.8,4377.9,29.099999999999454,2019-12-13,2019-12-13_proceedings.txt
Stortinget-20191213-085502_4377900_4406300,de har ikke alltid tid til å jobbe på stortinget der de er der ute for å skape verdier derfor eee er det veldig viktig at vi har et spesielt ansvar for å ivareta deres sak gjøre deres hverdag enklere det er frihetspolitikk satt i praksis og en av grunnene til at jeg er stolt over å kalle venstre mitt parti vi kan ikke evaluere opsjonsordningen nå eller utvidelsen av skattefunn ennå men vi kan si noe om dagens grunderpolitikk som venstre har stått inne for så langt vi kjempet igjennom eee,dei har ikkje alltid tid til å lobbe på stortinget der dei gjer der ute for å skape verdiar derfor eee er det veldig viktig at vi har eit spesielt ansvar for å ivareta deira sak gjere deras kvardag enklare det er frihetspolitikk sett i praksis og ein av grunnane til at eg er stolt over å kalle venstre mitt parti vi kan ikkje evaluere opsjonsordninga nå eller utvidelsen av skattefunnet erna men vi kan seie noko om dagens grunde politikk som venstre har stått innanfor så langt vi har kjempe gjennom eee,4377.9,4406.3,28.400000000000546,2019-12-13,2019-12-13_proceedings.txt
Stortinget-20191213-085502_4406300_4433400,presåkornfond på et tidspunkt der andre mente det vil være både dyrt og eee og kun en ordning for privilegerte rikinger sannheten viste seg å være det motsatte presokornfond har hjulpet hundre og sytti norske selskaper gjennom en kritisk fase seksti prosent av disse selskapene sier til menon economics at de har vokst raskere på grunn av ordninga dette er hundre og sytti selskaper med minst sytti hundre og sytti grundere bak dem som har kunnet realisere minst deer i markedet,presåkornfond på eit tidspunkt der andre meiner til det vil vere både dyrt og eee å kunne ein eee ordning for priviligerte riking sannheten viste seg vere det motsette for sukordfonnen har gjort ett hundre og sytti norske selskaper gjennom ein kritisk fase seksti prosent av desse selskapa seier til menon økonomiks at dei har vokst raskare på grunn av ordninga dette er hundre og sytti selskaper med minst sytti hundre og sytti grundere bak dei som har kunne realisere minst del i markedet,4406.3,4433.4,27.099999999999454,2019-12-13,2019-12-13_proceedings.txt
Stortinget-20191213-085502_4433400_4459800,noen har klart seg andre har ikke gjort det men de har sikret at de som trenger det får tilgang til kapital selv om de ikke har en rik onkel som kan spytte inve investeringer i starten om noen år kommer vi til å se de samme resultatene når me noen eller andre evaluerer ordningene av skattefunn eller opsjonsordninga inntil da må vi huske på at vi kjemper eee for dette eee for mer økonomisk frihet og det er noe av det viktigste vi kan gjøre for å la folk leve det livet d,nokon har klart seg andre har ikkje gjort det men vi har sikkerheit at dei som treng det får tilgang til kapital sjel om dei ikkje har ein rik konkur som kan spytte in investeringar i starten og no når kommer til å se dei same resultata når dei er nokon eller andre evaluerer ordninga av skattefunn eller oppsjonsordningar inn til da må vi hyse på at vi kjempar eee for dette eee for meir økonomisk frihet og det er noko av det viktigaste vi kan gjere for å la folk lever det livet d,4433.4,4459.8,26.400000000000546,2019-12-13,2019-12-13_proceedings.txt
Stortinget-20191213-085502_4459800_4485500,det åpnes opp for eee replikkordskifte og første replikant er sigbjørn gjelsvikderetter kari elisabeth kaski gjelsvik president eee statsbudsjettet innebærer blant anna en eee overføring av de kommunale skatteoppkreverne til skatteetaten en sterk sentralisering,det opnast opp for eee replikkordskifte og første replikant er sigbjørn gjelsvikderetter kar elisabeth kaskigjelsvik president eee statsbudsjettet inneber blant anna ein overføring av dei kommunale skatteoppkreveree til skattetaten ein sterk sentralisering,4459.8,4485.5,25.699999999999818,2019-12-13,2019-12-13_proceedings.txt
Stortinget-20191213-085502_4485500_4515100,som møter kraftig motstand både ifra de ansatte og deres organisasjonene men og ifra over tre hundre av landets ordførere det at en frykter for den lokale kompetansen for de gode lokale fleksible løsningene frykta en svekka kamp mot arbeidslivskriminalitet og frykter og at det blir vanskeligere å kreve inn den skatten som en skal eee vil venstre kunne være villig til å gjøre en ny vurdering av saka der en går i dialog med de som den berører,som møter kraftig motstand både ifrå dei eee ansatte og deira organisasjonar men og ifrå over tre hundre av landets ordførar til at ein fryktar for den lokale kompetansen for dei gode lokale fleksible løysingane frykta ein svekka kamp mot arbeidslivskriminalitet og fryktar og at det blir vanskelegare å kreve inn den skatten som ein skal eee vil venstre kunne vere villig til å gjere ein ny vurdering av eee saker der ein går i dialog med dei som den berører,4485.5,4515.1,29.600000000000364,2019-12-13,2019-12-13_proceedings.txt
Stortinget-20191213-085502_4515100_4540800,og vil og venstre kunne være positiv til at de som nå får ekstremt lang reisevei til sitt nye arbeidssted at en kan finne fleksible løsninger for de der de kan beholde sitt arbeidssted president raja president eee jeg tror det er en kjent sak at eee venstre tidligere har vært imot eee sammenslåingen av disse eee kemnerkontorene eee og i tidligere forslag i tjuefemten så var det foreslått at antallet skulle være trettitre,og vil og venstre kunne vere positiv til at dei som no får ekstremt lang reiseveg til sitt nye arbeidsta at det kan finne fleksible løysingar for dei der dei kan behalde sitt arbeidsda president president eee eg trur det er ein kjent sak at eee venstre tidlegare har vore imot eee samanslåinga av eee desse me kenderkontora eee og i tidlegare forslag i tjuefemten så var det foreslått at antalet skulle vere trettitre,4515.1,4540.8,25.699999999999818,2019-12-13,2019-12-13_proceedings.txt
