file,text_bm,text_nn,start,end,duration,date,proceedingsfile
Stortinget-20190507-095514_8947800_8971700,det er også bra at statsråden stiller seg bak dette det gir eee autoritet til de som skal behandle saken gjennom en uavhengig granskning det var selvfølgelig president nødvendig å heve båten men hvilke vurderinger og forberedelser som ble gjort må stortinget få vite og det må komme offentligheten til kunnskap,det er også bra at statsråden stiller seg bak dette det gir eee autoritet til dei som skal behandle saka gjennom ein uavhengig gransking det har vare sjølvfølgelig president nødvendig å heve båten men kva vurderingar og forberedelser som blei gjort må stortinget få vite og det må komme offentlegheita til kunnskap,8947.8,8971.7,23.900000000001455,2019-05-07,2019-05-07_proceedings.txt
Stortinget-20190507-095514_8971700_8992300,en slik undersøkelse er nødvendig for også fordi kostnadene ved bergingen selvfølgelig er av stor betydning komiteen bekrefter at dette er en granskning som ikke skal ta for seg årsakene til selve forliset men selve sikringen og bergingsar,ein slik undersøkelse er nødvendig for å også fordi kostnadene ved berginga selvfølgelig er av stor betydning komiteen bekreftar at dette er ein gransking som ikkje skal ta for seg årsakene til selveforlise med sjølve sikringa og bergingsar,8971.7,8992.3,20.599999999998545,2019-05-07,2019-05-07_proceedings.txt
Stortinget-20190507-095514_8992300_9016900,i likhet med eee saksordfører president så vil jeg påpeke at det er s et særlig forhold og det er arbeidsforholdene for de som arbeidet med selve bergingen det er fremkommet opplysninger i pressen som også saksordfører sier om lange og muligens helt uforsvarlige lange arbeidsperioder for noen av de som deltok i bergingsarbeidet jeg forutsetter,i likhet med eee saksordfører president så vil eg påpeike at det er s eit særleg forhold og det gjer arbeidsforholda for dei som arbeider med sjølve berginga det er fremkommet opplysningar i pressen som også saksordfører seier om lange og muligvis heilt uforsvarleg i lange arbeidsperioder for nokon av dei som deltok i bergingsarbeidet jeg forutsetter,8992.3,9016.9,24.600000000000364,2019-05-07,2019-05-07_proceedings.txt
Stortinget-20190507-095514_9016900_9040600,at alle forhold også knyttet til bergingsmannskapets arbeidsforhold blir tatt opp i mandatet og undersøkt på en ordentlig måte og jeg ber om at statsråden sørger for at så skjer jeg viser for øvrig til eee saksordførers innlegg og eee og slutter meg til det hun framstilteneste taler håre elvenes,at alle får lov også knytt til bergingsmannskapets arbeidsforhold blir tatt opp i mandatet og undersjø på ein åndeleg måte og eg ber om at statsråden sørger for at så skjer eg viser for øvrig til eee saksordførers innlegg og eee og slutte meg til det ho framstillneste talar hori elvenes,9016.9,9040.6,23.700000000000728,2019-05-07,2019-05-07_proceedings.txt
Stortinget-20190507-095514_9049300_9077800,elvenes eee president eee som det er nevnt i tidligere innlegg så var dette en svært krevende maritime operasjon som skulle gjennomføres en ting er selve operasjonen men før du går og ut i operasjon så må du gjennomføre en rekke simuleringer du må j gjennomføre risikoanalyser for det arbeidet som skal gjøres slik at du har tenkt igjennom hva som skal gjøres og hva som eventuelt kan gå feil,elvenes takk eee president eee som det er nemnt i tidlegare innlegg så var dette ein svært krevjande maritim operasjon som skulle gjennomførast ein ting er sjølve operasjon men før du går og ut i operasjon så må du gjennomføre ein rekke simuleringar du må jo gjennomføre risikoanalysar for det arbeidet som skal gjerast slik at du har tenkt gjennom kva som skal gjerast og kva som eventuelt kan gå feil,9049.3,9077.8,28.5,2019-05-07,2019-05-07_proceedings.txt
Stortinget-20190507-095514_9077800_9102000,jeg vil minne representanten kolberg spesielt at dette var et fartøy som lå på en fjellhylle en skrå fjellhylle med fare for å skli ned på havutsdyp med minimale muligheter til å kunne ha blitt berga eee det synes som om at redningsoperasjonen har gått godt eee og vi skal være glade for det,eg vil minne representanten koberg spesielt at dette var eit fartøy som låg på ein fjellhylle i ein skrå fjellhylle med fare for å skli ned på havedstyp med minimale muligheter til å kunna blitt berga eee det synest som om at redningsoperasjonen har gått godt eee og vi skal vere glade for det,9077.8,9102.0,24.200000000000728,2019-05-07,2019-05-07_proceedings.txt
Stortinget-20190507-095514_9102000_9129400,eee det er også positivt at det er et enstemmig storting eller en enstemmig komite som står bak innstillinga men jeg må jo si jeg merka meg jo at arbeiderpartiet var tidlig ute med å foreslå en kommisjon som skulle se på dette berringsarbeidet eee stortinget skal være varsom å bruke kommisjoner eee spesielt eee og i dette tilfellet så er det jo to kommisjoner som skal se på selve eee,eee det er også positivt at eee det er ein enstemmig storting eller en enstemmig komite som står bak innstillinga men eg må jo seia merka meg jo at arbeidarpartiet var tidleg ute med å foreslå ein kommisjon som skulle se på dette an beringsarbeidet eee stortinget skal vere varsame å bruke kommisjonar eee spesielt eee og i dette tilfellet så er det jo to kommisjonar som skal sjå på sjølve eee,9102.0,9129.4,27.399999999999636,2019-05-07,2019-05-07_proceedings.txt
Stortinget-20190507-095514_9129400_9155600,nå får man jo eee belyst alle aspekt ved selve bergingsoperasjonen av fregatten og det er bra men igjen dette var et svært krevende arbeid under røffe værforhold eee som man skal ha all mulig respekt og gi honnør til de bergingsmannskapene som sto i den operasjonen her dette var ikke enkelt neste taler,no får ein jo eee belyst alle aspekt ved sjølve bergingsoperasjon av prigatten og det er bra men igjen dette var eit svært krevjande arbeid under røffe værforhold eee som ein skal ha all mulig respekt og gje honør til dei bergingsmannskapa som stod i den operasjonen her dette var ikkje enkeltneste talar,9129.4,9155.6,26.200000000000728,2019-05-07,2019-05-07_proceedings.txt
Stortinget-20190507-095514_9164300_9191500,lysbakken president jeg skal ikke holde et langt innlegg siden det er enighet om dette og så berømmer jeg statsråden for viljen til å komme eee stortinget i møte når det gjelder å få til eee en eee undersøkelse i tråd med det forslagsstillerne har bedt om jeg vil også bare understreke det samme som representantene navarsete og kolberg nemlig at dette med arbeidsforholdene og det som har kommet fram der bør inn i mandag nevnt i,lysbakken eee president eg skal ikkje halde eit langt innlegg sidan det er einigheit om dette også berømme statsråden for viljen til å komme eee stortinget i møte når det gjeld å få til eee ein eee undersøkt si tråd med det forslagsstillarane har bedt om eg vil også berre understreke det same som representanten navarsete kolberg nemleg at dette med arbeidsforholda og det som har komme fram der bør inn i manda nemnt i,9164.3,9191.5,27.200000000000728,2019-05-07,2019-05-07_proceedings.txt
Stortinget-20190507-095514_9191500_9202500,merknadene så vil jeg også understreke det eg oppfordre eee forsvarsministeren til å eee kommentere det i sitt innlegg neste taler statsråd frank bakkejensen,merknadene så vil eg også understreke det å oppfordre eee forsvarsministeren til å kommentere det i sitt innleggeste talar statsråd frank bakke jensen,9191.5,9202.5,11.0,2019-05-07,2019-05-07_proceedings.txt
Stortinget-20190507-095514_9206700_9235000,qqq bakkejensen takk skal du ha president ulykke med knm helge ingstad er som eee vi alle er enige om en var en svært dramatisk og alvorlig hendelse for alle involverte og for forsvaret som helhet bergingsarbeidet har vært en kompleks maritim operasjon hvor sikkerheta til personell har hatt høyeste prioritet planene for heving og transport av fartøyet ble utarbeida i tett samarbeid med både det norske veritas og kystverk,bakke jensentakk skal du ha president ulykka med knm helge ingstad er som eee vi alle er einige om ein var ein svært dramatisk og alvorleg hendelse for alle ein må vedta og for forsvaret som helhet bergingsarbeidet har vore ein kompleks maritim operasjon kor sikkerheit ta til personell har latt høyest er en prioritet planane for heving og transport av fartyet blei utarbeida i tett samarbeid med både den norske vedkasse og kystveg,9206.7,9235.0,28.299999999999272,2019-05-07,2019-05-07_proceedings.txt
Stortinget-20190507-095514_9235000_9263400,tilbakemeldingen jeg har fått så langt er at bergingsarbeidet har gått svært bra utgiftene som har påløpt underveis har vært rapportert ved ulike anledninger umiddelbart etter ulykka fikk sjøforsvaret ei ekstra bevilgning på femti millioner kroner for å gjennomføre de akutte handlingene som var kremt det var imidlertid allerede da åpenbart at det kom til å påløpe vesentlig større utgifter i tjuenitten jeg har tidligere informert stortinget om utviklinga i utgiftene ved bergingsarbeid utgiftene er nå beregna til syv hundre og tjueseks millioner kroner,tilbakemeldinga er fått så langt er at bergingsarbeidet har gått svært bra utgiftene som har påløpt undervis har vore rapportert ved ulike anledningar umiddelbart etter ulykka fekk sjølvforsvaret ei ekstra bevilgning på femti million kroner for å gjennomføre dei akutte handlingane som var krevd det var i mietid allereie i dag openbert at det kom til å påløpe vesentleg større utgifter i tjuenitten eg har tidlegare informert stortinget om utviklinga i utgiftene ved bergingsarbeidet utgiftene er nu berekna til sju hundre de og tjueseks million kroner,9235.0,9263.4,28.399999999999636,2019-05-07,2019-05-07_proceedings.txt
Stortinget-20190507-095514_9263400_9289600,det her omfatter imidlertid også noe utbedring av skader og arbeid med å redde materiell frem til nå president det her var ei alvorlig ulykke som vi må ta så mye lærdom av som mulig både ulykker og bergningsarbeidet undersøkes nå av flere parter statens havarikommisjon for transport og statens havarikommisjon for forsvaret undersøke hendelsesforløpet frem til koalisjonsskjedde og videre frem til hele besetninga var evakuert politiet etterforsker om de,det her omfattar i min lite tid også noko utbedring av skadar og arbeidet med å redde materiell fram til nu president det her var ei alvorleg ulykke som vi må ta så mye lærdom av som mulig både ulykka og bergingsarbeidet undersøkast nu av fleire partar statens haverikommisjon for transport og statens haverikommisjon for forsvaret å undersøke hendelsesfoløpet fram til kollisjonsskjedde og vidare fram til heile besetninga var evakuert politiet er etterforsking de,9263.4,9289.6,26.200000000000728,2019-05-07,2019-05-07_proceedings.txt
Stortinget-20190507-095514_9289600_9315300,parallelt pågår det to sektorinterne undersøkelser forsvaret undersøker hendelsesforløpet og årsakssammenhenger for ulykker forsvarsmateriell gjennomgår bergingsoperasjon og tekniske aspekter ved ulykke med fokus på å tilføre sektoren kunnskap og erfaring jeg er trygg på at vi vil få gode svar som resultat av de her forskjellige granskningene og undersøkelsen president fartøyet er nå ved sjøforsvarets hovedbase håkonsvern og bergingsarbeidet er inne i siste og avsluttende fase,parallelt pågår det to sektor interne undersøkelser forsvaret undersøker hendelsesforløpet og årsakssamanhengar for ulike forsvarsmateriel gjennomgår bergingsoperasjon og tekniske aspektar ei ulykke med fokus på å tilføre sektoren kunnskap og erfaring eg er trygg på at vi vil få gode svar og resultat av dei her forskjeligranskingen og undersøke president fartøyet er nu ved sjøforsvarets hovudbase håkonsvern og bergingsarbeidet er inn i siste og avsluttande fase,9289.6,9315.3,25.69999999999891,2019-05-07,2019-05-07_proceedings.txt
Stortinget-20190507-095514_9315300_9342100,forsvarsmateriell vurderer skadeomfanget på knm helge ingstad og vil ferdigstille en rapport om det her før sommeren i tillegg arbeides det med å bevare og berge så mye materiell og systemer som mulig det her arbeidet vil sannsynligvis være ferdig i løpet av andre kvartal tjuenitten det er imidlertid et ressurskrevende arbeid som legger beslag på sentrale personer s personer som også vil måtte involveres ved i ekstern og uavhengig gjennomgang jeg er opptatt president av mest mulig åpenhet om og hevingsarbeidet,forsvarsmateriel vurderer skadeomfanget på kven ein helge ingstad og vil ferdigstille ein rapport om det her føl saman i tillegg arbeides det med å bevare og berge så mye materiell og system som mulig det her arbeidet vi sannsynlege dess vere ferdig i løpet av andre kvartal tjuenitten det er imidlertid eit ressurskrevjande arbeid som legg beslag på sentrale personar personar som også vil måtte involverast ved ei ekstern og uavhengig gjennomgang eg er opptatt president av mest mulig åpenhet om og hevingsarbeidet,9315.3,9342.1,26.80000000000109,2019-05-07,2019-05-07_proceedings.txt
Stortinget-20190507-095514_9342100_9366600,en ekstern og uavhengig gjennomgang vil kunne bidra til å øke kunnskapen om bergingsarbeidet ytterligere det pågår flere viktige undersøkelser som vil gi oss gode svar og jeg stiller meg også positiv til forslaget om ei ekstern og uavhengig gjennomgang av bergingsarbeidet det her vil kunne bidra ytterligere til viktig lærdom etter bergingsoperasjonen president en slik gjennomgang bør settes i gang først etter at bergingsarbeidet og vurderinga av skadeanomhanget er fullført og derfor kan det tidligst skje i andre halvdel av tjuenitten,ein ekstern og uavhengig gjennomgang vil kunne bidra til å auke kunnskapen om bergingsarbeidet ytterlegare det pågår fleire viktige undersøkelser som vil gi oss gode svar og her stiller eg også positiv til forslag om ei ekstern og uavhengig gjennomgang av bergingsarbeidet det her vil kunne bidra ytterlegare til viktig lærdom etter dekningsoperasjon president ein slik gjennomgang bør settast i gang først etter at bergingsarbeidet og vurderingar av skadeahenget er fullført og derfor kan det tilliks skje i andre halvdelar av tjuenitten,9342.1,9366.6,24.5,2019-05-07,2019-05-07_proceedings.txt
Stortinget-20190507-095514_9366600_9390500,på den her måten sikrer vi at dem som er best kvalifisert er tilgjengelig for en slik undersøkelse for å sikre størst mulig åpenhet og offentliggjøring bør den ikke omfatte gradert informasjon og forhold som undersøkes og etterforskes av havarikommisjonen og politiet og avslutningsvis president så har jeg lyst til å holde tett kontakt med forslagsstillerne og komiteen både i forhold til det med mandat men også for å sikre at vi dekker,på den her måten sikrar vi at dei som er best kvalifisert er tilgjengeleg for ein slik undersøkelse for å sikre størst mulig openheit og offentleggjering bør den ikkje omfatte gradert informasjon og forlag som undersøkast og etterforskast av haverikommisjonen og politiet og avslutningsvis president så har eg lyst til å halde tett kontakt med forslagsstillarane og komiteen både i forhold til det med mandat men også for å sikre at vi dekker,9366.6,9390.5,23.899999999999636,2019-05-07,2019-05-07_proceedings.txt
Stortinget-20190507-095514_9390500_9403600,kravet om en uavhengig eee gransking sånn at jeg i fo i forkant av arbeidet går i gang så vil jeg drøfte de tingene med komiteen presidentda er det klart for replikkordskifte første replikant liv signe navarsete,kravet om eigen uavhengig eee gransking sånn at vi eee for i forkant av arbeidet i år gang så vil eg drøfte dei tinga med komiteen presidentdå er det klart for replikkordskifte fyrste replikant liv signe navarsete,9390.5,9403.6,13.100000000000364,2019-05-07,2019-05-07_proceedings.txt
Stortinget-20190507-095514_9413000_9434500,navarsetetakk president eee og takk til statsråden eee både for ei veldig konstruktiv holdning eee og til sak til forslaget men og for at eee han eee vil komme attende til komiteen og ha en dialog eee om de som han nå eee varsla det prisverdig,navarsete takk president eee og takk til statsråden eee både for ei veldig konstruktiv haldning eee og til saka til forslaget men og for at eee han eee vil komma attende til komiteen og ha ein dialog eee om dei som han no eee varslar detr prisverdig,9413.0,9434.5,21.5,2019-05-07,2019-05-07_proceedings.txt
Stortinget-20190507-095514_9434500_9464100,eee i media har det jo vært skrevet en del kring eee den ut ar utsettingen av oppdraget knytta til krmhelgingstad altså kny av utbedring av skråg eee og eee det har vært eee hevda at eee det som skjedde gjennom eee anbotsutsettinga eee gjorde at den ikke følge arbeidsmiljølova eee på en god nok måte så mitt spørsmål er vil statsråden vurdere å ta med,i media har det jo vore skrive ein del kring eee den ut ar utsetjinga av oppdraget knytt til krem helging stad altså kny av utbedringa om skråket eee og det har vore eee hevda at det som skjedde gjennom anbrotsutsetningar eee gjorde at ein ikkje følgde arbeidsmiljølova eee på ein god nok måte så mitt spørsmål er eee vil statsråden vurdera å ta med,9434.5,9464.1,29.600000000000364,2019-05-07,2019-05-07_proceedings.txt
Stortinget-20190507-095514_9464100_9491900,eee det momentet i når han skal utferdige eee mandatet for eee for den gransking i eee det kan vel på en forholdsvis enkel måte og legges inn som en del av mandatet eee enten for råstad fest da at eee det har skjedd noe som ikke bor og ski eller for å avkrefte eee det som har oppstått ja president eee altså jeg mener det er en viktig del av det jeg har jeg hå håper om at vi skal få et svar på at de konkrete tingene lenge før,eee det momentet i eee når han skal utferdiga eee mandatet for eee for denne granskinga eee det kan vel på ein forholdsvis enkel måte og leggast inn som ein del av mandatet eee enten for å stadfesta at eee det har skjedd noko som ikkje burde skjedd eller for å avkrefta eee det som har oppstått ja president eee altså eg meiner det er ein viktig del av det har eg håp håp om at vi skal få eit svar på at dei konkrete tinga lenger før,9464.1,9491.9,27.799999999999272,2019-05-07,2019-05-07_proceedings.txt
Stortinget-20190507-095514_9491900_9518700,vi får mandat for at dermed altså eee brudd på på eee på lov og regler skal ikke skje heller ikke regi eee av eee av forsvaret sånn at vi kommer til å ettergå den eee den saken og få og forklare til hva som har skjedd så kan det godt enn at det kan være en viktig del av mandatet se hvordan man i den typen eee bergingsoperasjoner der mye må skje fort eee også sikrer at vi holder oss innafor den delen sånn at det det kommer jeg til å vurdere før jeg kommer med mandatet til dagnavarse eee,vi får mandatet for at her me altså eee brudd på på eee på lov og reglar skal ikkje skje heller ikkje i regi er av eee av forsvaret sånn at vi kommer til å ettergå den eee den saka og få eee å forklare til kva som har skjedd så kan eg godt enn at det kan vere ein viktig del av mandatet ser korleis ein i den typen eee bergingsoperasjonar der mye må skje fort eee også sikre at vi holder oss eee innanfor den delen sånn at det kommer eg til å vurdere før det kommer med mandatet na eee,9491.9,9518.7,26.80000000000109,2019-05-07,2019-05-07_proceedings.txt
Stortinget-20190507-095514_9518700_9542600,jeg saker for svaret president eee jeg skal ikke hefte til med flere spørsmål denne saken for her er vi veldig enige jeg vil bare rett og slett takke eee statsråden men jeg er av og til veldig uenig om ting men jeg synes det er v bra for stortinget og for samarbeidet eee mellom storting og regjering at vi og har saker der vi kan jobbe godt i dag og dette er ei slik sak og det syns jeg statsråden skal ha ros for takk,eg takkar for svaret president eee eg skal ikkje hefta tid med fleire spørsmål i denne saka for her er me veldig einige eg vil berre rett og sett takka eee statsråden me er av og til veldig ueinige om ting me eg synest det er bra for stortinget og for samarbeidet eee mellom storting og regjering at me og har saker der me kan jobba godt i lag og dette er ei slik sak og det synest eg statsråden skal ha rosar,9518.7,9542.6,23.899999999999636,2019-05-07,2019-05-07_proceedings.txt
Stortinget-20190507-095514_9542600_9570400,ja president jeg får lov også takke hjertelig jeg er helt enig med med representanten at de gangene vi kan eee jobbe godt i la og kommunisere godt både når vi er enig og uenig da det er da er vi på det beste da er debatten i sak fire avslutta og vi går videre på sak fem som er interpellasjon fra representanten anniken huitfeldt til forsvarsministeren nittiende februar tjuenittien ble i norge presentert med en rapport for en inte spørreundersøkelse i forsvaret,enden at far lov også takke hjarteleg eg er heilt einig med med representanten at dei gongane vi kan eee jobbe godt i lag kommunisere godt både når vi er einige og ueinige det det er da er vi på det bestedå er debatten i sak fire avslutta me går vidare på sak fem som er interpellasjon frå representanten anniken vidtfeld til forsvarsministeren nittiande februar tjuenitten blei noreg presentert med ein rapport frå ein inte spørendomrsøkelse i forsvaret,9542.6,9570.4,27.799999999999272,2019-05-07,2019-05-07_proceedings.txt
Stortinget-20190507-095514_9570400_9597100,spørreundersøkelsen ble gjennomført med over åtte tusen vernepliktige ansatte respondenter i forsvaret for å kartlegge mobbing og seksuell trakassering gjort av kollegaer eller overordnede undersøkelsen viser at over hundre og seksti personer har opplevd voldtekt eller forsøk på voldtekt det siste året i forsvar det er halvparten menn og kvinner som faller inn under denne statistikken og kun to av tilfellene er anmeldt i politi det er ikke første gangsvarets,spørundsøkelsen blei gjennomført med over åtte tusen vernepliktige og ansette espedentar i forsvaret for å kartlegga mobbing og seksuell trakasering gjort av kollegar eller overordnade undersøkinga viser at over hundre og seksti personar har opplevt valdtekt eller forsøk på valdtekt dei siste året i forsvar det er halvparten menn og kvinner som faller inn under denne statistikken og kun to av tilfella er anmeldt til politiet det er ikkje fyrste gongsvarets,9570.4,9597.1,26.700000000000728,2019-05-07,2019-05-07_proceedings.txt
Stortinget-20190507-095514_9597100_9613500,vernepliktige ansatte opplever å bli utsatt for seksuell trakassering i sin tjenesteperiode hva har statsråden gjort av konkrete tiltak frem til nå og hvilke tiltak vil iverksettes framover for å sikre bedre varselrutiner i forsvaret anniken huitfeldt,verneplikta og ansatte opplever å bli utsett for seksuell trakassering i sin tenesteperiodekva har statsråden gjort av konkrete tiltak fram til no og kva tiltak vil iverksettast framover for å sikra betre varsel rutiner i forsvaret anniken witselh,9597.1,9613.5,16.399999999999636,2019-05-07,2019-05-07_proceedings.txt
Stortinget-20190507-095514_9619100_9647000,huitfeldt president innføring av verneplikt for både kvinner og menn i forsvaret har vært en suksess de aller aller fleste jentene er fornøyde og føler seg inkludert det er ingenting som tyder på at dagens forsvar er verre enn andre arenaer hvor ungdom deltar når det gjelder seksuell trassering og overgrep,vitfelhpresident innføring av verneplikt for både kvinner og menn i forsvaret har vore ein suksess dei aller aller fleste jentene er fornøgde å føle seg inkludert det er ingenting som tyder på at dagens forsvar er verre enn andre arena vår ungdom deltar når det gjeld seksuell trasering og overgrep,9619.1,9647.0,27.899999999999636,2019-05-07,2019-05-07_proceedings.txt
Stortinget-20190507-095514_9647000_9676400,grenaderi panserbataljonen brigade nord hanne konstad forteller om et inkluderende forslag forsvar hun sier jeg har heller ikke opplevd å bli harsha med fordi jeg er kvinne tvert imot har vi stått sammen mot urett og ukultur dette er vi helt avhengige av for å kunne utføre den jobben vi har satt til å gjøre hun forteller videre om overgrep som et samfunnsproblem,gren der i pansebatallionen blei gade nor hamnar konsta forteller om eit inkluderande forslag forsvar hus dei gir eg har heller ikkje opplevd å bli harsame for dei er kvinner tvert imot har vi stått saman mot urett og ukultur dette er vi heilt avhengige av for å kunne utføre den jobben vi har satt til å gjere hon forteljer vidare om overgrep som eit samfunnsproblem,9647.0,9676.4,29.399999999999636,2019-05-07,2019-05-07_proceedings.txt
Stortinget-20190507-095514_9676400_9704200,og ikke en utfordring som forsvaret står aleine om men det som skiller forsvaret fra veldig mange andre arenaer hvor unge mennesker deltar er det f nære forholdet man har til hverandre man bor sammen spiser sammen er sammen på øvelse og ofte også på fritiden langt hjemmefra det skaper samhold og kameratskap men skjer det noe negativt mellom sånn late så kan det oppleves som ektra belastende å bo,og ikkje ein utfordring som forsvaret står aleine om men det som skiljer forsvaret frå veldig mange andre arene vår unge menneske deltak er det nære forholda ein har til verandre ein bur saman spiser saman er saman på øvelse og ofte også på fritida langt hemme frå det skaper samhald og kamaratskap men skjer det noko negativt mellom sonat me så kan me oppleves av ektra belastne å bu,9676.4,9704.2,27.80000000000109,2019-05-07,2019-05-07_proceedings.txt
