file,text_bm,text_nn,start,end,duration,date,proceedingsfile
Stortinget-20190507-095514_4975800_5002600,står det i loven at det må være demokratisk oppbygning samt at de skal bidra til å vedlikeholde og styrke demokratiet og legge grunnlag for bærekraftig utvikling ved å engasjere og utvikle aktive medborgere dette ambisiøse mål herunder er det viktig å trekke fram politiske studieforbund som blir nevnt i egen forskrift her er det kun venstre og senterpartiet som står igjeneforbund,står det i loven at det må vere eit demokratisk oppbygning samt at dei skal bidra til å vedlikehald å styrke demokratiet å legge grunnlag for berekraftig utvikling ved å engasjere og utvikle aktive medborgarar dette ambisiøse mål her når er det viktig å trekke fram politiske studieforbund som blir nemnt i eigen forskrift her er er kun venstre og senterpartiet som står igjenforbond,4975.8,5002.6,26.800000000000182,2019-05-07,2019-05-07_proceedings.txt
Stortinget-20190507-095514_5002600_5017600,ingen av dem hadde eksistert hvis ikke det var for forskrifta når venstre var ute av stortinget var studieforbundene en del av kontinuiteten i deres organisasjon dette er en de demokratisk di glemme,ingen av dei hadde eksistert viss ikkje det var for forskrifta når venstre var ute av stortinget var studieforbundet ein del av kontinuiteten i deira organisasjon dette er ein de demokratisk di gløyme,5002.6,5017.6,15.0,2019-05-07,2019-05-07_proceedings.txt
Stortinget-20190507-095514_5017600_5046900,endringene kunnskapsdepartementet ser på for sturforbundet er mange og jeg nevner blant anna deling mellom kunnskapsdepartementet og kulturdepartementet regionalisering endra rammer for minstekrav til deltakere erstatte kurstimer med deltakertimer krav mot kurs må ha lærers økt grunntilskudd endra trappetrinsmodell definere administrasjon tydelig føring for bruk av opplæringstilskuddet endra rapporteringskrav kvalitative rapporter,endringa i kunnskapsdepartementet ser på for stude forbundet er mange og eg nemner blant anna at deling mellom kunnskapsdepartementet og kulturdepartementet regionalisering endra ramme for minstegrav til deltakarar erstatta kur stimer med deltakartimer krav at kurs må ha læres økt grunntilskot endra trappetrinnsmodell definere administrasjon tydeleg føring for bruk av opplæringstilskotet endra rapporteringskrav kvalitative rapportar,5017.6,5046.9,29.299999999999272,2019-05-07,2019-05-07_proceedings.txt
Stortinget-20190507-095514_5046900_5076200,og avvikling av særordning for politiske sturforbund det viktigste er at det er en sammenheng med samfunnsoppdrag og lovverk og vi har forstått det sånn at departementet konkluderer i sitt arbeid i løpet av våren en gjennomgående mangel ved arbeidet slik hvis senterpartiet ser det er at det ikke er vurdert konsekvenser av de ulike tiltaka og endringene jeg mener også det er s grunn til å spørre hva regjeringa ønsker å oppnå med de ulike forslaga,og avvikling av særordning for politiske stureforbod det viktigaste er at det er ein samning med samfunnsoppdrag og lovverk og vi har forstått det sånn at departementet konkluderer i sitt arbeid i løpet av våren ein gjennomgåande mangel ved arbeider slik vil senterpartiet ser det er at det ikkje er vurduert konsekvensar av dei ulike tiltaka og endringane eg meiner også det grunnen til å spørje kva regjeringa ønsker å oppnå med dei ulike forslaga,5046.9,5076.2,29.300000000000182,2019-05-07,2019-05-07_proceedings.txt
Stortinget-20190507-095514_5076500_5106300,president informasjonsflyten i samfunnet er i endring og det er et økende behov for seriøse kanaler for informasjon og faglig påfyll flere må få tilgang på skolering med lav terskel for å delta til stede der folk er og tilpasse den enkelte studiearbeid er en kombinasjon av at kompetansepåfyll fyller sine formelle former samtidig som vi er bevisste på at kunnskapsoverføring mennesker imellom,president informasjonsflyte i samfunnet er i endring og det er eit øknad behov for seriøse kanalar for informasjon og fagleg påfyll fleire må få tilgang på skolering med lav terskel for å delta til stader der folk er og tilpassa den enkelte studiearbeid er ein kombinasjon av at kompetansepåfyll fylgjer sine formelle former samtidig som e bevisste på at kunnskapsovverføring menneske i mellom,5076.5,5106.3,29.800000000000182,2019-05-07,2019-05-07_proceedings.txt
Stortinget-20190507-095514_5106300_5132200,er verdifull hvordan regjeringa følger opp stortingets engasjement for studieforbund og statsråden sine tanker om studieforbundene sine bidrag til kompetanseheving blir det interessant å høre mer om nå i den store sammenhengen er studieforbundene viktige verktøy for inkludering både av individ som risikerer å falle fra i arbeids og samfunnsliv samt inkludering av nye statsborgere for eksempel,er verdifull vår denne regjeringa følge opp stortingets engasjement for studieforbund og statsråden sine tankar om studieforbunda sine bidrag til kompetanseheving blir det interessant å høyre meir om nå i den store samningen er studieforbunda viktige var ei for inkludering både av individ som dissikerer å falle frå i arbeids og samfunnsliv samt inkludering av nye statsborgarar for eksempel,5106.3,5132.2,25.899999999999636,2019-05-07,2019-05-07_proceedings.txt
Stortinget-20190507-095514_5132200_5159900,studieforbundet kultur og tradisjon har blitt trukket fram som et godt eksempel med strikk kurs i voga språktrening og sosial forståelse i regi av kristelig studieforbund stiller opp ut over det ordinære opplæringstilbudet for nye landsmenn folkeuniversitetet hjelper de ta mesterbrev rundt i hele landet og dette var bare et par eksempler for a fa hva fda vil bringe veit vi ikke,studieforbundet kultur og tradisjon har blitt trukket fram som eit godt eksempel med strikk kurs i vågå språktrening og sosial forståelse i regi av kristeleg studieforbund stiller opp ut over det ordinære opplæringstilbodet for nye landsmenn folkeuniversitetet hjelper dei ta meste brev rundt i heile landet og dette var bare par eksempel for fram kva fda vil bringe veit vi ikkje,5132.2,5159.9,27.699999999999818,2019-05-07,2019-05-07_proceedings.txt
Stortinget-20190507-095514_5159900_5186700,men vi kan gjøre som en meining for hva studiearbeid skal være president i min innsendte interpellasjon spør jeg hvordan følger regjeringa opp innstilling og engasjement på studiearbeid studieforbund som eee utdannings og forskningskomiteen la fram for inneværende år og hvordan meiner statsråden studieforbunde bidrar til kompetanseheving neste taler er statsrå,men vi kan gjere sånne meining for va studiearbeid skal vere president i min innstendte interpolasjon spørre vorden følger regjeringa opp innstilling og engasjement for studiearbeid studieforbund som eee utdannings og forskningskomiteen la fram for inneverende år og var da meiner statsråden studieforbunda bidrar til kompetansehevingneste talar er statsrå,5159.9,5186.7,26.800000000000182,2019-05-07,2019-05-07_proceedings.txt
Stortinget-20190507-095514_5192700_5214000,får gratulere statsråden med dagens sommar i år tusen takk vær så god statsråd sanner president la meg først få takke representanten strand for en god og viktig interpellasjon det er tydelig at representantene har et stort engasjement for stue og det er bra,å gratulere statsråden med dagens så marie tusentakk ver så god statsråd salen president la meg først få takke representanten strand for ein god og viktig interpellasjon det er tydeleg at representantene har eit stort engasjement for stuet og det er bra,5192.7,5214.0,21.300000000000182,2019-05-07,2019-05-07_proceedings.txt
Stortinget-20190507-095514_5214000_5240600,jeg skal forsøke å formidle noen av de vurderingene regjeringen gjør seg om studieforbundets rolle og bidrag i kompetanseheving i samfunnet men som representanten også understreke i s eller viste til i sitt innlegg eee så er det nå flere vurderinger som foretas disse er en de disse er ikke endelig konkludert og det betyr at det er en del problemstillinger som jeg ikke kan komme nå,jeg skal forsøke å formidle nokon av dei vurderingane regjeringa gjer sa om studeforbundets rolle og bidrag i kompetanseheving i samfunnet men som representanten også understrekte i s eller viste til i sitt eee innlegg eee så er det no fleire vurderingar som foretas desse er en de desse er ikkje endeleg konkludert og det betyr at det er ein del problemstillingar som eg ikkje kan komme da,5214.0,5240.6,26.600000000000364,2019-05-07,2019-05-07_proceedings.txt
Stortinget-20190507-095514_5240600_5260000,studieforbundet har lang og bred erfaring i å tilby opplæring i kultur tradisjoner demokratibygging og folkeopplysning men de tilbyr også voksenopplæring i mer tradisjonell forstand de har i alle år vært viktige bidragsytere til opplæring utenfor det formelle utdanningssystemet,studieforbundet har eee lang og bre erfaring i å tilby opplæring i kultur tradisjonar demokratibygging og folkeopplysning men dei tilbyr også vaksenopplæring i meir tradisjonell for stand dei har i alle år vore viktige bidragsytere til opplæring utanfor det formelle utdanningssystemet,5240.6,5260.0,19.399999999999636,2019-05-07,2019-05-07_proceedings.txt
Stortinget-20190507-095514_5260000_5289800,jeg ønsker å anerkjenne den evnen studieforbundene har til å utvikle seg og tilpasse seg både til voksnes opplæringsbehov og til de utfordringene vi står ovenfor i samfunnet gjennom studieforbundene blir kulturarv og tradisjoner tilgjengelig interesse vekkes og viktig kunnskap videreføres til nye generasjoner jeg mener vi bør bevare frivilligheten som en alternativ og supplerende opplæringsarena for livslang læring,eg ønsker å anerkjenne den evnen studieforbunda har til å utvikle seg og tilpasse seg både til vaksnes opplæringsbehov og til dei utfordringane vi står ovenfor i samfunnet gjennom studieforbundet blir kulturarv og tradisjonar tilgjengeleg interesse vekkas og viktig kunnskap vidareførast til nye generasjonar jeg meiner vi bør bevare frivilligheita som ein alternativ og supplerande opplæringsarena for livslang læring,5260.0,5289.8,29.800000000000182,2019-05-07,2019-05-07_proceedings.txt
Stortinget-20190507-095514_5289800_5310000,derfor er det viktig å sikre en fortsatt god studieforbundsordning når det gjelder studieforbundenes konkrete bidrag til kompetanseheving vil jeg minne om utdannings og forskningskomiteens tydelige holdning til frivillig sektor komiteen har gjennom mange år uttrykt at frivilligheten selv,derfor er det viktig å sikre ein fortsatt god studieforbundsordning når det gjeld studieforbundets konkrete bidrag til kompetanseheving vil eg minne om utdannings og forskingskomiteens tydeleg haldning til frivillig sektor komiteen har gjennom mange år uttrykt at frivilligheita sel,5289.8,5310.0,20.199999999999818,2019-05-07,2019-05-07_proceedings.txt
Stortinget-20190507-095514_5310000_5335700,best vet hvordan de kan bidra i samfunnet det har vært komiteens standpunkt at studieforbundene må få organisere opplæringen slik de finner det mest hensiktsmessige studieforbundsordningen skal være enkel og ubyråkratisk det er et poeng for regjeringen at staten ikke skal kreve omfattende rapportering på måloppnåelse fra organisasjoner i frivillig sektor,best veit vordi dei kan bidra i samfunnet det har vore komiteens standpunkt at studieforbundet må å få organisere opplæringa slik dei finn det mest hensiktsmessigstudieforbundsordninga skal vere enkel og ubyråkratisk det er eit poeng for regjeringa at staten ikkje skal krevje omfattande rapportering på måloppnåelse frå organisasjonar i frivillig sektor,5310.0,5335.7,25.699999999999818,2019-05-07,2019-05-07_proceedings.txt
Stortinget-20190507-095514_5335700_5355000,vi mottar derfor ikke detaljert informasjon om studieforbundenes kvalitative bidrag til kompetanseheving og slik bør det også være likevel mener jeg den store etterspørselen etter kurs i stud studieforbundets regi vitner om at deres bidrag er relevante,vi mottar derfor ikkje detaljert informasjon om studieforbundets kvalitative bidrag til kompetanseheving og slik bør det også vere likevel meiner eg den store etterspørselen etter kurs i sty studieforbundets regi vitnar om at deira bidrag er relevante,5335.7,5355.0,19.300000000000182,2019-05-07,2019-05-07_proceedings.txt
Stortinget-20190507-095514_5355000_5377100,hvert år arrangeres det førtifem tusen kurs med omkring en halv million deltakere i regi av studieforbund og deres medlemsorganisasjoner opplæringen skal være uformell og ha lav terskel for deltakelse voksenopplæringsloven skal føre til motivasjon og tilgang til kunnskap og kompetanse for alle,kvart år aransjerast det førtifem tusen kurs med omkring ein halv million deltakarar i regi av studieforbund og deiras medlemsorganisasjoner opplæringa skal vere uformeld og ha lav terskel for deltakelse vaksneopplæringslovan skal føre til motivasjon og tilgang til kunnskap og kompetanse for alle,5355.0,5377.1,22.100000000000364,2019-05-07,2019-05-07_proceedings.txt
Stortinget-20190507-095514_5377100_5400100,på den måten bidrar studieforbundene til den enkeltes utvikling og til mø til å møte behovene i samfunns og arbeidsliv statens bidrag er å redusere opplæringskostnadene for den enkelte slik samarbeider staten og frivilligheten om å bidra til livslang læring og til å motivere enkeltpersoner til å øke sin egen kompetanse,på den måten bidrar studieforbundet til den enkeltes utvikling og til mø til å møte behova i samfunns og arbeidsliv statens bidrag er å redusere opplæringskostnadene for den enkelte slik samarbeider staten og frivilligheten om å bidra til livslang læring og til å motivere enkeltpersonar til å auke sin eigen kompetanse,5377.1,5400.1,23.0,2019-05-07,2019-05-07_proceedings.txt
Stortinget-20190507-095514_5400100_5419700,studieforbundene har også en sentral rolle i folkeopplysning og i den demokratiske opplæringen som skjer i frivillige organisasjoner ikke minst er studieforbundets tilbydere av opplæring i og bevaring av for eksempel kulturarv tradisjoner og gamle håndverksfag viktig,studieforbundet har også ein sentral rolle i folkeopplysning og i den demokratiske opplæringa som skjer i frivillige organisasjonar ikkje minst er studieforbundets tilbydere av opplæring i og bevaring av for eksempel kulturarv tradisjonar og gamle hantverksfag viktig,5400.1,5419.7,19.599999999999454,2019-05-07,2019-05-07_proceedings.txt
Stortinget-20190507-095514_5419700_5443100,fra kor og korps til norskopplæring for innvandrere fra opplæring i digitale og grunnleggende ferdigheter til kurs i bevaring av samisk kulturarv og fra organisasjons og ledelsesfag til gamle håndverkstradisjoner gjennom slike aktiviteter skoleres befolkningen til å delta i fellesskapet dette er en forutsetning for et fungerende demokrati,frå kor og korps til norskopplæring for innvandrar frå opplæring i digitale og grunnleggande ferdigheter til kurs i bevaring av samisk kulturarv og frå organisasjons og ledelsesfag til gamle handtverkstradisjonar gjennom slike aktivitetar skolers befolkninga til å delta i fellesskapet dette er ein forutsetning for eit fungerande demokrati,5419.7,5443.1,23.400000000000546,2019-05-07,2019-05-07_proceedings.txt
Stortinget-20190507-095514_5443100_5468200,det er stor variasjon i nivå og innhold og dermed også i opplæringstilbudet fra studieforbund til studieforbund noen studieforbund har en tydelig profil og satsing innenfor utdannings og kompetansepolitikken enkelte studieforbund har et bredt kurstilbud som blant annet omfatter kurs rettet mot arbeidslivet og arbeidstakere med behov for utdanning,det er ei stor variasjon i nivå og innhald og dermed også gi opplæringstilbodet frå studieforbund til studieforbund nokon studieforbund har ein tydeleg profil og satsing gjennanfor utdannings og kompetansepolitikken enkelte studieforbund har eit breitt kurstilbod som blant anna omfattar kurs rett mot arbeidslivet og arbeidstakarar med behov for utdanning,5443.1,5468.2,25.099999999999454,2019-05-07,2019-05-07_proceedings.txt
Stortinget-20190507-095514_5468200_5497300,tilbudet omfatter etter og videreutdanningskurs innenfor en rekke profesjoner enkelte har opplæringstilbud med stor bredde i kurshemder og faginnhold og lang erfaring som kursholdere i arbeidslivet noen tilbyr også opplæring innenfor kompetansepolitiske satsingsområder som grunnleggende fer ferdigheter norskopplæring og fagopplæring det finnes eee det finnes også studieforbund som tilbyr kurs innenfor kompetanseplussordningen,tilbodet omfattar etter og vidareutdanningskurs innanfor ein rekke profesjonar enkelte har opplæringstilbod med stor bredde i kursemder og faginnhald og lang erfaring som kursholdere i arbeidslivet nokon tilbyr også opplæring innanfor kompetansepolitiske satsingsområde som grunnleggande fer ferdigheter norskopplæring og fagopplæring det finst eee det finst også studieforbund som tilbyr kurs innanfor kompetanseplussordningen,5468.2,5497.3,29.100000000000364,2019-05-07,2019-05-07_proceedings.txt
Stortinget-20190507-095514_5497300_5526500,studieforbundene har med andre ord gode forutsetninger og muligheter til å bidra til livslang læring deres bidrag kan skje gjennom å motvirke utenforskap og motivere til livsmestring og deltakelse i samfunnet men det kan også være gjennom å inspirere og hjelpe enkeltmennesker på vei mot mer kunnskap i form av formell opplæring eller utdanning studieforbundene vet best selv hvordan de kan bidra,studieforbundet har med andre ord gode forutsetningar og muligheter til å bidra til livslang læ læring deira bidrag kan skje gjennom å motverke utanforskap og motivere til livsmestring og deltakelse i samfunnet men det kan også vere gjennom å inspirere og hjelpe enkeltmenneske på veg mot meir kunnskap i form av formell opplæring eller utdanning studieforbundet vet best sel vore den dei kan bidra,5497.3,5526.5,29.199999999999818,2019-05-07,2019-05-07_proceedings.txt
Stortinget-20190507-095514_5526500_5547700,regjeringen gjennomfører kompetansereformen lære hele livet målet med kompetansereformen er at ingen skal gå ut på dato målgruppen er virksomheter og arbeidstakere som har behov for mer kompetanse som følge av digitalisering og andre krav til omstillingansereformen,regjeringa gjennomfører kompetansereforma lære heile livet målet med kompetansereforma er at ingen skal gå ut på dato målgruppen er virksomheter og arbeidstakarar som har behov for meir kompetanse som følge av digitalisering og andre krav til omstillingansereforma,5526.5,5547.7,21.199999999999818,2019-05-07,2019-05-07_proceedings.txt
Stortinget-20190507-095514_5547700_5575300,handler om å sørge for at de som er i arbeid har den kompetansen de trenger for å kunne håndtere nye oppgaver og opprettholde sin tilknytning til arbeidslivet regjeringen mener at studieforbundene vil kunne ha en plass i kompetansereformen i likhet med fagskolene yrkesfaglig opplæring universitets og høgskolesektoren og privat sektor vil frivilligheten kunne ha en rolle kompetansereformen,handlar om å sørge for at dei som er i arbeid har den kompetansen dei treng for å kunne handtere nye oppgåver og opprettholde sin tilknytting til arbeidslivet regjeringa meiner at studieforbundet vil kunne ha ein plass i kompetansereformen i likhet med fagskolene yrkesfagleg opplæring universitets og høgskolesektoren og privat sektor vil frivilligheten kunne ha ein rolle kompetansereforma,5547.7,5575.3,27.600000000000364,2019-05-07,2019-05-07_proceedings.txt
Stortinget-20190507-095514_5575300_5604700,studieforbundet bør selv ha en diskusjon om hvordan de kan møte samfunnets behov hvilken plass de bør ha og hvordan de kan bidra inn i kompetansereformen studieforbundet har lang erfaring som opplæringstilbydere bred kompetanse og et godt utbygd nettverk blant virksomheter og i all alle landsdeler de har dermed gode forutsetninger for å kunne bidra til kompetanseheving både i den en både for den enkelte og for samfunnet,studieforbundet bør sel ha ein diskusjon om korleis vi kan møta samfunnets behov kva plass dei bør ha og korleis dei kan bidra inn i kompetansereformen studieforbundet har lang erfaring som opplæringstilbodret bre kompetanse og eit godt utbygd nettverk blant virksomheter og i all alle landsdelar dei har dermed gode forutsetningar for å kunne bidra til kompetanseheving både i den enk eee både for den enkelte og for samfunnet,5575.3,5604.7,29.399999999999636,2019-05-07,2019-05-07_proceedings.txt
Stortinget-20190507-095514_5604700_5627200,president jeg mener at studieforbundet har en viktig rolle i dag og i fremtiden studieforbundene kan bidra positivt i møte med flere av de samfunnsutfordringene vi står ovenfor de tilbyr opplæring på andre arenaer og og premisser enn tradisjonell utdanning og bidrar dermed til befolkningens kompetanse på en litt annen måte enn utdanningssystemet,president eg meiner at studieforbundet har ein viktig rolle i dag og i framtiden studieforbundet kan bidra positivt i møte med fleire av dei samfunnsutfordringane vi står ovenfor dei tilbyr opplæring på andre arenaer og og premisser ein tradisjonell utdanning og bidrar dermed til befolkningas kompetanse på ein litt annan måte enn utdanningssystemet,5604.7,5627.2,22.5,2019-05-07,2019-05-07_proceedings.txt
Stortinget-20190507-095514_5627200_5652200,gjennom sine tradisjoner og uformelle tilnærming til opplæring har studieforbund et potensial og en unik evne til å motivere voksne til livslang læring jeg vil likevel understreke at studieforbundet må fortsette å utvikle seg for å være relevante og for å kunne bidra til økt kompetanse for den enkelte regjeringen er opptatt av å bevare forutsigbare rammer for studieforbund,gjennom sine tradisjonar og uformelle tilnærming til opplæring har studieforbund eit potensial og ein unik evne til å motivere vaksne til livslang læring eg vil likevel understreke at studieforbundet må fortsette å utvikle seg for å vere relevante og for å kunne bidra til auka kompetanse for den enkelte regjeringa er opptatt av å bevare forutsigbare rammer for studieforbund,5627.2,5652.2,25.0,2019-05-07,2019-05-07_proceedings.txt
Stortinget-20190507-095514_5652200_5680500,og av å forenkle kravene til frivilligheten jeg mener at studieforbundet gjennom sin lovforankring har den forutsigbarheten som må til for at de skal kunne bidra til kompetanseheving på ulike måter i samfunnet de har dermed også gode muligheter for å videreutvikle seg innenfor brede sitt brede mandat og samfunnsoppdrag neste taler er interpellanten eee marit knutsdatter strand,og av å forenkle krava til frivilligheten eg meiner at studieforbundet gjennom sin lovforankring har den forutsigbarheten som må til for at dei skal kunne bidra til kompetanseheving på ulike måtar i samfunnet dei har der også gode muligheter for å vidareutvikle seg innanfor bree sitt breie mandat og samfunnsoppdragneste talar er interpellanten eee marit knutsdatter strand,5652.2,5680.5,28.300000000000182,2019-05-07,2019-05-07_proceedings.txt
Stortinget-20190507-095514_5689900_5711300,knutsdatter strandærede president det er godt å høre vi kan være enige om frivillighetens verdi eee og jeg er glad at statsråden qqq omtaler studieforbundet i så positivt ordlag det er vel interessant å høre at de er ulike problemsima stillingene for endring ikke nøds bli konkludert,knutsdatter strand eee president det er godt å høyre vi kan vere einige om frivilligheitas verdi eee og er glad statsråden omtaler studieforbundet i så positivt olag det er vel interessant å høyre at det i ulike problemsstillingar for endring ikkje nøds blir konkludert,5689.9,5711.3,21.400000000000546,2019-05-07,2019-05-07_proceedings.txt
Stortinget-20190507-095514_5711300_5739900,nå eee og da håper jeg statsråden kan rede redegjøre for hva vi får vite i løpet av våren eventuelt hva studieforbundet faktisk fortsatt må gå rundt og lure på eee hva vi kan vente oss og hva slags endringer eventuelt kommer til å stå i for her er det nettopp frivilligheten det handler om det er folk som stiller opp på sin egen fritid og da må væris respekt for at de trenger også forutsigbarhet i sin hverdag det er videre interessant at eee,nå eee og då håper eg statsråden kan eee rede redegjøre for kva vi får vite i løpet av våren eventuelt var studieforbunda faktisk fortsatt må gå rundt og lure på eee kva vi kan vente oss og var slags endringa eventuelt kommer til å stå i for her er det nettopp frivilligheten det handlar om der folk som stiller opp på sin eigen fritid og det me har ris respekt frå dethenget også forutsigbarhet i sin kvardag det er vidare interessant at eee,5711.3,5739.9,28.599999999999454,2019-05-07,2019-05-07_proceedings.txt
Stortinget-20190507-095514_5739900_5763400,studieforbunden sjøl veit best hvordan de løser sine utfordringer at statsråden er så tydelig i det poenget og også at kompetansereformen vil inkludere studieforbund det er vi glade for signala tar vi med oss videre og vil eee melde tilbake sagt at staten får mye mer for penger enn vi noen gang kan måle og vite i de investeringene som blir gjort i studieforbund,studieforbundet sjøl veit best kor len dei løyse sine utfordringar at statsråden er så tydeleg i det poenget og også at kompetansereforma vil inkludere studieforbund det er vi glade for signala tar med oss vidare og vil eee melde tilbakeslatt at staten får mykje meir for pengar enn vi nokon gong kan måle å vita i dei investeringane som blir gjort i studieforbund,5739.9,5763.4,23.5,2019-05-07,2019-05-07_proceedings.txt
