file,text_bm,text_nn,start,end,duration,date,proceedingsfile
Stortinget-20191022-145521_220000_222300,syns er gjenesten av valuta,stensen inotteke,220.0,222.3,2.3000000000000114,2019-10-22,2019-10-22_proceedings.txt
Stortinget-20191022-095533_275600_304500,stortingets møte er lovlig satt ærede medrepresentanter tidligere stortingsrepresentant for nordtrøndelag fylke arne lingstad er gått bort femtisyv år gammel som stortingsrepresentant var det den daværende kirke utdannings og forskningskomiteen som ble hans arena den kjente han godt fra før han hadde vært rådgiver for jon lilletun i perioden nittennittitre til nittennittisju,stortingets møte er lovleg satt er det med representantartidlegare stortingsrepresentant for nordtunlag fylket arne lingstad har gått bort femtisju år gammal som stortingsrepresentant var det den davane kirke utdannings og forskingskomiteen som blei hans arena den kjemte han godt frå før har me hadde vore rådgiver for jon lilletun i perioden nittennittitre til nittennittisju,275.6,304.5,28.899999999999977,2019-10-22,2019-10-22_proceedings.txt
Stortinget-20191022-095533_304500_332100,den gang lilletun var leder for komiteen selv ble arne lyngstad komiteens nestleder i sin første periode i sin andre periode var han medlem av delegasjonen til nordisk råd og i totusenogtre var han også leder for den norske delegasjonen det var lærer den unge verdøren hadde tenkt å bli da han begynte på sine studier som blant annet førte til en prisbelønt hovedoppgave i historie i nittennittito temaet var auro,den gong lilletun var leder for komiteen sel blei arne linstad komiteens nestleder i sin første periode i sin andre periode var han medlem av a delegasjon til nordisk råd og i totusenogtre var han også leder for den norske delegasjonen det var lærar den unge verden hadde tenkt å bli det han begynte på sine studiar som blant anna førte til ein prisbelønt hovedoppgave i historie i nittennittito tema var lot,304.5,332.1,27.600000000000023,2019-10-22,2019-10-22_proceedings.txt
Stortinget-20191022-095533_332100_362000,europadebatt i den sosialistiske internasjonale nittenfemtifem til sekstitre dette fikk krfs parlamentariske leder kåre hjemmestrede på og han hyret inn den unge historikeren og partimedlemmene som rådgiver for europapolitikken i krf arne lingstad ble valgt inn på stortinget i nittennittisju for krf det var hjemfylke nordtrøndelag som hadde satt han opp som sin førstekandidat i en alder av trettifem år kunne han allerede vise til en lang liste når det gjaldt verv,europadebatt i den sosialistiske internasjonalen nittenfemtifem til sekstitre dette fekk krfs parlamentariske leder kåre gjønnes reide på og han hyre tin den unge historikeren og partimedlemmer som rådgivar for europapolitikken ikrf arne lingstad blei valde inn på stortinget i nittennittisju for krf det var hjemfylket nordrundlag som hadde sett han opp som sin førstekandidat ein aldra trettifem år kunne han allereie vise til ein lang liste nådealt verv,332.1,362.0,29.899999999999977,2019-10-22,2019-10-22_proceedings.txt
Stortinget-20191022-145521_350900_353200,skal vi skylde,skapsråd,350.9,353.2,2.3000000000000114,2019-10-22,2019-10-22_proceedings.txt
Stortinget-20191022-145521_359300_380500,da er stortinget klar til å gå til votering over sakene på dagens kart sak en innstilling fra stortingets presidentskap om valg av stortingets ombudsmann for forvaltninga til den her saken er det satt fram ett forslag fra bjørnar moxnes på vegne av rødt forslag nummer en på vegne av rødt er opptatt støtte til forslaget,da er stortinget klart å gå til votering og ved sakene på dagens kart sak ein innstilling frå stortingets presidentskap om val av stortingets ombodsmann for forvaltninga til den her saka er det satt fram eitt forslag frå bjørnar moxnes på vegner av rudt forslag nummer ein på vegner av rudt er opptatt støtte til forslaget,359.3,380.5,21.19999999999999,2019-10-22,2019-10-22_proceedings.txt
Stortinget-20191022-095533_362000_390700,innen både krf og krf u som lokalpolitiker både i verdal og trondheim og fylkestinget i nordtrøndelag innen edruskapsarbeidet hadde han også hatt flere verv blant annet som leder for det norske totalavholdsselskaps ungdomsforbund nå en del av juvente i totusenogen ble han rammet av bærmarkskreft det var en tøff beskjed å få for en småbarnsfar men han var tapper og kom da også tilbake til arbeidet som stortingsrepresentant,innan både krf og krfu som lokalpolitikar både i vardal og trondheim og fylkestinget i nordtrøndelag innan ederskapsarbeidet hadde han også hatt fleire verv blant anna som leder for det norske totalavholdsselskaps ungdomsforbund nå ein del av uventet i totusenogein blei han ramma av barmarkskrift det var ein tøff beskjed å få for ein småbarns far men han var tapper kom det også tilbake til arbeidet som stortingsrepresentant,362.0,390.7,28.69999999999999,2019-10-22,2019-10-22_proceedings.txt
Stortinget-20191022-145521_380500_396800,dem som stemmer for forslaget bruker forknapp og sitter og dem som stemmer imot bruker motknapp og reiser seg det voteres voteringa er avslutta for forslaget stemte sju mot stemt åttini,dei som stemmer for forslaget bruker forknapp og sit og de som stemmer imot bruker motknapp og reiser seg det voterast voteringa er avslutta for forslaget stemt eee sju mot stemt åttini,380.5,396.8,16.30000000000001,2019-10-22,2019-10-22_proceedings.txt
Stortinget-20191022-095533_390700_415400,og etter valget i totusenogfem da mandatet i trøn nordtrøndelaget gikk tapt var han igjen rådgiver i krfs stortingsgruppe i en kort periode i totusenogseks ble ansatt som direktør for den diakonale lukkastiftelsen med hovedkontor i malvik i den forbindelse flyttet han og familien tilbake til de trønderske hjemtraktene qqq han var glad for oppgavene i lukasstiftelsen,og etter val totusenogfem der mandatet i trøn nordundlaget ikapte var han igjen rådgivar i kr stortingsgruppe ein kort partei totusenogseks blei antatt at direktør for den diakonale lukka stiftelsen med hovudkontor i malvik i den forbindelse flytte han og familien tilbake til dei trønderske hjentraktmeq han var glad for oppgåvene i lukas stiftelsen,390.7,415.4,24.69999999999999,2019-10-22,2019-10-22_proceedings.txt
Stortinget-20191022-145521_400100_429100,da tror jeg vi skal ta den her voteringa om igjen det er mye som tyder på det altså forslag nummer en på vegne av ruten er opptatt mdg har varsla støtte til forslaget det er altså to personer av en sann her som skal stemme imot dem som stemmer for forslaget bruker forknapp og sitter og dem som stemmer imot bruker motknapp og reiser seg det voteres voteringa er avslutta for forslaget stemte tre,det trur eg vi skal ta den her voteringa om igjen da det er mykje som tyder på det altså forslag nummer ein på vegner av rute opp til at mdg har varsla støtte etter forslaget det er altså to personar i ein salen her som skal stemme imot dei som stemmer for forslaget bruker forknapp og sit og dei som stemmer imot bruker motknapp og reiser seg det voterast voteringa er avslutta for forslaget er stemt tre,400.1,429.1,29.0,2019-10-22,2019-10-22_proceedings.txt
Stortinget-20191022-095533_415400_445300,men da sykdommen slo til igjen måtte han trappe ned og etter hvert akseptere at yrkeslivet var slutt engasjementet var likevel sterkt blant annet som brukerrepresentant i beslutningsemda for legemidler lyngstad engasjerte seg for partiet helt til det siste så sent som femte mai i år drøyt tre uker før han døde deltok han på en valgkampssamling i trondheim krf arne lyngstad vil bli husket som en trofast flittig og grundig person,men da sykdommen slo til igjen måtte han trappe ned og etter kvart akseptere at yrkeslivet var slutt angasjementet var likevel sterkt blant anna som brukerrepresentant i beslutningsemdar for legemiddel lyngstad engasjerte seg for partiet heilt til det siste så sent som femte mai i år drøyt tre uker før han døde deltok ham på ein vagkampssamling i trondheim krf arne lyngstad vil bli huska som ein trufast flittig og grundig person,415.4,445.3,29.900000000000034,2019-10-22,2019-10-22_proceedings.txt
Stortinget-20191022-145521_429100_458600,mot stemte nittiåtte den foregår dermed er forslaget forkasta innstillinga refereres tilrådingas punkt en er opptatt en til stortingets ombudsmann for forvaltninga for tidsrommet første februar tjuetjue til trettiførste desember tjuetjueen velges hanne halem mdg og rødt har varsla at dem vil stemme imot dem som stemmer for innstillinga bruker forknapp og sitter og dem stemmer imot bruker motknapp og reiser seg og det voteres voteringa er avslutta for innstillinga stemt,mot stemt nittiåtte len på gå dermed er forslaget forkasta innstillinga refererast tilrådninga punkt ein er opptatt ein til stortingets ombodsmann for forvaltninga på tidsrommet første februar tjuetjue til trettiførste desember tjuetjueein velger sanne halm mdg og raudt har varsla at dei vil stemme imot dei som stemmer for innstillinga bruker forknapp og sit og den skal me imot bruke motknapp og reiser og det voterast voteringa er avslutta for innstillinga stemt,429.1,458.6,29.5,2019-10-22,2019-10-22_proceedings.txt
Stortinget-20191022-095533_445300_460500,like mye bak i kulissene som på scenen der med vemod vi har mottatt meldingen om at han er gått bort vi minnes arne lyngstad for hans virke i stortinget og lyser fred over hane,like mye bak i kulissane som på senen dermed vemod vi har mottatt meldinga om at han er gått bort vi minnest arne lymstad for hans virke i stortinget og lyser fred over hane,445.3,460.5,15.199999999999989,2019-10-22,2019-10-22_proceedings.txt
Stortinget-20191022-145521_458600_485100,nittifire mot stemte tre dermed er innstillinga vedtatt tilrådingas punkt to er opptatt to kontorsjef bjørn derlind konstitueres som stortingets ombudsmann i forvaltninga for tidsrommet første til trettiførste januar tjuetjue rødt har varsla at dem vil stemme imot dem som stemmer for innstillinga bruker forknapp og sitter og dem som stemmer imot bruker motknapp og reiser seg og det voteres votering,nittifire mot stemt tre dermed er innstillinga vedtatt tilrådinga punkt to er opptatt to kontorsjef bjørn delin konstituere som stortingets ombodsmann forvaltninga for tidsrommet første til trettiførste januar tjuetjue raudt har varsla at dei vil stemme imot dei som stemmer for innstillinga bruker forknapp og sit og den stemmer imot bruker motknapp og reiser seg og det voterast votering,458.6,485.1,26.5,2019-10-22,2019-10-22_proceedings.txt
Stortinget-20191022-145521_485100_511600,for innstillinga stemte nittiseks mot stemt en dermed er innstillinga vedtatt sak to innstilling fra valgkomiteen innstillinga refereres som varamedlem til stortingets delegasjon til efta parlamentarikerkomiteene og den felles eøs parlamentarikerkomiteen velges solfrid lerbrekk dem som stemmer imot bes reise seg det har ingen gjort og det er enstemmig vedtatt sakene tre og fire va fem,for innstillinga stemt nittiseks mot stemt ein dermed er innstillinga vedtatt sak to innstilling frå valkomiteen innstillinga refererast som varamedlem til stortingets delegasjon til efta parlamentarikerkomiteene og den felles eøs parlamentarikerkomiteen velges solfrid leirebrekk dei som stemmer imot bes desse det har ingen gjort og det er enstemmig vedtatt sakene tre og fire va fem,485.1,511.6,26.5,2019-10-22,2019-10-22_proceedings.txt
Stortinget-20191022-145521_511600_541000,sak fem er annen gangs behandling av lovsak og gi lovvedtak en stortingets vedtak til lov om endringer i straffeprosessloven påtalemyndighetens uavhengighet med mer det foreligger ingen forslag til anmerkning og stortingets lovvedtak er dermed bifalt ved annen gangs behandling og blir å sende kongen i overensstemmelse med grunnloven sak seks er referat referatet er omtelt på representantene sine plasser og publisert på salappen presidenten refererer bare sakens nummer og forslag til vedtak trettien,sak fem er angangsbehandling av lovsak og gir lovvedtak ein stortingets vedtak til lov om endringar i straffeprosessloven påtalemyndighetens uavhengigheit med meir det foreligger ingen forslag til anmerkning og stortingets lovetak er dermed bifalt ved annomgangs behandling og blir og sen kongen i overensstemmelse med grunnloven sak seks er referat i referatet omtalt på representantane sine plassar og publisert på salappen presidenten refererer bare sakens nummer og forslag til vedtak trettiein,511.6,541.0,29.399999999999977,2019-10-22,2019-10-22_proceedings.txt
Stortinget-20191022-095533_527300_549300,representanten knut arild hareide som har vært permittert har igjen tatt sete den tidligere innkalte vararepresentanten for finnmark vetle langedal tar nå sete fra arbeiderpartiets stortingsgruppe foreligger søknad om at den innvilgede permisjonen for representanten elsemay norderhus syvende til tjuefjerde oktober endres i sykepermisjon fra og med toogtjuende oktober og inntil videre,representanten knut arild hareide som har vore permittert har gjentatt setet den tidlege innkalte varerepresentanten for finnmark vetle langedal tar nå sete frå arbeidarpartiet stortingsgruppe førlege søknad om at den innvilgede permisjonen frå representanten else may norderus syne til tjuefjerde oktober endra til sykepermisjon fram med toogtjuende oktober og inntil vidare,527.3,549.3,22.0,2019-10-22,2019-10-22_proceedings.txt
Stortinget-20191022-145521_541000_568500,og trettien foreslås vedlagt protokollen trettito foreslås sendt justiskomiteen trettitre og trettifire foreslås sendt kommunal og forvaltningskomiteen trettifem foreslås sendt kontroll og konstitusjonskomiteen trettiseks foreslås sendt næringskomiteen unntatt b som foreslås sendt næringskomiteen som forelegger sitt utkast til innstilling for utenriks og forsvarskomiteen til uttalelse før innstilling avgis det anses vedtatt beret før møtet heves,og trettiein foreslås vedlagt protokollen trettito foreslåast senkt justiskomiteen trettitre og trettifire foreslåast sendt kommunal og forvaltningskomiteen trettifem foreslåast sin kontroll og konstitusjonskomiteen trettiseks føreslåast sing næringskomiteen unntatt b som foreslår sin næringskomiteen som forelegg sitt utkast til innstilling for utenriks og forsvarskomiteen til uttalelse før innstilling avgis det anses vedtatt beret før møtet hevast,541.0,568.5,27.5,2019-10-22,2019-10-22_proceedings.txt
Stortinget-20191022-095533_549300_565800,denne søknad foreslås behandlet straks og innvilget og det anses vedtatt vararepresentanten tove lise torve foreslås innkalt for å møte i permisjonstiden det anses også vedtatt statsråd kjellbørge freiberg vil overbringe to kongelige proposisjoner,denne søknads forsats på handlet straks innvilget og det anses vedtatt varerepresentanten tove lise torve forsatt innkalt for å møte i permisjonstiden det anses også vedtattstatsråd kjell børge freiberg vil overdringe to kongelege proposisjonar,549.3,565.8,16.5,2019-10-22,2019-10-22_proceedings.txt
Stortinget-20191022-145521_568500_571700,det gjør ingen og møtet er dermed heva,det gjer ingen og møtet er dermed heva,568.5,571.7,3.2000000000000455,2019-10-22,2019-10-22_proceedings.txt
Stortinget-20191022-095533_572100_598900,statsråd kjellbørge freiberg president jeg har den glede å overbringe to proposisjoner eee det er proposisjon om lov om vern av forretningshemmeta forretningshemlighetsloven og samtykke til godkjenning av eøskomiteens beslutning nummer nett en totusenognitten av niogtyvende mars totusenognitten om innlemmelse iektiv,statsråd kjellberg freberg president har ein glede å overbringe to proposisjonar eee det er proposisjon om lov om vern av forretningshemligheita forretningshemlighetslovan og samtykke til godkjenning av eøskomiteens beslutning nummer nittien totusenognitten av nia tyvende mars totusenognitten om innlemmelse iektiv,572.1,598.9,26.799999999999955,2019-10-22,2019-10-22_proceedings.txt
Stortinget-20191022-145521_594700_597700,første det muterte,preste dei motella as,594.7,597.7,3.0,2019-10-22,2019-10-22_proceedings.txt
Stortinget-20191022-095533_598900_625400,tjueseksten ni førtitre forretningshemmelighetsdirektivet nummer to er endringer i introduksjonsloven nasjonalt tolkeregister proposisjonene vil bli behandlet på reglementsmessig måte til behandling foreligger de saker som er oppført på dagsorden nummer tin,tjueseksten ni førtitre forretningshemlighetsdirektivet nummer to er endringar i introduksjonslova nasjonalt tolkeregister represisjonen vil bli behandla på reglementsmessig måte til behandling for ligg dei saker som er oppført på dagsorden nummer tin,598.9,625.4,26.5,2019-10-22,2019-10-22_proceedings.txt
Stortinget-20191022-095533_625400_639500,innstilling fra stortingets presidentskap om valg av stortingets ombudsmann for forvaltninga innstilling tjue s tjuenitten tjuetjue første taler i saken er tone,innstilling frå stortingets presidentskap om val av stortingets ombodsmann for forvaltninga innstilling tjues tjuenitten tjuetjue første talar i saka er tone,625.4,639.5,14.100000000000023,2019-10-22,2019-10-22_proceedings.txt
Stortinget-20191022-095533_652800_680100,trøen vær så god ærede president nåværende sivilombudsmann aage thor falkanger har varslet at han vil fratre ved årsskiftet stortinget må derfor velge ny sivilombudsmannen for vervet som sivilombudsmannen kreves faglige kvalifikasjoner tilsvarende det som kreves for embete som høyesterettsdommer sivilombudsmannen er dessuten leder av sivilombudsmannens kontor som for tiden har cirka sytti ansatte derfor qqq,røn ver så god det president novarande sivilombodsmannen og tor falkanger har varslat at han vil frå til det ved årskiftet stortinget må derfor velge ny sivilombodsmann for vervet som sivilombodsmannen krevst fagleg konferasjonar tilsvaran er det som krevjast for embetet som høyesterettsdommer sivilombodsmannen er dessutan leder av sivilombodsmannens kontor som for tida har cirka sytti ansatte derfor,652.8,680.1,27.300000000000068,2019-10-22,2019-10-22_proceedings.txt
Stortinget-20191022-095533_680100_708000,kombinerer svært gode faglige kvalifikasjoner med profesjonell virksomhetsledelse herunder ha gode lederegenskaper og evne til tydelig kommunikasjon presidentskapet har valgt å gjennomføre en mer åpen prosess for rekruttering av sivilombudsmannen enn noen gang tidligere med ordinær utlysning og søknadsprosess vervet ble kunngjort i offentlig i mai tjuenitten med søknadsfist første oktober tjuenitten utlysgen har vært bredt annonsert,kombinere svært gode faglege konfikasjonar med profesjonell viksmelsledelse her under har gode lederekenskaper og evne til tydeleg kommunikasjon presentskapet har valt å gjennomføre ein meir open prosess for rekruttering av sivilombodsmannen enn nokon gong tidlegare med ordinær utlysning og søknadsprosess vervet blei kunngjort i offentleg i mari tjuenitten med søknadsvisk første oktober tjuenitten utlysnga har vore breitt annonsert,680.1,708.0,27.899999999999977,2019-10-22,2019-10-22_proceedings.txt
Stortinget-20191022-095533_708000_737700,administrasjonen har hatt bistand fra rekrutteringsbyrå til å sondere markedet ikke minst for å skape interesse for en slik fremtredende stilling og motivere personer som kan være aktuelle å søke det var fire søkere til stillingen da fristen var gått ut og hele søkerlisten har vært offentliggjort presidentskapet har enstemmig besluttet å innstille kommuneadvokat i oslo hanne harlem til vervet som ny sivilombudsmannen for perioden første februar tjuetjue til trettiførste desember tjuetjueen,ammestasjonen er at bistand frå rekrutteringsbyrå til å sondere markedet ikkje minst for å skape interesse for ein slik fremtredande stilling og motivere personar som kan vere aktuelle å søke det var fire søkere til stillinga der fristen var gått ut og heile søkelista har vore offentleggjort blei seskapet har einsamme beslutte til å innstille kommuneadvokat i oslo hanna halem til vervet som ny sivilombodsmannen for perioden første februari tjuetjue til trettiførste desember tjuetjueein,708.0,737.7,29.700000000000045,2019-10-22,2019-10-22_proceedings.txt
Stortinget-20191022-095533_737700_763100,presidentskapet vil samtidig foreslå at den kontorsjefen hos sivilombudsmannens kontor som har lengst ansinitet bjørn dalian midlertidig konstitueres som sivilombudsmannen i januar tjuetjue inntil harlem kan tiltre han har hale meg født i nittensekstifire og tok juridisk embetseksamen i nittennitti hun har jobbet som advokat hos regjeringsadvokaten og har vært dommerfullmektig i nordtroms heredsrett,presidentskapet vil samtidig foreslå at den kontorsjefen hos sivilombodsmannens kontor som har lengst ansinitet bjørn dalin midlertidig konstituerest som sivilombodsmannen i januar tjuetjue inntil haai kan tiltre han var hallem fødd i nittensekstifire og tok juridisk embetseksamen i nittennitti hon har jobbe som advokat hos regjeringsadvokaten og har vore dommerfullmektig i nordtroms herredsrett,737.7,763.1,25.399999999999977,2019-10-22,2019-10-22_proceedings.txt
Stortinget-20191022-095533_763100_793100,hun også jobbet som sjefsjurist i kreditttilsynet og advokat i norsk hydro harlem var justisminister i totusen til totusenogen assisterende direktør i norsk hydro totusenogen til totusenogfire og universitetsdirektør ved universitetet i oslo totusenogfire til totusenogsju i perioden totusenogsju til totusenogelleve var hun styreleder i helse sørøst regionalt helfo helseforetak og hadde flere andre tunge styreverv fra tjueelleve og fram til dag har harlem vært kommuneadvokat i oslo,ho også jobbe som skjefsjurist i kridikktilsynet og advokat i norsk hydro harleim var justisminister i totusen til totusenogein assisterande direktør i norsk hydro totusenogein til totusenogfire og universitetsdirektør ved universitetet i oslo totusenogfire til totusenogsju i perioden totusenogsju til totusenogelleve var hun styreleder i helse sørøst regionalt hel helseføretak og hadde fleire andre tunge styreverv frå tjueelleve og fram til i dag har harlem vore kommuneadvokat i oslo,763.1,793.1,30.0,2019-10-22,2019-10-22_proceedings.txt
Stortinget-20191022-095533_793100_820700,hanne harlem vil bli den sjette sivilombudsmannen i rekken siden høyesteredsdommer andreas skei ble utnevnt til den første sivilombudsmannen i desember nittensekstito hun blir den første kvinnelige sivilombudsmannen og det er gledelig at det nå er en kvinne som skal kle dette vervet presidentskapet har merket seg og vurdert grundig den kritikk som er rettet mot hanne harlem i hovedsak knyttet til saker hun har håndtert i rollen somt for oslo kommune,hanne hallem vil bli den sjette sivilombodsmannen i rekken sidan høystresdommer andreas skei blei utnemnd til den første sivilombodsmannen i desember nittensekstito ho blir den første kvinnelege sivilombodsmannen og det er gledeleg at det nå er ein kvinne som skal kle dette vervet presentskapet har merke seg og vurdert grundig den kritikk som er retta mot hanne hallheim i hovudsak knytt til saker ho har handtert i rollen somt for oslo kommune,793.1,820.7,27.600000000000023,2019-10-22,2019-10-22_proceedings.txt
Stortinget-20191022-095533_820700_840400,det er viktig å merke seg at hun i disse sakene har opptrådt som advokat for oslo kommune og hun har da fremmet kommunens interesser i sakene disse aspektene har vært vurdert i prosessen presidentskapet mener at det ikke er grunnlag for å hevde at hanne harlem er imot åpenhet eller innsyn president,det er viktig å merke seg at hun i desse sakene har opptredd som advokat for oslo kommune og hon har da fremma kommunens interesser i sakene desse aspektane har vore vurdert i prosessen presidentskapet meiner at det ikkje er grunnlag for å hevde at hanne harlem er imot openheit eller innsyn president,820.7,840.4,19.699999999999932,2019-10-22,2019-10-22_proceedings.txt
Stortinget-20191022-095533_840400_869200,med den kandidaten som nå er foreslått vil vervet som ombudsmann fylles av en juridisk kapasitet og meget erfaren leder med betydelig praktisk erfaring fra offentlig sektor jeg er trygg på at halem vil ivareta sivilombudsmannens viktige oppgave med å verne borgerne mot urett og bidra til å videreutvikle sivilombudsmannen som institusjon og sentral samfunnsaktør jeg anbefaler innstillingen å tar opp de forslag som er fremmet der takk,med den kandidaten som no har foreslått vil vere som ombodsmann fyllest av ein juridisk kapasitet og meget erfarne leder med betydeleg praktisk erfaring frå offentleg sektor eg er trygg på at haleim vil ivareta sivilombodsmannens viktige oppgåver med å verne borgerne mot urett og bidra til å vidareutvikle sivilombodsmannen som institusjon og sentral samfunnsaktør ja anbefaler innstillinga og tar opp dei forslag som er fremma der takk,840.4,869.2,28.800000000000068,2019-10-22,2019-10-22_proceedings.txt
Stortinget-20191022-095533_869200_876800,da har eee tone bilar trøen tatt opp eee innstillinga da er neste taler petter eide,da har eee tonebilete tatt opp innstillinga da er neste talar petter eide,869.2,876.8,7.599999999999909,2019-10-22,2019-10-22_proceedings.txt
