file,text_bm,text_nn,start,end,duration,date,proceedingsfile
Stortinget-20201118-095524_8877100_8906800,så har vi økt eee eller vi har faktisk dobla samferdselsbudsjettet det er mye veier til distriktene og det betyr at vi bygger sammen bo arbeidsmarkedsregionene eee effektivt så en storstilt samling eee satsing på samferdsel i motsetning til arbeiderpartiet gjorde sørger for at det samla skatte og avgiftstrykket på familiene reduseres i motsetning til arbeiderpartiet gjorde det er det som betyr noen ting i hverdagen det er helheten som betyr noen ting ikke symbolpolitikken,så har vi økt eee eller vi har faktisk dobla samferdselsbudsjettet det er ny vegar til distrikta og det betyr at vi bygger saman bod arbeidsmarkedsregionene eee effektivt så ein storstilt samling eee satsing på samferdsel i motsetning til arbeidarpartiet gjort sørger for at det samla skatte og avgifttrykket på familiane reduserast i motsetning til arbeidarpartiet gjort det er det som betyr noko ting i kvardagen det er helheten som betyr nokonting ikkje symbolpolitikken tida er ute,8877.1,8906.8,29.69999999999891,2020-11-18,2020-11-18_proceedings.txt
Stortinget-20201118-095524_8906800_8912800,spørsmål audla er fra representanten nina sandberg til distrikts og digitaliseringsministeren,spørsmål aula er frå representanten nina sandberg til distrikts og digitaliseringsministeren,8906.8,8912.8,6.0,2020-11-18,2020-11-18_proceedings.txt
Stortinget-20201118-095524_8916500_8940900,sandberg eee nesna er nordnorges elsteinstitusjon for høyere utdanning og nedlegginga av lærerutdanninga på nesten ad eee demonstrerer dessverre med all tydelighet at det trengs eee bedre politikk for utdanningstilbud i hele landet eee som grunnlag for bærekraftig lokalsamfunn og gode velferdstjenester nært folk der de bor,sandberg eee nesna er nordnoregs eldste institusjon for høgre utdanning og nedlegginga av lærarutdanninga på nesna er eee demonstrerer dessverre med all tydelegheit at det trengst eee betre politikk for utdanningstilbod i heile landet eee som grunnlag for berekraftig lokalsamfunn og gode velferdstenester nær folk der dei bur,8916.5,8940.9,24.399999999999636,2020-11-18,2020-11-18_proceedings.txt
Stortinget-20201118-095524_8940900_8968300,arbeiderpartiet vil bygge ut utdanningstilbudet eee sånn at den når flere og prioritere desentralisert utdanning men hva vil regjeringa gjøre for å styrke universitetene sin rolle i regional utvikling og den praksisnære forskninga takk statsråd hofstad helleland president regjeringa har satt kompetansepolitikk høyt på dagsorden gjennom flere år og kompetanserefo lærer hele livet,arbeidarpartiet vil bygge ut utdanningstilbodet eee som at ein når flere å prioritere det sentralisert utdanning men kva vil regjeringa gjere for å styrke universitetene sin rolle i regional utvikling og den praksisnære forskinga takk statsråd hofta hellelandpresident regjeringa har satt eee kompetansepolitikke høgt på dagsorden gjennom eee fleire år og kompetanserefo læra heile livet,8940.9,8968.3,27.399999999999636,2020-11-18,2020-11-18_proceedings.txt
Stortinget-20201118-095524_8968300_8998000,den representerer en tung satsing på ulike kompetansefremmende tiltak det utlyser store midler til utvikling av fleksible etter og videreutdanningstilbud og desentraliserte utdanningstilbud jeg er derfor glad for at vi har en eee handlekraftig eee minister for høyere utdanning eee som så eee til de grader har vært tydelig på at desentraliserte utdanningstilbud,den representerer ein tung satsing på ulike kompetansefreme tiltak det utlyser store midlar til utvikling av fleksible etter og vidareutdanningstilbod og desentraliserte utdanningstilbod eg er derfor glad for at vi har ein handlekraftig eee minister for høgre utdanning eee som så eee tedde grader har vore tydeleg på at det sentraliserte utdanningstilbod,8968.3,8998.0,29.700000000000728,2020-11-18,2020-11-18_proceedings.txt
Stortinget-20201118-095524_8998000_9022000,er viktig i statsbudsjettet for tjuetjueen så foreslår regjeringa å videreføre satsinga i utdanningsløftet med to og en halv milliard kroner på å utvide kapasiteten i videregående opplæring vekk fagskolene ved høyskolene og universitetene samt til kompetansetiltak for ledige og permitterte fylkeskommunene har også fått en forsterka kompetansepolitisk rolle,er viktig i statsbudsjettet for tjuetjueein så foreslår regjeringa å vidareføre satsingar i utdanningsløftet med to og ein halv milliard kroner på å utvidd kapasiteten i vidrivande opplæring vek fagerskolane ved høgskolane og universitetene samt kompetansetiltak for ledige og permiterte fylkeskommunar også fått ein forsterka kompetansepolitikrolle,8998.0,9022.0,24.0,2020-11-18,2020-11-18_proceedings.txt
Stortinget-20201118-095524_9022000_9051200,president universiteter og høyskoler har som en del av sitt samfunnsoppdrag å samarbeid med det lokale og regionale samfunns og arbeidslivet om utdanning og forskning at et lokalsamfunn reagerer når et studiested legges ned det forstår jeg veldig godt men universitetene og høyskolene sin studiestruktur det styres ikke politisk det er styrene som beslutter strukturen og da stortinget behandla strukturreformen i tjuefemten så understreka et stort flertall,president universitetet og høgskolar har som ein del av sitt samfunnsoppdrag og samarbeid med det lokale og regionale samfunns og arbeidslivet om utdanning og forsking at eit lokalsamfunn reagerer når eit studiested leggast ned det forstår er veldig godt men universiteten og høgskolane sin studiestruktur det styrast ikkje politisk det er styrande som beskyttar strukturen og da stortinget behandla strukturreforma i tjuefemten så understreka eit stort fleirtal,9022.0,9051.2,29.200000000000728,2020-11-18,2020-11-18_proceedings.txt
Stortinget-20201118-095524_9051200_9078600,jeg tror det var alle partiene bortsett fra senterpartiet så da altså med arbeiderpartiet og at det må også i framtiden slik de er i dag være opp til institusjonene selv og deres styrer og vurdere hva en hensiktsmessig studiestruktur innebærer jeg skulle snarveisrute til det han stor utvikling for tilflytting og tilgangen på kompetent arbeidskraft lonalt,eg trur det var alle partia bortsett frå senterpartiet så da altså med arbeidarpartiet og at det må også i framtida slik der i dag vere opp til institusjonane sel og deira styrer og vurderer va ein hensiktsmessig studiestruktur innebere så å se e n godgeving for tilflytting og tilgangen på kompetent arbeidskraft loonalt,9051.2,9078.6,27.399999999999636,2020-11-18,2020-11-18_proceedings.txt
Stortinget-20201118-095524_9078600_9101300,stortingsrepresentanten etterlyser hva regjeringa kan gjøre for å styrke praksisnær forskning undervisninga ved uhinstitusjonene det skal være forskningsbasert sånn at utdanninga skal baseres på ny forskning i profesjonsutdanninga bidrar i praksisnær forskning til å styrke kunnskap kvalitet og effektivitet i arbeidslivet regjeringa er opptatt,stortingsrepresentanten etterlyser varieringa han gjere for å styrke praksis nær forsking under visninga ved uhinstitusjonane det skal vere forskingsbasert sånn at utdanningane skal baserast på ny forsking i profesjonsutdanningar bidrag praksiser forsking til å styrke kunnskap kvalitet og effektivitet i arbeidslivet regjeringa er opptatt,9078.6,9101.3,22.69999999999891,2020-11-18,2020-11-18_proceedings.txt
Stortinget-20201118-095524_9101300_9128300,av høy kvalitet og relevans både utdanning og forskning det er direktoratet for internasjonalisering og kvalitetsutvikling i utdanninga diku og forskningsrådet lyser ut de midler som bidrar til arbeidsrelevant utdanning og praksisnær forskning nå jobber ministeren for høyere utdanning og forskning med en stortingsmelding om arbeidslivsrelevans som regjeringa planl tjuetjueen,av høg kvalitet og relevans både utdanning og forsking det er direktoratet for internasjonalisering og kvalitetsutvikring i utdanninga diku og forskingsrådet lyser ut det midla som bidrar til arbeidsrelevant utdanning og praksisnær forsking no jobbar ministeren for høgre utdanning og forsking med ein stortingsmelding om arbeidslivsrelevans som regjeringa plan tjuetjueein,9101.3,9128.3,27.0,2020-11-18,2020-11-18_proceedings.txt
Stortinget-20201118-095524_9128300_9158200,den her meldinga vil omhandle hvordan universiteter og høyskoler evne å møte arbeidslivets kompetansebehov det krever bred dialog og mer systematisk samarbeid mellom universiteter høyskoler og virksomheter både i stat kommune og privat næringslivja takk president eee da takker jeg statsråden for svar og registrerer at hun mener det er opp til studiestedene enkeltvis å sørge for at man får den totale kapasiteten av fagfolk i norge som er nødvendig,den her meldinga vil omhandle volans universitet og høgskolar evna å møte arbeidslivets kompetansebehov det krev bre dialog og meir systematisk samarbeid mellom universiteta høgskolar og virksomheter både i stat kommune og privat næringsliv børja takk president eee eee da takkar statsråden for svaret og registrerer at eee ho meiner det er opp til studiestadene enkeltvis å sørge for at ein får den totale kapasiteten av fagfolk i noreg som er nødvendig,9128.3,9158.2,29.900000000001455,2020-11-18,2020-11-18_proceedings.txt
Stortinget-20201118-095524_9158200_9185300,eee distriktsnæringsutvalget understreker jo at det kreves en aktiv politikk for å motvirke seg sentralisering og advarer om at fraflytting og mangel på arbeidskraft med relevant kompetanse er den største utfordringa for utviklinga av distriktsnorge eee og utvalget peker på og framhever spesielt utdanningssystemet sin sentrale rolle for eee folks valg av bosted og tilgangen til arbeids eee,eee distriktsnæringsutvalet understreker jo at det krevst ein aktiv politikk for å motvirke se sentralisering og avdarer om at fråflytting og mangel på arbeidskraft med relevant kompetanse er den største utfordringa for utviklinga av distriktsnoreg eee og utvalet peikar på å framheve ei spesielt utdanningssystemet sin sentrale rolle for eee folksvaga bustad og tilgangen til arbeids eee,9158.2,9185.3,27.099999999998545,2020-11-18,2020-11-18_proceedings.txt
Stortinget-20201118-095524_9185300_9215300,så vet vi at rundt sytti prosent eee blir værende i regionen der de studerer og hvis du ser på de som er født i regionen så er det hele åtti prosent eee jeg registrerer at høyre sitt partiprogram som jeg kjenner at distriktsministeren har hatt et særskilt ansvar for en anna rolle jeg sier ingenting om å styrke høyere utdanning i distriktene eee og da president må jeg nesten spørre eee hvordan vil regjeringa i praksis følge opp utvalgsanbefalinga om å styrke desentralisert utdanning for å hindre fraflytting og utvikle kompetanse i regihofstad helleland,så veit vi at rundt sytti prosent eee blir verande i regionen der dei studerer og viss du ser på dei som er født i regionen så er det heile åtti prosent eee eg registrerer eit høgre sitt partiprogram som eg kjenner at distriktsministeren har hatt eit særskilt ansvar for i ein anna rolle seier ingenting om å styrke høgre utdanning i distrikta eee og da president må eg nesten spørje eee korleis vil regjeringa i praksis følgje opp utvalssambefaring om å styrke det sentralisert utdanning for å hindre framføing og utvikle kompetanse i regio ropstad helleland,9185.3,9215.3,30.0,2020-11-18,2020-11-18_proceedings.txt
Stortinget-20201118-095524_9215300_9234000,ja president jeg er veldig eee veldig glad for den eee utredninga vi har eee fått fra distriktsnæringsutvalget veldig enig i mange av deres konklusjoner ikke minst det som handler om eee kompetanse eee og desentralisert utdanning at det er viktig med med den nærheten også for eee å å si,ja president eg er veldig eee veldig glad for den eee utredninga vi har fått frå distriktsnæringsutvalet veldig einig i mange av demes konklusjonar og ikkje minst det som handlar om eee kompetanse eee og det sentralisert utdanning at det er viktig med med den nærheten også for eee å å sikre,9215.3,9234.0,18.700000000000728,2020-11-18,2020-11-18_proceedings.txt
Stortinget-20201118-095524_9234000_9256600,kre og utvikle eee jobber rundt om i hele distriktsnorge og derfor så er jeg eee glad eee for at regjeringa har satsa betydelig på desentralisert utdanning eee og på det konkrete spørsmålet til representanten eee så vil jeg bare bekrefte at det satser vi eee videre på regjeringa eee bevilge hundre millioner til fleksible utdanningstilbud femten universet,kre og utvikle eee jobba rundt om i heile distriktsnoreg og derfor så er eg eee glad eee for at regjeringa har satsa betydelig på des se talisert utdanning eee og på det konkrete spørsmålet til representanten eee så vil eg berre bekrefte at det satsar vi eee vidare på regjeringa eee bevilga hundre millionar til fleksible utdanningstilbod femten univers,9234.0,9256.6,22.600000000000364,2020-11-18,2020-11-18_proceedings.txt
Stortinget-20201118-095524_9256600_9282800,siteter av høyskolen eee fikk tilbud til å opprette flere fleksible og desentraliserte tilbud som er tilpassa den livssituasjonen mange voksne er i og diku da har fått midler til utvikling og drift av studietilbud der det ikke er kampus det her skal bidra til at folk skal kunne eee i i eee større grad eee beklag,siteta og haugskolar eee fekk tilbod til å opprette fleire fleksible og det sentraliserte tilbod som er tilpassa til ein livssituasjon mange vaksne er i og dike da har fått midla til utvikling og drift av studietilbod der det ikkje er kempis det her skal bidra til at folk skal kunn eee i i eee større grad eee beklag,9256.6,9282.8,26.19999999999891,2020-11-18,2020-11-18_proceedings.txt
Stortinget-20201118-095524_9282800_9311900,president eee kompetanse vsutvalget for å følge opp det slår fast at mangelen på kvalifisert arbeidskraft er spesielt stor i helse og omsorgssektoren og at utfordringene er særlig store i distriktene eee i september så kom jo riksrevisjonen sin eee rapport om bemanningsproblemer i helseforetakene eee der det slås fast at jordmormangel eee påvirker kvaliteten på fødselsomsorgen eee til tross for økende jordmormangel så vet vi at kandidatmålet for jordmødre er uendra fra tjuetretten og framover,kompetanse ved årsutvaget for å følgje opp der slår fast at mangel på kvalifisert arbeidskraft er spesielt stor i helse og omsorgssektoren og at utfordringane er særleg store i distrikta eee i september så kom jo riksrevisjonen sin rapport om bemanningsproblemet i helseforetaka eee der det slås fast at jordmormangel eee påverkar kvaliteten på fødselsomsorgen eee tiltrossfor økande jordmormangel så veit vi at kandidatmålet for jordmødre er uendra frå tjuetretten og framover,9282.8,9311.9,29.100000000000364,2020-11-18,2020-11-18_proceedings.txt
Stortinget-20201118-095524_9311900_9340000,eee og nylig så la jeg merke til at nrk meldte at fødeavdelinga i kristian kristiansund av mangel på jordmøndre bemanna opp med vikarer fra såkalt rødland eee som ikke må eller som unntas fra karantenebestemmelsene eee så mitt spørsmål er ser statsråden at mangel på helsepersonell i distriktene eee også kan svekke beredskapen under pandemien og hva vil hun da eventuelt i regjering gjøre for å motarbeide ei sånn problemstilling statsråd hofstad helleland,eee og nyleg så la eg merke til at nrk melde at fødeavdelinga i kristian kristen sunn av mangel på jordmødre bemanna opp med vikarar frå såkalla røe land eee som ikkje må eller som må unntas frå karantene bestemmelsene eee så mitt spørsmål er ser statsråden at mangel og helsepersonell i distrikta eee også kan svekke beredskapen under pandemien og kva vil ho da eventuelt i regjeringa gjere for å motarbeide ei sånn problemstillingstatsråd hofte helland,9311.9,9340.0,28.100000000000364,2020-11-18,2020-11-18_proceedings.txt
Stortinget-20201118-095524_9340000_9364700,eee s president det jeg er glad for er jo at eee den den økninga som vi har sett av antall offentlige ansatte eee de siste årene det har kommet særlig i tre sektorer det har kommet innafor justis vi har mange mange flere politifolk det har kommet innafor utdanning og og forskning eee og det har kommet innafor helse og omsorg,eee president det er er glad for er jo at eee den den økninga som vi har sett av antal offentlege ansatte eee dei siste åra det har kome særleg i tre sektorar det har komme innanfor justis vi har mange mange fleire politifolk det har komme innanfor utdanning og og forsking eee og det har komme innanfor helse og omsorg,9340.0,9364.7,24.700000000000728,2020-11-18,2020-11-18_proceedings.txt
Stortinget-20201118-095524_9364700_9392400,helse og omsorgs medarbeidere som representanten er er innom og det er selvsagt viktig at vi bidrar med tilstrekkelig antall jordmødre i kommunen og derfor så satser også regjeringa målretta for å øke antall jordmødre i kommunene for tjuetjueen så har vi foreslått å øremerke seksti millioner kroner av tilskudd til styrking av helsestasjon og skolehelsetjenestentil jordmorsårsverk,helse omsorgs og medarbeidarar som representantene eee innom og det er sjølvsagt viktig at vi bidrar med tilstrekkeleg antal jordmødrer i kommunen og derfor så satsar også regjeringa målretta for å auke antal jordmødrer i kommunane på tjuetjueein så har vi fordeslått å øremerke seksti millionar kroner av tilskot til styrking av helsesituasjonen og skolhelsetjenestentil jordmors årsverk,9364.7,9392.4,27.69999999999891,2020-11-18,2020-11-18_proceedings.txt
Stortinget-20201118-095524_9392400_9417500,vi prioriterer flere jordmødre og vi prioriterer også ressurser til kommunen og derfor er jeg veldig glad for at eee regjeringa eee la fram eee støttepakke til kommunene på over sju milliarder bare for noen få dager siden står å halde oss innafor den tid med til seg spørsmål tolv er fra representanten arstein langholm hansen til distrikts og digitaliseringsministeren,vi prioriterer fleire jordmødrer og vi prioriterer også ressursar til kommunen og derfor er eg veldig glad for at eee regjeringa eee la fram eee støttepakket til kommunane på over sju milliardar berre for noko få dagar sidan tarv alle oss innanfor den tida me tilsett spørsmål tolv er frå representanten øystein langholm hansen til distrikts og digitaliseringsministeren,9392.4,9417.5,25.100000000000364,2020-11-18,2020-11-18_proceedings.txt
Stortinget-20201118-095524_9422200_9446500,hansen takk president distrikts og digitaliseringsministeren har gjentatte ganger og uttalt seg utrolig positivt om bredbåndsdekningen i norge men dekningsgraden varierer veldig og de tetteste befolkede områdene har en dekning på nittiseks prosent og den tilsvarende dekningen i distriktsnorge er bare femtiseks prosent,hansen takk president distrikts og digitaliseringsministeren har gjentatte gangar og uttalt seg utruleg positivt om breibandsdekninga i noreg men dekningsgraden verger veldig og dei tettaste befolka område har ein dekning på nittiseks prosent og tin tilsvarande dekningen i distriktsnoreg er bare femtiseks prosent,9422.2,9446.5,24.299999999999272,2020-11-18,2020-11-18_proceedings.txt
Stortinget-20201118-095524_9446500_9466600,områdene med lavest befolkningstetthet utgjør samtidig de dyreste områdene å bygge ut hvilken plan og tidshorisont har regjeringa for å oppnå full bredbåndsdekning i hele landet for å unngå at vi og i framtida har en todelt digital dekning,områdene med lavest befolkningstetthet utgjer samtidig dei dyraste områdene å bygga ut kva plan og tidsseriat har regjeringa for å oppnå full breibandsdekning i heile landet for å unngå at me og i framtida har ein todelt digital dekning,9446.5,9466.6,20.100000000000364,2020-11-18,2020-11-18_proceedings.txt
Stortinget-20201118-095524_9466600_9485100,president jeg takker representanten hansen for svaret nei spørsmålet så skal jeg prøve å svare eee og jeg er veldig glad for at eee representanten stiller det spørsmålet fordi at jeg er veldig stolt president over det eee norge har fått til eee når det kjem til eee bredbånd og mobildekning,president eg takkar representanten hansen for svaret nei spørsmålet så skal av prøva os svar eee og eg er veldig glad for at eee representanten stiller dei spørsmålet fordi at eg er veldig stolt president over det eee noreg har fått eee når det er kjem til eee brebande om mobildekning,9466.6,9485.1,18.5,2020-11-18,2020-11-18_proceedings.txt
Stortinget-20201118-095524_9485100_9514600,for bredbånd mobiltjenester og internett er grunnleggende viktig i dagliglivet vårt for næringsutvikling og arbeidsplasser og for gode offentlige tjenester ikke minst så har vi sett det nå under pandemien særlig også da knytta til eee s skoleverket og arbeidsplasser når jeg uttalte meg så positivt da så er det ikke uten grunn det er fordi utviklinga har vært særdeles positiv både i det tetteste befolka områdene og i distrikta,for breband mobiltenester og internett er grunnleggande viktig i dagleglivet våre for næringsutvikling og arbeidsplassar og for gode offer til tenester ikkje minst så har vi sett det no under pandemien særleg også da knytta til eee s skoleverket og arbeidsplassar når det har uttalt meg så positivt då så er det ikkje utan grunn det er fordi utviklinga har vore serdelles positiv både i dei tettest befolka områda og i distrikta,9485.1,9514.6,29.5,2020-11-18,2020-11-18_proceedings.txt
Stortinget-20201118-095524_9514600_9539900,denne regjeringa har virkelig fått fart på utbygging av bredbånd i hele landet investeringene i nett og tjenester har økt det blir investert over tolv milliarder kroner i nett og tjenester i tjuenitten over fire milliarder kroner mer enn i tjuetretten det er viktig å være klar over at nesten hundre prosent av husstandene i norge har tilbud om grunnleggende bredbånd,denne regjeringa har verkeleg fått fart på utbygging av breband i heile landet investeringane i netto teneste har økt det blir investert over tolv milliardar kroner i netto tenesta i tjuenitten over fire milliardar kroner meir enn i tjuetretten det er viktig å vere klar over at nesten hundre prosent av hustandane i noreg har tilbod om grunnleggande breiband,9514.6,9539.9,25.299999999999272,2020-11-18,2020-11-18_proceedings.txt
Stortinget-20201118-095524_9539900_9568700,det handler om at vi kan bruke offentlige portaler handle på internett bruke nettbank lese nettaviser strøm med video det er viktig tallene som representanten er inne på det gjelder høyhastighetsbredbånd og når vi tok over i tjuetretten ja da var det bare sekstitre prosent av norske husstander som hadde tilbud om sånne bredbånd per første halvår tjuetjue så hadde det her økt til åttini prosent av hustøynene,det handlar om at vi kan bruke offentleg portalar handla på internett brukt nettbank leis nettavisa strøm video det er viktig talane som representanten er inne på det gjeld høghastigheitsbre og når vi tok over i tjuetretten ja da var det berre sekstitre prosent av norske hustangar som har tilbod om sånne breiband per første halvår tjuetjue så hadde det her økte åttini prosent av husingane,9539.9,9568.7,28.80000000000109,2020-11-18,2020-11-18_proceedings.txt
Stortinget-20201118-095524_9568700_9598400,det er en formidabel økning dekninga har økt enda mer i spredtbygde strøk og dekninga for fiberbredbånd i distriktsområde har økt fra bare elleve prosent når regjeringa solberg tiltrådte til femtifem prosent i tjuetjue altså en femdobling en stor del er bygd ut av markedet sjøl men i områder der det ikke er kommersielt,det er ein formidabel økning dekninga har økt enda meir i sprett bygde strøk og dekninga for fiberbreane i distriktsområda har økt frå bare elleve prosent når regjeringa solberg tiltropte til femtifem prosent i tjuetjue altså ein femdobling ein stor del er bygd ut av markedet sjøl men i område der det ikkje er kommersielt,9568.7,9598.4,29.69999999999891,2020-11-18,2020-11-18_proceedings.txt
Stortinget-20201118-095524_9598400_9624900,grunnlag så er det staten som bidrar med tilskudd denne regjeringa har tildelt mer til bredbåndsutbygging i distriktene enn den rødgrønne regjeringa gjør men vi stopper ikke der vi fortsetter bredbåndsutbygginga med full kraft og jeg er derfor veldig glad for at vi nettopp fikk eee beskjed om at i europa sin eee sin eee desyindeks for tjuetjuge,grunnlag så er det staten som bidrar med tilskott denne regjeringa har tildelt meir til brebandsutbygging i distrikta enn den raudgrøne regjeringa gjer men vi stopper ikkje der vi fortsetter bredbandsutbygginga med full kraft og eg er derfor veldig glad for at vi nettopp fikk eee beskjed om at i europa sin eee sin eee desindeks for tjuetjug,9598.4,9624.9,26.5,2020-11-18,2020-11-18_proceedings.txt
Stortinget-20201118-095524_9624900_9654000,sammen med danmark som faktisk har de beste nettene i hele europa det er jeg veldig glad for i stortingsmeldinga digital agenda for tjueseksten så satte regjeringa som mål at alle hustaller i landet skal ha tilbud om høyhastighetsbredbånd på sikt vi arbeider nå med en ny stortingsmelding som kjem snart om bredbånd mobil og internett der skal jeg love representanten at denne regjeringa kjem til å sette nye ambisiøse mål,saman med danmark som faktisk har dei beste netta i heile europa det er eg veldig glad for i stortingsmeldinga digital agenda for tjueseksten så satte regjeringa som mål at alle hushalda i landet skal ha tilbod om høghastigheitsbreband på sikt vi arbeider no med ein ny stortingsmelding som kjem snart om bredband mobil og internett der skal lov representanten at denne regjeringa kjem til å sette nye ambisiøse mål,9624.9,9654.0,29.100000000000364,2020-11-18,2020-11-18_proceedings.txt
