file,text_bm,text_nn,start,end,duration,date,proceedingsfile
Stortinget-20201117-095521_7216800_7239100,fremfor alt bør alvorlig syke barn og unge og deres familier få tilrettelagt og helhetlig tilbud som ivaretar hele bredden av familiens behov mange ønsker mer hjemmetid noen ønsker å dø hjemme vår oppgave er legge til rette for dette blant annet gjennom etableringen av barnepalative team ved sykehusene,framforalt bør alvorleg syke barn og unge og deira familiar få til rettelagt og hel eit litt tilbod som i vartar heile bredden av familiens behov mange ønsker me hjemmetid nokon ønsker å dø hjemme vår oppgåve er legge til rette for dette blant anna gjennom etableringa av barnepaletive tim ved sjukehusa,7216.8,7239.1,22.300000000000182,2020-11-17,2020-11-17_proceedings.txt
Stortinget-20201117-095521_7239600_7268400,regjeringens politiske plattform gir et tydelig uttrykk for den politiske viljen der er til å styrke lindrende behandling og omsorg derfor har vi nå lagt fram en egen stortingsmelding målet med meldingen er tredelt vi vil synliggjøre døden som en del av livet men vil bidra til at de som har behov for det får tilgang til lindrende behandling og omsorg og med ønsket å legge til rette for best mulig livskvalitet og valgfrihet valgfrihet til å bestemme hvor man ønsket det,regjeringas politiske plattform gir eit tydeleg uttrykk for den politiske viljen det er til å styrke lindrande behandling og omsorg derfor har me nå lagt fram ein eigen stortingsmelding målet med meldinga er tredelt og vi vil synleggjere døden som ein del av livet me vil bidra til at dei som har behov for det får tilgang til lindrande behandling og omsorg og me ønsker å legge til rette for best mulig livskvalite til alferd valfred til å bestemme kor ein ønsker dø,7239.6,7268.4,28.799999999999272,2020-11-17,2020-11-17_proceedings.txt
Stortinget-20201117-095521_7268400_7296200,og om man ønsker å dø hjemme gjennom stortingsmeldingen tar regjeringen flere grep for å styrke kvalitet kapasitet og kompetanse i helse og omsorgstjenesten det er enkelte mennesker som skal få definere hva som oppleves som verdifullt derfor må medvirkning og valgfrihet står sentralt i tilbudet om lindrende behandling og omsorg spørsmålet hva er viktig for deg er minst like viktig i denne de av livet som ellers,og om ein ønsker å dø hjemme gjennom stortingsmeldinga tar regjeringa fleire grep for å styrke kvalitet kapasitet og kompetanse i helse og omsorgstjenesten det er enkelte menneske som skal få definere kva som oppleves som verdifult derfor må medverking av valfred for sentralt i tilbod om lindrande behandling og omsorg spørsmålet var er viktig for dei er minst like viktig i denne den av livet som ellas,7268.4,7296.2,27.800000000000182,2020-11-17,2020-11-17_proceedings.txt
Stortinget-20201117-095521_7296200_7325100,derfor vil regjeringen styrke arbeidet med forhåndssamtaler i helse og omsorgstjenesten gjennom systematisk bruk av forhåndssamtaler vil det bli tydeliggjøre hva som er viktig for den enkelte og i livets sluttfase først da kan vi nå målet om pasientens helsetjeneste og en verdig avslutning på livet for flere regjeringen vil utrede hvordan flere eldre kan få mulighet til å lage elektronisk livstestament og hvordan ordningen kan bli bedre kjent i befolkningen,derfor vil regjeringa styrke arbeidet med forholdsamtalar i helse omsorgstjenesten gjennom systematisk bruk av forhåndssamtalar vil det bli tydelegjere kva som er viktig for den enkelte og i livets sluttfase først då kan me nå måla om pasientens helsetjeneste og ein verdig avslutning på livet for fleire regjeringa vil utrede korleis fleire eldre kan få mulighet til å lage elektronisk lifstestament og korleis ordninga kan bli betre kjent i befolkningen,7296.2,7325.1,28.900000000000546,2020-11-17,2020-11-17_proceedings.txt
Stortinget-20201117-095521_7325100_7354400,håp er at det elektroniske livstestement kan bidra til større åpenhet at flere deler sine tanker rundt døden med sine nærmeste mangfold i tjenesten bidrar til økt valgfrihet derfor har regjeringen etablert et tilbud til lindrende enhet som drives etter hospisfilosofien frivillige og ideelle aktører kan søke om tilskudd målet bygge opp tjenester som kan vi kan være viktig supplement til de ordinære tjenestene sånne tilbud kan være spesielt viktig for alvorlig syke barn og unge og deres familier,håpet er at elektroniske livselsemek kan bidra til større openheit og at fleire deler sine tankar rundt døden med sine nærmaste mangfaldet i tenesten bidra til økt valgfrihet derfor har regjeringa etablert eit tilbod i lindonenhet som drivast etter hosspisfillosofien frivillig og ideelle aktørar kan søke om tilskot målet bygge opp tesar skal kan vere viktige supplement til dei ordinære tenestene sånne tilbod kan vere spesielt viktig for alvorleg syke barn og unge deiras familiar,7325.1,7354.4,29.299999999999272,2020-11-17,2020-11-17_proceedings.txt
Stortinget-20201117-095521_7354400_7377600,dette er familier som ofte har et sterkt behov for avlastning og omsorg vi skal alle dø en dag men alle andre dager skal leve det er kloke ord av en avdød svensk forfatter dette er og tittelen på stortingsmeldingen og det er og utgangspunktet for en ny fremtidsretta innsats innen lindrende behandling og omsorg president,dette er familiar som ofte har eit sterkt behov for avlasting og omsorg me skal alle dø ein dag men alle andre dagar skal me leve det er kloke ord av ein avdød svensk for fator dette er og tittelen på stortingsmeldinga og det er og utgangspunktet for ein ny framtidsretta innsats innan lindrande behandling og omsorg eee president,7354.4,7377.6,23.200000000000728,2020-11-17,2020-11-17_proceedings.txt
Stortinget-20201117-095521_7377900_7386600,da åpnes det opp for et eee replikkordskifte og første replikant er tuva moflag lucasen,da åpnes det opp for eit eee replikkordskifte og første replikant er tuva moflag mosen,7377.9,7386.6,8.700000000000728,2020-11-17,2020-11-17_proceedings.txt
Stortinget-20201117-095521_7389800_7415300,takk president eee dette er jo en stortingsmelding som omhandler palliasjon gjennom hele livet og for ulike diagnoser eee og så har vi opplevd at palliasjon for barn har fått stor oppmerksomhet her har det vært til dels faglig uenighet og også politisk,moflagtakk president eee dette er jo ein stortingsmelding som omhandlar palliasjon gjennom heile livet og for ulike diagnosar eee og så har vi opplevd at palliasjon for barn har fått eee stor oppmerksomhet her har det vore til dels fagleg ueinigheit og også politisk,7389.8,7415.3,25.5,2020-11-17,2020-11-17_proceedings.txt
Stortinget-20201117-095521_7415300_7429200,enighet eee president jeg vil trekke fram eee barnepalliative team eee hvor eee det både er fremmet forslag om at midler til etableringen av di disse skal øremerkes men det er jo en hel komite som er,ueinigheit eee president eg vil trekke fram eee barnepaative tim eee vor det både er fremme eit forslag om at midler til etableringa av de desse skal øremerkes men det er jo ein heil komite som er,7415.3,7429.2,13.899999999999636,2020-11-17,2020-11-17_proceedings.txt
Stortinget-20201117-095521_7429200_7452200,stiller seg bak at de skal etableres så jeg lurte på om statsråden kunne si noe om status for utrulling av barnepalliativ eee barn barnepalliative team som jeg ser på som grunnmuren i det tilbudet som skal sikre likeverdige tjenester for alvorlig syke barn og deres familier over hele landetstatsråd høie,stiller seg bak at dei skal etablerast så eg lurte på om statsråden kunne sei noko om status for utrulling av barnepagativ eee barn barnepaative tim som eg ser på som grunnmuren i det tilbodet som skal sikre likeverdige tenester for alvorleg psyke barn og deira familiar over heile landet statsråd høge,7429.2,7452.2,23.0,2020-11-17,2020-11-17_proceedings.txt
Stortinget-20201117-095521_7452200_7479300,president eee ja det arbeidet er i gang i alle helseregionene basisbevilgningen til helseregionene blei i eee eee samarbeidet som regjeringspartiene hadde med fremskrittspartiet i forbindelse med revidert budsjett økt med seks hundre millioner kroner eee og i den forbindelse så eee blei det og lagt føringer på at noen av disse midlene skal benyttes etablere regionalative team,president eee ja det arbeidet i gang i alle helseregionene basisblinga der helseregionene blei i eee samarbeidet som regjeringspartia hadde med fremskrittspartiet i forbindelse og revidert budsjett økt med seks hundre millionar kroner eee og i den forbindelse så eee blei det og lagt føringar på at nokon av desse mitane skal benyttast å etablere regionalitive tim,7452.2,7479.3,27.100000000000364,2020-11-17,2020-11-17_proceedings.txt
Stortinget-20201117-095521_7479300_7504800,så det er blitt gitt som et eee oppdrag til helseregionene i etterkant av behandlingen av revidert eee budsjett og helseregionene må da rapportere på dette på årsrapporteringen for tjuetjue og eee jeg har og tatt det opp i møte med eee direktøren og styrelederen i helseregionen at jeg forventer at de følger opp de føringene som det ble gitt i fra regjeringspartiene og fremskrittspartiet i forbindelse med behandlingen av revidert budsjett,så det er blitt gitt som eit eee oppdrag til helseregionene i etterkant av behandlinga av revidert budsjett og helseregionene må då rapportera på dette på årsrapporteringa frå tjuetjue og eee eg har og tatt opp i møtet med eee direktøren og styreledaren i helseregionen at eg forventar at dei følgjer opp dei føringane som det blei gitt ifrå regjeringspartia og framstegspartiet i forbindelse med behandinga av revidert budsjett,7479.3,7504.8,25.5,2020-11-17,2020-11-17_proceedings.txt
Stortinget-20201117-095521_7504800_7526200,moflag vil da ha ny replikk eee ja takk takk president eee eee det skal vi følge med på eee vi har jo vært bekymra for at dette ikke går fort nok og at man ikke får dette rullet ut som ønsket og det er jo derfor eee eee arbeiderpartiet sammen med senterpartiet og sv har fremmet dette forslaget merking av,moflag vil då ha ein ny replikk ja takk takk president eee det skal vi følge med på eee vi har jo vore bekymra for at dette ikkje går fort nok og at ein ikkje får dette rullet ut eee som ønsket og det er jo derfor eee eee arbeidarpartiet saman med senterpartiet og sv har fremmet dette forslaget merking av,7504.8,7526.2,21.399999999999636,2020-11-17,2020-11-17_proceedings.txt
Stortinget-20201117-095521_7526200_7543650,disse eee midlene men jeg går over til et litt annet tema president eee noe som flere har vært inne på her i dag og som det også er fremmet et løst forslag om som eee vi kommer tilbake til senere i debatten det handler om eee spesialisering i pala,desse midla men eg går over til eit lite anna tema president eee noko som fleire har vore inne på her i dag og som det også har fremme til eit løst forslag om som eee vi kommer tilbake til seinare i debatten det handlar om spesialisering i parar,7526.2,7543.65,17.449999999999818,2020-11-17,2020-11-17_proceedings.txt
Stortinget-20201117-095521_7543650_7571700,asjon for leger eee og jeg lurte på om helseministeren kunne utdype litt om hvordan man ser for seg at dette kan bli etablert så fort som mulig for å sik sikre at vi får eee får spesialistkompetanse for leger i palliasjonstatsråd høiepresident eee eee fra regjeringen sin side så har vi jo eee støtta den intensjonen og det er jo derfor og det i stortingsmeldingen omtalt at,asjon for leger eee og eg lurte på om helseministeren kunne utdype litt om kordan ein ser for seg at dette kan bli etablert så fort som mulig for å sik sikre at vi får eee får spesialistkompetanse for leger i povesjonstatsråd høgpresident eee eee frå regjeringa si side så har me jo eee støtta den intensjonen og det er jo derfor og det i stortingsmeldinga er omtalt at,7543.65,7571.7,28.050000000000182,2020-11-17,2020-11-17_proceedings.txt
Stortinget-20201117-095521_7571700_7600100,dette er noe som vi ønsker å vurdere eee så oppfatter jeg at eee stortinget i dag eee ønsker å konkludere eee om at det skal skje at det skal etableres en sånn spesialitet der har jeg ingenting imot fordi vi hadde ikke sagt at vi ville utrede de aller hvis vi ikke mente at det var en god ide eee så så det regner jeg med eee det blir sikkert en del av av debatten og voteringen så da vil vi jo ta tak i i det det var viktig for meg å si at,dette er noko som eg eee ønsker å vurdera eee så oppfattar eg at stortinget i dag eee ønsker å konkludera eee om at det skal skje at det skal etablerast ein sånn spesialitet det har eg ingenting imot fordi me hadde ikkje sagt at me ville utreda det viss me ikkje meinte at det var ein god ide eee så soder einig med eee det blir sikker ein del av av debatten og voteringa så då ville me jo ta tak i i det det var viktig for meg å seie at,7571.7,7600.1,28.400000000000546,2020-11-17,2020-11-17_proceedings.txt
Stortinget-20201117-095521_7600100_7627300,eee måten som spesialitetene nå etableres på har endra seg eee sånn at dette begrepet påbyggingsspesialitet eksisterer ikke i dagens eee spesialiststruktur eee så det man bare være klar over at det ikke lenger er et begrep som som brukes men det kan man eventuelt følge opp når stortinget har gjort sine sine vedtak men det er ikke da eee det som er den problemstilling,eee måten som spesialitetane nå eee etablerast på har endra seg eee sånn at eee dette begrepet påbyggingsspesialitet eksisterer ikkje i dagens eee spesialiststruktur eee så det ein berre klare over at det ikkje lenger det er eit begrep som som brukast men det kan eventuelt følgje opp når stortinget har gjort sine sine vedtak men det er ikkje då eee det som er problem,7600.1,7627.3,27.199999999999818,2020-11-17,2020-11-17_proceedings.txt
Stortinget-20201117-095521_7627300_7632900,da er neste replikant eee kjersti toppe,da er neste replikant eee kjersti toppe,7627.3,7632.9,5.599999999999454,2020-11-17,2020-11-17_proceedings.txt
Stortinget-20201117-095521_7640700_7668400,toppe qqq takk eee president eee eee i meldinga så blir jeg en eee jo kritisert fordi at han ikke er nok tydelig fra regjeringen sin side på eee eee på struktur og organiseringen av det politive arbeidet både i spesialisthelsetjenester og i kommunene eee slik som nou en sa at det skulle være regionalt eee politivt sent der ihus det skulle være,toppetakk takk eee president eee eee i meldinga så blir ein jo kritisert fordi at den ikkje er nok tydeleg i frå regjeringa si side på eee eee på struktur og organiseringa av det pallitive arbeid både i spesialisthelsetenesta og eee i kommunane eee slik som houen sa at det skulle vera regionalt eee politivt senterhus det skulle vera,7640.7,7668.4,27.699999999999818,2020-11-17,2020-11-17_proceedings.txt
Stortinget-20201117-095521_7668400_7691700,eee eee minimum et pallitivt team på alle lokalsjukehus og i kommunene så skulle det i alle fall være og palitiveteam eventuelt eee politivesentereee så jeg og etterlyser jo konkrete tiltak jeg ser det ikke øremerka midler i sjukehusene for å etablere dette her og det er jo ingen konkrete tiltak eller for å få opp halittive team i kommunene som,eee eee minem med eit palitivt tim på alle lokalsjukehus og i kommunane så skulle det i alle fall vera og politivetem eventuelt eee palitive senter eee så eg og etterlyser jo konkrete tiltak eg ser det ikkje øyremerkte midlar i sjukehusa for å etablera dette her og det er jo ingen konkrete tiltak heller for å få opp palitive team i kommunane som,7668.4,7691.7,23.300000000000182,2020-11-17,2020-11-17_proceedings.txt
Stortinget-20201117-095521_7691700_7720000,etter da vi har fått svar på spørsmålet så er det bare fire politive team i kommunenorge i dag hva vil statsråden gjøre for å virkelig få til en oppbygging av struktur og eee i på palliasjonsfeltet i helsetjenesten statsråd høie eee president når det gjelder helseregionene så er det jo sånt at der eee er det jo svært sjelden at vi bruker øre merkemidler men der bruker vi oppdragsdokumentene eee også for foretakene i generelle bevilgninger i denne sammenheng så har det jo,etter det vi har fått svar på spørsmål så er det berre fire palitive tim i kommune noreg i dag kva vil statsråden gjere for å verkeleg få til ein oppbygging av eee struktur og i på pallesjonsfeltet i helsetenestanstatsråd høye eee president når det gjeld helseregionane så er det jo sånt at der eee er det jo svært skjelletamp me bruker å gjere merkemiddel men der bruker me jo oppdragsdokument eee også for foretaka i generelle bevilgninga i denne samanheng så har det jo,7691.7,7720.0,28.300000000000182,2020-11-17,2020-11-17_proceedings.txt
Stortinget-20201117-095521_7720000_7744200,eee både fått bevilling der eee det har de markert at noe av denne økningen skal brukes til etableringen av kvalitative team for barn og så er det gitt og et oppdrag på det i oppdragsdokumentet det betyr at de må rapportere på det oppdraget så det er den måten som vi styrer spesialisthelsetjenesten på i disse spørsmålene når det gjelder kommunene så har vi ingen instruksjonsmulighet om forbi kommunene,eee både fått eee bevilning der eee eee der det er markert at noko av denne økninga skal brukast til etablering av pallitiativetim for barn og så er det gitt og eit oppdrag på det oppdragsdokumentet det betyr at vi må rapportera på det oppdraget så det er den måten som er styre spesialisthelsetjenesten på i desse spørsmåla når det gjeld kommunar så har me ingen instruksjons mulighet å forbi kommunane,7720.0,7744.2,24.199999999999818,2020-11-17,2020-11-17_proceedings.txt
Stortinget-20201117-095521_7744200_7771900,eee så der er vi jo avhengig av å bruke andre eee virkemidler og det viktigste virkemiddelet er selvfølgelig å styrke kommunens eee eee økonomi som vi har gjort eee det andre er jo å å legge dette inn i forhold til kompetanse og der ligger jo i statsbudsjettet for tjuetjueen en etableringen av kompetanseløft tjuetjuefem eee det ligg der det ligger en rekke øremerka midler til å heve kompetansen som eee og kes på dette området toppe,eee så der er me jo avhengig av å bruke andre eee verkemiddel og det viktigaste verkemiddelet er selvfølgelig å styrka kommunens eee eee økonomi som me har gjort eee det andre er jo å legge dette inn i forhold til kompetanse og der ligg jo i statsbudsjettet for tjuetjueein ein etablering av kompetanseløft tjuetjuefem eee det ligg der det ligg ein rekke øremerka midler det heve kompetansen som eee og kast på dette områdettoppe,7744.2,7771.9,27.699999999999818,2020-11-17,2020-11-17_proceedings.txt
Stortinget-20201117-095521_7771900_7792600,takk eee president eee i innstillingen så ligger det et eee forslag eee fra eee frp og sv om å se sette ned et utvalg som skal vurdere vurdere ulike eee praksis og konsekvenser eee når det gjelder aktiv dødshjelp,takk eee president eee i innstillinga så ligg det eit forslag frå eee frp og sv om å sette ned eit utval som skal vurdere vurdera ulike eee eee praksis og konsekvensar eee når det gjeld aktiv dødshjelp,7771.9,7792.6,20.700000000000728,2020-11-17,2020-11-17_proceedings.txt
Stortinget-20201117-095521_7792600_7809100,det er to partier som står bak nå eee men eee det kunne jo og tenkes eee at et slikt forslag snart vil kunne få flertall i denne eee salen eee jeg kunne gjerne tenkt meg og hørt hva statsråden eee,det er to parti som står bak no eee men eee det kunne jo og tenkast at eit slikt forslag snart ville kunne få fleirtalet i denne eee salen eee eg kunne gjerne tenkt meg å høyrte kva statsråden eee,7792.6,7809.1,16.5,2020-11-17,2020-11-17_proceedings.txt
Stortinget-20201117-095521_7809100_7835700,vil seie om fema aktiv dødshjelp på vegne av regjeringen dette er jo ikke en del av stortingsmeldinga men det har faktisk blitt en del av innstillinga eee jeg synes jo det er beklagelig når det skal handle om livshjelp og lindrende behandling men sånn er det så jeg ønsker en kommentar fra statsråden på tema aktivitetshjelpstatsråd høie nei president eee aktiv dødshjelp er ikke en del av regjeringen sin sin politikt fram,vil seie om tema aktiv dødshjelp på vegner av regjeringa dette er jo ikkje ein del av stortingsmeldinga men det har faktisk blitt ein del av innstillinga eee eg synest jo det er beklageleg når det skal handla om livshjelp og lindrande behandling men sånn er det så eg ønsker ein kommentar frå statsråden på tema aktiv døtshjelpstatsråd høene president eee aktiv dødshjelp er ikkje ein del av regjeringa sin eee sin politikt fram,7809.1,7835.7,26.599999999999454,2020-11-17,2020-11-17_proceedings.txt
Stortinget-20201117-095521_7835700_7864900,en stortingsmelding der det er livshjelp som er tema og det er jeg helt enig med representanten at eee eee målet vårt er å eee nettopp bidra til en livshjelp som gjør at folk får eee gode lindrende oppfølging at en og opplever stor grad av valgfrihet ved å kunne legge vekt på sine egne verdier eee og knytta til eee til det livet siste siste fase det å innføre aktiv dødshjelp i norge det eee er noe som eee,ein stortingsmelding der det er livshjelp som er tema og det er eg heilt einig med representanten at eee målet vårt er å nettopp bidra til ein livshjelp som gjer at folk får god lindrande oppfølging og at ein og opplever stor grad av valgfrihet for å kunne legge vekk på sine eigne verdiar eee og knytta til eee til den livets siste siste fase det å innføra aktiv dødshjelp i noreg det eee er noko som eee,7835.7,7864.9,29.199999999999818,2020-11-17,2020-11-17_proceedings.txt
Stortinget-20201117-095521_7864900_7886500,som jeg personlig er imot jeg mener at det eee s eee strider mot mange grunnleggende verdier både i samfunnet vårt og i i helse helsetjenesten og det er ikke aktivt det seg blir ikke en del av regjeringen sin politikkda er neste replikant eee nicholas wilkinsonsanjik,som eg personleg er imot eg meiner at det eee eee strid mot mange grunnleggjande verdiar både i samfunnet vårt og i i helsehelseteen sen det er ikkje aktiv det seg er ikkje ein del av regjeringas synpolitida er neste replikant eee nicholas wilkensenakk,7864.9,7886.5,21.600000000000364,2020-11-17,2020-11-17_proceedings.txt
Stortinget-20201117-095521_7891300_7920000,president det handler om barnepallisjonsteam igjen også ministeren sier at sykehusene skal bygge opp barneparasjonsteam fra oppdragsdokumentene når han svarte til eee toppe men vi vet at det ikke er på plass jeg jobber med også snakker med mange av disse foreldrene som har barn som trenger lindrende behandling som sier at det ikke er på plass,president eee handlar om barne poleasjonsteim igjen også ministeren seier at psykehusan skal bygge opp barnepodeasjonsteam frå oppdrasdokumenta når han svarte til toppe men vi veit at det ikkje er på plass eg jobbar med også snakke med mange av desse foreldra som har barn som trenger lindrande behandling som seier at det ikkje er på plass,7891.3,7920.0,28.699999999999818,2020-11-17,2020-11-17_proceedings.txt
Stortinget-20201117-095521_7920000_7944000,eee og da vil jeg gjerne spørre altså har eee helseministeren kontroll hvor mange eee palliative team har vi i norge nå hvilke helseforetak har det eee har eee barnetallesjonsteam jeg vil gjerne vite det for å være helt sikker på at helseministeren har kontrollstatsråd høie,eee og da vil eg gjerne spørje altså har eee helseministeren kontroll vor mange eee palliative tim har vi i noreg no kva helseføretak har det eee har eee barnetalsjonstim eg vil gjerne vite det for å vere heilt sikker på at helseministeren har kontroll statsråd høie,7920.0,7944.0,24.0,2020-11-17,2020-11-17_proceedings.txt
Stortinget-20201117-095521_7944000_7973300,president eee oppdraget til helseregionen om etablering av barnepallativeteam ble gitt i juni i år eee sånn at eee det er jo det oppdraget som de nå skal rapportere på ved årsrapporteringen for tjuetjue og da vil vi få oversikt over hvordan de ulike regionene har fulgt opp det eee oppdraget eee og jeg har hatt far ikke veldig lenge siden møte med helseregionene der jeg og understrekte betydningen av at de fulgte opp dette oppdraget og når den rapporteringen,president eee oppdraget til helseregionen om etablering av barnepoptivetim blei gitt i juni i år eee sånn at det er jo det oppdraget som dei nå skal rapportere på ver årsrapporteringa for tjuetjue og då vil me få oversikt over korleis i ulike regionar har følgt opp det eee oppdraget eee og eg har hatt for ikkje veldig lenge sidan møte med helseregionen der eg og understrekte betydninga av at dei følgde opp dette oppdraget så når den rapporteringa,7944.0,7973.3,29.300000000000182,2020-11-17,2020-11-17_proceedings.txt
