file,text_bm,text_nn,start,end,duration,date,proceedingsfile
Stortinget-20201117-095521_3299400_3327200,farm to forke strategien skal sikre overgangen til et bærekraftig matsystem i eu dette handler om å ta eee bedre vare på matsikkerhet og bedre tilgangen til et sunt kosthold fra ei sunnere planet på en måte som involverer både bønder næringsliv og forbrukere disse strategiene er bredt anlagt det vil være område som blir omfattet av eøssamarbeidet sjøl om naturvern er holdt ut eøsavtalen og,form til folk sevegen skal sikre overgangen til eit berekraftig matsystem i eu dette handlar om å ta eee betre vare på matsikkerheit og betre tilgangen til eit sunt kosthald for ei sunnare planet på ein måte som involverer både bønder næringsliv og forbrukarardesse strategiane er breitt anlagt det vil vere område som blir omfatta av eøssamarbeidet sjøl om naturvern er heldt ut eøsavtalen og,3299.4,3327.2,27.799999999999727,2020-11-17,2020-11-17_proceedings.txt
Stortinget-20201117-095521_3327200_3356800,sjøl om norge står utafor eus felles landbrukspolitikk et eksempel på dette her er arbeid som er varsla for å sikre mer bærekraftig bruk av plantevernmiddel vi kan også forvente at norge vil bli omfatta av tiltak som omhandler eu sitt vassdirektiv som er rammen for de viktige vassforvaltningsplanene våre norge er også tett på eu sitt arbeid med fornybar energi der det blir varsla en gjennomgang av biodrivstoff med høg risiko for arealbruksendringepresident,sjøl om noreg står utanfor eus felles landbrukspolitikk eit eksempel på dette her er arbeid som er varsla for å sikre meir berekraftig bruk av plantevernmiddel vi kan også forvente at noreg vil bli omfatta av tiltak som omhandlar eu sitt vassdirektiv som er ramme for dei viktige vassforvaltningsplanane våre noreg er også tett på eu sitt arbeid med fornybar energi der det blir varsla ein gjennomgang av biodrivstaff med høg risiko for arealbruksendringpresident,3327.2,3356.8,29.600000000000364,2020-11-17,2020-11-17_proceedings.txt
Stortinget-20201117-095521_3356800_3381700,europas grønne giv kombinerer klima og miljø med vekst velferd og verdiskaping initiativet er forankra på høgeste hold i eu for å sikre ei heilskaplig strategisk og koordinert gjennomføring i norge er oppfølginga av europas kaniv et felles prosjekt for heile regjeringa godt koordinert av utenriksministeren,europas grunne giv kombinere klima og miljø med vekst velferd og verdiskaping initiativet er forankra på høgaste hald i eu for å sikra ei heilskapleg strategisk og koordinert gjennomføring i noreg er oppfølginga av europa skal give eit fellesprosjekt for heile regjeringa godt kordinert av utanriksministeren,3356.8,3381.7,24.899999999999636,2020-11-17,2020-11-17_proceedings.txt
Stortinget-20201117-095521_3381700_3411000,vi er på vanlig måte godt i gang med å kartlegge og identifisere norske interesser i alle enkeltforslag som blir lagt fram vi registrerer at norsk næringsliv ulike bransjeaktører og andre interessenter nå også orienterer seg mer og mer mot europas grønne giv og de mange initiativer som er under utvikling det gjør det er klokt i president og det lover godt for ambisjonen til regjeringa om at norge skal være en aktiv partner for eu i det grønne skiftet,vi er på vanleg måte godt i gang med å kartlegge og identifisere norske interesser i alle enkelt forslag som blir lagt fram vi registrerer at norsk næringsliv ulike bransjeaktørar og andre interessentar no også orienterer seg meir og meir mot europas grunngjev og dei mange initiativa som er under utvikling det gjer dei klokt i president og det lovar godt for ambisjonen til regjeringa om at noreg skal vere ein aktiv partner for eu i det grønne skiftet,3381.7,3411.0,29.300000000000182,2020-11-17,2020-11-17_proceedings.txt
Stortinget-20201117-095521_3412900_3438400,presidenten vil foreslå at redegjørelsen om viktige eu og eøssaker legges ut for behandling i et senere møte i stortinget og det anses vedtatt sak eee to innstilling fra arbeids og sosialkomiteen om endringer i arbeids og velferdsforvaltningen sosialtjenesteloven lov om statens pensjonskasse og enkelte andre lover behandling av personopplysninger innstilling sytti l tjuetjue tjuetjueen,presidenten vil fortsatt redøelsen om viktige eu og eøs saker leggast ut eee for behandling i eit seinare møte i stortinget og det anses vedtatt sak eee to innstilling frå arbeids og sosialkomiteen om endringar i arbeids og velferdsforvaltninga sosialtenestelova lov om statens pensjonskasse og enkelte andre lover behandling av personopplysningar innstilling sytti elev tjuetjue tjuetjueein,3412.9,3438.4,25.5,2020-11-17,2020-11-17_proceedings.txt
Stortinget-20201117-095521_3438400_3468000,jamfør proposisjon ett hundre og trettifem l tjuenitten tjuetjue ber noen om ordet i den saken så synes ikke sak tre innstilling fra justiskomiteen om representantforslag fra stortingsrepresentantene petter eide kari elisabeth kaski karin andersen og mona fagerås om rettslig amnesti mot anmeldelse og straffeforfølgelse for egne brukerdoser til personer,i jamfør proposisjon eitt hundre og trettifem ell tjuenitten tjuetjue ber nokon om ordet i den saka så synest eee ikkje sak tre innstilling frå justiskomiteen om representantforslag frå stortingsrepresentantane petter eide kar elisabeth kaski karin andersen og mona fagerås om rettsleg amnesti mot anmeldelse og straffeforfølgelse for eigne brukerdoser til personar,3438.4,3468.0,29.59999999999991,2020-11-17,2020-11-17_proceedings.txt
Stortinget-20201117-095521_3468000_3497500,som yter assistanse til rusbrukere hvor det er fare for liv og helse innstilling femtitre s tjue tjue tjuetjueen jamfør dokument åtte trettifem s tjuenitten tjuetjue etter ønske fra komiteen vil presidenten ordne debatten slik fem minutter til hver partigruppe og fem minutter til medlemmer av regjeringen videre vil det innenfor den fordelte taletid blir gitt anledning til inntil seks replikker med svar etter innlegg fra medlemmer av regjeringen og de som måtte tegne seg på talerlisten utover den fordelte taletid får en taletid på inntil tre minutter,som yter asistanse til rusbrukarar vor det er fare for liv og helse innstilling femtitre s tjuetjue tjuetjueein jamfør dokument åtte trettifem s tjuenitten tjuetjue etter vespakomiteen vil presidenten øydne debatten slik fem minutter til vare partigruppa fem minutter til medlemmer av regjeringa ved det vil innanfor den fordelte taletid blitt anledning til inntil seks replikker med svar etter innlegg frå medlemmer av regjeringa og dei som måtte ten seg på talarlista utover den fordelte taletid får ein taletid på inntil tre minuttar,3468.0,3497.5,29.5,2020-11-17,2020-11-17_proceedings.txt
Stortinget-20201117-095521_3497500_3502000,første taler er ingunn foss som er sakens ordfører,første talar er ingunn foss som er sakas ordførar,3497.5,3502.0,4.5,2020-11-17,2020-11-17_proceedings.txt
Stortinget-20201117-095521_3514700_3538300,foss takk eee president først så vil jeg takke komiteen for eee godt samarbeid i denne saken som er et representantforslag fra sv om rettslig amnesti mot anmeldelse og straffeforfølgelse forfølgelse for egne brukere doser til personer som yter assistanse til rusbrukere hvor det er fare for liv og helse,for takk eee president først eee så vil eg takka komiteen for godt samarbeid i denne saka som er eit representantforslag frå sv om rettsleg amnesti mot anmeldelse og straffeforfølgeske forfølgelse frå eigne brukardoser til personar som yter asistanse til rusbrukarar må det er fare for liv og helse,3514.7,3538.3,23.600000000000364,2020-11-17,2020-11-17_proceedings.txt
Stortinget-20201117-095521_3538300_3566700,og president komiteen oppfatter forslagsstillerne dithen at det i påvente rusreformen ønskes et rettslig amnesti for de som ydet hjelp til rusbrukere og som trenger helsehjelp slik at disse ikke risikerer å bli straffeforfullt av politiet for besittelse av egne brukerdoser av narkotika forslagsstillerne mener dette vil bidra til at flere rusbru rusmisbrukere kan få raskere og bedre helsehjelp og at terskelen for kontakt av politi og helsevesen blir lavere,og president komiteen oppfattar forslagsstillarane dithen at dei i påventa rusreforma ønskes eit rettsleg amnesti for dei som yder hjelp to rusbrukarar som treng helsehjelp slik at desse ikkje risikerer å bli straffeforfulgt av politiet for besittelse av eigne brukardoser av narkotika forslagsstillarane meiner dette vil bidra til at fleire rusbru rusmisbrukarar kan få raskare og betre helsehjelp og at terskelen for kontakt av politi og helsevesen blir lavare,3538.3,3566.7,28.399999999999636,2020-11-17,2020-11-17_proceedings.txt
Stortinget-20201117-095521_3566700_3594000,president jeg er enig i at problemstillingen om straffeforfølging som hindrer for å oppsøke helsehjelp og narkotikaproblemer skal tas på alvor og viser i den anledning til regjeringas ønske om å gjennomføre en rusreform i påvente reformen er likevel rettstilstanden slik at riksadvokaten i rundskrid ii tjuefjorten om narkotikasaker har vært tydelig på at politiet skal prioritere de mest alvorligekaforbrytelsene,president eg er einig i at problemstillinga om straffeforfølging som hinder for å oppsøke helsehjelp for narkotikaproblema skal tas på alvor og viser i denne anledning til regjeringas ønske om å gjennomføra ein rusreform i påvent av reforma er likevel rettstilstanden slik at riksadvokaten i rundskriv to tjuefjorten om narkotikasaker har vore tydeleg på at politiet skal prioritera dei mest alvorlegekaforbrytelsene,3566.7,3594.0,27.300000000000182,2020-11-17,2020-11-17_proceedings.txt
Stortinget-20201117-095521_3594000_3607900,vi har forståelse for at riksadvokatens rundskriv ikke nødvendigvis har kjent blant gruppa gruppen av rusmisbrukere representantforslag retter seg mot men understreker at dette skal være gjeldende praksis hos politiet slik det er instruert fra øverst og portal myndighet,vi har forståelse for at riksadvokatens rundskriv ikkje nødvendigvis har kjent blant kopar gruppe nav rusmisbrukarar representantforslag retter seg mot men understreka dette skal vere gjeldande praksis hos politiet slik det instruerte øveste påtalemyndighet,3594.0,3607.9,13.900000000000091,2020-11-17,2020-11-17_proceedings.txt
Stortinget-20201117-095521_3607900_3626200,i statsrådens brev til komiteen vises det au til at dette har vært gjeldende praksis siden totusenogfjorten og at oppfatningen er at politiet ikke anmelder personer som har bes bistått i en nødsituasjon en kan imidlertid ikke utelukke at slike tilfeller unntaksvis kan ha forekommet president,i statsrådens brev til komiteen visest det au til at dette har vore gjeldande praksis siden totusenogfjorten og at oppfatningen er at politiet ikkje anmelder personar som har bes bistått i ein nødsituasjon ein kan imidlertid ikkje utelukka at slike tilfelle unntaksvis kan ha forekomme president,3607.9,3626.2,18.299999999999727,2020-11-17,2020-11-17_proceedings.txt
Stortinget-20201117-095521_3626200_3651600,som sagt jeg er enig i at problemstillingen må tas på alvor men jeg er au enig med statsråden i at det vil være både unødvendig og ressurskrevende og igangsette et lovarbeid knytta til dette når problemstillingen ser ut til å være ganske liten og regjeringa likevel skal komme til stortinget med forslag til vedtak og lovendringer i tilknytning til rusreformen takkneste taler er eee solveig skids,som sagt er eg einig i at problemstillinga må tas på alvor men er au einig med statsråden i at det vil vere både unødvendig og ressurskrevjande og i gangsette eit lovarbeid knytt til dette når problemstillinga ser ut til å vere ganske liten og regjeringa likevel skal komme til stortinget med forslag til vedtak og lovendringar i tilknytning til rusreformatakkneste talar er eee solvei skids,3626.2,3651.6,25.40000000000009,2020-11-17,2020-11-17_proceedings.txt
Stortinget-20201117-095521_3665000_3689600,president allerede da og denne dørum var justisminister for snart tjue år sia så blei det understreka at politiet ikke skulle grave i lommene til rusavhengige mennesker etter brukerdose men heller prioritere alvorlige narkotikaforbrytelser riksadvokaten understreker også i sitt rundskriv fra tjuefjorten at politiet skal prioritere de mest alvorlige narkotikaforbrytelsene,sitt president allrede å denne dørum var justisminister for snart tjue år sidan så blei det understreka at politiet ikkje skulle grave i lommane til rusavhengig menneske etter bruke dosar men heller prioritere alvorlege narkotikaforbrytelser riksadvokaten understrekar også i sit rundskriv frå tjuefjorten at politiet skal prioritere dei mest alvorlege narkotikaforbyndelsene,3665.0,3689.6,24.59999999999991,2020-11-17,2020-11-17_proceedings.txt
Stortinget-20201117-095521_3689600_3714700,og det er gitt klar instruks for å overstå påtalemyndighet om at politiet ikke skal prioritere straffeforfølging av mennesker med alvorlig narkotikaproblemer president spørsmålet om straffeforfølging er til hinder for å oppsøke helsehjelp for narkotikaproblemer må tas på alvor sjøl om det trolig forekommer sjelden ser vi imidlertid av og til tilfeller der politiet anmelder personer som er ruspåvirka og trenger helsehjelp,og det er gitt klar instruks frå overste påtalemyndighet om at politiet ikkje skal prioritere straffeforfølging av menneske med alvorleg narkotikaproblema president spørsmålet om straff oforfølging er eit hinder for å oppsøke helsehjelp for narkotikaproblema må tas på alvor sjøl om det troleg forekommer skjeldan ser ved midlertid av og til tilfelle der politiet anmelder personar som er ruspåverka og treng helsehjelp,3689.6,3714.7,25.09999999999991,2020-11-17,2020-11-17_proceedings.txt
Stortinget-20201117-095521_3714700_3744400,og president jeg forstår at det kan føre til at færre ønsker å ta kontakt når dem trenger hjelp og det er alvorlig president det er derfor regjeringa nå skal legge fram en rusreform fordi mennesker som har rusproblemer skal få hjelp og ikke straff fordi det må bli lettere å søke hjelp og få hjelp uten å måtte være redd for å bli straffa det gjelder både dem som har alvorlige rusproblemer dem som akkurat har innsett at dem er i ferd med å få et rusproblem eller har innsett at dem har det,og president eg forstår at det kan føre til at færre ønsker å ta kontakt når dei treng hjelp og det er alvorleg president det er derfor regjeringa no skal legge fram ein rusreform fordi menneske som har rusproblem skal få hjelp og ikkje straff fordi det må bli lettare å søke hjelp og få hjelp utan å måtte vere redd for å bli straffa det gjeld både dei som har alvorlege rusproblema dei som akkurat har innsett at dei er i ferd med å få eit rusproblem eller har innsett at dei har det,3714.7,3744.4,29.700000000000273,2020-11-17,2020-11-17_proceedings.txt
Stortinget-20201117-095521_3744400_3772900,eller for pårørende som er bekymra for noen som ennå ikke forstår at dem er i ferd med å få et rustproblem president vi må kunne søke hjelp uten å måtte frykte straff og president det ville være både ressurskreende og unødvendig å sette i gang et eget lovarbeid på dem spesifikke problemstillingene som forslagsstillerne reiser her når vi veit at regjeringa nå arbeider med og skal legge fram for stortinget en rusreform med en rekke forslag til lovendringa på dette området,eller for pårørende som er bekymra for nokon som ennå ikkje forstår at ein er feil må få eit rusproblem president vi må kunne søke hjelp utan å måtte frykte straff og president det ville vere både ressurskrevjande og unødvendig å sette i gang eit eige lovarbeid på den spesifikke problemstillingane som forslagsstillarane reiser her når vi veit at regjeringa no arbeider med og skal legge fram for stortinget ein rusreform med ein rekke forslag til lovendringar på dette området,3744.4,3772.9,28.5,2020-11-17,2020-11-17_proceedings.txt
Stortinget-20201117-095521_3772900_3795200,president jeg ser fram til at regjeringa legger fram sitt forslag til rusreform og jeg håper at det ikke er lenge til den kommer til stortinget takk neste taler er petter eide deretter statsråd bent høieeide,president eg ser fram til at regjeringa legg fram sitt forslag til rusreform og eg håpar at det ikkje er lenge til den kommer til stortinget takkneste talar er petter eide deretter statsråd bent høieeide,3772.9,3795.2,22.299999999999727,2020-11-17,2020-11-17_proceedings.txt
Stortinget-20201117-095521_3795200_3822600,ja tusen takk eee president eee god formeddag eee vi eee i sv legger fram her et forslag til en midlertidig lov i påvente av eee av ru av rusreformen vi er kjent med det forhold at eee rusavhengig i byene våre eee som gjerne eee som gjerne er er sprøytenarkomane veldig eller av og til observerer observerer,ja tusen takk eee president eee god formiddag eee vi eee i sv legg fram her eit forslag til ein midlertidig lov i påvente av eee av ru av rusreforma vi er kjent med det forhold at eee rusavhengige i byn våre eee som gjerne eee som gjerne er eee er eee sprute narkomane veldig eller av og til eee observerer observerer,3795.2,3822.6,27.40000000000009,2020-11-17,2020-11-17_proceedings.txt
Stortinget-20201117-095521_3822600_3845200,eee risiko for død og t og trussel mot helse og gjerne også overdose og vi mener og vi har også observert at flere av dem er engstlige for å ka ta kontakt med helsevesenet av redsel for selv å bli eee selv å bli straffeforfult i sommer president var jeg ute i på gata i oslo sammen med qqq noen av representanter for organisasjonene som jobber med dette,eee risiko for død og og h trussel mot helse gjer noko så overdoser og vi meiner og vi har også observert at fleire av dei er engskeleg for å kunne ta kontakt med helsevesenet av redsel for sil å bli eee til å bli straffeforfult i same president var eg ute på gata i oslo saman med nokon når representantar for organisasjonane som job med dette,3822.6,3845.2,22.59999999999991,2020-11-17,2020-11-17_proceedings.txt
Stortinget-20201117-095521_3845200_3868900,eee og jeg påtraff en gruppe mest brøyteavhengig der som eee satt og den en ja mens jeg var der så ble den ene personen hun fikk da en sprøyte i halsen og fikk et alvorlig sånn type krampeaktige anfall mens de lå der og selvfølgelig var vi egen de som var rundt deg veldig veldig engstlige for at det her kunne skje noe men noen kom heldigvis til rekningen veldig fort etterpå men det er nettopp denne type situasjoner at vi ønsker,eee og i eit påtreffe ein gruppe med prytavhengig der som eee satt og den en eee mens eg var der så blei den eine personen fekk da ein sprute i halsen og fekk eit alvorleg sånn type krumpaktige anfall men so låder og så følger var vi eg dei som var rundt dei veldig veldig engsteleg for at det her kunne skje no men du kom heldegvis til tekninga veldig fort sette på men er nettopp denne type situasjoner at vi ønsker,3845.2,3868.9,23.700000000000273,2020-11-17,2020-11-17_proceedings.txt
Stortinget-20201117-095521_3868900_3895800,og tilby en form for rettslig amnesti for de som observerer slike ting i eee i gata norge er på eee overdosetoppen i europa eee vi qqq vi har to hundre og seksti overdoser i norge i i året og vi tror at veldig mange av de kunne vært dette kunne vært redusert hvis vi hadde gred å redusere frykten blant de andre rusavhengige til å lettereontakt,og tilby er ein form for rettsleg amnesti for dei som observerer slike ting i eee i gata noreg er på overdomstoppen i europa eee vi vi har to hundre og seksti overdoser i noreg i i året og vi trur at veldig mange av dei kunne var dette kunne vore redusert viss vi hadde gredde å redusere frykten blant dei andre rusavhengi til å lettreontakt,3868.9,3895.8,26.90000000000009,2020-11-17,2020-11-17_proceedings.txt
Stortinget-20201117-095521_3895800_3925800,forslaget vårt legger opp til at det skal være en rettslig beskyttelse for de som tar kontakt slik at de selv ikke trenger å være engstlige for å tilkalle helsevesenet så sier jeg president at i eee merknadene fra de andre partiene fra regjeringspartiene og så videre og også arbeiderpartiet så henviste seg til et rundskriv fra riksadvokaten som eee har eee s fortalt politiet instruert politiet at det ikke skal straffeforfølge denne type hendelser og det er helt riktig og det er vel og bra at det er slik,forslaget vårt legg opp til at det skal vere ein rettsleg beskyttelse for dei som tar kontakt slik at dei sel ikkje trenger å vere engsteleg for å tilkalle helsevesenet så seier eg president at i eee merknadene frå dei andre partia frå regjeringspartia og så vidare og også arbeidarpartiet som henviser seg til eit rundskri frå riksadvokaten som eee har i fortalt politi instruert politiet at det ikkje skal straffeforfølge denne type hendelser og det er heilt riktig og det er vel og bra at det er slik,3895.8,3925.8,30.0,2020-11-17,2020-11-17_proceedings.txt
Stortinget-20201117-095521_3925800_3954900,men det er altså ikke slik president at det er rusavhengig på gata i oslo leser rundskriv fra riksadvokaten de gjør faktisk ikke det uavhengig av om hva som er beskjeden fra riksadvokaten til eee til politiet så er det sånn at den frykten er der sant det er en opplevelse av en frykt som de har og mange av de rusavhengige i o i i i byene våre har vært rusavhengig levd i det miljøet i mange mange år,men det er altså ikkje slik president at rusavhengi på gata i oslo leser rundskriv frå riksadvokaten det gjer faktisk ikkje det uavhengig av om kva som er beskjeden frå riksadvokaten til eee til politiet så er det jo sånn at den frikten er der at det er ein opplevelse av ein frykt som dei har og mange av dei rusavhenga i og i i i byane våre har vore rusavhengi levt i det miljøet i mange mange år,3925.8,3954.9,29.09999999999991,2020-11-17,2020-11-17_proceedings.txt
Stortinget-20201117-095521_3954900_3978000,og de har opplevd politiet som en fiende i mange år og de opplever ikke at de nødvendigvis får den beskyttelsen de trenger hvis de varsler denne type saker eee et et eee en amnestilov som vi er kjent med fra andre land eee vil på en helt annen måte sende et tydelig signal til denne gruppa om at de trygt kan eee eee,og dei har opplevd politiet som ein finn det i mange år og dei opplever ikkje at det nødvendigvis får den beskyttelsen dei treng viss dei varslar denne type saker eee eit eit eee ein amnestilov som vi har kjent med frå andre land eee vil på ein heilt anna måte sende eit tydeleg signal til denne gruppa om at det trygt kan eee eee,3954.9,3978.0,23.09999999999991,2020-11-17,2020-11-17_proceedings.txt
Stortinget-20201117-095521_3978000_3999300,kan varsle de kan ringe inn telefonnummeret eller kontakt ambulanse hvis de ser at dette er eee eee hvis de opplever at dette er nødvendig og jeg mener at det er helt a helt nødvendig at vi gjør dette nå president for å beskytte denne gruppa så er det også sånn at vi skal behandle deler av dette når vi skal beha rusreformen,kan varsle dei kan ringe nødtelefonnumret eller kontakte ambulanse viss dei ser at dette er eee viss dei opplever at dette er nødvendig og eg meiner at det er heilt heilt nødvendig at vi gjer dette noko president for å beskytte denne gruppa så er det også sånn at vi skal behandle deler av dette når vi skal beha rusreforma,3978.0,3999.3,21.300000000000182,2020-11-17,2020-11-17_proceedings.txt
Stortinget-20201117-095521_3999300_4009600,det er usikkert når den kommer til stortinget eee og jeg og det kan gå mange liv tapt president før stortinget får vedtatt en en rusreform,det er usikkert når den kommer til stortinget eee og eee og det kan gå mange liv tapt president før stortinget får vedtatt en ein rusreform,3999.3,4009.6,10.299999999999727,2020-11-17,2020-11-17_proceedings.txt
Stortinget-20201117-095521_4009600_4038200,eee så jeg så vårt forslag i denne saken er at vi ber eee justisdepartementet om å lage en midlertidig lov det trenger ikke å være en stor og omfattende lov lo lovarbeid for det skal være midlertidig å gjelde fram til vi får en gjeldende rusreform som kanskje og forhåpentligvis også da vil gi denne form for rettslig eee rettslig beskyttelse så med det legger jeg fram sv sitt forslag president takk da har representanten eide tatt opp det forslaget sv har,eee så ja så vårt forslag i denne saka er at vi ber eee justisdepartementet om å lage ein midlertid lov det treng ikkje å vere ein stor og omfattande lov lålovarvere for det skal vere midlertidig og gjelde fram til vi får ein gjeldnerysreform som kanskje ogforhopelegvis også da vil gi denne form for rettsleg eee rekkeleg beskyttelse så med det legg eg fram f sitt forslag president eee takkda har representanten eide tatt opp det forslaget sv har,4009.6,4038.2,28.59999999999991,2020-11-17,2020-11-17_proceedings.txt
Stortinget-20201117-095521_4038200_4042500,eee neste taler er eee statsråd bent høie,eee neste talar er eee statsråd bent høie,4038.2,4042.5,4.300000000000182,2020-11-17,2020-11-17_proceedings.txt
Stortinget-20201117-095521_4048600_4075000,statsråd høie president eee regjeringen arbeider med en rusreform der straff for bruk av narkotikar skal erstattes med hjelp behandling og oppfølging representantene tar opp en viktig problemstilling og jeg vet at der er gjort undersøkelser der det fremkommer at noen kan vegre seg for å tilkalle hjelp av frykt for å bli an,statsråd høie president regjeringa arbeider med ein rusreform der straff for bruken av kotikar skal stattast med hjelp behandling og oppfølging representanten tar opp ein viktig problemstilling og eg veit at det er gjort undersøkelser der det ka fremkommer at nokon kan vegra seg for tilkalle hjelp av frykt for å bli an,4048.6,4075.0,26.40000000000009,2020-11-17,2020-11-17_proceedings.txt
