file,text_bm,text_nn,start,end,duration,date,proceedingsfile
Stortinget-20201118-095524_13377300_13406700,alle flyselskap eee påvirkes og utfordres sterkt av pandemien regjeringen fortsetter å følge nøye med på utviklingen i markedet og situasjonen til flyselskaper vil være eee altså vil vi vi vil løpende vurdere behovet for å tilpasse eksisterende tiltak eller å ta nye grep eee hvis og når og om det anses for hensiktsmessigllestadpresident jeg eee takker for eee svaret,alle flyselskap eee påverkast og utfordrast sterkt av pandemien regjeringa fortset å følgja nøye med på utviklinga i markedet og situasjonen til flyselskapa vil vere eee altså vil me me vil løpande vurdera behovet for å tilpassa eksisterande tiltak eller å ta nye grep eee visst og når og om det anses for hensiktsmessig president eg eee takkar for eee svaret,13377.3,13406.7,29.400000000001455,2020-11-18,2020-11-18_proceedings.txt
Stortinget-20201118-095524_13406700_13430000,eee senterpartiet sitt engasjement i dette ligger jo til alle tri de norske eee flyselskaper eee men det er klart oppmerksomheten i det siste har vært mest eee knytta til eee norwegian eee og det var jo tema tidligere i dag når statsministeren var i eee stortinget og og både svarte på spørsmålet og stilte eee sine spørsmål,eee senterpartiet sitt engasjement i dette ligg jo til alle tre dei norske eee flyselskapa eee men det er klart oppmerksomheten i det siste har vore mest eee knytta til eee no wien eee og det var jo tema tidlegare i dag når statsministeren var i eee stortinget og og både svarte på spørsmål stilte eee sine spørsmål,13406.7,13430.0,23.299999999999272,2020-11-18,2020-11-18_proceedings.txt
Stortinget-20201118-095524_13430000_13446400,eee men statsministeren sa at næringsministeren og samferdselsministeren hadde hatt gjentatte runder med norwegen og da lurer jeg på i norwegian heter sjefen jacob skram hvor mange møter har næringsministeren hatt med jacob skram denne høsten,eee men statsministeren sa at næringsministeren og samferdselsministeren hadde hatt gjentatte rundar med nor viken og då lurar eg på i novigenhette sjefen jacob skram kor mange møte har næringsministeren hatt med jakobskram denne hausten,13430.0,13446.4,16.399999999999636,2020-11-18,2020-11-18_proceedings.txt
Stortinget-20201118-095524_13446400_13468199,statsråd nybøærede president eee det er et veldig konkret spørsmål som jeg ikke tor å sier det eksakte antallet på vi har hatt eee løpende kontakt med norwegian og med jacob skram det har vært i form av både fysiske møter vi har hatt digitale møter og det har og vært en del telefonsamta men det nyaktige antallet,statsråd nybø president eee det er eit veldig konkret spørsmål som eg ikkje får å seie det eksakte antalet på me har hatt eee løpande kontakt med nor riden og med jacob skram det har vore i form av både fysiske møter me har hatt digitale møter og det har og vore ein del telefonsamta men det nyjerktige antal,13446.4,13468.199,21.799000000000888,2020-11-18,2020-11-18_proceedings.txt
Stortinget-20201118-095524_13468199_13489999,det det tror jeg ikke står på talerstolen her i stortinget og sier men det har vært eee omfattende kontakt og norwegian er blant de eee eee altså blant de enkeltselskapene jeg har hatt mest kontakt med eee den siste tida eee jeg eee jeg er opptatt av å ha god dialog eee med med luftfarten og de som har bedt om møter har fått møte og me brukt eee som jeg sa i mitt innleg,le det det trur eg ikkje å stå på talarstolen her i stortinget å seie men det har vore eee omfattande kontakt og norvidjen er blant dei eee ei altså blant dei enkeltselskapa eg har hatt mest kontakt med eee den siste tida eee eg eg er opptatt av å ha en god dialog eee med med luftparten og dei som har bedt om møtet ho har fått møte og me brukt eee som eg sa i mitt innleg,13468.199,13489.999,21.799999999999272,2020-11-18,2020-11-18_proceedings.txt
Stortinget-20201118-095524_13490000_13519600,fjorten milliarder kroner på ekstraordinære tiltak for luftfarten men norwegen er et selskap som og i en spesiell situasjon på grunn av den finansielle strukturen eierstrukturen i selskapet eee og og jeg syns det er vanskelig å forstå at senterpartiet vi late til å skulle ha en eee ønska ukritisk å eee s eee legge kapital inn i inn i det selskapet pollestadpresident det er vil være en fordel for denne regjeringa om de lytter mer,g fjorten milliardar kroner på ekstra ordinære tiltak frå luftfarten men norvidjen er eit selskap som og er i ein spesiell situasjon på grunn av den finansielle strukturen eigar strukturen i selskapet eee og og eg synest det er vanskeleg å forstå at senterpartiet ver late til å skulle ha ein eee ønske ukritisk og se legge kapital inn inn i det selskapet president det er vel vore ein fordel for denne regjeringa om dei lyttar meir,13490.0,13519.6,29.600000000000364,2020-11-18,2020-11-18_proceedings.txt
Stortinget-20201118-095524_13519600_13548000,og fantaserte mindre for det er ikke sånn at senterpartiet noen gang har sagt at vi skal legge penger ukritisk inn i norvijien men vi har sagt at vi ønsker å redde de tre norske flyselskapa gjennom krisen eee vi registrerer at de norske flyselskapene ikke har fått ei eneste krone i støtte en har fått kjøp av leverte tjenester eee en har fått garantier,og fantaserte mindre for det er ikkje sånn at senterpartiet nokon gong har sagt at me skal legga pengar ukritisk inn i no widen men me har sagt at me ønsker å redda dei tre norske flyselskapa gjennom krisen eee me registrerer at dei norske flyselskapa ikkje har fått ei einaste krone i støtte ein har fått kjøp av leverte tenester eee ein har fått garantiar,13519.6,13548.0,28.399999999999636,2020-11-18,2020-11-18_proceedings.txt
Stortinget-20201118-095524_13548000_13574400,en har fått noe reduserte avgifter men en har altså i motsetning til alle andre bransjer omtrent som er har ramma ikke fått støtte eee og da er det litt eee rart å bli beskyldt for denne eee type eee ting eee mitt spørsmål til næringsministeren er deler næringsministeren målet om at alle tre norske flyselskap skal overleve koronapandemien,ein har fått noko reduserte avgifter men ein har altså i motsetning til alle andre bransjeomtrent som me har sama ikkje fått støtte eee og då er det litt eee rart å bli beskylt for denne eee type eee ting eee mitt spørsmål til næringsministeren er deler næringsministeren målet om at alle tre norske flyselskap skal overleve koruna pandemien,13548.0,13574.4,26.399999999999636,2020-11-18,2020-11-18_proceedings.txt
Stortinget-20201118-095524_13574400_13595666,ærede president jeg er opptatt av at vi skal ha en luftfart etter conronapandemiene jeg er opptatt av at vi skal ha konkurranse i eee ett etter koronapandemien men jeg er opptatt av at må vurdere enkeltselskapene ut fra den situasjonen de står i og som representanten pollestad sier eee senært ute og sagt at,ærede president eg er opptatt av at me skal ha ein luftfart etter konrånepandemien eg er opptatt av at me skal ha konkurranse i eee ett etter koronapandemien men eg er opptatt av å må vurdera enkeltselskapa ut frå den situasjonen dei står i og som representanten pollestad seier eee senore ute og sagt at,13574.4,13595.666,21.26599999999962,2020-11-18,2020-11-18_proceedings.txt
Stortinget-20201118-095524_13595666_13616933,de ønsker å redde norwegian det betyr at det ikke er noen insitamenter for kreditorer for eiere til å gjøre noe gjøre noen ting til å bli med og redusere gjelda til å bli med å spytte inn kapital for senterpartiet har jo sagt at staten tilrop med oljefondet koste hva det koste vil det er ikke fornuftig bruk av skattebetalerner her om et selskap,vi ønsker å redda nor igjen det betyr at det ikkje er nokon insitament av for kreditorar for eigarar til å gjere noreg gjer nokon ting til å bli med å redusera gjeld og til å bli med og spytta inn kapital for senterpartiet har jo sagt at staten stiller opp med oljefondet kosta kva det kosta vil det er ikkje fornuftig bruk av skattebetalanekar her om mitt selskap,13595.666,13616.933,21.267000000001644,2020-11-18,2020-11-18_proceedings.txt
Stortinget-20201118-095524_13616933_13646200,med over førti nesten femti milliarder kroner i gjeld jeg ønsker norwegian alt godt jeg synes norwegen har tjent det norske luftmarkedet godt de har vært en viktig aktør for oss de har om hvor en viktig del av konkurransesituasjonen i norsk luftfart og jeg håper de overleve men min jobb er å vurdere bruken av skattebetalernes penger og den har i denne situasjonen ikke vært å gå inn i selskapet med kapital da går vi videre til neste spørsmål som er fra representanten sverre myrli til samferdselsministeren,med over førti nesten femti milliardar kroner i gjeld eg ønsker no widen alt godt esenet no iden har kjent det norske luftmarkeder godt det har vore ein viktig aktør for oss ja for en viktig del av konkurransesituasjonen i norsk luftfart og eg håpe dei overlever men min jobb er å vurdera bruken av skattebetalanes pengar og den har i denne situasjonen ikkje bare å gå inn i selskapet med kapital da går eg vidare til neste spørsmål som er frå representanten sverre mulig til samferdselsministeren,13616.933,13646.2,29.266999999999825,2020-11-18,2020-11-18_proceedings.txt
Stortinget-20201118-095524_13661900_13688300,myrli vær så god takk for det president flere drosjesentraler har etter liberaliseringa av drosjenæringa første november kutte ut beredskap på natta fylkeskommunene kan gi enerett til å kjøre drosje noen steder men dette gjelder,mili ver så godtakk for det president fleire drasjesentralar har etter liberaliseringa av drosjenæringa første november kutte ut beredskap på natta fylkeskommunar kan gi einerett til å køyre drasse nokon stader men dette gjeld,13661.9,13688.3,26.399999999999636,2020-11-18,2020-11-18_proceedings.txt
Stortinget-20201118-095524_13688300_13717500,dersom eneretten tildeles andre enn de som har avtaler for tilrettelagt transport pasientreiser eller skoleskys i området vil ikke de som kjører på kontrakt kunne tilby enkeltturer i samme område hva vil regjeringa gjøre for å sikre et godt drosjetilbud i distrikta i framtida statsråd knut arild hereide gode president jeg takker for spørsmålet og jeg ønsker å legge til rette,dersom eineretten tildelast andre enn dei som har avtale for tilrettelagt transport pasientreiser eller skoleskyss i området vil ikkje dei som køyrer på kontrakt kunne tilby enkeltturar i same område kva vil regjeringa gjere for å sikre eit godt drosjetilbod i distrikta i framtidastatsråd knut arild hære gode president eg takkar for spørsmålet og eg ønsker å legge til rette,13688.3,13717.5,29.200000000000728,2020-11-18,2020-11-18_proceedings.txt
Stortinget-20201118-095524_13717500_13746100,for et best mulig drosjetilbud i hele landet det er fylkeskommunene som er nærmest til å vurdere behovet for drosjetransport innenfor sitt område fylkeskommunene har derfor i den nye drosjereguleringa fått et verktøy til å sikre tilfredsstillende transporttilbud fylkeskommunen kan når det nødvendig tildele en rette i kommuner med mindre enn tjue tusen innbyggere og lavere befolkningstetthet,for eit best mulig trosjetilbod i heile landet det er fylkeskommunane som er nærmast til å vurdere behovet for drosjetransport innanfor sitt område fylkeskommunane har derfor i den nye drosjereguleringa fått eit verktøy til å sikra tilfredsstillande transporttilbod fylkeskommunen kan når det er nødvendig tildele einretta i kommunar med mindre enn tjue tusen innbyggarar og lavere befolkningstetthet,13717.5,13746.1,28.600000000000364,2020-11-18,2020-11-18_proceedings.txt
Stortinget-20201118-095524_13746100_13775400,en åtti innbyggere hver per kvadratkilometer tildeling av eieretten kan eventuelt kombineres med økonomisk kompensasjon for tjenesten dersom markedet ikke tilbyr et tilfredsstillende tilbud på kommersielt grunnlag så kan fylkeskommunene tildele en rette innenfor en eller flere kommuner eneretten skal fastsettes i kontrakt og skal tildeles etter åpne,enn åtti innbyggarar kvar per kvadratkilometer tildeling av einerettar kan eventuelt kombinerast med økonomisk kompensasjon for tenesten dersom markedet ikkje tilbyr eit tilfredsstillande tilbod på kommersielt grunnlag så kan fylkeskommunane tildele eineretta innanfor ein eller fleire kommunar eineretta skal fastsettast i kontrakt og skal tildelast etter opne,13746.1,13775.4,29.299999999999272,2020-11-18,2020-11-18_proceedings.txt
Stortinget-20201118-095524_13775400_13803600,prosesser maksimal kontraktslingde er fem år de aktørene som har kontrakt om å utføre skolekyss eller pasienttransport vil kunne konkurrere om tildeling av en rettskontakt på lik linje med andre aktører fylkeskommunene kan innenfor gjeldende regelverk samordne for eksempel skolekyss og tildeling av eneretter,prosessar maksimal kontraktlengde er fem år dei aktørane som har kontrakt om må utføra skulekyss eller pasienttransport vil kunne konkurrere om tildeling av einerettskontrakt på lik linje med andre aktørar fylkeskommunane kan innanfor gjeldande regelverk samordna for eksempel skulekyss og tildeling av einerettar,13775.4,13803.6,28.200000000000728,2020-11-18,2020-11-18_proceedings.txt
Stortinget-20201118-095524_13803600_13833200,videre kan fylkeskommunene samarbeide med helseforetakene om samordning av enretta skolekyss og pasienttransport dersom det er hensiktsmessig ved å åpne for tildeling av eienretta har regjeringen lagt til rette for at fylkeskommunene som er nærmest til å vurdere behovet for drosjetransport lokalt og at dermed fylkeskommunene kan sikre et tilfredsstillende drosjetilbud og i distriktene,vidare kan fylkeskommunane samarbeide med helseføretaka om samordning av einerettar skule kyst og pasienttransport dersom det er hensiktsmessig ved å opna for tildeling av einretta har regjeringa lagt til rette for at fylkeskommunane som er nærmast til å vurdere behovet for drosjetransport lokalt og at dermed fylkeskommunen kan sikra eit tilfredsstillande drosjetilbod og i distrikta,13803.6,13833.2,29.600000000000364,2020-11-18,2020-11-18_proceedings.txt
Stortinget-20201118-095524_13833200_13860600,drosjenæringa er som mange andre næringer president i en krevende situasjon som følge av utbruddet av kved nitten jeg har invitert aktørene i næringa til et møte eee i denne måneden for å høre deres vurderinger både i lys av regelendringene og situasjonen som følge av kovid nittennittbrudte naturlig nok så er dette en næring som vi nå følger veldig nøye utviklingen framover presimyrli,drosjenæringa er som mange andre næringar president i ein krevjande situasjon som følge av utbrotet av kovidnitten eg har immitert aktørane i næringa til eit møte eee i denne månaden for å høyra deiras vurderingar både i lys av regelendringane og situasjonen som følge av kovidnittenutbrøtet naturleg nok så er dette ein næring som vi nå følger veldig nøye utviklinga framover presi,13833.2,13860.6,27.399999999999636,2020-11-18,2020-11-18_proceedings.txt
Stortinget-20201118-095524_13860600_13890600,ja takk president jeg takker for svaret men jeg er redd dette ikke holder eee fra arbeiderpartiets side så er vi nå svært opptatt av hva som skjer med drosjenæringa og jeg må bare si president jeg tror jeg kan si unisont fra alle kommuner fra alle fylker så er en nå bekymra over hvordan dette vil slå inn det nye regelverket eee så kan altså fylkeskommunene tilgi gi enerett i eee i i i kommunene eee og sjølsagt så kan det samordnes,ja takk president eg takkar for svaret men eg er redd dette ikkje holder eee frå arbeidarpartiet si side så er vi no svært opptatt av va som skjer med drosjenæringa og eg må berre seie president jeg trur eg kan si unisont frå alle kommunar frå alle fylke så er ein nå bekymra over vorde dette vil slå inn det nye regelverket eee så kan altså fylkeskommune til g gi einerett i eee i i n i kommunane eee og sjølvsagt så kan det samordnast,13860.6,13890.6,30.0,2020-11-18,2020-11-18_proceedings.txt
Stortinget-20201118-095524_13890600_13916400,men president i et fylke med mange kommuner og det er det i alle fylker så vil jo det bare bli samme selskap noen steder som stø kjører skoleskys og pasienttransport og som i tillegg vil kunne få en rett så det vil jo bare være ei svært svært få tilfeller at det vil bli samme selskapet president jeg syns det er veldig synd at regjeringa presser gjennom en sånn reform,men president i eit fylke med mange kommunar og det gjer det i alle fylka så vil jo det berre bli same selskap nokon stader som stø køyrer skoleskys og pasienttransport og som i tillegg vil kunne få einig rett så det ville jo berre vere ei svært svært få tilfelle at det vil bli same selskapet president eg synest det er veldig synn at regjeringa presser gjennom ein sånn reform,13890.6,13916.4,25.799999999999272,2020-11-18,2020-11-18_proceedings.txt
Stortinget-20201118-095524_13916400_13941100,drosjenæringa står i fare for å bli utradert mange steder og spørsmålet mitt til samferdselsministeren er har noen flere virkemidler enn enerettsmodellenstatsråd hareide gode president eee det er vel tydelig at det har vært en reell uenighet om denne saken i stortinget regjeringa valgte å utsette reformen i fire måneder nettopp på grunn av kovid nittenutbruddet,drasjønæringa står i fare for å bli utradert mange stader og spørsmålet mitt til samferdselsministeren her har nokon fleire verkemiddel enn enighetsmodellen statsråd xxx president eee det er vel tydeleg at det har vore ein reell ueinigheit om denne saka i stortinget regjeringa valde å utsette reforma i fire månader nettopp på grunn av kovidnittenutbryddet,13916.4,13941.1,24.700000000000728,2020-11-18,2020-11-18_proceedings.txt
Stortinget-20201118-095524_13941100_13967500,og nettopp det som går på en rette er det en av de viktigste virkemidlene vi har i distriktsnorge og så er det og sånn at og i den situasjonen vi har hatt nå så er det jo for eksempel på eee pasientreiser ikke nødvendigvis en koordinering eee og situasjonen før første november sånn sett så vil ikke situasjonen være så ulik for den situasjonen vi hadde før førsten november og den vil har,og nettopp det som går på einerettar er du ein av dei viktigaste verkemiddela vi har i distriktsnoreg og så er det og sånn at og i den situasjonen vi har hatt no så er det jo for eksempel på eee pasientreiser ikkje nødvendigvis ein kordinering eee og situasjonen før første november sånt sett så vil ikkje situasjonen vere så ulik for den situasjonen vi hadde før første november og den vil har,13941.1,13967.5,26.399999999999636,2020-11-18,2020-11-18_proceedings.txt
Stortinget-20201118-095524_13967500_13991700,men mitt poeng er at her er det mulighet for fylkeskommunene å bruke dette verktøyet hvis de ønsker det det er min forståelse at det ønsker og fylkeskommunene gjøre ikke minst da i distriktskommunene så tror jeg det er for tidlig å si noe om effekten av denne reformen det vil vi sjå seinere eee og nettopp eee tilbudet og etterspørselen næringa har vært krevende og tidligere,men mitt poeng er at her er det mulighet for fylkeskommunane å bruka dette verktøyet viss eg ønsker det det er min forståelse at det ønsker og fylkeskommunane gjer ikkje minst da i distriktskommunane så trur eg det er for tidleg å seie noko om effekten av denne reforma det vil vi sjå seinare eee og nettopp tilbodet og etterspørselen i denringa har vore krevjande nok tidlegaremlig,13967.5,13991.7,24.200000000000728,2020-11-18,2020-11-18_proceedings.txt
Stortinget-20201118-095524_13991700_14012500,eee president jo det blir en vesentlig endring for de selskapene som i dag har pasienttransport de vil med det nye systemet ikkerkunne kjøre enkeltturer i den kommunen som har enerett hvis det selskapet da ikke tilfeldigvis har vunnet akkurat det samme eee oppdraget så president det bli forskjell,eee president jo det blir ein vesentleg endring for dei selskapa som i dag har pasienttransport dei vil med det nye systemet ikkje kunne køyre enkeltturar i den kommunen som har einerett viss det selskapet da ikkje tilfeldigvis har vunne i akkurat dei same eee oppdraget så president det bli forskjell,13991.7,14012.5,20.799999999999272,2020-11-18,2020-11-18_proceedings.txt
Stortinget-20201118-095524_14012500_14035500,det høres ut som samferdselsministeren ikke tar dette innover seg og her i byen her er det drosjer an mask nærmest på et hvert drosje nei hvert gategjørene her vil det ikke bli noe problem men hvordan vil dette blir i hurdalen i rendalen i nesseby hvordan skal vi klare å sikre et godt drosjetilbud der i framtida og president jeg eee,det høyrest ut som samferdselsministeren itte tar dette innover seg og her i byn her er det drosjer ann maspnærmest pet vert drosj ne vert eee gatehjørne her vil det ikkje bli noko problem men vorde vil dette bli i hurdalen i rendalen i nesseby vorde skal vi klare å sikre eit godt drosjetilbod der i framtida og president er,14012.5,14035.5,23.0,2020-11-18,2020-11-18_proceedings.txt
Stortinget-20201118-095524_14035500_14064200,eee jeg er forundra over at kristelig folkeparti vil være er med på dette herre og s kan jeg ha siste spørsmålet til samferdselsministeren hvilke deler av distriktsnorge hvilke kommuner hvilke fylker drosjenæringa i distriktsnorge hvor har regjeringa fått innspill om at dette er en god modell d å liberalisere drosjenæringa slik gode president jeg tror vi skal være lig å se at dette og er ei næring som det har vært,eg er forundra over at kristeleg folkeparti vil vere ære med på dette her er og kan eg ha siste spørsmålet til samferdselsministeren kva delar av distriktsnoreg kva kommunar vil fylker drasjenæringar i distriktsnoreg vor har regjeringa fått innspel om at dette er ein god modell og å liberalisere drosjenæringa slik gode president eg trur vi skal vere ærleg å seie at dette og er ei næring som det har vore,14035.5,14064.2,28.700000000000728,2020-11-18,2020-11-18_proceedings.txt
Stortinget-20201118-095524_14064200_14084100,i en krevende situasjon og først før eee første november og det er jo behovet for en ny regulering eee og og eee vi veit jo det at esa har jo og peikt på den reguleringa som vi hadde før første november så at vi måtte gjøre noe det måtte vi ha gjort og da vi valgt eee en liberalisering,i ein krevjande stasjon og først før eee første november og det er jo behovet for ein nyregulering eee og og vi veit jo det at esa har jo og peikt på den reguleringa som vi hadde før første november så at vi måtte gjere noko det måtte vi ha gjort og då har vi valt eee ein liberalisering,14064.2,14084.1,19.899999999999636,2020-11-18,2020-11-18_proceedings.txt
Stortinget-20201118-095524_14084100_14112700,men og sikre at her kan distriktsnorge eees behov ivaretas nettopp gjennom den einomrettsmodellen og der kan altså da fylkeskommunene legge inn kontakter legge inn føringer i spørsmålet fra representanten myrli så går det og på dette med tilbud eksempelvis snattesti det kan fylkeskommunene fullt ut regulere i de avtalene og kontraktene de inngår så er det viktig for meg å signalisere bitar dette naturlig nok på alvor vi følger denne næringa spesielt tett,men og sikre at her kan distriktsnoreg eee behov ivaretas nettopp gjennom den einerettsmodellen og der kan altså da fylkeskommunane legga inn kontaktar legga inn føringar i spørsmålet frå representanten myrli så går det opp på dette med tilbod eksempelvis nattestid det kan fylkeskommunar fulgt ut regulera i dei avtalane og kontraktane dei inngår så er det viktig for meg å sile lesere vi tar dette naturleg nok på alvor og vi følger denne næringa spesielt tett,14084.1,14112.7,28.600000000000364,2020-11-18,2020-11-18_proceedings.txt
Stortinget-20201118-095524_14112700_14136900,jeg har dialog med bransjen og næringa og det kommer jeg og til å ha bidrar framover nettopp fordi vi nå har hatt en betydelig endringda går vi videre til neste spørsmål som er fra representanten kirsti leirtrø til samferdselsministeren leirtrø vær så godgode president,eg har dialog med bransjen og næringa og det kommer eg og til å ha vidare framover nettopp fordi vi no har hatt ein betydeleg endringda går vi vidare til neste spørsmål som er frå representanten kirsti leirtrø til semfertshelseministeren likrø ver så god gode president,14112.7,14136.9,24.19999999999891,2020-11-18,2020-11-18_proceedings.txt
Stortinget-20201118-095524_14136900_14161600,næringslivet i distriktene varsler stadig oftere ei bekymring for dårlig framkommelighet og mer skred og ras og innbyggerne en økende redsel for egen sikkerhet grunna tilstand på fylkesveinettet ei beregning eee viser at forfallet på fylkesveiene øker med tre milliarder kroner hvert år,næringslivet i distrikta varslar stadig oftare ei bekymring for dårleg framkommelegheit og mer skred og ras og innbyggarane ein aukande retsel for eigen sikkerheit grunna tilstand på fylkesvegnettet ei berekning eee viser at forfallet på fylkesvegane aukar med tre milliardar kroner kvart år,14136.9,14161.6,24.700000000000728,2020-11-18,2020-11-18_proceedings.txt
