file,text_bm,text_nn,start,end,duration,date,proceedingsfile
Stortinget-20200414-115433_7788100_7797500,ja takk da har representanten tatt opp de forslag som arbeiderpartiet står bak neste taler er eee representanten kristin ørmen johnsen høyre deretter rulate,ja takk da har representanten tatt opp dei forslag som arbeidarpartiet står bak neste talar er eee representanten christian normen jonsen høgre deretter rulati,7788.1,7797.5,9.399999999999636,2020-04-14,2020-04-14_proceedings.txt
Stortinget-20200414-115433_7803400_7826700,bermen johnsen vær så god gode president da grunnloven eee regulerte statssirkeordningen eee i tjuetolv ble det åpnet for reformer mellom stat og kirke og når staten ble skilt fra kirken i tjuesytten så ble det jo helt naturlig å vurdere eierskapet til det to hundre år gamle opplysningsvesenets fond litt mystisk egentlig,bermen user så gode president det grunnlova eee regulerte statikordninga eee i tjuetolv blei det opnat for reformer mellom stat og kirke og når staten blei skilt frå cirken i tjuesytten så blei det jo heilt naturleg å vurdere eigarskapet til det to hundre år gamle opplysningsvesenets fond litt mystisk eigentleg,7803.4,7826.7,23.300000000000182,2020-04-14,2020-04-14_proceedings.txt
Stortinget-20200414-115433_7826700_7855700,siden opprinnelsen har det vært eee stridigheter om fondet og det har jo faktisk en finanskapital på to komma seks milliarder kroner og mange har vært interessert i å bruke midlene blant annet kommunene til det beste for å rett og slett istandsette mange kirker fondet besitter landbrukseiendommer stabur sætre sko kraftverk og pristegårder så det er en betydelig eee andel eiendommer i fondet,sidan og prinsen har det vorte eee stridigheter om eee fondet og det har jo faktisk ein finanskapital på to komma seks milliardar kroner og mange har vore interessert i å bruke midlane blant anna kommunane til det beste for å rett og slett istandsette mange kirker fonden besitter landbrukseigedomar stabur setre skog kraftpark og prestegardar så det er ein betydeleg eee andel eigedomar i fondet,7826.7,7855.7,29.0,2020-04-14,2020-04-14_proceedings.txt
Stortinget-20200414-115433_7855700_7884100,og høyre har fått henvendelser fra kommuner og private og næringsdrivende som har ønsket dialog med opplysningsvesenets fond for å kjøpe uteiendommer fordi at det båndlegger areal som hindrer utvikling i kommuner og næringsvirksomhet dette har vist seg vanskelig og vi tror nå at dette vil løse seg en enstemmig komite ønsker velkommen avklaring om eieromfallene eee forholdene og vi er veldig positive til den modellen som er foreslått,og høgre har fått henvenser frå kommunar og private næringsdrivane som har ønskt dialog med opplysningsvesenets fond for å kjøpe ut eigedomar fordi at det er vanleg er areal som hindrar utvikling i kommunar og næringsvirksomhet dette har vist seg vanskeleg og vi trur no at dette vil løyse seg ein enstemmig komite ønsker vel kome ein eee avklaring om eiromfagnee forholda og vi er veldig positive til den eee modellen som er foreslått,7855.7,7884.1,28.400000000000546,2020-04-14,2020-04-14_proceedings.txt
Stortinget-20200414-115433_7884100_7898700,deling av eiendommer av særlig kirkelig verdi går til kirkene mens staten da blir eier av øvrige eiendeler den brede oppslutninga om modellen er viktig for løsningen krever politisk over,deling av eigedomer av særleg kirkeleg verdi går til kirkene men staten eee da blir eira øvrige ein deler den breie oppslutninga og modellen er viktig for løysingane krevjer politisk over,7884.1,7898.7,14.599999999999454,2020-04-14,2020-04-14_proceedings.txt
Stortinget-20200414-115433_7898700_7928500,og departementet har gitt tydelige signaler om at de vil forplikte seg til istandsetting av verneverdi kirkebygg og dette er noen som komiteen har vært særlig opptatt av vi ønsker jo en forsterket innsats og strategi for de bevaringsverdige standkirkene komiteens eee enstemmige forslag eee og vedtak eller forslag til vedtak i saken gir trygghet for at dette vil skje og stortinget har lagt noen føringer i det videre arbeidet,og departementet har gitt tydeleg signaler om at dei vil forplikte seg til distansetting av verneverdet i kirkebygg og dette er noko som komiteen har vore særleg opptatt av vi ønsker jo ein forsterka innsats og strategi for dei bevaringsverdige steinkirkene komiteens eee einstemmig forslag eee og vedtak eller forslag til vedtak i saka gir trygghet for at dette vil skje og stortinget har lagt nokon føringar i det vidare arbeidet,7898.7,7928.5,29.800000000000182,2020-04-14,2020-04-14_proceedings.txt
Stortinget-20200414-115433_7928500_7955000,at stat og kirke skal være likeverdig parter i prosessen at kirkens verdi skal skilles ut først at staten øker innsatsen for rehabilitering av kulturhistoriske kirker og at dette ikke skal komme på bekostning av kommunenes innsats og stortinget ber også departementet å komme tilbake til en sak om eee eee fondseiendommene som statenr,at stat og kirke skal vere likeverdige partar i prosessen at kirkes verdi skal skiljast ut først at staten aukar innsatsen for rehabilitering av kulturhistoriske kirke og at dette ikkje skal komme på bekostning av kommunanes innsats og stortinget ber også departementet å komme tilbake til ein sak om eee eee fondseigedomane som statenr,7928.5,7955.0,26.5,2020-04-14,2020-04-14_proceedings.txt
Stortinget-20200414-115433_7955000_7978500,så får vi smøre oss med litt tålmodighet i utålmodigheten så får vi kanskje også glede oss da at fondet har bidratt til å bygge norge som kunnskapsnasjon for fondet var en viktig finansieringskilde for utbygging av almeskolen så det har vi nytt godt av ja takk neste taler er representanten himanshu gulat i fremskrittspartiet deretter øvstegård,så får vi smøre oss med litt tolmodigheit i utomodigheten så får vi kanskje også glede oss da at fonna har bidrag til å bygge noreg som kunnskapsnasjon for fondet var ein viktig finansieringskilde for utbygging av omskole så det har vi nytt godt om ja takk neste talar er representanten himanshu gulati fremstegspartiet deretter øvstegård,7955.0,7978.5,23.5,2020-04-14,2020-04-14_proceedings.txt
Stortinget-20200414-115433_7984600_7986600,gulati vær så god,gula t iversen god,7984.6,7986.6,2.0,2020-04-14,2020-04-14_proceedings.txt
Stortinget-20200414-115433_7986600_8016350,eee president jeg er glad for at det er mer enighet i denne saken enn det var i den forrige og jeg vil også her gratulere statsråden eee med saken og at det er en enstemmig komite som står bak uklarheten rundt eierspørsmålet om opplysningsfestet fond har jo eksistert over lang tid likevel har jo grunnlovens tydelige føringer gjort at fondets eee og tydelig føring om at fondets verdier skal komme kirkelige formål til gode gjort at fondets forvaltning likevel har hatt en eee meget god og viktig forutsigbar,eee president eg er glad for at det er meir einigheit i denne saka enn det var i den forrige og eg vil også her gratulere statsråden eee med saka at det er ein enstemmig komite som står bak uklarhetene rundt eige spørsmålet om ut opplysingssa har jo eksistert av ei lang tid likevel har jo grunnlovens tydelege føringar gjort at eee fonn et eee og tydeleg føring om at fondets verdi skal komme kirkelege forhold til gode gjort at fonnes forvaltning likevel har hatt ein meget god og viktig forutsigbar,7986.6,8016.35,29.75,2020-04-14,2020-04-14_proceedings.txt
Stortinget-20200414-115433_8016350_8046100,het og det er bra at denne avklaret avklaringen endelig kommer det er bra at det er den endelig eee at en eee et samlet storting som står bak eee og det er også en løsning som eee eee forplikter staten til økt innsats hva gjelder vedlikehold av kirkebygg fremover som er eee eee viktig i tillegg til at jeg føler man har funnet en fornuftig eee eee deling av eee fondets eee verd eee verdier som også kirken er enig i hvor de mer,het og det er bra at den avklar avklaringa endelig kommer det er bra at det er ein endeleg eee ein eee eit samla storting som står bak eee og der er det også ein løysing som eee forpliktar staten til økt innsats var gjeld vedlikehald av kirkebygg framover som er eee viktig i tillegg til at følgemann har funnet ein fornuftig eee eee deling av eee fondets eee eee verd eee verdier som også kirken er einig i vurdimer,8016.35,8046.1,29.75,2020-04-14,2020-04-14_proceedings.txt
Stortinget-20200414-115433_8046100_8075000,praktisk eee daglige og og og de byggene som brukes mer daglig i kirken eee får en mer direkte styring fra kirken mens det som er av mer kommersiell eee formuemasse eee beholdes eee i fondet og hos staten så dette er en eee viktig avklaring som det er bra at stortinget står samlet om og som vi i fremskrittspartiet ønsker velkommenja takk neste taler er representanten freddy andre øvstegård sosialistisk venstreparti deretter grimstad,praktisk eee eee daglege og og dei byggen som brukes mer dagleg kirken eee får ein meir direkte styring frå kirken mens det som er av meir kommersiell formjømasse eee behaldast eee i forma og hos staten så dette er ein viktig avklaring som det er bra at stortinget står samla om eee og som vi i framstegspartiet ønske bli komeja takk neste talar er representanten freddy andre øvstegård sosialistisk venstreparti deretter grimstad,8046.1,8075.0,28.899999999999636,2020-04-14,2020-04-14_proceedings.txt
Stortinget-20200414-115433_8086200_8111600,øvstegård vær så god ja president eee jeg er veldig glad for at vi har funnet sammen om en omforent løsning når det gjelder opplysningsvesenets fond og den lista som eee alle partiene i komiteen har stilt seg bak eee den gir forutsigbarhet for kirka den gir grunnlag for et godt bevaringsprogram for eee kulturhistoriske viktige kulturbygg og ikke minst så,øvstegård ver så odja president eee eg vel er glad for at vi har funnet saman om ein eee omforent løysing når det gjeld opplysningsvesenets fond og den lista som eee alle partia i komiteen har stilt seg bak eee den gir forutsigbarhet for silke den gir grunnlag for eit godt eee bevaringsprogram for kulturhistorisk eee viktig kulturbygg og ikkje minst så,8086.2,8111.6,25.400000000000546,2020-04-14,2020-04-14_proceedings.txt
Stortinget-20200414-115433_8111600_8140500,eee og dette er viktig særlig for sv så gir den en klar bestilling på å få en egen sak om fondseiendommene som staten overtar etter at opplysningsfondet vesnesfond er oppdelt og den bestillinga lyder at saken må eee drøfte spørsmål om formålet det et samfunnsansvar organisering vilkår for salg av eiendommer sikkerhetsspørsmål samt andre forhold som er av betydning for forvaltningen av det gjenværende fondet som staten overtar,eee og dette er viktig særleg for sv så gir den ein klar bestilling på å få ein eigen sak om fondseigedomane som staten overtar etter att opplysningsfodet vesensfondn er oppdelt og den bestillinga lyder at saka må eee drifte spørsmål om formålet der eit samfunnsansvar organisering vilkår for sageigedomar sikkerheitsspørsmål samt andre fordel som er av betydning for forvaltninga av jernvare fondet som staten overtar,8111.6,8140.5,28.899999999999636,2020-04-14,2020-04-14_proceedings.txt
Stortinget-20200414-115433_8140500_8166200,og president her er svs forventninger for den saken klare som at festekontrakter tilbys innløst og at det må tas breiere samfunnshensyn enn det som følger av et inntjeningsbehov eee alene for det er jo klart president at det her er snakk om store eiendommer som er veldig viktige for mange lokalsamfunn eee rundt forbi,og president her er svs forventningar for den saka klare som har at festekontrakta tilbys eee innløyst og at det må tas breire samfunnshensyn enn det som følgjer av eit inntjeningsbehov eee aleme for de er jo klart president at det her er snakk om store eigedomar som er veldig viktige for mange lokalsamfunn eee rundt forbi,8140.5,8166.2,25.699999999999818,2020-04-14,2020-04-14_proceedings.txt
Stortinget-20200414-115433_8166200_8182600,og der må vi ta ansvar for at lokalsamfunnene skal kunne eee utvikle seg uten at fondet blir eee en sperre for det så til slutt president et et spørsmål som sv står overraskende alene om å problematisere i denne innstillinga eee,og dei må vi ta ansvaret for at lokalsamfunnet skal kunne eee utvikle seg utan at fondet blir eee ein sperre for det så til slutt president eit eit spørsmål som sv står overraskande aleine om å problematisere i denne innstillinga eee,8166.2,8182.6,16.400000000000546,2020-04-14,2020-04-14_proceedings.txt
Stortinget-20200414-115433_8182600_8208700,fordi i denne saken så legger vi også opp til å servere altså den norske det norske kirket en rekke eiendommer som også kan være skikkelig indre filer i et lokalsamfunn som er tilknytta kirka selv og det er helt ok president det er en god eee inndeling men vi stiller heller ingen krav til hva som skjer etter det det kan jo fort tenkes president at kirka får s,fordi i denne saka så legg vi også opp til å servere altså det norske det norske skilket ein rekke eigedommar som også kan vere det skikkeleg indrefiler i eit lokalsamfunn som er tilknytta eee sirka sel og det er heilt ok president ein god eee inndeling men vi stiller heller ingen krav til kva som skjer etter det det kan jo fort tenkast president at silke får s,8182.6,8208.7,26.100000000000364,2020-04-14,2020-04-14_proceedings.txt
Stortinget-20200414-115433_8208700_8232100,mitt i sentrum er byer og bygdyr som etter hvert kirka ser verdien av vil avviksle og kanskje selge og det er ikke noe mistenkeliggjøring av kirka som ligger bak det det er sånn eee utviklingen kan gå så her er det også viktige eiendommer i mange lokalsamfunn som kan komme på private hender uten at samfunnet får noe igjen for det president det er eee,mitt i sentrum av byre og bygdyr som etter kvart sirka ser verdien av vil avviksle og kanskje selje og det er ikkje nok mistenkeringar av sirka som ligg bak det det sånn eee utviklinga kan gå så her er det altså viktige eigedomar i mange lokalsamfunn som kan komme på private hender utan at samfunnet får noko gjenfor det president det er eee,8208.7,8232.1,23.399999999999636,2020-04-14,2020-04-14_proceedings.txt
Stortinget-20200414-115433_8232100_8260700,en problematikk som flertallet i komiteen burde vært med sv eee på og derfor er også vi foreslått at regjeringen skal utrede en hjemfallsrett for disse eiendommene og det forslaget tar jeg da også opp eee president som sv står alene på men ellers så er vi glad for den enigheten vi har kommet til en viktig avklaring av opplysningsvesenets fond som har vært på høy tid president ja takk da har representanten tatt opp de forslag som sosialistisk venstreparti står bak,ein problematikk som fleirtalet i komiteen burde vore med sv eee på og derfor er altså vi føreslått at regjeringa skal utrede ein hjemfallsrett for desse eigedomane og det forslaget tar eg då også opp eee president som sv står eller eine på men eller så er vi glade for den einigheita vi har kome til ein viktig avklaring av opplysningsvesenets fond som har vore på høg tid presidentja takk det har representanten tatt opp dei forslag som sosialistisk venstreparti står bak,8232.1,8260.7,28.600000000000364,2020-04-14,2020-04-14_proceedings.txt
Stortinget-20200414-115433_8260700_8267500,neste taler er representanten carlerik grimstad venstre deretter representanten lasasrus,neste talar er representanten kal eee erik grimstad venstre deretter representanten lasu,8260.7,8267.5,6.799999999999272,2020-04-14,2020-04-14_proceedings.txt
Stortinget-20200414-115433_8270600_8296600,grimstad vær så god eee takk president denne reformen av opplysningsvesenets fond er en viktig opprydning i eierskapet til verdier som ligger i fondet helt siden dannelsen av fondet ved lov av atten tjueen har det vært en diskusjon om eiendomsretten til dette fondet i dag ser vi ser det ut eee som vi går inn for en god landing av dette spørsmålet nesten to hundre år etterpå,grimsta ver så god eee takk president denne reforma av opplysingsvesenond er ein viktig opprydning i eigarskapet til verdiar som ligg i fondet i sidan dansen har fondet ved lov av attentjueein har det vore ein diskusjon om eigedomsretten til dette fondet i dag ser vi ser det ut eee som vi går inn for ein god blanding av dette spørsmålet nesten to hundre år etterpå,8270.6,8296.6,26.0,2020-04-14,2020-04-14_proceedings.txt
Stortinget-20200414-115433_8296600_8323600,legge grunnlaget for istandsetting og sikring av de kulturhistoriske viktige kirkebyggene i norge det setter venstre stor pris på også jeg personlig i mitt valgdistrikt så har vi tjueen middelalder kirker som sårt trenger til oppussing og til vedlikehold og jeg vil takke dem som lokalt har stått på i denne saken eee og en særlig takk går til tidligere kulturminister som har hatt et personlig engte for,legg grunnlaget for istandsetting og sikring av dei kulturhistoriske viktige kirkebyggene i noreg det set venstre stor pris på og så jeg personleg i mitt vagdistrikt så har vi tjueein middelalde kirke som sårt trenger til oppussing og til vedlikehald og eg vil takke dei som lokalt har stått på i denne saka eee og ein særleg takk går til tidlegare kulturminister som har hatt eit personleg engte for,8296.6,8323.6,27.0,2020-04-14,2020-04-14_proceedings.txt
Stortinget-20200414-115433_8323600_8353400,venstre og jeg selv har lenge vært bekymret for hvordan det skal gå med denne nasjonalskatten de norske kirkene er uten å sette av store midler til dette allerede på begynnelsen av totusentallet ble det beregnet et samlet vedlikeholdsetterslep på om lag ti milliarder kroner for kirkebyggene etterslepet var økende og forfallet var akselererende økende vedlikeholdsinnsats de siste ti årene har bidratt til å forhindre at det samlede vedlikeholdsetterslepet har økt ytterligere mitt nøkkeltallsrapporten for tilstanden,venstre og eg ser har lenge vore bekymra for korleis det skal gå med denne nasjonalskatten dei norske kirkene er utan å setta store middel til dette av dreie på begynnelsen av totusentalet blei det vereint eit samla vedlikeholdsetterslep på om lag ti milliardar kroner for kjikkebyggenet etterslepet var kne og forfallet var akselrerande aukande vedlikehalds innsats dei siste ti åra har bidrag til å forhindre at det samlede vedlikehaldsetterslepet har økt ytterlegare mitt nøkkeltalsrapporten får tilstanden,8323.6,8353.4,29.799999999999272,2020-04-14,2020-04-14_proceedings.txt
Stortinget-20200414-115433_8353400_8376900,for de norske kirkene i fra tjuesytten til atten viser imidlertid at det er mye ugjort i rapporten heter det og undersøkelsen viser en alvorlig svak tilstand for ytterveggene i middelalder kirken i stein og sytten hundretallskirkene hvor andelen med mindre bra eller dårlig tilstand for ytteveggene ligger på henholdsvis trettisyv og trettifem prosent for venstre er kulturminnevernet en del av samfunnsoppdraget,på dei norske kirke i frå tjuesytten til att den viser i midlertid at det er mykje ugjort i rapporten heiter det undersøkelsen viser er ein alvorleg svak tilstand for ytterveggene i middelalde kirkene i stein og syttenhundretalerkene vor andelen med mindre bra eller dårleg tilstand for yttevegne ligg på hennes viss trettisyog trettifem prosent for venstre er kulturminnevernet ein del av samfunnsoppdraget,8353.4,8376.9,23.5,2020-04-14,2020-04-14_proceedings.txt
Stortinget-20200414-115433_8376900_8406600,kirkene er i en særstilling som kulturminner og blant de fremste eksemplene innen arkitektur kunsthistorie og håndverk fra de siste tusen årene for framtiden vil vi forhåpentlig kunne ta vare på denne sentrale delen av vår historie fullt og helt det vi nå diskuterer henger også sammen med den saken vi nettopp har behandlet i denne salen president trossamfunnsloven det vil si at det handler om mer enn kulturminner det handler også om at fysiske rom er viktige for mennesker i dag,kirkene er i ein særstilling som kulturminner og blant dei fremste eksemplene innan arkitektur kunsthistorie og handtverk frå dei siste tusen åra for framtida vil vi forhåpleg kunne ta vare på denne sentrale delen av vår historie fullt og heilt det vi nå diskuterer heng også saman med den saka vi nettopp har behandla i denne salen eee president trossamfunnslova det vil si at det handlar om mer enn kulturminne det handlar også om at fysiske rom er viktig for menneske i dag,8376.9,8406.6,29.700000000000728,2020-04-14,2020-04-14_proceedings.txt
Stortinget-20200414-115433_8406600_8433500,kirkerommet skal være åpent både for utøvelse av tro og for mennesker som har liten tilknytning til religiøs tro til slutt president med dette vedtaket kan vi i norge ta vare på norges kultur kirkehistorie ved å sette oss selv vår bakgrunn og identitet inn i en større sammenheng ja takk neste taler er representanten jorunn gedit lotus kristelig folkeparti deret,kirkerommet skal vere opent både for utøvelse av tru og for venske som har liten tilknytning til religiøs tru til slutt president med dette vedtaket kan vi i noreg ta vare på noregs kultur kirkehistorie ved os sette oss selv vår bakgrunn og identitet inn i ein større samlingja takk neste talar er representanten jorunn gleditsch lossius skrifteleg folkeparti derett,8406.6,8433.5,26.899999999999636,2020-04-14,2020-04-14_proceedings.txt
Stortinget-20200414-115433_8435600_8457000,lossus vær så god president krf er også glade for at eierspørsmålet omkring opplysningsvesenets fond nå endelig avklares at staten og kirka skal fordele verdiene i fondet seg imellom forutsett at staten forplikter seg til en styrka innsats for ing i samsetting av landets his kulturhistoriskefulle kirkebygg,la user so president krf er også glade for at eigarspørsmålet omkring opplysningsvesenets fond no endeleg avklara at staten og kirka skal fordele verdiane i fondet seier mellom forutsett at staten forplikta seg til ein styrka innsats for in i samansetting av landets hist kulturhistoriskefulle kirkebygg,8435.6,8457.0,21.399999999999636,2020-04-14,2020-04-14_proceedings.txt
Stortinget-20200414-115433_8457000_8478000,de eiendelene som har en særlig kirkelig verdi skal skilles ut ifra fondet og overføres til den norske kirke og det gjenværende opplysningsvesenets fond vil staten bli eier av og statens innsats over tid skal minst svare til den verdien som det gjenværende fondet representerer for staten og samla sett så betyr løsninga at hele fondet kommer den norskl gode,dei eigedelen som har ein særleg kirkeleg verdi skal skiljast ut ifrå fondet og overførast til den norske kirke og det gjenværende opplysningsvesens fond vil staten bli eigar av og statens innsats over tid skal minst svare til den verdien som det gjenværende fondet representerer for staten og samla sett så betyr løysinga at heile fondet kommer den norsl gode,8457.0,8478.0,21.0,2020-04-14,2020-04-14_proceedings.txt
Stortinget-20200414-115433_8478000_8501500,president eee vi i krf er også glade for den enigheten vi har i komite og for de felles forslagene man kommet fram til der vi ber regjeringa sørge for å ivareta viktige momenter ved oppdelinga det må sikres at statens økte innsats svarer til beregning av reell verdi og det er også viktig at statens økte innsats ovenfor kirkebyggene på ingen måte avløser kommunenes økonomiske ansvar for kirkebyggene,president eee vi er krf er også glade for den einigheita i vi har i komiteen og for dei felles forslaga me har komme fram til der vi ber regjeringa sørge for å ivareta viktige moment ved oppdelinga det må sikrast at statens økte innsats svarer til bereikninga rell verdi og det er også viktig at statens økte innsats ovanfor kirkebyggene på ingen måte avløyser kommunanes økonomiske ansvar for kirkebyggene,8478.0,8501.5,23.5,2020-04-14,2020-04-14_proceedings.txt
Stortinget-20200414-115433_8501500_8517600,videre er det betydning at man får på plass en oversikt der man i samråd med kirkelige instanser og antikvariske myndigheter igangsetter bevaringsprogrammer av kirkebygget i en prioritert rekkefølge ut ifra kriterier som alder verneverdi og vedlikeholdstilstand,vidare er det betydning at ein får på plass ein oversikt der ein i samråd med kirkelege instanser og antikvariske myndigheiter i gangsetter bevaringsprogrammer av kirkebygger i ein prioritert rekkefølle ut ifrå kriterier som alder verneverdi og vedlikehaldstilstand,8501.5,8517.6,16.100000000000364,2020-04-14,2020-04-14_proceedings.txt
Stortinget-20200414-115433_8517600_8546100,president vi har mange flotte verneverdige kirker i landet vårt og dessverre er vedlikeholdsetterslepet stort derfor er krf veldig glad for at eierspørsmålet omkring opplysningsvesenet fond nå endelig ble avklart og det og at det vil bety en styrka innsats for istandsetting og sikring av de verneverdige kirkene våre det her er et arbeid som må skje systematisk over tid men eee komiteens enstemmige forslag til vedtak i saken gir trygghet for at det her vil bli ivaretatt på en god måte,president vi har mange flette verneverdige kirker i landet vårt og dessverre er vedlikehaldsetterslepet stort derfor er krf veldig glade for at eigarspørsmålet omkring opplysningsvesenet får no endeleg bli avklart og det at det vil bety ein styrka innsats for istandsetting og sikring av dei verneverdige kirkene våre det her er eit arbeid som må skje systematisk over tid men eee komiteens enstemmige forslag til vedtak i saka gir trygghet for at det her vil bli ivaretatt på ein god måte,8517.6,8546.1,28.5,2020-04-14,2020-04-14_proceedings.txt
Stortinget-20200414-115433_8546100_8550800,ja takk neste taler er statsråd kjell ingolf ropstad,ja takk neste talar er statsråd kjell ingolf ropstad,8546.1,8550.8,4.699999999998909,2020-04-14,2020-04-14_proceedings.txt
