file,text_bm,text_nn,start,end,duration,date,proceedingsfile
Stortinget-20200414-115433_5492300_5514500,flertallsvedtak i tjueatten støtter dette vi bør også på denne måten oppfordre til at flere benytter sjansen til å søke innflytelse i det trossamfunn man tilhører jeg har nevnte identitet i mitt forrige innlegg også president spør man muslimske jenter om hvorfor de går med hijab i norge får man som oftest til svar at de ønsker å ikle seg et identitetsmerke for sin tro,fleirtalsvedtak i tjueatten støtte dette vi bør også på denne måten opphøre til at fleire benytt sjansen til å søke innflytelse i det trosamfunn ein tilhøyrer eg har nemnte identitet i mitt førre innlegg også president spør men muslimske gjenter om korfor dei går med hidsjap i noreg får ein som oftes til svar at dei ønsker å ikle seg eit identitetsmerke for sin tro,5492.3,5514.5,22.199999999999818,2020-04-14,2020-04-14_proceedings.txt
Stortinget-20200414-115433_5514500_5541200,ofte kommer disse jentene fra moderne relativt sekulariserte miljøer med stor vekt på behov for utdannelse og selvvalgte jobber man behøver altså ikke være hortvangsgifte for parter paternalisme og en cinderkykeideologi for å gå med dette hovedplaget det noen feilaktig oppfatter som fundamentalistisk religionsutøvelse vi bør være rause også i vår statsamfunn,ofte kommer desse jentene frå moderne relativt sekulariserte miljøar med stor vekt på behov for utdannelse og selvakte jobbar ein behøver altså ikkje vere fortvangsgifte for parten paternalisme og ein kinder kykje i ideologi for å gå med dette hovudplagget det er nokon feilaktig oppfattar som fundamentalistisk regionsutøvelse vi bør vere reuse også i vår statsamfunn,5514.5,5541.2,26.699999999999818,2020-04-14,2020-04-14_proceedings.txt
Stortinget-20200414-115433_5541200_5554400,enn det som tradisjonelt gjennom tusen år har preget det norske samfunn og derfor vil jeg slutte igjen med ordene til representant skei grande under en debatt i tjuetolv hun sa jeg mener det er viktig,ein det som tradisjonelt gjennom tusen år har prega det norske samfunn og derfor ville eg slutte igjen med orde til representant sei grande under ein debatt i tjuetolv hon sa ja eg meiner det er viktig,5541.2,5554.4,13.199999999999818,2020-04-14,2020-04-14_proceedings.txt
Stortinget-20200414-115433_5554400_5573200,for å beholde bredden i ulike tros og livssynssamfunn at staten støtter den type aktiviteter godt og reist som vi gjør i dag grunnen til at jeg synes det er viktig er at vi ser at det i an i de landene der tros og livssynssamfunn ikke blir finansiert på en reis måte fra statens side vil pengemakta få mer og mer makt for meg,for å behalde bredden i ulike tros og livssynssamfunn at staten støtter den type aktiviteter godt og reist som vi gjer i dag grunnen til at her synest det er viktig er at vi ser at i an i dei landet der tros og livssynssamfunn ikkje blir finansiert på ein raus måte frå statens side vil pengemakta få meir og meir makt for meg,5554.4,5573.2,18.800000000000182,2020-04-14,2020-04-14_proceedings.txt
Stortinget-20200414-115433_5573200_5600600,er mareritte en kirke styrt av oljepenger fra usa og en muslimsk verdens støtte til oljepenger fra andre oljeproduserende land noe som ville gitt pengene altfor stor makt i trossamfunnet dette slutter jeg meg helt og fullt til president og derfor er jeg glad for at frps forslag om å kutte all støtte til trossamfunn lider et nederlag her i dagda er neste taler saksordfører i saken jorunn gledius,ei marerittet enn sirke styrt av oljepenger frå usa og ein muslimsk verd støtte til oljepenger frå andre oljeproduserande land noko som ville gitt pengane altfor stor makt i trossamfunnet dette sluttar eg meg heilt og fullt til president og derfor er eg glad for at frps forslag om å kutta alt støtte til trossamfunn lyder eit nedlag her i dagda er neste talar saksordførar i saka jorun gledius,5573.2,5600.6,27.400000000000546,2020-04-14,2020-04-14_proceedings.txt
Stortinget-20200414-115433_5605400_5628500,lass president jeg har eee respekt for at eee frps representanter i behandlinga av den her loven har behov for å gi uttrykk for sin primærpolitikk men jeg har likevel behov for å adressere deres påstand om at tro er en privat sak at vi derfor burde fjerne statsstøtte til tro og livssynssamfunnene,lassus president eg har eee respekt for at eee frps representantar i behandlinga av den her lova har behov for å gi uttrykk for sin primærpolitikk men eg har like vel behov for å adressere deira påstand om å tru er ein privat sak og at vi derfor burde fjerne statsstøtte til tro og livssynssamfunnet,5605.4,5628.5,23.100000000000364,2020-04-14,2020-04-14_proceedings.txt
Stortinget-20200414-115433_5628500_5650400,det at enkelte mennesker opplever sin tro som noe svært personlig det skal selvfølgelig respekteres men dersom vi som samfunn begynner å se på tro og livssyn som noe er utelukkende privat da mister vi noe verdifullt og jeg synes dessverre at frps uttalelser her gir uttrykk for en veldig snever forståelse av hva tros og livssynssamfuene betyr for samfunnet,det er at enkelte menneske opplever sin tro som noko svært personleg det skal selvfølgelig respekterast men dersom vi som samfunn begynner å se på tro og livssyn som noko utelukkande privat da mister vi noko verdifult og eg synest dessverre at frps uttalelser her gir uttrykk for ein veldig snever forståelse av va trosa livssynssamfunet betyr for samfunnet,5628.5,5650.4,21.899999999999636,2020-04-14,2020-04-14_proceedings.txt
Stortinget-20200414-115433_5650400_5667800,for a det at hele åttifem prosent av alle i norge tilhører et trossamfunn det forteller oss at tro og tilhørighet det er viktig for folk det er noe som betyr enormt mye både for enkeltmennesker og som en samfunnsbyggende kraft og kutter statsstøtte,for det at heile åttifem prosent av alle i noreg tilhøyrer ei trosamfunn det forteller oss at tru og tilhørighet det er viktig for folk det er noko som betyr enormt mye både for enkeltmennesker og som ein samfunnsbyggjande kraft å kutte statsetat,5650.4,5667.8,17.400000000000546,2020-04-14,2020-04-14_proceedings.txt
Stortinget-20200414-115433_5667800_5682400,det ville ramme mange små trossamfunn i hele landet men det ville være spesielt dramatisk for den norske kirke og mange lokalsamfunn ville miste det eneste aktive trossamfunnet dersom de skulle bli tvunget til å bare drive,det ville ramme mange små og trosamfunn i heile landet men det ville vere spesielt dramatisk for det norske kirke og mange lokalsamfunn ville å mista det einaste aktive trusamfunnet dersom dei skulle bli tvunge til å bare drive,5667.8,5682.4,14.599999999999454,2020-04-14,2020-04-14_proceedings.txt
Stortinget-20200414-115433_5682400_5711000,sytti prosent av alle nordmenn tilhører den norske kirke og det betyr ikke nødvendigvis at alle har et veldig nært og aktivt forhold til sin tro men at de likevel setter pris på hva kirken tilbyr av rammer for høytider og spesielle dager i livet sånn som da konformasjon bryller på begravelse president jeg ønsker ikke en eee amerikansk finansieringsmodell for tros og livssynssamfunnene våre der man er helt avhengig av rike unkler for å ha en press i kirka eller å ha et for forsamlingslokale,sytti prosent av alle nordmenn tilhøyrer det norske kirke og det betyr ikkje nødvendigvis at alle har eit veldig nært og aktivt forhold til sin tro men at dei likevel set pris på kva kirka tilbyr rammer for høyder og spesielle dagar i livet sånn som då konformasjon bryller på begravelse president jeg ønsker ikkje ein amerikansk finansieringsmodell på tros og livsinnsamfunne våre der ein har heilt avhengig av rike onklar for å ha ein press i kirka eller å ha eit for forsamlingslokale,5682.4,5711.0,28.600000000000364,2020-04-14,2020-04-14_proceedings.txt
Stortinget-20200414-115433_5711000_5740100,den modellen vi har i norge i dag og som fungerer veldig godt det er nettopp det at vi gir noe statsstøtte i bånn som genererer enormt mye frivillig aktivitet vi får så mye igjen men fjerner vi statsstøtte så ville det kunne ta knekken på masse frivillige arbeid fordi man mister forutsigbarhet man mister kanskje den ene ansatte som koordinerer alle de frivillige og givertjenesten eller at man kanskje mister tilgangen på de lokalene der all den positive aktiviteten skjer,den modellen vi har i noreg i dag og som fungerer veldig godt det er nettopp det at vi gir noko statstøtte i barn som genererer enormt mye frivillig aktivitet vi får så my igjen men fjerne vi statstøtte så ville det kunne ta knekken på masse frivillig arbeid fordi me mister forutsigbarhet me mister kanskje den eine ansatte som kordinerer alle dei frivillige og givertenestene eller at ein kanskje mister tilgangen på dei lokalane der all den positive aktiviteten skjer,5711.0,5740.1,29.100000000000364,2020-04-14,2020-04-14_proceedings.txt
Stortinget-20200414-115433_5740100_5765200,president statsstøtte har en stor praktisk betydning spesielt for den norske kirke og den har også en symbolsk verdi fordi vi viser tro og livssynssamfunnene at de har en viktig plass i samfunnet vårt det er en ordning som krf er stolt av at vi har prioritert i norge over lang tid og som vi mener at vi skal fortsette å prioritere i framtidada er neste taler kristin ørmen johnsen,president statsråda har ein stor praktisk betydning spesielt for den norske kirke og den har også ein symbolsk verdi fordi vi viser trå lyftingsamfunnet at dei har ein viktig plass i samfunnet vårt det er ein ordning som krf er stolt av at vi har prioritert i noreg over lang tid og som vi meiner at vi skal fortsette å prioritere i framtidada er neste talar kristin ørmen jonsen,5740.1,5765.2,25.099999999999454,2020-04-14,2020-04-14_proceedings.txt
Stortinget-20200414-115433_5774300_5799300,johnsen president når vi snakker om eee skillet av eee kirke og stat så snakker vi også i dag og har en debatt om eee tillit versus kontroll og jeg er opptatt av at vi nå gir tillit til den norske kirke vi gir tillit til kirkemøtet,junsenpresident når vi snakker om eee skylde av eee kirke og stat så snakkar vi også i dag og har ein debatt om tillit wasshus kontroll og jeg er opptatt av at vi no gir tillit til det norske kirket vi gir tillit til kirkemøte,5774.3,5799.3,25.0,2020-04-14,2020-04-14_proceedings.txt
Stortinget-20200414-115433_5799300_5824200,og vi gir også en tillit til de som skal få eee støtte samtidig så har vi sagt at vi har et behov for kontroll eee det var nevnt eee likestilling i debatten tidligere og jeg vil bare understreke at alle som får statsstøtte skal ha en årsrapport,og vi gir også ein eee tillit til di som skal eee få eee støtte samtidig så har vi sagt at vi har eit behov for kontroll eee det var nemnt eee likestilling i eee debatten tidlegare og eg vil berre understrøke at alle som får statsstøtte skal ha ein årsrapport,5799.3,5824.2,24.899999999999636,2020-04-14,2020-04-14_proceedings.txt
Stortinget-20200414-115433_5824200_5853500,i den årsrapporten skal det gjøres rede for hvilke tiltak det enkelte samfunn har for å fremme blant annet likestilling og tilsynsmyndigheten har også mulighet til å pålegge andre rapporteringer for eksempel rapportering på hvordan barns rettigheter blir ivaretatt sånn sett har vi om man kan si det eee noe ris bak eee speilet man får støtte,i den årsrapporten skal det gjerast rede for kalka tiltak det enkelte samfunn har for å fremme blant anna likestilling og tilsynsmyndigheten har også mulighet til å pålegge andre rapporteringar for eksempel rapportering på vorda barns rettigheter blir ivaretatt sånn sett har vi om ein kan seie det eee noko ris bak eee speilet ein får støtte,5824.2,5853.5,29.300000000000182,2020-04-14,2020-04-14_proceedings.txt
Stortinget-20200414-115433_5853500_5883400,men man forventer også at man lever i tråd med det som er stortingets ønske så er jo religionsfrihet en hjørnestein i en rettsstat og det kan være religioner som har praksis som vi ikke liker men vi har nå klart ved disse årsrapportene å få til at vi skal ha et tilsyn inn i disse for det skal være en åpenhet,men ein forventar også at ein lever i tråd med det som er stortingets ønske så er jo regionsfrihet ein hjørnestein i ein rettsstat og det kan vere regionar som har praksis som vi ikkje likar men vi har no klart ved desse årsrapportane å få til at vi skal ha eit tilsyn inn i desse for det skal vere ein openhet,5853.5,5883.4,29.899999999999636,2020-04-14,2020-04-14_proceedings.txt
Stortinget-20200414-115433_5883400_5910600,når det gjelder tillit så har vi jo nå gitt kirkemøtet en tillit og det undrer meg litt over at eee man har denne voldsomme trangen til å styre jeg mener jo at kirkemøtet har både kompetanse og kapasitet til å foreta de nødvendige valg på hvordan kirken skal styres det er tross alt kirkens egne som sitter derogså opptatt av at,når det gjeld tillit så har vi jo nå gitt kirkemøte tillit og det undrar meg litt over at eee ein har denne valdsame trangen til å styre jeg mener jo at kirkemøtet har både kompetanse og kapasitet til å foreta dei nødvendige val på vorda kirken skal styrast der tross alt kirkens eigne som sit der og så opptatt av at,5883.4,5910.6,27.200000000000728,2020-04-14,2020-04-14_proceedings.txt
Stortinget-20200414-115433_5910600_5938900,denne dialogen som man er bekymret om eee at kommunene ikke skal ha med både kirken og de ulike tro og livssynssamfunnene som kommunepolitiker så hadde jeg mange møter med den norske kirke med tro og livssynssamfunn og nå er det så mange senterpartiordførere eee rundt i landet så jeg kan ikke skjønne at dette kan bekymre i det hele tattda er neste taler trond giske,denne dialogen som ein er bekymra om eee at kommunar ikkje skal ha med både kirken og dei ulike tro livssynssamfunnet som kommunepolitikar så hadde eg mange møter med den norske kirke med tro og livsynsamfunn og nå er det så mange senterpartiordførere rundt i landet så eg kan ikkje skjønne at dette kan bekymre i det heile tada er neste talar trond giske,5910.6,5938.9,28.299999999999272,2020-04-14,2020-04-14_proceedings.txt
Stortinget-20200414-115433_5946400_5973700,giske vær så god president det var historisk da vi i totusenogåtte ikke bare ble enige men enstemmig om de reformene som nå gjennomføres og er stort sett gjennomført i forholdet mellom stat og kirke en av de tingene vi ble enige om at det var at kirkas organisering fortsatt skulle nedfelles kirkelov,ska ver så godpresident det var historisk av vi i totusenogåtte ikkje berre bli einig med ein einstemmig om dei reformane som nå gjennomføres og er stort sett gjennomført i forholdet mellom stat og kirke ein av dei tingane vi blei einige om at det var at kirkas organisering fortsatt skulle nedføljes skirkelov,5946.4,5973.7,27.300000000000182,2020-04-14,2020-04-14_proceedings.txt
Stortinget-20200414-115433_5973700_6001600,eee og det skal den fortsatt gjøre men regjeringspartiene gjør et stort nummer ut av at vi ikke skal men noen ting om hvordan kirkevalgene skal gjennomføres for meg president så må det være noe av det helt grunnleggende i en kirkelov hvordan demokratiet i denne kirka ivaretas det er for eksempel helt meningsløst å skrive i loven at kirkemøtet skal være kirkas øverste organ uten samtidig å si,eee og det skal me fortsette å gjere men regjeringspartia er eit stort nummer ut av at vi ikkje skal me nokonting om vordo kirkevalge skal gjennomførast for meg president så må det vere no var det heilt grunnleggjande i ein kirkelov vor blant demokratiet i denne kirka ivaretas det er for eksempel heilt meningsløst og skriv i loven at kirkemøtet skal vere kirkas overste organ utan samtidig å si,5973.7,6001.6,27.900000000000546,2020-04-14,2020-04-14_proceedings.txt
Stortinget-20200414-115433_6001600_6023700,hva som konstituerer dette kirkemøtet hvordan det kirkemøtet skal velges eee alle over femten skal ha stemmerett utover det står det ingenting om sikring for eksempel av direkte valg adgang til valgene muligheten for deltakelse den gamle ordninga besto jo av at man holdt valg eee indirekte først til bisbedområdet,kva som konstituerer dette kirkemøtet korleis ved kirkemøtet skal veljast eee alle over femten skal stemme rett utover det står det ingenting om sikring for eksempel av direkte vag adgang til valga muligheten for deltakelse den gamle åydninga bestor jo av at ein holdt vald eee inndirekte først til bispedømerådet,6001.6,6023.7,22.099999999999454,2020-04-14,2020-04-14_proceedings.txt
Stortinget-20200414-115433_6023700_6048900,etter kir altså etter gudstjeneste hvor stort sett de aller aller mest aktive deltok og så valgte bispedømmerådet sine medlemmer til kirkemøtet demokratisering var helt sentralt i kirkeforliket og det er derfor uforklarlig at ikke eee partnerne fra den gangen fortsatt er med på å sikre de demokratiske rammene rundt kirka så president til dette med,etter ski altså etter gudsteneste vår stort sett dei aller aller mest aktive deltok og så valde lisbedømerådet sine medlemmar til kirkemøte demokratisering var heilt sentralt i kirkeforliket og det er derfor uforklarleg at ikkje eee parten dansa den gongen fortsatt er med på å sikre dei demokratiske rammane rundt kirka så president til dette med,6023.7,6048.9,25.199999999999818,2020-04-14,2020-04-14_proceedings.txt
Stortinget-20200414-115433_6048900_6076500,antall medlemmer og krav til eee trossamfunnene for å få støtte for det første så er det jo helt utrolig synes jeg at eee krfs representant eee omtaler dem av oss som mener at grensa kunne vært noe høyere enn femti eee som et totalitært syn tror jeg var representanten lossus eee kalt senterpartiet autoritære linje eee var det hun kalte arbeiderpartiepartiets eee syn,antal medlemmar og krav til eee trosamfunna for å få støtte for det første så er det jo heilt utruleg synest eg at eee krfs representant eee omtaler dei av oss som meiner at grensa kunne vore noko høgare enn femti eee som eit totalitært syn trur eg var representanten lassus eee kalt senterparti autoritære linja eee var det hor kalt arbeidarpartirpartiets syn,6048.9,6076.5,27.600000000000364,2020-04-14,2020-04-14_proceedings.txt
Stortinget-20200414-115433_6076500_6104300,frps syn derimot om at grensa skal gå ved tre komma fire millioner den blir uttalt som respekt for frps primærstandpunkt det er altså forskjell på hvordan man behandler eee ulike partiers standpunkter eee og tybringgjeddes eee innlegg blir av saksordfører forbigått i stillhet vel man velger sine partnere med omhu det errosfrihet i norge,frps syn derimot om at grensa skal gå over tre komma fire millionar den blir uttalt som respekt for frps primærstandpunkt det er altså forskjell på vorland men behandlar eee ulike partias standpunkta eee og tybring edde eee innlegg blir av saksordførar forbigått i stillheit vel ein veljer sine partnarar med omhu det erosfriheit i noreg,6076.5,6104.3,27.800000000000182,2020-04-14,2020-04-14_proceedings.txt
Stortinget-20200414-115433_6104300_6132900,men det er ikke rett til statstilskudd det er rett til statstilskudd på like vilkår som det står i grunnloven og hvis vilkår er noen knesatte prinsipper for hva denne støtten skal gå til så vil det være i full overensstemmelse med like vilkår for støtte overhodet ikke gå utover det enkelte trossamfunns trosfrihet presidentneste taler er kari henriksen,men det er ikkje rett til statstilskot det er rett til statstilskot på like vilkår som det står i grunnloven og viss vilkåra er nokon knesette prinsippa for kva denne støtta skal gå til så vil det vere i full overenstemmelse med like vilkår for støtte over hovudet ikkje gå utover det enkelte trosamfunns trosfrihet presidenteneste talar er kari henriksen,6104.3,6132.9,28.599999999999454,2020-04-14,2020-04-14_proceedings.txt
Stortinget-20200414-115433_6139300_6167700,henriksen takk president jeg har behov for å si at eee jeg opplever det ganske underlig eee som arbeiderpartimedlem å stå her og høre på den mangel på ydmygghet som jeg opplever å bli presentert for denne talerstolen overfor arbeiderpartiet i tros og livssynssaken statsråden,henriksen takk president eg har behov for å si at eee eg opplever det er ganske underleg eee som arbeidarpartimedlem å stå her og høyrer på den mangel på udmyghet som eg opplever å bli presentert for denne talarstolen overfor arbeidarpartiet i trosoglivsynssaka statsråden,6139.3,6167.7,28.399999999999636,2020-04-14,2020-04-14_proceedings.txt
Stortinget-20200414-115433_6167700_6197000,spørre litt retorisk vet ikke om det er ironisk eller forsøk på å være morsom om det ikke skjer noe bra i tros og livssynsorganisasjonenepresident da kan i hvert fall ikke ministeren ha hørt hvor mye av det jeg har snakka om når det gjelder tros og livssynspolitikken det som er poenget president er at arbeiderpartiet har alltid,spør litt retorisk eg veit jo om det er ironisk eller forsøg for å vere måsun om det ikkje skjer må bra i tros og livssynsorganisasjonen president det kan i kvart fall ikkje ministeren ha høyrt på mye av det eg har snakka om når det gjeld tros og livsynspolitikken det som er poenget president er at arbeidarpartiet har alltid,6167.7,6197.0,29.300000000000182,2020-04-14,2020-04-14_proceedings.txt
Stortinget-20200414-115433_6197000_6225200,lytte til undertrykte mennesker og vi lytter til undertrykte mennesker også i tros og livssynssamfunn og det er de som fremmer de problemstillingene som arbeiderpartiet reiser i sine forslag om å styrke like stillinger om å sørge for at ikke homofile blir diskriminert om å sørge for at valgene skal skje på demokratisk vis,lytta til undertrykte menneska og vi lyttar til undertrykte menneske også i tros oglifsmssamfunn og det er dei som fremmar dei problemstillingane som arbeidarpartiet reiser i sine forslag om å styrke like stillingar om sørge for at ikkje homofile blir diskriminert om å sørge for at vala skal skje på demokratisk vis,6197.0,6225.2,28.199999999999818,2020-04-14,2020-04-14_proceedings.txt
Stortinget-20200414-115433_6225200_6254400,president det er ikke noe arbeiderpartiet sitter på et lønnkammer på ønsker ut det er levende troende mennesker som henvender seg til arbeiderpartiet fordi de tror og vil tilhøre det som er så viktig for de nemlig et tros og livssynssamfunn men tros og livssynssamfunnets praksis setter en sperre for at de kan utøve sin grunnleggende tro i den mynigheten de hører hjemme,president dekke no arbeidarpartiet sit på eit lønn kamp og ønsker ut det er levande tovande menneske som henvender seg til arbeidarpartiet fordi dei trur og vil tilhøyre det som er så viktig for dei nemleg ei tros og livssynssamfunn men tros og livssynssamfunnets praksis setta ein sperre for at dei kan utøve sin grunnleggande to i den menigheten dei høyr og hjeme,6225.2,6254.4,29.199999999999818,2020-04-14,2020-04-14_proceedings.txt
Stortinget-20200414-115433_6254400_6283900,det er det vi diskuterer i dag og det er det denne regjeringa har satt en stopper for i paragrafen om å nekte tilskudd og der er vi helt på linje og det er det som er kontrollen president det er ikke om vi vil ha en samfunnskontrakt eller ikke det er en avsporing av debatten og det er altså en måte å diskutere på som jeg finner jeg må si det fra denne talerstolen president litt usmaklig fra kristelig folkepartis ståsted,det er det vi diskuterer i dag og det er det denne regjeringa har satt inn stoppa for i paragrafen om å nekte tilskot og der er vi heilt på linje og det er det som er kontrollen president det er ikkje om vi vil ha ein samfunnskontrakt eller ikkje det er ei avsporing av debatten og det er altså ein måte å diskutere på som er kvinna eg må si det frå denne talarstolen president litt usmakleg frå kristeleg folkepartis ståstad,6254.4,6283.9,29.5,2020-04-14,2020-04-14_proceedings.txt
Stortinget-20200414-115433_6284400_6312300,det at kristelig folkeparti fraviker den lange tradisjonen om å finne breie forlik i disse sakene det sier mer om kristelig folkeparti mener jeg og retningsvalg enn det sier om arbeiderpartiets behov for kontroll president jeg synes det er beklagelig at kristelig folkeparti har fått med seg høyre venstre og fremskrittspartiet på den typen kontroll,det at kristeleg folkeparti fraviker den lange tradisjonen om å finne breie forlik i desse sakene det seier meir om kristeleg folkeparti meiner og er orretningsval enn det sider om arbeidarpartiets behov for kontroll president eg synest det er beklageleg at kristeleg folkeparti har fått med seg høgre venstre og framstegspartiet på den typen kontroll,6284.4,6312.3,27.900000000000546,2020-04-14,2020-04-14_proceedings.txt
Stortinget-20200414-115433_6312300_6335000,og på den typen eee eee politikk men sånn er det og når jeg da leser at kristelig folkeparti ministeren er bekymra for om arbeiderpartiet tar omvalg når de ikke har løfta en finger for å få flertall da undrer det med presidentda er neste taler åslaug semjacobsen,og på den typen eee eee politikk men sånn er det og når eg da lesa at kristeleg folkeparti ministeren er bekymra for om arbeidarpartiet tar omval når dei ikkje har løfta en finger for å få fleirtal det undå med presidentda er neste talar osla sem jacobsen,6312.3,6335.0,22.699999999999818,2020-04-14,2020-04-14_proceedings.txt
