file,text_bm,text_nn,start,end,duration,date,proceedingsfile
Stortinget-20201117-095521_11180900_11210400,president arbeiderpartiet har lenge vært utålmodig etter å oppnå et bedre samspill mellom helseforetak universiteter høyskoler institusjoner med ansvar for det nasjonale helseregisteret samt en nødvendig infrastruktur som fasiliterer et slikt samspill og at regjeringen nå foreslår en nasjonal teknisk og organisatorisk løsning for ei tilgjenge ti tilgjengeliggjøring av helsedata gjennom helseanalyseplattformen og tilgangsfunksjonen i tilgangsfunksjonen helsedataservice støtter vi sjøl om vi meiner det er,president arbeidarpartiet har lenge vore utålmodig etter å oppnå eit betre samspel mellom helseføretak universitetet høgskoler og institusjonar med ansvar for nasjonale helseregistre samt ein nødvendig infrastruktur som fasilitere eit slikt samspel at regjeringa nå foreslår ein nasjonal teknisk konsertorisk løysing for tilje ti tilgjengeleggjering av helsedata gjennom helseanalyseplattformen og tilgangsfunksjonen i tilgang funksjonen helsedatasørvis støttar vi sjøl om vi meiner det er,11180.9,11210.4,29.5,2020-11-17,2020-11-17_proceedings.txt
Stortinget-20201117-095521_11210400_11238400,særlig for de store populasjonsundersøkelsene som troms undersøkelsen og hønteee hunt etter vel en gjenstår eee viktige avveininger før før dette landet er riktig helsearkivet på tynset er en suksess allerede etter ett år og har en interess har et interessant potensial for å ivareta flere oppgaver framover arbeiderpartiet ser derfor også positivt på at tynset og helsearkivet der,særleg for dei store populasjonsundersøkelsene som tromseundersøkelsen og hørt eee hundt dette velina gjenstår eee viktige avvegingar før dette landet riktig helsearkivet på tynnsett er ein suksess allereie etter eitt år og har ein interess har eit interessant potensiale for å ivareta fleire oppgåver framover arbeidarpartiet ser derfor også positivt på at tynnset og helsearkivet der,11210.4,11238.4,28.0,2020-11-17,2020-11-17_proceedings.txt
Stortinget-20201117-095521_11238400_11261500,som har utviklet relevant kompetanse for førstelinjetjenesten i helsedataservice utredes som mulig lokalitet for denne funksjonen så støtter arbeiderpartiet løst forslag nummer to fra senterpartiet neste talar mari holm lønseth deretter tor andre johnsen,som har utvikla eit relevant kompetanse for førstelinjeteneste i helsedatasørvis utredast som mulig lokalitet for denne funksjonen så støttar eee arbeidarpartiet løst forslag nummer to frå senterpartietneste talar mari holm lønseth deretter tore andre jonsen,11238.4,11261.5,23.100000000000364,2020-11-17,2020-11-17_proceedings.txt
Stortinget-20201117-095521_11265700_11290400,takk for det president riktig bruk av helsedata gir mange muligheter det gir oss muligheten til bedre forskning det kan igjen gi oss bedre behandling bedre kunnskapsgrunnlag for å drive forebygging og mer innovasjon i helse og omsorgstjenesten helsedata vil også kunne gi et godt grunnlag for å skape nye jobber og videreutvikle helsenæringa i norge,lønsethtakk for det president riktig bruk av helsedata gir mange muligheter det gir oss muligheten til betre forsking det kan igjen gi oss betre behandling betre kunnskapsgrunnlag for å drive forebygging og mer innovasjon i helse og omsorgsteneste helsedata vil også kunne gi eit godt grunnlag for å skape nye jobbar og vidareutvikle helsenæringa i noreg,11265.7,11290.4,24.69999999999891,2020-11-17,2020-11-17_proceedings.txt
Stortinget-20201117-095521_11290400_11318400,i dag så må helsedata hentes fra ulike register mange opplever at det er uforholdsmessig tid og ressurskrevende å få opplysningene fra dem her registrene og det er et rom for forenkling derfor så fremmes forslag om endringer i helseregisterloven som skal gi nettopp enklere tilgang til helsedata til bruk i helseanalyser og forskning enklere tilgang til sånne data betyr imidlertid ikke at vi kompromisser med personvernet,i dag så må helsedata hentast frå ulike register mange opplever at det er uforholdsmessig tid og ressurskrevjande å få opplysningane frå dei her registra og det er eit rom for forenkling derfor så fremmast forslag om endringar i helseregisterlova som skal gi nettopp enklare tilgang til helsedata til bruk i helseanalysar og forskingenklare tilgang til sånne data betyr i midlertid ikkje at vi kompromisser med personvernet,11290.4,11318.4,28.0,2020-11-17,2020-11-17_proceedings.txt
Stortinget-20201117-095521_11318400_11347800,en forutsetning for at vi skal kunne ta i bruk ny teknologi ikke minst at vi også kan bidra til å utvikle ny teknologi er at vi som personer også er trygge på at personvernet vårt er godt ivaretatt derfor så er det viktig for eee høyre også å understreke at personvernet i dem her endringene er godt ivaretatt lovforslaget er sånn sett ingen utvidelse av adgangen til å tilgjengeliggjøre helseopplysninger og hensynet til personvernet både vurdert og ivaretatt i lovteksten,ein forutsetning for at vi skal kunne ta i bruk ny teknologi ikkje minst at vi også kan bidra til å utvikle ny teknologi er at vi som personar også er trygg på at personvernet våre er godt ivaretatt derfor så er det viktig for eee høgre ogs å understreke at personvernet i dei her endringane er godt ivaretatt lovforslaget synes sett ingen utvidelse av adgangen til å tilgjengeleg for helseopplysningar og hensynet til personvernet både vurdert og ivaretatt i lovteksten,11318.4,11347.8,29.399999999999636,2020-11-17,2020-11-17_proceedings.txt
Stortinget-20201117-095521_11347800_11373000,president helsedata er som sagt viktig for bedre behandling men ikke minst så er også det arbeidet som gjøres i mange av dem befolkningsbaserte helseundersøkelsene viktig det gjelder for eksempel huntundersøkelsen spørsmålet om hvilke helseregistre som skal tilgjengeliggjøres på helseanalyseplattformen skal reguleres i en egen forskrift og det skal også sendes ut på høring på vanlig måte,president helsedata er som sagt viktig for betre behandling men ikkje minst så er også det arbeidet som gjerast i mange av dei befolkningsbaserte helseundersøkelsene viktig det gjeld for eksempel hundundersøkelsen spørsmålet om vake helseregistera som skal tilgjengelgerest på helseanalyseplattformen skal regulerest i ein eigen forskrift og det skal også sendast ut på høyring på vanleg måte,11347.8,11373.0,25.200000000000728,2020-11-17,2020-11-17_proceedings.txt
Stortinget-20201117-095521_11373000_11398200,og her vil jeg også påpeke at det selvfølgelig også vil gjelde eventuelt eee forholdet til saminor det kan jo være aktuelt på vanlig måte å konsultere sametinget i henhold til dem retningslinjene som allerede regjeringa eee forholder seg til men vi vurderer også regjeringspartiene vurderer at vi stemmer mot for det løse forslaget til senterpartiet nummer to for å se,og her vil eg også påpeike at det er selvfølgelig også vedeld eventuelt eee forhold til sammi nor det kan jo vere aktuelt på vanleg måte å konsultere sametinget i henhold til den retningslinja som allereie regjeringa eee forholde seg til men vi vurderer også regjeringspartia vurderer at vi stemmer mo for det lause forslaget til senterpartiet nummer to for å,11373.0,11398.2,25.200000000000728,2020-11-17,2020-11-17_proceedings.txt
Stortinget-20201117-095521_11398200_11422900,konsultere sametinget vi vurderer at det egentlig er i henhold til dem retningslinjene som allerede regjeringa må forholde seg til og heller at det ikke vil skape noen presedens videre president avslutningsvis så har jeg også lyst til å kommentere lokaliseringa av helsedataservice regjeringa har en god tradisjon med å flytte statlige arbeidsplasser ut av oslo den gode tradisjonen skal vi fortsette,konsultere sametinget vi vurderer at det eigentleg er i henhold til den retningsideen som allereie regjeringa må forholde seg til og heller at det ikkje vil skape nokon presidens vidare president avslutningsvis så har eg også lyst til å kommentere lokaliseringa av helsedatasurvis regjeringa har ein god tradisjon med å flytte statlege arbeidsplassar ut av oslo den gode tradisjonen skal vi fortsette,11398.2,11422.9,24.69999999999891,2020-11-17,2020-11-17_proceedings.txt
Stortinget-20201117-095521_11422900_11439500,t eee med og det er også viktig at regjeringa gjør en grundig vurdering av ulike alternativer for lokalisering og flertallet i komiteen viser også til at tynset kan være et av flere alternativ takk neste taler tor andre johnsen deretter kjersti toppe,t eee med og det er også viktig at regjeringa gjer ei grundig vurdering av ulike alternativ for lokalisering og fleirtalet i komiteen viser også til at tyngt sett kan vere eitt av fleire alternativ takkneste talar tor andre jonsen deretter kjersti toppe,11422.9,11439.5,16.600000000000364,2020-11-17,2020-11-17_proceedings.txt
Stortinget-20201117-095521_11449800_11478100,johansen president takk høsten tjuetretten så utsatte høyre og frp sammen med venstre og krf byggingen av helsearkivet på tinseth årsaken var at vi måtte utsette prosjektet for det var store kostnadsoverskridelser eller hvert fall store kostnader vi måtte få ned kostnadene siden dessverre ap og senterpartiet og sv da i kjent stil hadde prosjektert og planlagt et helsearkiv hvor det overhodet ikke var noe kostnadsfokus president vi fikk mye kritikk,jansen president tak hausten tjuetretten så utsette høgre og frp same venstre og krf beginner elsikkerhet på tilsett årsaka ver at vi måtte utsette prosjektet for det var i store kostnadsoverskridelser og i alle fall store kostnader vi måtte få ned kostnadene sidan dessverre ap og senterpartiet og sv da i kjent stil hadde prosjektert og planlagt eit tesaka for det overhovudet ikkje var noko kostnadsfokus president vi fekk mykje kritikk,11449.8,11478.1,28.30000000000109,2020-11-17,2020-11-17_proceedings.txt
Stortinget-20201117-095521_11478100_11507500,fra venstresiden da vi utsatte prosjektet men nå er aldri fornøyd vi kuttet kostnadene med flere hundre millioner vi fikk etablert over femti arbeidsplasser og vi fikk et teknisk og moderne og fremtidsrettet helsearkiv i stedet for en uttatte er bunker for å si det på den måten hvor det var planlagt å lagre tonnevis med api papir følgelig kan man både se at vi sparte skattebetalerne for penger mye penger og vi fikk et bedre helsearkiv ved å utsette og gjennomgå prosjektet på nytt,frå venstresiden det av utsette prosjektet men nå aller for nøgd blir kutta ut kostnadene med fleire hundre millionar vi fekk etablert over femti arbeidsplassar og vi fekk eit teknisk og moderne og fremtidsrettet helsearkiv i stader for ein utate bunker frå å seie det på den måten og det var planlagt å lagre tonnvis med api papir følgeleg kan ven både se at vi sparte skattebetalane for pengar mye pengar og vi fekk eit betre helsearkiv ved å utsette å gjennomgå prosjektet på nytt,11478.1,11507.5,29.399999999999636,2020-11-17,2020-11-17_proceedings.txt
Stortinget-20201117-095521_11507500_11523600,før vi satte i gang byggingen helsearkivet er en suksess som også min kollega hagebakken konstaterte i stad og det er etablert et unikt kompetansemiljø innenforskning helseregisterforvaltning it helserett og arkiv,før vi sette i gang bygginga helsearkivet vere ein suksess som også min kollega hagebakken konstanterte i stad og det er etablert eit unikt kompetansemiljø innan forsking helseregisterforvaltning ite helserett og arkiv,11507.5,11523.6,16.100000000000364,2020-11-17,2020-11-17_proceedings.txt
Stortinget-20201117-095521_11523600_11550400,president det er logisk riktig og viktig at vi ser de endringene som stortinget nå skal gjøre i helsedataregisterloven og etableringen av helsedataservice i sammenheng med eksisterende fagmiljøer og helsearkivet på tynset næringslivet er flinke til å ta ut synergier for å effektivisere virksomhetene sine og her har det offentlig mye å lære å samlokalisere helsedataservice tynset,president det er logisk riktig og viktig at vi ser dei endringane som stortinget no skal gjere i helsedataregisterloven og etableringa av helsedataservis er samanheng med eksisterande fagmiljø og helsearkivet på tynnset næringslivet er flinke til å ta ut synergiar for å effektivisere virksomhetene sine og her har det offentleg mye å lære å samlokalisere helsedatasørvis tynnseth,11523.6,11550.4,26.799999999999272,2020-11-17,2020-11-17_proceedings.txt
Stortinget-20201117-095521_11550400_11579000,vil utvilsomt gi store synergier både økonomiske men kanskje aller viktigst faglige for forskerne og andre som har behov for enklere og tryggere tilgang til bruk av statistikk i helseanalyser og forskning og kvalitetsforbedring planlegging styring og beredskap frp er tydelig på at det beste er å samlokalisere helsedataservice med helsearkivet,vil utvilsamt gi store synergi både økonomiske men kanskje aller viktigast faglege for forskarne og andre som har behov for det enklare og tryggare tilgang til bruk av statistikk i helseanalyse og forsking og kvalitetsforbetring planlegging styring og beredskapfrp er tydeleg på at det beste er å samlokalisere helsedatasørvis med helsearkivet,11550.4,11579.0,28.600000000000364,2020-11-17,2020-11-17_proceedings.txt
Stortinget-20201117-095521_11579000_11606700,heldigvis så er sp og sv det også men det er meget skuffende president å se at verken regjeringen eller ap ser denne tydelige fordelen med samlokalisering og at det ikke vil være med å støtte forslaget fra frp senterpartiet og sv og president eee høyre som jeg vanligvis ser på som et eee klokt eee næringslivsvennlig parti som har respekt for skattebetalernes peng vi samarbeider veldig godt med,heldigvis så er sp og sv det også men det er med eige skuffende president å seie at verken regjeringa eller ap ser denne tydelege fordelen med samlokalisering og at det ikkje vil vere med og støtte forslaget frå frp senterpartiet og sv og president eee høgre som eg vanlegvis ser på oss som eit eee klokt eee næringslivsvennleg parti som har respekt for skattebetalan pen vi samarbeider veldig godt med,11579.0,11606.7,27.700000000000728,2020-11-17,2020-11-17_proceedings.txt
Stortinget-20201117-095521_11606700_11628700,syns det er synd at de kjem på en samlokalisering jeg synes det er enda mer oppsiktsvekkende og skuffende å se at tynseth og hedmark ap sin nye og store sønn representanten sandtrøen svikter fullstendig i denne saken jeg tviler ikke på at sandtrøen inn i sinne ser fordelen med å samlokalisere helsedataservice og helsearkivet men dessverre er han ikke med og har ikke fått med sitt parti på det,så det ser eg syn at dei krem på ein sam lokalisering eg synest det er enda meir oppsiktsvekkande å skuffene å se at tynseth og hedmark ap sin nye og store sømn representanten sandtrøen svikter fullstendig i denne saka det er eit vidare på at sandtrøen innerst inne ser fordelen med å samlokalisere heilte dataservi og sarkivet men dessverre er han ikkje med og har ikkje fått med sitt parti på det,11606.7,11628.7,22.0,2020-11-17,2020-11-17_proceedings.txt
Stortinget-20201117-095521_11628700_11644800,ellers så vil jeg opplyse at frp kommer til å stemme mot alle løse forslag i saken og herved da så tar jeg f opp frp og sv og senterpartiet sitt felles forslag takk for da forslaget ser fram teke opp neste taler kjersti toppe deretter nicholas wilkinson,eller så vil eg opplyst av at frp kommer til å stemme imot alle løse forslag i saka og her ved da så tar af opp frp og sv og senterpartiet sitt felles forslag takk då då forslaget ser fram å teke opp neste talar kjersti toppe deretter nicholas wilkinson,11628.7,11644.8,16.099999999998545,2020-11-17,2020-11-17_proceedings.txt
Stortinget-20201117-095521_11653200_11681800,toppe takk eee president i denne saka få størst det en felles nasjonal organisatorisk og teknisk lesing for helse data der data fra alle nasjonale og regionale befolkningsbaserte helseundersøkelser skal tilgjengeliggjøres i gårfikomiteen et bred fra sametingsrådet de skriver at regjeringa ikke har fulgt opp konsultasjonsplikter i denne saka og at samme se rettigheter og status ikke er vurdert eller ivaretatt i arbeidet med helseregisterloven,toppetakk eee president i denne saka føreslårst det ein fella sjo nasjonal organisatorisk og teknisk løysing for helsedata der data frå alle nasjonale og regionale befolkningsbaserte helseundersøkelser skal tilgjengeleggjerast i går fekk komiteen eit brev frå sametingsrådet dei skriv at regjeringa ikkje har følgt opp konstitusjonspliktar i denne saka og at samiske rettigheter status ikkje er vudert eller ivaretatt i arbeidet med helseregisterlova,11653.2,11681.8,28.599999999998545,2020-11-17,2020-11-17_proceedings.txt
Stortinget-20201117-095521_11681800_11706100,samme trenger jeg bekymra for regjeringas forslag som vil kunne få konsekvenser for eierskap og forvaltning av data fra samiske befolkningsundersøkelser det peker på internasjonale konvensjoner og urfallsrett urfolks rett til å utøve kontroll med innsamling tilgang til analyse for tolkning av helserelaterte data de mener at en slik utøvelse av kontroll ikke vil være mulig med en nasjonal sammenstilling og teknisk løsning,sametinget er bekymra for regjeringas forslag som vil kunne få konsekvensar for eigarskap og forvaltning av data frå samiske befolkningsundersøkelser det peikar på internasjonale konvensjonar og ufolk rett ur folks rett til å utøve kontroll med innsamling tilgang til analyse og fortolking av helserelaterte data dei meiner at ein slik utøvelse av kontroll ikkje vil vera mulig med ein nasjonal samanstilling og teknisk løysing,11681.8,11706.1,24.30000000000109,2020-11-17,2020-11-17_proceedings.txt
Stortinget-20201117-095521_11706100_11734400,på denne bakgrunn så har senterpartiet fremma et løst forslag i dag stortinget ber regjeringen konsultere samme tinget før forskrift etter paragraf sju i helseregisterloven som skal regulere hva helseregister som skal tilgjengeliggjøres i helseplattformen blir sendt på høring med mål om opp med mål om å oppnå enighet om sikring av urfolks kontroll med innsamling tilgang analyse og fortolkning av helserelaterte data og jeg håper at dette forslaget kan få flertall i dag der har det betydd mykje,på denne bakgrunn så har senterpartiet fremma eit laust forslag i dag stortinget ber regjeringa konsultere sametinget før forskrift etter paragraf tjue helseregisterlova som skal regulera kva helseregister som skal tilgjengeleggjerast i helseplaforma blir sendt på høyring med mål å opp med mål om å oppnå einigheit om sikring av urfolk kontroll med innsamling tilgang analyse og fortolking av helsereliterte dataa håpar at dette forslaget kan få fleirtal i dag det hadde betydd mykje,11706.1,11734.4,28.299999999999272,2020-11-17,2020-11-17_proceedings.txt
Stortinget-20201117-095521_11734400_11756000,i saka står senterpartiet inn i merknader om at planen om å permanent overføre data og kompetanse fra tromsøundersøkelsen og hønt til helsedataservice framstår som uhensiktsmessig vi støtter ikke ens overføring av eierskap til såkalte dataprodukter og forvaltning avsvar til helsedataservice for befolkningsundersøkelse generelt jeg meiner dette må greies videre,i saka står senterpartiet inn i merknaden om at planen om å permanent overføra data og kompetanse frå tromseundersøkelsen og hørt til helsedata og sørvis framstår som uhensiktsmessig vi støttar ikkje eins overføring av eigarskap til såkalla dataprodukt og forvaltninga svar til helse data og sørvis for befolkningsundersøkse generelt og meiner dette måtgreiast vidare,11734.4,11756.0,21.600000000000364,2020-11-17,2020-11-17_proceedings.txt
Stortinget-20201117-095521_11756000_11785600,så står vi inn i forslaget som er omtalt om at helsedata service kan eee skal etableres på tynset og samlokaliseres med norsk helsearkiv sammen med frp og sv i lovforslaget foreslås det at arbeidet med å få dispensasjon fra taushetsplikt eee skal overflyttes fra de regionale komiteene for medisinsk og helsefaglig forskningsetikk til helsedataservice senterpartiet er skeptisk til slik overføring av ansvar og viser til at,så står vi inne i forslaget som er omtalt om at helsedata sørvis kan eee skal etablerast på tynnset og samlokaliserast med norsk helsearkiv saman med frp og sv i lovforslaget foreslås det at arbeidet med å få dispensasjon frå tausesplikt eee skal overflyttast frå dei regionale komiteen for medisinske og helsefarleg forskingsetikk til helsedata sørvis senterpartiet er skeptisk til slik overføring ansvar og viser til at eee,11756.0,11785.6,29.600000000000364,2020-11-17,2020-11-17_proceedings.txt
Stortinget-20201117-095521_11785600_11815500,de regionale komiteene er eee i dag er tverrfaglig sammensatt og per i dag de eneste med kompetanse til å gjøre slike forskningsetiske vurderinger av søknader om utlevering av data fra pasienten sitt journal sin journal senterpartiet er bekymra og i denne saka for personvernutfordringene eee som blant anna datatilsynet har framheva i sine høringsinnspill om at presentasjonen av personververnutfordringer er mangefull,dei regionale komiteane er eee i dag eit tverrfagleg samansett og per i dag dei einaste med kompetanse til å gjera slike forskingsetiske vurderingar av søknadar om utvidering av data frå pasienten sitt sjonal sin sjonal senterpartiet er bekymra og i denne saka for personvernutfordringene eee som blant anna datatilsynet har framheva i sine høyringsinnspel om at presentasjonen av personververnutfordringar er mangefull,11785.6,11815.5,29.899999999999636,2020-11-17,2020-11-17_proceedings.txt
Stortinget-20201117-095521_11815500_11845000,i proposisjonen så ligger det mange forsikringer fra regjeringa om at personvernet med denne lovendringa blir bedre ivaretatt enn før eee og jeg vil understreke at ansvaret for at personvernet blir ivaretatt i de nye løsningene som foreslått er nå regjeringa sitt ansvar og med dette så ja eee ja jeg må ta opp de forslag som jeg frem takk representanten er ikke få da forslaget det er en del av neste taler er nicholas wilkinson da retter karlar grimstad,i proposisjonen så ligg det mange forsikringar frå regjeringa om at personvernet med denne lovendringa blir betre ivaretatt enn før eee og eg vil understreke at ansvaret for at personvernet blir ivaretatt i dei nye løysingane som foreslått er no regjeringa sitt ansvar og med dette så ja eee ja eg må ta opp ei forslag som vi har fremma takeda er representanten de jo dei forslag dei er ein del av neste talar nicolas wilkensen deretter carlerik grimstad,11815.5,11845.0,29.5,2020-11-17,2020-11-17_proceedings.txt
Stortinget-20201117-095521_11847500_11872700,wilkinson president sv støtter loven vi mener at norsk helsearkiv og helsedataservice bør samlokalokaliseres derfor foreslår sv sammen med frp og senterpartiet om å etablere helsedataservise på tynsett,president sv støttarloven vi meiner at norsk helsearkiv og helsedataservis bør samloka lokaliserast derfor foreslår sv saman med frp og senterpartiet om å etablere helsedatasereviss på tynnsett,11847.5,11872.7,25.200000000000728,2020-11-17,2020-11-17_proceedings.txt
Stortinget-20201117-095521_11872700_11889100,sv støtter det viktige løse forslaget fra senterpartiet om at sametinget skal konsulteres neste ta karel carl erik grimstad deretter statsråd bent høie,sv støttar det viktige lause forslaget frå senterpartiet om at sametinget skal konsulterastneste talar caril carl erik grimstad deretter statsråd bent høie,11872.7,11889.1,16.399999999999636,2020-11-17,2020-11-17_proceedings.txt
Stortinget-20201117-095521_11901500_11922600,grinstadtakk president eee gode helseregistre legger en vikt et virk viktig grunnlag for å fremme helse bedre grunnlag for forskning og forbedre helse og omsorgstjenestene våre det er liten uenighet om at de lovendringene vi gjør i dag vil gi både bedre og tryggere behandling og også legge til rette for mer ngsutvikling,grimstadtakk president eee gode helseregistret legg ein vekt eit viktig grunnlag for å fremme helse betre grunnlag for forskning og for betre helse og omsorgstenestene våre det er ein liten ueinigheit om at dei lovendringane vi gjer i dag vil gi både betre og tryggare behandling og også legge til rette for eee mer ngsutvikling,11901.5,11922.6,21.100000000000364,2020-11-17,2020-11-17_proceedings.txt
Stortinget-20201117-095521_11922600_11949600,for venstre er personvernet viktig og selv om departementet mener det styrkes gjennom lovendringene så må vi følge med på hvilke personvernkonsekvenser helseanalyseplattformen vil ha for den enkelte det er en selvfølge at de registrerte har rettigheter som skal ivaretas og at vi har personvernforordningen og helseregisterloven som skal beskytte den registrerte innbygger i tillegg gir det en økt trygghet at alle,for venstre er personvernet viktig og sjel om departementet meiner det styrkast gjennom lovendringane med så om vi følger med på kva personvernkonsekvensar helseanalyseplattformen vil ha for den enkelte det er eee sjølvfølge at dei registrerte har rettigheter som skal ivaretas og at vi har personvernforordninga og helseregisterloven som skal beskytte den re eee registrerte innbyggar i tillegg gir det ein økt trygghet at alle gått er nå,11922.6,11949.6,27.0,2020-11-17,2020-11-17_proceedings.txt
