file,text_bm,text_nn,start,end,duration,date,proceedingsfile
Stortinget-20201118-095524_4606800_4635900,i årets budsjett president så øker for eksempel regjeringa cotoavgiften på klimautslipp med fem prosent og det er bra men så nuller dem samtidig ut effekten av det her for bensin og diesel ved å senke veibruksavgifta akkurat like mye med det formålet å holde prisen akkurat like lav for bilisten det er jo frppolitikk vi ser fra regjeringa sjøl etter frp har gått ut av regjering det skal altså ikke koste et øre mer å forurense på norske veier hele poenget med miljøavgifta president,i årets budsjett president så aukar for eksempel regjeringa seaotoavgifta på klima utslitt med fem prosent og det er bra men så nuller dei samtidig ut effekten av det her for bensin og disel ved å senk vegbruksavgifta akkurat like mye med det formålet å halde prisen akkurat like lav for bilisten det er jo frppolitikk vi ser frå regjeringa sjøl etter frp har gått ut av regjering det skal altså ikkje koste eit øre meir å forurense på norske vegar heile poenget med miljøavgifter president,4606.8,4635.9,29.099999999999454,2020-11-18,2020-11-18_proceedings.txt
Stortinget-20201118-095524_4635900_4662900,er å få han som ellers ville ha bytta til elbil om tre år til å gjøre det neste år for det heller ikke med elbilfordelene aleine det går ikke fort nok ikke bare for oss som er aller mest opptatt av ungene våre sin framtid men heller ikke for regjeringa og deres evne til å nå egne mål etter sju år med frp er det altså umulig å se forskjell på høyre og frp sin grå og miljøfitspolitikk,er å få han som elles skulle bytta til elbil om tre år til å gjere det neste år for de helliket med elbilfordelane aleine det går ikkje fort nok ikkje berre for oss som er aller mest opptatt av ungdomaret sin framtid men heller ikkje for regjeringa å dømes evne til å nå eigne mål etter sju år med frp er det altså umulig å se forskjell på høgre og frp sin grå og miljøfitspolitikk,4635.9,4662.9,27.0,2020-11-18,2020-11-18_proceedings.txt
Stortinget-20201118-095524_4662900_4692800,så mitt spørsmål er egentlig om statsministeren kan gjøre det klart for oss som lurer hva er forskjellen på regjeringa sitt syn på miljøavgifter for bil og drivstoff og fremskrittspartiets syn statsminister solberg president utgangspunktet vårt er granavollen og det er altså regjeringens felles syn er det som ligger i ran om volden og det innebærer blant annet det at vi skal øke cotoavgiften systematisk i årene fremover men vi skal eee,så mitt spørsmål er gentleg om statsministeren kan gjere det klart for oss som lurer kva ap forskjellen på regjeringa si syn på miljøavgifter for bil og drivstoff og framstegspartiets syn statsminister solberg president utgangspunktet vårt er grane vald og det er altså regjeringas felles syn i det som ligg i grane vollen og det inneber at blant anna det at vi skal auke seogtoavgiften systematisk i åra framover men vi skal eee,4662.9,4692.8,29.900000000000546,2020-11-18,2020-11-18_proceedings.txt
Stortinget-20201118-095524_4692800_4718700,se sørge for at man fører tilbake eee de samme utgiftene til de som blir rammet av det og på bilistsiden er det gjort ved at veibruksavgiften eee går ned det er altså regjeringen eee for høyre sitt virk synspunkt så ville altså ikke nødvendigvis dette vært et eee ting vi hadde vært opptatt av fem den lille økningen har heller ikke den største,så følg for at ein fører tilbake eee dei same utgiftene til dei som blir rammet og på bilistsiden er det gjort ved at vegbruksavgifta eee går ned det er altså regjeringa for høgre sitt ve ve synspunkt så ville altså ikkje nødvendigvis dette vore eit ting vi hadde vore opptatt av fem i den lille økninga har heller ikke den største,4692.8,4718.7,25.899999999999636,2020-11-18,2020-11-18_proceedings.txt
Stortinget-20201118-095524_4718700_4747200,betydningen eee for eee eee for eee klimautslippene det vi ser nå er jo at den politikken som vi har ført har bidratt til at vi både klarer å få ned klimautslippene for fjerde år på rad har klimautslippene gått ned vi ligger mye tettere på å nå kotomålene enn de fleste ville trodd i forhold til reduksjoner samtidig klarer vi å gjøre det uten å stoppe utviklingen i norge,betydninga eee for eee for eee klimautsippene det vi ser no er jo at den politikken som vi har ført har bidratt til at vi både klarer å få ned klimautslippene for fjerde år på rad har klimautslippene gått ned vi ligg mykje tettare på å nå kotomåla enn dei fleste ville trod i forhold til reduksjonar samtidig klarar vi å gjere det utan å stoppe utviklinga i noreg,4718.7,4747.2,28.5,2020-11-18,2020-11-18_proceedings.txt
Stortinget-20201118-095524_4747200_4775250,fordi vi har frem til pandemien hatt økonomisk vekst vi har klart å frikoble de tingene derfor så er det viktig at vårt utgangspunkt og kanskje aller viktigst er at vi skal stoppe utslippene ned men ikke stoppe utviklingen for vi tror jo at politikk som stopper utviklingen det er en politikk som heller ikke klarer å redusere klimautslippene over tid fordi det kommer til å skape så stor grad av motstand og det vi nå ser er jo en enorm endring i det norske samfunnet og norsk næringsliv kinoteknologi,fordi vi har fram til pandemien hatt økonomisk vekst vi har klart å frikopla dei tinga derfor så er det viktig at vårt utgangspunkt og kanskje aller viktigast er at vi skal stoppe utsleppet men ikkje stoppe utviklinga for vi trur jo at politikk som stoppar utviklinga det er ein politikk som heller ikkje klarar å redusere klimautsitene over tid fordi det kommer til å skape så stor grad av motstand og det vi no ser er jo ein enorm endring i det norske samfunnet og norsk næringsliv getteknologi,4747.2,4775.25,28.050000000000182,2020-11-18,2020-11-18_proceedings.txt
Stortinget-20201118-095524_4775250_4804500,knyttet til til å se veksten i det grønne i fremtiden vi har klart å få til det vi fra borgerlige politikere eller ikke sosialist politikere har satt over alle år nemlig at teknologibiten det er næringslivet det er det som skal brikke de men er ikke frem og da er det to ting som er viktig det ene er at man jobber godt med stimulansen på det det andre er at vi har et skatteopplegg og en økonomi som bidrar til at det ikke blir rødt tall i bedriftene for da har de ikke penger til endringen og der feiler jo mdg stort basthalen,knytte til til å se veksten i dei grøne i framtiden vi er klar til å få til det vi frå borgerlege politikarar eller ikkje sosial politikarar har satt over alle år nemleg at teknologibiten det er næringslivet det er det som skal brikke demonen fram og då er det to ting som er viktig det eine er at man jobbar godt med stimulansen på det det andre er at vi har eit skatteopplegg og ein økonomi som bidrar til at det ikkje blir råtal i bedriftene for da hadde ikkje pengar til endringa og der feilar jo mdg stort,4775.25,4804.5,29.25,2020-11-18,2020-11-18_proceedings.txt
Stortinget-20201118-095524_4804500_4834400,president flertallet i norges befolkning vil ha en innskjerpa og kraftige klimapolitikk og jeg er helt uenig i at det er et motsetningsforhold mellom utvikling og det å få ned utslippene eee og det å framstille som at regjeringa sitt statsbudsjett som er lagt fram og prinsippet om både forurense betaler som ligger i grønnvollplattformen eller prinsippet om at pumpeprisene skal være lik har noen som ting qqq noen ting som helst gjør med koronapandemien eee det er litt søkt for det vet både jeg og statsministeren at det ikke stemmer det gir ikke mening president,president eee fleirtalet i noregs befolkning vil ha ein innskjerpa og kraftig klimapolitikk og er heilt ueinig i at ei motsetningsforhold mellom utvikling og det å få ned utsleppa eee og det å framstille det som at regjeringa sitt statsbudsjett som er lagt fram av prinsippet om både forurense betale som ligg i grannehaplattforma eller prinsipp om at pumpeprisen skal vere lik har nokon ting nokon ting som helst i og med korånapandemien eee det er litt søgt for det veit både eg og statsministeren at d t ikkje stemmer eee det gir ikkje meining president,4804.5,4834.4,29.899999999999636,2020-11-18,2020-11-18_proceedings.txt
Stortinget-20201118-095524_4834400_4858700,at statsministeren på den ene sida sier at det er regjeringa sin politikk at bensin og dieselprisene skal være akkurat det samme og så sier at men for høyre er ikke det så viktig nei vel så er det krf eller venstre da det er veldig viktig for å ikke få opp en sin eller dieselprisen eee det blir jo jeg sittende igjen og lure på det er altså klin umulig president å få til en firedobling i takten på utslippskutt som vi trenger eee i norge nå,at statsministeren at den eine sida seier at det er regjeringa sin politikk at bensin og diselprisane skal vere akkurat det same og spesie at me for høyrer ikkje det så viktig når eg vel så er det krf eller venstre da det er veldig viktig for å ikkje få bensin eller diselprisen eee det blir eg sittande igjen og lure på det er altså klinemulig president å få til ein firedobling i takten på utsleppskutt som vi treng eee i noreg no,4834.4,4858.7,24.300000000000182,2020-11-18,2020-11-18_proceedings.txt
Stortinget-20201118-095524_4858700_4886600,uten å bruke miljøavgifta da snakker vi i så fall forbud eller for eksempel personkvoter på eee på flyreiser spørsmålet er igjen hva er forskjellen på frp sin miljøavgiftspolitikk og regjeringa sinstatsminister solberg president regjeringen styrer på granavolden den er basert på fire partier det er viktig der er helt sikkert mange ting for eksempel det i det hele tatt å øke ceotoavgiften v vel neppe vært et forslag fra frp,utan å bruke miljøgifter da snakkar i så fall forbod eller for eksempel personkvota på eee på flyreisa spørsmålet er igjen kva forskjellen på frp sin miljøavgiftspolitikk og regjeringa sin statsminister solberg president regjeringa styrer på granavollen den er basert på fire partia det er viktig der er heilt sikker at mange ting for eksempel det det heile tatt å auke sidotoavgiften var neppe vert eit forslag frå frp,4858.7,4886.6,27.900000000000546,2020-11-18,2020-11-18_proceedings.txt
Stortinget-20201118-095524_4886600_4915000,det er altså et forslag fra fra regjeringen i fellesskap men å la skape en divergens mellom regjeringen som tross alt styrer på et kompromiss mellom fire partier og frp blir ikke det samme som å si hva de andre partiene nødvendigvis hadde gjort så skjønte ikke jeg kom eee kommentarene om koronapandemien eee for jeg har ikke sagt at dette er noe med koronapandemien å gjøre jeg sa at før koronapandemien trådte til så så vi at vi hadde økonomisk vekst,det er altså eit forslag frå frå regjeringa i fellesskap men å la skape ein det er vegens mellom regjeringa som trass alt styrer på eit kompromiss mellom fire partia og frp blir ikkje det same som å si kva dei andre partia nødvendigvis hadde gjort så skjønte ikkje kome kommentaren om koronapandemien eee for eg har ikkje sagt at dette har no med koronapandemien å gjere eg sa at før koronapandemien trådde til så såg vi at vi hadde økonomisk vekst,4886.6,4915.0,28.399999999999636,2020-11-18,2020-11-18_proceedings.txt
Stortinget-20201118-095524_4915000_4936700,som selv om vi klarte å få ned utslippene i norge det har ingenting med koronapandemien å gjørebasthalm president at hvis regjeringa kan og regjeringa sin politikk er eee ikke radikalt klare å endre synet på miljøavgifta så har det her i stortinget ingen grunn til å tro på at regjeringa vil klare å fremtak som får oss i havn,som sjøl om vi klarte å få ned utsleppa i noreg det har ingenting med koronapandemien å gjere president at viss regjeringa kan og regjeringa sin politikk er eee ikkje radikalt klare å endre synet på miljøavgifter så har det her i stortinget ingen grunn til å tru på at regjeringa vil klare å fremtak som får oss i hamn,4915.0,4936.7,21.699999999999818,2020-11-18,2020-11-18_proceedings.txt
Stortinget-20201118-095524_4936700_4965700,for femti prosent utslippskutt minst innen tjuetretti det klarer ikke statsministeren å sannsynliggjøre det klarer ikke forskerne å sannsynliggjøre og som nevnt president så er altså alternativet er mye mer restriktive tiltak som forbud eller kvoter på å få lov til å kjøre eee med bil eller få lov til å ta fly eee og det president vil jeg si si at det regner mye mindre på god høyrepolitikk sånn som jeg har vært vant til å kjenne den enn det å bruke markedet til å fremme de mest miljøvennlige måtene å reise på,for femti prosent utslippskutt minst innan tjuetretti det klarer ikkje statsministeren og son si neger det klarer ikkje forskarane og sannsyne og som nemnt president så er altså alternativet er mye meir restriktive tiltak som forbod eller kvotar for å få lov til å køyre eee med bil eller får lov til å ta fly eee og det president vil jo eg si at han egner mye mindre på god høgrepolitikk sånn som eg har vore vant å kjenne den enn det å bruke markedet til å fremme dei mest miljøvennlege måtane å reise på,4936.7,4965.7,29.0,2020-11-18,2020-11-18_proceedings.txt
Stortinget-20201118-095524_4965700_4992900,det bekymrer meg veldig at frp har fått en dobbeltstemme inn i statsbudsjettet ved at altså frp har vært med å framforhandle grandavanplattformen statsministeren føler seg forplikta til det men frp sjøl føler seg jo ikke forplikta til den samme plattformen og er jo veldig tydelig utad i offentligheten på at dem vil ha eee mer avgiftslette på på fossilbiler og på drivstoff så president hva kan vi vente oss av innrømmelser til frp i budsjettet for neste årister eee solberg,det bekymrar meg veldig at frp har fått ein dobbeltstemme inn i statsbudsjettet ved at altså frp har vore med å framforhandle grannemanplattforma statsministeren føler seg forplikta til det med frp sjøl føler sau ikkje forplikta til den same plattforma og er jo veldig tydeleg utad i offentlegheiten på at dei vil ha eee meir avisletta på på fossilbilar og på drivstoff så president kva kan vi vente oss av innrømmelse til frp i budsjettet for neste årnister eee solberg,4965.7,4992.9,27.199999999999818,2020-11-18,2020-11-18_proceedings.txt
Stortinget-20201118-095524_4992900_5022000,president eee vi har pågående forhandlinger så det må nok representanten vente til hva vi både skal ha av gjennomslag og endringer men jeg har lyst til å understreke en ting at vi har altså nå eee viste at vi klarer å få nedutslippene i norge med at de har gått ned fire apparat når regjeringen kom inn i regjeringskontorene i tjuetretten så bestilte man et eee en måling på hvor s langt vekke var vi i gapet til kotavtalen altså tjuetjuemålene våre,president eee vi har pågåande forhandlingar så det må nok representanten vente til va vi både skal ha av gjennomslag og eee endringar men eg har lyst til å understreke ein ting at eee vi har altså no eee vist at vi klarar å få ned utsleppen i noreg med at dei har gått ned fire år på rad når regjeringa kom inn i regjeringskontora i tjuetretten så bestilte ein eit ein måling på vors langt vekke var vi i gapet til keåteavtalen så tjuetjue måla vare,4992.9,5022.0,29.100000000000364,2020-11-18,2020-11-18_proceedings.txt
Stortinget-20201118-095524_5022000_5049000,den viste åtte millioner tonn i forskjell nå er det gapet nesten lokert ikke helt men nesten lukket det var det veldig få som trodde på bare for få år tilbake igjen i denne salen inklusive mdg som hele tiden har ment at vi ikke var mulig å få til de resultatene regjeringen faktisk leverer på og så har vi altså sagt at vi kommer med en melding om hvordan vi skal nåjuetredve,den viste åtte millionar tonn i forskjell no er det gapet nesten loket ikkje heilt men nesten loket det var det veldig få som trudde på berre for få år tilbake i denne salen inklusive mdg som heile tida har meint at vi ikkje var mulig å få til dei resultata regjeringa faktisk leverer på og så har vi altså sagt at vi kommer med ein melding om korleis vi skal njuetredve,5022.0,5049.0,27.0,2020-11-18,2020-11-18_proceedings.txt
Stortinget-20201118-095524_5049000_5065200,og eee der ligger også selvfølgelig avgiftspolitikk inne som et av elementene knyttet til det i forbindelse med altså før før eee jul eee sånn at man får muligheten til å vise det men jeg har altså fått et betydelig mer optimistisk syn på vår muligheter,og eee der ligg også så fekk eg avgiftspolitikk inne som eitt av elementa knytte til det i forbindelse med altså før før eee jul eee sånn at ein får muligheit til å vise det men eg har altså fått eit betydeleg meir optimistisk syn på vår muligheter,5049.0,5065.2,16.199999999999818,2020-11-18,2020-11-18_proceedings.txt
Stortinget-20201118-095524_5065200_5086300,vene til å klare å nå disse målene i norge nettopp fordi at jeg er ute og møter alle de som nå tar alle signalene alle de bedriftene som sier at grønn vekst er veien for min bedrift som for noen få år siden var mest opptatt av å skulle være motstrebende på de endringene som skjer og nå ønsker å heie på oss strammere krav,vene til å klare å nå desse måla i noreg nettopp fordi at dei er ute og møter alle dei som no tar alle signala det alle dei bedriftene som seier at grøn vekst er vegen frå min bedrift som for nokon få år sidan var mest opptatt av og skulle vera motstrebande på dei endringane som skjer og no ønsker å heia på os samare krav,5065.2,5086.3,21.100000000000364,2020-11-18,2020-11-18_proceedings.txt
Stortinget-20201118-095524_5086300_5115200,derfor ser vi jo innenfor eee hele skipsfarten en helt annet vo eee momentum eee norsk eee rederiforbund altså medlemmene der har gått inn for at de ikke skal kontrahere en eneste båt etter tjuetredve som ikke er en nullutslippsløsning det er en enorm dreiv for det vi må gjøre i den maritime sektoren og regjeringen har svart med hele det grønne maritime programmet ved en inkurie fikk statsministeren nå ett hundre ekstra på dette svaret,derfor ser vi jo innanfor eee heile skipsfarten ein heilt anna momentum eee norsk rederiforbund altså medlemmane der har gått inn for at like skal kontrahere ein eineste båt etter tjuetredve som ikkje er ein nullutsleppsløysing det er ein enorm dreiv for det vi må gjere i den maritime sektoren og regjeringa har svart med heile det grøne maritime programmet ein ku fekk statsministeren nå eit munutt ekstra på dette svaret q,5086.3,5115.2,28.899999999999636,2020-11-18,2020-11-18_proceedings.txt
Stortinget-20201118-095524_5115200_5125800,qqq president qqq da går vi videre til eee til det siste hovedspørsmålet som stilles av eee representanten ingil kjerkol,miske kjempe president da går vi vidare til eee til det siste hovudspørsmålet som fyllest av eee representanten ingvild kjerkol,5115.2,5125.8,10.600000000000364,2020-11-18,2020-11-18_proceedings.txt
Stortinget-20201118-095524_5131700_5159200,kjerkol president mitt spørsmål handler om de nye av hundre og en sar ken ridningshelikoptrene og om dem skal kunne lande på de samme norske akuttsykehusene som dagens sekinghelikoptre har gjort i totusenogelleve så vedtok stortinget ei kostnadsramme for regjeringa for å kunne gjennomføre tilpasning av landingsmulighetene ved sykehus som benyttes ns redningshelikoptre,kjerkol president mitt spørsmål handlar om dei nye av hundre og ein sar kom redningshelikopterane og om dei skal kunne land på dei same norske akuttsykehusane som dagens sikinghelikoptrr har gjort i totusenogelleve så vedtok stortinget ei kostnadsramme for regjeringa for å kunne gjennomføre tilpasning av lønningsmulighetene ved sykehus som benyttast ens redningshelikopter,5131.7,5159.2,27.5,2020-11-18,2020-11-18_proceedings.txt
Stortinget-20201118-095524_5159200_5182400,vi har i dag tjueen akuttsykehus der seaking landet de nye redningshelikoptrene er støre tøngre og har mer rotorvind helseforetakene sa allerede i tjueseksten at den usikkerheten som eksisterer knytta til effekten av rotorvind er en risiko som nå må avklares uten unødig opphold,vi har i dag tjueein akuttsykehus der siking lander dei nye redningshelikoptrane er støre tønger og har meir rotur vinn helseføretaka sa allereie i tjueseksten at den usikkerheiten som eksisterer knytt til effekten av rotorvi er ein risiko som no må avklarast utan unødig opphald,5159.2,5182.4,23.199999999999818,2020-11-18,2020-11-18_proceedings.txt
Stortinget-20201118-095524_5182400_5204100,parallelt må det brukes ressurser på å utrede hvilke avbøtende tiltak som kan være aktuelt på berørte sykehus slik at det ikke tapes slik at det tapes minst mulig tid dersom tiltak blir nødvendig vi er nå i tjuetjueen president de nye helikoptrene skal fann i tjuetjueto,parallelt må det brukast ressursar på å utrede kva avbøtande tiltak som kan vere aktuelt på berørte sykehus slik at det ikkje er tapas slik at det tapas minst mulig tid dersom tiltak blir nødvendig vi er no i tjuetjueein president dei nye helikoptrane skal fainn i tjuetjueto,5182.4,5204.1,21.700000000000728,2020-11-18,2020-11-18_proceedings.txt
Stortinget-20201118-095524_5204100_5228300,en gjennomgang nhar nrk har gjort viser at det nå er femten akuttsykehus der de nye redningshelikoptrene foreløpig ikke kan lande jeg kan ikke ramse opp alle president men universitetssykehuset i tromsø harstad samtlige akuttsykehus i trøndelag og på helgeland stavanger sørlandet sine sykehus og flere,ein gjennomgang nar nrk har gjort viser at det no er femten akuttsykehus der dei nye redningshelikoptrane foreløpig ikkje kan lande eg kan ikkje ramse opp alle president men universitetssjukehuset i tromsø hasta samtlige akuttsykehus i trøndelag og på helgeland stavanger sørlande sine sykehus og fleire,5204.1,5228.3,24.199999999999818,2020-11-18,2020-11-18_proceedings.txt
Stortinget-20201118-095524_5228300_5257900,på spørsmål fra stortinget så svarer helseministeren at rikshospitalet og ullevold i helse sørøst vil bli oppgradert for å kunne lande de nye redningshelikoptrene så jeg lurer på om statsministeren kan forklare betyr det at regjeringa ikke vil følge opp vedtaket fra totusenogelleve eller betyr det at bare de større regionsykehusene nå skal kunne lande de nye helikoptrenestatsminister erna solberg,på spørsmål frå stortinget så svarer helseministeren at rikshospitalet og ullevold i helse si aust vil bli oppgradert for å kunne land dei nye redningshelikoptrane så er eg lurer på om statsministeren kan forklare betyr det at regjeringa ikkje vil fylgje opp vedtaket frå totusenogelleve eller betyr det at bare dei større regionsykehusane no skal kunne lande dei nye helikoptranestatsminister erna solberg,5228.3,5257.9,29.599999999999454,2020-11-18,2020-11-18_proceedings.txt
Stortinget-20201118-095524_5257900_5278300,president det er helt klart at vi skal eee sørge for at de nye helikopterene skal kunne lande ved de samme sykehusene hvor sea king lander i dag eventuelt andre steder i nærheten etter avtale med helseforetakene og arbeidet for å se på be både behovet og løå,eee president det er heilt klart at vi skal eee sørge for at dei nye helikoptere skal kunne lande ved dei same sykehusa vår siking landar i dag eventuelt andre stader i nærheten etter avtale med helseføretaka og arbeidet for å se på be både behovet og lo,5257.9,5278.3,20.400000000000546,2020-11-18,2020-11-18_proceedings.txt
Stortinget-20201118-095524_5278300_5293350,det er litt for tidlig å si hvor mange sykehus som eee eee det eventuelt vil være som har behov for tilpasninger enda men det er en gradvis innfasing av eee av de nye helikopterene og vi jobbeed hvert enkelt også,det er litt fortidleg å si om mange sykehus som eee eee det eventuelt vil vere som har behov for tilpassingar enda men det er ein gradvis innfasing av eee av dei nye helikopterne og vi jobbaed vert enkelt og så,5278.3,5293.35,15.050000000000182,2020-11-18,2020-11-18_proceedings.txt
Stortinget-20201118-095524_5293350_5309900,noen som sier at dette skulle vi gjort før vel allerede i eee i tjueelleve så var det tydelig og glad at vi var nødt til å gjøre dette at nye helikopter kunne være tyngre kunne ha annen påvirkning enn det med enn det som er i dag eee men før vi har helikoptre så vi får testet og det har vi jo altså nå,når o som seier at dette skulle vi gjort førve allereie i eee i tjueelleve så var det tydeleg glad at vi var nødt til å gjere dette at nye helikopter kunne vere tyngre kunne ha anna påverking enn det med enn det som er i dag eee men før vi har helikoptra så vi får testet og det har vi jo altså no,5293.35,5309.9,16.549999999999272,2020-11-18,2020-11-18_proceedings.txt
Stortinget-20201118-095524_5309900_5336900,gjort den siste tiden så kan vi heller ikke være sikker på akkurat hvor og på hvilken måte eee vi trenger å gjøre endringer men utgangspunktet vårt er altså de samme sykehusene vo seaking lander i dag eventuelt eee andre steder i nærheten etter avtale med helseforetakene kjerkolpresident det er bra at statsministeren bekrefter at de akuttsykehusene som seaking har kunnet landa på eller v fortsatt skal kunne gikoptrene,gjort den siste tida så kan vi heller ikkje vere sikker på akkurat vor og på kvalen måte eee vi treng å gjere endringar men utgangspunktet vårt er altså dei same sykehusa vorsikinglaner i dag eventuelt andre stader i nærheten etter avtalen med helseføretaka president det er bra at statsministeren bekrefte at dei akuttsykehusane som siking har kunna landa på eller v fortsatt skal kunne gkoptrane,5309.9,5336.9,27.0,2020-11-18,2020-11-18_proceedings.txt
